PlayType_description,Batting_Team_id,Batting_Team_name,Bowling_Team_id,Bowling_Team_name,Innings,Total_Runs_on_delivery,Commentary,Commentary_short,Score,Bowler_id,Bowler_name,Bowler_maiden,Bowler_balls,Bowler_wickets,Bowler_over,Bowler_conceded,Other_Bowler_id,Other_Bowler_name,Other_Bowler_maidens,Other_Bowler_balls,Other_Bowler_wickets,Other_Bowler_overs,Other_Bowler_conceded,Batsman_id,Batsman_name,Batsman_runs,Batsman_balls_faced,Batsman_four,Batsman_sixes,Other_Batsman_id,Other_Batsman_name,Other_Batsman_runs,Other_Batsman_balls_faced,Other_Batsman_four,Other_Batsman_sixes,Over_ball,Over_complete,Over_maiden,Over_no_Ball,Over_wide,Over_byes,Over_leg_byes,Over_number,Over_runs,Over_wickets,Dismissal_is_true,Dismissal_type,Dismissal_fielder_iskeeper,Dismissal_text,Innings_run_rate,Innings_byes,Innings_balls,Innings_no_balls,Innings_wickets,Innings_leg_byes,Innings_session,Innings_day,Innings_wides,Innings_runs
no run,6,India,8,Sri Lanka,2nd innings,0,"<b>big swing into the left-hander</b>. Dhawan aims for an off drive, but gets an inside edge onto pad","Lakmal to Dhawan, no run",0,49619,Suranga Lakmal,1,13,0,2.1,6,574178,Akila Dananjaya,0,18,1,3.0,20,28235,Shikhar Dhawan,11,17,2,0,642519,Shreyas Iyer,2,10,0,0,5,False,0,0,0,0,0,7,2,0,False,,False,False,3.95,0,41,0,1,0,1,1,0,27
run,6,India,8,Sri Lanka,2nd innings,1,gets down the track to flick the ball to the right of short midwicket,"Lakmal to Dhawan, 1 run",0,49619,Suranga Lakmal,1,13,0,2.1,7,574178,Akila Dananjaya,0,18,1,3.0,20,28235,Shikhar Dhawan,12,18,2,0,642519,Shreyas Iyer,2,10,0,0,6,True,0,0,0,0,0,7,2,0,False,,False,False,4.0,0,42,0,1,0,1,1,0,28
run,6,India,8,Sri Lanka,2nd innings,1,strides out to the pitch of a tossed up delivery on leg stump and drives inside out to long-off,"Dananjaya to Dhawan, 1 run",0,574178,Akila Dananjaya,0,19,1,3.1,21,49619,Suranga Lakmal,1,13,0,2.1,7,28235,Shikhar Dhawan,13,19,2,0,642519,Shreyas Iyer,2,10,0,0,1,False,0,0,0,0,0,8,4,0,False,,False,False,4.04,0,43,0,1,0,1,1,0,29
run,6,India,8,Sri Lanka,2nd innings,1,"holds up in the pitch, and doesn't really turn. And because of that Iyer, looking to flick through midwicket, ends up punching to long-on","Dananjaya to Iyer, 1 run",0,574178,Akila Dananjaya,0,20,1,3.2,22,49619,Suranga Lakmal,1,13,0,2.1,7,642519,Shreyas Iyer,3,11,0,0,28235,Shikhar Dhawan,13,19,2,0,2,False,0,0,0,0,0,8,4,0,False,,False,False,4.09,0,44,0,1,0,1,1,0,30
run,6,India,8,Sri Lanka,2nd innings,1,,"Dananjaya to Dhawan, 1 run",0,574178,Akila Dananjaya,0,21,1,3.3,23,49619,Suranga Lakmal,1,13,0,2.1,7,28235,Shikhar Dhawan,14,20,2,0,642519,Shreyas Iyer,3,11,0,0,3,False,0,0,0,0,0,8,4,0,False,,False,False,4.13,0,45,0,1,0,1,1,0,31
no run,6,India,8,Sri Lanka,2nd innings,0,"tosses it up outside off, Iyer get to the pitch and turns it to short midwicket","Dananjaya to Iyer, no run",0,574178,Akila Dananjaya,0,22,1,3.4,23,49619,Suranga Lakmal,1,13,0,2.1,7,642519,Shreyas Iyer,3,12,0,0,28235,Shikhar Dhawan,14,20,2,0,4,False,0,0,0,0,0,8,4,0,False,,False,False,4.04,0,46,0,1,0,1,1,0,31
run,6,India,8,Sri Lanka,2nd innings,1,shuffles across outside off and picks away the offbreak to deep square leg,"Dananjaya to Iyer, 1 run",0,574178,Akila Dananjaya,0,23,1,3.5,24,49619,Suranga Lakmal,1,13,0,2.1,7,642519,Shreyas Iyer,4,13,0,0,28235,Shikhar Dhawan,14,20,2,0,5,False,0,0,0,0,0,8,4,0,False,,False,False,4.08,0,47,0,1,0,1,1,0,32
no run,6,India,8,Sri Lanka,2nd innings,0,steps forward with bat close to pad and defends with soft hands. He looks good; looks set,"Dananjaya to Dhawan, no run",0,574178,Akila Dananjaya,0,24,1,4.0,24,49619,Suranga Lakmal,1,13,0,2.1,7,28235,Shikhar Dhawan,14,21,2,0,642519,Shreyas Iyer,4,13,0,0,6,True,0,0,0,0,0,8,4,0,False,,False,False,4.0,0,48,0,1,0,1,1,0,32
run,6,India,8,Sri Lanka,2nd innings,2,"on the pads and Iyer clips it neatly to deep square leg, off his back foot","Lakmal to Iyer, 2 runs",0,49619,Suranga Lakmal,1,19,0,3.1,9,574178,Akila Dananjaya,0,24,1,4.0,24,642519,Shreyas Iyer,6,14,0,0,28235,Shikhar Dhawan,14,21,2,0,1,False,0,0,0,0,0,9,13,0,False,,False,False,4.16,0,49,0,1,0,1,1,0,34
run,6,India,8,Sri Lanka,2nd innings,2,"stands up tall against the short ball outside off and lashes it behind point, with an angled bat, as opposed to horizontal. Signs that he is mindful of the risks involved playing the moving ball","Lakmal to Iyer, 2 runs",0,49619,Suranga Lakmal,1,20,0,3.2,11,574178,Akila Dananjaya,0,24,1,4.0,24,642519,Shreyas Iyer,8,15,0,0,28235,Shikhar Dhawan,14,21,2,0,2,False,0,0,0,0,0,9,13,0,False,,False,False,4.32,0,50,0,1,0,1,1,0,36
run,6,India,8,Sri Lanka,2nd innings,1,straight bat again as he gets behind a back of a length delivery and punches in front of point,"Lakmal to Iyer, 1 run",0,49619,Suranga Lakmal,1,21,0,3.3,12,574178,Akila Dananjaya,0,24,1,4.0,24,642519,Shreyas Iyer,9,16,0,0,28235,Shikhar Dhawan,14,21,2,0,3,False,0,0,0,0,0,9,13,0,False,,False,False,4.35,0,51,0,1,0,1,1,0,37
four,6,India,8,Sri Lanka,2nd innings,4,"there's a short point, there's backward point, and there's a wide third man. All of them are useless as Dhawan charges down the track and flays the ball square on the off side. Sublime shot","Lakmal to Dhawan, FOUR runs",0,49619,Suranga Lakmal,1,22,0,3.4,16,574178,Akila Dananjaya,0,24,1,4.0,24,28235,Shikhar Dhawan,18,22,3,0,642519,Shreyas Iyer,9,16,0,0,4,False,0,0,0,0,0,9,13,0,False,,False,False,4.73,0,52,0,1,0,1,1,0,41
no run,6,India,8,Sri Lanka,2nd innings,0,misses a full toss so badly - he is playing a flick - that Lakmal is lured into appealing for lbw. Might have clipped the flap of the pad as it goes to the wicketkeeper. But impact is outside off,"Lakmal to Dhawan, no run",0,49619,Suranga Lakmal,1,23,0,3.5,16,574178,Akila Dananjaya,0,24,1,4.0,24,28235,Shikhar Dhawan,18,23,3,0,642519,Shreyas Iyer,9,16,0,0,5,False,0,0,0,0,0,9,13,0,False,,False,False,4.64,0,53,0,1,0,1,1,0,41
four,6,India,8,Sri Lanka,2nd innings,4,slower ball outside off and Dhawan looks a picture of grace as he cover drives it to the fence.,"Lakmal to Dhawan, FOUR runs",0,49619,Suranga Lakmal,1,24,0,4.0,20,574178,Akila Dananjaya,0,24,1,4.0,24,28235,Shikhar Dhawan,22,24,4,0,642519,Shreyas Iyer,9,16,0,0,6,True,0,0,0,0,0,9,13,0,False,,False,False,5.0,0,54,0,1,0,1,1,0,45
run,6,India,8,Sri Lanka,2nd innings,1,closes the bat face against a legbreak on middle and gets a leading edge to third man.,"Dananjaya to Iyer, 1 run",0,574178,Akila Dananjaya,0,25,1,4.1,25,49619,Suranga Lakmal,1,24,0,4.0,20,642519,Shreyas Iyer,10,17,0,0,28235,Shikhar Dhawan,22,24,4,0,1,False,0,0,0,0,0,10,10,0,False,,False,False,5.01,0,55,0,1,0,1,1,0,46
four,6,India,8,Sri Lanka,2nd innings,4,drops it short and Dhawan rocks back to pull it to the deep midwicket boundary. Easy pickings. India have got 50. That's one-fourth of the target.,"Dananjaya to Dhawan, FOUR runs",0,574178,Akila Dananjaya,0,26,1,4.2,29,49619,Suranga Lakmal,1,24,0,4.0,20,28235,Shikhar Dhawan,26,25,5,0,642519,Shreyas Iyer,10,17,0,0,2,False,0,0,0,0,0,10,10,0,False,,False,False,5.35,0,56,0,1,0,1,1,0,50
run,6,India,8,Sri Lanka,2nd innings,1,gets down the pitch and drills the good length offbreak to long-off.,"Dananjaya to Dhawan, 1 run",0,574178,Akila Dananjaya,0,27,1,4.3,30,49619,Suranga Lakmal,1,24,0,4.0,20,28235,Shikhar Dhawan,27,26,5,0,642519,Shreyas Iyer,10,17,0,0,3,False,0,0,0,0,0,10,10,0,False,,False,False,5.36,0,57,0,1,0,1,1,0,51
four,6,India,8,Sri Lanka,2nd innings,4,legbreak wanders way down leg and Iyer does the simple thing - sweep past leg slip to the boundary,"Dananjaya to Iyer, FOUR runs",0,574178,Akila Dananjaya,0,28,1,4.4,34,49619,Suranga Lakmal,1,24,0,4.0,20,642519,Shreyas Iyer,14,18,1,0,28235,Shikhar Dhawan,27,26,5,0,4,False,0,0,0,0,0,10,10,0,False,,False,False,5.68,0,58,0,1,0,1,1,0,55
no run,6,India,8,Sri Lanka,2nd innings,0,"goes around the wicket for a flighted offbreak outside off, Iyer drives to short cover","Dananjaya to Iyer, no run",0,574178,Akila Dananjaya,0,29,1,4.5,34,49619,Suranga Lakmal,1,24,0,4.0,20,642519,Shreyas Iyer,14,19,1,0,28235,Shikhar Dhawan,27,26,5,0,5,False,0,0,0,0,0,10,10,0,False,,False,False,5.59,0,59,0,1,0,1,1,0,55
no run,6,India,8,Sri Lanka,2nd innings,0,advances at this offbreak - yorks himself really - and flicks it to short midwicket,"Dananjaya to Iyer, no run",0,574178,Akila Dananjaya,0,30,1,5.0,34,49619,Suranga Lakmal,1,24,0,4.0,20,642519,Shreyas Iyer,14,20,1,0,28235,Shikhar Dhawan,27,26,5,0,6,True,0,0,0,0,0,10,10,0,False,,False,False,5.5,0,60,0,1,0,1,1,0,55
run,6,India,8,Sri Lanka,2nd innings,1,"hangs back in his crease and carves the ball behind point. It has only a tiny bit of room, but he makes the most of it by leaning back from the ball","Mathews to Dhawan, 1 run",0,49764,Angelo Mathews,0,1,0,0.1,1,574178,Akila Dananjaya,0,30,1,5.0,34,28235,Shikhar Dhawan,28,27,5,0,642519,Shreyas Iyer,14,20,1,0,1,False,0,0,0,0,0,11,12,0,False,,False,False,5.5,0,61,0,1,0,1,1,0,56
four,6,India,8,Sri Lanka,2nd innings,4,"<B>misfield at deep midwicket</b>. Chaturanga de Silva, the sub for Suranga Lakmal, has it covered as he slides to his left. But it trickles past him. Too short from Mathews to start off and a firmly struck pull gets due reward","Mathews to Iyer, FOUR runs",0,49764,Angelo Mathews,0,2,0,0.2,5,574178,Akila Dananjaya,0,30,1,5.0,34,642519,Shreyas Iyer,18,21,2,0,28235,Shikhar Dhawan,28,27,5,0,2,False,0,0,0,0,0,11,12,0,False,,False,False,5.8,0,62,0,1,0,1,1,0,60
no run,6,India,8,Sri Lanka,2nd innings,0,"back of a length on off stump, defends","Mathews to Iyer, no run",0,49764,Angelo Mathews,0,3,0,0.3,5,574178,Akila Dananjaya,0,30,1,5.0,34,642519,Shreyas Iyer,18,22,2,0,28235,Shikhar Dhawan,28,27,5,0,3,False,0,0,0,0,0,11,12,0,False,,False,False,5.71,0,63,0,1,0,1,1,0,60
run,6,India,8,Sri Lanka,2nd innings,2,"another strong shot, Iyer's bottom hand to the fore as a shortish delivery on off stump screams away to deep midwicket","Mathews to Iyer, 2 runs",0,49764,Angelo Mathews,0,4,0,0.4,7,574178,Akila Dananjaya,0,30,1,5.0,34,642519,Shreyas Iyer,20,23,2,0,28235,Shikhar Dhawan,28,27,5,0,4,False,0,0,0,0,0,11,12,0,False,,False,False,5.81,0,64,0,1,0,1,1,0,62
four,6,India,8,Sri Lanka,2nd innings,4,"and now he sends the ball sailing through cover, a top hand dominant shot. And this isn't a bad ball either. Pitched on a good length, outside off, with plenty of protection for this shot. Yet short cover, long-off and sweeper cover are spectators","Mathews to Iyer, FOUR runs",0,49764,Angelo Mathews,0,5,0,0.5,11,574178,Akila Dananjaya,0,30,1,5.0,34,642519,Shreyas Iyer,24,24,3,0,28235,Shikhar Dhawan,28,27,5,0,5,False,0,0,0,0,0,11,12,0,False,,False,False,6.09,0,65,0,1,0,1,1,0,66
run,6,India,8,Sri Lanka,2nd innings,1,"slower ball, pitched on a shortish length. Iyer tries to dab it past slip, but a little bit of movement into him off the pitch ruins those plans","Mathews to Iyer, 1 run",0,49764,Angelo Mathews,0,6,0,1.0,12,574178,Akila Dananjaya,0,30,1,5.0,34,642519,Shreyas Iyer,25,25,3,0,28235,Shikhar Dhawan,28,27,5,0,6,True,0,0,0,0,0,11,12,0,False,,False,False,6.09,0,66,0,1,0,1,1,0,67
four,6,India,8,Sri Lanka,2nd innings,4,"<b>dropped</b> at slip! Mathews is the man there, reaching up over his head to try and hang on to a cut shot coming off the top edge. Those have to stick.","Pathirana to Iyer, FOUR runs",0,212756,Sachith Pathirana,0,1,0,0.1,4,49764,Angelo Mathews,0,6,0,1.0,12,642519,Shreyas Iyer,29,26,4,0,28235,Shikhar Dhawan,28,27,5,0,1,False,0,0,0,0,0,12,8,0,False,,False,False,6.35,0,67,0,1,0,1,1,0,71
run,6,India,8,Sri Lanka,2nd innings,1,rocks back and drills a shortish delivery to long-off,"Pathirana to Iyer, 1 run",0,212756,Sachith Pathirana,0,2,0,0.2,5,49764,Angelo Mathews,0,6,0,1.0,12,642519,Shreyas Iyer,30,27,4,0,28235,Shikhar Dhawan,28,27,5,0,2,False,0,0,0,0,0,12,8,0,False,,False,False,6.35,0,68,0,1,0,1,1,0,72
run,6,India,8,Sri Lanka,2nd innings,2,"fine leg is inside the circle, so Dhawan ensures he gets just enough bat to this good length ball on leg stump","Pathirana to Dhawan, 2 runs",0,212756,Sachith Pathirana,0,3,0,0.3,7,49764,Angelo Mathews,0,6,0,1.0,12,28235,Shikhar Dhawan,30,28,5,0,642519,Shreyas Iyer,30,27,4,0,3,False,0,0,0,0,0,12,8,0,False,,False,False,6.43,0,69,0,1,0,1,1,0,74
run,6,India,8,Sri Lanka,2nd innings,1,"comes down the pitch, and then has to adjust to the ball being quite slow. Dhawan delays his shot and flicks it to square leg. He's in form.","Pathirana to Dhawan, 1 run",0,212756,Sachith Pathirana,0,4,0,0.4,8,49764,Angelo Mathews,0,6,0,1.0,12,28235,Shikhar Dhawan,31,29,5,0,642519,Shreyas Iyer,30,27,4,0,4,False,0,0,0,0,0,12,8,0,False,,False,False,6.42,0,70,0,1,0,1,1,0,75
no run,6,India,8,Sri Lanka,2nd innings,0,keeps to his crease to try and flick a good length ball on middle away. Doesn't quite do so and is struck fairly high on the pad. Pathirana appeals. Umpire says not out.,"Pathirana to Iyer, no run",0,212756,Sachith Pathirana,0,5,0,0.5,8,49764,Angelo Mathews,0,6,0,1.0,12,642519,Shreyas Iyer,30,28,4,0,28235,Shikhar Dhawan,31,29,5,0,5,False,0,0,0,0,0,12,8,0,False,,False,False,6.33,0,71,0,1,0,1,1,0,75
no run,6,India,8,Sri Lanka,2nd innings,0,"huge appeal for lbw again and this looks fairly close. Umpire Menon shakes his head again and <b>Sri Lanka decide to review</b>. Quicker delivery from Pathirana, pitched up, squeezing past the inside edge and thudding into the knee roll of the front foot. Off stump and parts of middle is visible on impact. And Ball-tracking says it will be missing the stumps. Sri Lanka lose their review","Pathirana to Iyer, no run",0,212756,Sachith Pathirana,0,6,0,1.0,8,49764,Angelo Mathews,0,6,0,1.0,12,642519,Shreyas Iyer,30,29,4,0,28235,Shikhar Dhawan,31,29,5,0,6,True,0,0,0,0,0,12,8,0,False,,False,False,6.25,0,72,0,1,0,1,1,0,75
run,6,India,8,Sri Lanka,2nd innings,1,shuffles across onto off stump and deflects the short ball to long leg,"Pradeep to Dhawan, 1 run",0,324358,Nuwan Pradeep,0,1,0,0.1,1,212756,Sachith Pathirana,0,6,0,1.0,8,28235,Shikhar Dhawan,32,30,5,0,642519,Shreyas Iyer,30,29,4,0,1,False,0,0,0,0,0,13,2,0,False,,False,False,6.24,0,73,0,1,0,1,1,0,76
no run,6,India,8,Sri Lanka,2nd innings,0,"back of a length and outside off, blocks","Pradeep to Iyer, no run",0,324358,Nuwan Pradeep,0,2,0,0.2,1,212756,Sachith Pathirana,0,6,0,1.0,8,642519,Shreyas Iyer,30,30,4,0,28235,Shikhar Dhawan,32,30,5,0,2,False,0,0,0,0,0,13,2,0,False,,False,False,6.16,0,74,0,1,0,1,1,0,76
no run,6,India,8,Sri Lanka,2nd innings,0,"shortish and outside off, Iyer lashes it to point","Pradeep to Iyer, no run",0,324358,Nuwan Pradeep,0,3,0,0.3,1,212756,Sachith Pathirana,0,6,0,1.0,8,642519,Shreyas Iyer,30,31,4,0,28235,Shikhar Dhawan,32,30,5,0,3,False,0,0,0,0,0,13,2,0,False,,False,False,6.08,0,75,0,1,0,1,1,0,76
run,6,India,8,Sri Lanka,2nd innings,1,softens the grip on the bat and opens the face as well to guide the shortish delivery to third man. Good batting.,"Pradeep to Iyer, 1 run",0,324358,Nuwan Pradeep,0,4,0,0.4,2,212756,Sachith Pathirana,0,6,0,1.0,8,642519,Shreyas Iyer,31,32,4,0,28235,Shikhar Dhawan,32,30,5,0,4,False,0,0,0,0,0,13,2,0,False,,False,False,6.07,0,76,0,1,0,1,1,0,77
no run,6,India,8,Sri Lanka,2nd innings,0,"full and outside off, drives to mid-off","Pradeep to Dhawan, no run",0,324358,Nuwan Pradeep,0,5,0,0.5,2,212756,Sachith Pathirana,0,6,0,1.0,8,28235,Shikhar Dhawan,32,31,5,0,642519,Shreyas Iyer,31,32,4,0,5,False,0,0,0,0,0,13,2,0,False,,False,False,6.0,0,77,0,1,0,1,1,0,77
no run,6,India,8,Sri Lanka,2nd innings,0,"back of a length on off stump, blocks","Pradeep to Dhawan, no run",0,324358,Nuwan Pradeep,0,6,0,1.0,2,212756,Sachith Pathirana,0,6,0,1.0,8,28235,Shikhar Dhawan,32,32,5,0,642519,Shreyas Iyer,31,32,4,0,6,True,0,0,0,0,0,13,2,0,False,,False,False,5.92,0,78,0,1,0,1,1,0,77
run,6,India,8,Sri Lanka,2nd innings,1,hangs back and slices the flatter delivery through cover,"Pathirana to Iyer, 1 run",0,212756,Sachith Pathirana,0,7,0,1.1,9,324358,Nuwan Pradeep,0,6,0,1.0,2,642519,Shreyas Iyer,32,33,4,0,28235,Shikhar Dhawan,32,32,5,0,1,False,0,0,0,0,0,14,9,0,False,,False,False,5.92,0,79,0,1,0,1,1,0,78
run,6,India,8,Sri Lanka,2nd innings,1,flings his front leg aside and drills the short ball on off stump to long-on,"Pathirana to Dhawan, 1 run",0,212756,Sachith Pathirana,0,8,0,1.2,10,324358,Nuwan Pradeep,0,6,0,1.0,2,28235,Shikhar Dhawan,33,33,5,0,642519,Shreyas Iyer,32,33,4,0,2,False,0,0,0,0,0,14,9,0,False,,False,False,5.92,0,80,0,1,0,1,1,0,79
run,6,India,8,Sri Lanka,2nd innings,1,"slows it down, and gets the ball to slide on with the arm. Iyer, playing for turn, gets an inside edge. But Dhawan races across to the other end. He's been alert to every scoring opportunity","Pathirana to Iyer, 1 run",0,212756,Sachith Pathirana,0,9,0,1.3,11,324358,Nuwan Pradeep,0,6,0,1.0,2,642519,Shreyas Iyer,33,34,4,0,28235,Shikhar Dhawan,33,33,5,0,3,False,0,0,0,0,0,14,9,0,False,,False,False,5.92,0,81,0,1,0,1,1,0,80
run,6,India,8,Sri Lanka,2nd innings,1,"brutal sweep shot, taking the ball from leg stump and it would have thudded into the boundary boards if not for a big dive from the substitute de Silva","Pathirana to Dhawan, 1 run",0,212756,Sachith Pathirana,0,10,0,1.4,12,324358,Nuwan Pradeep,0,6,0,1.0,2,28235,Shikhar Dhawan,34,34,5,0,642519,Shreyas Iyer,33,34,4,0,4,False,0,0,0,0,0,14,9,0,False,,False,False,5.92,0,82,0,1,0,1,1,0,81
four,6,India,8,Sri Lanka,2nd innings,4,steps out of his crease to slog the ball over midwicket. Instead he gets an inside edge to the long leg boundary,"Pathirana to Iyer, FOUR runs",0,212756,Sachith Pathirana,0,11,0,1.5,16,324358,Nuwan Pradeep,0,6,0,1.0,2,642519,Shreyas Iyer,37,35,5,0,28235,Shikhar Dhawan,34,34,5,0,5,False,0,0,0,0,0,14,9,0,False,,False,False,6.14,0,83,0,1,0,1,1,0,85
run,6,India,8,Sri Lanka,2nd innings,1,"presses forward as a trigger movement, but seeing the ball short, he rocks back and slaps through point","Pathirana to Iyer, 1 run",0,212756,Sachith Pathirana,0,12,0,2.0,17,324358,Nuwan Pradeep,0,6,0,1.0,2,642519,Shreyas Iyer,38,36,5,0,28235,Shikhar Dhawan,34,34,5,0,6,True,0,0,0,0,0,14,9,0,False,,False,False,6.14,0,84,0,1,0,1,1,0,86
no run,6,India,8,Sri Lanka,2nd innings,0,<b>beats him</b> outside off as he pitches a short of a length ball in the off stump corridor. Iyer is squared up and pushing at the ball with hard hands,"Pradeep to Iyer, no run",0,324358,Nuwan Pradeep,0,7,0,1.1,2,212756,Sachith Pathirana,0,12,0,2.0,17,642519,Shreyas Iyer,38,37,5,0,28235,Shikhar Dhawan,34,34,5,0,1,False,0,0,0,0,0,15,5,0,False,,False,False,6.07,0,85,0,1,0,1,1,0,86
no run,6,India,8,Sri Lanka,2nd innings,0,blocks a shortish delivery on off stump,"Pradeep to Iyer, no run",0,324358,Nuwan Pradeep,0,8,0,1.2,2,212756,Sachith Pathirana,0,12,0,2.0,17,642519,Shreyas Iyer,38,38,5,0,28235,Shikhar Dhawan,34,34,5,0,2,False,0,0,0,0,0,15,5,0,False,,False,False,6.0,0,86,0,1,0,1,1,0,86
four,6,India,8,Sri Lanka,2nd innings,4,"<b>almost taken at the third man boundary</b>! What an effort from Dananjaya, races to his right, puts in the full length dive, but it just eludes him. An upper cut from Iyer, which looked for all money as a very very clever shot, nearly ends up a brainfade","Pradeep to Iyer, FOUR runs",0,324358,Nuwan Pradeep,0,9,0,1.3,6,212756,Sachith Pathirana,0,12,0,2.0,17,642519,Shreyas Iyer,42,39,6,0,28235,Shikhar Dhawan,34,34,5,0,3,False,0,0,0,0,0,15,5,0,False,,False,False,6.2,0,87,0,1,0,1,1,0,90
no run,6,India,8,Sri Lanka,2nd innings,0,"shortish delivery on off stump, blocks","Pradeep to Iyer, no run",0,324358,Nuwan Pradeep,0,10,0,1.4,6,212756,Sachith Pathirana,0,12,0,2.0,17,642519,Shreyas Iyer,42,40,6,0,28235,Shikhar Dhawan,34,34,5,0,4,False,0,0,0,0,0,15,5,0,False,,False,False,6.13,0,88,0,1,0,1,1,0,90
no run,6,India,8,Sri Lanka,2nd innings,0,"back of a length and outside off, punches to mid-on","Pradeep to Iyer, no run",0,324358,Nuwan Pradeep,0,11,0,1.5,6,212756,Sachith Pathirana,0,12,0,2.0,17,642519,Shreyas Iyer,42,41,6,0,28235,Shikhar Dhawan,34,34,5,0,5,False,0,0,0,0,0,15,5,0,False,,False,False,6.06,0,89,0,1,0,1,1,0,90
run,6,India,8,Sri Lanka,2nd innings,1,"there is very little room to play the cut, but Iyer wants to, and so he sways away from the line of the short ball and chops it down to third man","Pradeep to Iyer, 1 run",0,324358,Nuwan Pradeep,0,12,0,2.0,7,212756,Sachith Pathirana,0,12,0,2.0,17,642519,Shreyas Iyer,43,42,6,0,28235,Shikhar Dhawan,34,34,5,0,6,True,0,0,0,0,0,15,5,0,False,,False,False,6.06,0,90,0,1,0,1,1,0,91
six,6,India,8,Sri Lanka,2nd innings,6,over wide long-on! India are motoring. Pathirana looks like a left-arm spinner who simply slides balls on with the arm . Iyer is aware of that as he races down the pitch and launches it with the angle from around the wicket,"Pathirana to Iyer, SIX runs",0,212756,Sachith Pathirana,0,13,0,2.1,23,324358,Nuwan Pradeep,0,12,0,2.0,7,642519,Shreyas Iyer,49,43,6,1,28235,Shikhar Dhawan,34,34,5,0,1,False,0,0,0,0,0,16,12,0,False,,False,False,6.39,0,91,0,1,0,1,1,0,97
run,6,India,8,Sri Lanka,2nd innings,1,"tosses it up outside off, Iyer reaches for it and drives along the ground to reach a <b>second fifty in two matches</b>","Pathirana to Iyer, 1 run",0,212756,Sachith Pathirana,0,14,0,2.2,24,324358,Nuwan Pradeep,0,12,0,2.0,7,642519,Shreyas Iyer,50,44,6,1,28235,Shikhar Dhawan,34,34,5,0,2,False,0,0,0,0,0,16,12,0,False,,False,False,6.39,0,92,0,1,0,1,1,0,98
run,6,India,8,Sri Lanka,2nd innings,1,"fuller delivery on middle, tucks it behind square leg","Pathirana to Dhawan, 1 run",0,212756,Sachith Pathirana,0,15,0,2.3,25,324358,Nuwan Pradeep,0,12,0,2.0,7,28235,Shikhar Dhawan,35,35,5,0,642519,Shreyas Iyer,50,44,6,1,3,False,0,0,0,0,0,16,12,0,False,,False,False,6.38,0,93,0,1,0,1,1,0,99
four,6,India,8,Sri Lanka,2nd innings,4,"cuts it away, playing late and placing the ball to the left of backward point. Brilliant batting. But have to say, pretty poor bowling. Just too short.","Pathirana to Iyer, FOUR runs",0,212756,Sachith Pathirana,0,16,0,2.4,29,324358,Nuwan Pradeep,0,12,0,2.0,7,642519,Shreyas Iyer,54,45,7,1,28235,Shikhar Dhawan,35,35,5,0,4,False,0,0,0,0,0,16,12,0,False,,False,False,6.57,0,94,0,1,0,1,1,0,103
no run,6,India,8,Sri Lanka,2nd innings,0,"tosses it up into the pads, Iyer opens himself up to push the ball inside out back down the pitch","Pathirana to Iyer, no run",0,212756,Sachith Pathirana,0,17,0,2.5,29,324358,Nuwan Pradeep,0,12,0,2.0,7,642519,Shreyas Iyer,54,46,7,1,28235,Shikhar Dhawan,35,35,5,0,5,False,0,0,0,0,0,16,12,0,False,,False,False,6.5,0,95,0,1,0,1,1,0,103
no run,6,India,8,Sri Lanka,2nd innings,0,gets forward to nudge a flighted delivery on leg stump to short midwicket,"Pathirana to Iyer, no run",0,212756,Sachith Pathirana,0,18,0,3.0,29,324358,Nuwan Pradeep,0,12,0,2.0,7,642519,Shreyas Iyer,54,47,7,1,28235,Shikhar Dhawan,35,35,5,0,6,True,0,0,0,0,0,16,12,0,False,,False,False,6.43,0,96,0,1,0,1,1,0,103
run,6,India,8,Sri Lanka,2nd innings,1,"good length ball outside off, drives on the up to sweeper cover","Pradeep to Dhawan, 1 run",0,324358,Nuwan Pradeep,0,13,0,2.1,8,212756,Sachith Pathirana,0,18,0,3.0,29,28235,Shikhar Dhawan,36,36,5,0,642519,Shreyas Iyer,54,47,7,1,1,False,0,0,0,0,0,17,3,0,False,,False,False,6.43,0,97,0,1,0,1,1,0,104
run,6,India,8,Sri Lanka,2nd innings,1,gets up on his toes and unleashes a picture perfect cover drive off the back foot. Those are the shot played by batsmen in prime form. One who is well in tune with the pace of the pitch,"Pradeep to Iyer, 1 run",0,324358,Nuwan Pradeep,0,14,0,2.2,9,212756,Sachith Pathirana,0,18,0,3.0,29,642519,Shreyas Iyer,55,48,7,1,28235,Shikhar Dhawan,36,36,5,0,2,False,0,0,0,0,0,17,3,0,False,,False,False,6.42,0,98,0,1,0,1,1,0,105
run,6,India,8,Sri Lanka,2nd innings,1,chops a shortish delivery angled into him to the third man region,"Pradeep to Dhawan, 1 run",0,324358,Nuwan Pradeep,0,15,0,2.3,10,212756,Sachith Pathirana,0,18,0,3.0,29,28235,Shikhar Dhawan,37,37,5,0,642519,Shreyas Iyer,55,48,7,1,3,False,0,0,0,0,0,17,3,0,False,,False,False,6.42,0,99,0,1,0,1,1,0,106
no run,6,India,8,Sri Lanka,2nd innings,0,"first he is ducking into the short ball, and then at the last minute, he tries a ramp over the keeper's head. No luck pulling it off though","Pradeep to Iyer, no run",0,324358,Nuwan Pradeep,0,16,0,2.4,10,212756,Sachith Pathirana,0,18,0,3.0,29,642519,Shreyas Iyer,55,49,7,1,28235,Shikhar Dhawan,37,37,5,0,4,False,0,0,0,0,0,17,3,0,False,,False,False,6.36,0,100,0,1,0,1,1,0,106
no run,6,India,8,Sri Lanka,2nd innings,0,"<b>extra bounce</b> and with Iyer squared up, and trying to place the ball to mid-on, gets a leading edge","Pradeep to Iyer, no run",0,324358,Nuwan Pradeep,0,17,0,2.5,10,212756,Sachith Pathirana,0,18,0,3.0,29,642519,Shreyas Iyer,55,50,7,1,28235,Shikhar Dhawan,37,37,5,0,5,False,0,0,0,0,0,17,3,0,False,,False,False,6.29,0,101,0,1,0,1,1,0,106
no run,6,India,8,Sri Lanka,2nd innings,0,"full on off stump, defends neatly","Pradeep to Iyer, no run",0,324358,Nuwan Pradeep,0,18,0,3.0,10,212756,Sachith Pathirana,0,18,0,3.0,29,642519,Shreyas Iyer,55,51,7,1,28235,Shikhar Dhawan,37,37,5,0,6,True,0,0,0,0,0,17,3,0,False,,False,False,6.23,0,102,0,1,0,1,1,0,106
no run,6,India,8,Sri Lanka,2nd innings,0,strides down the pitch and thumps the flighted delivery back to the bowler,"Dananjaya to Dhawan, no run",0,574178,Akila Dananjaya,0,31,1,5.1,34,324358,Nuwan Pradeep,0,18,0,3.0,10,28235,Shikhar Dhawan,37,38,5,0,642519,Shreyas Iyer,55,51,7,1,1,False,0,0,0,0,0,18,3,0,False,,False,False,6.17,0,103,0,1,0,1,1,0,106
run,6,India,8,Sri Lanka,2nd innings,1,"advances again, but having not reached the pitch, and still trying to flick against the turn, he gets a leading edge to long-off","Dananjaya to Dhawan, 1 run",0,574178,Akila Dananjaya,0,32,1,5.2,35,324358,Nuwan Pradeep,0,18,0,3.0,10,28235,Shikhar Dhawan,38,39,5,0,642519,Shreyas Iyer,55,51,7,1,2,False,0,0,0,0,0,18,3,0,False,,False,False,6.17,0,104,0,1,0,1,1,0,107
