PlayType_description,Batting_Team_id,Batting_Team_name,Bowling_Team_id,Bowling_Team_name,Innings,Total_Runs_on_delivery,Commentary,Commentary_short,Score,Bowler_id,Bowler_name,Bowler_maiden,Bowler_balls,Bowler_wickets,Bowler_over,Bowler_conceded,Other_Bowler_id,Other_Bowler_name,Other_Bowler_maidens,Other_Bowler_balls,Other_Bowler_wickets,Other_Bowler_overs,Other_Bowler_conceded,Batsman_id,Batsman_name,Batsman_runs,Batsman_balls_faced,Batsman_four,Batsman_sixes,Other_Batsman_id,Other_Batsman_name,Other_Batsman_runs,Other_Batsman_balls_faced,Other_Batsman_four,Other_Batsman_sixes,Over_ball,Over_complete,Over_maiden,Over_no_Ball,Over_wide,Over_byes,Over_leg_byes,Over_number,Over_runs,Over_wickets,Dismissal_is_true,Dismissal_type,Dismissal_fielder_iskeeper,Dismissal_text,Innings_run_rate,Innings_byes,Innings_balls,Innings_no_balls,Innings_wickets,Innings_leg_byes,Innings_session,Innings_day,Innings_wides,Innings_runs
wide,8,Sri Lanka,6,India,1st innings,1,"another bouncer at 127 kph, but strays down leg, extra","Pandya to Pradeep, 1 wide",212/9,625371,Hardik Pandya,0,53,2,8.5,49,559235,Kuldeep Yadav,0,54,3,9.0,41,324358,Nuwan Pradeep,0,4,0,0,360456,Asela Gunaratne,14,34,0,0,6,False,0,0,1,0,0,41,1,1,False,,False,False,5.19,0,245,0,9,0,1,1,1,212
no run,8,Sri Lanka,6,India,1st innings,0,"good length outside off, Pradeep beaten on the outside edge","Pandya to Pradeep, no run",212/9,625371,Hardik Pandya,0,54,2,9.0,49,559235,Kuldeep Yadav,0,54,3,9.0,41,324358,Nuwan Pradeep,0,5,0,0,360456,Asela Gunaratne,14,34,0,0,7,True,0,0,0,0,0,41,1,1,False,,False,False,5.17,0,246,0,9,0,1,1,0,212
no run,8,Sri Lanka,6,India,1st innings,0,"flat outside off, swatted away to cover","Kuldeep Yadav to Gunaratne, no run",212/9,559235,Kuldeep Yadav,0,55,3,9.1,41,625371,Hardik Pandya,0,54,2,9.0,49,360456,Asela Gunaratne,14,35,0,0,324358,Nuwan Pradeep,0,5,0,0,1,False,0,0,0,0,0,42,1,0,False,,False,False,5.14,0,247,0,9,0,1,1,0,212
no run,8,Sri Lanka,6,India,1st innings,0,"some flight around off, defended","Kuldeep Yadav to Gunaratne, no run",212/9,559235,Kuldeep Yadav,0,56,3,9.2,41,625371,Hardik Pandya,0,54,2,9.0,49,360456,Asela Gunaratne,14,36,0,0,324358,Nuwan Pradeep,0,5,0,0,2,False,0,0,0,0,0,42,1,0,False,,False,False,5.12,0,248,0,9,0,1,1,0,212
no run,8,Sri Lanka,6,India,1st innings,0,"a googly outside off, scythed to point, still no run, refuses the available single","Kuldeep Yadav to Gunaratne, no run",212/9,559235,Kuldeep Yadav,0,57,3,9.3,41,625371,Hardik Pandya,0,54,2,9.0,49,360456,Asela Gunaratne,14,37,0,0,324358,Nuwan Pradeep,0,5,0,0,3,False,0,0,0,0,0,42,1,0,False,,False,False,5.1,0,249,0,9,0,1,1,0,212
no run,8,Sri Lanka,6,India,1st innings,0,"a yorker around middle, blocked","Kuldeep Yadav to Gunaratne, no run",212/9,559235,Kuldeep Yadav,0,58,3,9.4,41,625371,Hardik Pandya,0,54,2,9.0,49,360456,Asela Gunaratne,14,38,0,0,324358,Nuwan Pradeep,0,5,0,0,4,False,0,0,0,0,0,42,1,0,False,,False,False,5.08,0,250,0,9,0,1,1,0,212
no run,8,Sri Lanka,6,India,1st innings,0,"the googly around off, played away","Kuldeep Yadav to Gunaratne, no run",212/9,559235,Kuldeep Yadav,0,59,3,9.5,41,625371,Hardik Pandya,0,54,2,9.0,49,360456,Asela Gunaratne,14,39,0,0,324358,Nuwan Pradeep,0,5,0,0,5,False,0,0,0,0,0,42,1,0,False,,False,False,5.06,0,251,0,9,0,1,1,0,212
run,8,Sri Lanka,6,India,1st innings,1,"comes down and misses a drive, but the ball ricochets into a favourable area at midwicket for one leg bye","Kuldeep Yadav to Gunaratne, 1 run",213/9,559235,Kuldeep Yadav,0,60,3,10.0,42,625371,Hardik Pandya,0,54,2,9.0,49,360456,Asela Gunaratne,15,40,0,0,324358,Nuwan Pradeep,0,5,0,0,6,True,0,0,0,0,0,42,1,0,False,,False,False,5.07,0,252,0,9,0,1,1,0,213
run,8,Sri Lanka,6,India,1st innings,2,"should have been behind or closer to the wicket. Shortish and wide outside off, carved behind point. Pandya runs around from third man and throws to Bumrah who messes up the collection","Bumrah to Gunaratne, 2 runs",215/9,625383,Jasprit Bumrah,1,43,1,7.1,39,559235,Kuldeep Yadav,0,60,3,10.0,42,360456,Asela Gunaratne,17,41,0,0,324358,Nuwan Pradeep,0,5,0,0,1,False,0,0,0,0,0,43,2,0,False,,False,False,5.09,0,253,0,9,0,1,1,0,215
no run,8,Sri Lanka,6,India,1st innings,0,"a good wide yorker outside off, Gunaratne misses it","Bumrah to Gunaratne, no run",215/9,625383,Jasprit Bumrah,1,44,1,7.2,39,559235,Kuldeep Yadav,0,60,3,10.0,42,360456,Asela Gunaratne,17,42,0,0,324358,Nuwan Pradeep,0,5,0,0,2,False,0,0,0,0,0,43,2,0,False,,False,False,5.07,0,254,0,9,0,1,1,0,215
no run,8,Sri Lanka,6,India,1st innings,0,"another yorker outside off, jammed away to point","Bumrah to Gunaratne, no run",215/9,625383,Jasprit Bumrah,1,45,1,7.3,39,559235,Kuldeep Yadav,0,60,3,10.0,42,360456,Asela Gunaratne,17,43,0,0,324358,Nuwan Pradeep,0,5,0,0,3,False,0,0,0,0,0,43,2,0,False,,False,False,5.05,0,255,0,9,0,1,1,0,215
no run,8,Sri Lanka,6,India,1st innings,0,"dabs this full delivery down to third man, no run there","Bumrah to Gunaratne, no run",215/9,625383,Jasprit Bumrah,1,46,1,7.4,39,559235,Kuldeep Yadav,0,60,3,10.0,42,360456,Asela Gunaratne,17,44,0,0,324358,Nuwan Pradeep,0,5,0,0,4,False,0,0,0,0,0,43,2,0,False,,False,False,5.03,0,256,0,9,0,1,1,0,215
no run,8,Sri Lanka,6,India,1st innings,0,"136 kph, on the pads, worked away but straight to midwicket","Bumrah to Gunaratne, no run",215/9,625383,Jasprit Bumrah,1,47,1,7.5,39,559235,Kuldeep Yadav,0,60,3,10.0,42,360456,Asela Gunaratne,17,45,0,0,324358,Nuwan Pradeep,0,5,0,0,5,False,0,0,0,0,0,43,2,0,False,,False,False,5.01,0,257,0,9,0,1,1,0,215
no run,8,Sri Lanka,6,India,1st innings,0,"full and wide outside off, Gunaratne makes connection with nothing but air on his drive","Bumrah to Gunaratne, no run",215/9,625383,Jasprit Bumrah,1,48,1,8.0,39,559235,Kuldeep Yadav,0,60,3,10.0,42,360456,Asela Gunaratne,17,46,0,0,324358,Nuwan Pradeep,0,5,0,0,6,True,0,0,0,0,0,43,2,0,False,,False,False,5.0,0,258,0,9,0,1,1,0,215
no run,8,Sri Lanka,6,India,1st innings,0,"slow around middle and leg, pitches and rips away to beat the bat.","Chahal to Pradeep, no run",215/9,430246,Yuzvendra Chahal,2,55,3,9.1,46,625383,Jasprit Bumrah,1,48,1,8.0,39,324358,Nuwan Pradeep,0,6,0,0,360456,Asela Gunaratne,17,46,0,0,1,False,1,0,0,0,0,44,0,0,False,,False,False,4.98,0,259,0,9,0,1,1,0,215
no run,8,Sri Lanka,6,India,1st innings,0,"slightly quicker outside off, beats the bat again. Not as much turn because of the pace but beats him anyway","Chahal to Pradeep, no run",215/9,430246,Yuzvendra Chahal,2,56,3,9.2,46,625383,Jasprit Bumrah,1,48,1,8.0,39,324358,Nuwan Pradeep,0,7,0,0,360456,Asela Gunaratne,17,46,0,0,2,False,1,0,0,0,0,44,0,0,False,,False,False,4.96,0,260,0,9,0,1,1,0,215
no run,8,Sri Lanka,6,India,1st innings,0,"and again. Has to push that fuller, beats Pradeep by a mile again. Pradeep not chasing after them.","Chahal to Pradeep, no run",215/9,430246,Yuzvendra Chahal,2,57,3,9.3,46,625383,Jasprit Bumrah,1,48,1,8.0,39,324358,Nuwan Pradeep,0,8,0,0,360456,Asela Gunaratne,17,46,0,0,3,False,1,0,0,0,0,44,0,0,False,,False,False,4.94,0,261,0,9,0,1,1,0,215
no run,8,Sri Lanka,6,India,1st innings,0,"the googly outside off, Pradeep makes contact with the ball. Blocked","Chahal to Pradeep, no run",215/9,430246,Yuzvendra Chahal,2,58,3,9.4,46,625383,Jasprit Bumrah,1,48,1,8.0,39,324358,Nuwan Pradeep,0,9,0,0,360456,Asela Gunaratne,17,46,0,0,4,False,1,0,0,0,0,44,0,0,False,,False,False,4.92,0,262,0,9,0,1,1,0,215
no run,8,Sri Lanka,6,India,1st innings,0,"too full again, smothered away towards point","Chahal to Pradeep, no run",215/9,430246,Yuzvendra Chahal,2,59,3,9.5,46,625383,Jasprit Bumrah,1,48,1,8.0,39,324358,Nuwan Pradeep,0,10,0,0,360456,Asela Gunaratne,17,46,0,0,5,False,1,0,0,0,0,44,0,0,False,,False,False,4.9,0,263,0,9,0,1,1,0,215
no run,8,Sri Lanka,6,India,1st innings,0,"and again, very slow around off, Pradeep prods at the ball, but the ball beats Pradeep's waft","Chahal to Pradeep, no run",215/9,430246,Yuzvendra Chahal,3,60,3,10.0,46,625383,Jasprit Bumrah,1,48,1,8.0,39,324358,Nuwan Pradeep,0,11,0,0,360456,Asela Gunaratne,17,46,0,0,6,True,1,0,0,0,0,44,0,0,False,,False,False,4.88,0,264,0,9,0,1,1,0,215
no run,8,Sri Lanka,6,India,1st innings,0,"shortish and wide, slashed away to point","Kumar to Gunaratne, no run",215/9,326016,Bhuvneshwar Kumar,0,37,0,6.1,35,430246,Yuzvendra Chahal,3,60,3,10.0,46,360456,Asela Gunaratne,17,47,0,0,324358,Nuwan Pradeep,0,11,0,0,1,False,0,0,0,0,0,45,0,1,False,,False,False,4.86,0,265,0,9,0,1,1,0,215
no run,8,Sri Lanka,6,India,1st innings,0,carved away to deep point. No run there either,"Kumar to Gunaratne, no run",215/9,326016,Bhuvneshwar Kumar,0,38,0,6.2,35,430246,Yuzvendra Chahal,3,60,3,10.0,46,360456,Asela Gunaratne,17,48,0,0,324358,Nuwan Pradeep,0,11,0,0,2,False,0,0,0,0,0,45,0,1,False,,False,False,4.84,0,266,0,9,0,1,1,0,215
no run,8,Sri Lanka,6,India,1st innings,0,"133 kph, good length around off, blocked back. SL making no progress","Kumar to Gunaratne, no run",215/9,326016,Bhuvneshwar Kumar,0,39,0,6.3,35,430246,Yuzvendra Chahal,3,60,3,10.0,46,360456,Asela Gunaratne,17,49,0,0,324358,Nuwan Pradeep,0,11,0,0,3,False,0,0,0,0,0,45,0,1,False,,False,False,4.83,0,267,0,9,0,1,1,0,215
no run,8,Sri Lanka,6,India,1st innings,0,"sees Gunaratne coming and shortens the length to a bouncer around off, patted to deep point","Kumar to Gunaratne, no run",215/9,326016,Bhuvneshwar Kumar,0,40,0,6.4,35,430246,Yuzvendra Chahal,3,60,3,10.0,46,360456,Asela Gunaratne,17,50,0,0,324358,Nuwan Pradeep,0,11,0,0,4,False,0,0,0,0,0,45,0,1,False,,False,False,4.81,0,268,0,9,0,1,1,0,215
out,8,Sri Lanka,6,India,1st innings,0,"edged and gone! SL are bowled out. Good length outside off, Gunaratne tries to dab this down to third man but the ball takes the outside edge and carries low to Dhoni's right. A mighty collapse. Another one.","Kumar to Gunaratne, OUT",215/10,326016,Bhuvneshwar Kumar,0,41,1,6.5,35,430246,Yuzvendra Chahal,3,60,3,10.0,46,360456,Asela Gunaratne,17,51,0,0,324358,Nuwan Pradeep,0,11,0,0,5,True,0,0,0,0,0,45,0,1,True,caught,False,DAS Gunaratne c &dagger;Dhoni b Kumar 17 (81m 51b 0x4 0x6) SR: 33.33,4.79,0,269,0,10,0,1,1,0,215
no run,6,India,8,Sri Lanka,2nd innings,0,"<b>excellent line</b>! And swing under lights! He pitches it up, in the corridor outside off, and Rohit, wisely, lets the ball go","Lakmal to Sharma, no run",0,49619,Suranga Lakmal,0,1,0,0.1,0,False,False,0,0,0,False,0,34102,Rohit Sharma,0,1,0,0,28235,Shikhar Dhawan,0,0,0,0,1,False,1,0,0,0,0,1,0,0,False,,False,False,0.0,0,1,0,0,0,1,1,0,0
no run,6,India,8,Sri Lanka,2nd innings,0,"a shade shorter, but still making the ball seam away and testing the opening batsman's concentration. Rohit continues to let go","Lakmal to Sharma, no run",0,49619,Suranga Lakmal,0,2,0,0.2,0,False,False,0,0,0,False,0,34102,Rohit Sharma,0,2,0,0,28235,Shikhar Dhawan,0,0,0,0,2,False,1,0,0,0,0,1,0,0,False,,False,False,0.0,0,2,0,0,0,1,1,0,0
no run,6,India,8,Sri Lanka,2nd innings,0,"walks at the bowler, but Lakmal pulls his length back and jags the ball away past Rohit's defensive block","Lakmal to Sharma, no run",0,49619,Suranga Lakmal,0,3,0,0.3,0,False,False,0,0,0,False,0,34102,Rohit Sharma,0,3,0,0,28235,Shikhar Dhawan,0,0,0,0,3,False,1,0,0,0,0,1,0,0,False,,False,False,0.0,0,3,0,0,0,1,1,0,0
no run,6,India,8,Sri Lanka,2nd innings,0,"short and outside off, no shot again.","Lakmal to Sharma, no run",0,49619,Suranga Lakmal,0,4,0,0.4,0,False,False,0,0,0,False,0,34102,Rohit Sharma,0,4,0,0,28235,Shikhar Dhawan,0,0,0,0,4,False,1,0,0,0,0,1,0,0,False,,False,False,0.0,0,4,0,0,0,1,1,0,0
no run,6,India,8,Sri Lanka,2nd innings,0,back of a length and outside off. Rohit ushers it to the wicketkeeper #Gentle(Bats)man,"Lakmal to Sharma, no run",0,49619,Suranga Lakmal,0,5,0,0.5,0,False,False,0,0,0,False,0,34102,Rohit Sharma,0,5,0,0,28235,Shikhar Dhawan,0,0,0,0,5,False,1,0,0,0,0,1,0,0,False,,False,False,0.0,0,5,0,0,0,1,1,0,0
no run,6,India,8,Sri Lanka,2nd innings,0,"a thought flickers in his mind about playing this short of a length ball, holding its line outside off. But then come the alarm bells and finally the leave","Lakmal to Sharma, no run",0,49619,Suranga Lakmal,1,6,0,1.0,0,False,False,0,0,0,False,0,34102,Rohit Sharma,0,6,0,0,28235,Shikhar Dhawan,0,0,0,0,6,True,1,0,0,0,0,1,0,0,False,,False,False,0.0,0,6,0,0,0,1,1,0,0
run,6,India,8,Sri Lanka,2nd innings,1,"offbreak from around the wicket, and he gets a bit of a top edge through midwicket. No one inside the circle to try for the catch.","Dananjaya to Dhawan, 1 run",0,574178,Akila Dananjaya,0,1,0,0.1,1,49619,Suranga Lakmal,1,6,0,1.0,0,28235,Shikhar Dhawan,1,1,0,0,34102,Rohit Sharma,0,6,0,0,1,False,0,0,0,0,0,2,3,0,False,,False,False,0.85,0,7,0,0,0,1,1,0,1
run,6,India,8,Sri Lanka,2nd innings,1,"<b>falls short of long-on</b>! Beautiful piece of bowling, Dananjaya tossing it up outside off, drawing the big shot, and then the dip forcing Rohit to inside edge the ball","Dananjaya to Sharma, 1 run",0,574178,Akila Dananjaya,0,2,0,0.2,2,49619,Suranga Lakmal,1,6,0,1.0,0,34102,Rohit Sharma,1,7,0,0,28235,Shikhar Dhawan,1,1,0,0,2,False,0,0,0,0,0,2,3,0,False,,False,False,1.5,0,8,0,0,0,1,1,0,2
run,6,India,8,Sri Lanka,2nd innings,1,"flights it outside off, Dhawan sweeps and a diving Lakmal at short fine leg keeps it to a single","Dananjaya to Dhawan, 1 run",0,574178,Akila Dananjaya,0,3,0,0.3,3,49619,Suranga Lakmal,1,6,0,1.0,0,28235,Shikhar Dhawan,2,2,0,0,34102,Rohit Sharma,1,7,0,0,3,False,0,0,0,0,0,2,3,0,False,,False,False,2.0,0,9,0,0,0,1,1,0,3
no run,6,India,8,Sri Lanka,2nd innings,0,uses his wrists to keep the tossed up delivery down as he plays to midwicket,"Dananjaya to Sharma, no run",0,574178,Akila Dananjaya,0,4,0,0.4,3,49619,Suranga Lakmal,1,6,0,1.0,0,34102,Rohit Sharma,1,8,0,0,28235,Shikhar Dhawan,2,2,0,0,4,False,0,0,0,0,0,2,3,0,False,,False,False,1.8,0,10,0,0,0,1,1,0,3
no run,6,India,8,Sri Lanka,2nd innings,0,"goes back, picking the length to be short enough, and turns it to midwicket","Dananjaya to Sharma, no run",0,574178,Akila Dananjaya,0,5,0,0.5,3,49619,Suranga Lakmal,1,6,0,1.0,0,34102,Rohit Sharma,1,9,0,0,28235,Shikhar Dhawan,2,2,0,0,5,False,0,0,0,0,0,2,3,0,False,,False,False,1.63,0,11,0,0,0,1,1,0,3
no run,6,India,8,Sri Lanka,2nd innings,0,"shapes for a big one again, but he is wise to the bowler getting dip and so makes sure to instead keep it down with a roll of the wrists","Dananjaya to Sharma, no run",0,574178,Akila Dananjaya,0,6,0,1.0,3,49619,Suranga Lakmal,1,6,0,1.0,0,34102,Rohit Sharma,1,10,0,0,28235,Shikhar Dhawan,2,2,0,0,6,True,0,0,0,0,0,2,3,0,False,,False,False,1.5,0,12,0,0,0,1,1,0,3
wide,6,India,8,Sri Lanka,2nd innings,1,"shortish and down leg, so far that Dhawan has no chance of reaching it","Lakmal to Dhawan, 1 wide",0,49619,Suranga Lakmal,1,6,0,1.0,1,574178,Akila Dananjaya,0,6,0,1.0,3,28235,Shikhar Dhawan,2,2,0,0,34102,Rohit Sharma,1,10,0,0,1,False,0,0,1,0,0,3,5,0,False,,False,False,2.0,0,12,0,0,0,1,1,1,4
no run,6,India,8,Sri Lanka,2nd innings,0,"a hint of nip off the track, cramping Dhawan for room as he defends on off stump","Lakmal to Dhawan, no run",0,49619,Suranga Lakmal,1,7,0,1.1,1,574178,Akila Dananjaya,0,6,0,1.0,3,28235,Shikhar Dhawan,2,3,0,0,34102,Rohit Sharma,1,10,0,0,2,False,0,0,0,0,0,3,5,0,False,,False,False,1.84,0,13,0,0,0,1,1,0,4
no run,6,India,8,Sri Lanka,2nd innings,0,"continues getting handsome movement off the pitch, and bounce as well. Dhawan, caught in the crease, trying to flick the ball, is hit on the body","Lakmal to Dhawan, no run",0,49619,Suranga Lakmal,1,8,0,1.2,1,574178,Akila Dananjaya,0,6,0,1.0,3,28235,Shikhar Dhawan,2,4,0,0,34102,Rohit Sharma,1,10,0,0,3,False,0,0,0,0,0,3,5,0,False,,False,False,1.71,0,14,0,0,0,1,1,0,4
no run,6,India,8,Sri Lanka,2nd innings,0,"looks to flick a shortish delivery away off the hip, but he's not really timed the ball properly. Nearly pops up to short midwicket. I'm starting to wonder if the pitch is two-paced...","Lakmal to Dhawan, no run",0,49619,Suranga Lakmal,1,9,0,1.3,1,574178,Akila Dananjaya,0,6,0,1.0,3,28235,Shikhar Dhawan,2,5,0,0,34102,Rohit Sharma,1,10,0,0,4,False,0,0,0,0,0,3,5,0,False,,False,False,1.6,0,15,0,0,0,1,1,0,4
no run,6,India,8,Sri Lanka,2nd innings,0,"<b>beaten</b> outside off. Lakmal throws his head back, cussing his luck after watching a perfectly good length ball tempt Dhawan into an airy drive and dart past the outside edge","Lakmal to Dhawan, no run",0,49619,Suranga Lakmal,1,10,0,1.4,1,574178,Akila Dananjaya,0,6,0,1.0,3,28235,Shikhar Dhawan,2,6,0,0,34102,Rohit Sharma,1,10,0,0,5,False,0,0,0,0,0,3,5,0,False,,False,False,1.5,0,16,0,0,0,1,1,0,4
no run,6,India,8,Sri Lanka,2nd innings,0,"short and targeting the body with that seam movement into the left-hander. Dhawan defends, slipping deep into his crease","Lakmal to Dhawan, no run",0,49619,Suranga Lakmal,1,11,0,1.5,1,574178,Akila Dananjaya,0,6,0,1.0,3,28235,Shikhar Dhawan,2,7,0,0,34102,Rohit Sharma,1,10,0,0,6,False,0,0,0,0,0,3,5,0,False,,False,False,1.41,0,17,0,0,0,1,1,0,4
four,6,India,8,Sri Lanka,2nd innings,4,"pulls it wide of long-on! Good shot, taking full toll of the length, and also providing proof that he is starting to assess the pace of this pitch better","Lakmal to Dhawan, FOUR runs",0,49619,Suranga Lakmal,1,12,0,2.0,5,574178,Akila Dananjaya,0,6,0,1.0,3,28235,Shikhar Dhawan,6,8,1,0,34102,Rohit Sharma,1,10,0,0,7,True,0,0,0,0,0,3,5,0,False,,False,False,2.66,0,18,0,0,0,1,1,0,8
no run,6,India,8,Sri Lanka,2nd innings,0,waits in his crease to allow the good length ball to turn and clips it to backward square leg,"Dananjaya to Sharma, no run",0,574178,Akila Dananjaya,0,7,0,1.1,3,49619,Suranga Lakmal,1,12,0,2.0,5,34102,Rohit Sharma,1,11,0,0,28235,Shikhar Dhawan,6,8,1,0,1,False,0,0,0,0,0,4,8,1,False,,False,False,2.52,0,19,0,0,0,1,1,0,8
six,6,India,8,Sri Lanka,2nd innings,6,"that's monstrous! I could count up to about five before the ball came down into the crowd behind long-on! What hang time! What power! What a playa! Races down the pitch, the bat comes down from high over his head and finishes hitting his back as he launches a straight six","Dananjaya to Sharma, SIX runs",0,574178,Akila Dananjaya,0,8,0,1.2,9,49619,Suranga Lakmal,1,12,0,2.0,5,34102,Rohit Sharma,7,12,0,1,28235,Shikhar Dhawan,6,8,1,0,2,False,0,0,0,0,0,4,8,1,False,,False,False,4.2,0,20,0,0,0,1,1,0,14
no run,6,India,8,Sri Lanka,2nd innings,0,,"Dananjaya to Sharma, no run",0,574178,Akila Dananjaya,0,9,0,1.3,9,49619,Suranga Lakmal,1,12,0,2.0,5,34102,Rohit Sharma,7,13,0,1,28235,Shikhar Dhawan,6,8,1,0,3,False,0,0,0,0,0,4,8,1,False,,False,False,4.0,0,21,0,0,0,1,1,0,14
out,6,India,8,Sri Lanka,2nd innings,0,"<b>through the gate</b>! Rippaaaahh! The Dananjaya googly strikes again. Rohit was launching the offbreaks into orbit but he does not read the ball from the back of the hand. Steps forward, tentatively, to defend, thinking it is a legbreak. But it bites into the pitch, on a good length area outside off, and surges through to hit middle.","Dananjaya to Sharma, OUT",0,574178,Akila Dananjaya,0,10,1,1.4,9,49619,Suranga Lakmal,1,12,0,2.0,5,34102,Rohit Sharma,7,14,0,1,28235,Shikhar Dhawan,6,8,1,0,4,False,0,0,0,0,0,4,8,1,True,bowled,False,RG Sharma  b Dananjaya 7 (14m 14b 0x4 1x6) SR: 50.00,3.81,0,22,0,1,0,1,1,0,14
run,6,India,8,Sri Lanka,2nd innings,1,whips a tossed up delivery on his pads to deep square leg.,"Dananjaya to Iyer, 1 run",0,574178,Akila Dananjaya,0,11,1,1.5,10,49619,Suranga Lakmal,1,12,0,2.0,5,642519,Shreyas Iyer,1,1,0,0,28235,Shikhar Dhawan,6,8,1,0,5,False,0,0,0,0,0,4,8,1,False,,False,False,3.91,0,23,0,1,0,1,1,0,15
run,6,India,8,Sri Lanka,2nd innings,1,"sweeps off middle stump - lbw be damned. Then again, if he can time it as well as that, he can keep playing it and force the spinner to change his tactics","Dananjaya to Dhawan, 1 run",0,574178,Akila Dananjaya,0,12,1,2.0,11,49619,Suranga Lakmal,1,12,0,2.0,5,28235,Shikhar Dhawan,7,9,1,0,642519,Shreyas Iyer,1,1,0,0,6,True,0,0,0,0,0,4,8,1,False,,False,False,4.0,0,24,0,1,0,1,1,0,16
leg bye,6,India,8,Sri Lanka,2nd innings,1,"on the pads, hits the pads as Dhawan tries to flick through square leg","Lakmal to Dhawan, 1 leg bye",0,49619,Suranga Lakmal,1,13,0,2.1,5,574178,Akila Dananjaya,0,12,1,2.0,11,28235,Shikhar Dhawan,7,10,1,0,642519,Shreyas Iyer,1,1,0,0,1,False,0,0,0,0,1,5,1,0,False,,False,False,4.08,0,25,0,1,1,1,1,0,17
no run,6,India,8,Sri Lanka,2nd innings,0,back of a length and holding its line outside off. Iyer ignores it,"Lakmal to Iyer, no run",0,49619,Suranga Lakmal,1,14,0,2.2,5,574178,Akila Dananjaya,0,12,1,2.0,11,642519,Shreyas Iyer,1,2,0,0,28235,Shikhar Dhawan,7,10,1,0,2,False,0,0,0,0,0,5,1,0,False,,False,False,3.92,0,26,0,1,0,1,1,0,17
no run,6,India,8,Sri Lanka,2nd innings,0,"<b>so close to off stump</b>; that's a pretty tight leave. Lakmal pitches it up, the pitch offers him just enough to allow the ball to dart back in. A few more inches and this game would have broken open","Lakmal to Iyer, no run",0,49619,Suranga Lakmal,1,15,0,2.3,5,574178,Akila Dananjaya,0,12,1,2.0,11,642519,Shreyas Iyer,1,3,0,0,28235,Shikhar Dhawan,7,10,1,0,3,False,0,0,0,0,0,5,1,0,False,,False,False,3.77,0,27,0,1,0,1,1,0,17
no run,6,India,8,Sri Lanka,2nd innings,0,ignores the shortish delivery outside off,"Lakmal to Iyer, no run",0,49619,Suranga Lakmal,1,16,0,2.4,5,574178,Akila Dananjaya,0,12,1,2.0,11,642519,Shreyas Iyer,1,4,0,0,28235,Shikhar Dhawan,7,10,1,0,4,False,0,0,0,0,0,5,1,0,False,,False,False,3.64,0,28,0,1,0,1,1,0,17
no run,6,India,8,Sri Lanka,2nd innings,0,"back of a length and outside off, no shot","Lakmal to Iyer, no run",0,49619,Suranga Lakmal,1,17,0,2.5,5,574178,Akila Dananjaya,0,12,1,2.0,11,642519,Shreyas Iyer,1,5,0,0,28235,Shikhar Dhawan,7,10,1,0,5,False,0,0,0,0,0,5,1,0,False,,False,False,3.51,0,29,0,1,0,1,1,0,17
no run,6,India,8,Sri Lanka,2nd innings,0,tackles a shortish delivery on middle and sends it to midwicket,"Lakmal to Iyer, no run",0,49619,Suranga Lakmal,1,18,0,3.0,5,574178,Akila Dananjaya,0,12,1,2.0,11,642519,Shreyas Iyer,1,6,0,0,28235,Shikhar Dhawan,7,10,1,0,6,True,0,0,0,0,0,5,1,0,False,,False,False,3.4,0,30,0,1,0,1,1,0,17
four,6,India,8,Sri Lanka,2nd innings,4,"superb shot and the ball screams away through midwicket! This is a tossed up ball, landing on a perfectly good area outside off, but Dhawan has hared out of his crease to meet it at its pitch and then his wrists do the rest","Dananjaya to Dhawan, FOUR runs",0,574178,Akila Dananjaya,0,13,1,2.1,15,49619,Suranga Lakmal,1,18,0,3.0,5,28235,Shikhar Dhawan,11,11,2,0,642519,Shreyas Iyer,1,6,0,0,1,False,0,0,0,0,0,6,9,0,False,,False,False,4.06,0,31,0,1,0,1,1,0,21
no run,6,India,8,Sri Lanka,2nd innings,0,"tossed up legbreak, Dhawan reads it, presses forward with bat and pad together and blocks","Dananjaya to Dhawan, no run",0,574178,Akila Dananjaya,0,14,1,2.2,15,49619,Suranga Lakmal,1,18,0,3.0,5,28235,Shikhar Dhawan,11,12,2,0,642519,Shreyas Iyer,1,6,0,0,2,False,0,0,0,0,0,6,9,0,False,,False,False,3.93,0,32,0,1,0,1,1,0,21
no run,6,India,8,Sri Lanka,2nd innings,0,"picks the offbreak, which is angled into middle, and defends gently","Dananjaya to Dhawan, no run",0,574178,Akila Dananjaya,0,15,1,2.3,15,49619,Suranga Lakmal,1,18,0,3.0,5,28235,Shikhar Dhawan,11,13,2,0,642519,Shreyas Iyer,1,6,0,0,3,False,0,0,0,0,0,6,9,0,False,,False,False,3.81,0,33,0,1,0,1,1,0,21
no run,6,India,8,Sri Lanka,2nd innings,0,nudges the legbreak to midwicket,"Dananjaya to Dhawan, no run",0,574178,Akila Dananjaya,0,16,1,2.4,15,49619,Suranga Lakmal,1,18,0,3.0,5,28235,Shikhar Dhawan,11,14,2,0,642519,Shreyas Iyer,1,6,0,0,4,False,0,0,0,0,0,6,9,0,False,,False,False,3.7,0,34,0,1,0,1,1,0,21
wide,6,India,8,Sri Lanka,2nd innings,5,"loads up the sweep, but the ball slides too far down leg for him to connect","Dananjaya to Dhawan, 5 wides",0,574178,Akila Dananjaya,0,16,1,2.4,20,49619,Suranga Lakmal,1,18,0,3.0,5,28235,Shikhar Dhawan,11,14,2,0,642519,Shreyas Iyer,1,6,0,0,5,False,0,0,5,0,0,6,9,0,False,,False,False,4.58,0,34,0,1,0,1,1,5,26
no run,6,India,8,Sri Lanka,2nd innings,0,"flighted delivery on middle, Dhawan defends well","Dananjaya to Dhawan, no run",0,574178,Akila Dananjaya,0,17,1,2.5,20,49619,Suranga Lakmal,1,18,0,3.0,5,28235,Shikhar Dhawan,11,15,2,0,642519,Shreyas Iyer,1,6,0,0,6,False,0,0,0,0,0,6,9,0,False,,False,False,4.45,0,35,0,1,0,1,1,0,26
no run,6,India,8,Sri Lanka,2nd innings,0,leans forward to the tossed up offbreak outside off and pushes to cover,"Dananjaya to Dhawan, no run",0,574178,Akila Dananjaya,0,18,1,3.0,20,49619,Suranga Lakmal,1,18,0,3.0,5,28235,Shikhar Dhawan,11,16,2,0,642519,Shreyas Iyer,1,6,0,0,7,True,0,0,0,0,0,6,9,0,False,,False,False,4.33,0,36,0,1,0,1,1,0,26
no run,6,India,8,Sri Lanka,2nd innings,0,presents the full face to a back of a length delivery on off stump,"Lakmal to Iyer, no run",0,49619,Suranga Lakmal,1,19,0,2.7,5,574178,Akila Dananjaya,0,18,1,3.0,20,642519,Shreyas Iyer,1,7,0,0,28235,Shikhar Dhawan,11,16,2,0,1,False,0,0,0,0,0,7,2,0,False,,False,False,4.21,0,37,0,1,0,1,1,0,26
no run,6,India,8,Sri Lanka,2nd innings,0,"shortish and outside off, punches to cover","Lakmal to Iyer, no run",0,49619,Suranga Lakmal,1,20,0,2.8,5,574178,Akila Dananjaya,0,18,1,3.0,20,642519,Shreyas Iyer,1,8,0,0,28235,Shikhar Dhawan,11,16,2,0,2,False,0,0,0,0,0,7,2,0,False,,False,False,4.1,0,38,0,1,0,1,1,0,26
no run,6,India,8,Sri Lanka,2nd innings,0,"fuller delivery, swinging into him, brings out a checked flick. He's worried about closing the face against the moving ball","Lakmal to Iyer, no run",0,49619,Suranga Lakmal,1,21,0,2.9,5,574178,Akila Dananjaya,0,18,1,3.0,20,642519,Shreyas Iyer,1,9,0,0,28235,Shikhar Dhawan,11,16,2,0,3,False,0,0,0,0,0,7,2,0,False,,False,False,4.0,0,39,0,1,0,1,1,0,26
run,6,India,8,Sri Lanka,2nd innings,1,"opens the face and guides the fuller delivery, with the seam movement, to third man","Lakmal to Iyer, 1 run",0,49619,Suranga Lakmal,1,13,0,2.1,6,574178,Akila Dananjaya,0,18,1,3.0,20,642519,Shreyas Iyer,2,10,0,0,28235,Shikhar Dhawan,11,16,2,0,4,False,0,0,0,0,0,7,2,0,False,,False,False,4.05,0,40,0,1,0,1,1,0,27
