PlayType_description,Batting_Team_id,Batting_Team_name,Bowling_Team_id,Bowling_Team_name,Innings,Total_Runs_on_delivery,Commentary,Commentary_short,Score,Bowler_id,Bowler_name,Bowler_maiden,Bowler_balls,Bowler_wickets,Bowler_over,Bowler_conceded,Other_Bowler_id,Other_Bowler_name,Other_Bowler_maidens,Other_Bowler_balls,Other_Bowler_wickets,Other_Bowler_overs,Other_Bowler_conceded,Batsman_id,Batsman_name,Batsman_runs,Batsman_balls_faced,Batsman_four,Batsman_sixes,Other_Batsman_id,Other_Batsman_name,Other_Batsman_runs,Other_Batsman_balls_faced,Other_Batsman_four,Other_Batsman_sixes,Over_ball,Over_complete,Over_maiden,Over_no_Ball,Over_wide,Over_byes,Over_leg_byes,Over_number,Over_runs,Over_wickets,Dismissal_is_true,Dismissal_type,Dismissal_fielder_iskeeper,Dismissal_text,Innings_run_rate,Innings_byes,Innings_balls,Innings_no_balls,Innings_wickets,Innings_leg_byes,Innings_session,Innings_day,Innings_wides,Innings_runs
four,3,South Africa,6,India,2nd innings,4,"a bit wide and Markram leans into that. Back of a length outside off, Markram stays back and caresses his drive through cover with so much ease.","Kumar to Markram, FOUR runs",0,326016,Bhuvneshwar Kumar,0,5,0,0.5,6,False,False,0,0,0,False,0,600498,Aiden Markram,5,3,1,0,43906,Hashim Amla,1,2,0,0,5,False,0,0,0,0,0,1,6,0,False,,False,False,7.2,0,5,0,0,0,1,1,0,6
no run,3,South Africa,6,India,2nd innings,0,"good length and wide outside off, the ball swings away and Markram lets it go","Kumar to Markram, no run",0,326016,Bhuvneshwar Kumar,0,6,0,1.0,6,False,False,0,0,0,False,0,600498,Aiden Markram,5,4,1,0,43906,Hashim Amla,1,2,0,0,6,True,0,0,0,0,0,1,6,0,False,,False,False,6.0,0,6,0,0,0,1,1,0,6
run,3,South Africa,6,India,2nd innings,1,"good length outside off, Amla opens the bat face and guides one down to third man","Bumrah to Amla, 1 run",0,625383,Jasprit Bumrah,0,1,0,0.1,1,326016,Bhuvneshwar Kumar,0,6,0,1.0,6,43906,Hashim Amla,2,3,0,0,600498,Aiden Markram,5,4,1,0,1,False,0,0,0,0,0,2,6,0,False,,False,False,6.0,0,7,0,0,0,1,1,0,7
no run,3,South Africa,6,India,2nd innings,0,"good length outside off, carved to point.","Bumrah to Markram, no run",0,625383,Jasprit Bumrah,0,2,0,0.2,1,326016,Bhuvneshwar Kumar,0,6,0,1.0,6,600498,Aiden Markram,5,5,1,0,43906,Hashim Amla,2,3,0,0,2,False,0,0,0,0,0,2,6,0,False,,False,False,5.25,0,8,0,0,0,1,1,0,7
no run,3,South Africa,6,India,2nd innings,0,"back of a length outside off, Markram caresses his drive to point from the back foot","Bumrah to Markram, no run",0,625383,Jasprit Bumrah,0,3,0,0.3,1,326016,Bhuvneshwar Kumar,0,6,0,1.0,6,600498,Aiden Markram,5,6,1,0,43906,Hashim Amla,2,3,0,0,3,False,0,0,0,0,0,2,6,0,False,,False,False,4.66,0,9,0,0,0,1,1,0,7
no run,3,South Africa,6,India,2nd innings,0,"good length delivery outside off, hit away towards point","Bumrah to Markram, no run",0,625383,Jasprit Bumrah,0,4,0,0.4,1,326016,Bhuvneshwar Kumar,0,6,0,1.0,6,600498,Aiden Markram,5,7,1,0,43906,Hashim Amla,2,3,0,0,4,False,0,0,0,0,0,2,6,0,False,,False,False,4.2,0,10,0,0,0,1,1,0,7
four,3,South Africa,6,India,2nd innings,4,"a thick outside edge, but wide of slip for four. Back of a length outside off, Markram opens the bat face and taps it past the wide slip. A mixture of outside edge and outside half","Bumrah to Markram, FOUR runs",0,625383,Jasprit Bumrah,0,5,0,0.5,5,326016,Bhuvneshwar Kumar,0,6,0,1.0,6,600498,Aiden Markram,9,8,2,0,43906,Hashim Amla,2,3,0,0,5,False,0,0,0,0,0,2,6,0,False,,False,False,6.0,0,11,0,0,0,1,1,0,11
leg bye,3,South Africa,6,India,2nd innings,1,"full on leg, Markram misses out on some runs as the ball flicks the pad en route to square leg","Bumrah to Markram, 1 leg bye",0,625383,Jasprit Bumrah,0,6,0,1.0,5,326016,Bhuvneshwar Kumar,0,6,0,1.0,6,600498,Aiden Markram,9,9,2,0,43906,Hashim Amla,2,3,0,0,6,True,0,0,0,0,1,2,6,0,False,,False,False,6.0,0,12,0,0,1,1,1,0,12
run,3,South Africa,6,India,2nd innings,1,"wide outside off, Markram flays at that and caresses the ball towards extra cover. Iyer dives to his left to save three","Kumar to Markram, 1 run",0,326016,Bhuvneshwar Kumar,0,7,0,1.1,7,625383,Jasprit Bumrah,0,6,0,1.0,5,600498,Aiden Markram,10,10,2,0,43906,Hashim Amla,2,3,0,0,1,False,0,0,0,0,0,3,7,0,False,,False,False,6.0,0,13,0,0,0,1,1,0,13
run,3,South Africa,6,India,2nd innings,2,"just timing. Good length outside off, he opens the bat face and carves the ball past point for a couple. All placement","Kumar to Amla, 2 runs",0,326016,Bhuvneshwar Kumar,0,8,0,1.2,9,625383,Jasprit Bumrah,0,6,0,1.0,5,43906,Hashim Amla,4,4,0,0,600498,Aiden Markram,10,10,2,0,2,False,0,0,0,0,0,3,7,0,False,,False,False,6.42,0,14,0,0,0,1,1,0,15
no run,3,South Africa,6,India,2nd innings,0,"back of a length outside off, the ball bounces extra as Amla misses a punchy cut. Goes past the edge.","Kumar to Amla, no run",0,326016,Bhuvneshwar Kumar,0,9,0,1.3,9,625383,Jasprit Bumrah,0,6,0,1.0,5,43906,Hashim Amla,4,5,0,0,600498,Aiden Markram,10,10,2,0,3,False,0,0,0,0,0,3,7,0,False,,False,False,6.0,0,15,0,0,0,1,1,0,15
four,3,South Africa,6,India,2nd innings,4,"the edge, but wide of slip again, four again. Good length delivery outside off, the ball pitches, moves away, takes the outside edge and flies past slip. That's a good delivery, very probing. Wider than usual, but it's very good because of Amla's already pronounced shuffle","Kumar to Amla, FOUR runs",0,326016,Bhuvneshwar Kumar,0,10,0,1.4,13,625383,Jasprit Bumrah,0,6,0,1.0,5,43906,Hashim Amla,8,6,1,0,600498,Aiden Markram,10,10,2,0,4,False,0,0,0,0,0,3,7,0,False,,False,False,7.12,0,16,0,0,0,1,1,0,19
no run,3,South Africa,6,India,2nd innings,0,"and thereabouts again. Good length outside off, tapped towards point","Kumar to Amla, no run",0,326016,Bhuvneshwar Kumar,0,11,0,1.5,13,625383,Jasprit Bumrah,0,6,0,1.0,5,43906,Hashim Amla,8,7,1,0,600498,Aiden Markram,10,10,2,0,5,False,0,0,0,0,0,3,7,0,False,,False,False,6.7,0,17,0,0,0,1,1,0,19
no run,3,South Africa,6,India,2nd innings,0,"a full delivery outside off, driven to mid-off with the full face","Kumar to Amla, no run",0,326016,Bhuvneshwar Kumar,0,12,0,2.0,13,625383,Jasprit Bumrah,0,6,0,1.0,5,43906,Hashim Amla,8,8,1,0,600498,Aiden Markram,10,10,2,0,6,True,0,0,0,0,0,3,7,0,False,,False,False,6.33,0,18,0,0,0,1,1,0,19
no run,3,South Africa,6,India,2nd innings,0,"good length delivery outside off, Markram solidly behind the line to defend","Bumrah to Markram, no run",0,625383,Jasprit Bumrah,0,7,0,1.1,5,326016,Bhuvneshwar Kumar,0,12,0,2.0,13,600498,Aiden Markram,10,11,2,0,43906,Hashim Amla,8,8,1,0,1,False,0,0,0,0,0,4,3,0,False,,False,False,6.0,0,19,0,0,0,1,1,0,19
no run,3,South Africa,6,India,2nd innings,0,"around off, on a length, behind the line again to defend","Bumrah to Markram, no run",0,625383,Jasprit Bumrah,0,8,0,1.2,5,326016,Bhuvneshwar Kumar,0,12,0,2.0,13,600498,Aiden Markram,10,12,2,0,43906,Hashim Amla,8,8,1,0,2,False,0,0,0,0,0,4,3,0,False,,False,False,5.7,0,20,0,0,0,1,1,0,19
no run,3,South Africa,6,India,2nd innings,0,"overpitched outside off, Markram leans forward and drills a drive to cover. Doesn't need to bother much about swing, more seam.","Bumrah to Markram, no run",0,625383,Jasprit Bumrah,0,9,0,1.3,5,326016,Bhuvneshwar Kumar,0,12,0,2.0,13,600498,Aiden Markram,10,13,2,0,43906,Hashim Amla,8,8,1,0,3,False,0,0,0,0,0,4,3,0,False,,False,False,5.42,0,21,0,0,0,1,1,0,19
run,3,South Africa,6,India,2nd innings,3,"nicely played, around middle and leg, Markram chips the ball over mid-on. Just enough bat on a mis-timed stroke. And the ball stops itself juuust before the boundary. Three.","Bumrah to Markram, 3 runs",0,625383,Jasprit Bumrah,0,10,0,1.4,8,326016,Bhuvneshwar Kumar,0,12,0,2.0,13,600498,Aiden Markram,13,14,2,0,43906,Hashim Amla,8,8,1,0,4,False,0,0,0,0,0,4,3,0,False,,False,False,6.0,0,22,0,0,0,1,1,0,22
no run,3,South Africa,6,India,2nd innings,0,"good length delivery on a fourth-stump channel, Amla has walked right across, misses a flick.","Bumrah to Amla, no run",0,625383,Jasprit Bumrah,0,11,0,1.5,8,326016,Bhuvneshwar Kumar,0,12,0,2.0,13,43906,Hashim Amla,8,9,1,0,600498,Aiden Markram,13,14,2,0,5,False,0,0,0,0,0,4,3,0,False,,False,False,5.73,0,23,0,0,0,1,1,0,22
no run,3,South Africa,6,India,2nd innings,0,defended watchfully under his eyes,"Bumrah to Amla, no run",0,625383,Jasprit Bumrah,0,12,0,2.0,8,326016,Bhuvneshwar Kumar,0,12,0,2.0,13,43906,Hashim Amla,8,10,1,0,600498,Aiden Markram,13,14,2,0,6,True,0,0,0,0,0,4,3,0,False,,False,False,5.5,0,24,0,0,0,1,1,0,22
four,3,South Africa,6,India,2nd innings,4,"well bowled, on a length outside off, a thick outside edge beats the diving slip fielder. The third man is up, so another edge results in another boundary. Feels like India are under real pressure for the first time this series","Kumar to Markram, FOUR runs",0,326016,Bhuvneshwar Kumar,0,13,0,2.1,17,625383,Jasprit Bumrah,0,12,0,2.0,8,600498,Aiden Markram,17,15,3,0,43906,Hashim Amla,8,10,1,0,1,False,0,0,0,0,0,5,9,0,False,,False,False,6.24,0,25,0,0,0,1,1,0,26
run,3,South Africa,6,India,2nd innings,1,"short and wide this time, Markram slaps a cut to the sweeper cover, 137 kph","Kumar to Markram, 1 run",0,326016,Bhuvneshwar Kumar,0,14,0,2.2,18,625383,Jasprit Bumrah,0,12,0,2.0,8,600498,Aiden Markram,18,16,3,0,43906,Hashim Amla,8,10,1,0,2,False,0,0,0,0,0,5,9,0,False,,False,False,6.23,0,26,0,0,0,1,1,0,27
run,3,South Africa,6,India,2nd innings,1,a manufactured run. Gets right across and flicks an off-stump ball towards fine leg for one,"Kumar to Amla, 1 run",0,326016,Bhuvneshwar Kumar,0,15,0,2.3,19,625383,Jasprit Bumrah,0,12,0,2.0,8,43906,Hashim Amla,9,11,1,0,600498,Aiden Markram,18,16,3,0,3,False,0,0,0,0,0,5,9,0,False,,False,False,6.22,0,27,0,0,0,1,1,0,28
run,3,South Africa,6,India,2nd innings,1,"good single, full outside off, hit to mid-off, and Markram calls Amla through even with Kohli on the ball. Quality single","Kumar to Markram, 1 run",0,326016,Bhuvneshwar Kumar,0,16,0,2.4,20,625383,Jasprit Bumrah,0,12,0,2.0,8,600498,Aiden Markram,19,17,3,0,43906,Hashim Amla,9,11,1,0,4,False,0,0,0,0,0,5,9,0,False,,False,False,6.21,0,28,0,0,0,1,1,0,29
run,3,South Africa,6,India,2nd innings,1,"full delivery outside off, Amla slices that towards point. Didn't expect that line. Well bowled","Kumar to Amla, 1 run",0,326016,Bhuvneshwar Kumar,0,17,0,2.5,21,625383,Jasprit Bumrah,0,12,0,2.0,8,43906,Hashim Amla,10,12,1,0,600498,Aiden Markram,19,17,3,0,5,False,0,0,0,0,0,5,9,0,False,,False,False,6.2,0,29,0,0,0,1,1,0,30
run,3,South Africa,6,India,2nd innings,1,"another good single, short and wide outside off, chopped away to point. Pandya is on the circle so the single is easily made","Kumar to Markram, 1 run",0,326016,Bhuvneshwar Kumar,0,18,0,3.0,22,625383,Jasprit Bumrah,0,12,0,2.0,8,600498,Aiden Markram,20,18,3,0,43906,Hashim Amla,10,12,1,0,6,True,0,0,0,0,0,5,9,0,False,,False,False,6.2,0,30,0,0,0,1,1,0,31
run,3,South Africa,6,India,2nd innings,1,"good length outside off, a thick inside edge into the back thigh as Markram looks to drive","Bumrah to Markram, 1 run",0,625383,Jasprit Bumrah,0,13,0,2.1,9,326016,Bhuvneshwar Kumar,0,18,0,3.0,22,600498,Aiden Markram,21,19,3,0,43906,Hashim Amla,10,12,1,0,1,False,0,0,0,0,0,6,6,0,False,,False,False,6.19,0,31,0,0,0,1,1,0,32
four,3,South Africa,6,India,2nd innings,4,"uhuhuh, that's awesome. Back of a length outside off, Amla stands tall and punches the ball through cover point. He has placed that by opening the bat face depending on the gap he wanted to find","Bumrah to Amla, FOUR runs",0,625383,Jasprit Bumrah,0,14,0,2.2,13,326016,Bhuvneshwar Kumar,0,18,0,3.0,22,43906,Hashim Amla,14,13,2,0,600498,Aiden Markram,21,19,3,0,2,False,0,0,0,0,0,6,6,0,False,,False,False,6.75,0,32,0,0,0,1,1,0,36
no run,3,South Africa,6,India,2nd innings,0,"full delivery outside off, seam movement, defended back","Bumrah to Amla, no run",0,625383,Jasprit Bumrah,0,15,0,2.3,13,326016,Bhuvneshwar Kumar,0,18,0,3.0,22,43906,Hashim Amla,14,14,2,0,600498,Aiden Markram,21,19,3,0,3,False,0,0,0,0,0,6,6,0,False,,False,False,6.54,0,33,0,0,0,1,1,0,36
no run,3,South Africa,6,India,2nd innings,0,"good lines from Bumrah, in a channel just outside off, defended into the mid-off region","Bumrah to Amla, no run",0,625383,Jasprit Bumrah,0,16,0,2.4,13,326016,Bhuvneshwar Kumar,0,18,0,3.0,22,43906,Hashim Amla,14,15,2,0,600498,Aiden Markram,21,19,3,0,4,False,0,0,0,0,0,6,6,0,False,,False,False,6.35,0,34,0,0,0,1,1,0,36
no run,3,South Africa,6,India,2nd innings,0,"closer to off this time, 141 kph, Amla is behind the line as he blocks","Bumrah to Amla, no run",0,625383,Jasprit Bumrah,0,17,0,2.5,13,326016,Bhuvneshwar Kumar,0,18,0,3.0,22,43906,Hashim Amla,14,16,2,0,600498,Aiden Markram,21,19,3,0,5,False,0,0,0,0,0,6,6,0,False,,False,False,6.17,0,35,0,0,0,1,1,0,36
run,3,South Africa,6,India,2nd innings,1,"a thick inside edge down to fine leg for a single. Keeping it in that channel, a lovely over","Bumrah to Amla, 1 run",0,625383,Jasprit Bumrah,0,18,0,3.0,14,326016,Bhuvneshwar Kumar,0,18,0,3.0,22,43906,Hashim Amla,15,17,2,0,600498,Aiden Markram,21,19,3,0,6,True,0,0,0,0,0,6,6,0,False,,False,False,6.16,0,36,0,0,0,1,1,0,37
leg bye,3,South Africa,6,India,2nd innings,1,"good length around off, some lateral movement, the ball ducks back in, beats Amla on the inside edge and hits him on the back pad. One leg bye","Kumar to Amla, 1 leg bye",0,326016,Bhuvneshwar Kumar,0,19,0,3.1,22,625383,Jasprit Bumrah,0,18,0,3.0,14,43906,Hashim Amla,15,18,2,0,600498,Aiden Markram,21,19,3,0,1,False,0,0,0,0,1,7,6,0,False,,False,False,6.16,0,37,0,0,1,1,1,0,38
no run,3,South Africa,6,India,2nd innings,0,"full delivery outside off, the ball seams back in, takes the inside half towards midwicket","Kumar to Markram, no run",0,326016,Bhuvneshwar Kumar,0,20,0,3.2,22,625383,Jasprit Bumrah,0,18,0,3.0,14,600498,Aiden Markram,21,20,3,0,43906,Hashim Amla,15,18,2,0,2,False,0,0,0,0,0,7,6,0,False,,False,False,6.0,0,38,0,0,0,1,1,0,38
run,3,South Africa,6,India,2nd innings,1,"full delivery outside off, seemed like he misread the length of that, wanted to pull but the ball wasn't short, so he cut to the sweeper cover","Kumar to Markram, 1 run",0,326016,Bhuvneshwar Kumar,0,21,0,3.3,23,625383,Jasprit Bumrah,0,18,0,3.0,14,600498,Aiden Markram,22,21,3,0,43906,Hashim Amla,15,18,2,0,3,False,0,0,0,0,0,7,6,0,False,,False,False,6.0,0,39,0,0,0,1,1,0,39
no run,3,South Africa,6,India,2nd innings,0,"good length outside off, some extra bounce again, off the shoulder to point.","Kumar to Amla, no run",0,326016,Bhuvneshwar Kumar,0,22,0,3.4,23,625383,Jasprit Bumrah,0,18,0,3.0,14,43906,Hashim Amla,15,19,2,0,600498,Aiden Markram,22,21,3,0,4,False,0,0,0,0,0,7,6,0,False,,False,False,5.85,0,40,0,0,0,1,1,0,39
no run,3,South Africa,6,India,2nd innings,0,"excellently bowled, the one that is full and is looking to beat the inside edge and hit Amla on the front pad, but his bat is in line to defend","Kumar to Amla, no run",0,326016,Bhuvneshwar Kumar,0,23,0,3.5,23,625383,Jasprit Bumrah,0,18,0,3.0,14,43906,Hashim Amla,15,20,2,0,600498,Aiden Markram,22,21,3,0,5,False,0,0,0,0,0,7,6,0,False,,False,False,5.7,0,41,0,0,0,1,1,0,39
four,3,South Africa,6,India,2nd innings,4,"shortish and wide outside off, hit past point for four, just placed again. Waits for the ball, and then open the bat face accordingly. Sublime batting","Kumar to Amla, FOUR runs",0,326016,Bhuvneshwar Kumar,0,24,0,4.0,27,625383,Jasprit Bumrah,0,18,0,3.0,14,43906,Hashim Amla,19,21,3,0,600498,Aiden Markram,22,21,3,0,6,True,0,0,0,0,0,7,6,0,False,,False,False,6.14,0,42,0,0,0,1,1,0,43
no run,3,South Africa,6,India,2nd innings,0,"full delivery outside off, the ball moves back in, hit back to the bowler","Bumrah to Markram, no run",0,625383,Jasprit Bumrah,0,19,0,3.1,14,326016,Bhuvneshwar Kumar,0,24,0,4.0,27,600498,Aiden Markram,22,22,3,0,43906,Hashim Amla,19,21,3,0,1,False,0,0,0,0,0,8,1,1,False,,False,False,6.0,0,43,0,0,0,1,1,0,43
out,3,South Africa,6,India,2nd innings,0,"given by the umpire. Has a chat with Amla does Markram. And Amla calls for the review for his partner. What happened there? Looked like he misread the length again, looking to pull, but the ball is much fuller than he anticipated. In the end, all he can do is attempt a hopeless swat across the line. Hits Markram on the back leg, plumb in front of off. <strong>Three reds on HawkEye</strong>, SA lose their review.","Bumrah to Markram, OUT",0,625383,Jasprit Bumrah,0,20,1,3.2,14,326016,Bhuvneshwar Kumar,0,24,0,4.0,27,600498,Aiden Markram,22,23,3,0,43906,Hashim Amla,19,21,3,0,2,False,0,0,0,0,0,8,1,1,True,leg before wicket,False,AK Markram lbw b Bumrah 22 (30m 23b 3x4 0x6) SR: 95.65,5.86,0,44,0,1,0,1,1,0,43
run,3,South Africa,6,India,2nd innings,1,"<b>fumble</b> at cover, with the ball coming straight at him, allows Duminy to get off the mark straight away","Bumrah to Duminy, 1 run",0,625383,Jasprit Bumrah,0,21,1,3.3,15,326016,Bhuvneshwar Kumar,0,24,0,4.0,27,44932,Jean-Paul Duminy,1,1,0,0,43906,Hashim Amla,19,21,3,0,3,False,0,0,0,0,0,8,1,1,False,,False,False,5.86,0,45,0,1,0,1,1,0,44
no run,3,South Africa,6,India,2nd innings,0,"<b>huge appeal for caught behind</b> as the good length indipper cuts through Amla, but it's beaten the inside edge and clips the back pad through to Dhoni. The batsman was rather late in playing a shot there","Bumrah to Amla, no run",0,625383,Jasprit Bumrah,0,22,1,3.4,15,326016,Bhuvneshwar Kumar,0,24,0,4.0,27,43906,Hashim Amla,19,22,3,0,44932,Jean-Paul Duminy,1,1,0,0,4,False,0,0,0,0,0,8,1,1,False,,False,False,5.73,0,46,0,1,0,1,1,0,44
no run,3,South Africa,6,India,2nd innings,0,"shuffles across to perhaps counter Bumrah's steep angle into him, but a bit of extra bounce has the ball striking Amla's body","Bumrah to Amla, no run",0,625383,Jasprit Bumrah,0,23,1,3.5,15,326016,Bhuvneshwar Kumar,0,24,0,4.0,27,43906,Hashim Amla,19,23,3,0,44932,Jean-Paul Duminy,1,1,0,0,5,False,0,0,0,0,0,8,1,1,False,,False,False,5.61,0,47,0,1,0,1,1,0,44
no run,3,South Africa,6,India,2nd innings,0,"tries to tap it into the covers for a quick single, but Duminy knows the infield there is a bit too packed","Bumrah to Amla, no run",0,625383,Jasprit Bumrah,0,24,1,4.0,15,326016,Bhuvneshwar Kumar,0,24,0,4.0,27,43906,Hashim Amla,19,24,3,0,44932,Jean-Paul Duminy,1,1,0,0,6,True,0,0,0,0,0,8,1,1,False,,False,False,5.5,0,48,0,1,0,1,1,0,44
no run,3,South Africa,6,India,2nd innings,0,loops it up outside off at 78 kph and Duminy hits it to cover,"Kuldeep Yadav to Duminy, no run",0,559235,Kuldeep Yadav,0,1,0,0.1,0,625383,Jasprit Bumrah,0,24,1,4.0,15,44932,Jean-Paul Duminy,1,2,0,0,43906,Hashim Amla,19,24,3,0,1,False,0,0,0,0,0,9,3,0,False,,False,False,5.38,0,49,0,1,0,1,1,0,44
run,3,South Africa,6,India,2nd innings,1,"75kph, lunges, trying desperately to get to the pitch of a tossed up legbreak outside off, and drives through cover","Kuldeep Yadav to Duminy, 1 run",0,559235,Kuldeep Yadav,0,2,0,0.2,1,625383,Jasprit Bumrah,0,24,1,4.0,15,44932,Jean-Paul Duminy,2,3,0,0,43906,Hashim Amla,19,24,3,0,2,False,0,0,0,0,0,9,3,0,False,,False,False,5.4,0,50,0,1,0,1,1,0,45
run,3,South Africa,6,India,2nd innings,2,shifts deep in his crease to consign a terrible delivery - flat and way down leg - to long leg,"Kuldeep Yadav to Amla, 2 runs",0,559235,Kuldeep Yadav,0,3,0,0.3,3,625383,Jasprit Bumrah,0,24,1,4.0,15,43906,Hashim Amla,21,25,3,0,44932,Jean-Paul Duminy,2,3,0,0,3,False,0,0,0,0,0,9,3,0,False,,False,False,5.52,0,51,0,1,0,1,1,0,47
no run,3,South Africa,6,India,2nd innings,0,"steps out of his crease, but Kuldeep manages to get the ball to dip on Amla and forces him to block. Even then the turn beats the inside edge and strikes his pad","Kuldeep Yadav to Amla, no run",0,559235,Kuldeep Yadav,0,4,0,0.4,3,625383,Jasprit Bumrah,0,24,1,4.0,15,43906,Hashim Amla,21,26,3,0,44932,Jean-Paul Duminy,2,3,0,0,4,False,0,0,0,0,0,9,3,0,False,,False,False,5.42,0,52,0,1,0,1,1,0,47
no run,3,South Africa,6,India,2nd innings,0,goes back - reading the length to be shortish - and therefore is able to adjust to the googly off the pitch,"Kuldeep Yadav to Amla, no run",0,559235,Kuldeep Yadav,0,5,0,0.5,3,625383,Jasprit Bumrah,0,24,1,4.0,15,43906,Hashim Amla,21,27,3,0,44932,Jean-Paul Duminy,2,3,0,0,5,False,0,0,0,0,0,9,3,0,False,,False,False,5.32,0,53,0,1,0,1,1,0,47
no run,3,South Africa,6,India,2nd innings,0,strides forward to block a flighted delivery outside off,"Kuldeep Yadav to Amla, no run",0,559235,Kuldeep Yadav,0,6,0,1.0,3,625383,Jasprit Bumrah,0,24,1,4.0,15,43906,Hashim Amla,21,28,3,0,44932,Jean-Paul Duminy,2,3,0,0,6,True,0,0,0,0,0,9,3,0,False,,False,False,5.22,0,54,0,1,0,1,1,0,47
wide,3,South Africa,6,India,2nd innings,1,bangs it into the middle of the deck and it soars harmlessly to the keeper.,"Pandya to Duminy, 1 wide",0,625371,Hardik Pandya,0,0,0,0.0,1,559235,Kuldeep Yadav,0,6,0,1.0,3,44932,Jean-Paul Duminy,2,3,0,0,43906,Hashim Amla,21,28,3,0,1,False,0,0,1,0,0,10,6,0,False,,False,False,5.33,0,54,0,1,0,1,1,1,48
run,3,South Africa,6,India,2nd innings,1,"lovely shot, getting up high with the short ball on middle stump and deftly slanting it away to deep third man","Pandya to Duminy, 1 run",0,625371,Hardik Pandya,0,1,0,0.1,2,559235,Kuldeep Yadav,0,6,0,1.0,3,44932,Jean-Paul Duminy,3,4,0,0,43906,Hashim Amla,21,28,3,0,2,False,0,0,0,0,0,10,6,0,False,,False,False,5.34,0,55,0,1,0,1,1,0,49
run,3,South Africa,6,India,2nd innings,1,runs the back of a length delivery to the left of point for a quick single. <b>That brings up South Africa's 50</b>. Only 152 more needed.,"Pandya to Amla, 1 run",0,625371,Hardik Pandya,0,2,0,0.2,3,559235,Kuldeep Yadav,0,6,0,1.0,3,43906,Hashim Amla,22,29,3,0,44932,Jean-Paul Duminy,3,4,0,0,3,False,0,0,0,0,0,10,6,0,False,,False,False,5.35,0,56,0,1,0,1,1,0,50
no run,3,South Africa,6,India,2nd innings,0,"good length ball on off stump at 138 kph, Duminy defends","Pandya to Duminy, no run",0,625371,Hardik Pandya,0,3,0,0.3,3,559235,Kuldeep Yadav,0,6,0,1.0,3,44932,Jean-Paul Duminy,3,5,0,0,43906,Hashim Amla,22,29,3,0,4,False,0,0,0,0,0,10,6,0,False,,False,False,5.26,0,57,0,1,0,1,1,0,50
run,3,South Africa,6,India,2nd innings,1,"141kph, lets the short one come on and steers it to deep third man","Pandya to Duminy, 1 run",0,625371,Hardik Pandya,0,4,0,0.4,4,559235,Kuldeep Yadav,0,6,0,1.0,3,44932,Jean-Paul Duminy,4,6,0,0,43906,Hashim Amla,22,29,3,0,5,False,0,0,0,0,0,10,6,0,False,,False,False,5.27,0,58,0,1,0,1,1,0,51
run,3,South Africa,6,India,2nd innings,2,"spears it through the covers, angling the face of the bat to to beat Iyer placed close in","Pandya to Amla, 2 runs",0,625371,Hardik Pandya,0,5,0,0.5,6,559235,Kuldeep Yadav,0,6,0,1.0,3,43906,Hashim Amla,24,30,3,0,44932,Jean-Paul Duminy,4,6,0,0,6,False,0,0,0,0,0,10,6,0,False,,False,False,5.38,0,59,0,1,0,1,1,0,53
no run,3,South Africa,6,India,2nd innings,0,leaps back and across outside off - as he did at this venue in the Test match - and is beaten on the cut by extra pace and bounce from Pandya,"Pandya to Amla, no run",0,625371,Hardik Pandya,0,6,0,1.0,6,559235,Kuldeep Yadav,0,6,0,1.0,3,43906,Hashim Amla,24,31,3,0,44932,Jean-Paul Duminy,4,6,0,0,7,True,0,0,0,0,0,10,6,0,False,,False,False,5.3,0,60,0,1,0,1,1,0,53
run,3,South Africa,6,India,2nd innings,1,"lobs it up there for the drive and Duminy obliges, hitting to long-off","Kuldeep Yadav to Duminy, 1 run",0,559235,Kuldeep Yadav,0,7,0,1.1,4,625371,Hardik Pandya,0,6,0,1.0,6,44932,Jean-Paul Duminy,5,7,0,0,43906,Hashim Amla,24,31,3,0,1,False,0,0,0,0,0,11,4,0,False,,False,False,5.31,0,61,0,1,0,1,1,0,54
run,3,South Africa,6,India,2nd innings,1,"loads of turn as he tosses it up on off stump. Amla presses forward, trying to get to the pitch of it, but isn't successful and so settles for a single off the inside edge to square leg","Kuldeep Yadav to Amla, 1 run",0,559235,Kuldeep Yadav,0,8,0,1.2,5,625371,Hardik Pandya,0,6,0,1.0,6,43906,Hashim Amla,25,32,3,0,44932,Jean-Paul Duminy,5,7,0,0,2,False,0,0,0,0,0,11,4,0,False,,False,False,5.32,0,62,0,1,0,1,1,0,55
no run,3,South Africa,6,India,2nd innings,0,"quicker through the air, which makes Duminy want to play back. But the length is still full and if not for that straight bat coming down in time, he might have been lbw","Kuldeep Yadav to Duminy, no run",0,559235,Kuldeep Yadav,0,9,0,1.3,5,625371,Hardik Pandya,0,6,0,1.0,6,44932,Jean-Paul Duminy,5,8,0,0,43906,Hashim Amla,25,32,3,0,3,False,0,0,0,0,0,11,4,0,False,,False,False,5.23,0,63,0,1,0,1,1,0,55
no run,3,South Africa,6,India,2nd innings,0,"gets down the track, but Kuldeep pulls his length back and lines the ball on leg stump, cramping Duminy","Kuldeep Yadav to Duminy, no run",0,559235,Kuldeep Yadav,0,10,0,1.4,5,625371,Hardik Pandya,0,6,0,1.0,6,44932,Jean-Paul Duminy,5,9,0,0,43906,Hashim Amla,25,32,3,0,4,False,0,0,0,0,0,11,4,0,False,,False,False,5.15,0,64,0,1,0,1,1,0,55
run,3,South Africa,6,India,2nd innings,1,nudges it off his legs to backwards square leg,"Kuldeep Yadav to Duminy, 1 run",0,559235,Kuldeep Yadav,0,11,0,1.5,6,625371,Hardik Pandya,0,6,0,1.0,6,44932,Jean-Paul Duminy,6,10,0,0,43906,Hashim Amla,25,32,3,0,5,False,0,0,0,0,0,11,4,0,False,,False,False,5.16,0,65,0,1,0,1,1,0,56
run,3,South Africa,6,India,2nd innings,1,"79kph, hangs back to a good length ball outside off and slaps it to long-off","Kuldeep Yadav to Amla, 1 run",0,559235,Kuldeep Yadav,0,12,0,2.0,7,625371,Hardik Pandya,0,6,0,1.0,6,43906,Hashim Amla,26,33,3,0,44932,Jean-Paul Duminy,6,10,0,0,6,True,0,0,0,0,0,11,4,0,False,,False,False,5.18,0,66,0,1,0,1,1,0,57
no run,3,South Africa,6,India,2nd innings,0,<b>past the edge</b> as Amla attempts a cut and is surprised by a lot of extra bounce,"Pandya to Amla, no run",0,625371,Hardik Pandya,0,7,0,1.1,6,559235,Kuldeep Yadav,0,12,0,2.0,7,43906,Hashim Amla,26,34,3,0,44932,Jean-Paul Duminy,6,10,0,0,1,False,0,0,0,0,0,12,8,0,False,,False,False,5.1,0,67,0,1,0,1,1,0,57
run,3,South Africa,6,India,2nd innings,1,"<b>inside edge</b> as Amla is rooted to the crease, attempting to punch a 143 kph delivery, shortish in length, through cover. There is however not enough room for that","Pandya to Amla, 1 run",0,625371,Hardik Pandya,0,8,0,1.2,7,559235,Kuldeep Yadav,0,12,0,2.0,7,43906,Hashim Amla,27,35,3,0,44932,Jean-Paul Duminy,6,10,0,0,2,False,0,0,0,0,0,12,8,0,False,,False,False,5.11,0,68,0,1,0,1,1,0,58
