PlayType_description,Batting_Team_id,Batting_Team_name,Bowling_Team_id,Bowling_Team_name,Innings,Total_Runs_on_delivery,Commentary,Commentary_short,Score,Bowler_id,Bowler_name,Bowler_maiden,Bowler_balls,Bowler_wickets,Bowler_over,Bowler_conceded,Other_Bowler_id,Other_Bowler_name,Other_Bowler_maidens,Other_Bowler_balls,Other_Bowler_wickets,Other_Bowler_overs,Other_Bowler_conceded,Batsman_id,Batsman_name,Batsman_runs,Batsman_balls_faced,Batsman_four,Batsman_sixes,Other_Batsman_id,Other_Batsman_name,Other_Batsman_runs,Other_Batsman_balls_faced,Other_Batsman_four,Other_Batsman_sixes,Over_ball,Over_complete,Over_maiden,Over_no_Ball,Over_wide,Over_byes,Over_leg_byes,Over_number,Over_runs,Over_wickets,Dismissal_is_true,Dismissal_type,Dismissal_fielder_iskeeper,Dismissal_text,Innings_run_rate,Innings_byes,Innings_balls,Innings_no_balls,Innings_wickets,Innings_leg_byes,Innings_session,Innings_day,Innings_wides,Innings_runs
run,3,South Africa,8,Sri Lanka,1st innings,1,"full outside leg stump, and Hendricks shovels a check-drive down to long on. He'll keep strike","Jayasuriya to Hendricks, 1 run",120/2,422871,Prabath Jayasuriya,0,12,0,2.0,14,233514,Thisara Perera,0,24,1,4.0,13,269280,Reeza Hendricks,45,46,3,1,44828,Faf du Plessis,5,7,0,0,6,True,0,0,0,0,0,20,9,0,False,,False,False,6.0,0,120,0,2,0,1,1,0,120
run,3,South Africa,8,Sri Lanka,1st innings,2,"full on off, and once again a slower-than-usual delivery from Thisara. Flicked to deep midwicket for two","NLTC Perera to Hendricks, 2 runs",122/2,233514,Thisara Perera,0,25,1,4.1,15,422871,Prabath Jayasuriya,0,12,0,2.0,14,269280,Reeza Hendricks,47,47,3,1,44828,Faf du Plessis,5,7,0,0,1,False,0,0,0,0,0,21,8,0,False,,False,False,6.04,0,121,0,2,0,1,1,0,122
run,3,South Africa,8,Sri Lanka,1st innings,2,<b>almost played on!</b> Full on off and Hendricks' atttempted front-foot defense takes a inside edge and runs down to third man,"NLTC Perera to Hendricks, 2 runs",124/2,233514,Thisara Perera,0,26,1,4.2,17,422871,Prabath Jayasuriya,0,12,0,2.0,14,269280,Reeza Hendricks,49,48,3,1,44828,Faf du Plessis,5,7,0,0,2,False,0,0,0,0,0,21,8,0,False,,False,False,6.09,0,122,0,2,0,1,1,0,124
run,3,South Africa,8,Sri Lanka,1st innings,1,"full outside off, and <b>that's a fifty on ODI debut!</b> Comfortably tapped to cover as he raises his bat to the dressing room. David Miller gives him a standing ovation","NLTC Perera to Hendricks, 1 run",125/2,233514,Thisara Perera,0,27,1,4.3,18,422871,Prabath Jayasuriya,0,12,0,2.0,14,269280,Reeza Hendricks,50,49,3,1,44828,Faf du Plessis,5,7,0,0,3,False,0,0,0,0,0,21,8,0,False,,False,False,6.09,0,123,0,2,0,1,1,0,125
run,3,South Africa,8,Sri Lanka,1st innings,2,"back of a length outside off, and Faf comes down the ground. He's in an awkward position, as his attempted push to cover goes to the leg side instead","NLTC Perera to du Plessis, 2 runs",127/2,233514,Thisara Perera,0,28,1,4.4,20,422871,Prabath Jayasuriya,0,12,0,2.0,14,44828,Faf du Plessis,7,8,0,0,269280,Reeza Hendricks,50,49,3,1,4,False,0,0,0,0,0,21,8,0,False,,False,False,6.14,0,124,0,2,0,1,1,0,127
no run,3,South Africa,8,Sri Lanka,1st innings,0,"back of a length outside off, and guided off the back foot to point","NLTC Perera to du Plessis, no run",127/2,233514,Thisara Perera,0,29,1,4.5,20,422871,Prabath Jayasuriya,0,12,0,2.0,14,44828,Faf du Plessis,7,9,0,0,269280,Reeza Hendricks,50,49,3,1,5,False,0,0,0,0,0,21,8,0,False,,False,False,6.09,0,125,0,2,0,1,1,0,127
run,3,South Africa,8,Sri Lanka,1st innings,1,"back of a length on middle. But with the lack of pace, all Faf can do is whip it off his hips to fine leg","NLTC Perera to du Plessis, 1 run",128/2,233514,Thisara Perera,0,30,1,5.0,21,422871,Prabath Jayasuriya,0,12,0,2.0,14,44828,Faf du Plessis,8,10,0,0,269280,Reeza Hendricks,50,49,3,1,6,True,0,0,0,0,0,21,8,0,False,,False,False,6.09,0,126,0,2,0,1,1,0,128
run,3,South Africa,8,Sri Lanka,1st innings,1,"ful on off, and Faf looked like he was winding up for a big shot. But adjusts late, and drives down to long off instead","Jayasuriya to du Plessis, 1 run",129/2,422871,Prabath Jayasuriya,0,13,0,2.1,15,233514,Thisara Perera,0,30,1,5.0,21,44828,Faf du Plessis,9,11,0,0,269280,Reeza Hendricks,50,49,3,1,1,False,0,0,0,0,0,22,6,0,False,,False,False,6.09,0,127,0,2,0,1,1,0,129
run,3,South Africa,8,Sri Lanka,1st innings,2,"full outside off, and Hendricks is in no position to cut. But he goes for the shot anyway, and manages to squirt a top-edged cut past point for a couple","Jayasuriya to Hendricks, 2 runs",131/2,422871,Prabath Jayasuriya,0,14,0,2.2,17,233514,Thisara Perera,0,30,1,5.0,21,269280,Reeza Hendricks,52,50,3,1,44828,Faf du Plessis,9,11,0,0,2,False,0,0,0,0,0,22,6,0,False,,False,False,6.14,0,128,0,2,0,1,1,0,131
run,3,South Africa,8,Sri Lanka,1st innings,1,"full on leg stump, and Hendricks uses the angled bat to push towards cover","Jayasuriya to Hendricks, 1 run",132/2,422871,Prabath Jayasuriya,0,15,0,2.3,18,233514,Thisara Perera,0,30,1,5.0,21,269280,Reeza Hendricks,53,51,3,1,44828,Faf du Plessis,9,11,0,0,3,False,0,0,0,0,0,22,6,0,False,,False,False,6.13,0,129,0,2,0,1,1,0,132
run,3,South Africa,8,Sri Lanka,1st innings,1,"good length outside off, and punched to cover. Stopped by the diving fielder, but he can't stop the single","Jayasuriya to du Plessis, 1 run",133/2,422871,Prabath Jayasuriya,0,16,0,2.4,19,233514,Thisara Perera,0,30,1,5.0,21,44828,Faf du Plessis,10,12,0,0,269280,Reeza Hendricks,53,51,3,1,4,False,0,0,0,0,0,22,6,0,False,,False,False,6.13,0,130,0,2,0,1,1,0,133
no run,3,South Africa,8,Sri Lanka,1st innings,0,"full on off, and the attempted defensive shot towards cover goes to the leg side instead","Jayasuriya to Hendricks, no run",133/2,422871,Prabath Jayasuriya,0,17,0,2.5,19,233514,Thisara Perera,0,30,1,5.0,21,269280,Reeza Hendricks,53,52,3,1,44828,Faf du Plessis,10,12,0,0,5,False,0,0,0,0,0,22,6,0,False,,False,False,6.09,0,131,0,2,0,1,1,0,133
run,3,South Africa,8,Sri Lanka,1st innings,1,"full on leg stump, and defended past the bowler's left to long off. Enough time to walk across for one","Jayasuriya to Hendricks, 1 run",134/2,422871,Prabath Jayasuriya,0,18,0,3.0,20,233514,Thisara Perera,0,30,1,5.0,21,269280,Reeza Hendricks,54,53,3,1,44828,Faf du Plessis,10,12,0,0,6,True,0,0,0,0,0,22,6,0,False,,False,False,6.09,0,132,0,2,0,1,1,0,134
run,3,South Africa,8,Sri Lanka,1st innings,2,"back of a length outside off, and cut away hard in front of square! Work for the man in the deep, but Kusal Perera manages to dive and stop the ball from going for four","NLTC Perera to Hendricks, 2 runs",136/2,233514,Thisara Perera,0,31,1,5.1,23,422871,Prabath Jayasuriya,0,18,0,3.0,20,269280,Reeza Hendricks,56,54,3,1,44828,Faf du Plessis,10,12,0,0,1,False,0,0,0,0,0,23,5,1,False,,False,False,6.13,0,133,0,2,0,1,1,0,136
run,3,South Africa,8,Sri Lanka,1st innings,1,"back of a length outside off, and he runs this down to third man for a single","NLTC Perera to Hendricks, 1 run",137/2,233514,Thisara Perera,0,32,1,5.2,24,422871,Prabath Jayasuriya,0,18,0,3.0,20,269280,Reeza Hendricks,57,55,3,1,44828,Faf du Plessis,10,12,0,0,2,False,0,0,0,0,0,23,5,1,False,,False,False,6.13,0,134,0,2,0,1,1,0,137
no run,3,South Africa,8,Sri Lanka,1st innings,0,"short on off, and Faf sways away from the line of the delivery","NLTC Perera to du Plessis, no run",137/2,233514,Thisara Perera,0,33,1,5.3,24,422871,Prabath Jayasuriya,0,18,0,3.0,20,44828,Faf du Plessis,10,13,0,0,269280,Reeza Hendricks,57,55,3,1,3,False,0,0,0,0,0,23,5,1,False,,False,False,6.08,0,135,0,2,0,1,1,0,137
out,3,South Africa,8,Sri Lanka,1st innings,0,"<b>holes out!</b> Back of a length on off, and too short for Faf to attempt to whip off his pads. But he does so anyway, and it comes off the bat's inside half. In the air for a while, and Lakmal at deep midwicket makes no mistake","NLTC Perera to du Plessis, OUT",137/3,233514,Thisara Perera,0,34,2,5.4,24,422871,Prabath Jayasuriya,0,18,0,3.0,20,44828,Faf du Plessis,10,14,0,0,269280,Reeza Hendricks,57,55,3,1,4,False,0,0,0,0,0,23,5,1,True,caught,False,F du Plessis c Lakmal b NLTC Perera 10 (14b 0x4 0x6) SR: 71.42,6.04,0,136,0,3,0,1,1,0,137
no run,3,South Africa,8,Sri Lanka,1st innings,0,"short ball, and Hendricks' attempted pull doesn't come off! Flies over the bat as keeper and bowler appeal in unison for caught behind. The umpire smiles it off","NLTC Perera to Hendricks, no run",137/3,233514,Thisara Perera,0,35,2,5.5,24,422871,Prabath Jayasuriya,0,18,0,3.0,20,269280,Reeza Hendricks,57,56,3,1,44932,Jean-Paul Duminy,0,0,0,0,5,False,0,0,0,0,0,23,5,1,False,,False,False,6.0,0,137,0,3,0,1,1,0,137
run,3,South Africa,8,Sri Lanka,1st innings,2,"back of a length on off, and clipped off his hips to deep midwicket. A couple more","NLTC Perera to Hendricks, 2 runs",139/3,233514,Thisara Perera,0,36,2,6.0,26,422871,Prabath Jayasuriya,0,18,0,3.0,20,269280,Reeza Hendricks,59,57,3,1,44932,Jean-Paul Duminy,0,0,0,0,6,True,0,0,0,0,0,23,5,1,False,,False,False,6.04,0,138,0,3,0,1,1,0,139
run,3,South Africa,8,Sri Lanka,1st innings,2,"full outside off, and driven with the angled bat to the offside. Takes the outside edge and runs down to third man for a brace","Jayasuriya to Duminy, 2 runs",141/3,422871,Prabath Jayasuriya,0,19,0,3.1,22,233514,Thisara Perera,0,36,2,6.0,26,44932,Jean-Paul Duminy,2,1,0,0,269280,Reeza Hendricks,59,57,3,1,1,False,0,0,0,0,0,24,11,0,False,,False,False,6.08,0,139,0,3,0,1,1,0,141
run,3,South Africa,8,Sri Lanka,1st innings,1,"full just outside off, and driven to mid off for a quick single","Jayasuriya to Duminy, 1 run",142/3,422871,Prabath Jayasuriya,0,20,0,3.2,23,233514,Thisara Perera,0,36,2,6.0,26,44932,Jean-Paul Duminy,3,2,0,0,269280,Reeza Hendricks,59,57,3,1,2,False,0,0,0,0,0,24,11,0,False,,False,False,6.08,0,140,0,3,0,1,1,0,142
run,3,South Africa,8,Sri Lanka,1st innings,1,"good length outside off, and he rocks back onto the backfoot. Punched to deep extra cover","Jayasuriya to Hendricks, 1 run",143/3,422871,Prabath Jayasuriya,0,21,0,3.3,24,233514,Thisara Perera,0,36,2,6.0,26,269280,Reeza Hendricks,60,58,3,1,44932,Jean-Paul Duminy,3,2,0,0,3,False,0,0,0,0,0,24,11,0,False,,False,False,6.08,0,141,0,3,0,1,1,0,143
run,3,South Africa,8,Sri Lanka,1st innings,2,"full just outside off, and that's been chipped over the bowler's head. Long on intercepts","Jayasuriya to Duminy, 2 runs",145/3,422871,Prabath Jayasuriya,0,22,0,3.4,26,233514,Thisara Perera,0,36,2,6.0,26,44932,Jean-Paul Duminy,5,3,0,0,269280,Reeza Hendricks,60,58,3,1,4,False,0,0,0,0,0,24,11,0,False,,False,False,6.12,0,142,0,3,0,1,1,0,145
four,3,South Africa,8,Sri Lanka,1st innings,4,"good length outside off, and the cut has been <b>inside-edged</b> through the keeper's legs! Unlucky for SL, but Duminy won't mind how these runs come.","Jayasuriya to Duminy, FOUR runs",149/3,422871,Prabath Jayasuriya,0,23,0,3.5,30,233514,Thisara Perera,0,36,2,6.0,26,44932,Jean-Paul Duminy,9,4,1,0,269280,Reeza Hendricks,60,58,3,1,5,False,0,0,0,0,0,24,11,0,False,,False,False,6.25,0,143,0,3,0,1,1,0,149
run,3,South Africa,8,Sri Lanka,1st innings,1,"length ball on middle, but JP comes down the ground and converts it into a low full toss. Drives to long on","Jayasuriya to Duminy, 1 run",150/3,422871,Prabath Jayasuriya,0,24,0,4.0,31,233514,Thisara Perera,0,36,2,6.0,26,44932,Jean-Paul Duminy,10,5,1,0,269280,Reeza Hendricks,60,58,3,1,6,True,0,0,0,0,0,24,11,0,False,,False,False,6.25,0,144,0,3,0,1,1,0,150
no run,3,South Africa,8,Sri Lanka,1st innings,0,"good length outside off, and angling across Duminy. Tries to defend, but the inside edge almost ensures he chops on! Luckily for Duminy, the ball bounces over the stumps","Kumara to Duminy, no run",150/3,784375,Lahiru Kumara,0,37,1,6.1,48,422871,Prabath Jayasuriya,0,24,0,4.0,31,44932,Jean-Paul Duminy,10,6,1,0,269280,Reeza Hendricks,60,58,3,1,1,False,0,0,0,0,0,25,1,0,False,,False,False,6.2,0,145,0,3,0,1,1,0,150
no run,3,South Africa,8,Sri Lanka,1st innings,0,"full on off, and driven through the line to mid off. Straight to the fielder though","Kumara to Duminy, no run",150/3,784375,Lahiru Kumara,0,38,1,6.2,48,422871,Prabath Jayasuriya,0,24,0,4.0,31,44932,Jean-Paul Duminy,10,7,1,0,269280,Reeza Hendricks,60,58,3,1,2,False,0,0,0,0,0,25,1,0,False,,False,False,6.16,0,146,0,3,0,1,1,0,150
run,3,South Africa,8,Sri Lanka,1st innings,1,"aimed at his pads, and Duminy has no trouble whipping this away to the sweeper fielder on the leg side","Kumara to Duminy, 1 run",151/3,784375,Lahiru Kumara,0,39,1,6.3,49,422871,Prabath Jayasuriya,0,24,0,4.0,31,44932,Jean-Paul Duminy,11,8,1,0,269280,Reeza Hendricks,60,58,3,1,3,False,0,0,0,0,0,25,1,0,False,,False,False,6.16,0,147,0,3,0,1,1,0,151
no run,3,South Africa,8,Sri Lanka,1st innings,0,"full on off, and the front-foot defense is played to short mid on","Kumara to Hendricks, no run",151/3,784375,Lahiru Kumara,0,40,1,6.4,49,422871,Prabath Jayasuriya,0,24,0,4.0,31,269280,Reeza Hendricks,60,59,3,1,44932,Jean-Paul Duminy,11,8,1,0,4,False,0,0,0,0,0,25,1,0,False,,False,False,6.12,0,148,0,3,0,1,1,0,151
no run,3,South Africa,8,Sri Lanka,1st innings,0,"back of a length outside off, and the attempted punch comes off the bat's top half. Rolls away to mid off","Kumara to Hendricks, no run",151/3,784375,Lahiru Kumara,0,41,1,6.5,49,422871,Prabath Jayasuriya,0,24,0,4.0,31,269280,Reeza Hendricks,60,60,3,1,44932,Jean-Paul Duminy,11,8,1,0,5,False,0,0,0,0,0,25,1,0,False,,False,False,6.08,0,149,0,3,0,1,1,0,151
no run,3,South Africa,8,Sri Lanka,1st innings,0,"full just outside off, and defended to cover","Kumara to Hendricks, no run",151/3,784375,Lahiru Kumara,0,42,1,7.0,49,422871,Prabath Jayasuriya,0,24,0,4.0,31,269280,Reeza Hendricks,60,61,3,1,44932,Jean-Paul Duminy,11,8,1,0,6,True,0,0,0,0,0,25,1,0,False,,False,False,6.04,0,150,0,3,0,1,1,0,151
run,3,South Africa,8,Sri Lanka,1st innings,1,"full just outside off, and defended to cover off the front foot for a single","Jayasuriya to Duminy, 1 run",152/3,422871,Prabath Jayasuriya,0,25,0,4.1,32,784375,Lahiru Kumara,0,42,1,7.0,49,44932,Jean-Paul Duminy,12,9,1,0,269280,Reeza Hendricks,60,61,3,1,1,False,0,0,0,0,0,26,9,0,False,,False,False,6.03,0,151,0,3,0,1,1,0,152
no run,3,South Africa,8,Sri Lanka,1st innings,0,"full outside leg stump, but he misses out on the sweep. Hits his front leg, but impact was obviously outside","Jayasuriya to Hendricks, no run",152/3,422871,Prabath Jayasuriya,0,26,0,4.2,32,784375,Lahiru Kumara,0,42,1,7.0,49,269280,Reeza Hendricks,60,62,3,1,44932,Jean-Paul Duminy,12,9,1,0,2,False,0,0,0,0,0,26,9,0,False,,False,False,6.0,0,152,0,3,0,1,1,0,152
run,3,South Africa,8,Sri Lanka,1st innings,2,"full on leg stump, and nudged away to the leg side for a single","Jayasuriya to Hendricks, 2 runs",154/3,422871,Prabath Jayasuriya,0,27,0,4.3,34,784375,Lahiru Kumara,0,42,1,7.0,49,269280,Reeza Hendricks,62,63,3,1,44932,Jean-Paul Duminy,12,9,1,0,3,False,0,0,0,0,0,26,9,0,False,,False,False,6.03,0,153,0,3,0,1,1,0,154
four,3,South Africa,8,Sri Lanka,1st innings,4,"full on leg stump, and he top-edges a slog sweep! Could be out if deep backward square can intercept in time, but he can't get there, and the ball rolls away to the boundary for four","Jayasuriya to Hendricks, FOUR runs",158/3,422871,Prabath Jayasuriya,0,28,0,4.4,38,784375,Lahiru Kumara,0,42,1,7.0,49,269280,Reeza Hendricks,66,64,4,1,44932,Jean-Paul Duminy,12,9,1,0,4,False,0,0,0,0,0,26,9,0,False,,False,False,6.15,0,154,0,3,0,1,1,0,158
no run,3,South Africa,8,Sri Lanka,1st innings,0,"full on middle and leg. Turning into his pads, and defended to the leg side","Jayasuriya to Hendricks, no run",158/3,422871,Prabath Jayasuriya,0,29,0,4.5,38,784375,Lahiru Kumara,0,42,1,7.0,49,269280,Reeza Hendricks,66,65,4,1,44932,Jean-Paul Duminy,12,9,1,0,5,False,0,0,0,0,0,26,9,0,False,,False,False,6.11,0,155,0,3,0,1,1,0,158
run,3,South Africa,8,Sri Lanka,1st innings,2,"full outside leg stump, and that's been <b>played fine</b>, Flicked off his pads past the keeper, and short fine leg has to give it a mighty chase","Jayasuriya to Hendricks, 2 runs",160/3,422871,Prabath Jayasuriya,0,30,0,5.0,40,784375,Lahiru Kumara,0,42,1,7.0,49,269280,Reeza Hendricks,68,66,4,1,44932,Jean-Paul Duminy,12,9,1,0,6,True,0,0,0,0,0,26,9,0,False,,False,False,6.15,0,156,0,3,0,1,1,0,160
run,3,South Africa,8,Sri Lanka,1st innings,1,"good length outside off, and he rides the bounce to steer this delivery to third man","Kumara to Duminy, 1 run",161/3,784375,Lahiru Kumara,0,43,1,7.1,50,422871,Prabath Jayasuriya,0,30,0,5.0,40,44932,Jean-Paul Duminy,13,10,1,0,269280,Reeza Hendricks,68,66,4,1,1,False,0,0,0,0,0,27,6,0,False,,False,False,6.15,0,157,0,3,0,1,1,0,161
run,3,South Africa,8,Sri Lanka,1st innings,1,"full just outside off, and driven to extra cover for a single","Kumara to Hendricks, 1 run",162/3,784375,Lahiru Kumara,0,44,1,7.2,51,422871,Prabath Jayasuriya,0,30,0,5.0,40,269280,Reeza Hendricks,69,67,4,1,44932,Jean-Paul Duminy,13,10,1,0,2,False,0,0,0,0,0,27,6,0,False,,False,False,6.15,0,158,0,3,0,1,1,0,162
four,3,South Africa,8,Sri Lanka,1st innings,4,"back of a length outside off, and pulled away with ease! Played along the ground, and this beats the fielder placed in the deep","Kumara to Duminy, FOUR runs",166/3,784375,Lahiru Kumara,0,45,1,7.3,55,422871,Prabath Jayasuriya,0,30,0,5.0,40,44932,Jean-Paul Duminy,17,11,2,0,269280,Reeza Hendricks,69,67,4,1,3,False,0,0,0,0,0,27,6,0,False,,False,False,6.26,0,159,0,3,0,1,1,0,166
no run,3,South Africa,8,Sri Lanka,1st innings,0,"good length on middle stump, and defended to cover off the front foot","Kumara to Duminy, no run",166/3,784375,Lahiru Kumara,0,46,1,7.4,55,422871,Prabath Jayasuriya,0,30,0,5.0,40,44932,Jean-Paul Duminy,17,12,2,0,269280,Reeza Hendricks,69,67,4,1,4,False,0,0,0,0,0,27,6,0,False,,False,False,6.22,0,160,0,3,0,1,1,0,166
no run,3,South Africa,8,Sri Lanka,1st innings,0,"full on off, and pushed to cover off the front foot once again. Keeping things tight","Kumara to Duminy, no run",166/3,784375,Lahiru Kumara,0,47,1,7.5,55,422871,Prabath Jayasuriya,0,30,0,5.0,40,44932,Jean-Paul Duminy,17,13,2,0,269280,Reeza Hendricks,69,67,4,1,5,False,0,0,0,0,0,27,6,0,False,,False,False,6.18,0,161,0,3,0,1,1,0,166
no run,3,South Africa,8,Sri Lanka,1st innings,0,"full just outside off, and driven with the ball angling away. But <b>commitment on display from Mathews</b> as he dives to his left - at cover - and stops the ball from going through","Kumara to Duminy, no run",166/3,784375,Lahiru Kumara,0,48,1,8.0,55,422871,Prabath Jayasuriya,0,30,0,5.0,40,44932,Jean-Paul Duminy,17,14,2,0,269280,Reeza Hendricks,69,67,4,1,6,True,0,0,0,0,0,27,6,0,False,,False,False,6.14,0,162,0,3,0,1,1,0,166
run,3,South Africa,8,Sri Lanka,1st innings,1,"full just outside off, and going straight through. Hendricks uses his wrists to nudge this to square leg","Dananjaya to Hendricks, 1 run",167/3,574178,Akila Dananjaya,0,13,0,2.1,20,784375,Lahiru Kumara,0,48,1,8.0,55,269280,Reeza Hendricks,70,68,4,1,44932,Jean-Paul Duminy,17,14,2,0,1,False,0,0,0,0,0,28,6,0,False,,False,False,6.14,0,163,0,3,0,1,1,0,167
no run,3,South Africa,8,Sri Lanka,1st innings,0,"full on middle, and he takes a big stride forward to defend","Dananjaya to Duminy, no run",167/3,574178,Akila Dananjaya,0,14,0,2.2,20,784375,Lahiru Kumara,0,48,1,8.0,55,44932,Jean-Paul Duminy,17,15,2,0,269280,Reeza Hendricks,70,68,4,1,2,False,0,0,0,0,0,28,6,0,False,,False,False,6.1,0,164,0,3,0,1,1,0,167
run,3,South Africa,8,Sri Lanka,1st innings,1,"good length on off, and turning away after pitching. Cut to point","Dananjaya to Duminy, 1 run",168/3,574178,Akila Dananjaya,0,15,0,2.3,21,784375,Lahiru Kumara,0,48,1,8.0,55,44932,Jean-Paul Duminy,18,16,2,0,269280,Reeza Hendricks,70,68,4,1,3,False,0,0,0,0,0,28,6,0,False,,False,False,6.1,0,165,0,3,0,1,1,0,168
run,3,South Africa,8,Sri Lanka,1st innings,1,"full on middle, but the ball stays pretty low. Hendricks uses the depth of his crease to work it off his pads to the leg side","Dananjaya to Hendricks, 1 run",169/3,574178,Akila Dananjaya,0,16,0,2.4,22,784375,Lahiru Kumara,0,48,1,8.0,55,269280,Reeza Hendricks,71,69,4,1,44932,Jean-Paul Duminy,18,16,2,0,4,False,0,0,0,0,0,28,6,0,False,,False,False,6.1,0,166,0,3,0,1,1,0,169
run,3,South Africa,8,Sri Lanka,1st innings,1,"good length on middle, and punched off the back foot to deep extra cover","Dananjaya to Duminy, 1 run",170/3,574178,Akila Dananjaya,0,17,0,2.5,23,784375,Lahiru Kumara,0,48,1,8.0,55,44932,Jean-Paul Duminy,19,17,2,0,269280,Reeza Hendricks,71,69,4,1,5,False,0,0,0,0,0,28,6,0,False,,False,False,6.1,0,167,0,3,0,1,1,0,170
run,3,South Africa,8,Sri Lanka,1st innings,2,"half-tracker on middle, and Hendricks has no trouble in slogging a pull to the leg side. Man in the deep though, so a comfortable double on offer for SA","Dananjaya to Hendricks, 2 runs",172/3,574178,Akila Dananjaya,0,18,0,3.0,25,784375,Lahiru Kumara,0,48,1,8.0,55,269280,Reeza Hendricks,73,70,4,1,44932,Jean-Paul Duminy,19,17,2,0,6,True,0,0,0,0,0,28,6,0,False,,False,False,6.14,0,168,0,3,0,1,1,0,172
no run,3,South Africa,8,Sri Lanka,1st innings,0,"full just outside off, and Duminy misses out on the drive. Hit straight to cover","de Silva to Duminy, no run",172/3,465793,Dhananjaya de Silva,0,1,0,0.1,0,574178,Akila Dananjaya,0,18,0,3.0,25,44932,Jean-Paul Duminy,19,18,2,0,269280,Reeza Hendricks,73,70,4,1,1,False,0,0,0,0,0,29,6,0,False,,False,False,6.1,0,169,0,3,0,1,1,0,172
no run,3,South Africa,8,Sri Lanka,1st innings,0,"<b.appeal for lbw!</b> But not given. They are not reviewing though. It was full on leg stump, and he misses the defensive shot off the front foot. The ball sneaks inside his bat, but replays suggest it was bat-pad, which saved him","de Silva to Duminy, no run",172/3,465793,Dhananjaya de Silva,0,2,0,0.2,0,574178,Akila Dananjaya,0,18,0,3.0,25,44932,Jean-Paul Duminy,19,19,2,0,269280,Reeza Hendricks,73,70,4,1,2,False,0,0,0,0,0,29,6,0,False,,False,False,6.07,0,170,0,3,0,1,1,0,172
six,3,South Africa,8,Sri Lanka,1st innings,6,"<b>slogged!</b> Down on one knee, and meets this full ball under his eyes, and drags a sweep from outside off, and into the cow-corner boundary","de Silva to Duminy, SIX runs",178/3,465793,Dhananjaya de Silva,0,3,0,0.3,6,574178,Akila Dananjaya,0,18,0,3.0,25,44932,Jean-Paul Duminy,25,20,2,1,269280,Reeza Hendricks,73,70,4,1,3,False,0,0,0,0,0,29,6,0,False,,False,False,6.24,0,171,0,3,0,1,1,0,178
no run,3,South Africa,8,Sri Lanka,1st innings,0,"good length on middle, and he comes forward to defend. But the ball hits his front leg","de Silva to Duminy, no run",178/3,465793,Dhananjaya de Silva,0,4,0,0.4,6,574178,Akila Dananjaya,0,18,0,3.0,25,44932,Jean-Paul Duminy,25,21,2,1,269280,Reeza Hendricks,73,70,4,1,4,False,0,0,0,0,0,29,6,0,False,,False,False,6.2,0,172,0,3,0,1,1,0,178
no run,3,South Africa,8,Sri Lanka,1st innings,0,"yorker outside off, and he wedges a drive onto his boots. Ouch!","de Silva to Duminy, no run",178/3,465793,Dhananjaya de Silva,0,5,0,0.5,6,574178,Akila Dananjaya,0,18,0,3.0,25,44932,Jean-Paul Duminy,25,22,2,1,269280,Reeza Hendricks,73,70,4,1,5,False,0,0,0,0,0,29,6,0,False,,False,False,6.17,0,173,0,3,0,1,1,0,178
no run,3,South Africa,8,Sri Lanka,1st innings,0,"good length outside off, and he misses the flick off his pads. Hits his front leg, but the ball would've missed leg stump","de Silva to Duminy, no run",178/3,465793,Dhananjaya de Silva,0,6,0,1.0,6,574178,Akila Dananjaya,0,18,0,3.0,25,44932,Jean-Paul Duminy,25,23,2,1,269280,Reeza Hendricks,73,70,4,1,6,True,0,0,0,0,0,29,6,0,False,,False,False,6.13,0,174,0,3,0,1,1,0,178
run,3,South Africa,8,Sri Lanka,1st innings,1,"length ball on middle, and spinning into his pads. Flicked away to deep midwicket","Dananjaya to Hendricks, 1 run",179/3,574178,Akila Dananjaya,0,19,0,3.1,26,465793,Dhananjaya de Silva,0,6,0,1.0,6,269280,Reeza Hendricks,74,71,4,1,44932,Jean-Paul Duminy,25,23,2,1,1,False,0,0,0,0,0,30,7,0,False,,False,False,6.13,0,175,0,3,0,1,1,0,179
run,3,South Africa,8,Sri Lanka,1st innings,1,"good length on leg stump, and nudged away behind square for another single","Dananjaya to Duminy, 1 run",180/3,574178,Akila Dananjaya,0,20,0,3.2,27,465793,Dhananjaya de Silva,0,6,0,1.0,6,44932,Jean-Paul Duminy,26,24,2,1,269280,Reeza Hendricks,74,71,4,1,2,False,0,0,0,0,0,30,7,0,False,,False,False,6.13,0,176,0,3,0,1,1,0,180
four,3,South Africa,8,Sri Lanka,1st innings,4,"full just outside off, and swept away with ease! Picks the length early, and drags this with the spin, and into the mid-wicket boundary","Dananjaya to Hendricks, FOUR runs",184/3,574178,Akila Dananjaya,0,21,0,3.3,31,465793,Dhananjaya de Silva,0,6,0,1.0,6,269280,Reeza Hendricks,78,72,5,1,44932,Jean-Paul Duminy,26,24,2,1,3,False,0,0,0,0,0,30,7,0,False,,False,False,6.23,0,177,0,3,0,1,1,0,184
run,3,South Africa,8,Sri Lanka,1st innings,1,"full on leg stump, and pushed to point for a single","Dananjaya to Hendricks, 1 run",185/3,574178,Akila Dananjaya,0,22,0,3.4,32,465793,Dhananjaya de Silva,0,6,0,1.0,6,269280,Reeza Hendricks,79,73,5,1,44932,Jean-Paul Duminy,26,24,2,1,4,False,0,0,0,0,0,30,7,0,False,,False,False,6.23,0,178,0,3,0,1,1,0,185
no run,3,South Africa,8,Sri Lanka,1st innings,0,"full ball on off, and defended to cover","Dananjaya to Duminy, no run",185/3,574178,Akila Dananjaya,0,23,0,3.5,32,465793,Dhananjaya de Silva,0,6,0,1.0,6,44932,Jean-Paul Duminy,26,25,2,1,269280,Reeza Hendricks,79,73,5,1,5,False,0,0,0,0,0,30,7,0,False,,False,False,6.2,0,179,0,3,0,1,1,0,185
no run,3,South Africa,8,Sri Lanka,1st innings,0,"<b>what's happened here?</b> They're all confused. Akila appeals for caught behind, but Dickwella doesn't go up. Did he inside-edge a cut onto his boots and then into the keeper's gloves? Or was it ground first? Hmm, the umpire calls over though","Dananjaya to Duminy, no run",185/3,574178,Akila Dananjaya,0,24,0,4.0,32,465793,Dhananjaya de Silva,0,6,0,1.0,6,44932,Jean-Paul Duminy,26,26,2,1,269280,Reeza Hendricks,79,73,5,1,6,True,0,0,0,0,0,30,7,0,False,,False,False,6.16,0,180,0,3,0,1,1,0,185
