PlayType_description,Batting_Team_id,Batting_Team_name,Bowling_Team_id,Bowling_Team_name,Innings,Total_Runs_on_delivery,Commentary,Commentary_short,Score,Bowler_id,Bowler_name,Bowler_maiden,Bowler_balls,Bowler_wickets,Bowler_over,Bowler_conceded,Other_Bowler_id,Other_Bowler_name,Other_Bowler_maidens,Other_Bowler_balls,Other_Bowler_wickets,Other_Bowler_overs,Other_Bowler_conceded,Batsman_id,Batsman_name,Batsman_runs,Batsman_balls_faced,Batsman_four,Batsman_sixes,Other_Batsman_id,Other_Batsman_name,Other_Batsman_runs,Other_Batsman_balls_faced,Other_Batsman_four,Other_Batsman_sixes,Over_ball,Over_complete,Over_maiden,Over_no_Ball,Over_wide,Over_byes,Over_leg_byes,Over_number,Over_runs,Over_wickets,Dismissal_is_true,Dismissal_type,Dismissal_fielder_iskeeper,Dismissal_text,Innings_run_rate,Innings_byes,Innings_balls,Innings_no_balls,Innings_wickets,Innings_leg_byes,Innings_session,Innings_day,Innings_wides,Innings_runs
run,3,South Africa,8,Sri Lanka,1st innings,1,shuffles across his stumps and out of his crease now. Clips this middle-stump ball into the fine leg region,"de Silva to Duminy, 1 run",251/4,465793,Dhananjaya de Silva,0,20,0,3.2,21,574178,Akila Dananjaya,0,36,0,6.0,44,44932,Jean-Paul Duminy,52,54,4,1,321777,David Miller,15,19,2,0,2,False,0,0,0,0,0,41,5,0,False,,False,False,6.22,0,242,0,4,0,1,1,0,251
run,3,South Africa,8,Sri Lanka,1st innings,1,"length ball outside off stump, driven to long-off","de Silva to Miller, 1 run",252/4,465793,Dhananjaya de Silva,0,21,0,3.3,22,574178,Akila Dananjaya,0,36,0,6.0,44,321777,David Miller,16,20,2,0,44932,Jean-Paul Duminy,52,54,4,1,3,False,0,0,0,0,0,41,5,0,False,,False,False,6.22,0,243,0,4,0,1,1,0,252
run,3,South Africa,8,Sri Lanka,1st innings,1,"back of a length on leg stump, punched to long-on","de Silva to Duminy, 1 run",253/4,465793,Dhananjaya de Silva,0,22,0,3.4,23,574178,Akila Dananjaya,0,36,0,6.0,44,44932,Jean-Paul Duminy,53,55,4,1,321777,David Miller,16,20,2,0,4,False,0,0,0,0,0,41,5,0,False,,False,False,6.22,0,244,0,4,0,1,1,0,253
run,3,South Africa,8,Sri Lanka,1st innings,1,"length ball sliding on towards leg stump. Looks to drive down the ground, playing for turn, and it takes his inside edge and rolls to backward square leg","de Silva to Miller, 1 run",254/4,465793,Dhananjaya de Silva,0,23,0,3.5,24,574178,Akila Dananjaya,0,36,0,6.0,44,321777,David Miller,17,21,2,0,44932,Jean-Paul Duminy,53,55,4,1,5,False,0,0,0,0,0,41,5,0,False,,False,False,6.22,0,245,0,4,0,1,1,0,254
no run,3,South Africa,8,Sri Lanka,1st innings,0,,"de Silva to Duminy, no run",254/4,465793,Dhananjaya de Silva,0,24,0,4.0,24,574178,Akila Dananjaya,0,36,0,6.0,44,44932,Jean-Paul Duminy,53,56,4,1,321777,David Miller,17,21,2,0,6,True,0,0,0,0,0,41,5,0,False,,False,False,6.19,0,246,0,4,0,1,1,0,254
no run,3,South Africa,8,Sri Lanka,1st innings,0,tossed up on middle and leg. Stretches out low and reverse-paddles through backward point,"Dananjaya to Miller, no run",254/4,574178,Akila Dananjaya,0,37,0,6.1,44,465793,Dhananjaya de Silva,0,24,0,4.0,24,321777,David Miller,17,22,2,0,44932,Jean-Paul Duminy,53,56,4,1,1,False,0,0,0,0,0,42,3,0,False,,False,False,6.17,0,247,0,4,0,1,1,0,254
no run,3,South Africa,8,Sri Lanka,1st innings,0,"good length on leg stump, clipped watchfully into the on side","Dananjaya to Miller, no run",254/4,574178,Akila Dananjaya,0,38,0,6.2,44,465793,Dhananjaya de Silva,0,24,0,4.0,24,321777,David Miller,17,23,2,0,44932,Jean-Paul Duminy,53,56,4,1,2,False,0,0,0,0,0,42,3,0,False,,False,False,6.14,0,248,0,4,0,1,1,0,254
run,3,South Africa,8,Sri Lanka,1st innings,1,sees Miller stepping across and bowls one quicker at his pads. Clipped to deep backward square leg,"Dananjaya to Miller, 1 run",255/4,574178,Akila Dananjaya,0,39,0,6.3,45,465793,Dhananjaya de Silva,0,24,0,4.0,24,321777,David Miller,18,24,2,0,44932,Jean-Paul Duminy,53,56,4,1,3,False,0,0,0,0,0,42,3,0,False,,False,False,6.14,0,249,0,4,0,1,1,0,255
run,3,South Africa,8,Sri Lanka,1st innings,1,down the track and Akila shifts his line wider. Driven to sweeper cover,"Dananjaya to Duminy, 1 run",256/4,574178,Akila Dananjaya,0,40,0,6.4,46,465793,Dhananjaya de Silva,0,24,0,4.0,24,44932,Jean-Paul Duminy,54,57,4,1,321777,David Miller,18,24,2,0,4,False,0,0,0,0,0,42,3,0,False,,False,False,6.14,0,250,0,4,0,1,1,0,256
no run,3,South Africa,8,Sri Lanka,1st innings,0,"big appeal - he was sweeping from the stumps - and Llong says not-out. Did that straighten enough to be hitting the stumps? <b>Sri Lanka have reviewed</b> this... Nope, doesn't matter where that was going, because Miller got a bit of glove on it first","Dananjaya to Miller, no run",256/4,574178,Akila Dananjaya,0,41,0,6.5,46,465793,Dhananjaya de Silva,0,24,0,4.0,24,321777,David Miller,18,25,2,0,44932,Jean-Paul Duminy,54,57,4,1,5,False,0,0,0,0,0,42,3,0,False,,False,False,6.11,0,251,0,4,0,1,1,0,256
run,3,South Africa,8,Sri Lanka,1st innings,1,"back of a length, turns from middle to off. Goes deep in his crease to whip this to long-on. Only three from the over, not a whole lot of ambition from these two batsmen barring that missed sweep","Dananjaya to Miller, 1 run",257/4,574178,Akila Dananjaya,0,42,0,7.0,47,465793,Dhananjaya de Silva,0,24,0,4.0,24,321777,David Miller,19,26,2,0,44932,Jean-Paul Duminy,54,57,4,1,6,True,0,0,0,0,0,42,3,0,False,,False,False,6.11,0,252,0,4,0,1,1,0,257
four,3,South Africa,8,Sri Lanka,1st innings,4,"shot. That was fairly quick and fairly full outside off, and he gets down low in a flash and brings quick hands into play to sweep powerfully past deep midwicket, who didn't have a long way to move to his left","de Silva to Miller, FOUR runs",261/4,465793,Dhananjaya de Silva,0,25,0,4.1,28,574178,Akila Dananjaya,0,42,0,7.0,47,321777,David Miller,23,27,3,0,44932,Jean-Paul Duminy,54,57,4,1,1,False,0,0,0,0,0,43,8,0,False,,False,False,6.18,0,253,0,4,0,1,1,0,261
no run,3,South Africa,8,Sri Lanka,1st innings,0,"fullish outside off, defended into the covers","de Silva to Miller, no run",261/4,465793,Dhananjaya de Silva,0,26,0,4.2,28,574178,Akila Dananjaya,0,42,0,7.0,47,321777,David Miller,23,28,3,0,44932,Jean-Paul Duminy,54,57,4,1,2,False,0,0,0,0,0,43,8,0,False,,False,False,6.16,0,254,0,4,0,1,1,0,261
no run,3,South Africa,8,Sri Lanka,1st innings,0,"full on off, steps out and clips to midwicket","de Silva to Miller, no run",261/4,465793,Dhananjaya de Silva,0,27,0,4.3,28,574178,Akila Dananjaya,0,42,0,7.0,47,321777,David Miller,23,29,3,0,44932,Jean-Paul Duminy,54,57,4,1,3,False,0,0,0,0,0,43,8,0,False,,False,False,6.14,0,255,0,4,0,1,1,0,261
four,3,South Africa,8,Sri Lanka,1st innings,4,"length ball on off stump, and Miller opens up his front leg and gets down low to slog-sweep along the ground, this time to the right of deep midwicket","de Silva to Miller, FOUR runs",265/4,465793,Dhananjaya de Silva,0,28,0,4.4,32,574178,Akila Dananjaya,0,42,0,7.0,47,321777,David Miller,27,30,4,0,44932,Jean-Paul Duminy,54,57,4,1,4,False,0,0,0,0,0,43,8,0,False,,False,False,6.21,0,256,0,4,0,1,1,0,265
no run,3,South Africa,8,Sri Lanka,1st innings,0,"another slider, going down leg. Miller is cramped for room as he tries to work it leg-side, and is hit on the back leg","de Silva to Miller, no run",265/4,465793,Dhananjaya de Silva,0,29,0,4.5,32,574178,Akila Dananjaya,0,42,0,7.0,47,321777,David Miller,27,31,4,0,44932,Jean-Paul Duminy,54,57,4,1,5,False,0,0,0,0,0,43,8,0,False,,False,False,6.18,0,257,0,4,0,1,1,0,265
no run,3,South Africa,8,Sri Lanka,1st innings,0,"length ball sliding on towards off stump. Makes a bit of room and squeezes it to the right of cover, who makes a good sprawling stop","de Silva to Miller, no run",265/4,465793,Dhananjaya de Silva,0,30,0,5.0,32,574178,Akila Dananjaya,0,42,0,7.0,47,321777,David Miller,27,32,4,0,44932,Jean-Paul Duminy,54,57,4,1,6,True,0,0,0,0,0,43,8,0,False,,False,False,6.16,0,258,0,4,0,1,1,0,265
bye,3,South Africa,8,Sri Lanka,1st innings,4,"quick and full outside off, and Duminy aims a reverse-sweep at it. Doesn't make contact, but does enough to unsight the keeper, and the ball runs away for four byes","Dananjaya to Duminy, 4 byes",269/4,574178,Akila Dananjaya,0,43,0,7.1,47,465793,Dhananjaya de Silva,0,30,0,5.0,32,44932,Jean-Paul Duminy,54,58,4,1,321777,David Miller,27,32,4,0,1,False,0,0,0,4,0,44,16,0,False,,False,False,6.23,4,259,0,4,0,1,1,0,269
run,3,South Africa,8,Sri Lanka,1st innings,1,"slower outside off, swept to deep midwicket","Dananjaya to Duminy, 1 run",270/4,574178,Akila Dananjaya,0,44,0,7.2,48,465793,Dhananjaya de Silva,0,30,0,5.0,32,44932,Jean-Paul Duminy,55,59,4,1,321777,David Miller,27,32,4,0,2,False,0,0,0,0,0,44,16,0,False,,False,False,6.23,0,260,0,4,0,1,1,0,270
run,3,South Africa,8,Sri Lanka,1st innings,1,"low full-toss on middle stump, driven to long-on","Dananjaya to Miller, 1 run",271/4,574178,Akila Dananjaya,0,45,0,7.3,49,465793,Dhananjaya de Silva,0,30,0,5.0,32,321777,David Miller,28,33,4,0,44932,Jean-Paul Duminy,55,59,4,1,3,False,0,0,0,0,0,44,16,0,False,,False,False,6.22,0,261,0,4,0,1,1,0,271
six,3,South Africa,8,Sri Lanka,1st innings,6,"shot. There's that slog-sweep again. Makes hitting room by getting his front leg out of the way, and he needed all that room because it was pretty full. Then he gets down low and launches it high over wide long-on","Dananjaya to Duminy, SIX runs",277/4,574178,Akila Dananjaya,0,46,0,7.4,55,465793,Dhananjaya de Silva,0,30,0,5.0,32,44932,Jean-Paul Duminy,61,60,4,2,321777,David Miller,28,33,4,0,4,False,0,0,0,0,0,44,16,0,False,,False,False,6.34,0,262,0,4,0,1,1,0,277
four,3,South Africa,8,Sri Lanka,1st innings,4,well done. Akila saw him switch hands for the switch-hit and bowled it wide of off (leg) stump. Sweeps it over the man at short third man and picks up four more,"Dananjaya to Duminy, FOUR runs",281/4,574178,Akila Dananjaya,0,47,0,7.5,59,465793,Dhananjaya de Silva,0,30,0,5.0,32,44932,Jean-Paul Duminy,65,61,5,2,321777,David Miller,28,33,4,0,5,False,0,0,0,0,0,44,16,0,False,,False,False,6.41,0,263,0,4,0,1,1,0,281
no run,3,South Africa,8,Sri Lanka,1st innings,0,"full, on the stumps, clips it, looking for long-on, and the bowler moves quickly to field it","Dananjaya to Duminy, no run",281/4,574178,Akila Dananjaya,0,48,0,8.0,59,465793,Dhananjaya de Silva,0,30,0,5.0,32,44932,Jean-Paul Duminy,65,62,5,2,321777,David Miller,28,33,4,0,6,True,0,0,0,0,0,44,16,0,False,,False,False,6.38,0,264,0,4,0,1,1,0,281
run,3,South Africa,8,Sri Lanka,1st innings,2,"on the pads, clipped to the left of deep midwicket","NLTC Perera to Miller, 2 runs",283/4,233514,Thisara Perera,0,43,2,7.1,42,574178,Akila Dananjaya,0,48,0,8.0,59,321777,David Miller,30,34,4,0,44932,Jean-Paul Duminy,65,62,5,2,1,False,0,0,0,0,0,45,11,0,False,,False,False,6.4,0,265,0,4,0,1,1,0,283
run,3,South Africa,8,Sri Lanka,1st innings,2,"back of a length on leg stump, tucked off the hip to the left of deep square leg","NLTC Perera to Miller, 2 runs",285/4,233514,Thisara Perera,0,44,2,7.2,44,574178,Akila Dananjaya,0,48,0,8.0,59,321777,David Miller,32,35,4,0,44932,Jean-Paul Duminy,65,62,5,2,2,False,0,0,0,0,0,45,11,0,False,,False,False,6.42,0,266,0,4,0,1,1,0,285
run,3,South Africa,8,Sri Lanka,1st innings,1,"back of a length on off stump, clipped gently to the right of deep midwicket. No one in the circle in front of square on the leg side","NLTC Perera to Miller, 1 run",286/4,233514,Thisara Perera,0,45,2,7.3,45,574178,Akila Dananjaya,0,48,0,8.0,59,321777,David Miller,33,36,4,0,44932,Jean-Paul Duminy,65,62,5,2,3,False,0,0,0,0,0,45,11,0,False,,False,False,6.42,0,267,0,4,0,1,1,0,286
run,3,South Africa,8,Sri Lanka,1st innings,1,"short, close to off stump, pulled to the right of deep midwicket, where Dhananjaya stretches out his right hand to stop it","NLTC Perera to Duminy, 1 run",287/4,233514,Thisara Perera,0,46,2,7.4,46,574178,Akila Dananjaya,0,48,0,8.0,59,44932,Jean-Paul Duminy,66,63,5,2,321777,David Miller,33,36,4,0,4,False,0,0,0,0,0,45,11,0,False,,False,False,6.42,0,268,0,4,0,1,1,0,287
leg bye,3,South Africa,8,Sri Lanka,1st innings,1,length ball slanting away from off stump. Shuffles across and misses the flick and the ball rolls off his back pad to the left of the diving keeper,"NLTC Perera to Miller, 1 leg bye",288/4,233514,Thisara Perera,0,47,2,7.5,46,574178,Akila Dananjaya,0,48,0,8.0,59,321777,David Miller,33,37,4,0,44932,Jean-Paul Duminy,66,63,5,2,5,False,0,0,0,0,1,45,11,0,False,,False,False,6.42,0,269,0,4,1,1,1,0,288
four,3,South Africa,8,Sri Lanka,1st innings,4,"short on off stump and that's a fortuitous boundary for Duminy. Goes hard at this pull, and bottom-edges it to the left of the man at short fine leg","NLTC Perera to Duminy, FOUR runs",292/4,233514,Thisara Perera,0,48,2,8.0,50,574178,Akila Dananjaya,0,48,0,8.0,59,44932,Jean-Paul Duminy,70,64,6,2,321777,David Miller,33,37,4,0,6,True,0,0,0,0,0,45,11,0,False,,False,False,6.48,0,270,0,4,0,1,1,0,292
run,3,South Africa,8,Sri Lanka,1st innings,1,shortish on off stump. Chopped into the backward point region for a quick single,"Lakmal to Miller, 1 run",293/4,49619,Suranga Lakmal,1,49,0,8.1,37,233514,Thisara Perera,0,48,2,8.0,50,321777,David Miller,34,38,4,0,44932,Jean-Paul Duminy,70,64,6,2,1,False,0,0,0,0,0,46,23,0,False,,False,False,6.48,0,271,0,4,0,1,1,0,293
four,3,South Africa,8,Sri Lanka,1st innings,4,"in the blockhole - a low, dipping full-toss, actually -  on leg stump and that's dragged away for another four. Clears his front leg and swipes hard at it, and the bottom edge races away to the right of long leg","Lakmal to Duminy, FOUR runs",297/4,49619,Suranga Lakmal,1,50,0,8.2,41,233514,Thisara Perera,0,48,2,8.0,50,44932,Jean-Paul Duminy,74,65,7,2,321777,David Miller,34,38,4,0,2,False,0,0,0,0,0,46,23,0,False,,False,False,6.55,0,272,0,4,0,1,1,0,297
four,3,South Africa,8,Sri Lanka,1st innings,4,"down the track, giving himself room, and he lifts this leg-stump length ball just out of reach of the leaping cover fielder. That brings up South Africa's 300","Lakmal to Duminy, FOUR runs",301/4,49619,Suranga Lakmal,1,51,0,8.3,45,233514,Thisara Perera,0,48,2,8.0,50,44932,Jean-Paul Duminy,78,66,8,2,321777,David Miller,34,38,4,0,3,False,0,0,0,0,0,46,23,0,False,,False,False,6.61,0,273,0,4,0,1,1,0,301
six,3,South Africa,8,Sri Lanka,1st innings,6,"full-toss on the pads, and that's a bad ball. Clears his front leg and just whips it away to the left of deep square leg","Lakmal to Duminy, SIX runs",307/4,49619,Suranga Lakmal,1,52,0,8.4,51,233514,Thisara Perera,0,48,2,8.0,50,44932,Jean-Paul Duminy,84,67,8,3,321777,David Miller,34,38,4,0,4,False,0,0,0,0,0,46,23,0,False,,False,False,6.72,0,274,0,4,0,1,1,0,307
six,3,South Africa,8,Sri Lanka,1st innings,6,short on off stump and he clubs it away. Clears his front leg and clears the midwicket boundary with ease to move into the 90s,"Lakmal to Duminy, SIX runs",313/4,49619,Suranga Lakmal,1,53,0,8.5,57,233514,Thisara Perera,0,48,2,8.0,50,44932,Jean-Paul Duminy,90,68,8,4,321777,David Miller,34,38,4,0,5,False,0,0,0,0,0,46,23,0,False,,False,False,6.82,0,275,0,4,0,1,1,0,313
run,3,South Africa,8,Sri Lanka,1st innings,2,slower ball on off stump. Makes a bit of room and carves it to the right of the fielder at deep point. 23 off that over,"Lakmal to Duminy, 2 runs",315/4,49619,Suranga Lakmal,1,54,0,9.0,59,233514,Thisara Perera,0,48,2,8.0,50,44932,Jean-Paul Duminy,92,69,8,4,321777,David Miller,34,38,4,0,6,True,0,0,0,0,0,46,23,0,False,,False,False,6.84,0,276,0,4,0,1,1,0,315
run,3,South Africa,8,Sri Lanka,1st innings,2,"length ball slanting away from off stump. Lofts it to the left of the fielder at sweeper cover, and the fielder just about cuts it off with a sliding save","NLTC Perera to Miller, 2 runs",317/4,233514,Thisara Perera,0,49,2,8.1,52,49619,Suranga Lakmal,1,54,0,9.0,59,321777,David Miller,36,39,4,0,44932,Jean-Paul Duminy,92,69,8,4,1,False,0,0,0,0,0,47,9,1,False,,False,False,6.86,0,277,0,4,0,1,1,0,317
run,3,South Africa,8,Sri Lanka,1st innings,1,"slower ball, full outside off. Shuffles across and clips to deep midwicket","NLTC Perera to Miller, 1 run",318/4,233514,Thisara Perera,0,50,2,8.2,53,49619,Suranga Lakmal,1,54,0,9.0,59,321777,David Miller,37,40,4,0,44932,Jean-Paul Duminy,92,69,8,4,2,False,0,0,0,0,0,47,9,1,False,,False,False,6.86,0,278,0,4,0,1,1,0,318
out,3,South Africa,8,Sri Lanka,1st innings,0,"full outside off, and Duminy misses out on a hundred. A splendid innings comes to an end, as he steps across his stumps and looks to swing this over the leg side. May have wanted to go a little squarer, but it was a slightly off-pace ball from Thisara, and he ends up hitting it straight down the throat of deep midwicket","NLTC Perera to Duminy, OUT",318/5,233514,Thisara Perera,0,51,3,8.3,53,49619,Suranga Lakmal,1,54,0,9.0,59,44932,Jean-Paul Duminy,92,70,8,4,321777,David Miller,37,40,4,0,3,False,0,0,0,0,0,47,9,1,True,caught,False,JP Duminy c de Silva b NLTC Perera 92 (70b 8x4 4x6) SR: 131.42,6.83,0,279,0,5,0,1,1,0,318
run,3,South Africa,8,Sri Lanka,1st innings,1,"low full-toss, slanting away from off stump. Opens his bat face and steers to third man","NLTC Perera to Miller, 1 run",319/5,233514,Thisara Perera,0,52,3,8.4,54,49619,Suranga Lakmal,1,54,0,9.0,59,321777,David Miller,38,41,4,0,540316,Andile Phehlukwayo,0,0,0,0,4,False,0,0,0,0,0,47,9,1,False,,False,False,6.83,0,280,0,5,0,1,1,0,319
four,3,South Africa,8,Sri Lanka,1st innings,4,"short, shoulder-high ball on off stump, leans away to make a bit of room, and Phehlukwayo is off the mark with a boundary. Just opens his bat face and steers it to the right of third man","NLTC Perera to Phehlukwayo, FOUR runs",323/5,233514,Thisara Perera,0,53,3,8.5,58,49619,Suranga Lakmal,1,54,0,9.0,59,540316,Andile Phehlukwayo,4,1,1,0,321777,David Miller,38,41,4,0,5,False,0,0,0,0,0,47,9,1,False,,False,False,6.89,0,281,0,5,0,1,1,0,323
run,3,South Africa,8,Sri Lanka,1st innings,1,"back of a length on middle and leg, worked away to deep backward square leg","NLTC Perera to Phehlukwayo, 1 run",324/5,233514,Thisara Perera,0,54,3,9.0,59,49619,Suranga Lakmal,1,54,0,9.0,59,540316,Andile Phehlukwayo,5,2,1,0,321777,David Miller,38,41,4,0,6,True,0,0,0,0,0,47,9,1,False,,False,False,6.89,0,282,0,5,0,1,1,0,324
run,3,South Africa,8,Sri Lanka,1st innings,1,"flat, angling into the pads, worked to short fine leg","Dananjaya to Phehlukwayo, 1 run",325/5,574178,Akila Dananjaya,0,49,0,8.1,60,233514,Thisara Perera,0,54,3,9.0,59,540316,Andile Phehlukwayo,6,3,1,0,321777,David Miller,38,41,4,0,1,False,0,0,0,0,0,48,5,0,False,,False,False,6.89,0,283,0,5,0,1,1,0,325
no run,3,South Africa,8,Sri Lanka,1st innings,0,"very full on leg stump, jabbed back to the bowler","Dananjaya to Miller, no run",325/5,574178,Akila Dananjaya,0,50,0,8.2,60,233514,Thisara Perera,0,54,3,9.0,59,321777,David Miller,38,42,4,0,540316,Andile Phehlukwayo,6,3,1,0,2,False,0,0,0,0,0,48,5,0,False,,False,False,6.86,0,284,0,5,0,1,1,0,325
run,3,South Africa,8,Sri Lanka,1st innings,1,"a bit slower now, still quite full on middle stump. Swept to deep backward square leg","Dananjaya to Miller, 1 run",326/5,574178,Akila Dananjaya,0,51,0,8.3,61,233514,Thisara Perera,0,54,3,9.0,59,321777,David Miller,39,43,4,0,540316,Andile Phehlukwayo,6,3,1,0,3,False,0,0,0,0,0,48,5,0,False,,False,False,6.86,0,285,0,5,0,1,1,0,326
no run,3,South Africa,8,Sri Lanka,1st innings,0,length ball on middle stump and Phehlukwayo can't beat short third man with his reverse-sweep. Not enough pace on that ball from Dananjaya,"Dananjaya to Phehlukwayo, no run",326/5,574178,Akila Dananjaya,0,52,0,8.4,61,233514,Thisara Perera,0,54,3,9.0,59,540316,Andile Phehlukwayo,6,4,1,0,321777,David Miller,39,43,4,0,4,False,0,0,0,0,0,48,5,0,False,,False,False,6.83,0,286,0,5,0,1,1,0,326
run,3,South Africa,8,Sri Lanka,1st innings,1,"fuller, driven to long-off","Dananjaya to Phehlukwayo, 1 run",327/5,574178,Akila Dananjaya,0,53,0,8.5,62,233514,Thisara Perera,0,54,3,9.0,59,540316,Andile Phehlukwayo,7,5,1,0,321777,David Miller,39,43,4,0,5,False,0,0,0,0,0,48,5,0,False,,False,False,6.83,0,287,0,5,0,1,1,0,327
run,3,South Africa,8,Sri Lanka,1st innings,2,"a great over from Dananjaya. Sees Miller looking to step out and fires it at his feet, from a round-arm angle. Can only squeeze it down the ground, to the right of long-on. Jammed it into the ground and it bounced over the non-striker and umpire","Dananjaya to Miller, 2 runs",329/5,574178,Akila Dananjaya,0,54,0,9.0,64,233514,Thisara Perera,0,54,3,9.0,59,321777,David Miller,41,44,4,0,540316,Andile Phehlukwayo,7,5,1,0,6,True,0,0,0,0,0,48,5,0,False,,False,False,6.85,0,288,0,5,0,1,1,0,329
leg bye,3,South Africa,8,Sri Lanka,1st innings,1,"big appeal for lbw, and that isn't given. Very full, on or just outside leg stump, and Miller plays all around it. Pitched just outside leg, I think","NLTC Perera to Phehlukwayo, 1 leg bye",330/5,233514,Thisara Perera,0,55,3,9.1,59,574178,Akila Dananjaya,0,54,0,9.0,64,540316,Andile Phehlukwayo,7,6,1,0,321777,David Miller,41,44,4,0,1,False,0,0,0,0,1,49,17,1,False,,False,False,6.85,0,289,0,5,1,1,1,0,330
four,3,South Africa,8,Sri Lanka,1st innings,4,"wide half-volley, and Miller plays a flat-bat drive, in the air, to the left of sweeper cover. Poor delivery","NLTC Perera to Miller, FOUR runs",334/5,233514,Thisara Perera,0,56,3,9.2,63,574178,Akila Dananjaya,0,54,0,9.0,64,321777,David Miller,45,45,5,0,540316,Andile Phehlukwayo,7,6,1,0,2,False,0,0,0,0,0,49,17,1,False,,False,False,6.91,0,290,0,5,0,1,1,0,334
six,3,South Africa,8,Sri Lanka,1st innings,6,"slower length ball on off stump, and Miller clears his front leg, waits, and whips it away over square leg. This is his 11th ODI fifty","NLTC Perera to Miller, SIX runs",340/5,233514,Thisara Perera,0,57,3,9.3,69,574178,Akila Dananjaya,0,54,0,9.0,64,321777,David Miller,51,46,5,1,540316,Andile Phehlukwayo,7,6,1,0,3,False,0,0,0,0,0,49,17,1,False,,False,False,7.01,0,291,0,5,0,1,1,0,340
out,3,South Africa,8,Sri Lanka,1st innings,0,"low full-toss on off stump, and Miller picks out deep midwicket. Clears his front leg, but can't get the leverage to get the elevation he wants. Dhananjaya takes a good catch, moving backwards, at just around head height","NLTC Perera to Miller, OUT",340/6,233514,Thisara Perera,0,58,4,9.4,69,574178,Akila Dananjaya,0,54,0,9.0,64,321777,David Miller,51,47,5,1,540316,Andile Phehlukwayo,7,6,1,0,4,False,0,0,0,0,0,49,17,1,True,caught,False,DA Miller c de Silva b NLTC Perera 51 (47b 5x4 1x6) SR: 108.51,6.98,0,292,0,6,0,1,1,0,340
four,3,South Africa,8,Sri Lanka,1st innings,4,"full on off stump and Phehlukwayo puts it away, though perhaps not where he wants. Makes room to hit it over the covers, I think. Ends up getting a thick edge that runs away between backward point and short third man","NLTC Perera to Phehlukwayo, FOUR runs",344/6,233514,Thisara Perera,0,59,4,9.5,73,574178,Akila Dananjaya,0,54,0,9.0,64,540316,Andile Phehlukwayo,11,7,2,0,698189,Wiaan Mulder,0,0,0,0,5,False,0,0,0,0,0,49,17,1,False,,False,False,7.04,0,293,0,6,0,1,1,0,344
run,3,South Africa,8,Sri Lanka,1st innings,2,"length ball on off stump, slapped away hard to the left of sweeper cover","NLTC Perera to Phehlukwayo, 2 runs",346/6,233514,Thisara Perera,0,60,4,10.0,75,574178,Akila Dananjaya,0,54,0,9.0,64,540316,Andile Phehlukwayo,13,8,2,0,698189,Wiaan Mulder,0,0,0,0,6,True,0,0,0,0,0,49,17,1,False,,False,False,7.06,0,294,0,6,0,1,1,0,346
run,3,South Africa,8,Sri Lanka,1st innings,1,"short outside off, carrom ball, slapped to deep point","Dananjaya to Mulder, 1 run",347/6,574178,Akila Dananjaya,0,55,0,9.1,65,233514,Thisara Perera,0,60,4,10.0,75,698189,Wiaan Mulder,1,1,0,0,540316,Andile Phehlukwayo,13,8,2,0,1,False,0,0,0,0,0,50,17,1,False,,False,False,7.05,0,295,0,6,0,1,1,0,347
four,3,South Africa,8,Sri Lanka,1st innings,4,"shot! Phehlukwayo has been brilliant so far, very decisive with what he wants to do. Low full-toss on middle stump and he reverse-sweeps over backward point","Dananjaya to Phehlukwayo, FOUR runs",351/6,574178,Akila Dananjaya,0,56,0,9.2,69,233514,Thisara Perera,0,60,4,10.0,75,540316,Andile Phehlukwayo,17,9,3,0,698189,Wiaan Mulder,1,1,0,0,2,False,0,0,0,0,0,50,17,1,False,,False,False,7.11,0,296,0,6,0,1,1,0,351
six,3,South Africa,8,Sri Lanka,1st innings,6,"a bit slower now and Phehlukwayo is out of his crease in a flash to launch it high over long-on. Made a lot of room, and Akila couldn't do anything about it, even as he tried to fire it down leg","Dananjaya to Phehlukwayo, SIX runs",357/6,574178,Akila Dananjaya,0,57,0,9.3,75,233514,Thisara Perera,0,60,4,10.0,75,540316,Andile Phehlukwayo,23,10,3,1,698189,Wiaan Mulder,1,1,0,0,3,False,0,0,0,0,0,50,17,1,False,,False,False,7.21,0,297,0,6,0,1,1,0,357
wide,3,South Africa,8,Sri Lanka,1st innings,1,"quicker one, ends up sliding it down the leg side","Dananjaya to Phehlukwayo, 1 wide",358/6,574178,Akila Dananjaya,0,57,0,9.3,76,233514,Thisara Perera,0,60,4,10.0,75,540316,Andile Phehlukwayo,23,10,3,1,698189,Wiaan Mulder,1,1,0,0,4,False,0,0,1,0,0,50,17,1,False,,False,False,7.23,0,297,0,6,0,1,1,1,358
run,3,South Africa,8,Sri Lanka,1st innings,1,"full on off stump, doesn't quite get to the pitch with his lofted drive and ends up chipping on the bounce to sweeper cover","Dananjaya to Phehlukwayo, 1 run",359/6,574178,Akila Dananjaya,0,58,0,9.4,77,233514,Thisara Perera,0,60,4,10.0,75,540316,Andile Phehlukwayo,24,11,3,1,698189,Wiaan Mulder,1,1,0,0,5,False,0,0,0,0,0,50,17,1,False,,False,False,7.22,0,298,0,6,0,1,1,0,359
run,3,South Africa,8,Sri Lanka,1st innings,1,"full on the stumps, whipped to deep square leg","Dananjaya to Mulder, 1 run",360/6,574178,Akila Dananjaya,0,59,0,9.5,78,233514,Thisara Perera,0,60,4,10.0,75,698189,Wiaan Mulder,2,2,0,0,540316,Andile Phehlukwayo,24,11,3,1,6,False,0,0,0,0,0,50,17,1,False,,False,False,7.22,0,299,0,6,0,1,1,0,360
wide,3,South Africa,8,Sri Lanka,1st innings,2,sees Phehlukwayo looking to make room and fires it wide outside off stump - too wide. Keeper fumbles and they run a bye as well,"Dananjaya to Phehlukwayo, 2 wides",362/6,574178,Akila Dananjaya,0,59,0,9.5,80,233514,Thisara Perera,0,60,4,10.0,75,540316,Andile Phehlukwayo,24,11,3,1,698189,Wiaan Mulder,2,2,0,0,7,False,0,0,2,0,0,50,17,1,False,,False,False,7.26,0,299,0,6,0,1,1,2,362
