PlayType_description,Batting_Team_id,Batting_Team_name,Bowling_Team_id,Bowling_Team_name,Innings,Total_Runs_on_delivery,Commentary,Commentary_short,Score,Bowler_id,Bowler_name,Bowler_maiden,Bowler_balls,Bowler_wickets,Bowler_over,Bowler_conceded,Other_Bowler_id,Other_Bowler_name,Other_Bowler_maidens,Other_Bowler_balls,Other_Bowler_wickets,Other_Bowler_overs,Other_Bowler_conceded,Batsman_id,Batsman_name,Batsman_runs,Batsman_balls_faced,Batsman_four,Batsman_sixes,Other_Batsman_id,Other_Batsman_name,Other_Batsman_runs,Other_Batsman_balls_faced,Other_Batsman_four,Other_Batsman_sixes,Over_ball,Over_complete,Over_maiden,Over_no_Ball,Over_wide,Over_byes,Over_leg_byes,Over_number,Over_runs,Over_wickets,Dismissal_is_true,Dismissal_type,Dismissal_fielder_iskeeper,Dismissal_text,Innings_run_rate,Innings_byes,Innings_balls,Innings_no_balls,Innings_wickets,Innings_leg_byes,Innings_session,Innings_day,Innings_wides,Innings_runs
wide,3,South Africa,8,Sri Lanka,1st innings,1,"starts with an extremely wide length ball, swings away from Amla, who leaves it alone","Lakmal to Amla, 1 wide",1/0,49619,Suranga Lakmal,0,0,0,0.0,1,False,False,0,0,0,False,0,43906,Hashim Amla,0,0,0,0,379143,Quinton de Kock,0,0,0,0,1,False,0,0,1,0,0,1,5,0,False,,False,False,False,0,0,0,0,0,1,1,1,1
no run,3,South Africa,8,Sri Lanka,1st innings,0,much better. Angles it into the fourth-stump line and gets it to curl away late. Amla lets it swing and defends with soft hands towards backward point,"Lakmal to Amla, no run",1/0,49619,Suranga Lakmal,0,1,0,0.1,1,False,False,0,0,0,False,0,43906,Hashim Amla,0,1,0,0,379143,Quinton de Kock,0,0,0,0,2,False,0,0,0,0,0,1,5,0,False,,False,False,6.0,0,1,0,0,0,1,1,0,1
no run,3,South Africa,8,Sri Lanka,1st innings,0,"similar line, Amla defends again","Lakmal to Amla, no run",1/0,49619,Suranga Lakmal,0,2,0,0.2,1,False,False,0,0,0,False,0,43906,Hashim Amla,0,2,0,0,379143,Quinton de Kock,0,0,0,0,3,False,0,0,0,0,0,1,5,0,False,,False,False,3.0,0,2,0,0,0,1,1,0,1
no run,3,South Africa,8,Sri Lanka,1st innings,0,wider line to try and tempt Amla into a drive away from his body. He sees the amount of outswing on it and resists the temptation,"Lakmal to Amla, no run",1/0,49619,Suranga Lakmal,0,3,0,0.3,1,False,False,0,0,0,False,0,43906,Hashim Amla,0,3,0,0,379143,Quinton de Kock,0,0,0,0,4,False,0,0,0,0,0,1,5,0,False,,False,False,2.0,0,3,0,0,0,1,1,0,1
no run,3,South Africa,8,Sri Lanka,1st innings,0,"fuller, closer to off stump, blocked back to the bowler","Lakmal to Amla, no run",1/0,49619,Suranga Lakmal,0,4,0,0.4,1,False,False,0,0,0,False,0,43906,Hashim Amla,0,4,0,0,379143,Quinton de Kock,0,0,0,0,5,False,0,0,0,0,0,1,5,0,False,,False,False,1.5,0,4,0,0,0,1,1,0,1
no run,3,South Africa,8,Sri Lanka,1st innings,0,"wide-ish outswinger once more, gets some pretty steep bounce too, from a fullish length, and Amla leaves again","Lakmal to Amla, no run",1/0,49619,Suranga Lakmal,0,5,0,0.5,1,False,False,0,0,0,False,0,43906,Hashim Amla,0,5,0,0,379143,Quinton de Kock,0,0,0,0,6,False,0,0,0,0,0,1,5,0,False,,False,False,1.2,0,5,0,0,0,1,1,0,1
four,3,South Africa,8,Sri Lanka,1st innings,4,"short, the first time he's lost his length this over, and Amla punishes him with a back-foot slap to the point boundary","Lakmal to Amla, FOUR runs",5/0,49619,Suranga Lakmal,0,6,0,1.0,5,False,False,0,0,0,False,0,43906,Hashim Amla,4,6,1,0,379143,Quinton de Kock,0,0,0,0,7,True,0,0,0,0,0,1,5,0,False,,False,False,5.0,0,6,0,0,0,1,1,0,5
run,3,South Africa,8,Sri Lanka,1st innings,1,"shortish, slanting away from off stump, reaches out to tap it away through the point region","Kumara to de Kock, 1 run",6/0,784375,Lahiru Kumara,0,1,0,0.1,1,49619,Suranga Lakmal,0,6,0,1.0,5,379143,Quinton de Kock,1,1,0,0,43906,Hashim Amla,4,6,1,0,1,False,0,0,0,0,0,2,10,0,False,,False,False,5.14,0,7,0,0,0,1,1,0,6
no run,3,South Africa,8,Sri Lanka,1st innings,0,"ooh, extra bounce in the corridor outside off stump. Amla gets off his feet and fends at it, and he's lucky the ball doesn't kiss his gloves on its way to the keeper","Kumara to Amla, no run",6/0,784375,Lahiru Kumara,0,2,0,0.2,1,49619,Suranga Lakmal,0,6,0,1.0,5,43906,Hashim Amla,4,7,1,0,379143,Quinton de Kock,1,1,0,0,2,False,0,0,0,0,0,2,10,0,False,,False,False,4.5,0,8,0,0,0,1,1,0,6
four,3,South Africa,8,Sri Lanka,1st innings,4,"overpitched, wide, and Amla says thank you, opens his bat face to drive it forcefully to the point boundary","Kumara to Amla, FOUR runs",10/0,784375,Lahiru Kumara,0,3,0,0.3,5,49619,Suranga Lakmal,0,6,0,1.0,5,43906,Hashim Amla,8,8,2,0,379143,Quinton de Kock,1,1,0,0,3,False,0,0,0,0,0,2,10,0,False,,False,False,6.66,0,9,0,0,0,1,1,0,10
four,3,South Africa,8,Sri Lanka,1st innings,4,"oh, even better. Not quite as full as the previous one, and he holds his shape and meets it right under his eye to drive on the up, between cover and mid-off","Kumara to Amla, FOUR runs",14/0,784375,Lahiru Kumara,0,4,0,0.4,9,49619,Suranga Lakmal,0,6,0,1.0,5,43906,Hashim Amla,12,9,3,0,379143,Quinton de Kock,1,1,0,0,4,False,0,0,0,0,0,2,10,0,False,,False,False,8.4,0,10,0,0,0,1,1,0,14
run,3,South Africa,8,Sri Lanka,1st innings,1,"back of a length, good bounce again in the corridor. Rides the bounce and dabs it down to third man","Kumara to Amla, 1 run",15/0,784375,Lahiru Kumara,0,5,0,0.5,10,49619,Suranga Lakmal,0,6,0,1.0,5,43906,Hashim Amla,13,10,3,0,379143,Quinton de Kock,1,1,0,0,5,False,0,0,0,0,0,2,10,0,False,,False,False,8.18,0,11,0,0,0,1,1,0,15
no run,3,South Africa,8,Sri Lanka,1st innings,0,"back of a length, angling across to off stump. De Kock plays with soft hands, looking for a quick single into the off side, but the man at point moves in quickly to cut the ball off","Kumara to de Kock, no run",15/0,784375,Lahiru Kumara,0,6,0,1.0,10,49619,Suranga Lakmal,0,6,0,1.0,5,379143,Quinton de Kock,1,2,0,0,43906,Hashim Amla,13,10,3,0,6,True,0,0,0,0,0,2,10,0,False,,False,False,7.5,0,12,0,0,0,1,1,0,15
no run,3,South Africa,8,Sri Lanka,1st innings,0,"back of a length, close to off stump, defended to backward point","Lakmal to Amla, no run",15/0,49619,Suranga Lakmal,0,7,0,1.1,5,784375,Lahiru Kumara,0,6,0,1.0,10,43906,Hashim Amla,13,11,3,0,379143,Quinton de Kock,1,2,0,0,1,False,0,0,0,0,0,3,6,0,False,,False,False,6.92,0,13,0,0,0,1,1,0,15
no run,3,South Africa,8,Sri Lanka,1st innings,0,"well played. Good length, angling in towards off stump. This one doesn't swing away, and Amla watches it all the way and defends with a lovely vertical bat, back down the pitch towards the bowler","Lakmal to Amla, no run",15/0,49619,Suranga Lakmal,0,8,0,1.2,5,784375,Lahiru Kumara,0,6,0,1.0,10,43906,Hashim Amla,13,12,3,0,379143,Quinton de Kock,1,2,0,0,2,False,0,0,0,0,0,3,6,0,False,,False,False,6.42,0,14,0,0,0,1,1,0,15
wide,3,South Africa,8,Sri Lanka,1st innings,1,"second wide for Lakmal today. Loses his action a little, I think, and the ball starts swinging as soon as it leaves his hand, and ends up pretty short and very wide outside off stump","Lakmal to Amla, 1 wide",16/0,49619,Suranga Lakmal,0,8,0,1.2,6,784375,Lahiru Kumara,0,6,0,1.0,10,43906,Hashim Amla,13,12,3,0,379143,Quinton de Kock,1,2,0,0,3,False,0,0,1,0,0,3,6,0,False,,False,False,6.85,0,14,0,0,0,1,1,1,16
no run,3,South Africa,8,Sri Lanka,1st innings,0,"good length, fifth-stump line, left alone","Lakmal to Amla, no run",16/0,49619,Suranga Lakmal,0,9,0,1.3,6,784375,Lahiru Kumara,0,6,0,1.0,10,43906,Hashim Amla,13,13,3,0,379143,Quinton de Kock,1,2,0,0,4,False,0,0,0,0,0,3,6,0,False,,False,False,6.4,0,15,0,0,0,1,1,0,16
four,3,South Africa,8,Sri Lanka,1st innings,4,"width again, and Amla reaches out and carves it away, up and over the vacant cover point region","Lakmal to Amla, FOUR runs",20/0,49619,Suranga Lakmal,0,10,0,1.4,10,784375,Lahiru Kumara,0,6,0,1.0,10,43906,Hashim Amla,17,14,4,0,379143,Quinton de Kock,1,2,0,0,5,False,0,0,0,0,0,3,6,0,False,,False,False,7.5,0,16,0,0,0,1,1,0,20
run,3,South Africa,8,Sri Lanka,1st innings,1,"back of a length outside off, gets on his toes and punches it to the left of backward point. Third man mops up","Lakmal to Amla, 1 run",21/0,49619,Suranga Lakmal,0,11,0,1.5,11,784375,Lahiru Kumara,0,6,0,1.0,10,43906,Hashim Amla,18,15,4,0,379143,Quinton de Kock,1,2,0,0,6,False,0,0,0,0,0,3,6,0,False,,False,False,7.41,0,17,0,0,0,1,1,0,21
no run,3,South Africa,8,Sri Lanka,1st innings,0,"ooh, lbw appeal. Length ball, swinging into the left-hander, who plays across it from the crease, looking for midwicket, and misses. Going down the leg side, though","Lakmal to de Kock, no run",21/0,49619,Suranga Lakmal,0,12,0,2.0,11,784375,Lahiru Kumara,0,6,0,1.0,10,379143,Quinton de Kock,1,3,0,0,43906,Hashim Amla,18,15,4,0,7,True,0,0,0,0,0,3,6,0,False,,False,False,7.0,0,18,0,0,0,1,1,0,21
four,3,South Africa,8,Sri Lanka,1st innings,4,"Amla's racing away here, and he's being helped by some ordinary Sri Lankan bowling. Low full-toss outside off stump, and he squeezes it away to the right of backward point","Kumara to Amla, FOUR runs",25/0,784375,Lahiru Kumara,0,7,0,1.1,14,49619,Suranga Lakmal,0,12,0,2.0,11,43906,Hashim Amla,22,16,5,0,379143,Quinton de Kock,1,3,0,0,1,False,0,0,0,0,0,4,6,0,False,,False,False,7.89,0,19,0,0,0,1,1,0,25
run,3,South Africa,8,Sri Lanka,1st innings,2,"full outside off and Amla drives with an open face again, this time to the left of backward point. Lakmal has to put in the dive after sprinting to his right from third man","Kumara to Amla, 2 runs",27/0,784375,Lahiru Kumara,0,8,0,1.2,16,49619,Suranga Lakmal,0,12,0,2.0,11,43906,Hashim Amla,24,17,5,0,379143,Quinton de Kock,1,3,0,0,2,False,0,0,0,0,0,4,6,0,False,,False,False,8.1,0,20,0,0,0,1,1,0,27
no run,3,South Africa,8,Sri Lanka,1st innings,0,"shortish, angling in towards off stump. Jumps to ride the bounce and defends into the point region","Kumara to Amla, no run",27/0,784375,Lahiru Kumara,0,9,0,1.3,16,49619,Suranga Lakmal,0,12,0,2.0,11,43906,Hashim Amla,24,18,5,0,379143,Quinton de Kock,1,3,0,0,3,False,0,0,0,0,0,4,6,0,False,,False,False,7.71,0,21,0,0,0,1,1,0,27
no run,3,South Africa,8,Sri Lanka,1st innings,0,"quick, sharp bouncer over off stump - 87mph. Amla leans away from the line to evade it","Kumara to Amla, no run",27/0,784375,Lahiru Kumara,0,10,0,1.4,16,49619,Suranga Lakmal,0,12,0,2.0,11,43906,Hashim Amla,24,19,5,0,379143,Quinton de Kock,1,3,0,0,4,False,0,0,0,0,0,4,6,0,False,,False,False,7.36,0,22,0,0,0,1,1,0,27
no run,3,South Africa,8,Sri Lanka,1st innings,0,"good ball. Good length outside off, and Amla looks for the on-the-up cover drive. Nips in slightly, and rolls away into the square-leg region off the inside edge","Kumara to Amla, no run",27/0,784375,Lahiru Kumara,0,11,0,1.5,16,49619,Suranga Lakmal,0,12,0,2.0,11,43906,Hashim Amla,24,20,5,0,379143,Quinton de Kock,1,3,0,0,5,False,0,0,0,0,0,4,6,0,False,,False,False,7.04,0,23,0,0,0,1,1,0,27
no run,3,South Africa,8,Sri Lanka,1st innings,0,"another short ball, this time a little more outside off. Amla leans back and looks to uppercut, but can't connect","Kumara to Amla, no run",27/0,784375,Lahiru Kumara,0,12,0,2.0,16,49619,Suranga Lakmal,0,12,0,2.0,11,43906,Hashim Amla,24,21,5,0,379143,Quinton de Kock,1,3,0,0,6,True,0,0,0,0,0,4,6,0,False,,False,False,6.75,0,24,0,0,0,1,1,0,27
no run,3,South Africa,8,Sri Lanka,1st innings,0,"play and miss. Back of a length outside off, and this nips in and keeps slightly low to beat the inside edge as QdK looks to punch into the covers without moving his feet","Lakmal to de Kock, no run",27/0,49619,Suranga Lakmal,0,13,0,2.1,11,784375,Lahiru Kumara,0,12,0,2.0,16,379143,Quinton de Kock,1,4,0,0,43906,Hashim Amla,24,21,5,0,1,False,0,0,0,0,0,5,2,0,False,,False,False,6.48,0,25,0,0,0,1,1,0,27
run,3,South Africa,8,Sri Lanka,1st innings,1,"short, angling into the batsman's waist. Tucked away to long leg","Lakmal to de Kock, 1 run",28/0,49619,Suranga Lakmal,0,14,0,2.2,12,784375,Lahiru Kumara,0,12,0,2.0,16,379143,Quinton de Kock,2,5,0,0,43906,Hashim Amla,24,21,5,0,2,False,0,0,0,0,0,5,2,0,False,,False,False,6.46,0,26,0,0,0,1,1,0,28
no run,3,South Africa,8,Sri Lanka,1st innings,0,"big appeal as Lakmal gets this to nip back in and defeat Amla's attempted flick. He was on the back foot, and struck on the back leg, but the ball probably pitched too short to be hitting the stumps","Lakmal to Amla, no run",28/0,49619,Suranga Lakmal,0,15,0,2.3,12,784375,Lahiru Kumara,0,12,0,2.0,16,43906,Hashim Amla,24,22,5,0,379143,Quinton de Kock,2,5,0,0,3,False,0,0,0,0,0,5,2,0,False,,False,False,6.22,0,27,0,0,0,1,1,0,28
run,3,South Africa,8,Sri Lanka,1st innings,1,"shortish, a bit of width, cut away to the right of third man","Lakmal to Amla, 1 run",29/0,49619,Suranga Lakmal,0,16,0,2.4,13,784375,Lahiru Kumara,0,12,0,2.0,16,43906,Hashim Amla,25,23,5,0,379143,Quinton de Kock,2,5,0,0,4,False,0,0,0,0,0,5,2,0,False,,False,False,6.21,0,28,0,0,0,1,1,0,29
no run,3,South Africa,8,Sri Lanka,1st innings,0,"back of a length, angling into the body, clipped to midwicket","Lakmal to de Kock, no run",29/0,49619,Suranga Lakmal,0,17,0,2.5,13,784375,Lahiru Kumara,0,12,0,2.0,16,379143,Quinton de Kock,2,6,0,0,43906,Hashim Amla,25,23,5,0,5,False,0,0,0,0,0,5,2,0,False,,False,False,6.0,0,29,0,0,0,1,1,0,29
no run,3,South Africa,8,Sri Lanka,1st innings,0,"full, angling into the pads, and de Kock misses out, flicking this straight to midwicket","Lakmal to de Kock, no run",29/0,49619,Suranga Lakmal,0,18,0,3.0,13,784375,Lahiru Kumara,0,12,0,2.0,16,379143,Quinton de Kock,2,7,0,0,43906,Hashim Amla,25,23,5,0,6,True,0,0,0,0,0,5,2,0,False,,False,False,5.8,0,30,0,0,0,1,1,0,29
four,3,South Africa,8,Sri Lanka,1st innings,4,short on off stump and this one sits up - none of the steep bounce we've seen so far - and Amla swivels to pull it away to the backward square leg boundary,"Kumara to Amla, FOUR runs",33/0,784375,Lahiru Kumara,0,13,0,2.1,20,49619,Suranga Lakmal,0,18,0,3.0,13,43906,Hashim Amla,29,24,6,0,379143,Quinton de Kock,2,7,0,0,1,False,0,0,0,0,0,6,13,1,False,,False,False,6.38,0,31,0,0,0,1,1,0,33
four,3,South Africa,8,Sri Lanka,1st innings,4,"short again, a little further outside off, and Amla puts this away even more brilliantly, getting up off his toes and using his wrists to whip it away to the same backward square-leg boundary","Kumara to Amla, FOUR runs",37/0,784375,Lahiru Kumara,0,14,0,2.2,24,49619,Suranga Lakmal,0,18,0,3.0,13,43906,Hashim Amla,33,25,7,0,379143,Quinton de Kock,2,7,0,0,2,False,0,0,0,0,0,6,13,1,False,,False,False,6.93,0,32,0,0,0,1,1,0,37
four,3,South Africa,8,Sri Lanka,1st innings,4,"now he goes full and wide, and Amla flows into a beautiful drive, into the gap between cover point and extra-cover","Kumara to Amla, FOUR runs",41/0,784375,Lahiru Kumara,0,15,0,2.3,28,49619,Suranga Lakmal,0,18,0,3.0,13,43906,Hashim Amla,37,26,8,0,379143,Quinton de Kock,2,7,0,0,3,False,0,0,0,0,0,6,13,1,False,,False,False,7.45,0,33,0,0,0,1,1,0,41
no run,3,South Africa,8,Sri Lanka,1st innings,0,"back of a length close to off stump. Jumps up and looks to whip it into the leg side. The bounce ensures he can't play it to midwicket as intended, so he ends up keeping it down defensively, towards the non-striker","Kumara to Amla, no run",41/0,784375,Lahiru Kumara,0,16,0,2.4,28,49619,Suranga Lakmal,0,18,0,3.0,13,43906,Hashim Amla,37,27,8,0,379143,Quinton de Kock,2,7,0,0,4,False,0,0,0,0,0,6,13,1,False,,False,False,7.23,0,34,0,0,0,1,1,0,41
run,3,South Africa,8,Sri Lanka,1st innings,1,"back of a length on off stump, whipped away to deep square leg","Kumara to Amla, 1 run",42/0,784375,Lahiru Kumara,0,17,0,2.5,29,49619,Suranga Lakmal,0,18,0,3.0,13,43906,Hashim Amla,38,28,8,0,379143,Quinton de Kock,2,7,0,0,5,False,0,0,0,0,0,6,13,1,False,,False,False,7.2,0,35,0,0,0,1,1,0,42
out,3,South Africa,8,Sri Lanka,1st innings,0,"gone! De Kock has looked uneasy so far, and he gets out to a poor shot. A good length ball slanting across him. It's around the line of off stump when he meets it, looking to hit it against the angle over mid-on. Ends up getting a big edge on it, and man at backward point takes the high catch, backtracking and running to his right","Kumara to de Kock, OUT",42/1,784375,Lahiru Kumara,0,18,1,3.0,29,49619,Suranga Lakmal,0,18,0,3.0,13,379143,Quinton de Kock,2,8,0,0,43906,Hashim Amla,38,28,8,0,6,True,0,0,0,0,0,6,13,1,True,caught,False,Q de Kock c MDKJ Perera b Kumara 2 (8b 0x4 0x6) SR: 25.00,7.0,0,36,0,1,0,1,1,0,42
no run,3,South Africa,8,Sri Lanka,1st innings,0,"some outswing from a good length outside off, left alone","Lakmal to Hendricks, no run",42/1,49619,Suranga Lakmal,0,19,0,3.1,13,784375,Lahiru Kumara,0,18,1,3.0,29,269280,Reeza Hendricks,0,1,0,0,43906,Hashim Amla,38,28,8,0,1,False,0,0,0,0,0,7,6,0,False,,False,False,6.81,0,37,0,1,0,1,1,0,42
four,3,South Africa,8,Sri Lanka,1st innings,4,"overpitched, and Reeza is off the mark with a lovely drive to the left of cover point","Lakmal to Hendricks, FOUR runs",46/1,49619,Suranga Lakmal,0,20,0,3.2,17,784375,Lahiru Kumara,0,18,1,3.0,29,269280,Reeza Hendricks,4,2,1,0,43906,Hashim Amla,38,28,8,0,2,False,0,0,0,0,0,7,6,0,False,,False,False,7.26,0,38,0,1,0,1,1,0,46
run,3,South Africa,8,Sri Lanka,1st innings,2,"back of a length outside off, punched hard into the ground and it bounces up over the jumping backward point fielder","Lakmal to Hendricks, 2 runs",48/1,49619,Suranga Lakmal,0,21,0,3.3,19,784375,Lahiru Kumara,0,18,1,3.0,29,269280,Reeza Hendricks,6,3,1,0,43906,Hashim Amla,38,28,8,0,3,False,0,0,0,0,0,7,6,0,False,,False,False,7.38,0,39,0,1,0,1,1,0,48
no run,3,South Africa,8,Sri Lanka,1st innings,0,"back of a length, close to off stump with some outswing. Left alone","Lakmal to Hendricks, no run",48/1,49619,Suranga Lakmal,0,22,0,3.4,19,784375,Lahiru Kumara,0,18,1,3.0,29,269280,Reeza Hendricks,6,4,1,0,43906,Hashim Amla,38,28,8,0,4,False,0,0,0,0,0,7,6,0,False,,False,False,7.2,0,40,0,1,0,1,1,0,48
no run,3,South Africa,8,Sri Lanka,1st innings,0,"good ball. Angling in from a little wider on the crease and leaving Hendricks from the fifth-stump line. He thinks about defending, then changes his mind and leaves at the last moment. Good carry too","Lakmal to Hendricks, no run",48/1,49619,Suranga Lakmal,0,23,0,3.5,19,784375,Lahiru Kumara,0,18,1,3.0,29,269280,Reeza Hendricks,6,5,1,0,43906,Hashim Amla,38,28,8,0,5,False,0,0,0,0,0,7,6,0,False,,False,False,7.02,0,41,0,1,0,1,1,0,48
no run,3,South Africa,8,Sri Lanka,1st innings,0,"back of a length, a little wider, and Hendricks plays and misses, slashing uncertainly, looking for the late cut","Lakmal to Hendricks, no run",48/1,49619,Suranga Lakmal,0,24,0,4.0,19,784375,Lahiru Kumara,0,18,1,3.0,29,269280,Reeza Hendricks,6,6,1,0,43906,Hashim Amla,38,28,8,0,6,True,0,0,0,0,0,7,6,0,False,,False,False,6.85,0,42,0,1,0,1,1,0,48
run,3,South Africa,8,Sri Lanka,1st innings,1,"short and wide and Amla is a little late on his back-foot slap. Good pace from Kumara there. Ends up hitting it in the air, but on the bounce, to third man, off the toe end of the bat","Kumara to Amla, 1 run",49/1,784375,Lahiru Kumara,0,19,1,3.1,30,49619,Suranga Lakmal,0,24,0,4.0,19,43906,Hashim Amla,39,29,8,0,269280,Reeza Hendricks,6,6,1,0,1,False,0,0,0,0,0,8,3,0,False,,False,False,6.83,0,43,0,1,0,1,1,0,49
no run,3,South Africa,8,Sri Lanka,1st innings,0,"shortish, angling in to cramp Hendricks as he gets on his toes to try and punch into the covers. Ends up defending it instead","Kumara to Hendricks, no run",49/1,784375,Lahiru Kumara,0,20,1,3.2,30,49619,Suranga Lakmal,0,24,0,4.0,19,269280,Reeza Hendricks,6,7,1,0,43906,Hashim Amla,39,29,8,0,2,False,0,0,0,0,0,8,3,0,False,,False,False,6.68,0,44,0,1,0,1,1,0,49
no run,3,South Africa,8,Sri Lanka,1st innings,0,"full, angling into off and middle. Clipped to mid-on","Kumara to Hendricks, no run",49/1,784375,Lahiru Kumara,0,21,1,3.3,30,49619,Suranga Lakmal,0,24,0,4.0,19,269280,Reeza Hendricks,6,8,1,0,43906,Hashim Amla,39,29,8,0,3,False,0,0,0,0,0,8,3,0,False,,False,False,6.53,0,45,0,1,0,1,1,0,49
no run,3,South Africa,8,Sri Lanka,1st innings,0,"shot! But no runs, a back-of-a-length ball offering some width, and he punches forcefully but straight to Akila at cover point","Kumara to Hendricks, no run",49/1,784375,Lahiru Kumara,0,22,1,3.4,30,49619,Suranga Lakmal,0,24,0,4.0,19,269280,Reeza Hendricks,6,9,1,0,43906,Hashim Amla,39,29,8,0,4,False,0,0,0,0,0,8,3,0,False,,False,False,6.39,0,46,0,1,0,1,1,0,49
run,3,South Africa,8,Sri Lanka,1st innings,1,"short now, angling into off stump. Hits the inside half of the bat as he defends off the back foot and they pick up a quick single as the ball rolls gently into the leg side","Kumara to Hendricks, 1 run",50/1,784375,Lahiru Kumara,0,23,1,3.5,31,49619,Suranga Lakmal,0,24,0,4.0,19,269280,Reeza Hendricks,7,10,1,0,43906,Hashim Amla,39,29,8,0,5,False,0,0,0,0,0,8,3,0,False,,False,False,6.38,0,47,0,1,0,1,1,0,50
run,3,South Africa,8,Sri Lanka,1st innings,1,"shortish outside off, jumps across and dabs it to third man","Kumara to Amla, 1 run",51/1,784375,Lahiru Kumara,0,24,1,4.0,32,49619,Suranga Lakmal,0,24,0,4.0,19,43906,Hashim Amla,40,30,8,0,269280,Reeza Hendricks,7,10,1,0,6,True,0,0,0,0,0,8,3,0,False,,False,False,6.37,0,48,0,1,0,1,1,0,51
no run,3,South Africa,8,Sri Lanka,1st innings,0,length ball in the fourth-stump channel with a bit of gentle shape away. Left alone,"Lakmal to Amla, no run",51/1,49619,Suranga Lakmal,0,25,0,4.1,19,784375,Lahiru Kumara,0,24,1,4.0,32,43906,Hashim Amla,40,31,8,0,269280,Reeza Hendricks,7,10,1,0,1,False,1,0,0,0,0,9,0,0,False,,False,False,6.24,0,49,0,1,0,1,1,0,51
no run,3,South Africa,8,Sri Lanka,1st innings,0,"back of a length, slightly wider. Amla leaves again","Lakmal to Amla, no run",51/1,49619,Suranga Lakmal,0,26,0,4.2,19,784375,Lahiru Kumara,0,24,1,4.0,32,43906,Hashim Amla,40,32,8,0,269280,Reeza Hendricks,7,10,1,0,2,False,1,0,0,0,0,9,0,0,False,,False,False,6.12,0,50,0,1,0,1,1,0,51
no run,3,South Africa,8,Sri Lanka,1st innings,0,"back of a length close to off stump, defended into the covers","Lakmal to Amla, no run",51/1,49619,Suranga Lakmal,0,27,0,4.3,19,784375,Lahiru Kumara,0,24,1,4.0,32,43906,Hashim Amla,40,33,8,0,269280,Reeza Hendricks,7,10,1,0,3,False,1,0,0,0,0,9,0,0,False,,False,False,6.0,0,51,0,1,0,1,1,0,51
no run,3,South Africa,8,Sri Lanka,1st innings,0,"back of a length outside off, defended to backward point with soft hands","Lakmal to Amla, no run",51/1,49619,Suranga Lakmal,0,28,0,4.4,19,784375,Lahiru Kumara,0,24,1,4.0,32,43906,Hashim Amla,40,34,8,0,269280,Reeza Hendricks,7,10,1,0,4,False,1,0,0,0,0,9,0,0,False,,False,False,5.88,0,52,0,1,0,1,1,0,51
no run,3,South Africa,8,Sri Lanka,1st innings,0,"fuller now, not quite full enough for the forceful drive. Gets on the front foot for the checked drive to mid-off","Lakmal to Amla, no run",51/1,49619,Suranga Lakmal,0,29,0,4.5,19,784375,Lahiru Kumara,0,24,1,4.0,32,43906,Hashim Amla,40,35,8,0,269280,Reeza Hendricks,7,10,1,0,5,False,1,0,0,0,0,9,0,0,False,,False,False,5.77,0,53,0,1,0,1,1,0,51
no run,3,South Africa,8,Sri Lanka,1st innings,0,"back of a length close to off stump, punched to extra-cover","Lakmal to Amla, no run",51/1,49619,Suranga Lakmal,1,30,0,5.0,19,784375,Lahiru Kumara,0,24,1,4.0,32,43906,Hashim Amla,40,36,8,0,269280,Reeza Hendricks,7,10,1,0,6,True,1,0,0,0,0,9,0,0,False,,False,False,5.66,0,54,0,1,0,1,1,0,51
no run,3,South Africa,8,Sri Lanka,1st innings,0,"tossed up outside off, the offbreak first up, defended to short extra-cover","Dananjaya to Hendricks, no run",51/1,574178,Akila Dananjaya,0,1,0,0.1,0,49619,Suranga Lakmal,1,30,0,5.0,19,269280,Reeza Hendricks,7,11,1,0,43906,Hashim Amla,40,36,8,0,1,False,0,0,0,0,0,10,13,0,False,,False,False,5.56,0,55,0,1,0,1,1,0,51
run,3,South Africa,8,Sri Lanka,1st innings,3,"nice flight, a little wider, gets a positive stride in to drive against the turn, to the left of the diving extra-cover fielder","Dananjaya to Hendricks, 3 runs",54/1,574178,Akila Dananjaya,0,2,0,0.2,3,49619,Suranga Lakmal,1,30,0,5.0,19,269280,Reeza Hendricks,10,12,1,0,43906,Hashim Amla,40,36,8,0,2,False,0,0,0,0,0,10,13,0,False,,False,False,5.78,0,56,0,1,0,1,1,0,54
no run,3,South Africa,8,Sri Lanka,1st innings,0,"looped up once more, closer to off stump this time, stretches out to defend it back to the bowler","Dananjaya to Amla, no run",54/1,574178,Akila Dananjaya,0,3,0,0.3,3,49619,Suranga Lakmal,1,30,0,5.0,19,43906,Hashim Amla,40,37,8,0,269280,Reeza Hendricks,10,12,1,0,3,False,0,0,0,0,0,10,13,0,False,,False,False,5.68,0,57,0,1,0,1,1,0,54
six,3,South Africa,8,Sri Lanka,1st innings,6,"shot! Down the track, lovely quick feet as he sees some flight once again, on off stump. Makes a bit of room to hit it back over the bowler's head. Didn't look to hit that too hard, just lovely flow of his hands","Dananjaya to Amla, SIX runs",60/1,574178,Akila Dananjaya,0,4,0,0.4,9,49619,Suranga Lakmal,1,30,0,5.0,19,43906,Hashim Amla,46,38,8,1,269280,Reeza Hendricks,10,12,1,0,4,False,0,0,0,0,0,10,13,0,False,,False,False,6.2,0,58,0,1,0,1,1,0,60
four,3,South Africa,8,Sri Lanka,1st innings,4,"short now, on off stump, and he rocks back to cut it away to the left of the diving cover point fielder. Brings up his fifty as well. Super innings so far","Dananjaya to Amla, FOUR runs",64/1,574178,Akila Dananjaya,0,5,0,0.5,13,49619,Suranga Lakmal,1,30,0,5.0,19,43906,Hashim Amla,50,39,9,1,269280,Reeza Hendricks,10,12,1,0,5,False,0,0,0,0,0,10,13,0,False,,False,False,6.5,0,59,0,1,0,1,1,0,64
no run,3,South Africa,8,Sri Lanka,1st innings,0,"good length now, just outside off. Gets on the front foot and clips with the turn to midwicket","Dananjaya to Amla, no run",64/1,574178,Akila Dananjaya,0,6,0,1.0,13,49619,Suranga Lakmal,1,30,0,5.0,19,43906,Hashim Amla,50,40,9,1,269280,Reeza Hendricks,10,12,1,0,6,True,0,0,0,0,0,10,13,0,False,,False,False,6.4,0,60,0,1,0,1,1,0,64
