PlayType_description,Batting_Team_id,Batting_Team_name,Bowling_Team_id,Bowling_Team_name,Innings,Total_Runs_on_delivery,Commentary,Commentary_short,Score,Bowler_id,Bowler_name,Bowler_maiden,Bowler_balls,Bowler_wickets,Bowler_over,Bowler_conceded,Other_Bowler_id,Other_Bowler_name,Other_Bowler_maidens,Other_Bowler_balls,Other_Bowler_wickets,Other_Bowler_overs,Other_Bowler_conceded,Batsman_id,Batsman_name,Batsman_runs,Batsman_balls_faced,Batsman_four,Batsman_sixes,Other_Batsman_id,Other_Batsman_name,Other_Batsman_runs,Other_Batsman_balls_faced,Other_Batsman_four,Other_Batsman_sixes,Over_ball,Over_complete,Over_maiden,Over_no_Ball,Over_wide,Over_byes,Over_leg_byes,Over_number,Over_runs,Over_wickets,Dismissal_is_true,Dismissal_type,Dismissal_fielder_iskeeper,Dismissal_text,Innings_run_rate,Innings_byes,Innings_balls,Innings_no_balls,Innings_wickets,Innings_leg_byes,Innings_session,Innings_day,Innings_wides,Innings_runs
no run,8,Sri Lanka,3,South Africa,2nd innings,0,"back of a length on off stump, shuffles across to clip to midwicket","Ngidi to de Silva, no run",0,542023,Lungi Ngidi,0,30,3,5.0,46,379145,Tabraiz Shamsi,0,6,0,1.0,7,465793,Dhananjaya de Silva,0,3,0,0,49764,Angelo Mathews,18,25,1,1,8,True,0,0,0,0,0,20,6,1,False,,False,False,6.3,0,120,0,5,0,1,1,0,126
run,8,Sri Lanka,3,South Africa,2nd innings,1,"floated up slow outside off, driven to long-off","Shamsi to Mathews, 1 run",0,379145,Tabraiz Shamsi,0,7,0,1.1,8,542023,Lungi Ngidi,0,30,3,5.0,46,49764,Angelo Mathews,19,26,1,1,465793,Dhananjaya de Silva,0,3,0,0,1,False,0,0,0,0,0,21,4,0,False,,False,False,6.29,0,121,0,5,0,1,1,0,127
no run,8,Sri Lanka,3,South Africa,2nd innings,0,"dips onto a good length on off stump, defended with the turn to midwicket","Shamsi to de Silva, no run",0,379145,Tabraiz Shamsi,0,8,0,1.2,8,542023,Lungi Ngidi,0,30,3,5.0,46,465793,Dhananjaya de Silva,0,4,0,0,49764,Angelo Mathews,19,26,1,1,2,False,0,0,0,0,0,21,4,0,False,,False,False,6.24,0,122,0,5,0,1,1,0,127
run,8,Sri Lanka,3,South Africa,2nd innings,2,"back of a length, turning from middle to leg. Goes deep in his crease to work it to long leg, past the diving leg gully fielder","Shamsi to de Silva, 2 runs",0,379145,Tabraiz Shamsi,0,9,0,1.3,10,542023,Lungi Ngidi,0,30,3,5.0,46,465793,Dhananjaya de Silva,2,5,0,0,49764,Angelo Mathews,19,26,1,1,3,False,0,0,0,0,0,21,4,0,False,,False,False,6.29,0,123,0,5,0,1,1,0,129
no run,8,Sri Lanka,3,South Africa,2nd innings,0,"tossed up fuller, stretches out to clip it back to the bowler","Shamsi to de Silva, no run",0,379145,Tabraiz Shamsi,0,10,0,1.4,10,542023,Lungi Ngidi,0,30,3,5.0,46,465793,Dhananjaya de Silva,2,6,0,0,49764,Angelo Mathews,19,26,1,1,4,False,0,0,0,0,0,21,4,0,False,,False,False,6.24,0,124,0,5,0,1,1,0,129
no run,8,Sri Lanka,3,South Africa,2nd innings,0,"full outside off, driven to long-off","Shamsi to de Silva, no run",0,379145,Tabraiz Shamsi,0,11,0,1.5,10,542023,Lungi Ngidi,0,30,3,5.0,46,465793,Dhananjaya de Silva,2,7,0,0,49764,Angelo Mathews,19,26,1,1,5,False,0,0,0,0,0,21,4,0,False,,False,False,6.19,0,125,0,5,0,1,1,0,129
run,8,Sri Lanka,3,South Africa,2nd innings,1,"short, googly spinning away from off stump, slapped away to deep point","Shamsi to de Silva, 1 run",0,379145,Tabraiz Shamsi,0,12,0,2.0,11,542023,Lungi Ngidi,0,30,3,5.0,46,465793,Dhananjaya de Silva,3,8,0,0,49764,Angelo Mathews,19,26,1,1,6,True,0,0,0,0,0,21,4,0,False,,False,False,6.19,0,126,0,5,0,1,1,0,130
no run,8,Sri Lanka,3,South Africa,2nd innings,0,"shortish, a bit of inward movement towards off stump. No room for an attacking shot and de Silva defends into the off side","Ngidi to de Silva, no run",0,542023,Lungi Ngidi,0,31,3,5.1,46,379145,Tabraiz Shamsi,0,12,0,2.0,11,465793,Dhananjaya de Silva,3,9,0,0,49764,Angelo Mathews,19,26,1,1,1,False,0,0,0,0,0,22,2,0,False,,False,False,6.14,0,127,0,5,0,1,1,0,130
run,8,Sri Lanka,3,South Africa,2nd innings,1,"short on middle stump, pulled to long leg","Ngidi to de Silva, 1 run",0,542023,Lungi Ngidi,0,32,3,5.2,47,379145,Tabraiz Shamsi,0,12,0,2.0,11,465793,Dhananjaya de Silva,4,10,0,0,49764,Angelo Mathews,19,26,1,1,2,False,0,0,0,0,0,22,2,0,False,,False,False,6.14,0,128,0,5,0,1,1,0,131
no run,8,Sri Lanka,3,South Africa,2nd innings,0,"fullish outside off, can't time his drive and it rolls slowly to short cover","Ngidi to Mathews, no run",0,542023,Lungi Ngidi,0,33,3,5.3,47,379145,Tabraiz Shamsi,0,12,0,2.0,11,49764,Angelo Mathews,19,27,1,1,465793,Dhananjaya de Silva,4,10,0,0,3,False,0,0,0,0,0,22,2,0,False,,False,False,6.09,0,129,0,5,0,1,1,0,131
no run,8,Sri Lanka,3,South Africa,2nd innings,0,"nicely timed, but too close to the fielder. Length ball, a bit of width, and Mathews drives on the up with an open face, and backward point moves quickly to his right to stop it","Ngidi to Mathews, no run",0,542023,Lungi Ngidi,0,34,3,5.4,47,379145,Tabraiz Shamsi,0,12,0,2.0,11,49764,Angelo Mathews,19,28,1,1,465793,Dhananjaya de Silva,4,10,0,0,4,False,0,0,0,0,0,22,2,0,False,,False,False,6.04,0,130,0,5,0,1,1,0,131
no run,8,Sri Lanka,3,South Africa,2nd innings,0,"slower ball, full and wide outside off. Mathews misses the flat-bat square drive, and Nigel Llong doesn't signal wide but possibly thought about it","Ngidi to Mathews, no run",0,542023,Lungi Ngidi,0,35,3,5.5,47,379145,Tabraiz Shamsi,0,12,0,2.0,11,49764,Angelo Mathews,19,29,1,1,465793,Dhananjaya de Silva,4,10,0,0,5,False,0,0,0,0,0,22,2,0,False,,False,False,6.0,0,131,0,5,0,1,1,0,131
run,8,Sri Lanka,3,South Africa,2nd innings,1,"short, angling into off and middle, pulled round to deep square leg","Ngidi to Mathews, 1 run",0,542023,Lungi Ngidi,0,36,3,6.0,48,379145,Tabraiz Shamsi,0,12,0,2.0,11,49764,Angelo Mathews,20,30,1,1,465793,Dhananjaya de Silva,4,10,0,0,6,True,0,0,0,0,0,22,2,0,False,,False,False,6.0,0,132,0,5,0,1,1,0,132
run,8,Sri Lanka,3,South Africa,2nd innings,1,"shortish outside off, slapped to the left of backward point","Shamsi to Mathews, 1 run",0,379145,Tabraiz Shamsi,0,13,0,2.1,12,542023,Lungi Ngidi,0,36,3,6.0,48,49764,Angelo Mathews,21,31,1,1,465793,Dhananjaya de Silva,4,10,0,0,1,False,0,0,0,0,0,23,6,0,False,,False,False,6.0,0,133,0,5,0,1,1,0,133
no run,8,Sri Lanka,3,South Africa,2nd innings,0,"on the pads, clipped to short fine leg","Shamsi to de Silva, no run",0,379145,Tabraiz Shamsi,0,14,0,2.2,12,542023,Lungi Ngidi,0,36,3,6.0,48,465793,Dhananjaya de Silva,4,11,0,0,49764,Angelo Mathews,21,31,1,1,2,False,0,0,0,0,0,23,6,0,False,,False,False,5.95,0,134,0,5,0,1,1,0,133
no run,8,Sri Lanka,3,South Africa,2nd innings,0,"back of a length, turns in towards leg stump. Steps across and tucks it to short fine leg","Shamsi to de Silva, no run",0,379145,Tabraiz Shamsi,0,15,0,2.3,12,542023,Lungi Ngidi,0,36,3,6.0,48,465793,Dhananjaya de Silva,4,12,0,0,49764,Angelo Mathews,21,31,1,1,3,False,0,0,0,0,0,23,6,0,False,,False,False,5.91,0,135,0,5,0,1,1,0,133
run,8,Sri Lanka,3,South Africa,2nd innings,1,"slower now, more flight, on middle stump. Looks to drive inside-out, through mid-off maybe, and ends up playing too early and dragging it through midwicket with a lot of bottom hand","Shamsi to de Silva, 1 run",0,379145,Tabraiz Shamsi,0,16,0,2.4,13,542023,Lungi Ngidi,0,36,3,6.0,48,465793,Dhananjaya de Silva,5,13,0,0,49764,Angelo Mathews,21,31,1,1,4,False,0,0,0,0,0,23,6,0,False,,False,False,5.91,0,136,0,5,0,1,1,0,134
no run,8,Sri Lanka,3,South Africa,2nd innings,0,"quicker one, not short enough to go back and whip through midwicket. Turns in quickly and hits him on the back pad, but strikes him outside the line of off stump","Shamsi to Mathews, no run",0,379145,Tabraiz Shamsi,0,17,0,2.5,13,542023,Lungi Ngidi,0,36,3,6.0,48,49764,Angelo Mathews,21,32,1,1,465793,Dhananjaya de Silva,5,13,0,0,5,False,0,0,0,0,0,23,6,0,False,,False,False,5.86,0,137,0,5,0,1,1,0,134
four,8,Sri Lanka,3,South Africa,2nd innings,4,"loopy full-toss, and Mathews is quick to get on the front foot and swipe that away, one bounce, to the midwicket boundary","Shamsi to Mathews, FOUR runs",0,379145,Tabraiz Shamsi,0,18,0,3.0,17,542023,Lungi Ngidi,0,36,3,6.0,48,49764,Angelo Mathews,25,33,2,1,465793,Dhananjaya de Silva,5,13,0,0,6,True,0,0,0,0,0,23,6,0,False,,False,False,6.0,0,138,0,5,0,1,1,0,138
no run,8,Sri Lanka,3,South Africa,2nd innings,0,"back of a length close to off stump, defended towards backward point","Ngidi to de Silva, no run",0,542023,Lungi Ngidi,0,37,3,6.1,48,379145,Tabraiz Shamsi,0,18,0,3.0,17,465793,Dhananjaya de Silva,5,14,0,0,49764,Angelo Mathews,25,33,2,1,1,False,0,0,0,0,0,24,6,0,False,,False,False,5.95,0,139,0,5,0,1,1,0,138
four,8,Sri Lanka,3,South Africa,2nd innings,4,"shot! Length ball outside off, and he uses the hitting room to flat-bat that, on the up, between extra-cover and mid-off","Ngidi to de Silva, FOUR runs",0,542023,Lungi Ngidi,0,38,3,6.2,52,379145,Tabraiz Shamsi,0,18,0,3.0,17,465793,Dhananjaya de Silva,9,15,1,0,49764,Angelo Mathews,25,33,2,1,2,False,0,0,0,0,0,24,6,0,False,,False,False,6.08,0,140,0,5,0,1,1,0,142
run,8,Sri Lanka,3,South Africa,2nd innings,1,"length ball outside off, a touch shorter than the previous one. Presses forward and dabs with an open face to third man","Ngidi to de Silva, 1 run",0,542023,Lungi Ngidi,0,39,3,6.3,53,379145,Tabraiz Shamsi,0,18,0,3.0,17,465793,Dhananjaya de Silva,10,16,1,0,49764,Angelo Mathews,25,33,2,1,3,False,0,0,0,0,0,24,6,0,False,,False,False,6.08,0,141,0,5,0,1,1,0,143
no run,8,Sri Lanka,3,South Africa,2nd innings,0,"ooh, looks for the off-stump yorker, and nearly sneaks through as Mathews makes room for the inside-out cover drive. He's lucky he makes just enough contact to dig it out back to the bowler","Ngidi to Mathews, no run",0,542023,Lungi Ngidi,0,40,3,6.4,53,379145,Tabraiz Shamsi,0,18,0,3.0,17,49764,Angelo Mathews,25,34,2,1,465793,Dhananjaya de Silva,10,16,1,0,4,False,0,0,0,0,0,24,6,0,False,,False,False,6.04,0,142,0,5,0,1,1,0,143
no run,8,Sri Lanka,3,South Africa,2nd innings,0,"full outside off, driven to short cover","Ngidi to Mathews, no run",0,542023,Lungi Ngidi,0,41,3,6.5,53,379145,Tabraiz Shamsi,0,18,0,3.0,17,49764,Angelo Mathews,25,35,2,1,465793,Dhananjaya de Silva,10,16,1,0,5,False,0,0,0,0,0,24,6,0,False,,False,False,6.0,0,143,0,5,0,1,1,0,143
run,8,Sri Lanka,3,South Africa,2nd innings,1,"back of a length on off stump, clipped to deep square leg","Ngidi to Mathews, 1 run",0,542023,Lungi Ngidi,0,42,3,7.0,54,379145,Tabraiz Shamsi,0,18,0,3.0,17,49764,Angelo Mathews,26,36,2,1,465793,Dhananjaya de Silva,10,16,1,0,6,True,0,0,0,0,0,24,6,0,False,,False,False,6.0,0,144,0,5,0,1,1,0,144
four,8,Sri Lanka,3,South Africa,2nd innings,4,"down the track, meets this flighted off-stump ball on the full, and powers it back down the ground, into the boundary to the right of long-off","Shamsi to Mathews, FOUR runs",0,379145,Tabraiz Shamsi,0,19,0,3.1,21,542023,Lungi Ngidi,0,42,3,7.0,54,49764,Angelo Mathews,30,37,3,1,465793,Dhananjaya de Silva,10,16,1,0,1,False,0,0,0,0,0,25,6,0,False,,False,False,6.12,0,145,0,5,0,1,1,0,148
run,8,Sri Lanka,3,South Africa,2nd innings,1,"another loopy full-toss, this time wider outside off, swept hard and along the ground to deep midwicket","Shamsi to Mathews, 1 run",0,379145,Tabraiz Shamsi,0,20,0,3.2,22,542023,Lungi Ngidi,0,42,3,7.0,54,49764,Angelo Mathews,31,38,3,1,465793,Dhananjaya de Silva,10,16,1,0,2,False,0,0,0,0,0,25,6,0,False,,False,False,6.12,0,146,0,5,0,1,1,0,149
no run,8,Sri Lanka,3,South Africa,2nd innings,0,"googly, short enough to read it off the pitch and defend in front of off stump","Shamsi to de Silva, no run",0,379145,Tabraiz Shamsi,0,21,0,3.3,22,542023,Lungi Ngidi,0,42,3,7.0,54,465793,Dhananjaya de Silva,10,17,1,0,49764,Angelo Mathews,31,38,3,1,3,False,0,0,0,0,0,25,6,0,False,,False,False,6.08,0,147,0,5,0,1,1,0,149
no run,8,Sri Lanka,3,South Africa,2nd innings,0,"the stock ball, turning into his pads. Clipped to short fine leg. Sri Lanka haven't quite managed to beat that fielder yet","Shamsi to de Silva, no run",0,379145,Tabraiz Shamsi,0,22,0,3.4,22,542023,Lungi Ngidi,0,42,3,7.0,54,465793,Dhananjaya de Silva,10,18,1,0,49764,Angelo Mathews,31,38,3,1,4,False,0,0,0,0,0,25,6,0,False,,False,False,6.04,0,148,0,5,0,1,1,0,149
no run,8,Sri Lanka,3,South Africa,2nd innings,0,"tossed up on leg stump, gets on the front foot and clips to midwicket","Shamsi to de Silva, no run",0,379145,Tabraiz Shamsi,0,23,0,3.5,22,542023,Lungi Ngidi,0,42,3,7.0,54,465793,Dhananjaya de Silva,10,19,1,0,49764,Angelo Mathews,31,38,3,1,5,False,0,0,0,0,0,25,6,0,False,,False,False,6.0,0,149,0,5,0,1,1,0,149
run,8,Sri Lanka,3,South Africa,2nd innings,1,"back of a length on leg stump, clipped to deep square leg","Shamsi to de Silva, 1 run",0,379145,Tabraiz Shamsi,0,24,0,4.0,23,542023,Lungi Ngidi,0,42,3,7.0,54,465793,Dhananjaya de Silva,11,20,1,0,49764,Angelo Mathews,31,38,3,1,6,True,0,0,0,0,0,25,6,0,False,,False,False,6.0,0,150,0,5,0,1,1,0,150
no run,8,Sri Lanka,3,South Africa,2nd innings,0,"fullish, angling into off stump. Drives a little early, aiming for mid-off, ends up playing it to midwicket off the inside half of the bat","Mulder to de Silva, no run",0,698189,Wiaan Mulder,0,19,1,3.1,15,379145,Tabraiz Shamsi,0,24,0,4.0,23,465793,Dhananjaya de Silva,11,21,1,0,49764,Angelo Mathews,31,38,3,1,1,False,0,0,0,0,0,26,5,0,False,,False,False,5.96,0,151,0,5,0,1,1,0,150
no run,8,Sri Lanka,3,South Africa,2nd innings,0,"slower ball, shortish outside off. Pulls hard but straight to midwicket. Dhananjaya hasn't really been finding the gaps so far","Mulder to de Silva, no run",0,698189,Wiaan Mulder,0,20,1,3.2,15,379145,Tabraiz Shamsi,0,24,0,4.0,23,465793,Dhananjaya de Silva,11,22,1,0,49764,Angelo Mathews,31,38,3,1,2,False,0,0,0,0,0,26,5,0,False,,False,False,5.92,0,152,0,5,0,1,1,0,150
run,8,Sri Lanka,3,South Africa,2nd innings,1,"short again, comes in towards middle stump. Swivels to pull to the left of long leg","Mulder to de Silva, 1 run",0,698189,Wiaan Mulder,0,21,1,3.3,16,379145,Tabraiz Shamsi,0,24,0,4.0,23,465793,Dhananjaya de Silva,12,23,1,0,49764,Angelo Mathews,31,38,3,1,3,False,0,0,0,0,0,26,5,0,False,,False,False,5.92,0,153,0,5,0,1,1,0,151
run,8,Sri Lanka,3,South Africa,2nd innings,1,"full on middle stump, clipped to deep midwicket","Mulder to Mathews, 1 run",0,698189,Wiaan Mulder,0,22,1,3.4,17,379145,Tabraiz Shamsi,0,24,0,4.0,23,49764,Angelo Mathews,32,39,3,1,465793,Dhananjaya de Silva,12,23,1,0,4,False,0,0,0,0,0,26,5,0,False,,False,False,5.92,0,154,0,5,0,1,1,0,152
wide,8,Sri Lanka,3,South Africa,2nd innings,1,"short, angling way down the leg side, left alone","Mulder to de Silva, 1 wide",0,698189,Wiaan Mulder,0,22,1,3.4,18,379145,Tabraiz Shamsi,0,24,0,4.0,23,465793,Dhananjaya de Silva,12,23,1,0,49764,Angelo Mathews,32,39,3,1,5,False,0,0,1,0,0,26,5,0,False,,False,False,5.96,0,154,0,5,0,1,1,1,153
run,8,Sri Lanka,3,South Africa,2nd innings,2,"full on the pads, clipped away nicely and long leg has to throw himself to his right after a big sprint to cut that off. Phehlukwayo the fielder, does a fine job of keeping it down to two","Mulder to de Silva, 2 runs",0,698189,Wiaan Mulder,0,23,1,3.5,20,379145,Tabraiz Shamsi,0,24,0,4.0,23,465793,Dhananjaya de Silva,14,24,1,0,49764,Angelo Mathews,32,39,3,1,6,False,0,0,0,0,0,26,5,0,False,,False,False,6.0,0,155,0,5,0,1,1,0,155
no run,8,Sri Lanka,3,South Africa,2nd innings,0,"back of a length on off stump, defended into the on side, with the angle","Mulder to de Silva, no run",0,698189,Wiaan Mulder,0,24,1,4.0,20,379145,Tabraiz Shamsi,0,24,0,4.0,23,465793,Dhananjaya de Silva,14,25,1,0,49764,Angelo Mathews,32,39,3,1,7,True,0,0,0,0,0,26,5,0,False,,False,False,5.96,0,156,0,5,0,1,1,0,155
no run,8,Sri Lanka,3,South Africa,2nd innings,0,"flighted and full on middle stump, jabbed back to the bowler","Shamsi to Mathews, no run",0,379145,Tabraiz Shamsi,0,25,0,4.1,23,698189,Wiaan Mulder,0,24,1,4.0,20,49764,Angelo Mathews,32,40,3,1,465793,Dhananjaya de Silva,14,25,1,0,1,False,0,0,0,0,0,27,1,1,False,,False,False,5.92,0,157,0,5,0,1,1,0,155
no run,8,Sri Lanka,3,South Africa,2nd innings,0,"back of a length, turns into the pads, clipped to backward square leg","Shamsi to Mathews, no run",0,379145,Tabraiz Shamsi,0,26,0,4.2,23,698189,Wiaan Mulder,0,24,1,4.0,20,49764,Angelo Mathews,32,41,3,1,465793,Dhananjaya de Silva,14,25,1,0,2,False,0,0,0,0,0,27,1,1,False,,False,False,5.88,0,158,0,5,0,1,1,0,155
out,8,Sri Lanka,3,South Africa,2nd innings,0,"big appeal for lbw as Mathews misses the sweep. Given out, but it seemed like it might have been going down leg. Mathews turns and begins walking back before realising he can review this... Finally decides to take the review. No bat on it, let's see what ball-tracking says... pitches on about middle stump, and it's turning just enough to clip the outside of leg stump. Umpire's call, and that means Mathews will have to walk back","Shamsi to Mathews, OUT",0,379145,Tabraiz Shamsi,0,27,1,4.3,23,698189,Wiaan Mulder,0,24,1,4.0,20,49764,Angelo Mathews,32,42,3,1,465793,Dhananjaya de Silva,14,25,1,0,3,False,0,0,0,0,0,27,1,1,True,leg before wicket,False,AD Mathews lbw b Shamsi 32 (42b 3x4 1x6) SR: 76.19,5.84,0,159,0,6,0,1,1,0,155
no run,8,Sri Lanka,3,South Africa,2nd innings,0,"floated up on middle and leg, clipped to square leg","Shamsi to Dananjaya, no run",0,379145,Tabraiz Shamsi,0,28,1,4.4,23,698189,Wiaan Mulder,0,24,1,4.0,20,574178,Akila Dananjaya,0,1,0,0,465793,Dhananjaya de Silva,14,25,1,0,4,False,0,0,0,0,0,27,1,1,False,,False,False,5.81,0,160,0,6,0,1,1,0,155
no run,8,Sri Lanka,3,South Africa,2nd innings,0,"full on middle stump, defended to midwicket","Shamsi to Dananjaya, no run",0,379145,Tabraiz Shamsi,0,29,1,4.5,23,698189,Wiaan Mulder,0,24,1,4.0,20,574178,Akila Dananjaya,0,2,0,0,465793,Dhananjaya de Silva,14,25,1,0,5,False,0,0,0,0,0,27,1,1,False,,False,False,5.77,0,161,0,6,0,1,1,0,155
run,8,Sri Lanka,3,South Africa,2nd innings,1,"tossed up on off stump, driven to long-off","Shamsi to Dananjaya, 1 run",0,379145,Tabraiz Shamsi,0,30,1,5.0,24,698189,Wiaan Mulder,0,24,1,4.0,20,574178,Akila Dananjaya,1,3,0,0,465793,Dhananjaya de Silva,14,25,1,0,6,True,0,0,0,0,0,27,1,1,False,,False,False,5.77,0,162,0,6,0,1,1,0,156
run,8,Sri Lanka,3,South Africa,2nd innings,1,"fullish outside off, driven to sweeper cover","Mulder to Dananjaya, 1 run",0,698189,Wiaan Mulder,0,25,1,4.1,21,379145,Tabraiz Shamsi,0,30,1,5.0,24,574178,Akila Dananjaya,2,4,0,0,465793,Dhananjaya de Silva,14,25,1,0,1,False,0,0,0,0,0,28,5,0,False,,False,False,5.77,0,163,0,6,0,1,1,0,157
no run,8,Sri Lanka,3,South Africa,2nd innings,0,"full on off stump, defended with the angle into the on side","Mulder to de Silva, no run",0,698189,Wiaan Mulder,0,26,1,4.2,21,379145,Tabraiz Shamsi,0,30,1,5.0,24,465793,Dhananjaya de Silva,14,26,1,0,574178,Akila Dananjaya,2,4,0,0,2,False,0,0,0,0,0,28,5,0,False,,False,False,5.74,0,164,0,6,0,1,1,0,157
run,8,Sri Lanka,3,South Africa,2nd innings,1,"back of a length on middle stump, clipped to deep square leg","Mulder to de Silva, 1 run",0,698189,Wiaan Mulder,0,27,1,4.3,22,379145,Tabraiz Shamsi,0,30,1,5.0,24,465793,Dhananjaya de Silva,15,27,1,0,574178,Akila Dananjaya,2,4,0,0,3,False,0,0,0,0,0,28,5,0,False,,False,False,5.74,0,165,0,6,0,1,1,0,158
run,8,Sri Lanka,3,South Africa,2nd innings,1,"back of a length outside off, steered past Duminy, diving left from backward point, with an open bat face","Mulder to Dananjaya, 1 run",0,698189,Wiaan Mulder,0,28,1,4.4,23,379145,Tabraiz Shamsi,0,30,1,5.0,24,574178,Akila Dananjaya,3,5,0,0,465793,Dhananjaya de Silva,15,27,1,0,4,False,0,0,0,0,0,28,5,0,False,,False,False,5.74,0,166,0,6,0,1,1,0,159
no run,8,Sri Lanka,3,South Africa,2nd innings,0,"back of a length, angling into off stump. Defended from the back foot, and the ball drops down onto the batsman's left foot","Mulder to de Silva, no run",0,698189,Wiaan Mulder,0,29,1,4.5,23,379145,Tabraiz Shamsi,0,30,1,5.0,24,465793,Dhananjaya de Silva,15,28,1,0,574178,Akila Dananjaya,3,5,0,0,5,False,0,0,0,0,0,28,5,0,False,,False,False,5.71,0,167,0,6,0,1,1,0,159
run,8,Sri Lanka,3,South Africa,2nd innings,2,"back of a length outside off, and that's beautiful timing, punched with a vertical bat to the right of deep point","Mulder to de Silva, 2 runs",0,698189,Wiaan Mulder,0,30,1,5.0,25,379145,Tabraiz Shamsi,0,30,1,5.0,24,465793,Dhananjaya de Silva,17,29,1,0,574178,Akila Dananjaya,3,5,0,0,6,True,0,0,0,0,0,28,5,0,False,,False,False,5.75,0,168,0,6,0,1,1,0,161
no run,8,Sri Lanka,3,South Africa,2nd innings,0,"tossed up slow on leg stump, driven to mid-on","Shamsi to Dananjaya, no run",0,379145,Tabraiz Shamsi,0,31,1,5.1,24,698189,Wiaan Mulder,0,30,1,5.0,25,574178,Akila Dananjaya,3,6,0,0,465793,Dhananjaya de Silva,17,29,1,0,1,False,0,0,0,0,0,29,10,0,False,,False,False,5.71,0,169,0,6,0,1,1,0,161
four,8,Sri Lanka,3,South Africa,2nd innings,4,"short, wide, slapped away to the left of backward point","Shamsi to Dananjaya, FOUR runs",0,379145,Tabraiz Shamsi,0,32,1,5.2,28,698189,Wiaan Mulder,0,30,1,5.0,25,574178,Akila Dananjaya,7,7,1,0,465793,Dhananjaya de Silva,17,29,1,0,2,False,0,0,0,0,0,29,10,0,False,,False,False,5.82,0,170,0,6,0,1,1,0,165
run,8,Sri Lanka,3,South Africa,2nd innings,1,"full outside off, driven to long-off","Shamsi to Dananjaya, 1 run",0,379145,Tabraiz Shamsi,0,33,1,5.3,29,698189,Wiaan Mulder,0,30,1,5.0,25,574178,Akila Dananjaya,8,8,1,0,465793,Dhananjaya de Silva,17,29,1,0,3,False,0,0,0,0,0,29,10,0,False,,False,False,5.82,0,171,0,6,0,1,1,0,166
four,8,Sri Lanka,3,South Africa,2nd innings,4,"tossed up slow and wide of off and Dhananjaya gets down on one knee and drives in the air, deliberately, to the left of extra-cover","Shamsi to de Silva, FOUR runs",0,379145,Tabraiz Shamsi,0,34,1,5.4,33,698189,Wiaan Mulder,0,30,1,5.0,25,465793,Dhananjaya de Silva,21,30,2,0,574178,Akila Dananjaya,8,8,1,0,4,False,0,0,0,0,0,29,10,0,False,,False,False,5.93,0,172,0,6,0,1,1,0,170
no run,8,Sri Lanka,3,South Africa,2nd innings,0,"floated up on off stump, clipped to midwicket","Shamsi to de Silva, no run",0,379145,Tabraiz Shamsi,0,35,1,5.5,33,698189,Wiaan Mulder,0,30,1,5.0,25,465793,Dhananjaya de Silva,21,31,2,0,574178,Akila Dananjaya,8,8,1,0,5,False,0,0,0,0,0,29,10,0,False,,False,False,5.89,0,173,0,6,0,1,1,0,170
run,8,Sri Lanka,3,South Africa,2nd innings,1,"back of a length on leg stump, goes back and works it to deep square leg","Shamsi to de Silva, 1 run",0,379145,Tabraiz Shamsi,0,36,1,6.0,34,698189,Wiaan Mulder,0,30,1,5.0,25,465793,Dhananjaya de Silva,22,32,2,0,574178,Akila Dananjaya,8,8,1,0,6,True,0,0,0,0,0,29,10,0,False,,False,False,5.89,0,174,0,6,0,1,1,0,171
run,8,Sri Lanka,3,South Africa,2nd innings,2,"short, angling down leg, pulled to the left of long leg and Phehlukwayo does good work, at first, to put in the diving save, before losing control of the ball and almost letting it roll to the boundary, before mopping up once more","Mulder to de Silva, 2 runs",0,698189,Wiaan Mulder,0,31,1,5.1,27,379145,Tabraiz Shamsi,0,36,1,6.0,34,465793,Dhananjaya de Silva,24,33,2,0,574178,Akila Dananjaya,8,8,1,0,1,False,0,0,0,0,0,30,9,0,False,,False,False,5.93,0,175,0,6,0,1,1,0,173
run,8,Sri Lanka,3,South Africa,2nd innings,1,"length ball outside off, punched pleasingly on the up to deep point","Mulder to de Silva, 1 run",0,698189,Wiaan Mulder,0,32,1,5.2,28,379145,Tabraiz Shamsi,0,36,1,6.0,34,465793,Dhananjaya de Silva,25,34,2,0,574178,Akila Dananjaya,8,8,1,0,2,False,0,0,0,0,0,30,9,0,False,,False,False,5.93,0,176,0,6,0,1,1,0,174
no run,8,Sri Lanka,3,South Africa,2nd innings,0,"back of a length on off stump. Wanted to punch that through cover, ended up hitting it back towards the bowler off the inside half of his bat","Mulder to Dananjaya, no run",0,698189,Wiaan Mulder,0,33,1,5.3,28,379145,Tabraiz Shamsi,0,36,1,6.0,34,574178,Akila Dananjaya,8,9,1,0,465793,Dhananjaya de Silva,25,34,2,0,3,False,0,0,0,0,0,30,9,0,False,,False,False,5.89,0,177,0,6,0,1,1,0,174
four,8,Sri Lanka,3,South Africa,2nd innings,4,"full on off stump, the angle across him gives him an extra bit of room and he uses that to free his arms and loft this over wide mid-off","Mulder to Dananjaya, FOUR runs",0,698189,Wiaan Mulder,0,34,1,5.4,32,379145,Tabraiz Shamsi,0,36,1,6.0,34,574178,Akila Dananjaya,12,10,2,0,465793,Dhananjaya de Silva,25,34,2,0,4,False,0,0,0,0,0,30,9,0,False,,False,False,6.0,0,178,0,6,0,1,1,0,178
no run,8,Sri Lanka,3,South Africa,2nd innings,0,length ball slanting across to off stump. Stays on the back foot to defend and gets opened up as he plays this to backward point,"Mulder to Dananjaya, no run",0,698189,Wiaan Mulder,0,35,1,5.5,32,379145,Tabraiz Shamsi,0,36,1,6.0,34,574178,Akila Dananjaya,12,11,2,0,465793,Dhananjaya de Silva,25,34,2,0,5,False,0,0,0,0,0,30,9,0,False,,False,False,5.96,0,179,0,6,0,1,1,0,178
run,8,Sri Lanka,3,South Africa,2nd innings,2,"shortish on leg stump, worked off the hips to the right of deep square leg","Mulder to Dananjaya, 2 runs",0,698189,Wiaan Mulder,0,36,1,6.0,34,379145,Tabraiz Shamsi,0,36,1,6.0,34,574178,Akila Dananjaya,14,12,2,0,465793,Dhananjaya de Silva,25,34,2,0,6,True,0,0,0,0,0,30,9,0,False,,False,False,6.0,0,180,0,6,0,1,1,0,180
four,8,Sri Lanka,3,South Africa,2nd innings,4,"tossed up on off stump, and he goes for the reverse-sweep. Not sure if that's where he wanted to place it, but it rolls off the face of his bat and nutmegs the keeper","Shamsi to de Silva, FOUR runs",0,379145,Tabraiz Shamsi,0,37,1,6.1,38,698189,Wiaan Mulder,0,36,1,6.0,34,465793,Dhananjaya de Silva,29,35,3,0,574178,Akila Dananjaya,14,12,2,0,1,False,0,0,0,0,0,31,14,0,False,,False,False,6.09,0,181,0,6,0,1,1,0,184
four,8,Sri Lanka,3,South Africa,2nd innings,4,"he certainly hits this one where he wanted. Tossed up outside off and he gets forward to slog-sweep with a whip of his wrists, to the square leg boundary","Shamsi to de Silva, FOUR runs",0,379145,Tabraiz Shamsi,0,38,1,6.2,42,698189,Wiaan Mulder,0,36,1,6.0,34,465793,Dhananjaya de Silva,33,36,4,0,574178,Akila Dananjaya,14,12,2,0,2,False,0,0,0,0,0,31,14,0,False,,False,False,6.19,0,182,0,6,0,1,1,0,188
