PlayType_description,Batting_Team_id,Batting_Team_name,Bowling_Team_id,Bowling_Team_name,Innings,Total_Runs_on_delivery,Commentary,Commentary_short,Score,Bowler_id,Bowler_name,Bowler_maiden,Bowler_balls,Bowler_wickets,Bowler_over,Bowler_conceded,Other_Bowler_id,Other_Bowler_name,Other_Bowler_maidens,Other_Bowler_balls,Other_Bowler_wickets,Other_Bowler_overs,Other_Bowler_conceded,Batsman_id,Batsman_name,Batsman_runs,Batsman_balls_faced,Batsman_four,Batsman_sixes,Other_Batsman_id,Other_Batsman_name,Other_Batsman_runs,Other_Batsman_balls_faced,Other_Batsman_four,Other_Batsman_sixes,Over_ball,Over_complete,Over_maiden,Over_no_Ball,Over_wide,Over_byes,Over_leg_byes,Over_number,Over_runs,Over_wickets,Dismissal_is_true,Dismissal_type,Dismissal_fielder_iskeeper,Dismissal_text,Innings_run_rate,Innings_byes,Innings_balls,Innings_no_balls,Innings_wickets,Innings_leg_byes,Innings_session,Innings_day,Innings_wides,Innings_runs
wide,25,Bangladesh,4,West Indies,1st innings,1,"length ball starts down leg side and swings further towards the right, but not enough. He can't get bat on it","Cottrell to Tamim Iqbal, 1 wide",1/0,495551,Sheldon Cottrell,0,0,0,0.0,1,False,False,0,0,0,False,0,56194,Tamim Iqbal,0,0,0,0,380354,Anamul Haque,0,0,0,0,1,False,0,0,1,0,0,1,6,0,False,,False,False,False,0,0,0,0,0,1,1,1,1
no run,25,Bangladesh,4,West Indies,1st innings,0,length outside off with a hint of swing away again. Tapped into the off side,"Cottrell to Tamim Iqbal, no run",1/0,495551,Sheldon Cottrell,0,1,0,0.1,1,False,False,0,0,0,False,0,56194,Tamim Iqbal,0,1,0,0,380354,Anamul Haque,0,0,0,0,2,False,0,0,0,0,0,1,6,0,False,,False,False,6.0,0,1,0,0,0,1,1,0,1
no run,25,Bangladesh,4,West Indies,1st innings,0,"length ball on the pads, tickled to the keeper off the thigh","Cottrell to Tamim Iqbal, no run",1/0,495551,Sheldon Cottrell,0,2,0,0.2,1,False,False,0,0,0,False,0,56194,Tamim Iqbal,0,2,0,0,380354,Anamul Haque,0,0,0,0,3,False,0,0,0,0,0,1,6,0,False,,False,False,3.0,0,2,0,0,0,1,1,0,1
leg bye,25,Bangladesh,4,West Indies,1st innings,1,"length ball on the pads, tickled to fine leg's left from the crease","Cottrell to Tamim Iqbal, 1 leg bye",2/0,495551,Sheldon Cottrell,0,3,0,0.3,1,False,False,0,0,0,False,0,56194,Tamim Iqbal,0,3,0,0,380354,Anamul Haque,0,0,0,0,4,False,0,0,0,0,1,1,6,0,False,,False,False,4.0,0,3,0,0,1,1,1,0,2
no run,25,Bangladesh,4,West Indies,1st innings,0,"length ball outside off, slanting across the stumps. Left alone","Cottrell to Anamul Haque, no run",2/0,495551,Sheldon Cottrell,0,4,0,0.4,1,False,False,0,0,0,False,0,380354,Anamul Haque,0,1,0,0,56194,Tamim Iqbal,0,3,0,0,5,False,0,0,0,0,0,1,6,0,False,,False,False,3.0,0,4,0,0,0,1,1,0,2
no ball,25,Bangladesh,4,West Indies,1st innings,1,<b>ends up at second slip!</b> Yikes. That has slipped from Cottrell's hand and it's some early catching practice to his right for the slip fielder,"Cottrell to Anamul Haque, 1 no ball",3/0,495551,Sheldon Cottrell,0,4,0,0.4,2,False,False,0,0,0,False,0,380354,Anamul Haque,0,2,0,0,56194,Tamim Iqbal,0,3,0,0,6,False,0,1,0,0,0,1,6,0,False,,False,False,4.5,0,4,1,0,0,1,1,0,3
run,25,Bangladesh,4,West Indies,1st innings,1,"<b>top edge to fine leg</b> and it's taken, but it won't stand of course. Nice bouncer steep at the chest and he couldn't swing cleanly with the hook from under this","Cottrell to Anamul Haque, 1 run",4/0,495551,Sheldon Cottrell,0,5,0,0.5,3,False,False,0,0,0,False,0,380354,Anamul Haque,1,3,0,0,56194,Tamim Iqbal,0,3,0,0,7,False,0,0,0,0,0,1,6,0,False,,False,False,4.8,0,5,0,0,0,1,1,0,4
run,25,Bangladesh,4,West Indies,1st innings,2,"full outswinger on middle stump, leans in and closes the face late on this to get it through midwicket","Cottrell to Tamim Iqbal, 2 runs",6/0,495551,Sheldon Cottrell,0,6,0,1.0,5,False,False,0,0,0,False,0,56194,Tamim Iqbal,2,4,0,0,380354,Anamul Haque,1,3,0,0,8,True,0,0,0,0,0,1,6,0,False,,False,False,6.0,0,6,0,0,0,1,1,0,6
no run,25,Bangladesh,4,West Indies,1st innings,0,"short of a length outswinger outside off, some shape away. Enough time to get on the back foot and nudge this to backward point","Holder to Anamul Haque, no run",6/0,391485,Jason Holder,0,1,0,0.1,0,495551,Sheldon Cottrell,0,6,0,1.0,5,380354,Anamul Haque,1,4,0,0,56194,Tamim Iqbal,2,4,0,0,1,False,0,0,0,0,0,2,4,0,False,,False,False,5.14,0,7,0,0,0,1,1,0,6
no run,25,Bangladesh,4,West Indies,1st innings,0,floaty length ball wide outside off. Left alone,"Holder to Anamul Haque, no run",6/0,391485,Jason Holder,0,2,0,0.2,0,495551,Sheldon Cottrell,0,6,0,1.0,5,380354,Anamul Haque,1,5,0,0,56194,Tamim Iqbal,2,4,0,0,2,False,0,0,0,0,0,2,4,0,False,,False,False,4.5,0,8,0,0,0,1,1,0,6
no run,25,Bangladesh,4,West Indies,1st innings,0,"length ball outside off, dead-batted into the covers","Holder to Anamul Haque, no run",6/0,391485,Jason Holder,0,3,0,0.3,0,495551,Sheldon Cottrell,0,6,0,1.0,5,380354,Anamul Haque,1,6,0,0,56194,Tamim Iqbal,2,4,0,0,3,False,0,0,0,0,0,2,4,0,False,,False,False,4.0,0,9,0,0,0,1,1,0,6
no run,25,Bangladesh,4,West Indies,1st innings,0,"length ball on middle stump, stabbed back down the pitch from the crease","Holder to Anamul Haque, no run",6/0,391485,Jason Holder,0,4,0,0.4,0,495551,Sheldon Cottrell,0,6,0,1.0,5,380354,Anamul Haque,1,7,0,0,56194,Tamim Iqbal,2,4,0,0,4,False,0,0,0,0,0,2,4,0,False,,False,False,3.6,0,10,0,0,0,1,1,0,6
no run,25,Bangladesh,4,West Indies,1st innings,0,<b>gets the back leg</b> as this straightens after angling in at off stump. Some outswing. Anamul was looking to flick and had closed the face too early. That was going over off,"Holder to Anamul Haque, no run",6/0,391485,Jason Holder,0,5,0,0.5,0,495551,Sheldon Cottrell,0,6,0,1.0,5,380354,Anamul Haque,1,8,0,0,56194,Tamim Iqbal,2,4,0,0,5,False,0,0,0,0,0,2,4,0,False,,False,False,3.27,0,11,0,0,0,1,1,0,6
four,25,Bangladesh,4,West Indies,1st innings,4,"short and wide outside off, lots of time again to free the arms and this time he punches it through cover","Holder to Anamul Haque, FOUR runs",10/0,391485,Jason Holder,0,6,0,1.0,4,495551,Sheldon Cottrell,0,6,0,1.0,5,380354,Anamul Haque,5,9,1,0,56194,Tamim Iqbal,2,4,0,0,6,True,0,0,0,0,0,2,4,0,False,,False,False,5.0,0,12,0,0,0,1,1,0,10
run,25,Bangladesh,4,West Indies,1st innings,3,"overpitched on the pads, stands tall and handsomely whips this through square leg. Fine leg has a lot of running to this right to get to this","Cottrell to Tamim Iqbal, 3 runs",13/0,495551,Sheldon Cottrell,0,7,0,1.1,8,391485,Jason Holder,0,6,0,1.0,4,56194,Tamim Iqbal,5,5,0,0,380354,Anamul Haque,5,9,1,0,1,False,0,0,0,0,0,3,5,0,False,,False,False,6.0,0,13,0,0,0,1,1,0,13
run,25,Bangladesh,4,West Indies,1st innings,2,"full on leg stump, clips it off the front foot through the midwicket region","Cottrell to Anamul Haque, 2 runs",15/0,495551,Sheldon Cottrell,0,8,0,1.2,10,391485,Jason Holder,0,6,0,1.0,4,380354,Anamul Haque,7,10,1,0,56194,Tamim Iqbal,5,5,0,0,2,False,0,0,0,0,0,3,5,0,False,,False,False,6.42,0,14,0,0,0,1,1,0,15
no run,25,Bangladesh,4,West Indies,1st innings,0,"length ball outside off, left alone","Cottrell to Anamul Haque, no run",15/0,495551,Sheldon Cottrell,0,9,0,1.3,10,391485,Jason Holder,0,6,0,1.0,4,380354,Anamul Haque,7,11,1,0,56194,Tamim Iqbal,5,5,0,0,3,False,0,0,0,0,0,3,5,0,False,,False,False,6.0,0,15,0,0,0,1,1,0,15
no run,25,Bangladesh,4,West Indies,1st innings,0,"short in the corridor, mistimed cut into the covers","Cottrell to Anamul Haque, no run",15/0,495551,Sheldon Cottrell,0,10,0,1.4,10,391485,Jason Holder,0,6,0,1.0,4,380354,Anamul Haque,7,12,1,0,56194,Tamim Iqbal,5,5,0,0,4,False,0,0,0,0,0,3,5,0,False,,False,False,5.62,0,16,0,0,0,1,1,0,15
no run,25,Bangladesh,4,West Indies,1st innings,0,"length ball on middle stump, jabbed uppishly into the leg side from the crease. That stopped on him","Cottrell to Anamul Haque, no run",15/0,495551,Sheldon Cottrell,0,11,0,1.5,10,391485,Jason Holder,0,6,0,1.0,4,380354,Anamul Haque,7,13,1,0,56194,Tamim Iqbal,5,5,0,0,5,False,0,0,0,0,0,3,5,0,False,,False,False,5.29,0,17,0,0,0,1,1,0,15
no run,25,Bangladesh,4,West Indies,1st innings,0,"length outside off, left alone","Cottrell to Anamul Haque, no run",15/0,495551,Sheldon Cottrell,0,12,0,2.0,10,391485,Jason Holder,0,6,0,1.0,4,380354,Anamul Haque,7,14,1,0,56194,Tamim Iqbal,5,5,0,0,6,True,0,0,0,0,0,3,5,0,False,,False,False,5.0,0,18,0,0,0,1,1,0,15
no run,25,Bangladesh,4,West Indies,1st innings,0,"length on middle stump, closes the face and clips to midwicket","Holder to Tamim Iqbal, no run",15/0,391485,Jason Holder,0,7,0,1.1,4,495551,Sheldon Cottrell,0,12,0,2.0,10,56194,Tamim Iqbal,5,6,0,0,380354,Anamul Haque,7,14,1,0,1,False,0,0,0,0,0,4,2,0,False,,False,False,4.73,0,19,0,0,0,1,1,0,15
no run,25,Bangladesh,4,West Indies,1st innings,0,"length ball wide outside off, left alone","Holder to Tamim Iqbal, no run",15/0,391485,Jason Holder,0,8,0,1.2,4,495551,Sheldon Cottrell,0,12,0,2.0,10,56194,Tamim Iqbal,5,7,0,0,380354,Anamul Haque,7,14,1,0,2,False,0,0,0,0,0,4,2,0,False,,False,False,4.5,0,20,0,0,0,1,1,0,15
no run,25,Bangladesh,4,West Indies,1st innings,0,"length at middle stump, tapped down the pitch at the bowler","Holder to Tamim Iqbal, no run",15/0,391485,Jason Holder,0,9,0,1.3,4,495551,Sheldon Cottrell,0,12,0,2.0,10,56194,Tamim Iqbal,5,8,0,0,380354,Anamul Haque,7,14,1,0,3,False,0,0,0,0,0,4,2,0,False,,False,False,4.28,0,21,0,0,0,1,1,0,15
wide,25,Bangladesh,4,West Indies,1st innings,1,"overpitched ball down leg side, can't get bat on the flick","Holder to Tamim Iqbal, 1 wide",16/0,391485,Jason Holder,0,9,0,1.3,5,495551,Sheldon Cottrell,0,12,0,2.0,10,56194,Tamim Iqbal,5,8,0,0,380354,Anamul Haque,7,14,1,0,4,False,0,0,1,0,0,4,2,0,False,,False,False,4.57,0,21,0,0,0,1,1,1,16
no run,25,Bangladesh,4,West Indies,1st innings,0,"length ball wide outside off, left alone","Holder to Tamim Iqbal, no run",16/0,391485,Jason Holder,0,10,0,1.4,5,495551,Sheldon Cottrell,0,12,0,2.0,10,56194,Tamim Iqbal,5,9,0,0,380354,Anamul Haque,7,14,1,0,5,False,0,0,0,0,0,4,2,0,False,,False,False,4.36,0,22,0,0,0,1,1,0,16
run,25,Bangladesh,4,West Indies,1st innings,1,"full on off stump, leans into it and taps it to mid-off's left to pinch a single","Holder to Tamim Iqbal, 1 run",17/0,391485,Jason Holder,0,11,0,1.5,6,495551,Sheldon Cottrell,0,12,0,2.0,10,56194,Tamim Iqbal,6,10,0,0,380354,Anamul Haque,7,14,1,0,6,False,0,0,0,0,0,4,2,0,False,,False,False,4.43,0,23,0,0,0,1,1,0,17
no run,25,Bangladesh,4,West Indies,1st innings,0,"short of a length in the corridor, taps it into the off side from deep in the crease","Holder to Anamul Haque, no run",17/0,391485,Jason Holder,0,12,0,2.0,6,495551,Sheldon Cottrell,0,12,0,2.0,10,380354,Anamul Haque,7,15,1,0,56194,Tamim Iqbal,6,10,0,0,7,True,0,0,0,0,0,4,2,0,False,,False,False,4.25,0,24,0,0,0,1,1,0,17
no run,25,Bangladesh,4,West Indies,1st innings,0,"length ball at middle stump, tapped to mid-on from the crease","Cottrell to Tamim Iqbal, no run",17/0,495551,Sheldon Cottrell,0,13,0,2.1,10,391485,Jason Holder,0,12,0,2.0,6,56194,Tamim Iqbal,6,11,0,0,380354,Anamul Haque,7,15,1,0,1,False,0,0,0,0,0,5,8,0,False,,False,False,4.08,0,25,0,0,0,1,1,0,17
no run,25,Bangladesh,4,West Indies,1st innings,0,"short and wide outside off, late slice to backward point's right. Can't get it past him","Cottrell to Tamim Iqbal, no run",17/0,495551,Sheldon Cottrell,0,14,0,2.2,10,391485,Jason Holder,0,12,0,2.0,6,56194,Tamim Iqbal,6,12,0,0,380354,Anamul Haque,7,15,1,0,2,False,0,0,0,0,0,5,8,0,False,,False,False,3.92,0,26,0,0,0,1,1,0,17
four,25,Bangladesh,4,West Indies,1st innings,4,"length ball down leg side, head falls over into the off side as he stretches to flick this. Gets it wide of fine leg whose dive to the right is not quick enough","Cottrell to Tamim Iqbal, FOUR runs",21/0,495551,Sheldon Cottrell,0,15,0,2.3,14,391485,Jason Holder,0,12,0,2.0,6,56194,Tamim Iqbal,10,13,1,0,380354,Anamul Haque,7,15,1,0,3,False,0,0,0,0,0,5,8,0,False,,False,False,4.66,0,27,0,0,0,1,1,0,21
four,25,Bangladesh,4,West Indies,1st innings,4,"nicely done. Length ball outside off, leans in calmly as he punches this on the up. It bounces away wide of mid-off and teases the two fielders running after it before getting to the boundary","Cottrell to Tamim Iqbal, FOUR runs",25/0,495551,Sheldon Cottrell,0,16,0,2.4,18,391485,Jason Holder,0,12,0,2.0,6,56194,Tamim Iqbal,14,14,2,0,380354,Anamul Haque,7,15,1,0,4,False,0,0,0,0,0,5,8,0,False,,False,False,5.35,0,28,0,0,0,1,1,0,25
no run,25,Bangladesh,4,West Indies,1st innings,0,"length at the stumps, tapped to midwicket off the front foot","Cottrell to Tamim Iqbal, no run",25/0,495551,Sheldon Cottrell,0,17,0,2.5,18,391485,Jason Holder,0,12,0,2.0,6,56194,Tamim Iqbal,14,15,2,0,380354,Anamul Haque,7,15,1,0,5,False,0,0,0,0,0,5,8,0,False,,False,False,5.17,0,29,0,0,0,1,1,0,25
no run,25,Bangladesh,4,West Indies,1st innings,0,"length ball outside off, left alone","Cottrell to Tamim Iqbal, no run",25/0,495551,Sheldon Cottrell,0,18,0,3.0,18,391485,Jason Holder,0,12,0,2.0,6,56194,Tamim Iqbal,14,16,2,0,380354,Anamul Haque,7,15,1,0,6,True,0,0,0,0,0,5,8,0,False,,False,False,5.0,0,30,0,0,0,1,1,0,25
no run,25,Bangladesh,4,West Indies,1st innings,0,"short of a length just outside off, defended off the back foot","Holder to Anamul Haque, no run",25/0,391485,Jason Holder,0,13,0,2.1,6,495551,Sheldon Cottrell,0,18,0,3.0,18,380354,Anamul Haque,7,16,1,0,56194,Tamim Iqbal,14,16,2,0,1,False,0,0,0,0,0,6,2,0,False,,False,False,4.83,0,31,0,0,0,1,1,0,25
no run,25,Bangladesh,4,West Indies,1st innings,0,<b>sound</b> as this goes through to the keeper down leg side. It's a length ball on leg stump that he's trying to glance. Not out says the umpire. That was off the thigh guard.,"Holder to Anamul Haque, no run",25/0,391485,Jason Holder,0,14,0,2.2,6,495551,Sheldon Cottrell,0,18,0,3.0,18,380354,Anamul Haque,7,17,1,0,56194,Tamim Iqbal,14,16,2,0,2,False,0,0,0,0,0,6,2,0,False,,False,False,4.68,0,32,0,0,0,1,1,0,25
no run,25,Bangladesh,4,West Indies,1st innings,0,"length on leg stump, flicked to square leg's right","Holder to Anamul Haque, no run",25/0,391485,Jason Holder,0,15,0,2.3,6,495551,Sheldon Cottrell,0,18,0,3.0,18,380354,Anamul Haque,7,18,1,0,56194,Tamim Iqbal,14,16,2,0,3,False,0,0,0,0,0,6,2,0,False,,False,False,4.54,0,33,0,0,0,1,1,0,25
run,25,Bangladesh,4,West Indies,1st innings,1,"short of a length outside off, nudged to mid-on's right on the up","Holder to Anamul Haque, 1 run",26/0,391485,Jason Holder,0,16,0,2.4,7,495551,Sheldon Cottrell,0,18,0,3.0,18,380354,Anamul Haque,8,19,1,0,56194,Tamim Iqbal,14,16,2,0,4,False,0,0,0,0,0,6,2,0,False,,False,False,4.58,0,34,0,0,0,1,1,0,26
run,25,Bangladesh,4,West Indies,1st innings,1,"full outside off, blocked with soft hands to get a single to cover's left","Holder to Tamim Iqbal, 1 run",27/0,391485,Jason Holder,0,17,0,2.5,8,495551,Sheldon Cottrell,0,18,0,3.0,18,56194,Tamim Iqbal,15,17,2,0,380354,Anamul Haque,8,19,1,0,5,False,0,0,0,0,0,6,2,0,False,,False,False,4.62,0,35,0,0,0,1,1,0,27
no run,25,Bangladesh,4,West Indies,1st innings,0,"short of a length outside off, tapped to cover off the back foot","Holder to Anamul Haque, no run",27/0,391485,Jason Holder,0,18,0,3.0,8,495551,Sheldon Cottrell,0,18,0,3.0,18,380354,Anamul Haque,8,20,1,0,56194,Tamim Iqbal,15,17,2,0,6,True,0,0,0,0,0,6,2,0,False,,False,False,4.5,0,36,0,0,0,1,1,0,27
no run,25,Bangladesh,4,West Indies,1st innings,0,overpitched and in at middle stump. A firm punch to mid-on,"Cottrell to Tamim Iqbal, no run",27/0,495551,Sheldon Cottrell,0,19,0,3.1,18,391485,Jason Holder,0,18,0,3.0,8,56194,Tamim Iqbal,15,18,2,0,380354,Anamul Haque,8,20,1,0,1,False,0,0,0,0,0,7,1,0,False,,False,False,4.37,0,37,0,0,0,1,1,0,27
no run,25,Bangladesh,4,West Indies,1st innings,0,"length ball on off stump, climbs up as he gets in for the defence. Manages to drop it into the pitch","Cottrell to Tamim Iqbal, no run",27/0,495551,Sheldon Cottrell,0,20,0,3.2,18,391485,Jason Holder,0,18,0,3.0,8,56194,Tamim Iqbal,15,19,2,0,380354,Anamul Haque,8,20,1,0,2,False,0,0,0,0,0,7,1,0,False,,False,False,4.26,0,38,0,0,0,1,1,0,27
no run,25,Bangladesh,4,West Indies,1st innings,0,<b>falls safely</b> after pinging off his glove. Short of a length ball on leg stump and he's hurried on the pull. It lobs up for the keeper to his right but is quite far away in the end,"Cottrell to Tamim Iqbal, no run",27/0,495551,Sheldon Cottrell,0,21,0,3.3,18,391485,Jason Holder,0,18,0,3.0,8,56194,Tamim Iqbal,15,20,2,0,380354,Anamul Haque,8,20,1,0,3,False,0,0,0,0,0,7,1,0,False,,False,False,4.15,0,39,0,0,0,1,1,0,27
run,25,Bangladesh,4,West Indies,1st innings,1,"short of a length in the corridor, mistimed dab into the off side gives them the chance to pick up a single","Cottrell to Tamim Iqbal, 1 run",28/0,495551,Sheldon Cottrell,0,22,0,3.4,19,391485,Jason Holder,0,18,0,3.0,8,56194,Tamim Iqbal,16,21,2,0,380354,Anamul Haque,8,20,1,0,4,False,0,0,0,0,0,7,1,0,False,,False,False,4.2,0,40,0,0,0,1,1,0,28
no run,25,Bangladesh,4,West Indies,1st innings,0,"length on middle stump, flicked to square leg's right","Cottrell to Anamul Haque, no run",28/0,495551,Sheldon Cottrell,0,23,0,3.5,19,391485,Jason Holder,0,18,0,3.0,8,380354,Anamul Haque,8,21,1,0,56194,Tamim Iqbal,16,21,2,0,5,False,0,0,0,0,0,7,1,0,False,,False,False,4.09,0,41,0,0,0,1,1,0,28
no run,25,Bangladesh,4,West Indies,1st innings,0,"short of a length outside off, watchfully poked into the covers","Cottrell to Anamul Haque, no run",28/0,495551,Sheldon Cottrell,0,24,0,4.0,19,391485,Jason Holder,0,18,0,3.0,8,380354,Anamul Haque,8,22,1,0,56194,Tamim Iqbal,16,21,2,0,6,True,0,0,0,0,0,7,1,0,False,,False,False,4.0,0,42,0,0,0,1,1,0,28
run,25,Bangladesh,4,West Indies,1st innings,2,<b>clears mid-off</b> and Tamim survives again. Steps out at this length ball outside off and has an ugly swipe while losing his shape. Powell picks it a second late and can't get close to it running backwards as it's sliced off the face of the bat,"Holder to Tamim Iqbal, 2 runs",30/0,391485,Jason Holder,0,19,0,3.1,10,495551,Sheldon Cottrell,0,24,0,4.0,19,56194,Tamim Iqbal,18,22,2,0,380354,Anamul Haque,8,22,1,0,1,False,0,0,0,0,0,8,4,0,False,,False,False,4.18,0,43,0,0,0,1,1,0,30
run,25,Bangladesh,4,West Indies,1st innings,1,"length on leg stump, clipped through square leg","Holder to Tamim Iqbal, 1 run",31/0,391485,Jason Holder,0,20,0,3.2,11,495551,Sheldon Cottrell,0,24,0,4.0,19,56194,Tamim Iqbal,19,23,2,0,380354,Anamul Haque,8,22,1,0,2,False,0,0,0,0,0,8,4,0,False,,False,False,4.22,0,44,0,0,0,1,1,0,31
no run,25,Bangladesh,4,West Indies,1st innings,0,"length ball in the corridor, angled inwards. Gets forward and blocks","Holder to Anamul Haque, no run",31/0,391485,Jason Holder,0,21,0,3.3,11,495551,Sheldon Cottrell,0,24,0,4.0,19,380354,Anamul Haque,8,23,1,0,56194,Tamim Iqbal,19,23,2,0,3,False,0,0,0,0,0,8,4,0,False,,False,False,4.13,0,45,0,0,0,1,1,0,31
no run,25,Bangladesh,4,West Indies,1st innings,0,"length ball in the corridor, solidly blocked on the front foot","Holder to Anamul Haque, no run",31/0,391485,Jason Holder,0,22,0,3.4,11,495551,Sheldon Cottrell,0,24,0,4.0,19,380354,Anamul Haque,8,24,1,0,56194,Tamim Iqbal,19,23,2,0,4,False,0,0,0,0,0,8,4,0,False,,False,False,4.04,0,46,0,0,0,1,1,0,31
run,25,Bangladesh,4,West Indies,1st innings,1,"offcutter a length on leg stump, deflected to fine leg's right off the front foot","Holder to Anamul Haque, 1 run",32/0,391485,Jason Holder,0,23,0,3.5,12,495551,Sheldon Cottrell,0,24,0,4.0,19,380354,Anamul Haque,9,25,1,0,56194,Tamim Iqbal,19,23,2,0,5,False,0,0,0,0,0,8,4,0,False,,False,False,4.08,0,47,0,0,0,1,1,0,32
no run,25,Bangladesh,4,West Indies,1st innings,0,"short ball in the corridor, tapped back to the bowler off the back foot","Holder to Tamim Iqbal, no run",32/0,391485,Jason Holder,0,24,0,4.0,12,495551,Sheldon Cottrell,0,24,0,4.0,19,56194,Tamim Iqbal,19,24,2,0,380354,Anamul Haque,9,25,1,0,6,True,0,0,0,0,0,8,4,0,False,,False,False,4.0,0,48,0,0,0,1,1,0,32
no run,25,Bangladesh,4,West Indies,1st innings,0,<b>mistimed pull</b> as he looks to drag this from outside off. Short ball slanted across him is too quick for him,"Cottrell to Anamul Haque, no run",32/0,495551,Sheldon Cottrell,0,25,0,4.1,19,391485,Jason Holder,0,24,0,4.0,12,380354,Anamul Haque,9,26,1,0,56194,Tamim Iqbal,19,24,2,0,1,False,0,0,0,0,0,9,2,0,False,,False,False,3.91,0,49,0,0,0,1,1,0,32
run,25,Bangladesh,4,West Indies,1st innings,1,"length ball outside off, pushed with soft hands into the off side and another single is stolen","Cottrell to Anamul Haque, 1 run",33/0,495551,Sheldon Cottrell,0,26,0,4.2,20,391485,Jason Holder,0,24,0,4.0,12,380354,Anamul Haque,10,27,1,0,56194,Tamim Iqbal,19,24,2,0,2,False,0,0,0,0,0,9,2,0,False,,False,False,3.96,0,50,0,0,0,1,1,0,33
run,25,Bangladesh,4,West Indies,1st innings,1,"length ball on leg stump, flicked to short fine's left","Cottrell to Tamim Iqbal, 1 run",34/0,495551,Sheldon Cottrell,0,27,0,4.3,21,391485,Jason Holder,0,24,0,4.0,12,56194,Tamim Iqbal,20,25,2,0,380354,Anamul Haque,10,27,1,0,3,False,0,0,0,0,0,9,2,0,False,,False,False,4.0,0,51,0,0,0,1,1,0,34
no run,25,Bangladesh,4,West Indies,1st innings,0,<b>thuds the back leg</b> as he looks to pull. Short of a length ball on leg stump and he's looking to go towards fine leg with this,"Cottrell to Anamul Haque, no run",34/0,495551,Sheldon Cottrell,0,28,0,4.4,21,391485,Jason Holder,0,24,0,4.0,12,380354,Anamul Haque,10,28,1,0,56194,Tamim Iqbal,20,25,2,0,4,False,0,0,0,0,0,9,2,0,False,,False,False,3.92,0,52,0,0,0,1,1,0,34
no run,25,Bangladesh,4,West Indies,1st innings,0,"length outside off, defended into the covers","Cottrell to Anamul Haque, no run",34/0,495551,Sheldon Cottrell,0,29,0,4.5,21,391485,Jason Holder,0,24,0,4.0,12,380354,Anamul Haque,10,29,1,0,56194,Tamim Iqbal,20,25,2,0,5,False,0,0,0,0,0,9,2,0,False,,False,False,3.84,0,53,0,0,0,1,1,0,34
no run,25,Bangladesh,4,West Indies,1st innings,0,"length outside off, looks to push another one into the off side with soft hands. Can't get it off the pitch","Cottrell to Anamul Haque, no run",34/0,495551,Sheldon Cottrell,0,30,0,5.0,21,391485,Jason Holder,0,24,0,4.0,12,380354,Anamul Haque,10,30,1,0,56194,Tamim Iqbal,20,25,2,0,6,True,0,0,0,0,0,9,2,0,False,,False,False,3.77,0,54,0,0,0,1,1,0,34
no run,25,Bangladesh,4,West Indies,1st innings,0,"length on off stump, gets forward and flicks to short midwicket","Holder to Tamim Iqbal, no run",34/0,391485,Jason Holder,0,25,0,4.1,12,495551,Sheldon Cottrell,0,30,0,5.0,21,56194,Tamim Iqbal,20,26,2,0,380354,Anamul Haque,10,30,1,0,1,False,0,0,0,0,0,10,3,1,False,,False,False,3.7,0,55,0,0,0,1,1,0,34
run,25,Bangladesh,4,West Indies,1st innings,1,"full ball just outside off, steps out and yorks himself. Manages to squeeze it to mid-off's right","Holder to Tamim Iqbal, 1 run",35/0,391485,Jason Holder,0,26,0,4.2,13,495551,Sheldon Cottrell,0,30,0,5.0,21,56194,Tamim Iqbal,21,27,2,0,380354,Anamul Haque,10,30,1,0,2,False,0,0,0,0,0,10,3,1,False,,False,False,3.75,0,56,0,0,0,1,1,0,35
out,25,Bangladesh,4,West Indies,1st innings,0,<b>taken at mid-on.</b> Anamul's struggle ends. It's a a short ball rising steeply in the corridor and an ordinary attempt to hook. He's caught on the front foot and is completely cramped. Drags it into the hands of mid-on off the high part of the bat,"Holder to Anamul Haque, OUT",35/1,391485,Jason Holder,0,27,1,4.3,13,495551,Sheldon Cottrell,0,30,0,5.0,21,380354,Anamul Haque,10,31,1,0,56194,Tamim Iqbal,21,27,2,0,3,False,0,0,0,0,0,10,3,1,True,caught,False,Anamul Haque c KOA Powell b Holder 10 (31b 1x4 0x6) SR: 32.25,3.68,0,57,0,1,0,1,1,0,35
run,25,Bangladesh,4,West Indies,1st innings,2,"full on middle stump, flicks to deep square's right","Holder to Tamim Iqbal, 2 runs",37/1,391485,Jason Holder,0,28,1,4.4,15,495551,Sheldon Cottrell,0,30,0,5.0,21,56194,Tamim Iqbal,23,28,2,0,56143,Shakib Al Hasan,0,0,0,0,4,False,0,0,0,0,0,10,3,1,False,,False,False,3.82,0,58,0,1,0,1,1,0,37
no run,25,Bangladesh,4,West Indies,1st innings,0,"slower ball, full at middle stump. Has to check and tap with soft hands after shaping to flick","Holder to Tamim Iqbal, no run",37/1,391485,Jason Holder,0,29,1,4.5,15,495551,Sheldon Cottrell,0,30,0,5.0,21,56194,Tamim Iqbal,23,29,2,0,56143,Shakib Al Hasan,0,0,0,0,5,False,0,0,0,0,0,10,3,1,False,,False,False,3.76,0,59,0,1,0,1,1,0,37
no run,25,Bangladesh,4,West Indies,1st innings,0,"length in the corridor, pushed to point off the front foot","Holder to Tamim Iqbal, no run",37/1,391485,Jason Holder,0,30,1,5.0,15,495551,Sheldon Cottrell,0,30,0,5.0,21,56194,Tamim Iqbal,23,30,2,0,56143,Shakib Al Hasan,0,0,0,0,6,True,0,0,0,0,0,10,3,1,False,,False,False,3.7,0,60,0,1,0,1,1,0,37
no run,25,Bangladesh,4,West Indies,1st innings,0,short of a length and coming in at leg stump. Gets on the back foot and glances to short fine,"Bishoo to Shakib Al Hasan, no run",37/1,341593,Devendra Bishoo,0,1,0,0.1,0,391485,Jason Holder,0,30,1,5.0,15,56143,Shakib Al Hasan,0,1,0,0,56194,Tamim Iqbal,23,30,2,0,1,False,0,0,0,0,0,11,1,0,False,,False,False,3.63,0,61,0,1,0,1,1,0,37
no run,25,Bangladesh,4,West Indies,1st innings,0,short of a length skidder hurries him in the corridor. Gets back and taps to short cover,"Bishoo to Shakib Al Hasan, no run",37/1,341593,Devendra Bishoo,0,2,0,0.2,0,391485,Jason Holder,0,30,1,5.0,15,56143,Shakib Al Hasan,0,2,0,0,56194,Tamim Iqbal,23,30,2,0,2,False,0,0,0,0,0,11,1,0,False,,False,False,3.58,0,62,0,1,0,1,1,0,37
run,25,Bangladesh,4,West Indies,1st innings,1,"short of a length on leg stump, whipped to deep backward square","Bishoo to Shakib Al Hasan, 1 run",38/1,341593,Devendra Bishoo,0,3,0,0.3,1,391485,Jason Holder,0,30,1,5.0,15,56143,Shakib Al Hasan,1,3,0,0,56194,Tamim Iqbal,23,30,2,0,3,False,0,0,0,0,0,11,1,0,False,,False,False,3.61,0,63,0,1,0,1,1,0,38
no run,25,Bangladesh,4,West Indies,1st innings,0,"short of a length slider outside off, punched down the pitch off the back foot","Bishoo to Tamim Iqbal, no run",38/1,341593,Devendra Bishoo,0,4,0,0.4,1,391485,Jason Holder,0,30,1,5.0,15,56194,Tamim Iqbal,23,31,2,0,56143,Shakib Al Hasan,1,3,0,0,4,False,0,0,0,0,0,11,1,0,False,,False,False,3.56,0,64,0,1,0,1,1,0,38
