PlayType_description,Batting_Team_id,Batting_Team_name,Bowling_Team_id,Bowling_Team_name,Innings,Total_Runs_on_delivery,Commentary,Commentary_short,Score,Bowler_id,Bowler_name,Bowler_maiden,Bowler_balls,Bowler_wickets,Bowler_over,Bowler_conceded,Other_Bowler_id,Other_Bowler_name,Other_Bowler_maidens,Other_Bowler_balls,Other_Bowler_wickets,Other_Bowler_overs,Other_Bowler_conceded,Batsman_id,Batsman_name,Batsman_runs,Batsman_balls_faced,Batsman_four,Batsman_sixes,Other_Batsman_id,Other_Batsman_name,Other_Batsman_runs,Other_Batsman_balls_faced,Other_Batsman_four,Other_Batsman_sixes,Over_ball,Over_complete,Over_maiden,Over_no_Ball,Over_wide,Over_byes,Over_leg_byes,Over_number,Over_runs,Over_wickets,Dismissal_is_true,Dismissal_type,Dismissal_fielder_iskeeper,Dismissal_text,Innings_run_rate,Innings_byes,Innings_balls,Innings_no_balls,Innings_wickets,Innings_leg_byes,Innings_session,Innings_day,Innings_wides,Innings_runs
run,25,Bangladesh,4,West Indies,1st innings,1,"tossed up at off stump, driven to long-off","Nurse to Tamim Iqbal, 1 run",96/1,315594,Ashley Nurse,0,9,0,1.3,6,341593,Devendra Bishoo,1,36,0,6.0,22,56194,Tamim Iqbal,51,67,4,0,56143,Shakib Al Hasan,29,32,3,0,3,False,0,0,0,0,0,22,7,0,False,,False,False,4.46,0,129,0,1,0,1,1,0,96
run,25,Bangladesh,4,West Indies,1st innings,1,"arm ball, back of a length on middle stump, punched to long-on off the back foot","Nurse to Shakib Al Hasan, 1 run",97/1,315594,Ashley Nurse,0,10,0,1.4,7,341593,Devendra Bishoo,1,36,0,6.0,22,56143,Shakib Al Hasan,30,33,3,0,56194,Tamim Iqbal,51,67,4,0,4,False,0,0,0,0,0,22,7,0,False,,False,False,4.47,0,130,0,1,0,1,1,0,97
no run,25,Bangladesh,4,West Indies,1st innings,0,"full on off stump, jammed back down the pitch","Nurse to Tamim Iqbal, no run",97/1,315594,Ashley Nurse,0,11,0,1.5,7,341593,Devendra Bishoo,1,36,0,6.0,22,56194,Tamim Iqbal,51,68,4,0,56143,Shakib Al Hasan,30,33,3,0,5,False,0,0,0,0,0,22,7,0,False,,False,False,4.44,0,131,0,1,0,1,1,0,97
run,25,Bangladesh,4,West Indies,1st innings,2,"length outside off, steps out and goes inside-out to sweeper's left. Bit of aerobics by Cottrell out there as he flicks it back into play before crossing the boundary. Recovers and puts the throw back in. A long sprint and a one-handed pick up before all this","Nurse to Tamim Iqbal, 2 runs",99/1,315594,Ashley Nurse,0,12,0,2.0,9,341593,Devendra Bishoo,1,36,0,6.0,22,56194,Tamim Iqbal,53,69,4,0,56143,Shakib Al Hasan,30,33,3,0,6,True,0,0,0,0,0,22,7,0,False,,False,False,4.5,0,132,0,1,0,1,1,0,99
run,25,Bangladesh,4,West Indies,1st innings,1,<b>survives on the catch and then Shakib survives a run out</b> at the other end. He gets a leading edge as he looks to close the face and it lands between Gayle and extra cover. Bishoo is the fielder there and he can't hit the stumps as Shakib struggles to make his ground,"Gayle to Shakib Al Hasan, 1 run",100/1,51880,Chris Gayle,0,1,0,0.1,1,315594,Ashley Nurse,0,12,0,2.0,9,56143,Shakib Al Hasan,31,34,3,0,56194,Tamim Iqbal,53,69,4,0,1,False,0,0,0,0,0,23,7,0,False,,False,False,4.51,0,133,0,1,0,1,1,0,100
no run,25,Bangladesh,4,West Indies,1st innings,0,"length on leg stump, steps out and swipes off the inside half to midwicket","Gayle to Tamim Iqbal, no run",100/1,51880,Chris Gayle,0,2,0,0.2,1,315594,Ashley Nurse,0,12,0,2.0,9,56194,Tamim Iqbal,53,70,4,0,56143,Shakib Al Hasan,31,34,3,0,2,False,0,0,0,0,0,23,7,0,False,,False,False,4.47,0,134,0,1,0,1,1,0,100
four,25,Bangladesh,4,West Indies,1st innings,4,"<b>misfield</b> after Tamim steps out and bludgeons this past Gayle. Holder at long-off is right there, but he let's it slip. Didn't even have a lot of running to do, that's poor.","Gayle to Tamim Iqbal, FOUR runs",104/1,51880,Chris Gayle,0,3,0,0.3,5,315594,Ashley Nurse,0,12,0,2.0,9,56194,Tamim Iqbal,57,71,5,0,56143,Shakib Al Hasan,31,34,3,0,3,False,0,0,0,0,0,23,7,0,False,,False,False,4.62,0,135,0,1,0,1,1,0,104
run,25,Bangladesh,4,West Indies,1st innings,1,"length on middle, steps out and drives to long-on","Gayle to Tamim Iqbal, 1 run",105/1,51880,Chris Gayle,0,4,0,0.4,6,315594,Ashley Nurse,0,12,0,2.0,9,56194,Tamim Iqbal,58,72,5,0,56143,Shakib Al Hasan,31,34,3,0,4,False,0,0,0,0,0,23,7,0,False,,False,False,4.63,0,136,0,1,0,1,1,0,105
run,25,Bangladesh,4,West Indies,1st innings,1,"length on leg stump, whipped to deep midwicket off the back foot","Gayle to Shakib Al Hasan, 1 run",106/1,51880,Chris Gayle,0,5,0,0.5,7,315594,Ashley Nurse,0,12,0,2.0,9,56143,Shakib Al Hasan,32,35,3,0,56194,Tamim Iqbal,58,72,5,0,5,False,0,0,0,0,0,23,7,0,False,,False,False,4.64,0,137,0,1,0,1,1,0,106
no run,25,Bangladesh,4,West Indies,1st innings,0,"length ball, steps out and offers the pad","Gayle to Tamim Iqbal, no run",106/1,51880,Chris Gayle,0,6,0,1.0,7,315594,Ashley Nurse,0,12,0,2.0,9,56194,Tamim Iqbal,58,73,5,0,56143,Shakib Al Hasan,32,35,3,0,6,True,0,0,0,0,0,23,7,0,False,,False,False,4.6,0,138,0,1,0,1,1,0,106
run,25,Bangladesh,4,West Indies,1st innings,1,"tossed up at leg stump, driven down to long-on","Nurse to Shakib Al Hasan, 1 run",107/1,315594,Ashley Nurse,0,13,0,2.1,10,51880,Chris Gayle,0,6,0,1.0,7,56143,Shakib Al Hasan,33,36,3,0,56194,Tamim Iqbal,58,73,5,0,1,False,0,0,0,0,0,24,3,0,False,,False,False,4.61,0,139,0,1,0,1,1,0,107
run,25,Bangladesh,4,West Indies,1st innings,1,"short of a length on off stump, gets back and clips through square leg","Nurse to Tamim Iqbal, 1 run",108/1,315594,Ashley Nurse,0,14,0,2.2,11,51880,Chris Gayle,0,6,0,1.0,7,56194,Tamim Iqbal,59,74,5,0,56143,Shakib Al Hasan,33,36,3,0,2,False,0,0,0,0,0,24,3,0,False,,False,False,4.62,0,140,0,1,0,1,1,0,108
no run,25,Bangladesh,4,West Indies,1st innings,0,"short of a length outside off, dabbed to short third off the outside half","Nurse to Shakib Al Hasan, no run",108/1,315594,Ashley Nurse,0,15,0,2.3,11,51880,Chris Gayle,0,6,0,1.0,7,56143,Shakib Al Hasan,33,37,3,0,56194,Tamim Iqbal,59,74,5,0,3,False,0,0,0,0,0,24,3,0,False,,False,False,4.59,0,141,0,1,0,1,1,0,108
run,25,Bangladesh,4,West Indies,1st innings,1,"tossed up on leg stump, driven to long-on off the front foot","Nurse to Shakib Al Hasan, 1 run",109/1,315594,Ashley Nurse,0,16,0,2.4,12,51880,Chris Gayle,0,6,0,1.0,7,56143,Shakib Al Hasan,34,38,3,0,56194,Tamim Iqbal,59,74,5,0,4,False,0,0,0,0,0,24,3,0,False,,False,False,4.6,0,142,0,1,0,1,1,0,109
no run,25,Bangladesh,4,West Indies,1st innings,0,short of a length flat one in the corridor. Defended to point off the back foot,"Nurse to Tamim Iqbal, no run",109/1,315594,Ashley Nurse,0,17,0,2.5,12,51880,Chris Gayle,0,6,0,1.0,7,56194,Tamim Iqbal,59,75,5,0,56143,Shakib Al Hasan,34,38,3,0,5,False,0,0,0,0,0,24,3,0,False,,False,False,4.57,0,143,0,1,0,1,1,0,109
no run,25,Bangladesh,4,West Indies,1st innings,0,"full on off stump, driven with the turn to extra cover","Nurse to Tamim Iqbal, no run",109/1,315594,Ashley Nurse,0,18,0,3.0,12,51880,Chris Gayle,0,6,0,1.0,7,56194,Tamim Iqbal,59,76,5,0,56143,Shakib Al Hasan,34,38,3,0,6,True,0,0,0,0,0,24,3,0,False,,False,False,4.54,0,144,0,1,0,1,1,0,109
wide,25,Bangladesh,4,West Indies,1st innings,1,"full ball down leg side, can't get bat on the sweep","Gayle to Shakib Al Hasan, 1 wide",110/1,51880,Chris Gayle,0,6,0,1.0,8,315594,Ashley Nurse,0,18,0,3.0,12,56143,Shakib Al Hasan,34,38,3,0,56194,Tamim Iqbal,59,76,5,0,1,False,0,0,1,0,0,25,7,0,False,,False,False,4.58,0,144,0,1,0,1,1,1,110
run,25,Bangladesh,4,West Indies,1st innings,1,"short of a length on middle stump, gets on the back foot and taps it to short fine's right","Gayle to Shakib Al Hasan, 1 run",111/1,51880,Chris Gayle,0,7,0,1.1,9,315594,Ashley Nurse,0,18,0,3.0,12,56143,Shakib Al Hasan,35,39,3,0,56194,Tamim Iqbal,59,76,5,0,2,False,0,0,0,0,0,25,7,0,False,,False,False,4.59,0,145,0,1,0,1,1,0,111
run,25,Bangladesh,4,West Indies,1st innings,1,"short ball outside off. Punched back firmly at the bowler, who deflects it towards long-on","Gayle to Tamim Iqbal, 1 run",112/1,51880,Chris Gayle,0,8,0,1.2,10,315594,Ashley Nurse,0,18,0,3.0,12,56194,Tamim Iqbal,60,77,5,0,56143,Shakib Al Hasan,35,39,3,0,3,False,0,0,0,0,0,25,7,0,False,,False,False,4.6,0,146,0,1,0,1,1,0,112
run,25,Bangladesh,4,West Indies,1st innings,1,"length ball on the pads, slides in and deflects to short fine as he looks to flick","Gayle to Shakib Al Hasan, 1 run",113/1,51880,Chris Gayle,0,9,0,1.3,11,315594,Ashley Nurse,0,18,0,3.0,12,56143,Shakib Al Hasan,36,40,3,0,56194,Tamim Iqbal,60,77,5,0,4,False,0,0,0,0,0,25,7,0,False,,False,False,4.61,0,147,0,1,0,1,1,0,113
run,25,Bangladesh,4,West Indies,1st innings,1,"length on middle, steps out and slugs it out to deep midwicket off the inside half","Gayle to Tamim Iqbal, 1 run",114/1,51880,Chris Gayle,0,10,0,1.4,12,315594,Ashley Nurse,0,18,0,3.0,12,56194,Tamim Iqbal,61,78,5,0,56143,Shakib Al Hasan,36,40,3,0,5,False,0,0,0,0,0,25,7,0,False,,False,False,4.62,0,148,0,1,0,1,1,0,114
wide,25,Bangladesh,4,West Indies,1st innings,1,"length ball down leg side, left alone","Gayle to Shakib Al Hasan, 1 wide",115/1,51880,Chris Gayle,0,10,0,1.4,13,315594,Ashley Nurse,0,18,0,3.0,12,56143,Shakib Al Hasan,36,40,3,0,56194,Tamim Iqbal,61,78,5,0,6,False,0,0,1,0,0,25,7,0,False,,False,False,4.66,0,148,0,1,0,1,1,1,115
run,25,Bangladesh,4,West Indies,1st innings,1,"short and wide outside off, cut to sweeper's left","Gayle to Shakib Al Hasan, 1 run",116/1,51880,Chris Gayle,0,11,0,1.5,14,315594,Ashley Nurse,0,18,0,3.0,12,56143,Shakib Al Hasan,37,41,3,0,56194,Tamim Iqbal,61,78,5,0,7,False,0,0,0,0,0,25,7,0,False,,False,False,4.67,0,149,0,1,0,1,1,0,116
no run,25,Bangladesh,4,West Indies,1st innings,0,"length outside off, steps out and jams it into the pitch. On the bounce to extra cover","Gayle to Tamim Iqbal, no run",116/1,51880,Chris Gayle,0,12,0,2.0,14,315594,Ashley Nurse,0,18,0,3.0,12,56194,Tamim Iqbal,61,79,5,0,56143,Shakib Al Hasan,37,41,3,0,8,True,0,0,0,0,0,25,7,0,False,,False,False,4.64,0,150,0,1,0,1,1,0,116
no run,25,Bangladesh,4,West Indies,1st innings,0,"tossed up at off stump, driven on the bounce into the covers","Nurse to Shakib Al Hasan, no run",116/1,315594,Ashley Nurse,0,19,0,3.1,12,51880,Chris Gayle,0,12,0,2.0,14,56143,Shakib Al Hasan,37,42,3,0,56194,Tamim Iqbal,61,79,5,0,1,False,0,0,0,0,0,26,0,1,False,,False,False,4.6,0,151,0,1,0,1,1,0,116
no run,25,Bangladesh,4,West Indies,1st innings,0,"full on leg stump, driven back to the bowler","Nurse to Shakib Al Hasan, no run",116/1,315594,Ashley Nurse,0,20,0,3.2,12,51880,Chris Gayle,0,12,0,2.0,14,56143,Shakib Al Hasan,37,43,3,0,56194,Tamim Iqbal,61,79,5,0,2,False,0,0,0,0,0,26,0,1,False,,False,False,4.57,0,152,0,1,0,1,1,0,116
out,25,Bangladesh,4,West Indies,1st innings,0,"<b>top edge to deep square.</b> It was coming. They were both getting restless, and it's Shakib who goes first. Length ball looped right up at middle stump. Looks to go for the big slog sweep and ends up getting a top-edge. It's how you got the oversized slogger out at high school level - toss it right up. Shakib, among the elite allrounders in the world, will not be happy with that","Nurse to Shakib Al Hasan, OUT",116/2,315594,Ashley Nurse,0,21,1,3.3,12,51880,Chris Gayle,0,12,0,2.0,14,56143,Shakib Al Hasan,37,44,3,0,56194,Tamim Iqbal,61,79,5,0,3,False,0,0,0,0,0,26,0,1,True,caught,False,Shakib Al Hasan c Paul b Nurse 37 (44b 3x4 0x6) SR: 84.09,4.54,0,153,0,2,0,1,1,0,116
no run,25,Bangladesh,4,West Indies,1st innings,0,"tossed up at a length outside off, blocked on the front foot","Nurse to Mushfiqur Rahim, no run",116/2,315594,Ashley Nurse,0,22,1,3.4,12,51880,Chris Gayle,0,12,0,2.0,14,56029,Mushfiqur Rahim,0,1,0,0,56194,Tamim Iqbal,61,79,5,0,4,False,0,0,0,0,0,26,0,1,False,,False,False,4.51,0,154,0,2,0,1,1,0,116
no run,25,Bangladesh,4,West Indies,1st innings,0,"length outside off, pushed to point's right off the front foot","Nurse to Mushfiqur Rahim, no run",116/2,315594,Ashley Nurse,0,23,1,3.5,12,51880,Chris Gayle,0,12,0,2.0,14,56029,Mushfiqur Rahim,0,2,0,0,56194,Tamim Iqbal,61,79,5,0,5,False,0,0,0,0,0,26,0,1,False,,False,False,4.49,0,155,0,2,0,1,1,0,116
no run,25,Bangladesh,4,West Indies,1st innings,0,"length in the corridor, clipped to midwicket off the back foot","Nurse to Mushfiqur Rahim, no run",116/2,315594,Ashley Nurse,0,24,1,4.0,12,51880,Chris Gayle,0,12,0,2.0,14,56029,Mushfiqur Rahim,0,3,0,0,56194,Tamim Iqbal,61,79,5,0,6,True,0,0,0,0,0,26,0,1,False,,False,False,4.46,0,156,0,2,0,1,1,0,116
run,25,Bangladesh,4,West Indies,1st innings,1,"yorker length outside off, jammed square into the off side","Cottrell to Tamim Iqbal, 1 run",117/2,495551,Sheldon Cottrell,0,31,0,5.1,22,315594,Ashley Nurse,0,24,1,4.0,12,56194,Tamim Iqbal,62,80,5,0,56029,Mushfiqur Rahim,0,3,0,0,1,False,0,0,0,0,0,27,3,0,False,,False,False,4.47,0,157,0,2,0,1,1,0,117
no run,25,Bangladesh,4,West Indies,1st innings,0,"length ball pushed wide outside off, left alone","Cottrell to Mushfiqur Rahim, no run",117/2,495551,Sheldon Cottrell,0,32,0,5.2,22,315594,Ashley Nurse,0,24,1,4.0,12,56029,Mushfiqur Rahim,0,4,0,0,56194,Tamim Iqbal,62,80,5,0,2,False,0,0,0,0,0,27,3,0,False,,False,False,4.44,0,158,0,2,0,1,1,0,117
no run,25,Bangladesh,4,West Indies,1st innings,0,<b>beaten.</b> Gets a length ball to shape in marginally outside off and then gets it to rise away as he looks to drive through cover,"Cottrell to Mushfiqur Rahim, no run",117/2,495551,Sheldon Cottrell,0,33,0,5.3,22,315594,Ashley Nurse,0,24,1,4.0,12,56029,Mushfiqur Rahim,0,5,0,0,56194,Tamim Iqbal,62,80,5,0,3,False,0,0,0,0,0,27,3,0,False,,False,False,4.41,0,159,0,2,0,1,1,0,117
run,25,Bangladesh,4,West Indies,1st innings,1,"length outside off, driven on the up to points who puts in a throw at the non-striker's end and Jason Holder misfields at mid-on","Cottrell to Mushfiqur Rahim, 1 run",118/2,495551,Sheldon Cottrell,0,34,0,5.4,23,315594,Ashley Nurse,0,24,1,4.0,12,56029,Mushfiqur Rahim,1,6,0,0,56194,Tamim Iqbal,62,80,5,0,4,False,0,0,0,0,0,27,3,0,False,,False,False,4.42,0,160,0,2,0,1,1,0,118
wide,25,Bangladesh,4,West Indies,1st innings,1,"short ball down leg side, can't get bat on the pull","Cottrell to Tamim Iqbal, 1 wide",119/2,495551,Sheldon Cottrell,0,34,0,5.4,24,315594,Ashley Nurse,0,24,1,4.0,12,56194,Tamim Iqbal,62,80,5,0,56029,Mushfiqur Rahim,1,6,0,0,5,False,0,0,1,0,0,27,3,0,False,,False,False,4.46,0,160,0,2,0,1,1,1,119
no run,25,Bangladesh,4,West Indies,1st innings,0,offcutter at a length on off stump. Drops it into the off side with soft hands but can't get the single,"Cottrell to Tamim Iqbal, no run",119/2,495551,Sheldon Cottrell,0,35,0,5.5,24,315594,Ashley Nurse,0,24,1,4.0,12,56194,Tamim Iqbal,62,81,5,0,56029,Mushfiqur Rahim,1,6,0,0,6,False,0,0,0,0,0,27,3,0,False,,False,False,4.43,0,161,0,2,0,1,1,0,119
no run,25,Bangladesh,4,West Indies,1st innings,0,<b>nice</b> bouncer. Perfectly directed and viciously rising at his grille. But he does well to sway out of its way,"Cottrell to Tamim Iqbal, no run",119/2,495551,Sheldon Cottrell,0,36,0,6.0,24,315594,Ashley Nurse,0,24,1,4.0,12,56194,Tamim Iqbal,62,82,5,0,56029,Mushfiqur Rahim,1,6,0,0,7,True,0,0,0,0,0,27,3,0,False,,False,False,4.4,0,162,0,2,0,1,1,0,119
six,25,Bangladesh,4,West Indies,1st innings,6,<b>creams it over long-on.</b> Meets the length ball at the pitch outside off and swings cleanly to clear the fielder in the deep,"Nurse to Mushfiqur Rahim, SIX runs",125/2,315594,Ashley Nurse,0,25,1,3.7,18,495551,Sheldon Cottrell,0,36,0,6.0,24,56029,Mushfiqur Rahim,7,7,0,1,56194,Tamim Iqbal,62,82,5,0,1,False,0,0,0,0,0,28,9,0,False,,False,False,4.6,0,163,0,2,0,1,1,0,125
run,25,Bangladesh,4,West Indies,1st innings,1,"full outside off, shuffles and drives to long-off","Nurse to Mushfiqur Rahim, 1 run",126/2,315594,Ashley Nurse,0,26,1,3.8,19,495551,Sheldon Cottrell,0,36,0,6.0,24,56029,Mushfiqur Rahim,8,8,0,1,56194,Tamim Iqbal,62,82,5,0,2,False,0,0,0,0,0,28,9,0,False,,False,False,4.6,0,164,0,2,0,1,1,0,126
wide,25,Bangladesh,4,West Indies,1st innings,1,length ball pushed down leg side,"Nurse to Tamim Iqbal, 1 wide",127/2,315594,Ashley Nurse,0,26,1,3.8,20,495551,Sheldon Cottrell,0,36,0,6.0,24,56194,Tamim Iqbal,62,82,5,0,56029,Mushfiqur Rahim,8,8,0,1,3,False,0,0,1,0,0,28,9,0,False,,False,False,4.64,0,164,0,2,0,1,1,1,127
no run,25,Bangladesh,4,West Indies,1st innings,0,"full on off stump, driven back to the bowler on the bounce","Nurse to Tamim Iqbal, no run",127/2,315594,Ashley Nurse,0,27,1,3.9,20,495551,Sheldon Cottrell,0,36,0,6.0,24,56194,Tamim Iqbal,62,83,5,0,56029,Mushfiqur Rahim,8,8,0,1,4,False,0,0,0,0,0,28,9,0,False,,False,False,4.61,0,165,0,2,0,1,1,0,127
no run,25,Bangladesh,4,West Indies,1st innings,0,"short of a length on off stump, defended off the back foot","Nurse to Tamim Iqbal, no run",127/2,315594,Ashley Nurse,0,19,1,3.1,20,495551,Sheldon Cottrell,0,36,0,6.0,24,56194,Tamim Iqbal,62,84,5,0,56029,Mushfiqur Rahim,8,8,0,1,5,False,0,0,0,0,0,28,9,0,False,,False,False,4.59,0,166,0,2,0,1,1,0,127
no run,25,Bangladesh,4,West Indies,1st innings,0,"tossed up on leg stump, shuffles and sweeps to short fine","Nurse to Tamim Iqbal, no run",127/2,315594,Ashley Nurse,0,19,1,3.1,20,495551,Sheldon Cottrell,0,36,0,6.0,24,56194,Tamim Iqbal,62,85,5,0,56029,Mushfiqur Rahim,8,8,0,1,6,False,0,0,0,0,0,28,9,0,False,,False,False,4.56,0,167,0,2,0,1,1,0,127
run,25,Bangladesh,4,West Indies,1st innings,1,"short and wide outside off, cut to sweeper","Nurse to Tamim Iqbal, 1 run",128/2,315594,Ashley Nurse,0,19,1,3.1,21,495551,Sheldon Cottrell,0,36,0,6.0,24,56194,Tamim Iqbal,63,86,5,0,56029,Mushfiqur Rahim,8,8,0,1,7,True,0,0,0,0,0,28,9,0,False,,False,False,4.57,0,168,0,2,0,1,1,0,128
run,25,Bangladesh,4,West Indies,1st innings,2,"length ball on middle stump, stops on him as he looks to flick uppishly through leg side. Chips safely, wide of mid-on, in the end","Cottrell to Tamim Iqbal, 2 runs",130/2,495551,Sheldon Cottrell,0,37,0,6.1,26,315594,Ashley Nurse,0,19,1,3.1,21,56194,Tamim Iqbal,65,87,5,0,56029,Mushfiqur Rahim,8,8,0,1,1,False,0,0,0,0,0,29,10,0,False,,False,False,4.61,0,169,0,2,0,1,1,0,130
six,25,Bangladesh,4,West Indies,1st innings,6,<b>over the long-off boundary.</b> Lovely shot. Holds his shape and expertly launches this. That's class. It's a length ball outside off and he hits on the rise,"Cottrell to Tamim Iqbal, SIX runs",136/2,495551,Sheldon Cottrell,0,38,0,6.2,32,315594,Ashley Nurse,0,19,1,3.1,21,56194,Tamim Iqbal,71,88,5,1,56029,Mushfiqur Rahim,8,8,0,1,2,False,0,0,0,0,0,29,10,0,False,,False,False,4.8,0,170,0,2,0,1,1,0,136
no run,25,Bangladesh,4,West Indies,1st innings,0,"short of a length outside off, opens the face and deflects towards point","Cottrell to Tamim Iqbal, no run",136/2,495551,Sheldon Cottrell,0,39,0,6.3,32,315594,Ashley Nurse,0,19,1,3.1,21,56194,Tamim Iqbal,71,89,5,1,56029,Mushfiqur Rahim,8,8,0,1,3,False,0,0,0,0,0,29,10,0,False,,False,False,4.77,0,171,0,2,0,1,1,0,136
no run,25,Bangladesh,4,West Indies,1st innings,0,cops it on the pad as he lifts his front leg to try and whip this short of a length ball at his hips,"Cottrell to Tamim Iqbal, no run",136/2,495551,Sheldon Cottrell,0,40,0,6.4,32,315594,Ashley Nurse,0,19,1,3.1,21,56194,Tamim Iqbal,71,90,5,1,56029,Mushfiqur Rahim,8,8,0,1,4,False,0,0,0,0,0,29,10,0,False,,False,False,4.74,0,172,0,2,0,1,1,0,136
run,25,Bangladesh,4,West Indies,1st innings,1,"short outside off, drags it to mid-on with a pull","Cottrell to Tamim Iqbal, 1 run",137/2,495551,Sheldon Cottrell,0,41,0,6.5,33,315594,Ashley Nurse,0,19,1,3.1,21,56194,Tamim Iqbal,72,91,5,1,56029,Mushfiqur Rahim,8,8,0,1,5,False,0,0,0,0,0,29,10,0,False,,False,False,4.75,0,173,0,2,0,1,1,0,137
run,25,Bangladesh,4,West Indies,1st innings,1,short of a length outside off. Opens the face and gets it down to third man,"Cottrell to Mushfiqur Rahim, 1 run",138/2,495551,Sheldon Cottrell,0,42,0,7.0,34,315594,Ashley Nurse,0,19,1,3.1,21,56029,Mushfiqur Rahim,9,9,0,1,56194,Tamim Iqbal,72,91,5,1,6,True,0,0,0,0,0,29,10,0,False,,False,False,4.75,0,174,0,2,0,1,1,0,138
run,25,Bangladesh,4,West Indies,1st innings,1,"length on middle, clips to short fine from the crease","Nurse to Mushfiqur Rahim, 1 run",139/2,315594,Ashley Nurse,0,25,1,4.1,22,495551,Sheldon Cottrell,0,42,0,7.0,34,56029,Mushfiqur Rahim,10,10,0,1,56194,Tamim Iqbal,72,91,5,1,1,False,0,0,0,0,0,30,3,0,False,,False,False,4.76,0,175,0,2,0,1,1,0,139
run,25,Bangladesh,4,West Indies,1st innings,1,"full on middle stump, flicked to long-on off the front foot","Nurse to Tamim Iqbal, 1 run",140/2,315594,Ashley Nurse,0,26,1,4.2,23,495551,Sheldon Cottrell,0,42,0,7.0,34,56194,Tamim Iqbal,73,92,5,1,56029,Mushfiqur Rahim,10,10,0,1,2,False,0,0,0,0,0,30,3,0,False,,False,False,4.77,0,176,0,2,0,1,1,0,140
no run,25,Bangladesh,4,West Indies,1st innings,0,"short of a length on middle stump, tapped to midwicket off the back foot","Nurse to Mushfiqur Rahim, no run",140/2,315594,Ashley Nurse,0,27,1,4.3,23,495551,Sheldon Cottrell,0,42,0,7.0,34,56029,Mushfiqur Rahim,10,11,0,1,56194,Tamim Iqbal,73,92,5,1,3,False,0,0,0,0,0,30,3,0,False,,False,False,4.74,0,177,0,2,0,1,1,0,140
run,25,Bangladesh,4,West Indies,1st innings,1,"full on middle stump, driven to long-off","Nurse to Mushfiqur Rahim, 1 run",141/2,315594,Ashley Nurse,0,28,1,4.4,24,495551,Sheldon Cottrell,0,42,0,7.0,34,56029,Mushfiqur Rahim,11,12,0,1,56194,Tamim Iqbal,73,92,5,1,4,False,0,0,0,0,0,30,3,0,False,,False,False,4.75,0,178,0,2,0,1,1,0,141
no run,25,Bangladesh,4,West Indies,1st innings,0,"short of a length on middle stump, tapped back to the bowler on the bounce","Nurse to Tamim Iqbal, no run",141/2,315594,Ashley Nurse,0,29,1,4.5,24,495551,Sheldon Cottrell,0,42,0,7.0,34,56194,Tamim Iqbal,73,93,5,1,56029,Mushfiqur Rahim,11,12,0,1,5,False,0,0,0,0,0,30,3,0,False,,False,False,4.72,0,179,0,2,0,1,1,0,141
no run,25,Bangladesh,4,West Indies,1st innings,0,"full on off stump, can't get the drive past the bowler","Nurse to Tamim Iqbal, no run",141/2,315594,Ashley Nurse,0,30,1,5.0,24,495551,Sheldon Cottrell,0,42,0,7.0,34,56194,Tamim Iqbal,73,94,5,1,56029,Mushfiqur Rahim,11,12,0,1,6,True,0,0,0,0,0,30,3,0,False,,False,False,4.7,0,180,0,2,0,1,1,0,141
run,25,Bangladesh,4,West Indies,1st innings,1,"back of a length on off, and worked off his hips to the leg side for a single. Dribbles away to fine leg","Paul to Mushfiqur Rahim, 1 run",142/2,677081,Keemo Paul,0,19,0,3.1,23,315594,Ashley Nurse,0,30,1,5.0,24,56029,Mushfiqur Rahim,12,13,0,1,56194,Tamim Iqbal,73,94,5,1,1,False,0,0,0,0,0,31,11,0,False,,False,False,4.7,0,181,0,2,0,1,1,0,142
four,25,Bangladesh,4,West Indies,1st innings,4,"<b>flat-batted down the ground!</b> Length ball outside off, and Tamim gets his front leg out of the way and swings through the line of the ball","Paul to Tamim Iqbal, FOUR runs",146/2,677081,Keemo Paul,0,20,0,3.2,27,315594,Ashley Nurse,0,30,1,5.0,24,56194,Tamim Iqbal,77,95,6,1,56029,Mushfiqur Rahim,12,13,0,1,2,False,0,0,0,0,0,31,11,0,False,,False,False,4.81,0,182,0,2,0,1,1,0,146
no run,25,Bangladesh,4,West Indies,1st innings,0,"slower ball on leg stump, but too short to worry Tamim. Defended away","Paul to Tamim Iqbal, no run",146/2,677081,Keemo Paul,0,21,0,3.3,27,315594,Ashley Nurse,0,30,1,5.0,24,56194,Tamim Iqbal,77,96,6,1,56029,Mushfiqur Rahim,12,13,0,1,3,False,0,0,0,0,0,31,11,0,False,,False,False,4.78,0,183,0,2,0,1,1,0,146
run,25,Bangladesh,4,West Indies,1st innings,2,"full outside off, but Tamim walks towards the delivery and hits a <i>Gangulyesque</i> drive through to deep extra cover","Paul to Tamim Iqbal, 2 runs",148/2,677081,Keemo Paul,0,22,0,3.4,29,315594,Ashley Nurse,0,30,1,5.0,24,56194,Tamim Iqbal,79,97,6,1,56029,Mushfiqur Rahim,12,13,0,1,4,False,0,0,0,0,0,31,11,0,False,,False,False,4.82,0,184,0,2,0,1,1,0,148
four,25,Bangladesh,4,West Indies,1st innings,4,"slower ball outside leg, and this time Tamim scoops this off his hips, and over square leg! Rolls into the boundary behind square","Paul to Tamim Iqbal, FOUR runs",152/2,677081,Keemo Paul,0,23,0,3.5,33,315594,Ashley Nurse,0,30,1,5.0,24,56194,Tamim Iqbal,83,98,7,1,56029,Mushfiqur Rahim,12,13,0,1,5,False,0,0,0,0,0,31,11,0,False,,False,False,4.92,0,185,0,2,0,1,1,0,152
no run,25,Bangladesh,4,West Indies,1st innings,0,"length ball on middle, and Tamim's mistimed pull goes straight to midwicket. Big over","Paul to Tamim Iqbal, no run",152/2,677081,Keemo Paul,0,24,0,4.0,33,315594,Ashley Nurse,0,30,1,5.0,24,56194,Tamim Iqbal,83,99,7,1,56029,Mushfiqur Rahim,12,13,0,1,6,True,0,0,0,0,0,31,11,0,False,,False,False,4.9,0,186,0,2,0,1,1,0,152
out,25,Bangladesh,4,West Indies,1st innings,0,"<b>got him!</b> Mushfiqur was trying to do too much there. Short on middle, and Mushfiqur went down on one knee - outside off stump - to try and scoop it over fine leg. But he misses his swipe, and the ball turns away from him and crashes into leg stump. Soft, soft dismissal","Nurse to Mushfiqur Rahim, OUT",152/3,315594,Ashley Nurse,0,31,2,5.1,24,677081,Keemo Paul,0,24,0,4.0,33,56029,Mushfiqur Rahim,12,14,0,1,56194,Tamim Iqbal,83,99,7,1,1,False,0,0,0,0,0,32,7,1,True,bowled,False,Mushfiqur Rahim  b Nurse 12 (14b 0x4 1x6) SR: 85.71,4.87,0,187,0,3,0,1,1,0,152
four,25,Bangladesh,4,West Indies,1st innings,4,"full just outside off, and he defends with soft hands. Finds the bat's outside edge, but the ball sneaks betweek keeper and first slip. Gets off the mark with a streaky stroke","Nurse to Mahmudullah, FOUR runs",156/3,315594,Ashley Nurse,0,32,2,5.2,28,677081,Keemo Paul,0,24,0,4.0,33,56025,Mahmudullah,4,1,1,0,56194,Tamim Iqbal,83,99,7,1,2,False,0,0,0,0,0,32,7,1,False,,False,False,4.97,0,188,0,3,0,1,1,0,156
run,25,Bangladesh,4,West Indies,1st innings,1,"full outside off, and driven to deep extra cover for a single","Nurse to Mahmudullah, 1 run",157/3,315594,Ashley Nurse,0,33,2,5.3,29,677081,Keemo Paul,0,24,0,4.0,33,56025,Mahmudullah,5,2,1,0,56194,Tamim Iqbal,83,99,7,1,3,False,0,0,0,0,0,32,7,1,False,,False,False,4.98,0,189,0,3,0,1,1,0,157
run,25,Bangladesh,4,West Indies,1st innings,1,"wide outside off, and Tamim brings out the late dab past short fine leg","Nurse to Tamim Iqbal, 1 run",158/3,315594,Ashley Nurse,0,34,2,5.4,30,677081,Keemo Paul,0,24,0,4.0,33,56194,Tamim Iqbal,84,100,7,1,56025,Mahmudullah,5,2,1,0,4,False,0,0,0,0,0,32,7,1,False,,False,False,4.98,0,190,0,3,0,1,1,0,158
