PlayType_description,Batting_Team_id,Batting_Team_name,Bowling_Team_id,Bowling_Team_name,Innings,Total_Runs_on_delivery,Commentary,Commentary_short,Score,Bowler_id,Bowler_name,Bowler_maiden,Bowler_balls,Bowler_wickets,Bowler_over,Bowler_conceded,Other_Bowler_id,Other_Bowler_name,Other_Bowler_maidens,Other_Bowler_balls,Other_Bowler_wickets,Other_Bowler_overs,Other_Bowler_conceded,Batsman_id,Batsman_name,Batsman_runs,Batsman_balls_faced,Batsman_four,Batsman_sixes,Other_Batsman_id,Other_Batsman_name,Other_Batsman_runs,Other_Batsman_balls_faced,Other_Batsman_four,Other_Batsman_sixes,Over_ball,Over_complete,Over_maiden,Over_no_Ball,Over_wide,Over_byes,Over_leg_byes,Over_number,Over_runs,Over_wickets,Dismissal_is_true,Dismissal_type,Dismissal_fielder_iskeeper,Dismissal_text,Innings_run_rate,Innings_byes,Innings_balls,Innings_no_balls,Innings_wickets,Innings_leg_byes,Innings_session,Innings_day,Innings_wides,Innings_runs
run,4,West Indies,25,Bangladesh,2nd innings,1,"full on off, and Hope goes onto the back foot. Clips this away to deep midwicket","Rubel Hossain to Hope, 1 run",0,300619,Rubel Hossain,0,18,1,3.0,9,56143,Shakib Al Hasan,0,6,0,1.0,1,581379,Shai Hope,19,38,1,0,670025,Shimron Hetmyer,3,7,0,0,6,True,0,0,0,0,0,24,6,0,False,,False,False,4.7,0,144,0,2,0,1,1,0,113
no run,4,West Indies,25,Bangladesh,2nd innings,0,"good length outside off, and defended back to the bowler","Shakib Al Hasan to Hope, no run",0,56143,Shakib Al Hasan,0,7,0,1.1,1,300619,Rubel Hossain,0,18,1,3.0,9,581379,Shai Hope,19,39,1,0,670025,Shimron Hetmyer,3,7,0,0,1,False,0,0,0,0,0,25,4,0,False,,False,False,4.67,0,145,0,2,0,1,1,0,113
no run,4,West Indies,25,Bangladesh,2nd innings,0,good length just outside off. He goes to the off side and defends,"Shakib Al Hasan to Hope, no run",0,56143,Shakib Al Hasan,0,8,0,1.2,1,300619,Rubel Hossain,0,18,1,3.0,9,581379,Shai Hope,19,40,1,0,670025,Shimron Hetmyer,3,7,0,0,2,False,0,0,0,0,0,25,4,0,False,,False,False,4.64,0,146,0,2,0,1,1,0,113
no run,4,West Indies,25,Bangladesh,2nd innings,0,"full on off, and defended off the front foot. Stopped by the fielder at short cover","Shakib Al Hasan to Hope, no run",0,56143,Shakib Al Hasan,0,9,0,1.3,1,300619,Rubel Hossain,0,18,1,3.0,9,581379,Shai Hope,19,41,1,0,670025,Shimron Hetmyer,3,7,0,0,3,False,0,0,0,0,0,25,4,0,False,,False,False,4.61,0,147,0,2,0,1,1,0,113
four,4,West Indies,25,Bangladesh,2nd innings,4,"tossed up outside off, but Hope drags a slog-sweep from outside off. Gets a lot of meat behind that shot, and that's four for West Indies","Shakib Al Hasan to Hope, FOUR runs",0,56143,Shakib Al Hasan,0,10,0,1.4,5,300619,Rubel Hossain,0,18,1,3.0,9,581379,Shai Hope,23,42,2,0,670025,Shimron Hetmyer,3,7,0,0,4,False,0,0,0,0,0,25,4,0,False,,False,False,4.74,0,148,0,2,0,1,1,0,117
no run,4,West Indies,25,Bangladesh,2nd innings,0,"full just outside off, and defended","Shakib Al Hasan to Hope, no run",0,56143,Shakib Al Hasan,0,11,0,1.5,5,300619,Rubel Hossain,0,18,1,3.0,9,581379,Shai Hope,23,43,2,0,670025,Shimron Hetmyer,3,7,0,0,5,False,0,0,0,0,0,25,4,0,False,,False,False,4.71,0,149,0,2,0,1,1,0,117
no run,4,West Indies,25,Bangladesh,2nd innings,0,"full on off, and he goes onto the back foot and flicks it square to the leg side","Shakib Al Hasan to Hope, no run",0,56143,Shakib Al Hasan,0,12,0,2.0,5,300619,Rubel Hossain,0,18,1,3.0,9,581379,Shai Hope,23,44,2,0,670025,Shimron Hetmyer,3,7,0,0,6,True,0,0,0,0,0,25,4,0,False,,False,False,4.68,0,150,0,2,0,1,1,0,117
no run,4,West Indies,25,Bangladesh,2nd innings,0,"good length on middle, and fended off the back foot","Rubel Hossain to Hetmyer, no run",0,300619,Rubel Hossain,0,19,1,3.1,9,56143,Shakib Al Hasan,0,12,0,2.0,5,670025,Shimron Hetmyer,3,8,0,0,581379,Shai Hope,23,44,2,0,1,False,0,0,0,0,0,26,8,0,False,,False,False,4.64,0,151,0,2,0,1,1,0,117
no run,4,West Indies,25,Bangladesh,2nd innings,0,"full on middle, and defended off the front foot to mid off","Rubel Hossain to Hetmyer, no run",0,300619,Rubel Hossain,0,20,1,3.2,9,56143,Shakib Al Hasan,0,12,0,2.0,5,670025,Shimron Hetmyer,3,9,0,0,581379,Shai Hope,23,44,2,0,2,False,0,0,0,0,0,26,8,0,False,,False,False,4.61,0,152,0,2,0,1,1,0,117
run,4,West Indies,25,Bangladesh,2nd innings,2,"full on off, and that's been slog-swept to the leg side. Enough time to scamper back for two","Rubel Hossain to Hetmyer, 2 runs",0,300619,Rubel Hossain,0,21,1,3.3,11,56143,Shakib Al Hasan,0,12,0,2.0,5,670025,Shimron Hetmyer,5,10,0,0,581379,Shai Hope,23,44,2,0,3,False,0,0,0,0,0,26,8,0,False,,False,False,4.66,0,153,0,2,0,1,1,0,119
four,4,West Indies,25,Bangladesh,2nd innings,4,"good length on middle, and that's been <b>pulled away!</b> Wasn't too short, but Hetmyer did well to bend his knees, ensuring he was under the ball","Rubel Hossain to Hetmyer, FOUR runs",0,300619,Rubel Hossain,0,22,1,3.4,15,56143,Shakib Al Hasan,0,12,0,2.0,5,670025,Shimron Hetmyer,9,11,1,0,581379,Shai Hope,23,44,2,0,4,False,0,0,0,0,0,26,8,0,False,,False,False,4.79,0,154,0,2,0,1,1,0,123
no run,4,West Indies,25,Bangladesh,2nd innings,0,"full outside off, and angling across the batsman. Tries to drive but misses","Rubel Hossain to Hetmyer, no run",0,300619,Rubel Hossain,0,23,1,3.5,15,56143,Shakib Al Hasan,0,12,0,2.0,5,670025,Shimron Hetmyer,9,12,1,0,581379,Shai Hope,23,44,2,0,5,False,0,0,0,0,0,26,8,0,False,,False,False,4.76,0,155,0,2,0,1,1,0,123
run,4,West Indies,25,Bangladesh,2nd innings,2,"length ball outside off, and he runs it down to third man off the back foot","Rubel Hossain to Hetmyer, 2 runs",0,300619,Rubel Hossain,0,24,1,4.0,17,56143,Shakib Al Hasan,0,12,0,2.0,5,670025,Shimron Hetmyer,11,13,1,0,581379,Shai Hope,23,44,2,0,6,True,0,0,0,0,0,26,8,0,False,,False,False,4.8,0,156,0,2,0,1,1,0,125
run,4,West Indies,25,Bangladesh,2nd innings,1,"full on middle, and he takes a big stride forward to drive down to long off","Shakib Al Hasan to Hope, 1 run",0,56143,Shakib Al Hasan,0,13,0,2.1,6,300619,Rubel Hossain,0,24,1,4.0,17,581379,Shai Hope,24,45,2,0,670025,Shimron Hetmyer,11,13,1,0,1,False,0,0,0,0,0,27,3,0,False,,False,False,4.81,0,157,0,2,0,1,1,0,126
run,4,West Indies,25,Bangladesh,2nd innings,1,"full on middle, and that's been turned off his pads to the leg side","Shakib Al Hasan to Hetmyer, 1 run",0,56143,Shakib Al Hasan,0,14,0,2.2,7,300619,Rubel Hossain,0,24,1,4.0,17,670025,Shimron Hetmyer,12,14,1,0,581379,Shai Hope,24,45,2,0,2,False,0,0,0,0,0,27,3,0,False,,False,False,4.82,0,158,0,2,0,1,1,0,127
no run,4,West Indies,25,Bangladesh,2nd innings,0,"full outside off, forcing Hope to reach at it. Mistimes the drive to the off side","Shakib Al Hasan to Hope, no run",0,56143,Shakib Al Hasan,0,15,0,2.3,7,300619,Rubel Hossain,0,24,1,4.0,17,581379,Shai Hope,24,46,2,0,670025,Shimron Hetmyer,12,14,1,0,3,False,0,0,0,0,0,27,3,0,False,,False,False,4.79,0,159,0,2,0,1,1,0,127
no run,4,West Indies,25,Bangladesh,2nd innings,0,"overpitched outside off, and Hope tries to drive through the covers once again. But finds cover point","Shakib Al Hasan to Hope, no run",0,56143,Shakib Al Hasan,0,16,0,2.4,7,300619,Rubel Hossain,0,24,1,4.0,17,581379,Shai Hope,24,47,2,0,670025,Shimron Hetmyer,12,14,1,0,4,False,0,0,0,0,0,27,3,0,False,,False,False,4.76,0,160,0,2,0,1,1,0,127
run,4,West Indies,25,Bangladesh,2nd innings,1,"drifting down leg, but Hope can't play it fine. Instead mistimes a shot to square leg","Shakib Al Hasan to Hope, 1 run",0,56143,Shakib Al Hasan,0,17,0,2.5,8,300619,Rubel Hossain,0,24,1,4.0,17,581379,Shai Hope,25,48,2,0,670025,Shimron Hetmyer,12,14,1,0,5,False,0,0,0,0,0,27,3,0,False,,False,False,4.77,0,161,0,2,0,1,1,0,128
no run,4,West Indies,25,Bangladesh,2nd innings,0,"full on middle, and Hetmyer prefers going backwards to defend","Shakib Al Hasan to Hetmyer, no run",0,56143,Shakib Al Hasan,0,18,0,3.0,8,300619,Rubel Hossain,0,24,1,4.0,17,670025,Shimron Hetmyer,12,15,1,0,581379,Shai Hope,25,48,2,0,6,True,0,0,0,0,0,27,3,0,False,,False,False,4.74,0,162,0,2,0,1,1,0,128
no run,4,West Indies,25,Bangladesh,2nd innings,0,"full on off, and Hope punches this down the ground. Off the bat's inside half, though, and therefore Rubel intercepts","Rubel Hossain to Hope, no run",0,300619,Rubel Hossain,0,25,1,4.1,17,56143,Shakib Al Hasan,0,18,0,3.0,8,581379,Shai Hope,25,49,2,0,670025,Shimron Hetmyer,12,15,1,0,1,False,0,0,0,0,0,28,5,0,False,,False,False,4.71,0,163,0,2,0,1,1,0,128
run,4,West Indies,25,Bangladesh,2nd innings,1,"good length outside off, and crunched through the covers (off the back foot) to deep extra cover","Rubel Hossain to Hope, 1 run",0,300619,Rubel Hossain,0,26,1,4.2,18,56143,Shakib Al Hasan,0,18,0,3.0,8,581379,Shai Hope,26,50,2,0,670025,Shimron Hetmyer,12,15,1,0,2,False,0,0,0,0,0,28,5,0,False,,False,False,4.71,0,164,0,2,0,1,1,0,129
four,4,West Indies,25,Bangladesh,2nd innings,4,"good length on middle, and he inside edges this to the fine-leg boundary! Cramped for space as he attempted the punch off the back foot","Rubel Hossain to Hetmyer, FOUR runs",0,300619,Rubel Hossain,0,27,1,4.3,22,56143,Shakib Al Hasan,0,18,0,3.0,8,670025,Shimron Hetmyer,16,16,2,0,581379,Shai Hope,26,50,2,0,3,False,0,0,0,0,0,28,5,0,False,,False,False,4.83,0,165,0,2,0,1,1,0,133
no run,4,West Indies,25,Bangladesh,2nd innings,0,"good length on off, and defended off the back foot. But the ball goes past his outside edge and into the keeper's gloves. Bangladesh appeal, but not given! <b>They don't have a review</b>. Mashrafe thinks that was out, but alas. Replays show there was no edge","Rubel Hossain to Hetmyer, no run",0,300619,Rubel Hossain,0,28,1,4.4,22,56143,Shakib Al Hasan,0,18,0,3.0,8,670025,Shimron Hetmyer,16,17,2,0,581379,Shai Hope,26,50,2,0,4,False,0,0,0,0,0,28,5,0,False,,False,False,4.8,0,166,0,2,0,1,1,0,133
no run,4,West Indies,25,Bangladesh,2nd innings,0,"good length on middle, and he stays on the back foot, before running it down to third man","Rubel Hossain to Hetmyer, no run",0,300619,Rubel Hossain,0,29,1,4.5,22,56143,Shakib Al Hasan,0,18,0,3.0,8,670025,Shimron Hetmyer,16,18,2,0,581379,Shai Hope,26,50,2,0,5,False,0,0,0,0,0,28,5,0,False,,False,False,4.77,0,167,0,2,0,1,1,0,133
no run,4,West Indies,25,Bangladesh,2nd innings,0,"good length on middle, and defended tentatively to mid off","Rubel Hossain to Hetmyer, no run",0,300619,Rubel Hossain,0,30,1,5.0,22,56143,Shakib Al Hasan,0,18,0,3.0,8,670025,Shimron Hetmyer,16,19,2,0,581379,Shai Hope,26,50,2,0,6,True,0,0,0,0,0,28,5,0,False,,False,False,4.75,0,168,0,2,0,1,1,0,133
run,4,West Indies,25,Bangladesh,2nd innings,1,"good length outside off, and he cuts it away to deep point for a single","Shakib Al Hasan to Hope, 1 run",0,56143,Shakib Al Hasan,0,19,0,3.1,9,300619,Rubel Hossain,0,30,1,5.0,22,581379,Shai Hope,27,51,2,0,670025,Shimron Hetmyer,16,19,2,0,1,False,0,0,0,0,0,29,4,0,False,,False,False,4.75,0,169,0,2,0,1,1,0,134
run,4,West Indies,25,Bangladesh,2nd innings,1,"uses his feet! Full on leg stump, but he comes down the ground to try and lift off. Only manages to drill this down the ground to deep midwicket","Shakib Al Hasan to Hetmyer, 1 run",0,56143,Shakib Al Hasan,0,20,0,3.2,10,300619,Rubel Hossain,0,30,1,5.0,22,670025,Shimron Hetmyer,17,20,2,0,581379,Shai Hope,27,51,2,0,2,False,0,0,0,0,0,29,4,0,False,,False,False,4.76,0,170,0,2,0,1,1,0,135
run,4,West Indies,25,Bangladesh,2nd innings,1,"good length on middle, and angling into his body. Flicked away to square leg","Shakib Al Hasan to Hope, 1 run",0,56143,Shakib Al Hasan,0,21,0,3.3,11,300619,Rubel Hossain,0,30,1,5.0,22,581379,Shai Hope,28,52,2,0,670025,Shimron Hetmyer,17,20,2,0,3,False,0,0,0,0,0,29,4,0,False,,False,False,4.77,0,171,0,2,0,1,1,0,136
run,4,West Indies,25,Bangladesh,2nd innings,1,"flatter delivery on middle stump, but Hetmyer paddle sweeps this square to the fielder in the deep","Shakib Al Hasan to Hetmyer, 1 run",0,56143,Shakib Al Hasan,0,22,0,3.4,12,300619,Rubel Hossain,0,30,1,5.0,22,670025,Shimron Hetmyer,18,21,2,0,581379,Shai Hope,28,52,2,0,4,False,0,0,0,0,0,29,4,0,False,,False,False,4.77,0,172,0,2,0,1,1,0,137
no run,4,West Indies,25,Bangladesh,2nd innings,0,,"Shakib Al Hasan to Hope, no run",0,56143,Shakib Al Hasan,0,23,0,3.5,12,300619,Rubel Hossain,0,30,1,5.0,22,581379,Shai Hope,28,53,2,0,670025,Shimron Hetmyer,18,21,2,0,5,False,0,0,0,0,0,29,4,0,False,,False,False,4.75,0,173,0,2,0,1,1,0,137
no run,4,West Indies,25,Bangladesh,2nd innings,0,"good length outside off, and he tries to cut off the back foot. But the ball turns inwards, takes Hope's inside edge, and almost crashes into leg stump! Lucky","Shakib Al Hasan to Hope, no run",0,56143,Shakib Al Hasan,0,24,0,4.0,12,300619,Rubel Hossain,0,30,1,5.0,22,581379,Shai Hope,28,54,2,0,670025,Shimron Hetmyer,18,21,2,0,6,True,0,0,0,0,0,29,4,0,False,,False,False,4.72,0,174,0,2,0,1,1,0,137
run,4,West Indies,25,Bangladesh,2nd innings,1,"back of a length on middle, but Hetmyer pulls this down the ground to long on. Off the bat's inside half on this occasion","Rubel Hossain to Hetmyer, 1 run",0,300619,Rubel Hossain,0,31,1,5.1,23,56143,Shakib Al Hasan,0,24,0,4.0,12,670025,Shimron Hetmyer,19,22,2,0,581379,Shai Hope,28,54,2,0,1,False,0,0,0,0,0,30,6,0,False,,False,False,4.73,0,175,0,2,0,1,1,0,138
four,4,West Indies,25,Bangladesh,2nd innings,4,"full outside off, and he carves a drive past the diving cover fielder! Uses his wrists to place this brilliantly past the infielder. Shows the class he actually possesses","Rubel Hossain to Hope, FOUR runs",0,300619,Rubel Hossain,0,32,1,5.2,27,56143,Shakib Al Hasan,0,24,0,4.0,12,581379,Shai Hope,32,55,3,0,670025,Shimron Hetmyer,19,22,2,0,2,False,0,0,0,0,0,30,6,0,False,,False,False,4.84,0,176,0,2,0,1,1,0,142
no run,4,West Indies,25,Bangladesh,2nd innings,0,"good length outside off, and he punches this with the bat's open face. Straight to point","Rubel Hossain to Hope, no run",0,300619,Rubel Hossain,0,33,1,5.3,27,56143,Shakib Al Hasan,0,24,0,4.0,12,581379,Shai Hope,32,56,3,0,670025,Shimron Hetmyer,19,22,2,0,3,False,0,0,0,0,0,30,6,0,False,,False,False,4.81,0,177,0,2,0,1,1,0,142
no run,4,West Indies,25,Bangladesh,2nd innings,0,"full on middle, and he mistimes the straight drive off the front foot. Once again spliced off the bat's inside half. Goes to the bowler","Rubel Hossain to Hope, no run",0,300619,Rubel Hossain,0,34,1,5.4,27,56143,Shakib Al Hasan,0,24,0,4.0,12,581379,Shai Hope,32,57,3,0,670025,Shimron Hetmyer,19,22,2,0,4,False,0,0,0,0,0,30,6,0,False,,False,False,4.78,0,178,0,2,0,1,1,0,142
run,4,West Indies,25,Bangladesh,2nd innings,1,"full just outside off, and he defends with the bat's open face. Allows Hope to run this shot down to third man","Rubel Hossain to Hope, 1 run",0,300619,Rubel Hossain,0,35,1,5.5,28,56143,Shakib Al Hasan,0,24,0,4.0,12,581379,Shai Hope,33,58,3,0,670025,Shimron Hetmyer,19,22,2,0,5,False,0,0,0,0,0,30,6,0,False,,False,False,4.79,0,179,0,2,0,1,1,0,143
no run,4,West Indies,25,Bangladesh,2nd innings,0,"good length on off, but angling away from Hetmyer. He tried to drive square, but the ball kept moving away, eventually sneaking past the bat's outside edge as well","Rubel Hossain to Hetmyer, no run",0,300619,Rubel Hossain,0,36,1,6.0,28,56143,Shakib Al Hasan,0,24,0,4.0,12,670025,Shimron Hetmyer,19,23,2,0,581379,Shai Hope,33,58,3,0,6,True,0,0,0,0,0,30,6,0,False,,False,False,4.76,0,180,0,2,0,1,1,0,143
run,4,West Indies,25,Bangladesh,2nd innings,1,,"Shakib Al Hasan to Hope, 1 run",0,56143,Shakib Al Hasan,0,25,0,4.1,13,300619,Rubel Hossain,0,36,1,6.0,28,581379,Shai Hope,34,59,3,0,670025,Shimron Hetmyer,19,23,2,0,1,False,0,0,0,0,0,31,4,0,False,,False,False,4.77,0,181,0,2,0,1,1,0,144
no run,4,West Indies,25,Bangladesh,2nd innings,0,"<b>hits his face!</b> Full on middle, and he tries to paddle-sweep fine. But the ball hits his glove, and then the grille of his helmet","Shakib Al Hasan to Hetmyer, no run",0,56143,Shakib Al Hasan,0,26,0,4.2,13,300619,Rubel Hossain,0,36,1,6.0,28,670025,Shimron Hetmyer,19,24,2,0,581379,Shai Hope,34,59,3,0,2,False,0,0,0,0,0,31,4,0,False,,False,False,4.74,0,182,0,2,0,1,1,0,144
run,4,West Indies,25,Bangladesh,2nd innings,1,"full on middle, and worked towards the leg side","Shakib Al Hasan to Hetmyer, 1 run",0,56143,Shakib Al Hasan,0,27,0,4.3,14,300619,Rubel Hossain,0,36,1,6.0,28,670025,Shimron Hetmyer,20,25,2,0,581379,Shai Hope,34,59,3,0,3,False,0,0,0,0,0,31,4,0,False,,False,False,4.75,0,183,0,2,0,1,1,0,145
run,4,West Indies,25,Bangladesh,2nd innings,1,"length ball on off, and he goes onto the back foot. Whips a shot off his pads to the leg side","Shakib Al Hasan to Hope, 1 run",0,56143,Shakib Al Hasan,0,28,0,4.4,15,300619,Rubel Hossain,0,36,1,6.0,28,581379,Shai Hope,35,60,3,0,670025,Shimron Hetmyer,20,25,2,0,4,False,0,0,0,0,0,31,4,0,False,,False,False,4.76,0,184,0,2,0,1,1,0,146
no run,4,West Indies,25,Bangladesh,2nd innings,0,"drifting down leg, and Hetmyer goes down on one leg to paddle. Finds short fine leg","Shakib Al Hasan to Hetmyer, no run",0,56143,Shakib Al Hasan,0,29,0,4.5,15,300619,Rubel Hossain,0,36,1,6.0,28,670025,Shimron Hetmyer,20,26,2,0,581379,Shai Hope,35,60,3,0,5,False,0,0,0,0,0,31,4,0,False,,False,False,4.73,0,185,0,2,0,1,1,0,146
run,4,West Indies,25,Bangladesh,2nd innings,1,"good length outside off, but straightening after pitching. He goes onto the back foot and punches to long on","Shakib Al Hasan to Hetmyer, 1 run",0,56143,Shakib Al Hasan,0,30,0,5.0,16,300619,Rubel Hossain,0,36,1,6.0,28,670025,Shimron Hetmyer,21,27,2,0,581379,Shai Hope,35,60,3,0,6,True,0,0,0,0,0,31,4,0,False,,False,False,4.74,0,186,0,2,0,1,1,0,147
wide,4,West Indies,25,Bangladesh,2nd innings,2,"full, but down the leg side. Keeper can't collect either, and short fine leg runs to his left and intercepts","Mehidy Hasan Miraz to Hetmyer, 2 wides",0,629063,Mehidy Hasan,0,36,0,6.0,27,56143,Shakib Al Hasan,0,30,0,5.0,16,670025,Shimron Hetmyer,21,27,2,0,581379,Shai Hope,35,60,3,0,1,False,0,0,2,0,0,32,6,0,False,,False,False,4.8,0,186,0,2,0,1,1,2,149
no run,4,West Indies,25,Bangladesh,2nd innings,0,"good length outside off, and he walks across to the off side to cut","Mehidy Hasan Miraz to Hope, no run",0,629063,Mehidy Hasan,0,37,0,6.1,27,56143,Shakib Al Hasan,0,30,0,5.0,16,581379,Shai Hope,35,61,3,0,670025,Shimron Hetmyer,21,27,2,0,2,False,0,0,0,0,0,32,6,0,False,,False,False,4.78,0,187,0,2,0,1,1,0,149
no run,4,West Indies,25,Bangladesh,2nd innings,0,"tossed up outside off, and Hope goes for the expansive cover drive. Times it well too, but finds the infielder","Mehidy Hasan Miraz to Hope, no run",0,629063,Mehidy Hasan,0,38,0,6.2,27,56143,Shakib Al Hasan,0,30,0,5.0,16,581379,Shai Hope,35,62,3,0,670025,Shimron Hetmyer,21,27,2,0,3,False,0,0,0,0,0,32,6,0,False,,False,False,4.75,0,188,0,2,0,1,1,0,149
run,4,West Indies,25,Bangladesh,2nd innings,1,"good length on off, and Hope opens his stance to work this to the leg side. Played to midwicket","Mehidy Hasan Miraz to Hope, 1 run",0,629063,Mehidy Hasan,0,39,0,6.3,28,56143,Shakib Al Hasan,0,30,0,5.0,16,581379,Shai Hope,36,63,3,0,670025,Shimron Hetmyer,21,27,2,0,4,False,0,0,0,0,0,32,6,0,False,,False,False,4.76,0,189,0,2,0,1,1,0,150
run,4,West Indies,25,Bangladesh,2nd innings,1,"good length outside off, and Hetmyer carves a cut off the back foot to the fielder in the deep","Mehidy Hasan Miraz to Hetmyer, 1 run",0,629063,Mehidy Hasan,0,40,0,6.4,29,56143,Shakib Al Hasan,0,30,0,5.0,16,670025,Shimron Hetmyer,22,28,2,0,581379,Shai Hope,36,63,3,0,5,False,0,0,0,0,0,32,6,0,False,,False,False,4.76,0,190,0,2,0,1,1,0,151
run,4,West Indies,25,Bangladesh,2nd innings,2,"<b>goes for the big shot! But dropped!</b> Full outside off, and spinning away after pitching. Hope goes for the big inside-out lift over extra cover, but slices it in the air. Rubel - at long off - runs to his right to take the catch, but he fluffs it","Mehidy Hasan Miraz to Hope, 2 runs",0,629063,Mehidy Hasan,0,41,0,6.5,31,56143,Shakib Al Hasan,0,30,0,5.0,16,581379,Shai Hope,38,64,3,0,670025,Shimron Hetmyer,22,28,2,0,6,False,0,0,0,0,0,32,6,0,False,,False,False,4.8,0,191,0,2,0,1,1,0,153
no run,4,West Indies,25,Bangladesh,2nd innings,0,"good length on off, and he paddles this square to short fine leg","Mehidy Hasan Miraz to Hope, no run",0,629063,Mehidy Hasan,0,42,0,7.0,31,56143,Shakib Al Hasan,0,30,0,5.0,16,581379,Shai Hope,38,65,3,0,670025,Shimron Hetmyer,22,28,2,0,7,True,0,0,0,0,0,32,6,0,False,,False,False,4.78,0,192,0,2,0,1,1,0,153
no run,4,West Indies,25,Bangladesh,2nd innings,0,"good length on off, and he punches this down the ground. But Mashrafe, at short mid on, runs to his right and stops the ball","Shakib Al Hasan to Hetmyer, no run",0,56143,Shakib Al Hasan,0,31,0,5.1,16,629063,Mehidy Hasan,0,42,0,7.0,31,670025,Shimron Hetmyer,22,29,2,0,581379,Shai Hope,38,65,3,0,1,False,0,0,0,0,0,33,3,0,False,,False,False,4.75,0,193,0,2,0,1,1,0,153
no run,4,West Indies,25,Bangladesh,2nd innings,0,"full on middle, and going down leg. Hetmyer taps it to the leg side","Shakib Al Hasan to Hetmyer, no run",0,56143,Shakib Al Hasan,0,32,0,5.2,16,629063,Mehidy Hasan,0,42,0,7.0,31,670025,Shimron Hetmyer,22,30,2,0,581379,Shai Hope,38,65,3,0,2,False,0,0,0,0,0,33,3,0,False,,False,False,4.73,0,194,0,2,0,1,1,0,153
no run,4,West Indies,25,Bangladesh,2nd innings,0,"quicker ball on leg stump. Hetmyer tries to place this past short fine leg, but the ball hits his pad instead","Shakib Al Hasan to Hetmyer, no run",0,56143,Shakib Al Hasan,0,33,0,5.3,16,629063,Mehidy Hasan,0,42,0,7.0,31,670025,Shimron Hetmyer,22,31,2,0,581379,Shai Hope,38,65,3,0,3,False,0,0,0,0,0,33,3,0,False,,False,False,4.7,0,195,0,2,0,1,1,0,153
run,4,West Indies,25,Bangladesh,2nd innings,2,"he's drifting down leg once again, and this time Hetmyer connects with the paddle shot he was attempting. Beats short fine leg, but deep square leg does well to intercept. <b>Fifty partnership too</b>","Shakib Al Hasan to Hetmyer, 2 runs",0,56143,Shakib Al Hasan,0,34,0,5.4,18,629063,Mehidy Hasan,0,42,0,7.0,31,670025,Shimron Hetmyer,24,32,2,0,581379,Shai Hope,38,65,3,0,4,False,0,0,0,0,0,33,3,0,False,,False,False,4.74,0,196,0,2,0,1,1,0,155
no run,4,West Indies,25,Bangladesh,2nd innings,0,"good length outside off, and Hetmyer cuts it off the back foot to point","Shakib Al Hasan to Hetmyer, no run",0,56143,Shakib Al Hasan,0,35,0,5.5,18,629063,Mehidy Hasan,0,42,0,7.0,31,670025,Shimron Hetmyer,24,33,2,0,581379,Shai Hope,38,65,3,0,5,False,0,0,0,0,0,33,3,0,False,,False,False,4.72,0,197,0,2,0,1,1,0,155
run,4,West Indies,25,Bangladesh,2nd innings,1,"stays low! Lands on middle, and Hetmyer drags a pull off the back foot to cow corner","Shakib Al Hasan to Hetmyer, 1 run",0,56143,Shakib Al Hasan,0,36,0,6.0,19,629063,Mehidy Hasan,0,42,0,7.0,31,670025,Shimron Hetmyer,25,34,2,0,581379,Shai Hope,38,65,3,0,6,True,0,0,0,0,0,33,3,0,False,,False,False,4.72,0,198,0,2,0,1,1,0,156
run,4,West Indies,25,Bangladesh,2nd innings,1,"flat on middle, and Hetmyer backs away to make some extra room. Bunts a punch to long off for a single","Mehidy Hasan Miraz to Hetmyer, 1 run",0,629063,Mehidy Hasan,0,43,0,7.1,32,56143,Shakib Al Hasan,0,36,0,6.0,19,670025,Shimron Hetmyer,26,35,2,0,581379,Shai Hope,38,65,3,0,1,False,0,0,0,0,0,34,7,0,False,,False,False,4.73,0,199,0,2,0,1,1,0,157
run,4,West Indies,25,Bangladesh,2nd innings,1,"full on off, and he works it off his pads to the leg side with soft hands","Mehidy Hasan Miraz to Hope, 1 run",0,629063,Mehidy Hasan,0,44,0,7.2,33,56143,Shakib Al Hasan,0,36,0,6.0,19,581379,Shai Hope,39,66,3,0,670025,Shimron Hetmyer,26,35,2,0,2,False,0,0,0,0,0,34,7,0,False,,False,False,4.74,0,200,0,2,0,1,1,0,158
run,4,West Indies,25,Bangladesh,2nd innings,1,"length ball outside off, and he drags a pull to the square fielder on the leg side","Mehidy Hasan Miraz to Hetmyer, 1 run",0,629063,Mehidy Hasan,0,45,0,7.3,34,56143,Shakib Al Hasan,0,36,0,6.0,19,670025,Shimron Hetmyer,27,36,2,0,581379,Shai Hope,39,66,3,0,3,False,0,0,0,0,0,34,7,0,False,,False,False,4.74,0,201,0,2,0,1,1,0,159
run,4,West Indies,25,Bangladesh,2nd innings,2,"tossed up just outside off, and he pushes at it with soft hands to cover. They take a quick single, and the fielder has a shy at the non-striker's stumps! He misses, and Shakib's not backing up either, so West Indies earn an extra run","Mehidy Hasan Miraz to Hope, 2 runs",0,629063,Mehidy Hasan,0,46,0,7.4,36,56143,Shakib Al Hasan,0,36,0,6.0,19,581379,Shai Hope,41,67,3,0,670025,Shimron Hetmyer,27,36,2,0,4,False,0,0,0,0,0,34,7,0,False,,False,False,4.78,0,202,0,2,0,1,1,0,161
run,4,West Indies,25,Bangladesh,2nd innings,1,"low full toss just outside off, and it's been driven with the angled bat to cover point","Mehidy Hasan Miraz to Hope, 1 run",0,629063,Mehidy Hasan,0,47,0,7.5,37,56143,Shakib Al Hasan,0,36,0,6.0,19,581379,Shai Hope,42,68,3,0,670025,Shimron Hetmyer,27,36,2,0,5,False,0,0,0,0,0,34,7,0,False,,False,False,4.78,0,203,0,2,0,1,1,0,162
run,4,West Indies,25,Bangladesh,2nd innings,1,"full outside off, and that's been pushed away to the fielder at deep extra cover. <b>Drinks as well</b>","Mehidy Hasan Miraz to Hetmyer, 1 run",0,629063,Mehidy Hasan,0,48,0,8.0,38,56143,Shakib Al Hasan,0,36,0,6.0,19,670025,Shimron Hetmyer,28,37,2,0,581379,Shai Hope,42,68,3,0,6,True,0,0,0,0,0,34,7,0,False,,False,False,4.79,0,204,0,2,0,1,1,0,163
no run,4,West Indies,25,Bangladesh,2nd innings,0,"full on middle, and he makes some room. Punches to cover off the back foot, but finds Mehidy there","Shakib Al Hasan to Hetmyer, no run",0,56143,Shakib Al Hasan,0,37,0,6.1,19,629063,Mehidy Hasan,0,48,0,8.0,38,670025,Shimron Hetmyer,28,38,2,0,581379,Shai Hope,42,68,3,0,1,False,0,0,0,0,0,35,6,0,False,,False,False,4.77,0,205,0,2,0,1,1,0,163
run,4,West Indies,25,Bangladesh,2nd innings,1,"good length on leg stump, and he has no trouble in flicking the ball off his hips to square leg","Shakib Al Hasan to Hetmyer, 1 run",0,56143,Shakib Al Hasan,0,38,0,6.2,20,629063,Mehidy Hasan,0,48,0,8.0,38,670025,Shimron Hetmyer,29,39,2,0,581379,Shai Hope,42,68,3,0,2,False,0,0,0,0,0,35,6,0,False,,False,False,4.77,0,206,0,2,0,1,1,0,164
