PlayType_description,Batting_Team_id,Batting_Team_name,Bowling_Team_id,Bowling_Team_name,Innings,Total_Runs_on_delivery,Commentary,Commentary_short,Score,Bowler_id,Bowler_name,Bowler_maiden,Bowler_balls,Bowler_wickets,Bowler_over,Bowler_conceded,Other_Bowler_id,Other_Bowler_name,Other_Bowler_maidens,Other_Bowler_balls,Other_Bowler_wickets,Other_Bowler_overs,Other_Bowler_conceded,Batsman_id,Batsman_name,Batsman_runs,Batsman_balls_faced,Batsman_four,Batsman_sixes,Other_Batsman_id,Other_Batsman_name,Other_Batsman_runs,Other_Batsman_balls_faced,Other_Batsman_four,Other_Batsman_sixes,Over_ball,Over_complete,Over_maiden,Over_no_Ball,Over_wide,Over_byes,Over_leg_byes,Over_number,Over_runs,Over_wickets,Dismissal_is_true,Dismissal_type,Dismissal_fielder_iskeeper,Dismissal_text,Innings_run_rate,Innings_byes,Innings_balls,Innings_no_balls,Innings_wickets,Innings_leg_byes,Innings_session,Innings_day,Innings_wides,Innings_runs
run,25,Bangladesh,4,West Indies,1st innings,1,"full outside off, and he laces this drive through the covers. But well stopped by cover","Paul to Mahmudullah, 1 run",224/4,677081,Keemo Paul,0,31,0,5.1,36,391485,Jason Holder,0,48,1,8.0,44,56025,Mahmudullah,31,30,2,1,56007,Mashrafe Mortaza,19,11,3,0,1,False,0,0,0,0,0,43,8,0,False,,False,False,5.31,0,253,0,4,0,1,1,0,224
no run,25,Bangladesh,4,West Indies,1st innings,0,"slower ball, but wide and full outside off. Forces Mortaza to reach at it, and he mistimes a shot to cover","Paul to Mashrafe Mortaza, no run",224/4,677081,Keemo Paul,0,32,0,5.2,36,391485,Jason Holder,0,48,1,8.0,44,56007,Mashrafe Mortaza,19,12,3,0,56025,Mahmudullah,31,30,2,1,2,False,0,0,0,0,0,43,8,0,False,,False,False,5.29,0,254,0,4,0,1,1,0,224
run,25,Bangladesh,4,West Indies,1st innings,1,"full outside off, and he tries to slog a shot down the ground. Places this past Paul's left","Paul to Mashrafe Mortaza, 1 run",225/4,677081,Keemo Paul,0,33,0,5.3,37,391485,Jason Holder,0,48,1,8.0,44,56007,Mashrafe Mortaza,20,13,3,0,56025,Mahmudullah,31,30,2,1,3,False,0,0,0,0,0,43,8,0,False,,False,False,5.29,0,255,0,4,0,1,1,0,225
four,25,Bangladesh,4,West Indies,1st innings,4,"full outside off, and he slashes hard at this. Slices a drive, but the ball goes over gully for four!","Paul to Mahmudullah, FOUR runs",229/4,677081,Keemo Paul,0,34,0,5.4,41,391485,Jason Holder,0,48,1,8.0,44,56025,Mahmudullah,35,31,3,1,56007,Mashrafe Mortaza,20,13,3,0,4,False,0,0,0,0,0,43,8,0,False,,False,False,5.36,0,256,0,4,0,1,1,0,229
run,25,Bangladesh,4,West Indies,1st innings,1,"yorker just outside off, and he runs it down to third man for one","Paul to Mahmudullah, 1 run",230/4,677081,Keemo Paul,0,35,0,5.5,42,391485,Jason Holder,0,48,1,8.0,44,56025,Mahmudullah,36,32,3,1,56007,Mashrafe Mortaza,20,13,3,0,5,False,0,0,0,0,0,43,8,0,False,,False,False,5.36,0,257,0,4,0,1,1,0,230
run,25,Bangladesh,4,West Indies,1st innings,1,"short and wide outside off, and he flat-bats a pull down the ground. Nicks the non-striker's stumps on the way to long on","Paul to Mashrafe Mortaza, 1 run",231/4,677081,Keemo Paul,0,36,0,6.0,43,391485,Jason Holder,0,48,1,8.0,44,56007,Mashrafe Mortaza,21,14,3,0,56025,Mahmudullah,36,32,3,1,6,True,0,0,0,0,0,43,8,0,False,,False,False,5.37,0,258,0,4,0,1,1,0,231
six,25,Bangladesh,4,West Indies,1st innings,6,"improvisation! Mortaza goes really deep into his crease to try and earn a few extra seconds, and Holder bowls full outside off. Swings through the ball's line, and has enough behind his shot to beat long on!","Holder to Mashrafe Mortaza, SIX runs",237/4,391485,Jason Holder,0,49,1,8.1,50,677081,Keemo Paul,0,36,0,6.0,43,56007,Mashrafe Mortaza,27,15,3,1,56025,Mahmudullah,36,32,3,1,1,False,0,0,0,0,0,44,9,0,False,,False,False,5.49,0,259,0,4,0,1,1,0,237
no run,25,Bangladesh,4,West Indies,1st innings,0,"back of a length outside off, and Mashrafe tries to pull it fine down the leg side. Connects well, but finds the fielder at short fine leg","Holder to Mashrafe Mortaza, no run",237/4,391485,Jason Holder,0,50,1,8.2,50,677081,Keemo Paul,0,36,0,6.0,43,56007,Mashrafe Mortaza,27,16,3,1,56025,Mahmudullah,36,32,3,1,2,False,0,0,0,0,0,44,9,0,False,,False,False,5.46,0,260,0,4,0,1,1,0,237
run,25,Bangladesh,4,West Indies,1st innings,1,"back of a length on leg stump, and Mashrafe backs away to flat-bat a pull to wide long on","Holder to Mashrafe Mortaza, 1 run",238/4,391485,Jason Holder,0,51,1,8.3,51,677081,Keemo Paul,0,36,0,6.0,43,56007,Mashrafe Mortaza,28,17,3,1,56025,Mahmudullah,36,32,3,1,3,False,0,0,0,0,0,44,9,0,False,,False,False,5.47,0,261,0,4,0,1,1,0,238
no run,25,Bangladesh,4,West Indies,1st innings,0,"slower ball but short on middle stump. Goes over Mahmudullah's head, but the umpire says that's not a wide","Holder to Mahmudullah, no run",238/4,391485,Jason Holder,0,52,1,8.4,51,677081,Keemo Paul,0,36,0,6.0,43,56025,Mahmudullah,36,33,3,1,56007,Mashrafe Mortaza,28,17,3,1,4,False,0,0,0,0,0,44,9,0,False,,False,False,5.45,0,262,0,4,0,1,1,0,238
run,25,Bangladesh,4,West Indies,1st innings,1,"full on leg, and he clips it away to deep fine leg for one","Holder to Mahmudullah, 1 run",239/4,391485,Jason Holder,0,53,1,8.5,52,677081,Keemo Paul,0,36,0,6.0,43,56025,Mahmudullah,37,34,3,1,56007,Mashrafe Mortaza,28,17,3,1,5,False,0,0,0,0,0,44,9,0,False,,False,False,5.45,0,263,0,4,0,1,1,0,239
run,25,Bangladesh,4,West Indies,1st innings,1,"<b>what was that?!</b> Short ball on middle, and Mahmudullah tries to reverse-pull (yes, you read that right). He's tangled up, but manages to top-edge the shot to the keeper. <B>Dropped though!</b>","Holder to Mashrafe Mortaza, 1 run",240/4,391485,Jason Holder,0,54,1,9.0,53,677081,Keemo Paul,0,36,0,6.0,43,56007,Mashrafe Mortaza,29,18,3,1,56025,Mahmudullah,37,34,3,1,6,True,0,0,0,0,0,44,9,0,False,,False,False,5.45,0,264,0,4,0,1,1,0,240
no run,25,Bangladesh,4,West Indies,1st innings,0,"yorker just outside off, and the batsman can't get bat to ball","Paul to Mashrafe Mortaza, no run",240/4,677081,Keemo Paul,0,37,0,6.1,43,391485,Jason Holder,0,54,1,9.0,53,56007,Mashrafe Mortaza,29,19,3,1,56025,Mahmudullah,37,34,3,1,1,False,0,0,0,0,0,45,11,0,False,,False,False,5.43,0,265,0,4,0,1,1,0,240
four,25,Bangladesh,4,West Indies,1st innings,4,"<b>slashes and slashes hard!</b> That cliche best describes this shot. Full outside off, but his hard followthrough of the bat takes the shot past the keeper's right for four","Paul to Mashrafe Mortaza, FOUR runs",244/4,677081,Keemo Paul,0,38,0,6.2,47,391485,Jason Holder,0,54,1,9.0,53,56007,Mashrafe Mortaza,33,20,4,1,56025,Mahmudullah,37,34,3,1,2,False,0,0,0,0,0,45,11,0,False,,False,False,5.5,0,266,0,4,0,1,1,0,244
run,25,Bangladesh,4,West Indies,1st innings,1,"full on off, and he drills a drive to Paul. Stopped by him, but they still manage to steal a single","Paul to Mashrafe Mortaza, 1 run",245/4,677081,Keemo Paul,0,39,0,6.3,48,391485,Jason Holder,0,54,1,9.0,53,56007,Mashrafe Mortaza,34,21,4,1,56025,Mahmudullah,37,34,3,1,3,False,0,0,0,0,0,45,11,0,False,,False,False,5.5,0,267,0,4,0,1,1,0,245
four,25,Bangladesh,4,West Indies,1st innings,4,"full and wide outside off, and Mahmudullah tries to chase at it. Attempts to drive over cover, but the outside edge once again takes the ball past the keeper's right","Paul to Mahmudullah, FOUR runs",249/4,677081,Keemo Paul,0,40,0,6.4,52,391485,Jason Holder,0,54,1,9.0,53,56025,Mahmudullah,41,35,4,1,56007,Mashrafe Mortaza,34,21,4,1,4,False,0,0,0,0,0,45,11,0,False,,False,False,5.57,0,268,0,4,0,1,1,0,249
run,25,Bangladesh,4,West Indies,1st innings,1,"yorker just outside off, and he wedges this to short third man. <b>Brings up Bangladesh's 250!</b>","Paul to Mahmudullah, 1 run",250/4,677081,Keemo Paul,0,41,0,6.5,53,391485,Jason Holder,0,54,1,9.0,53,56025,Mahmudullah,42,36,4,1,56007,Mashrafe Mortaza,34,21,4,1,5,False,0,0,0,0,0,45,11,0,False,,False,False,5.57,0,269,0,4,0,1,1,0,250
run,25,Bangladesh,4,West Indies,1st innings,1,"yorker on off, but he manages to drive it down the ground for a single. <B>Partnership of 51 off 37 balls now</b>","Paul to Mashrafe Mortaza, 1 run",251/4,677081,Keemo Paul,0,42,0,7.0,54,391485,Jason Holder,0,54,1,9.0,53,56007,Mashrafe Mortaza,35,22,4,1,56025,Mahmudullah,42,36,4,1,6,True,0,0,0,0,0,45,11,0,False,,False,False,5.57,0,270,0,4,0,1,1,0,251
no run,25,Bangladesh,4,West Indies,1st innings,0,<b>reverse pulled again!</b> But Mortaza can't connect. The back of a length delivery goes over his bat and through to the keeper,"Holder to Mashrafe Mortaza, no run",251/4,391485,Jason Holder,0,55,1,9.1,53,677081,Keemo Paul,0,42,0,7.0,54,56007,Mashrafe Mortaza,35,23,4,1,56025,Mahmudullah,42,36,4,1,1,False,0,0,0,0,0,46,2,1,False,,False,False,5.55,0,271,0,4,0,1,1,0,251
run,25,Bangladesh,4,West Indies,1st innings,1,"length ball on off, and he swings across the line to deep midwicket for one","Holder to Mashrafe Mortaza, 1 run",252/4,391485,Jason Holder,0,56,1,9.2,54,677081,Keemo Paul,0,42,0,7.0,54,56007,Mashrafe Mortaza,36,24,4,1,56025,Mahmudullah,42,36,4,1,2,False,0,0,0,0,0,46,2,1,False,,False,False,5.55,0,272,0,4,0,1,1,0,252
no run,25,Bangladesh,4,West Indies,1st innings,0,"good length on leg stump, but going down the leg side","Holder to Mahmudullah, no run",252/4,391485,Jason Holder,0,57,1,9.3,54,677081,Keemo Paul,0,42,0,7.0,54,56025,Mahmudullah,42,37,4,1,56007,Mashrafe Mortaza,36,24,4,1,3,False,0,0,0,0,0,46,2,1,False,,False,False,5.53,0,273,0,4,0,1,1,0,252
run,25,Bangladesh,4,West Indies,1st innings,1,"good length outside leg, and he pulls this to fine leg for a single","Holder to Mahmudullah, 1 run",253/4,391485,Jason Holder,0,58,1,9.4,55,677081,Keemo Paul,0,42,0,7.0,54,56025,Mahmudullah,43,38,4,1,56007,Mashrafe Mortaza,36,24,4,1,4,False,0,0,0,0,0,46,2,1,False,,False,False,5.54,0,274,0,4,0,1,1,0,253
out,25,Bangladesh,4,West Indies,1st innings,0,"<b>glanced straight to short third man!</b> Mortaza was making room and Holder followed him. He tries to ramp this short ball over the infield, but the shot doesn't come off the bat's sweet spot","Holder to Mashrafe Mortaza, OUT",253/5,391485,Jason Holder,0,59,2,9.5,55,677081,Keemo Paul,0,42,0,7.0,54,56007,Mashrafe Mortaza,36,25,4,1,56025,Mahmudullah,43,38,4,1,5,False,0,0,0,0,0,46,2,1,True,caught,False,Mashrafe Mortaza c Gayle b Holder 36 (25b 4x4 1x6) SR: 144.00,5.52,0,275,0,5,0,1,1,0,253
no run,25,Bangladesh,4,West Indies,1st innings,0,"back of a length on leg stump, but going down leg. Not given a wide though as the batsman swiveled in an attempt to pull","Holder to Sabbir Rahman, no run",253/5,391485,Jason Holder,0,60,2,10.0,55,677081,Keemo Paul,0,42,0,7.0,54,373538,Sabbir Rahman,0,1,0,0,56025,Mahmudullah,43,38,4,1,6,True,0,0,0,0,0,46,2,1,False,,False,False,5.5,0,276,0,5,0,1,1,0,253
run,25,Bangladesh,4,West Indies,1st innings,1,"low full toss on off, and driven to cover for a single","Cottrell to Mahmudullah, 1 run",254/5,495551,Sheldon Cottrell,0,43,0,7.1,35,391485,Jason Holder,0,60,2,10.0,55,56025,Mahmudullah,44,39,4,1,373538,Sabbir Rahman,0,1,0,0,1,False,0,0,0,0,0,47,6,0,False,,False,False,5.5,0,277,0,5,0,1,1,0,254
run,25,Bangladesh,4,West Indies,1st innings,1,"full outside off, but Sabbir can't lap sweep this away to the leg side. Connects well, but his front leg comes in the ball's way, and it ricochets away to the off side","Cottrell to Sabbir Rahman, 1 run",255/5,495551,Sheldon Cottrell,0,44,0,7.2,36,391485,Jason Holder,0,60,2,10.0,55,373538,Sabbir Rahman,1,2,0,0,56025,Mahmudullah,44,39,4,1,2,False,0,0,0,0,0,47,6,0,False,,False,False,5.5,0,278,0,5,0,1,1,0,255
run,25,Bangladesh,4,West Indies,1st innings,2,"full outside off, and the drive has been sliced over point to the fielder in the deep","Cottrell to Mahmudullah, 2 runs",257/5,495551,Sheldon Cottrell,0,45,0,7.3,38,391485,Jason Holder,0,60,2,10.0,55,56025,Mahmudullah,46,40,4,1,373538,Sabbir Rahman,1,2,0,0,3,False,0,0,0,0,0,47,6,0,False,,False,False,5.52,0,279,0,5,0,1,1,0,257
run,25,Bangladesh,4,West Indies,1st innings,1,"length ball on off, and he dabs this down to third man for a single","Cottrell to Mahmudullah, 1 run",258/5,495551,Sheldon Cottrell,0,46,0,7.4,39,391485,Jason Holder,0,60,2,10.0,55,56025,Mahmudullah,47,41,4,1,373538,Sabbir Rahman,1,2,0,0,4,False,0,0,0,0,0,47,6,0,False,,False,False,5.52,0,280,0,5,0,1,1,0,258
run,25,Bangladesh,4,West Indies,1st innings,1,"full outside off, and he goes for a slog to the leg side. The ball isn't timed well","Cottrell to Sabbir Rahman, 1 run",259/5,495551,Sheldon Cottrell,0,47,0,7.5,40,391485,Jason Holder,0,60,2,10.0,55,373538,Sabbir Rahman,2,3,0,0,56025,Mahmudullah,47,41,4,1,5,False,0,0,0,0,0,47,6,0,False,,False,False,5.53,0,281,0,5,0,1,1,0,259
no run,25,Bangladesh,4,West Indies,1st innings,0,"full outside off, but the slower ball goes under his bat and through to the keeper","Cottrell to Mahmudullah, no run",259/5,495551,Sheldon Cottrell,0,48,0,8.0,40,391485,Jason Holder,0,60,2,10.0,55,56025,Mahmudullah,47,42,4,1,373538,Sabbir Rahman,2,3,0,0,6,True,0,0,0,0,0,47,6,0,False,,False,False,5.51,0,282,0,5,0,1,1,0,259
no run,25,Bangladesh,4,West Indies,1st innings,0,"starts off with the short ball. Lands on middle, and goes over Sabbir's head","Paul to Sabbir Rahman, no run",259/5,677081,Keemo Paul,0,43,0,7.1,54,495551,Sheldon Cottrell,0,48,0,8.0,40,373538,Sabbir Rahman,2,4,0,0,56025,Mahmudullah,47,42,4,1,1,False,0,0,0,0,0,48,11,0,False,,False,False,5.49,0,283,0,5,0,1,1,0,259
run,25,Bangladesh,4,West Indies,1st innings,1,"yorker on leg, and he nudges this fine for a single. Wants two, but they change their mind quickly","Paul to Sabbir Rahman, 1 run",260/5,677081,Keemo Paul,0,44,0,7.2,55,495551,Sheldon Cottrell,0,48,0,8.0,40,373538,Sabbir Rahman,3,5,0,0,56025,Mahmudullah,47,42,4,1,2,False,0,0,0,0,0,48,11,0,False,,False,False,5.49,0,284,0,5,0,1,1,0,260
run,25,Bangladesh,4,West Indies,1st innings,1,"length ball outside off, and that's been mistimed to point","Paul to Mahmudullah, 1 run",261/5,677081,Keemo Paul,0,45,0,7.3,56,495551,Sheldon Cottrell,0,48,0,8.0,40,56025,Mahmudullah,48,43,4,1,373538,Sabbir Rahman,3,5,0,0,3,False,0,0,0,0,0,48,11,0,False,,False,False,5.49,0,285,0,5,0,1,1,0,261
run,25,Bangladesh,4,West Indies,1st innings,1,"good length outside off, and he backs away to flat-bat a pull to wide long on","Paul to Sabbir Rahman, 1 run",262/5,677081,Keemo Paul,0,46,0,7.4,57,495551,Sheldon Cottrell,0,48,0,8.0,40,373538,Sabbir Rahman,4,6,0,0,56025,Mahmudullah,48,43,4,1,4,False,0,0,0,0,0,48,11,0,False,,False,False,5.49,0,286,0,5,0,1,1,0,262
wide,25,Bangladesh,4,West Indies,1st innings,1,"full outside leg stump, but Mahmudullah can't flick it fine. No worries, cause it's a wide anyway","Paul to Mahmudullah, 1 wide",263/5,677081,Keemo Paul,0,46,0,7.4,58,495551,Sheldon Cottrell,0,48,0,8.0,40,56025,Mahmudullah,48,43,4,1,373538,Sabbir Rahman,4,6,0,0,5,False,0,0,1,0,0,48,11,0,False,,False,False,5.51,0,286,0,5,0,1,1,1,263
six,25,Bangladesh,4,West Indies,1st innings,6,"full on middle, but he comes down the ground and <b>smashes it</b> over long on! Classy way to get to <b>fifty</b>","Paul to Mahmudullah, SIX runs",269/5,677081,Keemo Paul,0,47,0,7.5,64,495551,Sheldon Cottrell,0,48,0,8.0,40,56025,Mahmudullah,54,44,4,2,373538,Sabbir Rahman,4,6,0,0,6,False,0,0,0,0,0,48,11,0,False,,False,False,5.62,0,287,0,5,0,1,1,0,269
run,25,Bangladesh,4,West Indies,1st innings,1,"slower ball outside off, and he clips this away to backward square leg for a single","Paul to Mahmudullah, 1 run",270/5,677081,Keemo Paul,0,48,0,8.0,65,495551,Sheldon Cottrell,0,48,0,8.0,40,56025,Mahmudullah,55,45,4,2,373538,Sabbir Rahman,4,6,0,0,7,True,0,0,0,0,0,48,11,0,False,,False,False,5.62,0,288,0,5,0,1,1,0,270
run,25,Bangladesh,4,West Indies,1st innings,1,"full outside off, but his drive over extra cover doesn't come off. Takes the bat's inside edge and rolls away to the leg side","Cottrell to Mahmudullah, 1 run",271/5,495551,Sheldon Cottrell,0,49,0,8.1,41,677081,Keemo Paul,0,48,0,8.0,65,56025,Mahmudullah,56,46,4,2,373538,Sabbir Rahman,4,6,0,0,1,False,0,0,0,0,0,49,19,1,False,,False,False,5.62,0,289,0,5,0,1,1,0,271
four,25,Bangladesh,4,West Indies,1st innings,4,"full on middle, and that's been clipped off his legs for a boundary! Whips it away behind square, and fine leg is just too fine","Cottrell to Sabbir Rahman, FOUR runs",275/5,495551,Sheldon Cottrell,0,50,0,8.2,45,677081,Keemo Paul,0,48,0,8.0,65,373538,Sabbir Rahman,8,7,1,0,56025,Mahmudullah,56,46,4,2,2,False,0,0,0,0,0,49,19,1,False,,False,False,5.68,0,290,0,5,0,1,1,0,275
four,25,Bangladesh,4,West Indies,1st innings,4,"slower ball on off, but he picks the short length early, and swings across to the leg side. Aims at cow corner, and finds another boundary","Cottrell to Sabbir Rahman, FOUR runs",279/5,495551,Sheldon Cottrell,0,51,0,8.3,49,677081,Keemo Paul,0,48,0,8.0,65,373538,Sabbir Rahman,12,8,2,0,56025,Mahmudullah,56,46,4,2,3,False,0,0,0,0,0,49,19,1,False,,False,False,5.75,0,291,0,5,0,1,1,0,279
out,25,Bangladesh,4,West Indies,1st innings,0,"full outside off, and his attempted slog doesn't come off. Slices this shot, and Lewis takes this skyer at point","Cottrell to Sabbir Rahman, OUT",279/6,495551,Sheldon Cottrell,0,52,1,8.4,49,677081,Keemo Paul,0,48,0,8.0,65,373538,Sabbir Rahman,12,9,2,0,56025,Mahmudullah,56,46,4,2,4,False,0,0,0,0,0,49,19,1,True,caught,False,Sabbir Rahman c Lewis b Cottrell 12 (9b 2x4 0x6) SR: 133.33,5.73,0,292,0,6,0,1,1,0,279
six,25,Bangladesh,4,West Indies,1st innings,6,<b>golf ball swing!</b> Full on middle but Mahmudullah comes down the wicket and tonks it over long on. Picks the slower ball early once again,"Cottrell to Mahmudullah, SIX runs",285/6,495551,Sheldon Cottrell,0,53,1,8.5,55,677081,Keemo Paul,0,48,0,8.0,65,56025,Mahmudullah,62,47,4,3,550133,Mosaddek Hossain,0,0,0,0,5,False,0,0,0,0,0,49,19,1,False,,False,False,5.83,0,293,0,6,0,1,1,0,285
four,25,Bangladesh,4,West Indies,1st innings,4,"<b>glorious late cut!</b> Length ball outside off, and he places this perfectly behind point for a boundary. <B>Massive over</b>","Cottrell to Mahmudullah, FOUR runs",289/6,495551,Sheldon Cottrell,0,54,1,9.0,59,677081,Keemo Paul,0,48,0,8.0,65,56025,Mahmudullah,66,48,5,3,550133,Mosaddek Hossain,0,0,0,0,6,True,0,0,0,0,0,49,19,1,False,,False,False,5.89,0,294,0,6,0,1,1,0,289
run,25,Bangladesh,4,West Indies,1st innings,1,length ball on leg and Mosaddek backs away. Pulls down the ground to long on,"Paul to Mosaddek Hossain, 1 run",290/6,677081,Keemo Paul,0,49,0,8.1,66,495551,Sheldon Cottrell,0,54,1,9.0,59,550133,Mosaddek Hossain,1,1,0,0,56025,Mahmudullah,66,48,5,3,1,False,0,0,0,0,0,50,12,0,False,,False,False,5.89,0,295,0,6,0,1,1,0,290
run,25,Bangladesh,4,West Indies,1st innings,1,"back of a length on middle, and he swivels to pull. Finds fine leg","Paul to Mahmudullah, 1 run",291/6,677081,Keemo Paul,0,50,0,8.2,67,495551,Sheldon Cottrell,0,54,1,9.0,59,56025,Mahmudullah,67,49,5,3,550133,Mosaddek Hossain,1,1,0,0,2,False,0,0,0,0,0,50,12,0,False,,False,False,5.89,0,296,0,6,0,1,1,0,291
four,25,Bangladesh,4,West Indies,1st innings,4,"back of a length on middle, but Mosaddek swings away and finds the gap on the leg side! Beats deep midwicket to earn four","Paul to Mosaddek Hossain, FOUR runs",295/6,677081,Keemo Paul,0,51,0,8.3,71,495551,Sheldon Cottrell,0,54,1,9.0,59,550133,Mosaddek Hossain,5,2,1,0,56025,Mahmudullah,67,49,5,3,3,False,0,0,0,0,0,50,12,0,False,,False,False,5.95,0,297,0,6,0,1,1,0,295
run,25,Bangladesh,4,West Indies,1st innings,2,"full outside leg stump, and he backs away to drill a drive to long off","Paul to Mosaddek Hossain, 2 runs",297/6,677081,Keemo Paul,0,52,0,8.4,73,495551,Sheldon Cottrell,0,54,1,9.0,59,550133,Mosaddek Hossain,7,3,1,0,56025,Mahmudullah,67,49,5,3,4,False,0,0,0,0,0,50,12,0,False,,False,False,5.97,0,298,0,6,0,1,1,0,297
run,25,Bangladesh,4,West Indies,1st innings,2,"back of a length on middle, and the pull is well connected! But there are two men in the deep now, so they scamper back for two","Paul to Mosaddek Hossain, 2 runs",299/6,677081,Keemo Paul,0,53,0,8.5,75,495551,Sheldon Cottrell,0,54,1,9.0,59,550133,Mosaddek Hossain,9,4,1,0,56025,Mahmudullah,67,49,5,3,5,False,0,0,0,0,0,50,12,0,False,,False,False,6.0,0,299,0,6,0,1,1,0,299
run,25,Bangladesh,4,West Indies,1st innings,2,"full outside leg stump, and that's been shoveled to the vacant mid-wicket region. Enough time to steal a second and <B>Bangladesh finish on 301 for 6!</b>","Paul to Mosaddek Hossain, 2 runs",301/6,677081,Keemo Paul,0,54,0,9.0,77,495551,Sheldon Cottrell,0,54,1,9.0,59,550133,Mosaddek Hossain,11,5,1,0,56025,Mahmudullah,67,49,5,3,6,True,0,0,0,0,0,50,12,0,False,,False,False,6.02,0,300,0,6,0,1,1,0,301
run,4,West Indies,25,Bangladesh,2nd innings,1,"short of a length at off stump, dropped into the off side off the back foot","Mashrafe Mortaza to Gayle, 1 run",0,56007,Mashrafe Mortaza,0,1,0,0.1,1,False,False,0,0,0,False,0,51880,Chris Gayle,1,1,0,0,431901,Evin Lewis,0,0,0,0,1,False,0,0,0,0,0,1,1,0,False,,False,False,6.0,0,1,0,0,0,1,1,0,1
no run,4,West Indies,25,Bangladesh,2nd innings,0,"short of a length and wide outside off, left alone","Mashrafe Mortaza to Lewis, no run",0,56007,Mashrafe Mortaza,0,2,0,0.2,1,False,False,0,0,0,False,0,431901,Evin Lewis,0,1,0,0,51880,Chris Gayle,1,1,0,0,2,False,0,0,0,0,0,1,1,0,False,,False,False,3.0,0,2,0,0,0,1,1,0,1
no run,4,West Indies,25,Bangladesh,2nd innings,0,length ball lifts up and hits the handle as he looks to get forward and defend this,"Mashrafe Mortaza to Lewis, no run",0,56007,Mashrafe Mortaza,0,3,0,0.3,1,False,False,0,0,0,False,0,431901,Evin Lewis,0,2,0,0,51880,Chris Gayle,1,1,0,0,3,False,0,0,0,0,0,1,1,0,False,,False,False,2.0,0,3,0,0,0,1,1,0,1
no run,4,West Indies,25,Bangladesh,2nd innings,0,length ball slanted into the corridor. Left alone,"Mashrafe Mortaza to Lewis, no run",0,56007,Mashrafe Mortaza,0,4,0,0.4,1,False,False,0,0,0,False,0,431901,Evin Lewis,0,3,0,0,51880,Chris Gayle,1,1,0,0,4,False,0,0,0,0,0,1,1,0,False,,False,False,1.5,0,4,0,0,0,1,1,0,1
no run,4,West Indies,25,Bangladesh,2nd innings,0,<b>past the inside edge</b>as this length ball stays low. He's deep in the crease to try and defend this outside off but isn't close to connecting,"Mashrafe Mortaza to Lewis, no run",0,56007,Mashrafe Mortaza,0,5,0,0.5,1,False,False,0,0,0,False,0,431901,Evin Lewis,0,4,0,0,51880,Chris Gayle,1,1,0,0,5,False,0,0,0,0,0,1,1,0,False,,False,False,1.2,0,5,0,0,0,1,1,0,1
no run,4,West Indies,25,Bangladesh,2nd innings,0,nicely timed but straight to the fielder. Overpitched ball outside off and he gets his hands through this nicely,"Mashrafe Mortaza to Lewis, no run",0,56007,Mashrafe Mortaza,0,6,0,1.0,1,False,False,0,0,0,False,0,431901,Evin Lewis,0,5,0,0,51880,Chris Gayle,1,1,0,0,6,True,0,0,0,0,0,1,1,0,False,,False,False,1.0,0,6,0,0,0,1,1,0,1
no run,4,West Indies,25,Bangladesh,2nd innings,0,"length on off stump, blocked into the off side off the front foot","Mehidy Hasan Miraz to Gayle, no run",0,629063,Mehidy Hasan,0,1,0,0.1,0,56007,Mashrafe Mortaza,0,6,0,1.0,1,51880,Chris Gayle,1,2,0,0,431901,Evin Lewis,0,5,0,0,1,False,0,0,0,0,0,2,2,0,False,,False,False,0.85,0,7,0,0,0,1,1,0,1
no run,4,West Indies,25,Bangladesh,2nd innings,0,steps out against  short of a length ball and watches closely to block it in the end,"Mehidy Hasan Miraz to Gayle, no run",0,629063,Mehidy Hasan,0,2,0,0.2,0,56007,Mashrafe Mortaza,0,6,0,1.0,1,51880,Chris Gayle,1,3,0,0,431901,Evin Lewis,0,5,0,0,2,False,0,0,0,0,0,2,2,0,False,,False,False,0.75,0,8,0,0,0,1,1,0,1
run,4,West Indies,25,Bangladesh,2nd innings,1,"short of a length outside off, punched to long-off on the up","Mehidy Hasan Miraz to Gayle, 1 run",0,629063,Mehidy Hasan,0,3,0,0.3,1,56007,Mashrafe Mortaza,0,6,0,1.0,1,51880,Chris Gayle,2,4,0,0,431901,Evin Lewis,0,5,0,0,3,False,0,0,0,0,0,2,2,0,False,,False,False,1.33,0,9,0,0,0,1,1,0,2
no run,4,West Indies,25,Bangladesh,2nd innings,0,"short of a length outside off, tapped to cover on the up","Mehidy Hasan Miraz to Lewis, no run",0,629063,Mehidy Hasan,0,4,0,0.4,1,56007,Mashrafe Mortaza,0,6,0,1.0,1,431901,Evin Lewis,0,6,0,0,51880,Chris Gayle,2,4,0,0,4,False,0,0,0,0,0,2,2,0,False,,False,False,1.2,0,10,0,0,0,1,1,0,2
run,4,West Indies,25,Bangladesh,2nd innings,1,"length ball angled in at leg stump, clipped to deep midwicket off the back foot","Mehidy Hasan Miraz to Lewis, 1 run",0,629063,Mehidy Hasan,0,5,0,0.5,2,56007,Mashrafe Mortaza,0,6,0,1.0,1,431901,Evin Lewis,1,7,0,0,51880,Chris Gayle,2,4,0,0,5,False,0,0,0,0,0,2,2,0,False,,False,False,1.63,0,11,0,0,0,1,1,0,3
no run,4,West Indies,25,Bangladesh,2nd innings,0,"<b>raps the pad</b> but that's an arm ball, it's not straightening, it's hitting him in front of leg and it was delivered from wide of the crease. The lbw is turned down as Gayle misses on the flick","Mehidy Hasan Miraz to Gayle, no run",0,629063,Mehidy Hasan,0,6,0,1.0,2,56007,Mashrafe Mortaza,0,6,0,1.0,1,51880,Chris Gayle,2,5,0,0,431901,Evin Lewis,1,7,0,0,6,True,0,0,0,0,0,2,2,0,False,,False,False,1.5,0,12,0,0,0,1,1,0,3
no run,4,West Indies,25,Bangladesh,2nd innings,0,full outside off. Mistimed drive bounces back down the pitch off the inside half of the bat,"Mashrafe Mortaza to Lewis, no run",0,56007,Mashrafe Mortaza,0,7,0,1.1,1,629063,Mehidy Hasan,0,6,0,1.0,2,431901,Evin Lewis,1,8,0,0,51880,Chris Gayle,2,5,0,0,1,False,0,0,0,0,0,3,8,0,False,,False,False,1.38,0,13,0,0,0,1,1,0,3
run,4,West Indies,25,Bangladesh,2nd innings,1,"length ball on the pads, tapped into the leg side with soft hands","Mashrafe Mortaza to Lewis, 1 run",0,56007,Mashrafe Mortaza,0,8,0,1.2,2,629063,Mehidy Hasan,0,6,0,1.0,2,431901,Evin Lewis,2,9,0,0,51880,Chris Gayle,2,5,0,0,2,False,0,0,0,0,0,3,8,0,False,,False,False,1.71,0,14,0,0,0,1,1,0,4
four,4,West Indies,25,Bangladesh,2nd innings,4,<b>slaughtered.</b> Short of  a length ball on middle stump and he has backed away very early to make room and then whacked this over the off-side infield,"Mashrafe Mortaza to Gayle, FOUR runs",0,56007,Mashrafe Mortaza,0,9,0,1.3,6,629063,Mehidy Hasan,0,6,0,1.0,2,51880,Chris Gayle,6,6,1,0,431901,Evin Lewis,2,9,0,0,3,False,0,0,0,0,0,3,8,0,False,,False,False,3.2,0,15,0,0,0,1,1,0,8
