PlayType_description,Batting_Team_id,Batting_Team_name,Bowling_Team_id,Bowling_Team_name,Innings,Total_Runs_on_delivery,Commentary,Commentary_short,Score,Bowler_id,Bowler_name,Bowler_maiden,Bowler_balls,Bowler_wickets,Bowler_over,Bowler_conceded,Other_Bowler_id,Other_Bowler_name,Other_Bowler_maidens,Other_Bowler_balls,Other_Bowler_wickets,Other_Bowler_overs,Other_Bowler_conceded,Batsman_id,Batsman_name,Batsman_runs,Batsman_balls_faced,Batsman_four,Batsman_sixes,Other_Batsman_id,Other_Batsman_name,Other_Batsman_runs,Other_Batsman_balls_faced,Other_Batsman_four,Other_Batsman_sixes,Over_ball,Over_complete,Over_maiden,Over_no_Ball,Over_wide,Over_byes,Over_leg_byes,Over_number,Over_runs,Over_wickets,Dismissal_is_true,Dismissal_type,Dismissal_fielder_iskeeper,Dismissal_text,Innings_run_rate,Innings_byes,Innings_balls,Innings_no_balls,Innings_wickets,Innings_leg_byes,Innings_session,Innings_day,Innings_wides,Innings_runs
no run,509671,Melbourne Renegades,509674,Sydney Thunder,1st innings,0,"flipper outside off, he mistimes a drive back to the bowler","Fawad Ahmed to White, no run",68/3,240609,Fawad Ahmed,0,14,1,2.2,12,901157,Arjun Nair,0,6,0,1.0,16,8291,Cameron White,1,2,0,0,5334,Aaron Finch,29,23,1,2,2,False,0,0,0,0,0,11,5,0,False,,False,False,6.58,0,62,0,3,0,1,1,0,68
run,509671,Melbourne Renegades,509674,Sydney Thunder,1st innings,1,"top spinner full on leg, he clips this through forward square to the sweeper","Fawad Ahmed to White, 1 run",69/3,240609,Fawad Ahmed,0,15,1,2.3,13,901157,Arjun Nair,0,6,0,1.0,16,8291,Cameron White,2,3,0,0,5334,Aaron Finch,29,23,1,2,3,False,0,0,0,0,0,11,5,0,False,,False,False,6.57,0,63,0,3,0,1,1,0,69
run,509671,Melbourne Renegades,509674,Sydney Thunder,1st innings,1,"shorter wider leg break, he's back and cutting hard to deep cover-point","Fawad Ahmed to Finch, 1 run",70/3,240609,Fawad Ahmed,0,16,1,2.4,14,901157,Arjun Nair,0,6,0,1.0,16,5334,Aaron Finch,30,24,1,2,8291,Cameron White,2,3,0,0,4,False,0,0,0,0,0,11,5,0,False,,False,False,6.56,0,64,0,3,0,1,1,0,70
run,509671,Melbourne Renegades,509674,Sydney Thunder,1st innings,1,"leg break, flatter on leg, he skips out and drives to long on","Fawad Ahmed to White, 1 run",71/3,240609,Fawad Ahmed,0,17,1,2.5,15,901157,Arjun Nair,0,6,0,1.0,16,8291,Cameron White,3,4,0,0,5334,Aaron Finch,30,24,1,2,5,False,0,0,0,0,0,11,5,0,False,,False,False,6.55,0,65,0,3,0,1,1,0,71
run,509671,Melbourne Renegades,509674,Sydney Thunder,1st innings,1,"slider outside off, he's back and punching to deep cover-point","Fawad Ahmed to Finch, 1 run",72/3,240609,Fawad Ahmed,0,18,1,3.0,16,901157,Arjun Nair,0,6,0,1.0,16,5334,Aaron Finch,31,25,1,2,8291,Cameron White,3,4,0,0,6,True,0,0,0,0,0,11,5,0,False,,False,False,6.54,0,66,0,3,0,1,1,0,72
run,509671,Melbourne Renegades,509674,Sydney Thunder,1st innings,1,"104kph, tossed up on leg, he drives firmly to long on","Green to Finch, 1 run",73/3,787073,Chris Green,0,7,0,1.1,5,240609,Fawad Ahmed,0,18,1,3.0,16,5334,Aaron Finch,32,26,1,2,8291,Cameron White,3,4,0,0,1,False,0,0,0,0,0,12,6,0,False,,False,False,6.53,0,67,0,3,0,1,1,0,73
run,509671,Melbourne Renegades,509674,Sydney Thunder,1st innings,2,"shorter on leg, he's back and tucking this off the hip to the gap at square leg and they run well for two","Green to White, 2 runs",75/3,787073,Chris Green,0,8,0,1.2,7,240609,Fawad Ahmed,0,18,1,3.0,16,8291,Cameron White,5,5,0,0,5334,Aaron Finch,32,26,1,2,2,False,0,0,0,0,0,12,6,0,False,,False,False,6.61,0,68,0,3,0,1,1,0,75
run,509671,Melbourne Renegades,509674,Sydney Thunder,1st innings,1,"very full outside off, he pushes this out through cover-point for a single","Green to White, 1 run",76/3,787073,Chris Green,0,9,0,1.3,8,240609,Fawad Ahmed,0,18,1,3.0,16,8291,Cameron White,6,6,0,0,5334,Aaron Finch,32,26,1,2,3,False,0,0,0,0,0,12,6,0,False,,False,False,6.6,0,69,0,3,0,1,1,0,76
run,509671,Melbourne Renegades,509674,Sydney Thunder,1st innings,1,"101kph, fuller on leg, he clips this firmly to long on","Green to Finch, 1 run",77/3,787073,Chris Green,0,10,0,1.4,9,240609,Fawad Ahmed,0,18,1,3.0,16,5334,Aaron Finch,33,27,1,2,8291,Cameron White,6,6,0,0,4,False,0,0,0,0,0,12,6,0,False,,False,False,6.6,0,70,0,3,0,1,1,0,77
no run,509671,Melbourne Renegades,509674,Sydney Thunder,1st innings,0,"top spinner on off, he is forced to defend to cover","Green to White, no run",77/3,787073,Chris Green,0,11,0,1.5,9,240609,Fawad Ahmed,0,18,1,3.0,16,8291,Cameron White,6,7,0,0,5334,Aaron Finch,33,27,1,2,5,False,0,0,0,0,0,12,6,0,False,,False,False,6.5,0,71,0,3,0,1,1,0,77
run,509671,Melbourne Renegades,509674,Sydney Thunder,1st innings,1,"fuller outside leg, he clips this firmly to deep midwicket but too well to get two this time","Green to White, 1 run",78/3,787073,Chris Green,0,12,0,2.0,10,240609,Fawad Ahmed,0,18,1,3.0,16,8291,Cameron White,7,8,0,0,5334,Aaron Finch,33,27,1,2,6,True,0,0,0,0,0,12,6,0,False,,False,False,6.5,0,72,0,3,0,1,1,0,78
run,509671,Melbourne Renegades,509674,Sydney Thunder,1st innings,2,"131kph, good length, he charges and backs away and swings hard, gets a <strong>thick inside edge</strong> that flies well clear of leg stump and fine of fine leg","Sams to White, 2 runs",80/3,826901,Daniel Sams,0,13,1,2.1,10,787073,Chris Green,0,12,0,2.0,10,8291,Cameron White,9,9,0,0,5334,Aaron Finch,33,27,1,2,1,False,0,0,0,0,0,13,15,0,False,,False,False,6.57,0,73,0,3,0,1,1,0,80
leg bye,509671,Melbourne Renegades,509674,Sydney Thunder,1st innings,1,"short on the hip, he tries to whip and misses, it comes off the thigh guard and rolls away for a leg bye","Sams to White, 1 leg bye",81/3,826901,Daniel Sams,0,14,1,2.2,10,787073,Chris Green,0,12,0,2.0,10,8291,Cameron White,9,10,0,0,5334,Aaron Finch,33,27,1,2,2,False,0,0,0,0,1,13,15,0,False,,False,False,6.56,0,74,0,3,1,1,1,0,81
four,509671,Melbourne Renegades,509674,Sydney Thunder,1st innings,4,"short on the hip, he flips a pull shot very fine and fine leg is in the circle! Bad ball and he places this well pulling this fine","Sams to Finch, FOUR runs",85/3,826901,Daniel Sams,0,15,1,2.3,14,787073,Chris Green,0,12,0,2.0,10,5334,Aaron Finch,37,28,2,2,8291,Cameron White,9,10,0,0,3,False,0,0,0,0,0,13,15,0,False,,False,False,6.8,0,75,0,3,0,1,1,0,85
six,509671,Melbourne Renegades,509674,Sydney Thunder,1st innings,6,"<strong>he pulls this for six fine of fine leg!</strong> Another short one on the hip and it's a carbon copy pick up pull, but he got this one and it carries all the way fine of the man in the deep","Sams to Finch, SIX runs",91/3,826901,Daniel Sams,0,16,1,2.4,20,787073,Chris Green,0,12,0,2.0,10,5334,Aaron Finch,43,29,2,3,8291,Cameron White,9,10,0,0,4,False,0,0,0,0,0,13,15,0,False,,False,False,7.18,0,76,0,3,0,1,1,0,91
run,509671,Melbourne Renegades,509674,Sydney Thunder,1st innings,1,"118kph, slower ball outside off, he drives with control to long off","Sams to Finch, 1 run",92/3,826901,Daniel Sams,0,17,1,2.5,21,787073,Chris Green,0,12,0,2.0,10,5334,Aaron Finch,44,30,2,3,8291,Cameron White,9,10,0,0,5,False,0,0,0,0,0,13,15,0,False,,False,False,7.16,0,77,0,3,0,1,1,0,92
run,509671,Melbourne Renegades,509674,Sydney Thunder,1st innings,1,"114kph, off cutter slower ball, he drives on the up to long off","Sams to White, 1 run",93/3,826901,Daniel Sams,0,18,1,3.0,22,787073,Chris Green,0,12,0,2.0,10,8291,Cameron White,10,11,0,0,5334,Aaron Finch,44,30,2,3,6,True,0,0,0,0,0,13,15,0,False,,False,False,7.15,0,78,0,3,0,1,1,0,93
six,509671,Melbourne Renegades,509674,Sydney Thunder,1st innings,6,tossed up in the arc and <strong>White launches this with the spin over wide long on!</strong> This was right in the slot and he monstered this way over the long on fence,"Green to White, SIX runs",99/3,787073,Chris Green,0,13,0,2.1,16,826901,Daniel Sams,0,18,1,3.0,22,8291,Cameron White,16,12,0,1,5334,Aaron Finch,44,30,2,3,1,False,0,0,0,0,0,14,15,0,False,,False,False,7.51,0,79,0,3,0,1,1,0,99
run,509671,Melbourne Renegades,509674,Sydney Thunder,1st innings,1,"fuller on leg, he pushes a drive to long on","Green to White, 1 run",100/3,787073,Chris Green,0,14,0,2.2,17,826901,Daniel Sams,0,18,1,3.0,22,8291,Cameron White,17,13,0,1,5334,Aaron Finch,44,30,2,3,2,False,0,0,0,0,0,14,15,0,False,,False,False,7.5,0,80,0,3,0,1,1,0,100
no run,509671,Melbourne Renegades,509674,Sydney Thunder,1st innings,0,"he backed away early, Green saw it, tossed it slow and wide, he nearly fell over to slap a cut, <strong>misses</strong>. Lenton whips the bails off but he had his foot and knee down","Green to Finch, no run",100/3,787073,Chris Green,0,15,0,2.3,17,826901,Daniel Sams,0,18,1,3.0,22,5334,Aaron Finch,44,31,2,3,8291,Cameron White,17,13,0,1,3,False,0,0,0,0,0,14,15,0,False,,False,False,7.4,0,81,0,3,0,1,1,0,100
six,509671,Melbourne Renegades,509674,Sydney Thunder,1st innings,6,<strong>tossed up and hammered way over deep midwicket!</strong> What a strike! <strong>50 for Finch.</strong> He's back!,"Green to Finch, SIX runs",106/3,787073,Chris Green,0,16,0,2.4,23,826901,Daniel Sams,0,18,1,3.0,22,5334,Aaron Finch,50,32,2,4,8291,Cameron White,17,13,0,1,4,False,0,0,0,0,0,14,15,0,False,,False,False,7.75,0,82,0,3,0,1,1,0,106
run,509671,Melbourne Renegades,509674,Sydney Thunder,1st innings,1,"full on leg, he drives firmly back at Green and he can't handle it, it ricochets to long on","Green to Finch, 1 run",107/3,787073,Chris Green,0,17,0,2.5,24,826901,Daniel Sams,0,18,1,3.0,22,5334,Aaron Finch,51,33,2,4,8291,Cameron White,17,13,0,1,5,False,0,0,0,0,0,14,15,0,False,,False,False,7.73,0,83,0,3,0,1,1,0,107
run,509671,Melbourne Renegades,509674,Sydney Thunder,1st innings,1,"tossed up outside off, he tries to slog sweep and mistimes to long on","Green to White, 1 run",108/3,787073,Chris Green,0,18,0,3.0,25,826901,Daniel Sams,0,18,1,3.0,22,8291,Cameron White,18,14,0,1,5334,Aaron Finch,51,33,2,4,6,True,0,0,0,0,0,14,15,0,False,,False,False,7.71,0,84,0,3,0,1,1,0,108
run,509671,Melbourne Renegades,509674,Sydney Thunder,1st innings,1,"85kph, shorter leg break, he skips down and works this to midwicket","Fawad Ahmed to White, 1 run",109/3,240609,Fawad Ahmed,0,19,1,3.1,17,787073,Chris Green,0,18,0,3.0,25,8291,Cameron White,19,15,0,1,5334,Aaron Finch,51,33,2,4,1,False,0,0,0,0,0,15,5,0,False,,False,False,7.69,0,85,0,3,0,1,1,0,109
run,509671,Melbourne Renegades,509674,Sydney Thunder,1st innings,1,"shorter leg break, he cuts off the back foot to deep cover-point","Fawad Ahmed to Finch, 1 run",110/3,240609,Fawad Ahmed,0,20,1,3.2,18,787073,Chris Green,0,18,0,3.0,25,5334,Aaron Finch,52,34,2,4,8291,Cameron White,19,15,0,1,2,False,0,0,0,0,0,15,5,0,False,,False,False,7.67,0,86,0,3,0,1,1,0,110
run,509671,Melbourne Renegades,509674,Sydney Thunder,1st innings,1,"tossed up outside off, he dances down and works this behind square","Fawad Ahmed to White, 1 run",111/3,240609,Fawad Ahmed,0,21,1,3.3,19,787073,Chris Green,0,18,0,3.0,25,8291,Cameron White,20,16,0,1,5334,Aaron Finch,52,34,2,4,3,False,0,0,0,0,0,15,5,0,False,,False,False,7.65,0,87,0,3,0,1,1,0,111
run,509671,Melbourne Renegades,509674,Sydney Thunder,1st innings,1,"89kph, leg break, back of a length, he punches off the back foot to cover","Fawad Ahmed to Finch, 1 run",112/3,240609,Fawad Ahmed,0,22,1,3.4,20,787073,Chris Green,0,18,0,3.0,25,5334,Aaron Finch,53,35,2,4,8291,Cameron White,20,16,0,1,4,False,0,0,0,0,0,15,5,0,False,,False,False,7.63,0,88,0,3,0,1,1,0,112
run,509671,Melbourne Renegades,509674,Sydney Thunder,1st innings,1,"92kph, leg break on leg, he advances and works this against the turn through midwicket","Fawad Ahmed to White, 1 run",113/3,240609,Fawad Ahmed,0,23,1,3.5,21,787073,Chris Green,0,18,0,3.0,25,8291,Cameron White,21,17,0,1,5334,Aaron Finch,53,35,2,4,5,False,0,0,0,0,0,15,5,0,False,,False,False,7.61,0,89,0,3,0,1,1,0,113
no run,509671,Melbourne Renegades,509674,Sydney Thunder,1st innings,0,"perfect leg break on middle, he defends back to the bowler","Fawad Ahmed to Finch, no run",113/3,240609,Fawad Ahmed,0,24,1,4.0,21,787073,Chris Green,0,18,0,3.0,25,5334,Aaron Finch,53,36,2,4,8291,Cameron White,21,17,0,1,6,True,0,0,0,0,0,15,5,0,False,,False,False,7.53,0,90,0,3,0,1,1,0,113
no run,509671,Melbourne Renegades,509674,Sydney Thunder,1st innings,0,"132kph, back of a length, he tries to heave a pull over the leg side and <strong>misses</strong>. It goes well over leg stump","Sandhu to White, no run",113/3,499660,Gurinder Sandhu,0,13,1,2.1,14,240609,Fawad Ahmed,0,24,1,4.0,21,8291,Cameron White,21,18,0,1,5334,Aaron Finch,53,36,2,4,1,False,0,0,0,0,0,16,4,1,False,,False,False,7.45,0,91,0,3,0,1,1,0,113
run,509671,Melbourne Renegades,509674,Sydney Thunder,1st innings,1,"he backs away early, slower ball is fired well wide, he reaches out and drags this off the toe down to long on","Sandhu to White, 1 run",114/3,499660,Gurinder Sandhu,0,14,1,2.2,15,240609,Fawad Ahmed,0,24,1,4.0,21,8291,Cameron White,22,19,0,1,5334,Aaron Finch,53,36,2,4,2,False,0,0,0,0,0,16,4,1,False,,False,False,7.43,0,92,0,3,0,1,1,0,114
run,509671,Melbourne Renegades,509674,Sydney Thunder,1st innings,1,"high full toss, he pulls powerfully straight to deep midwicket. Close to a no-ball for above waist high, but not called","Sandhu to Finch, 1 run",115/3,499660,Gurinder Sandhu,0,15,1,2.3,16,240609,Fawad Ahmed,0,24,1,4.0,21,5334,Aaron Finch,54,37,2,4,8291,Cameron White,22,19,0,1,3,False,0,0,0,0,0,16,4,1,False,,False,False,7.41,0,93,0,3,0,1,1,0,115
run,509671,Melbourne Renegades,509674,Sydney Thunder,1st innings,1,"shorter length, he tries to pull, miscues, it spoons in the air towards long on but nowhere near the fielder","Sandhu to White, 1 run",116/3,499660,Gurinder Sandhu,0,16,1,2.4,17,240609,Fawad Ahmed,0,24,1,4.0,21,8291,Cameron White,23,20,0,1,5334,Aaron Finch,54,37,2,4,4,False,0,0,0,0,0,16,4,1,False,,False,False,7.4,0,94,0,3,0,1,1,0,116
out,509671,Melbourne Renegades,509674,Sydney Thunder,1st innings,0,"<strong>caught at deep midwicket!</strong> Undone by the slower ball. He delivered this way wide of off, Finch sat deep in the crease to launch over long on, he reached out and toed it high to deep midwicket, it falls short of the rope and Green takes the catch comfortably","Sandhu to Finch, OUT",116/4,499660,Gurinder Sandhu,0,17,2,2.5,17,240609,Fawad Ahmed,0,24,1,4.0,21,5334,Aaron Finch,54,38,2,4,8291,Cameron White,23,20,0,1,5,False,0,0,0,0,0,16,4,1,True,caught,False,AJ Finch c Green b Sandhu 54 (38b 2x4 4x6) SR: 142.10,7.32,0,95,0,4,0,1,1,0,116
run,509671,Melbourne Renegades,509674,Sydney Thunder,1st innings,1,"134kph, good length outside off, he shuffles back and across and tucks this to fine leg","Sandhu to White, 1 run",117/4,499660,Gurinder Sandhu,0,18,2,3.0,18,240609,Fawad Ahmed,0,24,1,4.0,21,8291,Cameron White,24,21,0,1,4864,Daniel Christian,0,0,0,0,6,True,0,0,0,0,0,16,4,1,False,,False,False,7.31,0,96,0,4,0,1,1,0,117
six,509671,Melbourne Renegades,509674,Sydney Thunder,1st innings,6,"<strong>crunched over long off!</strong> 138kph, half volley outside off, on a tee for White, he pulls out driver and thumps it straight over long off and into the stands!","Jordan to White, SIX runs",123/4,288992,Chris Jordan,0,13,0,2.1,19,499660,Gurinder Sandhu,0,18,2,3.0,18,8291,Cameron White,30,22,0,2,4864,Daniel Christian,0,0,0,0,1,False,0,0,0,0,0,17,15,0,False,,False,False,7.6,0,97,0,4,0,1,1,0,123
run,509671,Melbourne Renegades,509674,Sydney Thunder,1st innings,2,"slower ball on leg, he turns this around the corner to fine leg","Jordan to White, 2 runs",125/4,288992,Chris Jordan,0,14,0,2.2,21,499660,Gurinder Sandhu,0,18,2,3.0,18,8291,Cameron White,32,23,0,2,4864,Daniel Christian,0,0,0,0,2,False,0,0,0,0,0,17,15,0,False,,False,False,7.65,0,98,0,4,0,1,1,0,125
four,509671,Melbourne Renegades,509674,Sydney Thunder,1st innings,4,"brilliant scoop ramp over the keeper! It was a fuller delivery, he steps way outside off and flips it over his left shoulder! One bounce four! Incredible skill","Jordan to White, FOUR runs",129/4,288992,Chris Jordan,0,15,0,2.3,25,499660,Gurinder Sandhu,0,18,2,3.0,18,8291,Cameron White,36,24,1,2,4864,Daniel Christian,0,0,0,0,3,False,0,0,0,0,0,17,15,0,False,,False,False,7.81,0,99,0,4,0,1,1,0,129
run,509671,Melbourne Renegades,509674,Sydney Thunder,1st innings,1,"144kph, full on off, he crunches a drive to long on","Jordan to White, 1 run",130/4,288992,Chris Jordan,0,16,0,2.4,26,499660,Gurinder Sandhu,0,18,2,3.0,18,8291,Cameron White,37,25,1,2,4864,Daniel Christian,0,0,0,0,4,False,0,0,0,0,0,17,15,0,False,,False,False,7.8,0,100,0,4,0,1,1,0,130
run,509671,Melbourne Renegades,509674,Sydney Thunder,1st innings,1,"134kph, shorter outside off, he late cuts in the air a fair way to third man but it gets to Ferguson on the bounce","Jordan to Christian, 1 run",131/4,288992,Chris Jordan,0,17,0,2.5,27,499660,Gurinder Sandhu,0,18,2,3.0,18,4864,Daniel Christian,1,1,0,0,8291,Cameron White,37,25,1,2,5,False,0,0,0,0,0,17,15,0,False,,False,False,7.78,0,101,0,4,0,1,1,0,131
run,509671,Melbourne Renegades,509674,Sydney Thunder,1st innings,1,"fuller outside off, he leans back and cracks a drive to long off","Jordan to White, 1 run",132/4,288992,Chris Jordan,0,18,0,3.0,28,499660,Gurinder Sandhu,0,18,2,3.0,18,8291,Cameron White,38,26,1,2,4864,Daniel Christian,1,1,0,0,6,True,0,0,0,0,0,17,15,0,False,,False,False,7.76,0,102,0,4,0,1,1,0,132
run,509671,Melbourne Renegades,509674,Sydney Thunder,1st innings,1,"good length angled well wide of off, he backs away and miscues a flat bat back at the non-striker's stumps. It bounces off the stumps and away for one","Sams to White, 1 run",133/4,826901,Daniel Sams,0,19,1,3.1,23,288992,Chris Jordan,0,18,0,3.0,28,8291,Cameron White,39,27,1,2,4864,Daniel Christian,1,1,0,0,1,False,0,0,0,0,0,18,7,2,False,,False,False,7.74,0,103,0,4,0,1,1,0,133
run,509671,Melbourne Renegades,509674,Sydney Thunder,1st innings,1,"115kph, slower ball on off, he backs away and knocks this to cover","Sams to Christian, 1 run",134/4,826901,Daniel Sams,0,20,1,3.2,24,288992,Chris Jordan,0,18,0,3.0,28,4864,Daniel Christian,2,2,0,0,8291,Cameron White,39,27,1,2,2,False,0,0,0,0,0,18,7,2,False,,False,False,7.73,0,104,0,4,0,1,1,0,134
run,509671,Melbourne Renegades,509674,Sydney Thunder,1st innings,1,"131kph, full and speared into leg, he gives room but is forced to clip this to long on","Sams to White, 1 run",135/4,826901,Daniel Sams,0,21,1,3.3,25,288992,Chris Jordan,0,18,0,3.0,28,8291,Cameron White,40,28,1,2,4864,Daniel Christian,2,2,0,0,3,False,0,0,0,0,0,18,7,2,False,,False,False,7.71,0,105,0,4,0,1,1,0,135
four,509671,Melbourne Renegades,509674,Sydney Thunder,1st innings,4,"133kph, he skips down to a full ball on leg and glances this with quick hands wide of short fine and it races away!","Sams to Christian, FOUR runs",139/4,826901,Daniel Sams,0,22,1,3.4,29,288992,Chris Jordan,0,18,0,3.0,28,4864,Daniel Christian,6,3,1,0,8291,Cameron White,40,28,1,2,4,False,0,0,0,0,0,18,7,2,False,,False,False,7.86,0,106,0,4,0,1,1,0,139
out,509671,Melbourne Renegades,509674,Sydney Thunder,1st innings,0,"<strong>caught at deep point!</strong> Slower ball cutter wide of off, he sliced a square drive high in the air to deep point, Sangha is there and it takes the catch very low to the ground","Sams to Christian, OUT",139/5,826901,Daniel Sams,0,23,2,3.5,29,288992,Chris Jordan,0,18,0,3.0,28,4864,Daniel Christian,6,4,1,0,8291,Cameron White,40,28,1,2,5,False,0,0,0,0,0,18,7,2,True,caught,False,DT Christian c Sangha b Sams 6 (4b 1x4 0x6) SR: 150.00,7.79,0,107,0,5,0,1,1,0,139
out,509671,Melbourne Renegades,509674,Sydney Thunder,1st innings,0,"<strong>caught at cover!</strong> Slower ball completely deceives him. It was 115kph, shorter length wide of off, it stops in the surface, he checks the shot and chips this high to cover, Watson is on the circle and just shuffles back to take the catch.","Sams to White, OUT",139/6,826901,Daniel Sams,0,24,3,4.0,29,288992,Chris Jordan,0,18,0,3.0,28,8291,Cameron White,40,29,1,2,25913,Mohammad Nabi,0,0,0,0,6,True,0,0,0,0,0,18,7,2,True,caught,False,CL White c Watson b Sams 40 (29b 1x4 2x6) SR: 137.93,7.72,0,108,0,6,0,1,1,0,139
run,509671,Melbourne Renegades,509674,Sydney Thunder,1st innings,1,"131kph, good length on off, he defends with soft hands into cover","Sandhu to Harvey, 1 run",140/6,499660,Gurinder Sandhu,0,19,2,3.1,19,826901,Daniel Sams,0,24,3,4.0,29,1076382,Mackenzie Harvey,1,1,0,0,25913,Mohammad Nabi,0,0,0,0,1,False,0,0,0,0,0,19,6,1,False,,False,False,7.7,0,109,0,6,0,1,1,0,140
four,509671,Melbourne Renegades,509674,Sydney Thunder,1st innings,4,"<strong>lofted over mid off!</strong> Superb shot. Full outside off, on speed, he launches into a lofted off drive and it pitches just short of the rope. Mid off was up. Easy pickings.","Sandhu to Mohammad Nabi, FOUR runs",144/6,499660,Gurinder Sandhu,0,20,2,3.2,23,826901,Daniel Sams,0,24,3,4.0,29,25913,Mohammad Nabi,4,1,1,0,1076382,Mackenzie Harvey,1,1,0,0,2,False,0,0,0,0,0,19,6,1,False,,False,False,7.85,0,110,0,6,0,1,1,0,144
no run,509671,Melbourne Renegades,509674,Sydney Thunder,1st innings,0,"short ball, bouncer, Nabi shapes to pull then sways under it","Sandhu to Mohammad Nabi, no run",144/6,499660,Gurinder Sandhu,0,21,2,3.3,23,826901,Daniel Sams,0,24,3,4.0,29,25913,Mohammad Nabi,4,2,1,0,1076382,Mackenzie Harvey,1,1,0,0,3,False,0,0,0,0,0,19,6,1,False,,False,False,7.78,0,111,0,6,0,1,1,0,144
no run,509671,Melbourne Renegades,509674,Sydney Thunder,1st innings,0,"115kph, short slower ball, he tries to slap this over point but <strong>misses</strong>","Sandhu to Mohammad Nabi, no run",144/6,499660,Gurinder Sandhu,0,22,2,3.4,23,826901,Daniel Sams,0,24,3,4.0,29,25913,Mohammad Nabi,4,3,1,0,1076382,Mackenzie Harvey,1,1,0,0,4,False,0,0,0,0,0,19,6,1,False,,False,False,7.71,0,112,0,6,0,1,1,0,144
out,509671,Melbourne Renegades,509674,Sydney Thunder,1st innings,0,"<strong>caught behind!</strong> Brilliant from Sandhu. 131kph, short ball, beat him for pace after the slower ball, he tried to pull, feathered an edge and Lenton takes the catch.","Sandhu to Mohammad Nabi, OUT",144/7,499660,Gurinder Sandhu,0,23,3,3.5,23,826901,Daniel Sams,0,24,3,4.0,29,25913,Mohammad Nabi,4,4,1,0,1076382,Mackenzie Harvey,1,1,0,0,5,False,0,0,0,0,0,19,6,1,True,caught,False,Mohammad Nabi c &dagger;Lenton b Sandhu 4 (4b 1x4 0x6) SR: 100.00,7.64,0,113,0,7,0,1,1,0,144
leg bye,509671,Melbourne Renegades,509674,Sydney Thunder,1st innings,1,"<strong>appeal for LBW</strong>, not out. Good length on middle, hits him high on the pad and rolls to gully for a leg bye. It was too high","Sandhu to Tremain, 1 leg bye",145/7,499660,Gurinder Sandhu,0,24,3,4.0,23,826901,Daniel Sams,0,24,3,4.0,29,553800,Chris Tremain,0,1,0,0,1076382,Mackenzie Harvey,1,1,0,0,6,True,0,0,0,0,1,19,6,1,False,,False,False,7.63,0,114,0,7,1,1,1,0,145
no run,509671,Melbourne Renegades,509674,Sydney Thunder,1st innings,0,"125kph, good length outside off, he steps way inside the line to try and scoop fine but misses","Jordan to Tremain, no run",145/7,288992,Chris Jordan,0,19,0,3.1,28,499660,Gurinder Sandhu,0,24,3,4.0,23,553800,Chris Tremain,0,2,0,0,1076382,Mackenzie Harvey,1,1,0,0,1,False,0,0,0,0,0,20,7,2,False,,False,False,7.56,0,115,0,7,0,1,1,0,145
four,509671,Melbourne Renegades,509674,Sydney Thunder,1st innings,4,short ball into the body and pulls off the top edge over short fine! It lands just inches short of the rope,"Jordan to Tremain, FOUR runs",149/7,288992,Chris Jordan,0,20,0,3.2,32,499660,Gurinder Sandhu,0,24,3,4.0,23,553800,Chris Tremain,4,3,1,0,1076382,Mackenzie Harvey,1,1,0,0,2,False,0,0,0,0,0,20,7,2,False,,False,False,7.7,0,116,0,7,0,1,1,0,149
out,509671,Melbourne Renegades,509674,Sydney Thunder,1st innings,0,"<strong>Bowled him!</strong> 138kph, yorker, way too good! Just fired in at the base of off stump, too quick for Tremain and it lights up the stumps.","Jordan to Tremain, OUT",149/8,288992,Chris Jordan,0,21,1,3.3,32,499660,Gurinder Sandhu,0,24,3,4.0,23,553800,Chris Tremain,4,4,1,0,1076382,Mackenzie Harvey,1,1,0,0,3,False,0,0,0,0,0,20,7,2,True,bowled,False,CP Tremain  b Jordan 4 (4b 1x4 0x6) SR: 100.00,7.64,0,117,0,8,0,1,1,0,149
run,509671,Melbourne Renegades,509674,Sydney Thunder,1st innings,1,"142kph, yorker, speared into leg stump, hits him on the foot, there's an appeal, not out is the call, they scramble for a run, Jordan aborts the appeal to field the ball, fires at the non-striker's but it's wide as Richardson dives in. There was a little inside edge. One run given","Jordan to Richardson, 1 run",150/8,288992,Chris Jordan,0,22,1,3.4,33,499660,Gurinder Sandhu,0,24,3,4.0,23,272262,Kane Richardson,1,1,0,0,1076382,Mackenzie Harvey,1,1,0,0,4,False,0,0,0,0,0,20,7,2,False,,False,False,7.62,0,118,0,8,0,1,1,0,150
run,509671,Melbourne Renegades,509674,Sydney Thunder,1st innings,2,"138kph, fuller length into leg, he backs away and slices this up and over cover, doesn't time it but they get a couple","Jordan to Harvey, 2 runs",152/8,288992,Chris Jordan,0,23,1,3.5,35,499660,Gurinder Sandhu,0,24,3,4.0,23,1076382,Mackenzie Harvey,3,2,0,0,272262,Kane Richardson,1,1,0,0,5,False,0,0,0,0,0,20,7,2,False,,False,False,7.66,0,119,0,8,0,1,1,0,152
out,509671,Melbourne Renegades,509674,Sydney Thunder,1st innings,0,"<strong>Run Out!</strong> Confusion between the batsmen. Harvey stepped inside the line to paddle sweep fine, he missed, it just missed leg stump. Richardson ran for a bye but Harvey wasn't paying attention, they end up next to each other, Lenton throws it Jordan and Harvey is run out by a mile.","Jordan to Harvey, OUT",152/9,288992,Chris Jordan,0,24,1,4.0,35,499660,Gurinder Sandhu,0,24,3,4.0,23,1076382,Mackenzie Harvey,3,3,0,0,272262,Kane Richardson,1,1,0,0,6,True,0,0,0,0,0,20,7,2,True,run out,False,MW Harvey run out (&dagger;Lenton/Jordan) 3 (3b 0x4 0x6) SR: 100.00,7.6,0,120,0,9,0,1,1,0,152
no run,509674,Sydney Thunder,509671,Melbourne Renegades,2nd innings,0,"full on middle and off, 135kph, he pushes from the crease, gets a slight leading edge to cover","Richardson to Devcich, no run",0,272262,Kane Richardson,0,1,0,0.1,0,False,False,0,0,0,False,0,36948,Anton Devcich,0,1,0,0,8180,Shane Watson,0,0,0,0,1,False,0,0,0,0,0,1,1,1,False,,False,False,0.0,0,1,0,0,0,1,1,0,0
