PlayType_description,Batting_Team_id,Batting_Team_name,Bowling_Team_id,Bowling_Team_name,Innings,Total_Runs_on_delivery,Commentary,Commentary_short,Score,Bowler_id,Bowler_name,Bowler_maiden,Bowler_balls,Bowler_wickets,Bowler_over,Bowler_conceded,Other_Bowler_id,Other_Bowler_name,Other_Bowler_maidens,Other_Bowler_balls,Other_Bowler_wickets,Other_Bowler_overs,Other_Bowler_conceded,Batsman_id,Batsman_name,Batsman_runs,Batsman_balls_faced,Batsman_four,Batsman_sixes,Other_Batsman_id,Other_Batsman_name,Other_Batsman_runs,Other_Batsman_balls_faced,Other_Batsman_four,Other_Batsman_sixes,Over_ball,Over_complete,Over_maiden,Over_no_Ball,Over_wide,Over_byes,Over_leg_byes,Over_number,Over_runs,Over_wickets,Dismissal_is_true,Dismissal_type,Dismissal_fielder_iskeeper,Dismissal_text,Innings_run_rate,Innings_byes,Innings_balls,Innings_no_balls,Innings_wickets,Innings_leg_byes,Innings_session,Innings_day,Innings_wides,Innings_runs
no run,509671,Melbourne Renegades,509674,Sydney Thunder,1st innings,0,"back of a length on leg, he's back and across and defending back down the pitch","Sams to Boyce, no run",0/0,826901,Daniel Sams,0,1,0,0.1,0,False,False,0,0,0,False,0,326625,Cameron Boyce,0,1,0,0,5334,Aaron Finch,0,0,0,0,1,False,0,0,0,0,0,1,7,1,False,,False,False,0.0,0,1,0,0,0,1,1,0,0
out,509671,Melbourne Renegades,509674,Sydney Thunder,1st innings,0,"<strong>caught at mid off!</strong> The experiment fails! Back of a length, he backed away and tried to flat bat down the ground. It got onto quicker than expected, he miscues, slicing it towards mid off, Jordan runs forward and takes an excellent diving catch coming forward","Sams to Boyce, OUT",0/1,826901,Daniel Sams,0,2,1,0.2,0,False,False,0,0,0,False,0,326625,Cameron Boyce,0,2,0,0,5334,Aaron Finch,0,0,0,0,2,False,0,0,0,0,0,1,7,1,True,caught,False,CJ Boyce c Jordan b Sams 0 (2b 0x4 0x6) SR: 0.00,0.0,0,2,0,1,0,1,1,0,0
run,509671,Melbourne Renegades,509674,Sydney Thunder,1st innings,2,works this behind square wide of fine leg for a couple,"Sams to Harper, 2 runs",2/1,826901,Daniel Sams,0,3,1,0.3,2,False,False,0,0,0,False,0,772361,Sam Harper,2,1,0,0,5334,Aaron Finch,0,0,0,0,3,False,0,0,0,0,0,1,7,1,False,,False,False,4.0,0,3,0,1,0,1,1,0,2
four,509671,Melbourne Renegades,509674,Sydney Thunder,1st innings,4,"<strong>edged and it flies past slip!</strong> Good length angled across, he slashes off the back foot and gets a thick edge, it flies high and wide of slip and races fine of third man for four.","Sams to Harper, FOUR runs",6/1,826901,Daniel Sams,0,4,1,0.4,6,False,False,0,0,0,False,0,772361,Sam Harper,6,2,1,0,5334,Aaron Finch,0,0,0,0,4,False,0,0,0,0,0,1,7,1,False,,False,False,9.0,0,4,0,1,0,1,1,0,6
run,509671,Melbourne Renegades,509674,Sydney Thunder,1st innings,1,"shorter into the body, he swivels on a pull shot but picks out wide fine leg and only gets one","Sams to Harper, 1 run",7/1,826901,Daniel Sams,0,5,1,0.5,7,False,False,0,0,0,False,0,772361,Sam Harper,7,3,1,0,5334,Aaron Finch,0,0,0,0,5,False,0,0,0,0,0,1,7,1,False,,False,False,8.4,0,5,0,1,0,1,1,0,7
no run,509671,Melbourne Renegades,509674,Sydney Thunder,1st innings,0,"fuller outside off, 135kph, he drives neatly but straight to mid off","Sams to Finch, no run",7/1,826901,Daniel Sams,0,6,1,1.0,7,False,False,0,0,0,False,0,5334,Aaron Finch,0,1,0,0,772361,Sam Harper,7,3,1,0,6,True,0,0,0,0,0,1,7,1,False,,False,False,7.0,0,6,0,1,0,1,1,0,7
no run,509671,Melbourne Renegades,509674,Sydney Thunder,1st innings,0,"good length, outswinger, shaping away and tries to cut but misses","Jordan to Harper, no run",7/1,288992,Chris Jordan,0,1,0,0.1,0,826901,Daniel Sams,0,6,1,1.0,7,772361,Sam Harper,7,4,1,0,5334,Aaron Finch,0,1,0,0,1,False,0,0,0,0,0,2,5,0,False,,False,False,6.0,0,7,0,1,0,1,1,0,7
run,509671,Melbourne Renegades,509674,Sydney Thunder,1st innings,2,"back of a length on off, he defends on the back foot to the circle at forward square, they run hard and get two as three men converge on the ball","Jordan to Harper, 2 runs",9/1,288992,Chris Jordan,0,2,0,0.2,2,826901,Daniel Sams,0,6,1,1.0,7,772361,Sam Harper,9,5,1,0,5334,Aaron Finch,0,1,0,0,2,False,0,0,0,0,0,2,5,0,False,,False,False,6.75,0,8,0,1,0,1,1,0,9
no run,509671,Melbourne Renegades,509674,Sydney Thunder,1st innings,0,"136kph, good length angled down leg, he tries to flick but it hits the front pad and drops down","Jordan to Harper, no run",9/1,288992,Chris Jordan,0,3,0,0.3,2,826901,Daniel Sams,0,6,1,1.0,7,772361,Sam Harper,9,6,1,0,5334,Aaron Finch,0,1,0,0,3,False,0,0,0,0,0,2,5,0,False,,False,False,6.0,0,9,0,1,0,1,1,0,9
run,509671,Melbourne Renegades,509674,Sydney Thunder,1st innings,2,<strong>thick inside edge</strong> swinging hard and it just runs past leg stump! He backed away and tried to launch this down the ground and the thick edge runs fine and safely for two,"Jordan to Harper, 2 runs",11/1,288992,Chris Jordan,0,4,0,0.4,4,826901,Daniel Sams,0,6,1,1.0,7,772361,Sam Harper,11,7,1,0,5334,Aaron Finch,0,1,0,0,4,False,0,0,0,0,0,2,5,0,False,,False,False,6.6,0,10,0,1,0,1,1,0,11
run,509671,Melbourne Renegades,509674,Sydney Thunder,1st innings,1,"141kph, good length on off, he tries to swing over wide mid on, he miscues along the ground to the gap wide of mid on","Jordan to Harper, 1 run",12/1,288992,Chris Jordan,0,5,0,0.5,5,826901,Daniel Sams,0,6,1,1.0,7,772361,Sam Harper,12,8,1,0,5334,Aaron Finch,0,1,0,0,5,False,0,0,0,0,0,2,5,0,False,,False,False,6.54,0,11,0,1,0,1,1,0,12
no run,509671,Melbourne Renegades,509674,Sydney Thunder,1st innings,0,"139kph, fuller outside off, he plays a glorious drive, hammering it straight to cover","Jordan to Finch, no run",12/1,288992,Chris Jordan,0,6,0,1.0,5,826901,Daniel Sams,0,6,1,1.0,7,5334,Aaron Finch,0,2,0,0,772361,Sam Harper,12,8,1,0,6,True,0,0,0,0,0,2,5,0,False,,False,False,6.0,0,12,0,1,0,1,1,0,12
out,509671,Melbourne Renegades,509674,Sydney Thunder,1st innings,0,"<strong>bowled him!</strong> He stepped too far outside off and lost his leg stump! Harper moved across early, Sandhu delivered a 134kph length ball angled to leg stump, it was there to flick over the leg side but missed and it crashed into the top of leg!","Sandhu to Harper, OUT",12/2,499660,Gurinder Sandhu,0,1,1,0.1,0,288992,Chris Jordan,0,6,0,1.0,5,772361,Sam Harper,12,9,1,0,5334,Aaron Finch,0,2,0,0,1,False,0,0,0,0,0,3,3,1,True,bowled,False,SB Harper  b Sandhu 12 (9b 1x4 0x6) SR: 133.33,5.53,0,13,0,2,0,1,1,0,12
no run,509671,Melbourne Renegades,509674,Sydney Thunder,1st innings,0,"131kph, good length fourth stump line, he defends from the crease on the back foot towards mid on","Sandhu to Cooper, no run",12/2,499660,Gurinder Sandhu,0,2,1,0.2,0,288992,Chris Jordan,0,6,0,1.0,5,219885,Tom Cooper,0,1,0,0,5334,Aaron Finch,0,2,0,0,2,False,0,0,0,0,0,3,3,1,False,,False,False,5.14,0,14,0,2,0,1,1,0,12
no run,509671,Melbourne Renegades,509674,Sydney Thunder,1st innings,0,"132kph, fuller length outside off, he tries to drive but mistimes it dragging this to midwicket","Sandhu to Cooper, no run",12/2,499660,Gurinder Sandhu,0,3,1,0.3,0,288992,Chris Jordan,0,6,0,1.0,5,219885,Tom Cooper,0,2,0,0,5334,Aaron Finch,0,2,0,0,3,False,0,0,0,0,0,3,3,1,False,,False,False,4.8,0,15,0,2,0,1,1,0,12
run,509671,Melbourne Renegades,509674,Sydney Thunder,1st innings,1,"118kph, good length slower ball wide of off, he steps across and pushes this straight of mid on for one","Sandhu to Cooper, 1 run",13/2,499660,Gurinder Sandhu,0,4,1,0.4,1,288992,Chris Jordan,0,6,0,1.0,5,219885,Tom Cooper,1,3,0,0,5334,Aaron Finch,0,2,0,0,4,False,0,0,0,0,0,3,3,1,False,,False,False,4.87,0,16,0,2,0,1,1,0,13
run,509671,Melbourne Renegades,509674,Sydney Thunder,1st innings,2,"131kph back of a length outside off, he's up on his toes off the back foot punching nicely past cover, the sweeper comes around but can't cut off the second run","Sandhu to Finch, 2 runs",15/2,499660,Gurinder Sandhu,0,5,1,0.5,3,288992,Chris Jordan,0,6,0,1.0,5,5334,Aaron Finch,2,3,0,0,219885,Tom Cooper,1,3,0,0,5,False,0,0,0,0,0,3,3,1,False,,False,False,5.29,0,17,0,2,0,1,1,0,15
no run,509671,Melbourne Renegades,509674,Sydney Thunder,1st innings,0,"128kph, bouncer, over middle, Finch ducks under easily","Sandhu to Finch, no run",15/2,499660,Gurinder Sandhu,0,6,1,1.0,3,288992,Chris Jordan,0,6,0,1.0,5,5334,Aaron Finch,2,4,0,0,219885,Tom Cooper,1,3,0,0,6,True,0,0,0,0,0,3,3,1,False,,False,False,5.0,0,18,0,2,0,1,1,0,15
no run,509671,Melbourne Renegades,509674,Sydney Thunder,1st innings,0,"good length on off, he's back and working this towards midwicket","Sams to Cooper, no run",15/2,826901,Daniel Sams,0,7,1,1.1,7,499660,Gurinder Sandhu,0,6,1,1.0,3,219885,Tom Cooper,1,4,0,0,5334,Aaron Finch,2,4,0,0,1,False,0,0,0,0,0,4,1,0,False,,False,False,4.73,0,19,0,2,0,1,1,0,15
no run,509671,Melbourne Renegades,509674,Sydney Thunder,1st innings,0,"shorter length wide of off, he cuts but straight to point","Sams to Cooper, no run",15/2,826901,Daniel Sams,0,8,1,1.2,7,499660,Gurinder Sandhu,0,6,1,1.0,3,219885,Tom Cooper,1,5,0,0,5334,Aaron Finch,2,4,0,0,2,False,0,0,0,0,0,4,1,0,False,,False,False,4.5,0,20,0,2,0,1,1,0,15
no run,509671,Melbourne Renegades,509674,Sydney Thunder,1st innings,0,"133kph, good length on leg stump, he tries to whip fine but misses and gets taken on the pad","Sams to Cooper, no run",15/2,826901,Daniel Sams,0,9,1,1.3,7,499660,Gurinder Sandhu,0,6,1,1.0,3,219885,Tom Cooper,1,6,0,0,5334,Aaron Finch,2,4,0,0,3,False,0,0,0,0,0,4,1,0,False,,False,False,4.28,0,21,0,2,0,1,1,0,15
no run,509671,Melbourne Renegades,509674,Sydney Thunder,1st innings,0,"132kph, good length fourth stump line, he forces off the back foot to cover","Sams to Cooper, no run",15/2,826901,Daniel Sams,0,10,1,1.4,7,499660,Gurinder Sandhu,0,6,1,1.0,3,219885,Tom Cooper,1,7,0,0,5334,Aaron Finch,2,4,0,0,4,False,0,0,0,0,0,4,1,0,False,,False,False,4.09,0,22,0,2,0,1,1,0,15
run,509671,Melbourne Renegades,509674,Sydney Thunder,1st innings,1,"135kph, back of a length outside off, he is back and works this through the gap at midwicket","Sams to Cooper, 1 run",16/2,826901,Daniel Sams,0,11,1,1.5,8,499660,Gurinder Sandhu,0,6,1,1.0,3,219885,Tom Cooper,2,8,0,0,5334,Aaron Finch,2,4,0,0,5,False,0,0,0,0,0,4,1,0,False,,False,False,4.17,0,23,0,2,0,1,1,0,16
no run,509671,Melbourne Renegades,509674,Sydney Thunder,1st innings,0,"131kph, shorter length on off, he's back and defending down into the leg side","Sams to Finch, no run",16/2,826901,Daniel Sams,0,12,1,2.0,8,499660,Gurinder Sandhu,0,6,1,1.0,3,5334,Aaron Finch,2,5,0,0,219885,Tom Cooper,2,8,0,0,6,True,0,0,0,0,0,4,1,0,False,,False,False,4.0,0,24,0,2,0,1,1,0,16
no run,509671,Melbourne Renegades,509674,Sydney Thunder,1st innings,0,"134kph, shorter wide of off, he shapes to cut but it stays a touch low and he plays over the top","Jordan to Cooper, no run",16/2,288992,Chris Jordan,0,7,0,1.1,5,826901,Daniel Sams,0,12,1,2.0,8,219885,Tom Cooper,2,9,0,0,5334,Aaron Finch,2,5,0,0,1,False,0,0,0,0,0,5,8,0,False,,False,False,3.84,0,25,0,2,0,1,1,0,16
four,509671,Melbourne Renegades,509674,Sydney Thunder,1st innings,4,"128kph, he gets a short wide one again but nails this through point! It bounced normally this time, he thrashes the cut shot through the gap at point","Jordan to Cooper, FOUR runs",20/2,288992,Chris Jordan,0,8,0,1.2,9,826901,Daniel Sams,0,12,1,2.0,8,219885,Tom Cooper,6,10,1,0,5334,Aaron Finch,2,5,0,0,2,False,0,0,0,0,0,5,8,0,False,,False,False,4.61,0,26,0,2,0,1,1,0,20
no run,509671,Melbourne Renegades,509674,Sydney Thunder,1st innings,0,"<strong>dropped by Lenton!</strong> Oh No! This would have been a wide, he tried to reach out and cut, got a tiny bottom edge, Lenton drops an absolute sitter!","Jordan to Cooper, no run",20/2,288992,Chris Jordan,0,9,0,1.3,9,826901,Daniel Sams,0,12,1,2.0,8,219885,Tom Cooper,6,11,1,0,5334,Aaron Finch,2,5,0,0,3,False,0,0,0,0,0,5,8,0,False,,False,False,4.44,0,27,0,2,0,1,1,0,20
run,509671,Melbourne Renegades,509674,Sydney Thunder,1st innings,1,"good length on leg, he tucks this behind square for a single","Jordan to Cooper, 1 run",21/2,288992,Chris Jordan,0,10,0,1.4,10,826901,Daniel Sams,0,12,1,2.0,8,219885,Tom Cooper,7,12,1,0,5334,Aaron Finch,2,5,0,0,4,False,0,0,0,0,0,5,8,0,False,,False,False,4.5,0,28,0,2,0,1,1,0,21
run,509671,Melbourne Renegades,509674,Sydney Thunder,1st innings,1,"141kph, good length, on middle, he turns this off his hip to short fine. They take a tight one but Sandhu misfields","Jordan to Finch, 1 run",22/2,288992,Chris Jordan,0,11,0,1.5,11,826901,Daniel Sams,0,12,1,2.0,8,5334,Aaron Finch,3,6,0,0,219885,Tom Cooper,7,12,1,0,5,False,0,0,0,0,0,5,8,0,False,,False,False,4.55,0,29,0,2,0,1,1,0,22
run,509671,Melbourne Renegades,509674,Sydney Thunder,1st innings,2,"142kph, short ball, he pulls, but mistimes through midwicket and they get a couple","Jordan to Cooper, 2 runs",24/2,288992,Chris Jordan,0,12,0,2.0,13,826901,Daniel Sams,0,12,1,2.0,8,219885,Tom Cooper,9,13,1,0,5334,Aaron Finch,3,6,0,0,6,True,0,0,0,0,0,5,8,0,False,,False,False,4.8,0,30,0,2,0,1,1,0,24
run,509671,Melbourne Renegades,509674,Sydney Thunder,1st innings,2,"fuller on leg, he clips this easily fine of fine leg for a couple","Sandhu to Finch, 2 runs",26/2,499660,Gurinder Sandhu,0,7,1,1.1,5,288992,Chris Jordan,0,12,0,2.0,13,5334,Aaron Finch,5,7,0,0,219885,Tom Cooper,9,13,1,0,1,False,0,0,0,0,0,6,11,0,False,,False,False,5.03,0,31,0,2,0,1,1,0,26
run,509671,Melbourne Renegades,509674,Sydney Thunder,1st innings,1,"fuller length outside off, he pushes on the front foot to mid off who is deep on the circle, they get an easy one","Sandhu to Finch, 1 run",27/2,499660,Gurinder Sandhu,0,8,1,1.2,6,288992,Chris Jordan,0,12,0,2.0,13,5334,Aaron Finch,6,8,0,0,219885,Tom Cooper,9,13,1,0,2,False,0,0,0,0,0,6,11,0,False,,False,False,5.06,0,32,0,2,0,1,1,0,27
run,509671,Melbourne Renegades,509674,Sydney Thunder,1st innings,1,"126kph, outside off, he defends off the back foot with soft hands towards point","Sandhu to Cooper, 1 run",28/2,499660,Gurinder Sandhu,0,9,1,1.3,7,288992,Chris Jordan,0,12,0,2.0,13,219885,Tom Cooper,10,14,1,0,5334,Aaron Finch,6,8,0,0,3,False,0,0,0,0,0,6,11,0,False,,False,False,5.09,0,33,0,2,0,1,1,0,28
no run,509671,Melbourne Renegades,509674,Sydney Thunder,1st innings,0,"114kph, off cutter slower ball, he stands up and drives but doesn't time it to cover","Sandhu to Finch, no run",28/2,499660,Gurinder Sandhu,0,10,1,1.4,7,288992,Chris Jordan,0,12,0,2.0,13,5334,Aaron Finch,6,9,0,0,219885,Tom Cooper,10,14,1,0,4,False,0,0,0,0,0,6,11,0,False,,False,False,4.94,0,34,0,2,0,1,1,0,28
wide,509671,Melbourne Renegades,509674,Sydney Thunder,1st innings,2,"120kph, slower ball bouncer, he tries to upper cut, it's too high, called <strong>wide</strong>, he misses, it bounces short of Lenton and he misses it as well! They get another","Sandhu to Finch, 2 wides",30/2,499660,Gurinder Sandhu,0,10,1,1.4,9,288992,Chris Jordan,0,12,0,2.0,13,5334,Aaron Finch,6,9,0,0,219885,Tom Cooper,10,14,1,0,5,False,0,0,2,0,0,6,11,0,False,,False,False,5.29,0,34,0,2,0,1,1,2,30
run,509671,Melbourne Renegades,509674,Sydney Thunder,1st innings,1,"fuller length on leg, he glances this straight to short fine for a tight single but Finch got home","Sandhu to Cooper, 1 run",31/2,499660,Gurinder Sandhu,0,11,1,1.5,10,288992,Chris Jordan,0,12,0,2.0,13,219885,Tom Cooper,11,15,1,0,5334,Aaron Finch,6,9,0,0,6,False,0,0,0,0,0,6,11,0,False,,False,False,5.31,0,35,0,2,0,1,1,0,31
four,509671,Melbourne Renegades,509674,Sydney Thunder,1st innings,4,"slower ball, too full he throws the hands through the line and lofts this down the ground! Lovely shot. That might get him going","Sandhu to Finch, FOUR runs",35/2,499660,Gurinder Sandhu,0,12,1,2.0,14,288992,Chris Jordan,0,12,0,2.0,13,5334,Aaron Finch,10,10,1,0,219885,Tom Cooper,11,15,1,0,7,True,0,0,0,0,0,6,11,0,False,,False,False,5.83,0,36,0,2,0,1,1,0,35
run,509671,Melbourne Renegades,509674,Sydney Thunder,1st innings,1,"wrong un first up, he's back and working to midwicket, the fielder gets across but misfields and they get one","Fawad Ahmed to Cooper, 1 run",36/2,240609,Fawad Ahmed,0,1,0,0.1,1,499660,Gurinder Sandhu,0,12,1,2.0,14,219885,Tom Cooper,12,16,1,0,5334,Aaron Finch,10,10,1,0,1,False,0,0,0,0,0,7,5,0,False,,False,False,5.83,0,37,0,2,0,1,1,0,36
no run,509671,Melbourne Renegades,509674,Sydney Thunder,1st innings,0,"shorter leg break, he gives room and cuts to cover-point","Fawad Ahmed to Finch, no run",36/2,240609,Fawad Ahmed,0,2,0,0.2,1,499660,Gurinder Sandhu,0,12,1,2.0,14,5334,Aaron Finch,10,11,1,0,219885,Tom Cooper,12,16,1,0,2,False,0,0,0,0,0,7,5,0,False,,False,False,5.68,0,38,0,2,0,1,1,0,36
run,509671,Melbourne Renegades,509674,Sydney Thunder,1st innings,1,"slider outside off, he cuts to backward point and they get one","Fawad Ahmed to Finch, 1 run",37/2,240609,Fawad Ahmed,0,3,0,0.3,2,499660,Gurinder Sandhu,0,12,1,2.0,14,5334,Aaron Finch,11,12,1,0,219885,Tom Cooper,12,16,1,0,3,False,0,0,0,0,0,7,5,0,False,,False,False,5.69,0,39,0,2,0,1,1,0,37
run,509671,Melbourne Renegades,509674,Sydney Thunder,1st innings,1,"shorter outside off, he's back and punching to deep cover-point","Fawad Ahmed to Cooper, 1 run",38/2,240609,Fawad Ahmed,0,4,0,0.4,3,499660,Gurinder Sandhu,0,12,1,2.0,14,219885,Tom Cooper,13,17,1,0,5334,Aaron Finch,11,12,1,0,4,False,0,0,0,0,0,7,5,0,False,,False,False,5.7,0,40,0,2,0,1,1,0,38
run,509671,Melbourne Renegades,509674,Sydney Thunder,1st innings,1,"good length leg break wide of off, he cuts to backward point but can't beat Ferguson diving on the circle","Fawad Ahmed to Finch, 1 run",39/2,240609,Fawad Ahmed,0,5,0,0.5,4,499660,Gurinder Sandhu,0,12,1,2.0,14,5334,Aaron Finch,12,13,1,0,219885,Tom Cooper,13,17,1,0,5,False,0,0,0,0,0,7,5,0,False,,False,False,5.7,0,41,0,2,0,1,1,0,39
run,509671,Melbourne Renegades,509674,Sydney Thunder,1st innings,1,"wrong un on leg, he's back and tucking this to square leg","Fawad Ahmed to Cooper, 1 run",40/2,240609,Fawad Ahmed,0,6,0,1.0,5,499660,Gurinder Sandhu,0,12,1,2.0,14,219885,Tom Cooper,14,18,1,0,5334,Aaron Finch,12,13,1,0,6,True,0,0,0,0,0,7,5,0,False,,False,False,5.71,0,42,0,2,0,1,1,0,40
run,509671,Melbourne Renegades,509674,Sydney Thunder,1st innings,1,"good length pushed through on leg, he is back and punching to long on","Green to Cooper, 1 run",41/2,787073,Chris Green,0,1,0,0.1,1,240609,Fawad Ahmed,0,6,0,1.0,5,219885,Tom Cooper,15,19,1,0,5334,Aaron Finch,12,13,1,0,1,False,0,0,0,0,0,8,5,0,False,,False,False,5.72,0,43,0,2,0,1,1,0,41
leg bye,509671,Melbourne Renegades,509674,Sydney Thunder,1st innings,1,"101kph, full outside leg, he tried to whip but is beaten for pace, it runs off pad for a leg bye","Green to Finch, 1 leg bye",42/2,787073,Chris Green,0,2,0,0.2,1,240609,Fawad Ahmed,0,6,0,1.0,5,5334,Aaron Finch,12,14,1,0,219885,Tom Cooper,15,19,1,0,2,False,0,0,0,0,1,8,5,0,False,,False,False,5.72,0,44,0,2,1,1,1,0,42
run,509671,Melbourne Renegades,509674,Sydney Thunder,1st innings,1,"flatter on off, 88kph, he's back and forcing down to long off","Green to Cooper, 1 run",43/2,787073,Chris Green,0,3,0,0.3,2,240609,Fawad Ahmed,0,6,0,1.0,5,219885,Tom Cooper,16,20,1,0,5334,Aaron Finch,12,14,1,0,3,False,0,0,0,0,0,8,5,0,False,,False,False,5.73,0,45,0,2,0,1,1,0,43
no run,509671,Melbourne Renegades,509674,Sydney Thunder,1st innings,0,"102kph, fuller outside leg, Finch steps way outside leg and drives hard to midwicket","Green to Finch, no run",43/2,787073,Chris Green,0,4,0,0.4,2,240609,Fawad Ahmed,0,6,0,1.0,5,5334,Aaron Finch,12,15,1,0,219885,Tom Cooper,16,20,1,0,4,False,0,0,0,0,0,8,5,0,False,,False,False,5.6,0,46,0,2,0,1,1,0,43
run,509671,Melbourne Renegades,509674,Sydney Thunder,1st innings,1,"89kph, tossed high and slow wide of off, he has to reach out and pound a drives straight down to long off","Green to Finch, 1 run",44/2,787073,Chris Green,0,5,0,0.5,3,240609,Fawad Ahmed,0,6,0,1.0,5,5334,Aaron Finch,13,16,1,0,219885,Tom Cooper,16,20,1,0,5,False,0,0,0,0,0,8,5,0,False,,False,False,5.61,0,47,0,2,0,1,1,0,44
run,509671,Melbourne Renegades,509674,Sydney Thunder,1st innings,1,"pushed through on off, 87kph, he's back and knocking this down to long on","Green to Cooper, 1 run",45/2,787073,Chris Green,0,6,0,1.0,4,240609,Fawad Ahmed,0,6,0,1.0,5,219885,Tom Cooper,17,21,1,0,5334,Aaron Finch,13,16,1,0,6,True,0,0,0,0,0,8,5,0,False,,False,False,5.62,0,48,0,2,0,1,1,0,45
four,509671,Melbourne Renegades,509674,Sydney Thunder,1st innings,4,"full on leg, he sweeps hard behind square and picks the gap nicely!","Fawad Ahmed to Cooper, FOUR runs",49/2,240609,Fawad Ahmed,0,7,0,1.1,9,787073,Chris Green,0,6,0,1.0,4,219885,Tom Cooper,21,22,2,0,5334,Aaron Finch,13,16,1,0,1,False,0,0,0,0,0,9,6,1,False,,False,False,6.0,0,49,0,2,0,1,1,0,49
no run,509671,Melbourne Renegades,509674,Sydney Thunder,1st innings,0,"tossed up outside off, he tries to drive and gets a thick inside edge onto pad","Fawad Ahmed to Cooper, no run",49/2,240609,Fawad Ahmed,0,8,0,1.2,9,787073,Chris Green,0,6,0,1.0,4,219885,Tom Cooper,21,23,2,0,5334,Aaron Finch,13,16,1,0,2,False,0,0,0,0,0,9,6,1,False,,False,False,5.88,0,50,0,2,0,1,1,0,49
run,509671,Melbourne Renegades,509674,Sydney Thunder,1st innings,1,"leg break on off, he drives down to long on","Fawad Ahmed to Cooper, 1 run",50/2,240609,Fawad Ahmed,0,9,0,1.3,10,787073,Chris Green,0,6,0,1.0,4,219885,Tom Cooper,22,24,2,0,5334,Aaron Finch,13,16,1,0,3,False,0,0,0,0,0,9,6,1,False,,False,False,5.88,0,51,0,2,0,1,1,0,50
run,509671,Melbourne Renegades,509674,Sydney Thunder,1st innings,1,"89kph, shorter length leg break, he's back and cutting hard past point and they push for two but the sweeper cuts it off","Fawad Ahmed to Finch, 1 run",51/2,240609,Fawad Ahmed,0,10,0,1.4,11,787073,Chris Green,0,6,0,1.0,4,5334,Aaron Finch,14,17,1,0,219885,Tom Cooper,22,24,2,0,4,False,0,0,0,0,0,9,6,1,False,,False,False,5.88,0,52,0,2,0,1,1,0,51
no run,509671,Melbourne Renegades,509674,Sydney Thunder,1st innings,0,"slider on off, he's back pushing to cover","Fawad Ahmed to Cooper, no run",51/2,240609,Fawad Ahmed,0,11,0,1.5,11,787073,Chris Green,0,6,0,1.0,4,219885,Tom Cooper,22,25,2,0,5334,Aaron Finch,14,17,1,0,5,False,0,0,0,0,0,9,6,1,False,,False,False,5.77,0,53,0,2,0,1,1,0,51
out,509671,Melbourne Renegades,509674,Sydney Thunder,1st innings,0,"<strong>caught at cover!</strong> Picked out cover with a drive that he didn't get over the top of! It was well flighted outside off, he drives hard but his body weight is back, he hits it in the air and it just carries to Devcich at cover. He takes a good low catch.","Fawad Ahmed to Cooper, OUT",51/3,240609,Fawad Ahmed,0,12,1,2.0,11,787073,Chris Green,0,6,0,1.0,4,219885,Tom Cooper,22,26,2,0,5334,Aaron Finch,14,17,1,0,6,True,0,0,0,0,0,9,6,1,True,caught,False,TLW Cooper c Devcich b Fawad Ahmed 22 (26b 2x4 0x6) SR: 84.61,5.66,0,54,0,3,0,1,1,0,51
run,509671,Melbourne Renegades,509674,Sydney Thunder,1st innings,1,"pushed through on off, he is back and forcing down the ground to long on","Nair to Finch, 1 run",52/3,901157,Arjun Nair,0,1,0,0.1,1,240609,Fawad Ahmed,0,12,1,2.0,11,5334,Aaron Finch,15,18,1,0,8291,Cameron White,0,0,0,0,1,False,0,0,0,0,0,10,16,0,False,,False,False,5.67,0,55,0,3,0,1,1,0,52
run,509671,Melbourne Renegades,509674,Sydney Thunder,1st innings,1,"carrom ball, 90kph, he's back and punching to long off","Nair to White, 1 run",53/3,901157,Arjun Nair,0,2,0,0.2,2,240609,Fawad Ahmed,0,12,1,2.0,11,8291,Cameron White,1,1,0,0,5334,Aaron Finch,15,18,1,0,2,False,0,0,0,0,0,10,16,0,False,,False,False,5.67,0,56,0,3,0,1,1,0,53
no run,509671,Melbourne Renegades,509674,Sydney Thunder,1st innings,0,"86kph, outside off, he's back and trying to cut but mistimes to cover","Nair to Finch, no run",53/3,901157,Arjun Nair,0,3,0,0.3,2,240609,Fawad Ahmed,0,12,1,2.0,11,5334,Aaron Finch,15,19,1,0,8291,Cameron White,1,1,0,0,3,False,0,0,0,0,0,10,16,0,False,,False,False,5.57,0,57,0,3,0,1,1,0,53
six,509671,Melbourne Renegades,509674,Sydney Thunder,1st innings,6,"<strong>tossed up and Finch hits it onto the roof over long on!</strong> It was in the slot outside off, he was down on one knee and launching this over long on and it carried onto the roof! That was enormous.","Nair to Finch, SIX runs",59/3,901157,Arjun Nair,0,4,0,0.4,8,240609,Fawad Ahmed,0,12,1,2.0,11,5334,Aaron Finch,21,20,1,1,8291,Cameron White,1,1,0,0,4,False,0,0,0,0,0,10,16,0,False,,False,False,6.1,0,58,0,3,0,1,1,0,59
wide,509671,Melbourne Renegades,509674,Sydney Thunder,1st innings,1,this slipped out of his finger and nearly landed off the cut strip! Is this a free-hit for a no-ball for being off the pitch? It did land off the cut portion of the pitch! It's stays as a <strong>wide</strong> though,"Nair to Finch, 1 wide",60/3,901157,Arjun Nair,0,4,0,0.4,9,240609,Fawad Ahmed,0,12,1,2.0,11,5334,Aaron Finch,21,20,1,1,8291,Cameron White,1,1,0,0,5,False,0,0,1,0,0,10,16,0,False,,False,False,6.2,0,58,0,3,0,1,1,1,60
six,509671,Melbourne Renegades,509674,Sydney Thunder,1st innings,6,"<strong>short ball hammered over deep midwicket!</strong> Finch is climbing into Nair! Just a drag down short one, Finch waits and whacks it long over midwicket into the stands","Nair to Finch, SIX runs",66/3,901157,Arjun Nair,0,5,0,0.5,15,240609,Fawad Ahmed,0,12,1,2.0,11,5334,Aaron Finch,27,21,1,2,8291,Cameron White,1,1,0,0,6,False,0,0,0,0,0,10,16,0,False,,False,False,6.71,0,59,0,3,0,1,1,0,66
run,509671,Melbourne Renegades,509674,Sydney Thunder,1st innings,1,"good length, fourth stump, he knocks it into the off side with soft hands for a single","Nair to Finch, 1 run",67/3,901157,Arjun Nair,0,6,0,1.0,16,240609,Fawad Ahmed,0,12,1,2.0,11,5334,Aaron Finch,28,22,1,2,8291,Cameron White,1,1,0,0,7,True,0,0,0,0,0,10,16,0,False,,False,False,6.7,0,60,0,3,0,1,1,0,67
run,509671,Melbourne Renegades,509674,Sydney Thunder,1st innings,1,"85kph, leg break, shorter outside off, he's back and punching to deep cover-point","Fawad Ahmed to Finch, 1 run",68/3,240609,Fawad Ahmed,0,13,1,2.1,12,901157,Arjun Nair,0,6,0,1.0,16,5334,Aaron Finch,29,23,1,2,8291,Cameron White,1,1,0,0,1,False,0,0,0,0,0,11,5,0,False,,False,False,6.68,0,61,0,3,0,1,1,0,68
