PlayType_description,Batting_Team_id,Batting_Team_name,Bowling_Team_id,Bowling_Team_name,Innings,Total_Runs_on_delivery,Commentary,Commentary_short,Score,Bowler_id,Bowler_name,Bowler_maiden,Bowler_balls,Bowler_wickets,Bowler_over,Bowler_conceded,Other_Bowler_id,Other_Bowler_name,Other_Bowler_maidens,Other_Bowler_balls,Other_Bowler_wickets,Other_Bowler_overs,Other_Bowler_conceded,Batsman_id,Batsman_name,Batsman_runs,Batsman_balls_faced,Batsman_four,Batsman_sixes,Other_Batsman_id,Other_Batsman_name,Other_Batsman_runs,Other_Batsman_balls_faced,Other_Batsman_four,Other_Batsman_sixes,Over_ball,Over_complete,Over_maiden,Over_no_Ball,Over_wide,Over_byes,Over_leg_byes,Over_number,Over_runs,Over_wickets,Dismissal_is_true,Dismissal_type,Dismissal_fielder_iskeeper,Dismissal_text,Innings_run_rate,Innings_byes,Innings_balls,Innings_no_balls,Innings_wickets,Innings_leg_byes,Innings_session,Innings_day,Innings_wides,Innings_runs
four,509674,Sydney Thunder,509671,Melbourne Renegades,2nd innings,4,"shorter down leg, he pulls off the bottom edge and it runs fine of short fine and it races away!","Mohammad Nabi to Ferguson, FOUR runs",0,25913,Mohammad Nabi,0,10,0,1.4,10,4864,Daniel Christian,0,6,0,1.0,5,5236,Callum Ferguson,46,31,6,0,959827,Jason Sangha,22,25,0,1,4,False,0,0,0,0,0,11,7,0,False,,False,False,6.65,0,64,0,2,0,1,1,0,71
run,509674,Sydney Thunder,509671,Melbourne Renegades,2nd innings,1,"shorter on leg, he's back and across working this past square leg to the sweeper","Mohammad Nabi to Ferguson, 1 run",0,25913,Mohammad Nabi,0,11,0,1.5,11,4864,Daniel Christian,0,6,0,1.0,5,5236,Callum Ferguson,47,32,6,0,959827,Jason Sangha,22,25,0,1,5,False,0,0,0,0,0,11,7,0,False,,False,False,6.64,0,65,0,2,0,1,1,0,72
run,509674,Sydney Thunder,509671,Melbourne Renegades,2nd innings,1,"91kph good length on leg, he drives on the front foot to long on","Mohammad Nabi to Sangha, 1 run",0,25913,Mohammad Nabi,0,12,0,2.0,12,4864,Daniel Christian,0,6,0,1.0,5,959827,Jason Sangha,23,26,0,1,5236,Callum Ferguson,47,32,6,0,6,True,0,0,0,0,0,11,7,0,False,,False,False,6.63,0,66,0,2,0,1,1,0,73
run,509674,Sydney Thunder,509671,Melbourne Renegades,2nd innings,1,"111kph, slower ball on off, he drives to Finch who is right back on the circle for one","Christian to Sangha, 1 run",0,4864,Daniel Christian,0,7,0,1.1,6,25913,Mohammad Nabi,0,12,0,2.0,12,959827,Jason Sangha,24,27,0,1,5236,Callum Ferguson,47,32,6,0,1,False,0,0,0,0,0,12,9,0,False,,False,False,6.62,0,67,0,2,0,1,1,0,74
four,509674,Sydney Thunder,509671,Melbourne Renegades,2nd innings,4,he cuts from off stump and nails it through backward point! What a shot. Gives room and cuts this virtually from the top of off! He timed it superbly. <strong>50</strong> for Ferguson. From just 33 balls. This has been a gem so far,"Christian to Ferguson, FOUR runs",0,4864,Daniel Christian,0,8,0,1.2,10,25913,Mohammad Nabi,0,12,0,2.0,12,5236,Callum Ferguson,51,33,7,0,959827,Jason Sangha,24,27,0,1,2,False,0,0,0,0,0,12,9,0,False,,False,False,6.88,0,68,0,2,0,1,1,0,78
no run,509674,Sydney Thunder,509671,Melbourne Renegades,2nd innings,0,"124kph, slower bouncer, he just sways under it","Christian to Ferguson, no run",0,4864,Daniel Christian,0,9,0,1.3,10,25913,Mohammad Nabi,0,12,0,2.0,12,5236,Callum Ferguson,51,34,7,0,959827,Jason Sangha,24,27,0,1,3,False,0,0,0,0,0,12,9,0,False,,False,False,6.78,0,69,0,2,0,1,1,0,78
run,509674,Sydney Thunder,509671,Melbourne Renegades,2nd innings,1,"129kph short and wide, he backs away and cuts hard <strong>in the air</strong> but it bounces just short of the deep backward point posted now on the rope","Christian to Ferguson, 1 run",0,4864,Daniel Christian,0,10,0,1.4,11,25913,Mohammad Nabi,0,12,0,2.0,12,5236,Callum Ferguson,52,35,7,0,959827,Jason Sangha,24,27,0,1,4,False,0,0,0,0,0,12,9,0,False,,False,False,6.77,0,70,0,2,0,1,1,0,79
run,509674,Sydney Thunder,509671,Melbourne Renegades,2nd innings,2,"116kph, slower ball down leg, he glances fine, Gurney runs a long way around the boundary to make the rolling save","Christian to Sangha, 2 runs",0,4864,Daniel Christian,0,11,0,1.5,13,25913,Mohammad Nabi,0,12,0,2.0,12,959827,Jason Sangha,26,28,0,1,5236,Callum Ferguson,52,35,7,0,5,False,0,0,0,0,0,12,9,0,False,,False,False,6.84,0,71,0,2,0,1,1,0,81
run,509674,Sydney Thunder,509671,Melbourne Renegades,2nd innings,1,"136kph, back of a length, he tried to pull but it hurried off the surface and cramped him up, mistimes the pull to midwicket","Christian to Sangha, 1 run",0,4864,Daniel Christian,0,12,0,2.0,14,25913,Mohammad Nabi,0,12,0,2.0,12,959827,Jason Sangha,27,29,0,1,5236,Callum Ferguson,52,35,7,0,6,True,0,0,0,0,0,12,9,0,False,,False,False,6.83,0,72,0,2,0,1,1,0,82
no run,509674,Sydney Thunder,509671,Melbourne Renegades,2nd innings,0,"shorter outside off, he's back and cutting to backward point","Boyce to Sangha, no run",0,326625,Cameron Boyce,0,13,0,2.1,9,4864,Daniel Christian,0,12,0,2.0,14,959827,Jason Sangha,27,30,0,1,5236,Callum Ferguson,52,35,7,0,1,False,0,0,0,0,0,13,6,1,False,,False,False,6.73,0,73,0,2,0,1,1,0,82
four,509674,Sydney Thunder,509671,Melbourne Renegades,2nd innings,4,"tossed up outside off, he dances down and lofts this beautifully inside out over cover! Sensational footwork to get it away to the rope","Boyce to Sangha, FOUR runs",0,326625,Cameron Boyce,0,14,0,2.2,13,4864,Daniel Christian,0,12,0,2.0,14,959827,Jason Sangha,31,31,1,1,5236,Callum Ferguson,52,35,7,0,2,False,0,0,0,0,0,13,6,1,False,,False,False,6.97,0,74,0,2,0,1,1,0,86
run,509674,Sydney Thunder,509671,Melbourne Renegades,2nd innings,1,"shorter outside off, he late cuts fine","Boyce to Sangha, 1 run",0,326625,Cameron Boyce,0,15,0,2.3,14,4864,Daniel Christian,0,12,0,2.0,14,959827,Jason Sangha,32,32,1,1,5236,Callum Ferguson,52,35,7,0,3,False,0,0,0,0,0,13,6,1,False,,False,False,6.96,0,75,0,2,0,1,1,0,87
out,509674,Sydney Thunder,509671,Melbourne Renegades,2nd innings,0,"<strong>caught at long on!</strong> Superb catch from Christian! It was tossed up and he tried to loft this over long on, he gets a good piece of it, it carries a long way, Christian is right on the rope, he jumps up and takes the catch above his head! Like an outfielder robbing a home run in baseball!","Boyce to Ferguson, OUT",0,326625,Cameron Boyce,0,16,1,2.4,14,4864,Daniel Christian,0,12,0,2.0,14,5236,Callum Ferguson,52,36,7,0,959827,Jason Sangha,32,32,1,1,4,False,0,0,0,0,0,13,6,1,True,caught,False,CJ Ferguson c Christian b Boyce 52 (36b 7x4 0x6) SR: 144.44,6.86,0,76,0,3,0,1,1,0,87
no run,509674,Sydney Thunder,509671,Melbourne Renegades,2nd innings,0,"leg break on off, he pushes this to cover","Boyce to Green, no run",0,326625,Cameron Boyce,0,17,1,2.5,14,4864,Daniel Christian,0,12,0,2.0,14,787073,Chris Green,0,1,0,0,959827,Jason Sangha,32,32,1,1,5,False,0,0,0,0,0,13,6,1,False,,False,False,6.77,0,77,0,3,0,1,1,0,87
run,509674,Sydney Thunder,509671,Melbourne Renegades,2nd innings,1,"full outside off, he sweeps hard to deep midwicket, he pushes for two but it's not on","Boyce to Green, 1 run",0,326625,Cameron Boyce,0,18,1,3.0,15,4864,Daniel Christian,0,12,0,2.0,14,787073,Chris Green,1,2,0,0,959827,Jason Sangha,32,32,1,1,6,True,0,0,0,0,0,13,6,1,False,,False,False,6.76,0,78,0,3,0,1,1,0,88
run,509674,Sydney Thunder,509671,Melbourne Renegades,2nd innings,1,"128kph, good length on leg, he works this off his pads to deep midwicket","Christian to Green, 1 run",0,4864,Daniel Christian,0,13,0,2.1,15,326625,Cameron Boyce,0,18,1,3.0,15,787073,Chris Green,2,3,0,0,959827,Jason Sangha,32,32,1,1,1,False,0,0,0,0,0,14,7,0,False,,False,False,6.75,0,79,0,3,0,1,1,0,89
run,509674,Sydney Thunder,509671,Melbourne Renegades,2nd innings,2,"118kph, slower ball on off, he tries to drives, gets a thick inside edge that rolls slowly to midwicket and they get a couple through good running","Christian to Sangha, 2 runs",0,4864,Daniel Christian,0,14,0,2.2,17,326625,Cameron Boyce,0,18,1,3.0,15,959827,Jason Sangha,34,33,1,1,787073,Chris Green,2,3,0,0,2,False,0,0,0,0,0,14,7,0,False,,False,False,6.82,0,80,0,3,0,1,1,0,91
run,509674,Sydney Thunder,509671,Melbourne Renegades,2nd innings,2,"full toss, he whips this hard wide of long on and they sprint two more","Christian to Sangha, 2 runs",0,4864,Daniel Christian,0,15,0,2.3,19,326625,Cameron Boyce,0,18,1,3.0,15,959827,Jason Sangha,36,34,1,1,787073,Chris Green,2,3,0,0,3,False,0,0,0,0,0,14,7,0,False,,False,False,6.88,0,81,0,3,0,1,1,0,93
no run,509674,Sydney Thunder,509671,Melbourne Renegades,2nd innings,0,"123kph short ball, he advances and tries to hook but <strong>misses</strong>","Christian to Sangha, no run",0,4864,Daniel Christian,0,16,0,2.4,19,326625,Cameron Boyce,0,18,1,3.0,15,959827,Jason Sangha,36,35,1,1,787073,Chris Green,2,3,0,0,4,False,0,0,0,0,0,14,7,0,False,,False,False,6.8,0,82,0,3,0,1,1,0,93
run,509674,Sydney Thunder,509671,Melbourne Renegades,2nd innings,1,"113kph, back of a length outside off, he forces off the back foot to backward point","Christian to Sangha, 1 run",0,4864,Daniel Christian,0,17,0,2.5,20,326625,Cameron Boyce,0,18,1,3.0,15,959827,Jason Sangha,37,36,1,1,787073,Chris Green,2,3,0,0,5,False,0,0,0,0,0,14,7,0,False,,False,False,6.79,0,83,0,3,0,1,1,0,94
run,509674,Sydney Thunder,509671,Melbourne Renegades,2nd innings,1,"short ball, he is back and cracking a pull shot to deep square leg","Christian to Green, 1 run",0,4864,Daniel Christian,0,18,0,3.0,21,326625,Cameron Boyce,0,18,1,3.0,15,787073,Chris Green,3,4,0,0,959827,Jason Sangha,37,36,1,1,6,True,0,0,0,0,0,14,7,0,False,,False,False,6.78,0,84,0,3,0,1,1,0,95
run,509674,Sydney Thunder,509671,Melbourne Renegades,2nd innings,2,"angled down leg, he sweeps fine to fine leg","Boyce to Green, 2 runs",0,326625,Cameron Boyce,0,19,1,3.1,17,4864,Daniel Christian,0,18,0,3.0,21,787073,Chris Green,5,5,0,0,959827,Jason Sangha,37,36,1,1,1,False,0,0,0,0,0,15,7,0,False,,False,False,6.84,0,85,0,3,0,1,1,0,97
run,509674,Sydney Thunder,509671,Melbourne Renegades,2nd innings,1,skips down to a leg break and checks a drive to long on,"Boyce to Green, 1 run",0,326625,Cameron Boyce,0,20,1,3.2,18,4864,Daniel Christian,0,18,0,3.0,21,787073,Chris Green,6,6,0,0,959827,Jason Sangha,37,36,1,1,2,False,0,0,0,0,0,15,7,0,False,,False,False,6.83,0,86,0,3,0,1,1,0,98
run,509674,Sydney Thunder,509671,Melbourne Renegades,2nd innings,1,"leg break drifting in, he advances and drives inside out to long off","Boyce to Sangha, 1 run",0,326625,Cameron Boyce,0,21,1,3.3,19,4864,Daniel Christian,0,18,0,3.0,21,959827,Jason Sangha,38,37,1,1,787073,Chris Green,6,6,0,0,3,False,0,0,0,0,0,15,7,0,False,,False,False,6.82,0,87,0,3,0,1,1,0,99
run,509674,Sydney Thunder,509671,Melbourne Renegades,2nd innings,1,"leg break outside off, he steps outside off thinking of sweeping but he drives to the full length, hitting to long off","Boyce to Green, 1 run",0,326625,Cameron Boyce,0,22,1,3.4,20,4864,Daniel Christian,0,18,0,3.0,21,787073,Chris Green,7,7,0,0,959827,Jason Sangha,38,37,1,1,4,False,0,0,0,0,0,15,7,0,False,,False,False,6.81,0,88,0,3,0,1,1,0,100
run,509674,Sydney Thunder,509671,Melbourne Renegades,2nd innings,2,"shorter on off, he's back and tucking this to the circle at midwicket, the sweeper is very deep, they run very well to get two","Boyce to Sangha, 2 runs",0,326625,Cameron Boyce,0,23,1,3.5,22,4864,Daniel Christian,0,18,0,3.0,21,959827,Jason Sangha,40,38,1,1,787073,Chris Green,7,7,0,0,5,False,0,0,0,0,0,15,7,0,False,,False,False,6.87,0,89,0,3,0,1,1,0,102
no run,509674,Sydney Thunder,509671,Melbourne Renegades,2nd innings,0,"shorter on off, he's back and forcing back to the bowler","Boyce to Sangha, no run",0,326625,Cameron Boyce,0,24,1,4.0,22,4864,Daniel Christian,0,18,0,3.0,21,959827,Jason Sangha,40,39,1,1,787073,Chris Green,7,7,0,0,6,True,0,0,0,0,0,15,7,0,False,,False,False,6.8,0,90,0,3,0,1,1,0,102
wide,509674,Sydney Thunder,509671,Melbourne Renegades,2nd innings,1,"back of the hand slower, but it's way wide and called","Gurney to Green, 1 wide",0,244639,Harry Gurney,0,6,1,1.0,5,326625,Cameron Boyce,0,24,1,4.0,22,787073,Chris Green,7,7,0,0,959827,Jason Sangha,40,39,1,1,1,False,0,0,1,0,0,16,5,1,False,,False,False,6.86,0,90,0,3,0,1,1,1,103
out,509674,Sydney Thunder,509671,Melbourne Renegades,2nd innings,0,"<strong>caught at long on!</strong> Slower ball does it! Good length slower ball wide outside off, so hard for Green to generate the pace from out there, he swings this flat and hard to long on and Christian runs forward and takes another excellent catch","Gurney to Green, OUT",0,244639,Harry Gurney,0,7,2,1.1,5,326625,Cameron Boyce,0,24,1,4.0,22,787073,Chris Green,7,8,0,0,959827,Jason Sangha,40,39,1,1,2,False,0,0,0,0,0,16,5,1,True,caught,False,CJ Green c Christian b Gurney 7 (8b 0x4 0x6) SR: 87.50,6.79,0,91,0,4,0,1,1,0,103
run,509674,Sydney Thunder,509671,Melbourne Renegades,2nd innings,1,"104kph, slower ball outside off, he pushes off the front foot through cover","Gurney to Sangha, 1 run",0,244639,Harry Gurney,0,8,2,1.2,6,326625,Cameron Boyce,0,24,1,4.0,22,959827,Jason Sangha,41,40,1,1,826901,Daniel Sams,0,0,0,0,3,False,0,0,0,0,0,16,5,1,False,,False,False,6.78,0,92,0,4,0,1,1,0,104
run,509674,Sydney Thunder,509671,Melbourne Renegades,2nd innings,1,"<strong>sky ball dropped by Gurney</strong> Slower ball outside off, completely deceived, he got under it and hit it straight up, Gurney runs under it, he's not sure if the keeper will get there, eventually he goes for it and drops it. They made a mess of that.","Gurney to Sams, 1 run",0,244639,Harry Gurney,0,9,2,1.3,7,326625,Cameron Boyce,0,24,1,4.0,22,826901,Daniel Sams,1,1,0,0,959827,Jason Sangha,41,40,1,1,4,False,0,0,0,0,0,16,5,1,False,,False,False,6.77,0,93,0,4,0,1,1,0,105
no run,509674,Sydney Thunder,509671,Melbourne Renegades,2nd innings,0,"full outside off, he square drives firmly to backward point and White makes a super save","Gurney to Sangha, no run",0,244639,Harry Gurney,0,10,2,1.4,7,326625,Cameron Boyce,0,24,1,4.0,22,959827,Jason Sangha,41,41,1,1,826901,Daniel Sams,1,1,0,0,5,False,0,0,0,0,0,16,5,1,False,,False,False,6.7,0,94,0,4,0,1,1,0,105
run,509674,Sydney Thunder,509671,Melbourne Renegades,2nd innings,1,"slower ball, he drives on the up past the bowler","Gurney to Sangha, 1 run",0,244639,Harry Gurney,0,11,2,1.5,8,326625,Cameron Boyce,0,24,1,4.0,22,959827,Jason Sangha,42,42,1,1,826901,Daniel Sams,1,1,0,0,6,False,0,0,0,0,0,16,5,1,False,,False,False,6.69,0,95,0,4,0,1,1,0,106
run,509674,Sydney Thunder,509671,Melbourne Renegades,2nd innings,1,"full toss outside off, he drives firmly to cover on the circle, Finch misfields and allows one","Gurney to Sams, 1 run",0,244639,Harry Gurney,0,12,2,2.0,9,326625,Cameron Boyce,0,24,1,4.0,22,826901,Daniel Sams,2,2,0,0,959827,Jason Sangha,42,42,1,1,7,True,0,0,0,0,0,16,5,1,False,,False,False,6.68,0,96,0,4,0,1,1,0,107
no run,509674,Sydney Thunder,509671,Melbourne Renegades,2nd innings,0,"108kph short slower ball wide of off, he swings hard and misses, could have and probably should have been called wide","Richardson to Sams, no run",0,272262,Kane Richardson,0,19,1,3.1,25,244639,Harry Gurney,0,12,2,2.0,9,826901,Daniel Sams,2,3,0,0,959827,Jason Sangha,42,42,1,1,1,False,0,0,0,0,0,17,6,1,False,,False,False,6.61,0,97,0,4,0,1,1,0,107
out,509674,Sydney Thunder,509671,Melbourne Renegades,2nd innings,0,"<strong>caught at deep midwicket!</strong> Shorter ball banged in, it comes off the surface a touch slower, he pulls hard and high but not long enough to clear the deep midwicket boundary, Harvey is right back on the rope and takes a good catch.","Richardson to Sams, OUT",0,272262,Kane Richardson,0,20,2,3.2,25,244639,Harry Gurney,0,12,2,2.0,9,826901,Daniel Sams,2,4,0,0,959827,Jason Sangha,42,42,1,1,2,False,0,0,0,0,0,17,6,1,True,caught,False,DR Sams c Harvey b Richardson 2 (4b 0x4 0x6) SR: 50.00,6.55,0,98,0,5,0,1,1,0,107
run,509674,Sydney Thunder,509671,Melbourne Renegades,2nd innings,1,"110kph slower ball wide of off, he pushes off the back foot to backward point","Richardson to Sangha, 1 run",0,272262,Kane Richardson,0,21,2,3.3,26,244639,Harry Gurney,0,12,2,2.0,9,959827,Jason Sangha,43,43,1,1,603411,Jay Lenton,0,0,0,0,3,False,0,0,0,0,0,17,6,1,False,,False,False,6.54,0,99,0,5,0,1,1,0,108
four,509674,Sydney Thunder,509671,Melbourne Renegades,2nd innings,4,"11kph, slower ball short, he controls a pull behind square into the gap and it runs away for four! That's a bonus. Great placement","Richardson to Lenton, FOUR runs",0,272262,Kane Richardson,0,22,2,3.4,30,244639,Harry Gurney,0,12,2,2.0,9,603411,Jay Lenton,4,1,1,0,959827,Jason Sangha,43,43,1,1,4,False,0,0,0,0,0,17,6,1,False,,False,False,6.72,0,100,0,5,0,1,1,0,112
no run,509674,Sydney Thunder,509671,Melbourne Renegades,2nd innings,0,"112kph, shorter slower ball wide of off, he tries to pull but is beaten by the lack of pace","Richardson to Lenton, no run",0,272262,Kane Richardson,0,23,2,3.5,30,244639,Harry Gurney,0,12,2,2.0,9,603411,Jay Lenton,4,2,1,0,959827,Jason Sangha,43,43,1,1,5,False,0,0,0,0,0,17,6,1,False,,False,False,6.65,0,101,0,5,0,1,1,0,112
run,509674,Sydney Thunder,509671,Melbourne Renegades,2nd innings,1,"116kph, good length slower ball on middle, he defends on the front foot to midwicket","Richardson to Lenton, 1 run",0,272262,Kane Richardson,0,24,2,4.0,31,244639,Harry Gurney,0,12,2,2.0,9,603411,Jay Lenton,5,3,1,0,959827,Jason Sangha,43,43,1,1,6,True,0,0,0,0,0,17,6,1,False,,False,False,6.64,0,102,0,5,0,1,1,0,113
run,509674,Sydney Thunder,509671,Melbourne Renegades,2nd innings,2,"<strong>dropped at deep square leg by Harvey!</strong> 107kph slower ball, he flicks this in the air to deep square, Harvey runs to it, gets there easily and drops it! It costs two","Gurney to Lenton, 2 runs",0,244639,Harry Gurney,0,13,2,2.1,11,272262,Kane Richardson,0,24,2,4.0,31,603411,Jay Lenton,7,4,1,0,959827,Jason Sangha,43,43,1,1,1,False,0,0,0,0,0,18,9,0,False,,False,False,6.69,0,103,0,5,0,1,1,0,115
run,509674,Sydney Thunder,509671,Melbourne Renegades,2nd innings,1,"slower ball outside off, he whacks this back at the stumps at the non-striker's and hits them, it ricochets away. That might have been two if it missed the stumps","Gurney to Lenton, 1 run",0,244639,Harry Gurney,0,14,2,2.2,12,272262,Kane Richardson,0,24,2,4.0,31,603411,Jay Lenton,8,5,1,0,959827,Jason Sangha,43,43,1,1,2,False,0,0,0,0,0,18,9,0,False,,False,False,6.69,0,104,0,5,0,1,1,0,116
four,509674,Sydney Thunder,509671,Melbourne Renegades,2nd innings,4,slower ball but wide and cut hard backward point! Great placement! Sangha is strong through that area. Too wide from Gurney.,"Gurney to Sangha, FOUR runs",0,244639,Harry Gurney,0,15,2,2.3,16,272262,Kane Richardson,0,24,2,4.0,31,959827,Jason Sangha,47,44,2,1,603411,Jay Lenton,8,5,1,0,3,False,0,0,0,0,0,18,9,0,False,,False,False,6.85,0,105,0,5,0,1,1,0,120
run,509674,Sydney Thunder,509671,Melbourne Renegades,2nd innings,1,"129kph, wide yorker, he squeezes this out to cover","Gurney to Sangha, 1 run",0,244639,Harry Gurney,0,16,2,2.4,17,272262,Kane Richardson,0,24,2,4.0,31,959827,Jason Sangha,48,45,2,1,603411,Jay Lenton,8,5,1,0,4,False,0,0,0,0,0,18,9,0,False,,False,False,6.84,0,106,0,5,0,1,1,0,121
no run,509674,Sydney Thunder,509671,Melbourne Renegades,2nd innings,0,"another wide yorker, perfectly executed, he misses trying to run it to third man","Gurney to Lenton, no run",0,244639,Harry Gurney,0,17,2,2.5,17,272262,Kane Richardson,0,24,2,4.0,31,603411,Jay Lenton,8,6,1,0,959827,Jason Sangha,48,45,2,1,5,False,0,0,0,0,0,18,9,0,False,,False,False,6.78,0,107,0,5,0,1,1,0,121
run,509674,Sydney Thunder,509671,Melbourne Renegades,2nd innings,1,"103kph length slower ball, he swings this hard away to deep midwicket but it bounces short of the man running in","Gurney to Lenton, 1 run",0,244639,Harry Gurney,0,18,2,3.0,18,272262,Kane Richardson,0,24,2,4.0,31,603411,Jay Lenton,9,7,1,0,959827,Jason Sangha,48,45,2,1,6,True,0,0,0,0,0,18,9,0,False,,False,False,6.77,0,108,0,5,0,1,1,0,122
run,509674,Sydney Thunder,509671,Melbourne Renegades,2nd innings,2,"117kph. slower ball, wide of off, he cuts hard to deep point, they hesitate for two but go eventually, the throw is wide and Lenton gets there with a dive","Christian to Lenton, 2 runs",0,4864,Daniel Christian,0,19,0,3.1,23,244639,Harry Gurney,0,18,2,3.0,18,603411,Jay Lenton,11,8,1,0,959827,Jason Sangha,48,45,2,1,1,False,0,0,0,0,0,19,8,0,False,,False,False,6.82,0,109,0,5,0,1,1,0,124
no run,509674,Sydney Thunder,509671,Melbourne Renegades,2nd innings,0,"117kph, back of a length slower ball, he tries to pull but gets it off the gloves and it drops down","Christian to Lenton, no run",0,4864,Daniel Christian,0,20,0,3.2,23,244639,Harry Gurney,0,18,2,3.0,18,603411,Jay Lenton,11,9,1,0,959827,Jason Sangha,48,45,2,1,2,False,0,0,0,0,0,19,8,0,False,,False,False,6.76,0,110,0,5,0,1,1,0,124
run,509674,Sydney Thunder,509671,Melbourne Renegades,2nd innings,2,"120kph full outside off, he clears the right leg and slices this high and just out of reach of Finch running back from cover, they get two","Christian to Lenton, 2 runs",0,4864,Daniel Christian,0,21,0,3.3,25,244639,Harry Gurney,0,18,2,3.0,18,603411,Jay Lenton,13,10,1,0,959827,Jason Sangha,48,45,2,1,3,False,0,0,0,0,0,19,8,0,False,,False,False,6.81,0,111,0,5,0,1,1,0,126
run,509674,Sydney Thunder,509671,Melbourne Renegades,2nd innings,1,"120kph, back of a length, he pulls hard but doesn't nail it to deep midwicket, they only get one despite Richardson coming from right back on the rope at the long boundary","Christian to Lenton, 1 run",0,4864,Daniel Christian,0,22,0,3.4,26,244639,Harry Gurney,0,18,2,3.0,18,603411,Jay Lenton,14,11,1,0,959827,Jason Sangha,48,45,2,1,4,False,0,0,0,0,0,19,8,0,False,,False,False,6.8,0,112,0,5,0,1,1,0,127
run,509674,Sydney Thunder,509671,Melbourne Renegades,2nd innings,1,"12kph, back of a length, he advances and just bunts this to the gap at point for a single","Christian to Sangha, 1 run",0,4864,Daniel Christian,0,23,0,3.5,27,244639,Harry Gurney,0,18,2,3.0,18,959827,Jason Sangha,49,46,2,1,603411,Jay Lenton,14,11,1,0,5,False,0,0,0,0,0,19,8,0,False,,False,False,6.79,0,113,0,5,0,1,1,0,128
run,509674,Sydney Thunder,509671,Melbourne Renegades,2nd innings,2,"short slower ball, he pulls hard and flat to the long boundary at midwicket, Richardson is way back on the rope and they are able to run two","Christian to Lenton, 2 runs",0,4864,Daniel Christian,0,24,0,4.0,29,244639,Harry Gurney,0,18,2,3.0,18,603411,Jay Lenton,16,12,1,0,959827,Jason Sangha,49,46,2,1,6,True,0,0,0,0,0,19,8,0,False,,False,False,6.84,0,114,0,5,0,1,1,0,130
run,509674,Sydney Thunder,509671,Melbourne Renegades,2nd innings,1,"<strong>another sky ball dropped by Gurney!</strong> Sangha gets to <strong>50!</strong> Slower ball, gets a top edge straight up, Gurney camps under it and spills it! Two on the night.","Gurney to Sangha, 1 run",0,244639,Harry Gurney,0,19,2,3.1,19,4864,Daniel Christian,0,24,0,4.0,29,959827,Jason Sangha,50,47,2,1,603411,Jay Lenton,16,12,1,0,1,False,0,0,0,0,0,20,10,0,False,,False,False,6.83,0,115,0,5,0,1,1,0,131
run,509674,Sydney Thunder,509671,Melbourne Renegades,2nd innings,2,"135kph, yorker, speared at leg, he squeezes this out through midwicket, they run well for two but they need more","Gurney to Lenton, 2 runs",0,244639,Harry Gurney,0,20,2,3.2,21,4864,Daniel Christian,0,24,0,4.0,29,603411,Jay Lenton,18,13,1,0,959827,Jason Sangha,50,47,2,1,2,False,0,0,0,0,0,20,10,0,False,,False,False,6.87,0,116,0,5,0,1,1,0,133
run,509674,Sydney Thunder,509671,Melbourne Renegades,2nd innings,2,"126kph, full yorker at leg, he jams this out through mid on, again they run well to get back for two","Gurney to Lenton, 2 runs",0,244639,Harry Gurney,0,21,2,3.3,23,4864,Daniel Christian,0,24,0,4.0,29,603411,Jay Lenton,20,14,1,0,959827,Jason Sangha,50,47,2,1,3,False,0,0,0,0,0,20,10,0,False,,False,False,6.92,0,117,0,5,0,1,1,0,135
leg bye,509674,Sydney Thunder,509671,Melbourne Renegades,2nd innings,1,"107kph, slower ball on leg, he tries to whip over square leg, misses, it comes off pad and rolls away","Gurney to Lenton, 1 leg bye",0,244639,Harry Gurney,0,22,2,3.4,23,4864,Daniel Christian,0,24,0,4.0,29,603411,Jay Lenton,20,15,1,0,959827,Jason Sangha,50,47,2,1,4,False,0,0,0,0,1,20,10,0,False,,False,False,6.91,0,118,0,5,1,1,1,0,136
four,509674,Sydney Thunder,509671,Melbourne Renegades,2nd innings,4,he flicks this up and over backward square for four! Too little too late but a great shot from outside off to whip this behind square over the man in the circle,"Gurney to Sangha, FOUR runs",0,244639,Harry Gurney,0,23,2,3.5,27,4864,Daniel Christian,0,24,0,4.0,29,959827,Jason Sangha,54,48,3,1,603411,Jay Lenton,20,15,1,0,5,False,0,0,0,0,0,20,10,0,False,,False,False,7.05,0,119,0,5,0,1,1,0,140
no run,509674,Sydney Thunder,509671,Melbourne Renegades,2nd innings,0,"full wide yorker, he misses! Great bowling display from the Renegades!","Gurney to Sangha, no run",0,244639,Harry Gurney,0,24,2,4.0,27,4864,Daniel Christian,0,24,0,4.0,29,959827,Jason Sangha,54,49,3,1,603411,Jay Lenton,20,15,1,0,6,True,0,0,0,0,0,20,10,0,False,,False,False,7.0,0,120,0,5,0,1,1,0,140
