PlayType_description,Batting_Team_id,Batting_Team_name,Bowling_Team_id,Bowling_Team_name,Innings,Total_Runs_on_delivery,Commentary,Commentary_short,Score,Bowler_id,Bowler_name,Bowler_maiden,Bowler_balls,Bowler_wickets,Bowler_over,Bowler_conceded,Other_Bowler_id,Other_Bowler_name,Other_Bowler_maidens,Other_Bowler_balls,Other_Bowler_wickets,Other_Bowler_overs,Other_Bowler_conceded,Batsman_id,Batsman_name,Batsman_runs,Batsman_balls_faced,Batsman_four,Batsman_sixes,Other_Batsman_id,Other_Batsman_name,Other_Batsman_runs,Other_Batsman_balls_faced,Other_Batsman_four,Other_Batsman_sixes,Over_ball,Over_complete,Over_maiden,Over_no_Ball,Over_wide,Over_byes,Over_leg_byes,Over_number,Over_runs,Over_wickets,Dismissal_is_true,Dismissal_type,Dismissal_fielder_iskeeper,Dismissal_text,Innings_run_rate,Innings_byes,Innings_balls,Innings_no_balls,Innings_wickets,Innings_leg_byes,Innings_session,Innings_day,Innings_wides,Innings_runs
no run,509674,Sydney Thunder,509671,Melbourne Renegades,2nd innings,0,"137kph, good length way wide of off, he tries to thrash a square drive and<strong> misses</strong>","Richardson to Devcich, no run",0,272262,Kane Richardson,0,2,0,0.2,0,False,False,0,0,0,False,0,36948,Anton Devcich,0,2,0,0,8180,Shane Watson,0,0,0,0,2,False,0,0,0,0,0,1,1,1,False,,False,False,0.0,0,2,0,0,0,1,1,0,0
out,509674,Sydney Thunder,509671,Melbourne Renegades,2nd innings,0,"<strong>caught at third man!</strong> Short and wide, he reaches out to cut, gets a thick top edge, it flies straight to third man and Boyce takes a few steps in and takes a simple catch!","Richardson to Devcich, OUT",0,272262,Kane Richardson,0,3,1,0.3,0,False,False,0,0,0,False,0,36948,Anton Devcich,0,3,0,0,8180,Shane Watson,0,0,0,0,3,False,0,0,0,0,0,1,1,1,True,caught,False,AP Devcich c Boyce b Richardson 0 (3b 0x4 0x6) SR: 0.00,0.0,0,3,0,1,0,1,1,0,0
run,509674,Sydney Thunder,509671,Melbourne Renegades,2nd innings,1,"141kph, good length angled into leg, he is back and turning this with the angle to wide fine leg","Richardson to Ferguson, 1 run",0,272262,Kane Richardson,0,4,1,0.4,1,False,False,0,0,0,False,0,5236,Callum Ferguson,1,1,0,0,8180,Shane Watson,0,0,0,0,4,False,0,0,0,0,0,1,1,1,False,,False,False,1.5,0,4,0,1,0,1,1,0,1
no run,509674,Sydney Thunder,509671,Melbourne Renegades,2nd innings,0,"good length on off, he presses forward with a textbook forward defence","Richardson to Watson, no run",0,272262,Kane Richardson,0,5,1,0.5,1,False,False,0,0,0,False,0,8180,Shane Watson,0,1,0,0,5236,Callum Ferguson,1,1,0,0,5,False,0,0,0,0,0,1,1,1,False,,False,False,1.2,0,5,0,1,0,1,1,0,1
no run,509674,Sydney Thunder,509671,Melbourne Renegades,2nd innings,0,"135kph, back of a length on off, he's back and across and defending to backward point","Richardson to Watson, no run",0,272262,Kane Richardson,0,6,1,1.0,1,False,False,0,0,0,False,0,8180,Shane Watson,0,2,0,0,5236,Callum Ferguson,1,1,0,0,6,True,0,0,0,0,0,1,1,1,False,,False,False,1.0,0,6,0,1,0,1,1,0,1
four,509674,Sydney Thunder,509671,Melbourne Renegades,2nd innings,4,short down leg and he flicks this fine of short fine! A freebie first up and he cashes in glancing this away easily,"Tremain to Ferguson, FOUR runs",0,553800,Chris Tremain,0,1,0,0.1,4,272262,Kane Richardson,0,6,1,1.0,1,5236,Callum Ferguson,5,2,1,0,8180,Shane Watson,0,2,0,0,1,False,0,0,0,0,0,2,11,0,False,,False,False,4.28,0,7,0,1,0,1,1,0,5
four,509674,Sydney Thunder,509671,Melbourne Renegades,2nd innings,4,"132kph, fuller outswinger outside off, he drives elegantly wide of mid off! Superb shot from Ferguson. Just leaned on this drive into the gap","Tremain to Ferguson, FOUR runs",0,553800,Chris Tremain,0,2,0,0.2,8,272262,Kane Richardson,0,6,1,1.0,1,5236,Callum Ferguson,9,3,2,0,8180,Shane Watson,0,2,0,0,2,False,0,0,0,0,0,2,11,0,False,,False,False,6.75,0,8,0,1,0,1,1,0,9
wide,509674,Sydney Thunder,509671,Melbourne Renegades,2nd innings,1,"130kph, inswinger, angled down leg, he misses but it's called <strong>wide</strong>","Tremain to Ferguson, 1 wide",0,553800,Chris Tremain,0,2,0,0.2,9,272262,Kane Richardson,0,6,1,1.0,1,5236,Callum Ferguson,9,3,2,0,8180,Shane Watson,0,2,0,0,3,False,0,0,1,0,0,2,11,0,False,,False,False,7.5,0,8,0,1,0,1,1,1,10
no run,509674,Sydney Thunder,509671,Melbourne Renegades,2nd innings,0,"131kph, fuller outside off, he drives on the up to cover-point","Tremain to Ferguson, no run",0,553800,Chris Tremain,0,3,0,0.3,9,272262,Kane Richardson,0,6,1,1.0,1,5236,Callum Ferguson,9,4,2,0,8180,Shane Watson,0,2,0,0,4,False,0,0,0,0,0,2,11,0,False,,False,False,6.66,0,9,0,1,0,1,1,0,10
no run,509674,Sydney Thunder,509671,Melbourne Renegades,2nd innings,0,"129kph, shorter length on off, he backs away and tries to cut, but mistimes it cover","Tremain to Ferguson, no run",0,553800,Chris Tremain,0,4,0,0.4,9,272262,Kane Richardson,0,6,1,1.0,1,5236,Callum Ferguson,9,5,2,0,8180,Shane Watson,0,2,0,0,5,False,0,0,0,0,0,2,11,0,False,,False,False,6.0,0,10,0,1,0,1,1,0,10
run,509674,Sydney Thunder,509671,Melbourne Renegades,2nd innings,2,slices a <strong>leading edge high in the air</strong> but it just carries backward point running back. He tried to whip through midwicket but the leading edge carries a long way to get two,"Tremain to Ferguson, 2 runs",0,553800,Chris Tremain,0,5,0,0.5,11,272262,Kane Richardson,0,6,1,1.0,1,5236,Callum Ferguson,11,6,2,0,8180,Shane Watson,0,2,0,0,6,False,0,0,0,0,0,2,11,0,False,,False,False,6.54,0,11,0,1,0,1,1,0,12
no run,509674,Sydney Thunder,509671,Melbourne Renegades,2nd innings,0,"good length on off, he defends from the crease with an open face to backward point","Tremain to Ferguson, no run",0,553800,Chris Tremain,0,6,0,1.0,11,272262,Kane Richardson,0,6,1,1.0,1,5236,Callum Ferguson,11,7,2,0,8180,Shane Watson,0,2,0,0,7,True,0,0,0,0,0,2,11,0,False,,False,False,6.0,0,12,0,1,0,1,1,0,12
no run,509674,Sydney Thunder,509671,Melbourne Renegades,2nd innings,0,"139kph, fuller on off, he drives firmly straight to mid off","Richardson to Watson, no run",0,272262,Kane Richardson,0,7,1,1.1,1,553800,Chris Tremain,0,6,0,1.0,11,8180,Shane Watson,0,3,0,0,5236,Callum Ferguson,11,7,2,0,1,False,0,0,0,0,0,3,11,0,False,,False,False,5.53,0,13,0,1,0,1,1,0,12
run,509674,Sydney Thunder,509671,Melbourne Renegades,2nd innings,1,"138kph, back of a length on leg, he turns this away off the thigh through forward square","Richardson to Watson, 1 run",0,272262,Kane Richardson,0,8,1,1.2,2,553800,Chris Tremain,0,6,0,1.0,11,8180,Shane Watson,1,4,0,0,5236,Callum Ferguson,11,7,2,0,2,False,0,0,0,0,0,3,11,0,False,,False,False,5.57,0,14,0,1,0,1,1,0,13
no run,509674,Sydney Thunder,509671,Melbourne Renegades,2nd innings,0,"133kph, back of a length outside off, he is back and defending to point","Richardson to Ferguson, no run",0,272262,Kane Richardson,0,9,1,1.3,2,553800,Chris Tremain,0,6,0,1.0,11,5236,Callum Ferguson,11,8,2,0,8180,Shane Watson,1,4,0,0,3,False,0,0,0,0,0,3,11,0,False,,False,False,5.2,0,15,0,1,0,1,1,0,13
four,509674,Sydney Thunder,509671,Melbourne Renegades,2nd innings,4,"<strong>gloved over the keeper!</strong> 141kph short ball, he tried to pull, it got onto him too quick, comes off the glove and flies just over the keeper's outstretched glove and down to the rope","Richardson to Ferguson, FOUR runs",0,272262,Kane Richardson,0,10,1,1.4,6,553800,Chris Tremain,0,6,0,1.0,11,5236,Callum Ferguson,15,9,3,0,8180,Shane Watson,1,4,0,0,4,False,0,0,0,0,0,3,11,0,False,,False,False,6.37,0,16,0,1,0,1,1,0,17
run,509674,Sydney Thunder,509671,Melbourne Renegades,2nd innings,2,"good length on leg, he's back and across and tucking this to the gap behind square, they run well to get two","Richardson to Ferguson, 2 runs",0,272262,Kane Richardson,0,11,1,1.5,8,553800,Chris Tremain,0,6,0,1.0,11,5236,Callum Ferguson,17,10,3,0,8180,Shane Watson,1,4,0,0,5,False,0,0,0,0,0,3,11,0,False,,False,False,6.7,0,17,0,1,0,1,1,0,19
four,509674,Sydney Thunder,509671,Melbourne Renegades,2nd innings,4,"gives room and cuts hard in the air wide of third man! 137kph, back of a length on leg, he backs away and with quick hard carves it past backward point and wide of third man. Skilful shot","Richardson to Ferguson, FOUR runs",0,272262,Kane Richardson,0,12,1,2.0,12,553800,Chris Tremain,0,6,0,1.0,11,5236,Callum Ferguson,21,11,4,0,8180,Shane Watson,1,4,0,0,6,True,0,0,0,0,0,3,11,0,False,,False,False,7.66,0,18,0,1,0,1,1,0,23
out,509674,Sydney Thunder,509671,Melbourne Renegades,2nd innings,0,"<strong>caught at cover!</strong> Gurney gets the key scalp of Watson! 114kph slower ball cutter, Watson climbs into a cover-drive, hits it head high straight to Finch who takes the catch infront of his chest at cover! He loves it too!","Gurney to Watson, OUT",0,244639,Harry Gurney,0,1,1,0.1,0,272262,Kane Richardson,0,12,1,2.0,12,8180,Shane Watson,1,5,0,0,5236,Callum Ferguson,21,11,4,0,1,False,0,0,0,0,0,4,4,1,True,caught,False,SR Watson c Finch b Gurney 1 (5b 0x4 0x6) SR: 20.00,7.26,0,19,0,2,0,1,1,0,23
no run,509674,Sydney Thunder,509671,Melbourne Renegades,2nd innings,0,"good length angled across outside off, he defends on the front foot to cover","Gurney to Sangha, no run",0,244639,Harry Gurney,0,2,1,0.2,0,272262,Kane Richardson,0,12,1,2.0,12,959827,Jason Sangha,0,1,0,0,5236,Callum Ferguson,21,11,4,0,2,False,0,0,0,0,0,4,4,1,False,,False,False,6.9,0,20,0,2,0,1,1,0,23
run,509674,Sydney Thunder,509671,Melbourne Renegades,2nd innings,1,"129kph, back of a length on leg, he's back and working this through the gap square of midwicket","Gurney to Sangha, 1 run",0,244639,Harry Gurney,0,3,1,0.3,1,272262,Kane Richardson,0,12,1,2.0,12,959827,Jason Sangha,1,2,0,0,5236,Callum Ferguson,21,11,4,0,3,False,0,0,0,0,0,4,4,1,False,,False,False,6.85,0,21,0,2,0,1,1,0,24
no run,509674,Sydney Thunder,509671,Melbourne Renegades,2nd innings,0,"136kph, good length on middle and leg, he pushes this back to the bowler","Gurney to Ferguson, no run",0,244639,Harry Gurney,0,4,1,0.4,1,272262,Kane Richardson,0,12,1,2.0,12,5236,Callum Ferguson,21,12,4,0,959827,Jason Sangha,1,2,0,0,4,False,0,0,0,0,0,4,4,1,False,,False,False,6.54,0,22,0,2,0,1,1,0,24
run,509674,Sydney Thunder,509671,Melbourne Renegades,2nd innings,2,"115kph, slower ball, wide of off, he cuts firmly to deep point and the sweeper works hard to his left","Gurney to Ferguson, 2 runs",0,244639,Harry Gurney,0,5,1,0.5,3,272262,Kane Richardson,0,12,1,2.0,12,5236,Callum Ferguson,23,13,4,0,959827,Jason Sangha,1,2,0,0,5,False,0,0,0,0,0,4,4,1,False,,False,False,6.78,0,23,0,2,0,1,1,0,26
run,509674,Sydney Thunder,509671,Melbourne Renegades,2nd innings,1,"slower ball, he pushes this through cover-point","Gurney to Ferguson, 1 run",0,244639,Harry Gurney,0,6,1,1.0,4,272262,Kane Richardson,0,12,1,2.0,12,5236,Callum Ferguson,24,14,4,0,959827,Jason Sangha,1,2,0,0,6,True,0,0,0,0,0,4,4,1,False,,False,False,6.75,0,24,0,2,0,1,1,0,27
run,509674,Sydney Thunder,509671,Melbourne Renegades,2nd innings,1,"89kph off break on off, he's back and working this from off stump behind square","Mohammad Nabi to Ferguson, 1 run",0,25913,Mohammad Nabi,0,1,0,0.1,1,244639,Harry Gurney,0,6,1,1.0,4,5236,Callum Ferguson,25,15,4,0,959827,Jason Sangha,1,2,0,0,1,False,0,0,0,0,0,5,5,0,False,,False,False,6.72,0,25,0,2,0,1,1,0,28
run,509674,Sydney Thunder,509671,Melbourne Renegades,2nd innings,1,"off break on off, he's back and punching to mid off who is on the circle and they take one","Mohammad Nabi to Sangha, 1 run",0,25913,Mohammad Nabi,0,2,0,0.2,2,244639,Harry Gurney,0,6,1,1.0,4,959827,Jason Sangha,2,3,0,0,5236,Callum Ferguson,25,15,4,0,2,False,0,0,0,0,0,5,5,0,False,,False,False,6.69,0,26,0,2,0,1,1,0,29
run,509674,Sydney Thunder,509671,Melbourne Renegades,2nd innings,1,"90kph pushed through on middle, he's back and across and working this through midwicket","Mohammad Nabi to Ferguson, 1 run",0,25913,Mohammad Nabi,0,3,0,0.3,3,244639,Harry Gurney,0,6,1,1.0,4,5236,Callum Ferguson,26,16,4,0,959827,Jason Sangha,2,3,0,0,3,False,0,0,0,0,0,5,5,0,False,,False,False,6.66,0,27,0,2,0,1,1,0,30
no run,509674,Sydney Thunder,509671,Melbourne Renegades,2nd innings,0,"fired full outside off, 105kph, he tries to drive and <strong>misses</strong>","Mohammad Nabi to Sangha, no run",0,25913,Mohammad Nabi,0,4,0,0.4,3,244639,Harry Gurney,0,6,1,1.0,4,959827,Jason Sangha,2,4,0,0,5236,Callum Ferguson,26,16,4,0,4,False,0,0,0,0,0,5,5,0,False,,False,False,6.42,0,28,0,2,0,1,1,0,30
run,509674,Sydney Thunder,509671,Melbourne Renegades,2nd innings,1,"full toss outside off, he slices a drive off the thick edge, along the ground, Boyce makes ground to his left and makes a sensational save","Mohammad Nabi to Sangha, 1 run",0,25913,Mohammad Nabi,0,5,0,0.5,4,244639,Harry Gurney,0,6,1,1.0,4,959827,Jason Sangha,3,5,0,0,5236,Callum Ferguson,26,16,4,0,5,False,0,0,0,0,0,5,5,0,False,,False,False,6.41,0,29,0,2,0,1,1,0,31
run,509674,Sydney Thunder,509671,Melbourne Renegades,2nd innings,1,"fuller on off, he's back and working through midwicket","Mohammad Nabi to Ferguson, 1 run",0,25913,Mohammad Nabi,0,6,0,1.0,5,244639,Harry Gurney,0,6,1,1.0,4,5236,Callum Ferguson,27,17,4,0,959827,Jason Sangha,3,5,0,0,6,True,0,0,0,0,0,5,5,0,False,,False,False,6.4,0,30,0,2,0,1,1,0,32
run,509674,Sydney Thunder,509671,Melbourne Renegades,2nd innings,1,"137kph, back of a length on off, he's back and working this through the gap at square leg","Richardson to Ferguson, 1 run",0,272262,Kane Richardson,0,13,1,2.1,13,25913,Mohammad Nabi,0,6,0,1.0,5,5236,Callum Ferguson,28,18,4,0,959827,Jason Sangha,3,5,0,0,1,False,0,0,0,0,0,6,13,0,False,,False,False,6.38,0,31,0,2,0,1,1,0,33
run,509674,Sydney Thunder,509671,Melbourne Renegades,2nd innings,1,"135kph, good length on off, he pushes slowly on the front foot to mid off, Christian is deep on the circle and they pinch one to him despite Christian hitting the stumps","Richardson to Sangha, 1 run",0,272262,Kane Richardson,0,14,1,2.2,14,25913,Mohammad Nabi,0,6,0,1.0,5,959827,Jason Sangha,4,6,0,0,5236,Callum Ferguson,28,18,4,0,2,False,0,0,0,0,0,6,13,0,False,,False,False,6.37,0,32,0,2,0,1,1,0,34
four,509674,Sydney Thunder,509671,Melbourne Renegades,2nd innings,4,<strong>cuts hard behind point!</strong> Wasn't that short or wide but he gives some room and his hands are unreal to generate the pace and place it behind point wide of third man,"Richardson to Ferguson, FOUR runs",0,272262,Kane Richardson,0,15,1,2.3,18,25913,Mohammad Nabi,0,6,0,1.0,5,5236,Callum Ferguson,32,19,5,0,959827,Jason Sangha,4,6,0,0,3,False,0,0,0,0,0,6,13,0,False,,False,False,6.9,0,33,0,2,0,1,1,0,38
run,509674,Sydney Thunder,509671,Melbourne Renegades,2nd innings,1,"137kph, good length outside off, he pushes wide of cover and takes one","Richardson to Ferguson, 1 run",0,272262,Kane Richardson,0,16,1,2.4,19,25913,Mohammad Nabi,0,6,0,1.0,5,5236,Callum Ferguson,33,20,5,0,959827,Jason Sangha,4,6,0,0,4,False,0,0,0,0,0,6,13,0,False,,False,False,6.88,0,34,0,2,0,1,1,0,39
six,509674,Sydney Thunder,509671,Melbourne Renegades,2nd innings,6,"<strong>hooked over deep backward square!</strong> It wasn't controlled, short ball high, he hooked off the top edge, Cooper was in a long way from the long boundary, it kept carrying way over his head and carried just over the rope!","Richardson to Sangha, SIX runs",0,272262,Kane Richardson,0,17,1,2.5,25,25913,Mohammad Nabi,0,6,0,1.0,5,959827,Jason Sangha,10,7,0,1,5236,Callum Ferguson,33,20,5,0,5,False,0,0,0,0,0,6,13,0,False,,False,False,7.71,0,35,0,2,0,1,1,0,45
no run,509674,Sydney Thunder,509671,Melbourne Renegades,2nd innings,0,"back of a length on off, he defends off the back foot to point","Richardson to Sangha, no run",0,272262,Kane Richardson,0,18,1,3.0,25,25913,Mohammad Nabi,0,6,0,1.0,5,959827,Jason Sangha,10,8,0,1,5236,Callum Ferguson,33,20,5,0,6,True,0,0,0,0,0,6,13,0,False,,False,False,7.5,0,36,0,2,0,1,1,0,45
run,509674,Sydney Thunder,509671,Melbourne Renegades,2nd innings,1,"shorter leg break, he's back and cutting past point to the sweeper","Boyce to Ferguson, 1 run",0,326625,Cameron Boyce,0,1,0,0.1,1,272262,Kane Richardson,0,18,1,3.0,25,5236,Callum Ferguson,34,21,5,0,959827,Jason Sangha,10,8,0,1,1,False,0,0,0,0,0,7,4,0,False,,False,False,7.45,0,37,0,2,0,1,1,0,46
no run,509674,Sydney Thunder,509671,Melbourne Renegades,2nd innings,0,"85kph leg break, he's back and cuts to backward point","Boyce to Sangha, no run",0,326625,Cameron Boyce,0,2,0,0.2,1,272262,Kane Richardson,0,18,1,3.0,25,959827,Jason Sangha,10,9,0,1,5236,Callum Ferguson,34,21,5,0,2,False,0,0,0,0,0,7,4,0,False,,False,False,7.26,0,38,0,2,0,1,1,0,46
no run,509674,Sydney Thunder,509671,Melbourne Renegades,2nd innings,0,"very full on middle, yorker length, he squeezes this out","Boyce to Sangha, no run",0,326625,Cameron Boyce,0,3,0,0.3,1,272262,Kane Richardson,0,18,1,3.0,25,959827,Jason Sangha,10,10,0,1,5236,Callum Ferguson,34,21,5,0,3,False,0,0,0,0,0,7,4,0,False,,False,False,7.07,0,39,0,2,0,1,1,0,46
run,509674,Sydney Thunder,509671,Melbourne Renegades,2nd innings,1,"78kph leg break on off, he punches off the back foot inside out to deep point","Boyce to Sangha, 1 run",0,326625,Cameron Boyce,0,4,0,0.4,2,272262,Kane Richardson,0,18,1,3.0,25,959827,Jason Sangha,11,11,0,1,5236,Callum Ferguson,34,21,5,0,4,False,0,0,0,0,0,7,4,0,False,,False,False,7.05,0,40,0,2,0,1,1,0,47
run,509674,Sydney Thunder,509671,Melbourne Renegades,2nd innings,1,"very short, gets away with it, he just slaps this off the back foot to deep long off","Boyce to Ferguson, 1 run",0,326625,Cameron Boyce,0,5,0,0.5,3,272262,Kane Richardson,0,18,1,3.0,25,5236,Callum Ferguson,35,22,5,0,959827,Jason Sangha,11,11,0,1,5,False,0,0,0,0,0,7,4,0,False,,False,False,7.02,0,41,0,2,0,1,1,0,48
run,509674,Sydney Thunder,509671,Melbourne Renegades,2nd innings,1,"tossed up outside off, he skips down and drives to long off","Boyce to Sangha, 1 run",0,326625,Cameron Boyce,0,6,0,1.0,4,272262,Kane Richardson,0,18,1,3.0,25,959827,Jason Sangha,12,12,0,1,5236,Callum Ferguson,35,22,5,0,6,True,0,0,0,0,0,7,4,0,False,,False,False,7.0,0,42,0,2,0,1,1,0,49
run,509674,Sydney Thunder,509671,Melbourne Renegades,2nd innings,1,"good length on middle, he clips through midwicket","Tremain to Sangha, 1 run",0,553800,Chris Tremain,0,7,0,1.1,12,326625,Cameron Boyce,0,6,0,1.0,4,959827,Jason Sangha,13,13,0,1,5236,Callum Ferguson,35,22,5,0,1,False,0,0,0,0,0,8,6,0,False,,False,False,6.97,0,43,0,2,0,1,1,0,50
run,509674,Sydney Thunder,509671,Melbourne Renegades,2nd innings,1,"130kph, back of a length on middle, he punches to long on","Tremain to Ferguson, 1 run",0,553800,Chris Tremain,0,8,0,1.2,13,326625,Cameron Boyce,0,6,0,1.0,4,5236,Callum Ferguson,36,23,5,0,959827,Jason Sangha,13,13,0,1,2,False,0,0,0,0,0,8,6,0,False,,False,False,6.95,0,44,0,2,0,1,1,0,51
run,509674,Sydney Thunder,509671,Melbourne Renegades,2nd innings,2,"angled down leg, he glances this fine of fine leg","Tremain to Sangha, 2 runs",0,553800,Chris Tremain,0,9,0,1.3,15,326625,Cameron Boyce,0,6,0,1.0,4,959827,Jason Sangha,15,14,0,1,5236,Callum Ferguson,36,23,5,0,3,False,0,0,0,0,0,8,6,0,False,,False,False,7.06,0,45,0,2,0,1,1,0,53
run,509674,Sydney Thunder,509671,Melbourne Renegades,2nd innings,2,"full on the pads, 130kph, he whips this easily to the gap at deep midwicket for two","Tremain to Sangha, 2 runs",0,553800,Chris Tremain,0,10,0,1.4,17,326625,Cameron Boyce,0,6,0,1.0,4,959827,Jason Sangha,17,15,0,1,5236,Callum Ferguson,36,23,5,0,4,False,0,0,0,0,0,8,6,0,False,,False,False,7.17,0,46,0,2,0,1,1,0,55
no run,509674,Sydney Thunder,509671,Melbourne Renegades,2nd innings,0,"back of a length, on off, he defends off the back foot","Tremain to Sangha, no run",0,553800,Chris Tremain,0,11,0,1.5,17,326625,Cameron Boyce,0,6,0,1.0,4,959827,Jason Sangha,17,16,0,1,5236,Callum Ferguson,36,23,5,0,5,False,0,0,0,0,0,8,6,0,False,,False,False,7.02,0,47,0,2,0,1,1,0,55
no run,509674,Sydney Thunder,509671,Melbourne Renegades,2nd innings,0,"back of a length on off, he defends off the back foot","Tremain to Sangha, no run",0,553800,Chris Tremain,0,12,0,2.0,17,326625,Cameron Boyce,0,6,0,1.0,4,959827,Jason Sangha,17,17,0,1,5236,Callum Ferguson,36,23,5,0,6,True,0,0,0,0,0,8,6,0,False,,False,False,6.87,0,48,0,2,0,1,1,0,55
run,509674,Sydney Thunder,509671,Melbourne Renegades,2nd innings,1,"pushed through on off, he is back and working to wide mid on","Boyce to Ferguson, 1 run",0,326625,Cameron Boyce,0,7,0,1.1,5,553800,Chris Tremain,0,12,0,2.0,17,5236,Callum Ferguson,37,24,5,0,959827,Jason Sangha,17,17,0,1,1,False,0,0,0,0,0,9,5,0,False,,False,False,6.85,0,49,0,2,0,1,1,0,56
run,509674,Sydney Thunder,509671,Melbourne Renegades,2nd innings,1,"tossed up wide of off, he skips out and drives firmly to deep cover-point","Boyce to Sangha, 1 run",0,326625,Cameron Boyce,0,8,0,1.2,6,553800,Chris Tremain,0,12,0,2.0,17,959827,Jason Sangha,18,18,0,1,5236,Callum Ferguson,37,24,5,0,2,False,0,0,0,0,0,9,5,0,False,,False,False,6.84,0,50,0,2,0,1,1,0,57
run,509674,Sydney Thunder,509671,Melbourne Renegades,2nd innings,1,"floated up on middle, he whips against the turn to deep long on","Boyce to Ferguson, 1 run",0,326625,Cameron Boyce,0,9,0,1.3,7,553800,Chris Tremain,0,12,0,2.0,17,5236,Callum Ferguson,38,25,5,0,959827,Jason Sangha,18,18,0,1,3,False,0,0,0,0,0,9,5,0,False,,False,False,6.82,0,51,0,2,0,1,1,0,58
run,509674,Sydney Thunder,509671,Melbourne Renegades,2nd innings,1,"84kph, leg break on middle, he's back and pushing this to long on","Boyce to Sangha, 1 run",0,326625,Cameron Boyce,0,10,0,1.4,8,553800,Chris Tremain,0,12,0,2.0,17,959827,Jason Sangha,19,19,0,1,5236,Callum Ferguson,38,25,5,0,4,False,0,0,0,0,0,9,5,0,False,,False,False,6.8,0,52,0,2,0,1,1,0,59
run,509674,Sydney Thunder,509671,Melbourne Renegades,2nd innings,1,"78kph slower outside off, he slog sweep flat but well short of deep midwicket","Boyce to Ferguson, 1 run",0,326625,Cameron Boyce,0,11,0,1.5,9,553800,Chris Tremain,0,12,0,2.0,17,5236,Callum Ferguson,39,26,5,0,959827,Jason Sangha,19,19,0,1,5,False,0,0,0,0,0,9,5,0,False,,False,False,6.79,0,53,0,2,0,1,1,0,60
no run,509674,Sydney Thunder,509671,Melbourne Renegades,2nd innings,0,"shorter and wider, he cuts, it flies in the air but short of backward point","Boyce to Sangha, no run",0,326625,Cameron Boyce,0,12,0,2.0,9,553800,Chris Tremain,0,12,0,2.0,17,959827,Jason Sangha,19,20,0,1,5236,Callum Ferguson,39,26,5,0,6,True,0,0,0,0,0,9,5,0,False,,False,False,6.66,0,54,0,2,0,1,1,0,60
run,509674,Sydney Thunder,509671,Melbourne Renegades,2nd innings,1,"128kph, good length, top of off, he's back and working this through midwicket to the sweeper","Christian to Ferguson, 1 run",0,4864,Daniel Christian,0,1,0,0.1,1,326625,Cameron Boyce,0,12,0,2.0,9,5236,Callum Ferguson,40,27,5,0,959827,Jason Sangha,19,20,0,1,1,False,0,0,0,0,0,10,6,0,False,,False,False,6.65,0,55,0,2,0,1,1,0,61
run,509674,Sydney Thunder,509671,Melbourne Renegades,2nd innings,1,"131kph fuller on off, he pushes on the front foot to long on","Christian to Sangha, 1 run",0,4864,Daniel Christian,0,2,0,0.2,2,326625,Cameron Boyce,0,12,0,2.0,9,959827,Jason Sangha,20,21,0,1,5236,Callum Ferguson,40,27,5,0,2,False,0,0,0,0,0,10,6,0,False,,False,False,6.64,0,56,0,2,0,1,1,0,62
run,509674,Sydney Thunder,509671,Melbourne Renegades,2nd innings,1,"106kph, leg cutter slower ball, leg stump line, he clips this forward of square","Christian to Ferguson, 1 run",0,4864,Daniel Christian,0,3,0,0.3,3,326625,Cameron Boyce,0,12,0,2.0,9,5236,Callum Ferguson,41,28,5,0,959827,Jason Sangha,20,21,0,1,3,False,0,0,0,0,0,10,6,0,False,,False,False,6.63,0,57,0,2,0,1,1,0,63
run,509674,Sydney Thunder,509671,Melbourne Renegades,2nd innings,1,"116kph, shorter slower ball, he hooks, rolling the wrists down to fine leg","Christian to Sangha, 1 run",0,4864,Daniel Christian,0,4,0,0.4,4,326625,Cameron Boyce,0,12,0,2.0,9,959827,Jason Sangha,21,22,0,1,5236,Callum Ferguson,41,28,5,0,4,False,0,0,0,0,0,10,6,0,False,,False,False,6.62,0,58,0,2,0,1,1,0,64
run,509674,Sydney Thunder,509671,Melbourne Renegades,2nd innings,1,"131kph low full toss on middle, he clips this firmly to deep midwicket","Christian to Ferguson, 1 run",0,4864,Daniel Christian,0,5,0,0.5,5,326625,Cameron Boyce,0,12,0,2.0,9,5236,Callum Ferguson,42,29,5,0,959827,Jason Sangha,21,22,0,1,5,False,0,0,0,0,0,10,6,0,False,,False,False,6.61,0,59,0,2,0,1,1,0,65
leg bye,509674,Sydney Thunder,509671,Melbourne Renegades,2nd innings,1,"131kph, full toss tailing down, he's hit on the pad, <strong>they appeal for LBW but it's not out</strong>, sliding down leg, it rolls away to point for a leg bye","Christian to Sangha, 1 leg bye",0,4864,Daniel Christian,0,6,0,1.0,5,326625,Cameron Boyce,0,12,0,2.0,9,959827,Jason Sangha,21,23,0,1,5236,Callum Ferguson,42,29,5,0,6,True,0,0,0,0,1,10,6,0,False,,False,False,6.6,0,60,0,2,1,1,1,0,66
no run,509674,Sydney Thunder,509671,Melbourne Renegades,2nd innings,0,"drifting across him, shorter length, he tries to cut and misses. Harper whips the bails off. <strong>Appeals for the stumping. They check upstairs with the TV umpire but he's safe.</strong> His foot was always down","Mohammad Nabi to Sangha, no run",0,25913,Mohammad Nabi,0,7,0,1.1,5,4864,Daniel Christian,0,6,0,1.0,5,959827,Jason Sangha,21,24,0,1,5236,Callum Ferguson,42,29,5,0,1,False,0,0,0,0,0,11,7,0,False,,False,False,6.49,0,61,0,2,0,1,1,0,66
run,509674,Sydney Thunder,509671,Melbourne Renegades,2nd innings,1,"shorter on leg, he tries to whip, mistimes it behind square to short fine leg","Mohammad Nabi to Sangha, 1 run",0,25913,Mohammad Nabi,0,8,0,1.2,6,4864,Daniel Christian,0,6,0,1.0,5,959827,Jason Sangha,22,25,0,1,5236,Callum Ferguson,42,29,5,0,2,False,0,0,0,0,0,11,7,0,False,,False,False,6.48,0,62,0,2,0,1,1,0,67
no run,509674,Sydney Thunder,509671,Melbourne Renegades,2nd innings,0,"108kph, darted into off, he whips firmly to midwicket","Mohammad Nabi to Ferguson, no run",0,25913,Mohammad Nabi,0,9,0,1.3,6,4864,Daniel Christian,0,6,0,1.0,5,5236,Callum Ferguson,42,30,5,0,959827,Jason Sangha,22,25,0,1,3,False,0,0,0,0,0,11,7,0,False,,False,False,6.38,0,63,0,2,0,1,1,0,67
