PlayType_description,Batting_Team_id,Batting_Team_name,Bowling_Team_id,Bowling_Team_name,Innings,Total_Runs_on_delivery,Commentary,Commentary_short,Score,Bowler_id,Bowler_name,Bowler_maiden,Bowler_balls,Bowler_wickets,Bowler_over,Bowler_conceded,Other_Bowler_id,Other_Bowler_name,Other_Bowler_maidens,Other_Bowler_balls,Other_Bowler_wickets,Other_Bowler_overs,Other_Bowler_conceded,Batsman_id,Batsman_name,Batsman_runs,Batsman_balls_faced,Batsman_four,Batsman_sixes,Other_Batsman_id,Other_Batsman_name,Other_Batsman_runs,Other_Batsman_balls_faced,Other_Batsman_four,Other_Batsman_sixes,Over_ball,Over_complete,Over_maiden,Over_no_Ball,Over_wide,Over_byes,Over_leg_byes,Over_number,Over_runs,Over_wickets,Dismissal_is_true,Dismissal_type,Dismissal_fielder_iskeeper,Dismissal_text,Innings_run_rate,Innings_byes,Innings_balls,Innings_no_balls,Innings_wickets,Innings_leg_byes,Innings_session,Innings_day,Innings_wides,Innings_runs
no run,7,Pakistan,6,India,1st innings,0,he opens up and defends it back as Bumrah angles the ball in sharply from around the wicket,"Bumrah to Mohammad Amir, no run",160/8,625383,Jasprit Bumrah,2,42,1,7.0,23,326016,Bhuvneshwar Kumar,1,36,2,6.0,13,290948,Mohammad Amir,16,21,1,0,681305,Hasan Ali,1,2,0,0,6,True,0,0,0,0,0,42,2,1,False,,False,False,3.8,0,252,0,8,0,1,1,0,160
out,7,Pakistan,6,India,1st innings,0,"that looked like a handsome lofted drive down the ground with a follow through, but Hasan didn't quite middle it to clear mid on and hands an easy catch. An offcutter from Bhuvneshwar, driven down and DK takes a few steps back to get under it","Kumar to Hasan Ali, OUT",160/9,326016,Bhuvneshwar Kumar,1,37,3,6.1,13,625383,Jasprit Bumrah,2,42,1,7.0,23,681305,Hasan Ali,1,3,0,0,290948,Mohammad Amir,16,21,1,0,1,False,0,0,0,0,0,43,2,1,True,caught,False,Hasan Ali c Karthik b Kumar 1 (3b 0x4 0x6) SR: 33.33,3.79,0,253,0,9,0,1,1,0,160
no run,7,Pakistan,6,India,1st innings,0,goes for a big swing on the off side for the length ball and he finds cover,"Kumar to Mohammad Amir, no run",160/9,326016,Bhuvneshwar Kumar,1,38,3,6.2,13,625383,Jasprit Bumrah,2,42,1,7.0,23,290948,Mohammad Amir,16,22,1,0,697279,Usman Shinwari,0,0,0,0,2,False,0,0,0,0,0,43,2,1,False,,False,False,3.77,0,254,0,9,0,1,1,0,160
run,7,Pakistan,6,India,1st innings,2,goes a bit short of length outside off and Amir steers it square for one,"Kumar to Mohammad Amir, 2 runs",162/9,326016,Bhuvneshwar Kumar,1,39,3,6.3,15,625383,Jasprit Bumrah,2,42,1,7.0,23,290948,Mohammad Amir,18,23,1,0,697279,Usman Shinwari,0,0,0,0,3,False,0,0,0,0,0,43,2,1,False,,False,False,3.81,0,255,0,9,0,1,1,0,162
no run,7,Pakistan,6,India,1st innings,0,short ball and he lets it go to the keeper by ducking under it,"Kumar to Mohammad Amir, no run",162/9,326016,Bhuvneshwar Kumar,1,40,3,6.4,15,625383,Jasprit Bumrah,2,42,1,7.0,23,290948,Mohammad Amir,18,24,1,0,697279,Usman Shinwari,0,0,0,0,4,False,0,0,0,0,0,43,2,1,False,,False,False,3.79,0,256,0,9,0,1,1,0,162
no run,7,Pakistan,6,India,1st innings,0,"he targets the stumps with the angle, Amir opens up a bit and defends it just in time","Kumar to Mohammad Amir, no run",162/9,326016,Bhuvneshwar Kumar,1,41,3,6.5,15,625383,Jasprit Bumrah,2,42,1,7.0,23,290948,Mohammad Amir,18,25,1,0,697279,Usman Shinwari,0,0,0,0,5,False,0,0,0,0,0,43,2,1,False,,False,False,3.78,0,257,0,9,0,1,1,0,162
no run,7,Pakistan,6,India,1st innings,0,bangs in the bouncer and Amir ducks under the last ball too,"Kumar to Mohammad Amir, no run",162/9,326016,Bhuvneshwar Kumar,1,42,3,7.0,15,625383,Jasprit Bumrah,2,42,1,7.0,23,290948,Mohammad Amir,18,26,1,0,697279,Usman Shinwari,0,0,0,0,6,True,0,0,0,0,0,43,2,1,False,,False,False,3.76,0,258,0,9,0,1,1,0,162
out,7,Pakistan,6,India,1st innings,0,"right in the block hole, gets the base of off stump and the show's over! Quick and low, accurate stuff from Bumrah and Usman's bat comes down a bit too late","Bumrah to Usman Shinwari, OUT",162/10,625383,Jasprit Bumrah,2,43,2,7.1,23,326016,Bhuvneshwar Kumar,1,42,3,7.0,15,697279,Usman Shinwari,0,1,0,0,290948,Mohammad Amir,18,26,1,0,1,True,0,0,0,0,0,44,0,1,True,bowled,False,Usman Shinwari  b Bumrah 0 (1b 0x4 0x6) SR: 0.00,3.75,0,259,0,10,0,1,1,0,162
run,6,India,7,Pakistan,2nd innings,1,"full on leg stump, and he taps this to midwicket for a single to get off the mark. Amir and Rohit almost collided there!","Mohammad Amir to Sharma, 1 run",0,290948,Mohammad Amir,0,1,0,0.1,1,False,False,0,0,0,False,0,34102,Rohit Sharma,1,1,0,0,28235,Shikhar Dhawan,0,0,0,0,1,False,0,0,0,0,0,1,2,0,False,,False,False,6.0,0,1,0,0,0,1,1,0,1
no run,6,India,7,Pakistan,2nd innings,0,"good length just outside off, and going straight through. Dhawan shoulders his arms, and the ball has a nice carry into the gloves of captain Sarfraz","Mohammad Amir to Dhawan, no run",0,290948,Mohammad Amir,0,2,0,0.2,1,False,False,0,0,0,False,0,28235,Shikhar Dhawan,0,1,0,0,34102,Rohit Sharma,1,1,0,0,2,False,0,0,0,0,0,1,2,0,False,,False,False,3.0,0,2,0,0,0,1,1,0,1
run,6,India,7,Pakistan,2nd innings,1,"full on leg stump, and that's been flicked off his pads to the fine-leg fielder. Angling into his toes, and easily negated on this occasion","Mohammad Amir to Dhawan, 1 run",0,290948,Mohammad Amir,0,3,0,0.3,2,False,False,0,0,0,False,0,28235,Shikhar Dhawan,1,2,0,0,34102,Rohit Sharma,1,1,0,0,3,False,0,0,0,0,0,1,2,0,False,,False,False,4.0,0,3,0,0,0,1,1,0,2
no run,6,India,7,Pakistan,2nd innings,0,"full on middle, but the ball's not angling across. Holds its line, and Rohit defends off the front foot","Mohammad Amir to Sharma, no run",0,290948,Mohammad Amir,0,4,0,0.4,2,False,False,0,0,0,False,0,34102,Rohit Sharma,1,2,0,0,28235,Shikhar Dhawan,1,2,0,0,4,False,0,0,0,0,0,1,2,0,False,,False,False,3.0,0,4,0,0,0,1,1,0,2
no run,6,India,7,Pakistan,2nd innings,0,full on middle and off on this occasion. Rohit simply prods forward and fends with the straight bat,"Mohammad Amir to Sharma, no run",0,290948,Mohammad Amir,0,5,0,0.5,2,False,False,0,0,0,False,0,34102,Rohit Sharma,1,3,0,0,28235,Shikhar Dhawan,1,2,0,0,5,False,0,0,0,0,0,1,2,0,False,,False,False,2.4,0,5,0,0,0,1,1,0,2
no run,6,India,7,Pakistan,2nd innings,0,"length ball on middle, and angling across slightly this time. Rohit looks to defend, but the ball hits the outside of his bat and trickles away to cover","Mohammad Amir to Sharma, no run",0,290948,Mohammad Amir,0,6,0,1.0,2,False,False,0,0,0,False,0,34102,Rohit Sharma,1,4,0,0,28235,Shikhar Dhawan,1,2,0,0,6,True,0,0,0,0,0,1,2,0,False,,False,False,2.0,0,6,0,0,0,1,1,0,2
run,6,India,7,Pakistan,2nd innings,1,"length ball outside off, and Dhawan covers his off stump, before fending with the angled bat from near his face. The ball hits the side of his bat and runs down to third man for one","Usman Shinwari to Dhawan, 1 run",0,697279,Usman Shinwari,0,1,0,0.1,1,290948,Mohammad Amir,0,6,0,1.0,2,28235,Shikhar Dhawan,2,3,0,0,34102,Rohit Sharma,1,4,0,0,1,False,0,0,0,0,0,2,5,0,False,,False,False,2.57,0,7,0,0,0,1,1,0,3
four,6,India,7,Pakistan,2nd innings,4,"good length on off, and Rohit tries to defend. But there's no movement of thef feet, and the defensive shot takes an <b>inside edge</b> and runs away to the fine-leg boundary for four! Could've easily been chopped onto his stumps as well","Usman Shinwari to Sharma, FOUR runs",0,697279,Usman Shinwari,0,2,0,0.2,5,290948,Mohammad Amir,0,6,0,1.0,2,34102,Rohit Sharma,5,5,1,0,28235,Shikhar Dhawan,2,3,0,0,2,False,0,0,0,0,0,2,5,0,False,,False,False,5.25,0,8,0,0,0,1,1,0,7
no run,6,India,7,Pakistan,2nd innings,0,"length ball on off, and angling across the batsman. Left alone","Usman Shinwari to Sharma, no run",0,697279,Usman Shinwari,0,3,0,0.3,5,290948,Mohammad Amir,0,6,0,1.0,2,34102,Rohit Sharma,5,6,1,0,28235,Shikhar Dhawan,2,3,0,0,3,False,0,0,0,0,0,2,5,0,False,,False,False,4.66,0,9,0,0,0,1,1,0,7
no run,6,India,7,Pakistan,2nd innings,0,"tries to cut. but plays under the ball! Good length on off and with the ball angling across, Rohit thought he could free his arms","Usman Shinwari to Sharma, no run",0,697279,Usman Shinwari,0,4,0,0.4,5,290948,Mohammad Amir,0,6,0,1.0,2,34102,Rohit Sharma,5,7,1,0,28235,Shikhar Dhawan,2,3,0,0,4,False,0,0,0,0,0,2,5,0,False,,False,False,4.2,0,10,0,0,0,1,1,0,7
no run,6,India,7,Pakistan,2nd innings,0,"fuller outside off, and the angle almost takes it for a wide. But umpire Erasmus doesn't call it as Rohit chooses not to play at this delivery","Usman Shinwari to Sharma, no run",0,697279,Usman Shinwari,0,5,0,0.5,5,290948,Mohammad Amir,0,6,0,1.0,2,34102,Rohit Sharma,5,8,1,0,28235,Shikhar Dhawan,2,3,0,0,5,False,0,0,0,0,0,2,5,0,False,,False,False,3.81,0,11,0,0,0,1,1,0,7
no run,6,India,7,Pakistan,2nd innings,0,"fixes his line. Full on middle and leg, and Rohit's check-drive off the front foot is intercepted by the diving mid-off fielder","Usman Shinwari to Sharma, no run",0,697279,Usman Shinwari,0,6,0,1.0,5,290948,Mohammad Amir,0,6,0,1.0,2,34102,Rohit Sharma,5,9,1,0,28235,Shikhar Dhawan,2,3,0,0,6,True,0,0,0,0,0,2,5,0,False,,False,False,3.5,0,12,0,0,0,1,1,0,7
no run,6,India,7,Pakistan,2nd innings,0,"back of a length outside off stump, and slightly angling into Dhawan. But he shoulders his arms and sees the ball go into the gloves of the keeper","Mohammad Amir to Dhawan, no run",0,290948,Mohammad Amir,0,7,0,1.1,2,697279,Usman Shinwari,0,6,0,1.0,5,28235,Shikhar Dhawan,2,4,0,0,34102,Rohit Sharma,5,9,1,0,1,False,0,0,0,0,0,3,7,0,False,,False,False,3.23,0,13,0,0,0,1,1,0,7
no run,6,India,7,Pakistan,2nd innings,0,"good length just outside off, and Dhawan sticks his bat out and taps this off the back foot to point","Mohammad Amir to Dhawan, no run",0,290948,Mohammad Amir,0,8,0,1.2,2,697279,Usman Shinwari,0,6,0,1.0,5,28235,Shikhar Dhawan,2,5,0,0,34102,Rohit Sharma,5,9,1,0,2,False,0,0,0,0,0,3,7,0,False,,False,False,3.0,0,14,0,0,0,1,1,0,7
four,6,India,7,Pakistan,2nd innings,4,"full just outside off, and Dhawan leans forward to meet the ball on the up. Drives through the delivery's line, and smashes it through the covers for a four. 143kph from the bowler","Mohammad Amir to Dhawan, FOUR runs",0,290948,Mohammad Amir,0,9,0,1.3,6,697279,Usman Shinwari,0,6,0,1.0,5,28235,Shikhar Dhawan,6,6,1,0,34102,Rohit Sharma,5,9,1,0,3,False,0,0,0,0,0,3,7,0,False,,False,False,4.4,0,15,0,0,0,1,1,0,11
run,6,India,7,Pakistan,2nd innings,3,"full on middle, and he whips this off his pads to Malik at midwicket. Beats the fielder and therefore the old man needs to give it a chase. Does well to retrieve the ball before it gets to the boundary","Mohammad Amir to Dhawan, 3 runs",0,290948,Mohammad Amir,0,10,0,1.4,9,697279,Usman Shinwari,0,6,0,1.0,5,28235,Shikhar Dhawan,9,7,1,0,34102,Rohit Sharma,5,9,1,0,4,False,0,0,0,0,0,3,7,0,False,,False,False,5.25,0,16,0,0,0,1,1,0,14
no run,6,India,7,Pakistan,2nd innings,0,"that's the line he's looking for. Length ball on off, and just holding it's line as Rohit looks to defend. Just past his outside edge on this occasion","Mohammad Amir to Sharma, no run",0,290948,Mohammad Amir,0,11,0,1.5,9,697279,Usman Shinwari,0,6,0,1.0,5,34102,Rohit Sharma,5,10,1,0,28235,Shikhar Dhawan,9,7,1,0,5,False,0,0,0,0,0,3,7,0,False,,False,False,4.94,0,17,0,0,0,1,1,0,14
no run,6,India,7,Pakistan,2nd innings,0,"lands on middle, and Rohit comes half-forward to defend. Gets bat to ball, but not convincingly. Hits the top-half of the ball and rolls away to short cover","Mohammad Amir to Sharma, no run",0,290948,Mohammad Amir,0,12,0,2.0,9,697279,Usman Shinwari,0,6,0,1.0,5,34102,Rohit Sharma,5,11,1,0,28235,Shikhar Dhawan,9,7,1,0,6,True,0,0,0,0,0,3,7,0,False,,False,False,4.66,0,18,0,0,0,1,1,0,14
no run,6,India,7,Pakistan,2nd innings,0,"full on middle, and the leg-side flick is inside-edged onto his pads. Hits his leg and trickles away to the off side","Usman Shinwari to Dhawan, no run",0,697279,Usman Shinwari,0,7,0,1.1,5,290948,Mohammad Amir,0,12,0,2.0,9,28235,Shikhar Dhawan,9,8,1,0,34102,Rohit Sharma,5,11,1,0,1,False,0,0,0,0,0,4,1,0,False,,False,False,4.42,0,19,0,0,0,1,1,0,14
no run,6,India,7,Pakistan,2nd innings,0,"length ball on off, and he covers his off-stump line, before defending off the back foot","Usman Shinwari to Dhawan, no run",0,697279,Usman Shinwari,0,8,0,1.2,5,290948,Mohammad Amir,0,12,0,2.0,9,28235,Shikhar Dhawan,9,9,1,0,34102,Rohit Sharma,5,11,1,0,2,False,0,0,0,0,0,4,1,0,False,,False,False,4.2,0,20,0,0,0,1,1,0,14
no run,6,India,7,Pakistan,2nd innings,0,"good length outside off, and angling into Dhawan. He stays on the backfoot, and fends from near his pads","Usman Shinwari to Dhawan, no run",0,697279,Usman Shinwari,0,9,0,1.3,5,290948,Mohammad Amir,0,12,0,2.0,9,28235,Shikhar Dhawan,9,10,1,0,34102,Rohit Sharma,5,11,1,0,3,False,0,0,0,0,0,4,1,0,False,,False,False,4.0,0,21,0,0,0,1,1,0,14
no run,6,India,7,Pakistan,2nd innings,0,"good length outside off, and Dhawan wants to free his arms. Cuts this square, except the ball has gone under his bat and into the gloves of Sarfraz","Usman Shinwari to Dhawan, no run",0,697279,Usman Shinwari,0,10,0,1.4,5,290948,Mohammad Amir,0,12,0,2.0,9,28235,Shikhar Dhawan,9,11,1,0,34102,Rohit Sharma,5,11,1,0,4,False,0,0,0,0,0,4,1,0,False,,False,False,3.81,0,22,0,0,0,1,1,0,14
no run,6,India,7,Pakistan,2nd innings,0,"length ball outside off again. Dhawan stays on the back foot, and firmly punches with the angled bat to cover point","Usman Shinwari to Dhawan, no run",0,697279,Usman Shinwari,0,11,0,1.5,5,290948,Mohammad Amir,0,12,0,2.0,9,28235,Shikhar Dhawan,9,12,1,0,34102,Rohit Sharma,5,11,1,0,5,False,0,0,0,0,0,4,1,0,False,,False,False,3.65,0,23,0,0,0,1,1,0,14
run,6,India,7,Pakistan,2nd innings,1,"length ball outside off, and Dhawan sticks his bat out and dabs a back-foot block to third man for a single. Not sure he wanted the ball to go there, but he'll happily collect the single","Usman Shinwari to Dhawan, 1 run",0,697279,Usman Shinwari,0,12,0,2.0,6,290948,Mohammad Amir,0,12,0,2.0,9,28235,Shikhar Dhawan,10,13,1,0,34102,Rohit Sharma,5,11,1,0,6,True,0,0,0,0,0,4,1,0,False,,False,False,3.75,0,24,0,0,0,1,1,0,15
no run,6,India,7,Pakistan,2nd innings,0,"fuller from Amir, and Dhawan meets this outside off stump and pushes it towards cover. No chance of a single","Mohammad Amir to Dhawan, no run",0,290948,Mohammad Amir,0,13,0,2.1,9,697279,Usman Shinwari,0,12,0,2.0,6,28235,Shikhar Dhawan,10,14,1,0,34102,Rohit Sharma,5,11,1,0,1,False,1,0,0,0,0,5,0,0,False,,False,False,3.6,0,25,0,0,0,1,1,0,15
no run,6,India,7,Pakistan,2nd innings,0,"length ball on off, but takes some extra bounce! Hits Dhawan near his bat's handle, as he brings the bat down to defend","Mohammad Amir to Dhawan, no run",0,290948,Mohammad Amir,0,14,0,2.2,9,697279,Usman Shinwari,0,12,0,2.0,6,28235,Shikhar Dhawan,10,15,1,0,34102,Rohit Sharma,5,11,1,0,2,False,1,0,0,0,0,5,0,0,False,,False,False,3.46,0,26,0,0,0,1,1,0,15
no run,6,India,7,Pakistan,2nd innings,0,"good length outside off, and the ball angles in late. Dhawan looks to wedge it to the leg side, but the ball hits his bat and then falls into his pads. Appeal for lbw not given","Mohammad Amir to Dhawan, no run",0,290948,Mohammad Amir,0,15,0,2.3,9,697279,Usman Shinwari,0,12,0,2.0,6,28235,Shikhar Dhawan,10,16,1,0,34102,Rohit Sharma,5,11,1,0,3,False,1,0,0,0,0,5,0,0,False,,False,False,3.33,0,27,0,0,0,1,1,0,15
no run,6,India,7,Pakistan,2nd innings,0,punches this length ball from in front of off stump to cover,"Mohammad Amir to Dhawan, no run",0,290948,Mohammad Amir,0,16,0,2.4,9,697279,Usman Shinwari,0,12,0,2.0,6,28235,Shikhar Dhawan,10,17,1,0,34102,Rohit Sharma,5,11,1,0,4,False,1,0,0,0,0,5,0,0,False,,False,False,3.21,0,28,0,0,0,1,1,0,15
no run,6,India,7,Pakistan,2nd innings,0,"slightly fuller outside off, and Dhawan continues to remain patient. Fends this off the front foot to cover","Mohammad Amir to Dhawan, no run",0,290948,Mohammad Amir,0,17,0,2.5,9,697279,Usman Shinwari,0,12,0,2.0,6,28235,Shikhar Dhawan,10,18,1,0,34102,Rohit Sharma,5,11,1,0,5,False,1,0,0,0,0,5,0,0,False,,False,False,3.1,0,29,0,0,0,1,1,0,15
no run,6,India,7,Pakistan,2nd innings,0,"good length on off, and Dhawan tentatively comes forward to defend. Played back to the bowler as <b>Amir collects a maiden</b>","Mohammad Amir to Dhawan, no run",0,290948,Mohammad Amir,1,18,0,3.0,9,697279,Usman Shinwari,0,12,0,2.0,6,28235,Shikhar Dhawan,10,19,1,0,34102,Rohit Sharma,5,11,1,0,6,True,1,0,0,0,0,5,0,0,False,,False,False,3.0,0,30,0,0,0,1,1,0,15
no run,6,India,7,Pakistan,2nd innings,0,"full on middle, and Rohit brings his bat down in time to defend. The ball flies off the edge of the bat towards the off side","Usman Shinwari to Sharma, no run",0,697279,Usman Shinwari,0,13,0,2.1,6,290948,Mohammad Amir,1,18,0,3.0,9,34102,Rohit Sharma,5,12,1,0,28235,Shikhar Dhawan,10,19,1,0,1,False,0,0,0,0,0,6,2,0,False,,False,False,2.9,0,31,0,0,0,1,1,0,15
no run,6,India,7,Pakistan,2nd innings,0,"full on middle once again, and this time Rohit is in position early for a firm front-foot defense to mid off. Played off the bat's sweet spot","Usman Shinwari to Sharma, no run",0,697279,Usman Shinwari,0,14,0,2.2,6,290948,Mohammad Amir,1,18,0,3.0,9,34102,Rohit Sharma,5,13,1,0,28235,Shikhar Dhawan,10,19,1,0,2,False,0,0,0,0,0,6,2,0,False,,False,False,2.81,0,32,0,0,0,1,1,0,15
run,6,India,7,Pakistan,2nd innings,1,<b>leading edge!</b> But away from the fielder at point. Back of a length ball that Rohit tried to flick towards midwicket. The ball runs down to third man for a single,"Usman Shinwari to Sharma, 1 run",0,697279,Usman Shinwari,0,15,0,2.3,7,290948,Mohammad Amir,1,18,0,3.0,9,34102,Rohit Sharma,6,14,1,0,28235,Shikhar Dhawan,10,19,1,0,3,False,0,0,0,0,0,6,2,0,False,,False,False,2.9,0,33,0,0,0,1,1,0,16
no run,6,India,7,Pakistan,2nd innings,0,"back of a length outside off, and Dhawan pulls with the angle to midwicket. Mistimed","Usman Shinwari to Dhawan, no run",0,697279,Usman Shinwari,0,16,0,2.4,7,290948,Mohammad Amir,1,18,0,3.0,9,28235,Shikhar Dhawan,10,20,1,0,34102,Rohit Sharma,6,14,1,0,4,False,0,0,0,0,0,6,2,0,False,,False,False,2.82,0,34,0,0,0,1,1,0,16
run,6,India,7,Pakistan,2nd innings,1,"full on middle and leg. Dhawan allows this to come onto his pads, and then whips it behind square to fine leg for a single","Usman Shinwari to Dhawan, 1 run",0,697279,Usman Shinwari,0,17,0,2.5,8,290948,Mohammad Amir,1,18,0,3.0,9,28235,Shikhar Dhawan,11,21,1,0,34102,Rohit Sharma,6,14,1,0,5,False,0,0,0,0,0,6,2,0,False,,False,False,2.91,0,35,0,0,0,1,1,0,17
no run,6,India,7,Pakistan,2nd innings,0,"good length on middle, and he punches this beautifully off the back foot. But unfortunately (for India) he finds the fielder at cover","Usman Shinwari to Sharma, no run",0,697279,Usman Shinwari,0,18,0,3.0,8,290948,Mohammad Amir,1,18,0,3.0,9,34102,Rohit Sharma,6,15,1,0,28235,Shikhar Dhawan,11,21,1,0,6,True,0,0,0,0,0,6,2,0,False,,False,False,2.83,0,36,0,0,0,1,1,0,17
run,6,India,7,Pakistan,2nd innings,1,"full just outside off, and he check-drives a shot to mid on. Dhawan calls early for the single, but Rohit responds. Malik tries to throw down the stumps, but fails to get the direct hit","Mohammad Amir to Dhawan, 1 run",0,290948,Mohammad Amir,1,19,0,3.1,10,697279,Usman Shinwari,0,18,0,3.0,8,28235,Shikhar Dhawan,12,22,1,0,34102,Rohit Sharma,6,15,1,0,1,False,0,0,0,0,0,7,10,0,False,,False,False,2.91,0,37,0,0,0,1,1,0,18
no run,6,India,7,Pakistan,2nd innings,0,"full, but slower this time. Lands on off stump, and Rohit adjusts beautifully to caress a drive through to the off side","Mohammad Amir to Sharma, no run",0,290948,Mohammad Amir,1,20,0,3.2,10,697279,Usman Shinwari,0,18,0,3.0,8,34102,Rohit Sharma,6,16,1,0,28235,Shikhar Dhawan,12,22,1,0,2,False,0,0,0,0,0,7,10,0,False,,False,False,2.84,0,38,0,0,0,1,1,0,18
no run,6,India,7,Pakistan,2nd innings,0,"full on off stump, and he transfers his weight onto the front foot for a crunching cover drive. But once again to the fielder on the off side","Mohammad Amir to Sharma, no run",0,290948,Mohammad Amir,1,21,0,3.3,10,697279,Usman Shinwari,0,18,0,3.0,8,34102,Rohit Sharma,6,17,1,0,28235,Shikhar Dhawan,12,22,1,0,3,False,0,0,0,0,0,7,10,0,False,,False,False,2.76,0,39,0,0,0,1,1,0,18
four,6,India,7,Pakistan,2nd innings,4,"<b>width given, and punished by Rohit!</b> Length ball on off that's angling away, and Rohit latches onto the room to slap a cut past point for four. Third man had no chance either","Mohammad Amir to Sharma, FOUR runs",0,290948,Mohammad Amir,1,22,0,3.4,14,697279,Usman Shinwari,0,18,0,3.0,8,34102,Rohit Sharma,10,18,2,0,28235,Shikhar Dhawan,12,22,1,0,4,False,0,0,0,0,0,7,10,0,False,,False,False,3.3,0,40,0,0,0,1,1,0,22
four,6,India,7,Pakistan,2nd innings,4,"<b>finally pierces the infield!</b> Full on off, and he comes onto the front foot to drive through the covers. Hits the ball on the up, and this time it flies between cover and cover point for the second boundary of the over","Mohammad Amir to Sharma, FOUR runs",0,290948,Mohammad Amir,1,23,0,3.5,18,697279,Usman Shinwari,0,18,0,3.0,8,34102,Rohit Sharma,14,19,3,0,28235,Shikhar Dhawan,12,22,1,0,5,False,0,0,0,0,0,7,10,0,False,,False,False,3.8,0,41,0,0,0,1,1,0,26
run,6,India,7,Pakistan,2nd innings,1,"good length just outside off, and Rohit opens his bat's face to run this down to third man","Mohammad Amir to Sharma, 1 run",0,290948,Mohammad Amir,1,24,0,4.0,19,697279,Usman Shinwari,0,18,0,3.0,8,34102,Rohit Sharma,15,20,3,0,28235,Shikhar Dhawan,12,22,1,0,6,True,0,0,0,0,0,7,10,0,False,,False,False,3.85,0,42,0,0,0,1,1,0,27
run,6,India,7,Pakistan,2nd innings,1,"good length on middle, and he uses the angle to whip this off his hips to the fielder at deep square leg","Usman Shinwari to Sharma, 1 run",0,697279,Usman Shinwari,0,19,0,3.1,9,290948,Mohammad Amir,1,24,0,4.0,19,34102,Rohit Sharma,16,21,3,0,28235,Shikhar Dhawan,12,22,1,0,1,False,0,0,0,0,0,8,19,0,False,,False,False,3.9,0,43,0,0,0,1,1,0,28
run,6,India,7,Pakistan,2nd innings,1,"back of a length outside off, and Dhawan waits for the ball to get to him, before slicing this past the keeper's left to third man for another comfortable run","Usman Shinwari to Dhawan, 1 run",0,697279,Usman Shinwari,0,20,0,3.2,10,290948,Mohammad Amir,1,24,0,4.0,19,28235,Shikhar Dhawan,13,23,1,0,34102,Rohit Sharma,16,21,3,0,2,False,0,0,0,0,0,8,19,0,False,,False,False,3.95,0,44,0,0,0,1,1,0,29
no run,6,India,7,Pakistan,2nd innings,0,good length just outside off stump. Rohit pushes forward and blocks towards the off side,"Usman Shinwari to Sharma, no run",0,697279,Usman Shinwari,0,21,0,3.3,10,290948,Mohammad Amir,1,24,0,4.0,19,34102,Rohit Sharma,16,22,3,0,28235,Shikhar Dhawan,13,23,1,0,3,False,0,0,0,0,0,8,19,0,False,,False,False,3.86,0,45,0,0,0,1,1,0,29
six,6,India,7,Pakistan,2nd innings,6,"short! But Rohit spotted that early. Swivels and pulls for sure, and despite it being a top edge... the ball goes over the keeper's head for half-a-dozen!","Usman Shinwari to Sharma, SIX runs",0,697279,Usman Shinwari,0,22,0,3.4,16,290948,Mohammad Amir,1,24,0,4.0,19,34102,Rohit Sharma,22,23,3,1,28235,Shikhar Dhawan,13,23,1,0,4,False,0,0,0,0,0,8,19,0,False,,False,False,4.56,0,46,0,0,0,1,1,0,35
four,6,India,7,Pakistan,2nd innings,5,"good length on middle, and this time Rohit raises his front leg, and paddles a pull behind square to the fine-leg boundary. <B>He's overstepped too.</b>","Usman Shinwari to Sharma, (no ball) FOUR runs",0,697279,Usman Shinwari,0,22,0,3.4,21,290948,Mohammad Amir,1,24,0,4.0,19,34102,Rohit Sharma,26,24,4,1,28235,Shikhar Dhawan,13,23,1,0,5,False,0,1,0,0,0,8,19,0,False,,False,False,5.21,0,46,1,0,0,1,1,0,40
six,6,India,7,Pakistan,2nd innings,6,"<b>into the second tier!</b> That angle from around the wicket is working to Rohit's advantage. Back of a length outside off, and he <b>thumps</b> a pull right into the cow-corner boundary","Usman Shinwari to Sharma, SIX runs",0,697279,Usman Shinwari,0,23,0,3.5,27,290948,Mohammad Amir,1,24,0,4.0,19,34102,Rohit Sharma,32,25,4,2,28235,Shikhar Dhawan,13,23,1,0,6,False,0,0,0,0,0,8,19,0,False,,False,False,5.87,0,47,0,0,0,1,1,0,46
no run,6,India,7,Pakistan,2nd innings,0,"back of a length outside off stump. Rohit tiptoes and defends off the back foot, much to the disappointment of the Indian fans in the crowd","Usman Shinwari to Sharma, no run",0,697279,Usman Shinwari,0,24,0,4.0,27,290948,Mohammad Amir,1,24,0,4.0,19,34102,Rohit Sharma,32,26,4,2,28235,Shikhar Dhawan,13,23,1,0,7,True,0,0,0,0,0,8,19,0,False,,False,False,5.75,0,48,0,0,0,1,1,0,46
no run,6,India,7,Pakistan,2nd innings,0,"length ball just outside off, and blocked off the back foot","Hasan Ali to Dhawan, no run",0,681305,Hasan Ali,0,1,0,0.1,0,697279,Usman Shinwari,0,24,0,4.0,27,28235,Shikhar Dhawan,13,24,1,0,34102,Rohit Sharma,32,26,4,2,1,False,0,0,0,0,0,9,6,0,False,,False,False,5.63,0,49,0,0,0,1,1,0,46
run,6,India,7,Pakistan,2nd innings,1,"back of a length on leg stump, and Dhawan whips this off his pads past square-leg for a single","Hasan Ali to Dhawan, 1 run",0,681305,Hasan Ali,0,2,0,0.2,1,697279,Usman Shinwari,0,24,0,4.0,27,28235,Shikhar Dhawan,14,25,1,0,34102,Rohit Sharma,32,26,4,2,2,False,0,0,0,0,0,9,6,0,False,,False,False,5.64,0,50,0,0,0,1,1,0,47
no run,6,India,7,Pakistan,2nd innings,0,length ball just outside off. Rohit presses forward and comfortably defends to the off side,"Hasan Ali to Sharma, no run",0,681305,Hasan Ali,0,3,0,0.3,1,697279,Usman Shinwari,0,24,0,4.0,27,34102,Rohit Sharma,32,27,4,2,28235,Shikhar Dhawan,14,25,1,0,3,False,0,0,0,0,0,9,6,0,False,,False,False,5.52,0,51,0,0,0,1,1,0,47
four,6,India,7,Pakistan,2nd innings,4,"<b>ohhh, timing!</b> Good length outside off, and Rohit brings out the short-arm jab to check a pull right over the fielder at midwicket","Hasan Ali to Sharma, FOUR runs",0,681305,Hasan Ali,0,4,0,0.4,5,697279,Usman Shinwari,0,24,0,4.0,27,34102,Rohit Sharma,36,28,5,2,28235,Shikhar Dhawan,14,25,1,0,4,False,0,0,0,0,0,9,6,0,False,,False,False,5.88,0,52,0,0,0,1,1,0,51
