PlayType_description,Batting_Team_id,Batting_Team_name,Bowling_Team_id,Bowling_Team_name,Innings,Total_Runs_on_delivery,Commentary,Commentary_short,Score,Bowler_id,Bowler_name,Bowler_maiden,Bowler_balls,Bowler_wickets,Bowler_over,Bowler_conceded,Other_Bowler_id,Other_Bowler_name,Other_Bowler_maidens,Other_Bowler_balls,Other_Bowler_wickets,Other_Bowler_overs,Other_Bowler_conceded,Batsman_id,Batsman_name,Batsman_runs,Batsman_balls_faced,Batsman_four,Batsman_sixes,Other_Batsman_id,Other_Batsman_name,Other_Batsman_runs,Other_Batsman_balls_faced,Other_Batsman_four,Other_Batsman_sixes,Over_ball,Over_complete,Over_maiden,Over_no_Ball,Over_wide,Over_byes,Over_leg_byes,Over_number,Over_runs,Over_wickets,Dismissal_is_true,Dismissal_type,Dismissal_fielder_iskeeper,Dismissal_text,Innings_run_rate,Innings_byes,Innings_balls,Innings_no_balls,Innings_wickets,Innings_leg_byes,Innings_session,Innings_day,Innings_wides,Innings_runs
no run,8,Sri Lanka,7,Pakistan,1st innings,0,"full, just outside off stump. Defended towards backward point","Mohammad Nawaz to Perera, no run",103/2,348148,Mohammad Nawaz,0,8,1,1.2,4,922943,Shadab Khan,0,24,0,4.0,24,300629,Angelo Perera,0,2,0,0,345821,Danushka Gunathilaka,60,67,8,0,2,False,0,0,0,0,0,22,8,0,False,,False,False,4.82,0,128,0,2,0,1,1,0,103
run,8,Sri Lanka,7,Pakistan,1st innings,1,full on middle stump. Defended towards cover,"Mohammad Nawaz to Perera, 1 run",104/2,348148,Mohammad Nawaz,0,9,1,1.3,5,922943,Shadab Khan,0,24,0,4.0,24,300629,Angelo Perera,1,3,0,0,345821,Danushka Gunathilaka,60,67,8,0,3,False,0,0,0,0,0,22,8,0,False,,False,False,4.83,0,129,0,2,0,1,1,0,104
four,8,Sri Lanka,7,Pakistan,1st innings,4,<B>reverse swept</b> over short third man! Enough on the shot to beat the infield,"Mohammad Nawaz to Gunathilaka, FOUR runs",108/2,348148,Mohammad Nawaz,0,10,1,1.4,9,922943,Shadab Khan,0,24,0,4.0,24,345821,Danushka Gunathilaka,64,68,9,0,300629,Angelo Perera,1,3,0,0,4,False,0,0,0,0,0,22,8,0,False,,False,False,4.98,0,130,0,2,0,1,1,0,108
run,8,Sri Lanka,7,Pakistan,1st innings,1,"full, on off stump. Drilled to long on","Mohammad Nawaz to Gunathilaka, 1 run",109/2,348148,Mohammad Nawaz,0,11,1,1.5,10,922943,Shadab Khan,0,24,0,4.0,24,345821,Danushka Gunathilaka,65,69,9,0,300629,Angelo Perera,1,3,0,0,5,False,0,0,0,0,0,22,8,0,False,,False,False,4.99,0,131,0,2,0,1,1,0,109
run,8,Sri Lanka,7,Pakistan,1st innings,1,"full, outside off, and driven down the ground to long off","Mohammad Nawaz to Perera, 1 run",110/2,348148,Mohammad Nawaz,0,12,1,2.0,11,922943,Shadab Khan,0,24,0,4.0,24,300629,Angelo Perera,2,4,0,0,345821,Danushka Gunathilaka,65,69,9,0,6,True,0,0,0,0,0,22,8,0,False,,False,False,5.0,0,132,0,2,0,1,1,0,110
run,8,Sri Lanka,7,Pakistan,1st innings,1,"full, on off stump. Mistimes the googly to mid-on for a quick single","Shadab Khan to Perera, 1 run",111/2,922943,Shadab Khan,0,25,0,4.1,25,348148,Mohammad Nawaz,0,12,1,2.0,11,300629,Angelo Perera,3,5,0,0,345821,Danushka Gunathilaka,65,69,9,0,1,False,0,0,0,0,0,23,4,0,False,,False,False,5.0,0,133,0,2,0,1,1,0,111
run,8,Sri Lanka,7,Pakistan,1st innings,1,"full, outside leg stump. Flicked to deep midwicket","Shadab Khan to Gunathilaka, 1 run",112/2,922943,Shadab Khan,0,26,0,4.2,26,348148,Mohammad Nawaz,0,12,1,2.0,11,345821,Danushka Gunathilaka,66,70,9,0,300629,Angelo Perera,3,5,0,0,2,False,0,0,0,0,0,23,4,0,False,,False,False,5.01,0,134,0,2,0,1,1,0,112
run,8,Sri Lanka,7,Pakistan,1st innings,1,"full, just outside off stump. Driven to wide long off","Shadab Khan to Perera, 1 run",113/2,922943,Shadab Khan,0,27,0,4.3,27,348148,Mohammad Nawaz,0,12,1,2.0,11,300629,Angelo Perera,4,6,0,0,345821,Danushka Gunathilaka,66,70,9,0,3,False,0,0,0,0,0,23,4,0,False,,False,False,5.02,0,135,0,2,0,1,1,0,113
no run,8,Sri Lanka,7,Pakistan,1st innings,0,,"Shadab Khan to Gunathilaka, no run",113/2,922943,Shadab Khan,0,28,0,4.4,27,348148,Mohammad Nawaz,0,12,1,2.0,11,345821,Danushka Gunathilaka,66,71,9,0,300629,Angelo Perera,4,6,0,0,4,False,0,0,0,0,0,23,4,0,False,,False,False,4.98,0,136,0,2,0,1,1,0,113
run,8,Sri Lanka,7,Pakistan,1st innings,1,"full, on leg stump, and he hammers a drive towards mid-on. They scamper across before the fielder can get to it","Shadab Khan to Gunathilaka, 1 run",114/2,922943,Shadab Khan,0,29,0,4.5,28,348148,Mohammad Nawaz,0,12,1,2.0,11,345821,Danushka Gunathilaka,67,72,9,0,300629,Angelo Perera,4,6,0,0,5,False,0,0,0,0,0,23,4,0,False,,False,False,4.99,0,137,0,2,0,1,1,0,114
no run,8,Sri Lanka,7,Pakistan,1st innings,0,"half-tracker outside off, and he pulls to deep midwicket","Shadab Khan to Perera, no run",114/2,922943,Shadab Khan,0,30,0,5.0,28,348148,Mohammad Nawaz,0,12,1,2.0,11,300629,Angelo Perera,4,7,0,0,345821,Danushka Gunathilaka,67,72,9,0,6,True,0,0,0,0,0,23,4,0,False,,False,False,4.95,0,138,0,2,0,1,1,0,114
no run,8,Sri Lanka,7,Pakistan,1st innings,0,"full, outside off, and he tries to sweep","Mohammad Nawaz to Gunathilaka, no run",114/2,348148,Mohammad Nawaz,0,13,1,2.1,11,922943,Shadab Khan,0,30,0,5.0,28,345821,Danushka Gunathilaka,67,73,9,0,300629,Angelo Perera,4,7,0,0,1,False,0,0,0,0,0,24,5,0,False,,False,False,4.92,0,139,0,2,0,1,1,0,114
no run,8,Sri Lanka,7,Pakistan,1st innings,0,,"Mohammad Nawaz to Gunathilaka, no run",114/2,348148,Mohammad Nawaz,0,14,1,2.2,11,922943,Shadab Khan,0,30,0,5.0,28,345821,Danushka Gunathilaka,67,74,9,0,300629,Angelo Perera,4,7,0,0,2,False,0,0,0,0,0,24,5,0,False,,False,False,4.88,0,140,0,2,0,1,1,0,114
four,8,Sri Lanka,7,Pakistan,1st innings,4,short and wide. He rocks back and cuts it behind square past the infield,"Mohammad Nawaz to Gunathilaka, FOUR runs",118/2,348148,Mohammad Nawaz,0,15,1,2.3,15,922943,Shadab Khan,0,30,0,5.0,28,345821,Danushka Gunathilaka,71,75,10,0,300629,Angelo Perera,4,7,0,0,3,False,0,0,0,0,0,24,5,0,False,,False,False,5.02,0,141,0,2,0,1,1,0,118
run,8,Sri Lanka,7,Pakistan,1st innings,1,"length ball, on middle. Flicked to the leg side","Mohammad Nawaz to Gunathilaka, 1 run",119/2,348148,Mohammad Nawaz,0,16,1,2.4,16,922943,Shadab Khan,0,30,0,5.0,28,345821,Danushka Gunathilaka,72,76,10,0,300629,Angelo Perera,4,7,0,0,4,False,0,0,0,0,0,24,5,0,False,,False,False,5.02,0,142,0,2,0,1,1,0,119
no run,8,Sri Lanka,7,Pakistan,1st innings,0,"full, on middle. Meets the ball under his eye and fends it away","Mohammad Nawaz to Perera, no run",119/2,348148,Mohammad Nawaz,0,17,1,2.5,16,922943,Shadab Khan,0,30,0,5.0,28,300629,Angelo Perera,4,8,0,0,345821,Danushka Gunathilaka,72,76,10,0,5,False,0,0,0,0,0,24,5,0,False,,False,False,4.99,0,143,0,2,0,1,1,0,119
no run,8,Sri Lanka,7,Pakistan,1st innings,0,"full, on leg stump. Tapped to midwicket","Mohammad Nawaz to Perera, no run",119/2,348148,Mohammad Nawaz,0,18,1,3.0,16,922943,Shadab Khan,0,30,0,5.0,28,300629,Angelo Perera,4,9,0,0,345821,Danushka Gunathilaka,72,76,10,0,6,True,0,0,0,0,0,24,5,0,False,,False,False,4.95,0,144,0,2,0,1,1,0,119
run,8,Sri Lanka,7,Pakistan,1st innings,1,"length ball, on middle. Tapped to short third man","Shadab Khan to Gunathilaka, 1 run",120/2,922943,Shadab Khan,0,31,0,5.1,29,348148,Mohammad Nawaz,0,18,1,3.0,16,345821,Danushka Gunathilaka,73,77,10,0,300629,Angelo Perera,4,9,0,0,1,False,0,0,0,0,0,25,3,0,False,,False,False,4.96,0,145,0,2,0,1,1,0,120
no run,8,Sri Lanka,7,Pakistan,1st innings,0,"tossed up, on off. Driven to the bowler's left","Shadab Khan to Perera, no run",120/2,922943,Shadab Khan,0,32,0,5.2,29,348148,Mohammad Nawaz,0,18,1,3.0,16,300629,Angelo Perera,4,10,0,0,345821,Danushka Gunathilaka,73,77,10,0,2,False,0,0,0,0,0,25,3,0,False,,False,False,4.93,0,146,0,2,0,1,1,0,120
run,8,Sri Lanka,7,Pakistan,1st innings,1,"full, outside off, and driven to to wide long off","Shadab Khan to Perera, 1 run",121/2,922943,Shadab Khan,0,33,0,5.3,30,348148,Mohammad Nawaz,0,18,1,3.0,16,300629,Angelo Perera,5,11,0,0,345821,Danushka Gunathilaka,73,77,10,0,3,False,0,0,0,0,0,25,3,0,False,,False,False,4.93,0,147,0,2,0,1,1,0,121
no run,8,Sri Lanka,7,Pakistan,1st innings,0,"full, on middle, and he tries to go for a reverse sweep. Misses","Shadab Khan to Gunathilaka, no run",121/2,922943,Shadab Khan,0,34,0,5.4,30,348148,Mohammad Nawaz,0,18,1,3.0,16,345821,Danushka Gunathilaka,73,78,10,0,300629,Angelo Perera,5,11,0,0,4,False,0,0,0,0,0,25,3,0,False,,False,False,4.9,0,148,0,2,0,1,1,0,121
run,8,Sri Lanka,7,Pakistan,1st innings,1,"length ball, on off. Tapped towards the off side","Shadab Khan to Gunathilaka, 1 run",122/2,922943,Shadab Khan,0,35,0,5.5,31,348148,Mohammad Nawaz,0,18,1,3.0,16,345821,Danushka Gunathilaka,74,79,10,0,300629,Angelo Perera,5,11,0,0,5,False,0,0,0,0,0,25,3,0,False,,False,False,4.91,0,149,0,2,0,1,1,0,122
no run,8,Sri Lanka,7,Pakistan,1st innings,0,"good length, just outside off. Tapped off the back foot to cover","Shadab Khan to Perera, no run",122/2,922943,Shadab Khan,0,36,0,6.0,31,348148,Mohammad Nawaz,0,18,1,3.0,16,300629,Angelo Perera,5,12,0,0,345821,Danushka Gunathilaka,74,79,10,0,6,True,0,0,0,0,0,25,3,0,False,,False,False,4.88,0,150,0,2,0,1,1,0,122
run,8,Sri Lanka,7,Pakistan,1st innings,1,"length ball, on leg stump. Flicked to deep midwicket","Mohammad Nawaz to Gunathilaka, 1 run",123/2,348148,Mohammad Nawaz,0,19,1,3.1,17,922943,Shadab Khan,0,36,0,6.0,31,345821,Danushka Gunathilaka,75,80,10,0,300629,Angelo Perera,5,12,0,0,1,False,0,0,0,0,0,26,8,0,False,,False,False,4.88,0,151,0,2,0,1,1,0,123
run,8,Sri Lanka,7,Pakistan,1st innings,1,full on leg stump. Makes room and drives down to long on,"Mohammad Nawaz to Perera, 1 run",124/2,348148,Mohammad Nawaz,0,20,1,3.2,18,922943,Shadab Khan,0,36,0,6.0,31,300629,Angelo Perera,6,13,0,0,345821,Danushka Gunathilaka,75,80,10,0,2,False,0,0,0,0,0,26,8,0,False,,False,False,4.89,0,152,0,2,0,1,1,0,124
four,8,Sri Lanka,7,Pakistan,1st innings,4,"full, on middle Makes room and <B>absolutely clatters it</b> over the bowler's head","Mohammad Nawaz to Gunathilaka, FOUR runs",128/2,348148,Mohammad Nawaz,0,21,1,3.3,22,922943,Shadab Khan,0,36,0,6.0,31,345821,Danushka Gunathilaka,79,81,11,0,300629,Angelo Perera,6,13,0,0,3,False,0,0,0,0,0,26,8,0,False,,False,False,5.01,0,153,0,2,0,1,1,0,128
no run,8,Sri Lanka,7,Pakistan,1st innings,0,length ball on leg stump. Guided to short fine leg,"Mohammad Nawaz to Gunathilaka, no run",128/2,348148,Mohammad Nawaz,0,22,1,3.4,22,922943,Shadab Khan,0,36,0,6.0,31,345821,Danushka Gunathilaka,79,82,11,0,300629,Angelo Perera,6,13,0,0,4,False,0,0,0,0,0,26,8,0,False,,False,False,4.98,0,154,0,2,0,1,1,0,128
run,8,Sri Lanka,7,Pakistan,1st innings,1,"full, on middle. Fended away to the leg side","Mohammad Nawaz to Gunathilaka, 1 run",129/2,348148,Mohammad Nawaz,0,23,1,3.5,23,922943,Shadab Khan,0,36,0,6.0,31,345821,Danushka Gunathilaka,80,83,11,0,300629,Angelo Perera,6,13,0,0,5,False,0,0,0,0,0,26,8,0,False,,False,False,4.99,0,155,0,2,0,1,1,0,129
run,8,Sri Lanka,7,Pakistan,1st innings,1,"full, on off stump. Driven to deep extra cover","Mohammad Nawaz to Perera, 1 run",130/2,348148,Mohammad Nawaz,0,24,1,4.0,24,922943,Shadab Khan,0,36,0,6.0,31,300629,Angelo Perera,7,14,0,0,345821,Danushka Gunathilaka,80,83,11,0,6,True,0,0,0,0,0,26,8,0,False,,False,False,5.0,0,156,0,2,0,1,1,0,130
no run,8,Sri Lanka,7,Pakistan,1st innings,0,"length ball, outside off, and guided off the back foot to point","Wahab Riaz to Perera, no run",130/2,43590,Wahab Riaz,0,19,0,3.1,17,348148,Mohammad Nawaz,0,24,1,4.0,24,300629,Angelo Perera,7,15,0,0,345821,Danushka Gunathilaka,80,83,11,0,1,False,0,0,0,0,0,27,9,0,False,,False,False,4.96,0,157,0,2,0,1,1,0,130
run,8,Sri Lanka,7,Pakistan,1st innings,1,length ball on leg stump. Flicked off his hips to deep midwicket,"Wahab Riaz to Perera, 1 run",131/2,43590,Wahab Riaz,0,20,0,3.2,18,348148,Mohammad Nawaz,0,24,1,4.0,24,300629,Angelo Perera,8,16,0,0,345821,Danushka Gunathilaka,80,83,11,0,2,False,0,0,0,0,0,27,9,0,False,,False,False,4.97,0,158,0,2,0,1,1,0,131
no run,8,Sri Lanka,7,Pakistan,1st innings,0,"full, on middle. Flicked off his toes to deep midwicket","Wahab Riaz to Gunathilaka, no run",131/2,43590,Wahab Riaz,0,21,0,3.3,18,348148,Mohammad Nawaz,0,24,1,4.0,24,345821,Danushka Gunathilaka,80,84,11,0,300629,Angelo Perera,8,16,0,0,3,False,0,0,0,0,0,27,9,0,False,,False,False,4.94,0,159,0,2,0,1,1,0,131
run,8,Sri Lanka,7,Pakistan,1st innings,2,"length ball, wide outside off, and cut in front of square to deep point","Wahab Riaz to Gunathilaka, 2 runs",133/2,43590,Wahab Riaz,0,22,0,3.4,20,348148,Mohammad Nawaz,0,24,1,4.0,24,345821,Danushka Gunathilaka,82,85,11,0,300629,Angelo Perera,8,16,0,0,4,False,0,0,0,0,0,27,9,0,False,,False,False,4.98,0,160,0,2,0,1,1,0,133
no run,8,Sri Lanka,7,Pakistan,1st innings,0,"full, on off, and defended off the back foot to cover","Wahab Riaz to Gunathilaka, no run",133/2,43590,Wahab Riaz,0,23,0,3.5,20,348148,Mohammad Nawaz,0,24,1,4.0,24,345821,Danushka Gunathilaka,82,86,11,0,300629,Angelo Perera,8,16,0,0,5,False,0,0,0,0,0,27,9,0,False,,False,False,4.95,0,161,0,2,0,1,1,0,133
six,8,Sri Lanka,7,Pakistan,1st innings,6,"full, on off, and he <B>lofts this over the leg side</b> for a huge six. Clears his front leg and places it over wide long on","Wahab Riaz to Gunathilaka, SIX runs",139/2,43590,Wahab Riaz,0,24,0,4.0,26,348148,Mohammad Nawaz,0,24,1,4.0,24,345821,Danushka Gunathilaka,88,87,11,1,300629,Angelo Perera,8,16,0,0,6,True,0,0,0,0,0,27,9,0,False,,False,False,5.14,0,162,0,2,0,1,1,0,139
no run,8,Sri Lanka,7,Pakistan,1st innings,0,"length ball, outside off. Opens the bat's face to short third man","Usman Shinwari to Perera, no run",139/2,697279,Usman Shinwari,1,19,0,3.1,17,43590,Wahab Riaz,0,24,0,4.0,26,300629,Angelo Perera,8,17,0,0,345821,Danushka Gunathilaka,88,87,11,1,1,False,0,0,0,0,0,28,4,0,False,,False,False,5.11,0,163,0,2,0,1,1,0,139
no run,8,Sri Lanka,7,Pakistan,1st innings,0,"length ball, on off. Punched off the back foot","Usman Shinwari to Perera, no run",139/2,697279,Usman Shinwari,1,20,0,3.2,17,43590,Wahab Riaz,0,24,0,4.0,26,300629,Angelo Perera,8,18,0,0,345821,Danushka Gunathilaka,88,87,11,1,2,False,0,0,0,0,0,28,4,0,False,,False,False,5.08,0,164,0,2,0,1,1,0,139
no run,8,Sri Lanka,7,Pakistan,1st innings,0,"length ball, outside off, and punched off the back foot to cover","Usman Shinwari to Perera, no run",139/2,697279,Usman Shinwari,1,21,0,3.3,17,43590,Wahab Riaz,0,24,0,4.0,26,300629,Angelo Perera,8,19,0,0,345821,Danushka Gunathilaka,88,87,11,1,3,False,0,0,0,0,0,28,4,0,False,,False,False,5.05,0,165,0,2,0,1,1,0,139
run,8,Sri Lanka,7,Pakistan,1st innings,2,"length ball, outside off, and he opens the bat's face to guide it down to deep point","Usman Shinwari to Perera, 2 runs",141/2,697279,Usman Shinwari,1,22,0,3.4,19,43590,Wahab Riaz,0,24,0,4.0,26,300629,Angelo Perera,10,20,0,0,345821,Danushka Gunathilaka,88,87,11,1,4,False,0,0,0,0,0,28,4,0,False,,False,False,5.09,0,166,0,2,0,1,1,0,141
run,8,Sri Lanka,7,Pakistan,1st innings,2,"full, on middle. Whipped off his pads to deep midwicket","Usman Shinwari to Perera, 2 runs",143/2,697279,Usman Shinwari,1,23,0,3.5,21,43590,Wahab Riaz,0,24,0,4.0,26,300629,Angelo Perera,12,21,0,0,345821,Danushka Gunathilaka,88,87,11,1,5,False,0,0,0,0,0,28,4,0,False,,False,False,5.13,0,167,0,2,0,1,1,0,143
no run,8,Sri Lanka,7,Pakistan,1st innings,0,full on off stump. Driven to long off,"Usman Shinwari to Perera, no run",143/2,697279,Usman Shinwari,1,24,0,4.0,21,43590,Wahab Riaz,0,24,0,4.0,26,300629,Angelo Perera,12,22,0,0,345821,Danushka Gunathilaka,88,87,11,1,6,True,0,0,0,0,0,28,4,0,False,,False,False,5.1,0,168,0,2,0,1,1,0,143
run,8,Sri Lanka,7,Pakistan,1st innings,2,"full, on middle, and flicked off his toes to deep midwicket","Wahab Riaz to Gunathilaka, 2 runs",145/2,43590,Wahab Riaz,0,25,0,4.1,28,697279,Usman Shinwari,1,24,0,4.0,21,345821,Danushka Gunathilaka,90,88,11,1,300629,Angelo Perera,12,22,0,0,1,False,0,0,0,0,0,29,8,0,False,,False,False,5.14,0,169,0,2,0,1,1,0,145
no run,8,Sri Lanka,7,Pakistan,1st innings,0,"back of a length on off, and he sways away from the ball's line","Wahab Riaz to Gunathilaka, no run",145/2,43590,Wahab Riaz,0,26,0,4.2,28,697279,Usman Shinwari,1,24,0,4.0,21,345821,Danushka Gunathilaka,90,89,11,1,300629,Angelo Perera,12,22,0,0,2,False,0,0,0,0,0,29,8,0,False,,False,False,5.11,0,170,0,2,0,1,1,0,145
four,8,Sri Lanka,7,Pakistan,1st innings,4,"full, just outside off, and he leans into a glorious looking <B>drive through the covers!</b>","Wahab Riaz to Gunathilaka, FOUR runs",149/2,43590,Wahab Riaz,0,27,0,4.3,32,697279,Usman Shinwari,1,24,0,4.0,21,345821,Danushka Gunathilaka,94,90,12,1,300629,Angelo Perera,12,22,0,0,3,False,0,0,0,0,0,29,8,0,False,,False,False,5.22,0,171,0,2,0,1,1,0,149
run,8,Sri Lanka,7,Pakistan,1st innings,1,opens the bat's face and runs it down to third man,"Wahab Riaz to Gunathilaka, 1 run",150/2,43590,Wahab Riaz,0,28,0,4.4,33,697279,Usman Shinwari,1,24,0,4.0,21,345821,Danushka Gunathilaka,95,91,12,1,300629,Angelo Perera,12,22,0,0,4,False,0,0,0,0,0,29,8,0,False,,False,False,5.23,0,172,0,2,0,1,1,0,150
no run,8,Sri Lanka,7,Pakistan,1st innings,0,"full, on middle, and the attempted drive is spliced to cover","Wahab Riaz to Perera, no run",150/2,43590,Wahab Riaz,0,29,0,4.5,33,697279,Usman Shinwari,1,24,0,4.0,21,300629,Angelo Perera,12,23,0,0,345821,Danushka Gunathilaka,95,91,12,1,5,False,0,0,0,0,0,29,8,0,False,,False,False,5.2,0,173,0,2,0,1,1,0,150
run,8,Sri Lanka,7,Pakistan,1st innings,1,"yorker on off, but he does well to splice this away to short third man. <B>Fifty stand</b>","Wahab Riaz to Perera, 1 run",151/2,43590,Wahab Riaz,0,30,0,5.0,34,697279,Usman Shinwari,1,24,0,4.0,21,300629,Angelo Perera,13,24,0,0,345821,Danushka Gunathilaka,95,91,12,1,6,True,0,0,0,0,0,29,8,0,False,,False,False,5.2,0,174,0,2,0,1,1,0,151
out,8,Sri Lanka,7,Pakistan,1st innings,0,"full, on off stump. Flicked off his toes but it's in the air, and pocketed by the fielder placed at midwicket. Shinwari carrying his form from the other day","Usman Shinwari to Perera, OUT",151/3,697279,Usman Shinwari,1,25,1,4.1,21,43590,Wahab Riaz,0,30,0,5.0,34,300629,Angelo Perera,13,25,0,0,345821,Danushka Gunathilaka,95,91,12,1,1,False,0,0,0,0,0,30,2,1,True,caught,False,AK Perera c Haris Sohail b Usman Shinwari 13 (25b 0x4 0x6) SR: 52.00,5.17,0,175,0,3,0,1,1,0,151
no run,8,Sri Lanka,7,Pakistan,1st innings,0,"full, outside off, and driven to mid-off. He's toe ended this shot though","Usman Shinwari to Bhanuka, no run",151/3,697279,Usman Shinwari,1,26,1,4.2,21,43590,Wahab Riaz,0,30,0,5.0,34,629075,Minod Bhanuka,0,1,0,0,345821,Danushka Gunathilaka,95,91,12,1,2,False,0,0,0,0,0,30,2,1,False,,False,False,5.14,0,176,0,3,0,1,1,0,151
run,8,Sri Lanka,7,Pakistan,1st innings,1,"full, just outside off stump. Tapped with soft hands as they sneak across for a single","Usman Shinwari to Bhanuka, 1 run",152/3,697279,Usman Shinwari,1,27,1,4.3,22,43590,Wahab Riaz,0,30,0,5.0,34,629075,Minod Bhanuka,1,2,0,0,345821,Danushka Gunathilaka,95,91,12,1,3,False,0,0,0,0,0,30,2,1,False,,False,False,5.15,0,177,0,3,0,1,1,0,152
run,8,Sri Lanka,7,Pakistan,1st innings,1,"full, on off stump. Defended towards mid off as they scamper through for a single","Usman Shinwari to Gunathilaka, 1 run",153/3,697279,Usman Shinwari,1,28,1,4.4,23,43590,Wahab Riaz,0,30,0,5.0,34,345821,Danushka Gunathilaka,96,92,12,1,629075,Minod Bhanuka,1,2,0,0,4,False,0,0,0,0,0,30,2,1,False,,False,False,5.15,0,178,0,3,0,1,1,0,153
no run,8,Sri Lanka,7,Pakistan,1st innings,0,"length ball outside off, but this is the slower one from Usman. Tries to defend off the back foot, but the ball goes past his edge to the keeper","Usman Shinwari to Bhanuka, no run",153/3,697279,Usman Shinwari,1,29,1,4.5,23,43590,Wahab Riaz,0,30,0,5.0,34,629075,Minod Bhanuka,1,3,0,0,345821,Danushka Gunathilaka,96,92,12,1,5,False,0,0,0,0,0,30,2,1,False,,False,False,5.12,0,179,0,3,0,1,1,0,153
no run,8,Sri Lanka,7,Pakistan,1st innings,0,"length ball outside off, and punched away to cover","Usman Shinwari to Bhanuka, no run",153/3,697279,Usman Shinwari,1,30,1,5.0,23,43590,Wahab Riaz,0,30,0,5.0,34,629075,Minod Bhanuka,1,4,0,0,345821,Danushka Gunathilaka,96,92,12,1,6,True,0,0,0,0,0,30,2,1,False,,False,False,5.1,0,180,0,3,0,1,1,0,153
no run,8,Sri Lanka,7,Pakistan,1st innings,0,"length ball, outside off. The attempted cut is too close to his body, and is spliced to mid-on","Mohammad Amir to Gunathilaka, no run",153/3,290948,Mohammad Amir,0,25,1,4.1,18,697279,Usman Shinwari,1,30,1,5.0,23,345821,Danushka Gunathilaka,96,93,12,1,629075,Minod Bhanuka,1,4,0,0,1,False,0,0,0,0,0,31,3,0,False,,False,False,5.07,0,181,0,3,0,1,1,0,153
no run,8,Sri Lanka,7,Pakistan,1st innings,0,"length ball, just outside off stump. Tries to run it fine but deceived by the slower ball. Through to the keeper in the bounce. The ball was very close to the edge","Mohammad Amir to Bhanuka, no run",153/3,290948,Mohammad Amir,0,26,1,4.2,18,697279,Usman Shinwari,1,30,1,5.0,23,345821,Danushka Gunathilaka,96,94,12,1,629075,Minod Bhanuka,1,4,0,0,2,False,0,0,0,0,0,31,3,0,False,,False,False,5.04,0,182,0,3,0,1,1,0,153
run,8,Sri Lanka,7,Pakistan,1st innings,1,"length ball, outside off, and cut behind square to deep point","Mohammad Amir to Gunathilaka, 1 run",154/3,290948,Mohammad Amir,0,27,1,4.3,19,697279,Usman Shinwari,1,30,1,5.0,23,345821,Danushka Gunathilaka,97,95,12,1,629075,Minod Bhanuka,1,4,0,0,3,False,0,0,0,0,0,31,3,0,False,,False,False,5.04,0,183,0,3,0,1,1,0,154
run,8,Sri Lanka,7,Pakistan,1st innings,1,good length outside off stump. Opens the bat's face and chops it down to third man,"Mohammad Amir to Bhanuka, 1 run",155/3,290948,Mohammad Amir,0,28,1,4.4,20,697279,Usman Shinwari,1,30,1,5.0,23,629075,Minod Bhanuka,2,5,0,0,345821,Danushka Gunathilaka,97,95,12,1,4,False,0,0,0,0,0,31,3,0,False,,False,False,5.05,0,184,0,3,0,1,1,0,155
no run,8,Sri Lanka,7,Pakistan,1st innings,0,"length ball, outside off, and punched off the back foot","Mohammad Amir to Gunathilaka, no run",155/3,290948,Mohammad Amir,0,29,1,4.5,20,697279,Usman Shinwari,1,30,1,5.0,23,345821,Danushka Gunathilaka,97,96,12,1,629075,Minod Bhanuka,2,5,0,0,5,False,0,0,0,0,0,31,3,0,False,,False,False,5.02,0,185,0,3,0,1,1,0,155
run,8,Sri Lanka,7,Pakistan,1st innings,1,"good length, just outside off stump. Fended away to cover off the back foot","Mohammad Amir to Gunathilaka, 1 run",156/3,290948,Mohammad Amir,0,30,1,5.0,21,697279,Usman Shinwari,1,30,1,5.0,23,345821,Danushka Gunathilaka,98,97,12,1,629075,Minod Bhanuka,2,5,0,0,6,True,0,0,0,0,0,31,3,0,False,,False,False,5.03,0,186,0,3,0,1,1,0,156
no run,8,Sri Lanka,7,Pakistan,1st innings,0,"good length, outside off stump. Opens the bat's face late to guide a shot to point","Usman Shinwari to Gunathilaka, no run",156/3,697279,Usman Shinwari,1,31,1,5.1,23,290948,Mohammad Amir,0,30,1,5.0,21,345821,Danushka Gunathilaka,98,98,12,1,629075,Minod Bhanuka,2,5,0,0,1,False,0,0,0,0,0,32,3,0,False,,False,False,5.0,0,187,0,3,0,1,1,0,156
run,8,Sri Lanka,7,Pakistan,1st innings,1,"full, on middle stump. Drilled past the bowler's left for a quick single as mid-on gets behind it","Usman Shinwari to Gunathilaka, 1 run",157/3,697279,Usman Shinwari,1,32,1,5.2,24,290948,Mohammad Amir,0,30,1,5.0,21,345821,Danushka Gunathilaka,99,99,12,1,629075,Minod Bhanuka,2,5,0,0,2,False,0,0,0,0,0,32,3,0,False,,False,False,5.01,0,188,0,3,0,1,1,0,157
no run,8,Sri Lanka,7,Pakistan,1st innings,0,"length ball, on off stump and angling in. Defended off the back foot towards the non-striker","Usman Shinwari to Bhanuka, no run",157/3,697279,Usman Shinwari,1,33,1,5.3,24,290948,Mohammad Amir,0,30,1,5.0,21,629075,Minod Bhanuka,2,6,0,0,345821,Danushka Gunathilaka,99,99,12,1,3,False,0,0,0,0,0,32,3,0,False,,False,False,4.98,0,189,0,3,0,1,1,0,157
no run,8,Sri Lanka,7,Pakistan,1st innings,0,"length ball, just outside off, and he tries to flick towards the leg side. But the ball stays low and sneaks under his bat","Usman Shinwari to Bhanuka, no run",157/3,697279,Usman Shinwari,1,34,1,5.4,24,290948,Mohammad Amir,0,30,1,5.0,21,629075,Minod Bhanuka,2,7,0,0,345821,Danushka Gunathilaka,99,99,12,1,4,False,0,0,0,0,0,32,3,0,False,,False,False,4.95,0,190,0,3,0,1,1,0,157
run,8,Sri Lanka,7,Pakistan,1st innings,1,"full, outside off stump. Pushed off the back foot past the fielder at point","Usman Shinwari to Bhanuka, 1 run",158/3,697279,Usman Shinwari,1,35,1,5.5,25,290948,Mohammad Amir,0,30,1,5.0,21,629075,Minod Bhanuka,3,8,0,0,345821,Danushka Gunathilaka,99,99,12,1,5,False,0,0,0,0,0,32,3,0,False,,False,False,4.96,0,191,0,3,0,1,1,0,158
run,8,Sri Lanka,7,Pakistan,1st innings,1,"<B>there's the hundred!</b> At a run-a-ball. Full, just outside off stump, and driven square to deep point. Removes his helmet and celebrates with his bat in the air. Dugout on their feet too","Usman Shinwari to Gunathilaka, 1 run",159/3,697279,Usman Shinwari,1,36,1,6.0,26,290948,Mohammad Amir,0,30,1,5.0,21,345821,Danushka Gunathilaka,100,100,12,1,629075,Minod Bhanuka,3,8,0,0,6,True,0,0,0,0,0,32,3,0,False,,False,False,4.96,0,192,0,3,0,1,1,0,159
run,8,Sri Lanka,7,Pakistan,1st innings,1,"full, just outside off. Brings his bat down for a drive, but slices the shot down to deep point","Mohammad Amir to Gunathilaka, 1 run",160/3,290948,Mohammad Amir,0,31,1,5.1,22,697279,Usman Shinwari,1,36,1,6.0,26,345821,Danushka Gunathilaka,101,101,12,1,629075,Minod Bhanuka,3,8,0,0,1,False,0,0,0,0,0,33,6,0,False,,False,False,4.97,0,193,0,3,0,1,1,0,160
no run,8,Sri Lanka,7,Pakistan,1st innings,0,"full, on off stump. Tapped to short cover, but can't beat the fielder","Mohammad Amir to Bhanuka, no run",160/3,290948,Mohammad Amir,0,32,1,5.2,22,697279,Usman Shinwari,1,36,1,6.0,26,629075,Minod Bhanuka,3,9,0,0,345821,Danushka Gunathilaka,101,101,12,1,2,False,0,0,0,0,0,33,6,0,False,,False,False,4.94,0,194,0,3,0,1,1,0,160
no run,8,Sri Lanka,7,Pakistan,1st innings,0,"full, on off stump. Pushed with the bat's full face to long off","Mohammad Amir to Bhanuka, no run",160/3,290948,Mohammad Amir,0,33,1,5.3,22,697279,Usman Shinwari,1,36,1,6.0,26,629075,Minod Bhanuka,3,10,0,0,345821,Danushka Gunathilaka,101,101,12,1,3,False,0,0,0,0,0,33,6,0,False,,False,False,4.92,0,195,0,3,0,1,1,0,160
