PlayType_description,Batting_Team_id,Batting_Team_name,Bowling_Team_id,Bowling_Team_name,Innings,Total_Runs_on_delivery,Commentary,Commentary_short,Score,Bowler_id,Bowler_name,Bowler_maiden,Bowler_balls,Bowler_wickets,Bowler_over,Bowler_conceded,Other_Bowler_id,Other_Bowler_name,Other_Bowler_maidens,Other_Bowler_balls,Other_Bowler_wickets,Other_Bowler_overs,Other_Bowler_conceded,Batsman_id,Batsman_name,Batsman_runs,Batsman_balls_faced,Batsman_four,Batsman_sixes,Other_Batsman_id,Other_Batsman_name,Other_Batsman_runs,Other_Batsman_balls_faced,Other_Batsman_four,Other_Batsman_sixes,Over_ball,Over_complete,Over_maiden,Over_no_Ball,Over_wide,Over_byes,Over_leg_byes,Over_number,Over_runs,Over_wickets,Dismissal_is_true,Dismissal_type,Dismissal_fielder_iskeeper,Dismissal_text,Innings_run_rate,Innings_byes,Innings_balls,Innings_no_balls,Innings_wickets,Innings_leg_byes,Innings_session,Innings_day,Innings_wides,Innings_runs
run,7,Pakistan,8,Sri Lanka,2nd innings,1,"short of length outside off, goes for the cut but gets a thick outside edge towards third man","Kumara to Babar Azam, 1 run",0,784375,Lahiru Kumara,0,13,0,2.1,21,429738,Lakshan Sandakan,0,36,0,6.0,40,348144,Babar Azam,14,15,1,0,512191,Fakhar Zaman,65,69,7,1,1,False,0,0,0,0,0,26,7,0,False,,False,False,6.11,0,151,0,1,0,1,1,0,154
bye,7,Pakistan,8,Sri Lanka,2nd innings,2,"a sharp bouncer, Fakhar goes for the pull but misses. The keeper jumps but can get only his hands to it. And they sneak in two byes","Kumara to Fakhar Zaman, 2 byes",0,784375,Lahiru Kumara,0,14,0,2.2,21,429738,Lakshan Sandakan,0,36,0,6.0,40,512191,Fakhar Zaman,65,70,7,1,348144,Babar Azam,14,15,1,0,2,False,0,0,0,2,0,26,7,0,False,,False,False,6.15,2,152,0,1,0,1,1,0,156
run,7,Pakistan,8,Sri Lanka,2nd innings,1,"slower length ball outside off, guides it towards third man","Kumara to Fakhar Zaman, 1 run",0,784375,Lahiru Kumara,0,15,0,2.3,22,429738,Lakshan Sandakan,0,36,0,6.0,40,512191,Fakhar Zaman,66,71,7,1,348144,Babar Azam,14,15,1,0,3,False,0,0,0,0,0,26,7,0,False,,False,False,6.15,0,153,0,1,0,1,1,0,157
run,7,Pakistan,8,Sri Lanka,2nd innings,1,"another short one but down the leg side and doesn't bounce that much, Babar pulls it down towards fine leg","Kumara to Babar Azam, 1 run",0,784375,Lahiru Kumara,0,16,0,2.4,23,429738,Lakshan Sandakan,0,36,0,6.0,40,348144,Babar Azam,15,16,1,0,512191,Fakhar Zaman,66,71,7,1,4,False,0,0,0,0,0,26,7,0,False,,False,False,6.15,0,154,0,1,0,1,1,0,158
run,7,Pakistan,8,Sri Lanka,2nd innings,1,"length ball on the pads, tucked away towards the right of fine leg","Kumara to Fakhar Zaman, 1 run",0,784375,Lahiru Kumara,0,17,0,2.5,24,429738,Lakshan Sandakan,0,36,0,6.0,40,512191,Fakhar Zaman,67,72,7,1,348144,Babar Azam,15,16,1,0,5,False,0,0,0,0,0,26,7,0,False,,False,False,6.15,0,155,0,1,0,1,1,0,159
run,7,Pakistan,8,Sri Lanka,2nd innings,1,"length ball around off, dabs it towards third man for one more","Kumara to Babar Azam, 1 run",0,784375,Lahiru Kumara,0,18,0,3.0,25,429738,Lakshan Sandakan,0,36,0,6.0,40,348144,Babar Azam,16,17,1,0,512191,Fakhar Zaman,67,72,7,1,6,True,0,0,0,0,0,26,7,0,False,,False,False,6.15,0,156,0,1,0,1,1,0,160
run,7,Pakistan,8,Sri Lanka,2nd innings,5,"length ball on the stumps, skips down and nudges it towards square leg, and they set off for a quick single, Fakhar puts in the dive but a wide throw means they get four overthrows","Sandakan to Babar Azam, 5 runs",0,429738,Lakshan Sandakan,0,37,0,6.1,45,784375,Lahiru Kumara,0,18,0,3.0,25,348144,Babar Azam,21,18,1,0,512191,Fakhar Zaman,67,72,7,1,1,False,0,0,0,0,0,27,8,0,False,,False,False,6.3,0,157,0,1,0,1,1,0,165
no run,7,Pakistan,8,Sri Lanka,2nd innings,0,"length ball outside off, goes for the cut but misses","Sandakan to Fakhar Zaman, no run",0,429738,Lakshan Sandakan,0,38,0,6.2,45,784375,Lahiru Kumara,0,18,0,3.0,25,512191,Fakhar Zaman,67,73,7,1,348144,Babar Azam,21,18,1,0,2,False,0,0,0,0,0,27,8,0,False,,False,False,6.26,0,158,0,1,0,1,1,0,165
no run,7,Pakistan,8,Sri Lanka,2nd innings,0,"tossed up on the stumps, slower through the air, comes forward and blocks","Sandakan to Fakhar Zaman, no run",0,429738,Lakshan Sandakan,0,39,0,6.3,45,784375,Lahiru Kumara,0,18,0,3.0,25,512191,Fakhar Zaman,67,74,7,1,348144,Babar Azam,21,18,1,0,3,False,0,0,0,0,0,27,8,0,False,,False,False,6.22,0,159,0,1,0,1,1,0,165
run,7,Pakistan,8,Sri Lanka,2nd innings,1,flighted on the stumps once more. Goes for the slog sweep but ends up dragging towards square leg off the bottom edge,"Sandakan to Fakhar Zaman, 1 run",0,429738,Lakshan Sandakan,0,40,0,6.4,46,784375,Lahiru Kumara,0,18,0,3.0,25,512191,Fakhar Zaman,68,75,7,1,348144,Babar Azam,21,18,1,0,4,False,0,0,0,0,0,27,8,0,False,,False,False,6.22,0,160,0,1,0,1,1,0,166
run,7,Pakistan,8,Sri Lanka,2nd innings,1,"fuller on middle and leg, turns it gently towards fine leg","Sandakan to Babar Azam, 1 run",0,429738,Lakshan Sandakan,0,41,0,6.5,47,784375,Lahiru Kumara,0,18,0,3.0,25,348144,Babar Azam,22,19,1,0,512191,Fakhar Zaman,68,75,7,1,5,False,0,0,0,0,0,27,8,0,False,,False,False,6.22,0,161,0,1,0,1,1,0,167
run,7,Pakistan,8,Sri Lanka,2nd innings,1,"length ball on the stumps, tucked away in front of square leg","Sandakan to Fakhar Zaman, 1 run",0,429738,Lakshan Sandakan,0,42,0,7.0,48,784375,Lahiru Kumara,0,18,0,3.0,25,512191,Fakhar Zaman,69,76,7,1,348144,Babar Azam,22,19,1,0,6,True,0,0,0,0,0,27,8,0,False,,False,False,6.22,0,162,0,1,0,1,1,0,168
no run,7,Pakistan,8,Sri Lanka,2nd innings,0,"length ball on the stumps, Fakhar was looking to dab it on the off side but the bowler follows him, ends up dropping on the pitch. Was looking for a single but Lahiru was quick to the ball","Kumara to Fakhar Zaman, no run",0,784375,Lahiru Kumara,0,19,0,3.1,25,429738,Lakshan Sandakan,0,42,0,7.0,48,512191,Fakhar Zaman,69,77,7,1,348144,Babar Azam,22,19,1,0,1,False,0,0,0,0,0,28,8,0,False,,False,False,6.18,0,163,0,1,0,1,1,0,168
no run,7,Pakistan,8,Sri Lanka,2nd innings,0,"short of length outside off, looks to cut it through covers but it keeps low and sneaks under the bat. On the bounce to the keeper","Kumara to Fakhar Zaman, no run",0,784375,Lahiru Kumara,0,20,0,3.2,25,429738,Lakshan Sandakan,0,42,0,7.0,48,512191,Fakhar Zaman,69,78,7,1,348144,Babar Azam,22,19,1,0,2,False,0,0,0,0,0,28,8,0,False,,False,False,6.14,0,164,0,1,0,1,1,0,168
run,7,Pakistan,8,Sri Lanka,2nd innings,1,"short this time but no trouble for Fakhar, pulls it towards deep square leg","Kumara to Fakhar Zaman, 1 run",0,784375,Lahiru Kumara,0,21,0,3.3,26,429738,Lakshan Sandakan,0,42,0,7.0,48,512191,Fakhar Zaman,70,79,7,1,348144,Babar Azam,22,19,1,0,3,False,0,0,0,0,0,28,8,0,False,,False,False,6.14,0,165,0,1,0,1,1,0,169
four,7,Pakistan,8,Sri Lanka,2nd innings,4,"fuller around off, in the driving zone and Babar obliges with a glorious extra-cover drive","Kumara to Babar Azam, FOUR runs",0,784375,Lahiru Kumara,0,22,0,3.4,30,429738,Lakshan Sandakan,0,42,0,7.0,48,348144,Babar Azam,26,20,2,0,512191,Fakhar Zaman,70,79,7,1,4,False,0,0,0,0,0,28,8,0,False,,False,False,6.25,0,166,0,1,0,1,1,0,173
run,7,Pakistan,8,Sri Lanka,2nd innings,1,"short of length this time, dabs it down towards third man","Kumara to Babar Azam, 1 run",0,784375,Lahiru Kumara,0,23,0,3.5,31,429738,Lakshan Sandakan,0,42,0,7.0,48,348144,Babar Azam,27,21,2,0,512191,Fakhar Zaman,70,79,7,1,5,False,0,0,0,0,0,28,8,0,False,,False,False,6.25,0,167,0,1,0,1,1,0,174
run,7,Pakistan,8,Sri Lanka,2nd innings,2,"length ball around off, punched off the back foot towards sweeper cover, and they come back for the second","Kumara to Fakhar Zaman, 2 runs",0,784375,Lahiru Kumara,0,24,0,4.0,33,429738,Lakshan Sandakan,0,42,0,7.0,48,512191,Fakhar Zaman,72,80,7,1,348144,Babar Azam,27,21,2,0,6,True,0,0,0,0,0,28,8,0,False,,False,False,6.28,0,168,0,1,0,1,1,0,176
no run,7,Pakistan,8,Sri Lanka,2nd innings,0,"length ball around off, punched towards short midwicket from the back foot","Sandakan to Babar Azam, no run",0,429738,Lakshan Sandakan,0,43,0,7.1,48,784375,Lahiru Kumara,0,24,0,4.0,33,348144,Babar Azam,27,22,2,0,512191,Fakhar Zaman,72,80,7,1,1,False,0,0,0,0,0,29,5,0,False,,False,False,6.24,0,169,0,1,0,1,1,0,176
run,7,Pakistan,8,Sri Lanka,2nd innings,2,"short outside off, rocks back and cuts it hard towards deep extra cover, Nuwan Pradeep from deep cover cuts it off","Sandakan to Babar Azam, 2 runs",0,429738,Lakshan Sandakan,0,44,0,7.2,50,784375,Lahiru Kumara,0,24,0,4.0,33,348144,Babar Azam,29,23,2,0,512191,Fakhar Zaman,72,80,7,1,2,False,0,0,0,0,0,29,5,0,False,,False,False,6.28,0,170,0,1,0,1,1,0,178
run,7,Pakistan,8,Sri Lanka,2nd innings,1,"dragged down once again, goes back and pulls it towards deep midwicket","Sandakan to Babar Azam, 1 run",0,429738,Lakshan Sandakan,0,45,0,7.3,51,784375,Lahiru Kumara,0,24,0,4.0,33,348144,Babar Azam,30,24,2,0,512191,Fakhar Zaman,72,80,7,1,3,False,0,0,0,0,0,29,5,0,False,,False,False,6.28,0,171,0,1,0,1,1,0,179
run,7,Pakistan,8,Sri Lanka,2nd innings,1,"tossed up outside off, digs it out towards deep extra cover","Sandakan to Fakhar Zaman, 1 run",0,429738,Lakshan Sandakan,0,46,0,7.4,52,784375,Lahiru Kumara,0,24,0,4.0,33,512191,Fakhar Zaman,73,81,7,1,348144,Babar Azam,30,24,2,0,4,False,0,0,0,0,0,29,5,0,False,,False,False,6.27,0,172,0,1,0,1,1,0,180
run,7,Pakistan,8,Sri Lanka,2nd innings,1,"fuller on the pads, flicked towards deep-backward square leg","Sandakan to Babar Azam, 1 run",0,429738,Lakshan Sandakan,0,47,0,7.5,53,784375,Lahiru Kumara,0,24,0,4.0,33,348144,Babar Azam,31,25,2,0,512191,Fakhar Zaman,73,81,7,1,5,False,0,0,0,0,0,29,5,0,False,,False,False,6.27,0,173,0,1,0,1,1,0,181
no run,7,Pakistan,8,Sri Lanka,2nd innings,0,"a googly, pitching around middle and off and spinning in, punched towards short midwicket from the back foot","Sandakan to Fakhar Zaman, no run",0,429738,Lakshan Sandakan,0,48,0,8.0,53,784375,Lahiru Kumara,0,24,0,4.0,33,512191,Fakhar Zaman,73,82,7,1,348144,Babar Azam,31,25,2,0,6,True,0,0,0,0,0,29,5,0,False,,False,False,6.24,0,174,0,1,0,1,1,0,181
out,7,Pakistan,8,Sri Lanka,2nd innings,0,"length ball around off and skids back in to beat the bat and hit Babar on the knee roll, an appeal for lbw but Joel Wilson says on. Sri Lanka take the review, I think just in time. Replays show there was no bat involved and it would have gone on to hit the top of the middle stump","Pradeep to Babar Azam, OUT",0,324358,Nuwan Pradeep,1,25,1,4.1,26,429738,Lakshan Sandakan,0,48,0,8.0,53,348144,Babar Azam,31,26,2,0,512191,Fakhar Zaman,73,82,7,1,1,False,0,0,0,0,0,30,2,1,True,leg before wicket,False,Babar Azam lbw b Pradeep 31 (26b 2x4 0x6) SR: 119.23,6.2,0,175,0,2,0,1,1,0,181
no run,7,Pakistan,8,Sri Lanka,2nd innings,0,"and beaten outside off. Was a length ball in the channel, Sarfaraz pushes at it but gets beaten by the seam movement","Pradeep to Sarfaraz Ahmed, no run",0,324358,Nuwan Pradeep,1,26,1,4.2,26,429738,Lakshan Sandakan,0,48,0,8.0,53,227760,Sarfaraz Ahmed,0,1,0,0,512191,Fakhar Zaman,73,82,7,1,2,False,0,0,0,0,0,30,2,1,False,,False,False,6.17,0,176,0,2,0,1,1,0,181
run,7,Pakistan,8,Sri Lanka,2nd innings,1,"length ball on the stumps, tucked towards midwicket to get off the mark","Pradeep to Sarfaraz Ahmed, 1 run",0,324358,Nuwan Pradeep,1,27,1,4.3,27,429738,Lakshan Sandakan,0,48,0,8.0,53,227760,Sarfaraz Ahmed,1,2,0,0,512191,Fakhar Zaman,73,82,7,1,3,False,0,0,0,0,0,30,2,1,False,,False,False,6.16,0,177,0,2,0,1,1,0,182
no run,7,Pakistan,8,Sri Lanka,2nd innings,0,"length ball outside off, goes for the pull but misses as it doesn't bounce as much as Fakhar expected","Pradeep to Fakhar Zaman, no run",0,324358,Nuwan Pradeep,1,28,1,4.4,27,429738,Lakshan Sandakan,0,48,0,8.0,53,512191,Fakhar Zaman,73,83,7,1,227760,Sarfaraz Ahmed,1,2,0,0,4,False,0,0,0,0,0,30,2,1,False,,False,False,6.13,0,178,0,2,0,1,1,0,182
no run,7,Pakistan,8,Sri Lanka,2nd innings,0,"length ball on the stumps, pushes it back towards the bowler","Pradeep to Fakhar Zaman, no run",0,324358,Nuwan Pradeep,1,29,1,4.5,27,429738,Lakshan Sandakan,0,48,0,8.0,53,512191,Fakhar Zaman,73,84,7,1,227760,Sarfaraz Ahmed,1,2,0,0,5,False,0,0,0,0,0,30,2,1,False,,False,False,6.1,0,179,0,2,0,1,1,0,182
run,7,Pakistan,8,Sri Lanka,2nd innings,1,"length ball outside off, steers it towards third man","Pradeep to Fakhar Zaman, 1 run",0,324358,Nuwan Pradeep,1,30,1,5.0,28,429738,Lakshan Sandakan,0,48,0,8.0,53,512191,Fakhar Zaman,74,85,7,1,227760,Sarfaraz Ahmed,1,2,0,0,6,True,0,0,0,0,0,30,2,1,False,,False,False,6.1,0,180,0,2,0,1,1,0,183
run,7,Pakistan,8,Sri Lanka,2nd innings,1,"<b>dropped by Gunathilaka at first slip.</b> Fuller outside off, goes for a big booming drive, gets a thick outside edge to the right of Gunathilaka who goes one-handed but it doesn't stick","Sandakan to Fakhar Zaman, 1 run",0,429738,Lakshan Sandakan,0,49,0,8.1,54,324358,Nuwan Pradeep,1,30,1,5.0,28,512191,Fakhar Zaman,75,86,7,1,227760,Sarfaraz Ahmed,1,2,0,0,1,False,0,0,0,0,0,31,6,0,False,,False,False,6.09,0,181,0,2,0,1,1,0,184
wide,7,Pakistan,8,Sri Lanka,2nd innings,1,"fuller but way too outside off, Sarfaraz lets it go and collects a wide","Sandakan to Sarfaraz Ahmed, 1 wide",0,429738,Lakshan Sandakan,0,49,0,8.1,55,324358,Nuwan Pradeep,1,30,1,5.0,28,227760,Sarfaraz Ahmed,1,2,0,0,512191,Fakhar Zaman,75,86,7,1,2,False,0,0,1,0,0,31,6,0,False,,False,False,6.13,0,181,0,2,0,1,1,1,185
run,7,Pakistan,8,Sri Lanka,2nd innings,2,"fuller outside off, sweeps it towards deep-backward square leg","Sandakan to Sarfaraz Ahmed, 2 runs",0,429738,Lakshan Sandakan,0,50,0,8.2,57,324358,Nuwan Pradeep,1,30,1,5.0,28,227760,Sarfaraz Ahmed,3,3,0,0,512191,Fakhar Zaman,75,86,7,1,3,False,0,0,0,0,0,31,6,0,False,,False,False,6.16,0,182,0,2,0,1,1,0,187
no run,7,Pakistan,8,Sri Lanka,2nd innings,0,"length ball on the stumps, goes back and turns it towards square leg","Sandakan to Sarfaraz Ahmed, no run",0,429738,Lakshan Sandakan,0,51,0,8.3,57,324358,Nuwan Pradeep,1,30,1,5.0,28,227760,Sarfaraz Ahmed,3,4,0,0,512191,Fakhar Zaman,75,86,7,1,4,False,0,0,0,0,0,31,6,0,False,,False,False,6.13,0,183,0,2,0,1,1,0,187
bye,7,Pakistan,8,Sri Lanka,2nd innings,1,"fuller outside off, a googly this time, Sarfaraz was looking to work it on the leg side, misses but gets a bye as it bounces just in front of first slip who fails to make a clean stop","Sandakan to Sarfaraz Ahmed, 1 bye",0,429738,Lakshan Sandakan,0,52,0,8.4,57,324358,Nuwan Pradeep,1,30,1,5.0,28,227760,Sarfaraz Ahmed,3,5,0,0,512191,Fakhar Zaman,75,86,7,1,5,False,0,0,0,1,0,31,6,0,False,,False,False,6.13,1,184,0,2,0,1,1,0,188
no run,7,Pakistan,8,Sri Lanka,2nd innings,0,"length ball around off, punched back towards the bowler","Sandakan to Fakhar Zaman, no run",0,429738,Lakshan Sandakan,0,53,0,8.5,57,324358,Nuwan Pradeep,1,30,1,5.0,28,512191,Fakhar Zaman,75,87,7,1,227760,Sarfaraz Ahmed,3,5,0,0,6,False,0,0,0,0,0,31,6,0,False,,False,False,6.09,0,185,0,2,0,1,1,0,188
run,7,Pakistan,8,Sri Lanka,2nd innings,1,"fuller outside off, sweeps it towards deep midwicket","Sandakan to Fakhar Zaman, 1 run",0,429738,Lakshan Sandakan,0,54,0,9.0,58,324358,Nuwan Pradeep,1,30,1,5.0,28,512191,Fakhar Zaman,76,88,7,1,227760,Sarfaraz Ahmed,3,5,0,0,7,True,0,0,0,0,0,31,6,0,False,,False,False,6.09,0,186,0,2,0,1,1,0,189
no run,7,Pakistan,8,Sri Lanka,2nd innings,0,"length ball on middle and moving in, looks to flick but misses. The ball drops on the off side after hitting the thigh but the fielder was quick and prevents the single","Pradeep to Fakhar Zaman, no run",0,324358,Nuwan Pradeep,1,31,1,5.1,28,429738,Lakshan Sandakan,0,54,0,9.0,58,512191,Fakhar Zaman,76,89,7,1,227760,Sarfaraz Ahmed,3,5,0,0,1,False,0,0,0,0,0,32,1,1,False,,False,False,6.06,0,187,0,2,0,1,1,0,189
no run,7,Pakistan,8,Sri Lanka,2nd innings,0,"length ball angling in, stays in his crease and tucks it towards short midwicket","Pradeep to Fakhar Zaman, no run",0,324358,Nuwan Pradeep,1,32,1,5.2,28,429738,Lakshan Sandakan,0,54,0,9.0,58,512191,Fakhar Zaman,76,90,7,1,227760,Sarfaraz Ahmed,3,5,0,0,2,False,0,0,0,0,0,32,1,1,False,,False,False,6.03,0,188,0,2,0,1,1,0,189
out,7,Pakistan,8,Sri Lanka,2nd innings,0,"short of length outside off, goes for the upper cut but ends up hitting it towards the third man fielder. Shanaka takes a couple of steps diagonally to his left and takes it without any fuss","Pradeep to Fakhar Zaman, OUT",0,324358,Nuwan Pradeep,1,33,2,5.3,28,429738,Lakshan Sandakan,0,54,0,9.0,58,512191,Fakhar Zaman,76,91,7,1,227760,Sarfaraz Ahmed,3,5,0,0,3,False,0,0,0,0,0,32,1,1,True,caught,False,Fakhar Zaman c Shanaka b Pradeep 76 (91b 7x4 1x6) SR: 83.51,6.0,0,189,0,3,0,1,1,0,189
no run,7,Pakistan,8,Sri Lanka,2nd innings,0,"length ball outside off, defended from the front foot","Pradeep to Haris Sohail, no run",0,324358,Nuwan Pradeep,1,34,2,5.4,28,429738,Lakshan Sandakan,0,54,0,9.0,58,318788,Haris Sohail,0,1,0,0,227760,Sarfaraz Ahmed,3,5,0,0,4,False,0,0,0,0,0,32,1,1,False,,False,False,5.96,0,190,0,3,0,1,1,0,189
no run,7,Pakistan,8,Sri Lanka,2nd innings,0,"length ball around off, stays back and forces it towards short midwicket","Pradeep to Haris Sohail, no run",0,324358,Nuwan Pradeep,1,35,2,5.5,28,429738,Lakshan Sandakan,0,54,0,9.0,58,318788,Haris Sohail,0,2,0,0,227760,Sarfaraz Ahmed,3,5,0,0,5,False,0,0,0,0,0,32,1,1,False,,False,False,5.93,0,191,0,3,0,1,1,0,189
run,7,Pakistan,8,Sri Lanka,2nd innings,1,"length ball on the stumps, pushes it towards mid-on from the back foot","Pradeep to Haris Sohail, 1 run",0,324358,Nuwan Pradeep,1,36,2,6.0,29,429738,Lakshan Sandakan,0,54,0,9.0,58,318788,Haris Sohail,1,3,0,0,227760,Sarfaraz Ahmed,3,5,0,0,6,True,0,0,0,0,0,32,1,1,False,,False,False,5.93,0,192,0,3,0,1,1,0,190
run,7,Pakistan,8,Sri Lanka,2nd innings,1,"a googly from outside off, spinning back in but Haris does well to keep it out, works it towards covers","Sandakan to Haris Sohail, 1 run",0,429738,Lakshan Sandakan,0,55,0,9.1,59,324358,Nuwan Pradeep,1,36,2,6.0,29,318788,Haris Sohail,2,4,0,0,227760,Sarfaraz Ahmed,3,5,0,0,1,False,0,0,0,0,0,33,4,0,False,,False,False,5.93,0,193,0,3,0,1,1,0,191
no run,7,Pakistan,8,Sri Lanka,2nd innings,0,"fuller outside off, comes forward and drives it towards extra cover","Sandakan to Sarfaraz Ahmed, no run",0,429738,Lakshan Sandakan,0,56,0,9.2,59,324358,Nuwan Pradeep,1,36,2,6.0,29,227760,Sarfaraz Ahmed,3,6,0,0,318788,Haris Sohail,2,4,0,0,2,False,0,0,0,0,0,33,4,0,False,,False,False,5.9,0,194,0,3,0,1,1,0,191
no run,7,Pakistan,8,Sri Lanka,2nd innings,0,"fuller around off, driven straight back but Sandakan dives across to make the stop","Sandakan to Sarfaraz Ahmed, no run",0,429738,Lakshan Sandakan,0,57,0,9.3,59,324358,Nuwan Pradeep,1,36,2,6.0,29,227760,Sarfaraz Ahmed,3,7,0,0,318788,Haris Sohail,2,4,0,0,3,False,0,0,0,0,0,33,4,0,False,,False,False,5.87,0,195,0,3,0,1,1,0,191
run,7,Pakistan,8,Sri Lanka,2nd innings,1,"fuller on the stumps, flicks it towards midwicket","Sandakan to Sarfaraz Ahmed, 1 run",0,429738,Lakshan Sandakan,0,58,0,9.4,60,324358,Nuwan Pradeep,1,36,2,6.0,29,227760,Sarfaraz Ahmed,4,8,0,0,318788,Haris Sohail,2,4,0,0,4,False,0,0,0,0,0,33,4,0,False,,False,False,5.87,0,196,0,3,0,1,1,0,192
no run,7,Pakistan,8,Sri Lanka,2nd innings,0,"tossed up around off but too full, mistimes the flick towards backward square leg","Sandakan to Haris Sohail, no run",0,429738,Lakshan Sandakan,0,59,0,9.5,60,324358,Nuwan Pradeep,1,36,2,6.0,29,318788,Haris Sohail,2,5,0,0,227760,Sarfaraz Ahmed,4,8,0,0,5,False,0,0,0,0,0,33,4,0,False,,False,False,5.84,0,197,0,3,0,1,1,0,192
run,7,Pakistan,8,Sri Lanka,2nd innings,2,"another googly, goes back and punches it towards sweeper cover","Sandakan to Haris Sohail, 2 runs",0,429738,Lakshan Sandakan,0,60,0,10.0,62,324358,Nuwan Pradeep,1,36,2,6.0,29,318788,Haris Sohail,4,6,0,0,227760,Sarfaraz Ahmed,4,8,0,0,6,True,0,0,0,0,0,33,4,0,False,,False,False,5.87,0,198,0,3,0,1,1,0,194
no run,7,Pakistan,8,Sri Lanka,2nd innings,0,"full, just outside off, and tapped back to the bowler. Pradeep throws it back towards Sarfaraz, and the ball goes into the keeper's gloves","Pradeep to Sarfaraz Ahmed, no run",0,324358,Nuwan Pradeep,1,37,2,6.1,29,429738,Lakshan Sandakan,0,60,0,10.0,62,227760,Sarfaraz Ahmed,4,9,0,0,318788,Haris Sohail,4,6,0,0,1,False,0,0,0,0,0,34,7,0,False,,False,False,5.84,0,199,0,3,0,1,1,0,194
run,7,Pakistan,8,Sri Lanka,2nd innings,1,"length ball, outside off, and guided with the bat's open face to deep point","Pradeep to Sarfaraz Ahmed, 1 run",0,324358,Nuwan Pradeep,1,38,2,6.2,30,429738,Lakshan Sandakan,0,60,0,10.0,62,227760,Sarfaraz Ahmed,5,10,0,0,318788,Haris Sohail,4,6,0,0,2,False,0,0,0,0,0,34,7,0,False,,False,False,5.85,0,200,0,3,0,1,1,0,195
run,7,Pakistan,8,Sri Lanka,2nd innings,1,"length ball, angling in from outside off stump. Tapped with soft hands","Pradeep to Haris Sohail, 1 run",0,324358,Nuwan Pradeep,1,39,2,6.3,31,429738,Lakshan Sandakan,0,60,0,10.0,62,318788,Haris Sohail,5,7,0,0,227760,Sarfaraz Ahmed,5,10,0,0,3,False,0,0,0,0,0,34,7,0,False,,False,False,5.85,0,201,0,3,0,1,1,0,196
run,7,Pakistan,8,Sri Lanka,2nd innings,1,"full, on middle, and clipped off his pads to deep midwicket","Pradeep to Sarfaraz Ahmed, 1 run",0,324358,Nuwan Pradeep,1,40,2,6.4,32,429738,Lakshan Sandakan,0,60,0,10.0,62,227760,Sarfaraz Ahmed,6,11,0,0,318788,Haris Sohail,5,7,0,0,4,False,0,0,0,0,0,34,7,0,False,,False,False,5.85,0,202,0,3,0,1,1,0,197
no run,7,Pakistan,8,Sri Lanka,2nd innings,0,"full, on off, and he taps the slower ball away to mid-on","Pradeep to Haris Sohail, no run",0,324358,Nuwan Pradeep,1,41,2,6.5,32,429738,Lakshan Sandakan,0,60,0,10.0,62,318788,Haris Sohail,5,8,0,0,227760,Sarfaraz Ahmed,6,11,0,0,5,False,0,0,0,0,0,34,7,0,False,,False,False,5.82,0,203,0,3,0,1,1,0,197
four,7,Pakistan,8,Sri Lanka,2nd innings,4,"full, on off, and flicked into the gap near deep midwicket. Misfield from Jayasuriya in the deep gives Pakistan two free runs","Pradeep to Haris Sohail, FOUR runs",0,324358,Nuwan Pradeep,1,42,2,7.0,36,429738,Lakshan Sandakan,0,60,0,10.0,62,318788,Haris Sohail,9,9,1,0,227760,Sarfaraz Ahmed,6,11,0,0,6,True,0,0,0,0,0,34,7,0,False,,False,False,5.91,0,204,0,3,0,1,1,0,201
run,7,Pakistan,8,Sri Lanka,2nd innings,1,"length ball, outside off and turning further away. Flat-batted to mid-off","de Silva to Sarfaraz Ahmed, 1 run",0,784379,Wanindu Hasaranga,0,43,1,7.1,38,324358,Nuwan Pradeep,1,42,2,7.0,36,227760,Sarfaraz Ahmed,7,12,0,0,318788,Haris Sohail,9,9,1,0,1,False,0,0,0,0,0,35,4,0,False,,False,False,5.91,0,205,0,3,0,1,1,0,202
run,7,Pakistan,8,Sri Lanka,2nd innings,2,"another length ball outside off, and cut through to the fielder in the deep. Enough time to jog back for the second run","de Silva to Haris Sohail, 2 runs",0,784379,Wanindu Hasaranga,0,44,1,7.2,40,324358,Nuwan Pradeep,1,42,2,7.0,36,318788,Haris Sohail,11,10,1,0,227760,Sarfaraz Ahmed,7,12,0,0,2,False,0,0,0,0,0,35,4,0,False,,False,False,5.94,0,206,0,3,0,1,1,0,204
run,7,Pakistan,8,Sri Lanka,2nd innings,1,"googly on middle stump, and turning away. Tapped to mid-off off the back foot","de Silva to Haris Sohail, 1 run",0,784379,Wanindu Hasaranga,0,45,1,7.3,41,324358,Nuwan Pradeep,1,42,2,7.0,36,318788,Haris Sohail,12,11,1,0,227760,Sarfaraz Ahmed,7,12,0,0,3,False,0,0,0,0,0,35,4,0,False,,False,False,5.94,0,207,0,3,0,1,1,0,205
no run,7,Pakistan,8,Sri Lanka,2nd innings,0,"length ball, outside off stump. Cut square to the fielder at point","de Silva to Sarfaraz Ahmed, no run",0,784379,Wanindu Hasaranga,0,46,1,7.4,41,324358,Nuwan Pradeep,1,42,2,7.0,36,227760,Sarfaraz Ahmed,7,13,0,0,318788,Haris Sohail,12,11,1,0,4,False,0,0,0,0,0,35,4,0,False,,False,False,5.91,0,208,0,3,0,1,1,0,205
no run,7,Pakistan,8,Sri Lanka,2nd innings,0,"full, just outside off stump. Defended","de Silva to Sarfaraz Ahmed, no run",0,784379,Wanindu Hasaranga,0,47,1,7.5,41,324358,Nuwan Pradeep,1,42,2,7.0,36,227760,Sarfaraz Ahmed,7,14,0,0,318788,Haris Sohail,12,11,1,0,5,False,0,0,0,0,0,35,4,0,False,,False,False,5.88,0,209,0,3,0,1,1,0,205
no run,7,Pakistan,8,Sri Lanka,2nd innings,0,"full outside off, but the googly spins inwards. Defended with soft hands","de Silva to Sarfaraz Ahmed, no run",0,784379,Wanindu Hasaranga,0,48,1,8.0,41,324358,Nuwan Pradeep,1,42,2,7.0,36,227760,Sarfaraz Ahmed,7,15,0,0,318788,Haris Sohail,12,11,1,0,6,True,0,0,0,0,0,35,4,0,False,,False,False,5.85,0,210,0,3,0,1,1,0,205
no run,7,Pakistan,8,Sri Lanka,2nd innings,0,"full pitched on middle stump, and tapped off the back foot to the off side","Shanaka to Haris Sohail, no run",0,437316,Dasun Shanaka,0,19,0,3.1,13,784379,Wanindu Hasaranga,0,48,1,8.0,41,318788,Haris Sohail,12,12,1,0,227760,Sarfaraz Ahmed,7,15,0,0,1,False,0,0,0,0,0,36,7,0,False,,False,False,5.82,0,211,0,3,0,1,1,0,205
run,7,Pakistan,8,Sri Lanka,2nd innings,2,"full, just outside off, and driven to deep extra cover","Shanaka to Haris Sohail, 2 runs",0,437316,Dasun Shanaka,0,20,0,3.2,15,784379,Wanindu Hasaranga,0,48,1,8.0,41,318788,Haris Sohail,14,13,1,0,227760,Sarfaraz Ahmed,7,15,0,0,2,False,0,0,0,0,0,36,7,0,False,,False,False,5.85,0,212,0,3,0,1,1,0,207
run,7,Pakistan,8,Sri Lanka,2nd innings,2,"full, just outside off stump. Driven through to deep point","Shanaka to Haris Sohail, 2 runs",0,437316,Dasun Shanaka,0,21,0,3.3,17,784379,Wanindu Hasaranga,0,48,1,8.0,41,318788,Haris Sohail,16,14,1,0,227760,Sarfaraz Ahmed,7,15,0,0,3,False,0,0,0,0,0,36,7,0,False,,False,False,5.88,0,213,0,3,0,1,1,0,209
run,7,Pakistan,8,Sri Lanka,2nd innings,2,,"Shanaka to Haris Sohail, 2 runs",0,437316,Dasun Shanaka,0,22,0,3.4,19,784379,Wanindu Hasaranga,0,48,1,8.0,41,318788,Haris Sohail,18,15,1,0,227760,Sarfaraz Ahmed,7,15,0,0,4,False,0,0,0,0,0,36,7,0,False,,False,False,5.91,0,214,0,3,0,1,1,0,211
run,7,Pakistan,8,Sri Lanka,2nd innings,1,"full, on off stump. Defended towards cover","Shanaka to Haris Sohail, 1 run",0,437316,Dasun Shanaka,0,23,0,3.5,20,784379,Wanindu Hasaranga,0,48,1,8.0,41,318788,Haris Sohail,19,16,1,0,227760,Sarfaraz Ahmed,7,15,0,0,5,False,0,0,0,0,0,36,7,0,False,,False,False,5.91,0,215,0,3,0,1,1,0,212
