PlayType_description,Batting_Team_id,Batting_Team_name,Bowling_Team_id,Bowling_Team_name,Innings,Total_Runs_on_delivery,Commentary,Commentary_short,Score,Bowler_id,Bowler_name,Bowler_maiden,Bowler_balls,Bowler_wickets,Bowler_over,Bowler_conceded,Other_Bowler_id,Other_Bowler_name,Other_Bowler_maidens,Other_Bowler_balls,Other_Bowler_wickets,Other_Bowler_overs,Other_Bowler_conceded,Batsman_id,Batsman_name,Batsman_runs,Batsman_balls_faced,Batsman_four,Batsman_sixes,Other_Batsman_id,Other_Batsman_name,Other_Batsman_runs,Other_Batsman_balls_faced,Other_Batsman_four,Other_Batsman_sixes,Over_ball,Over_complete,Over_maiden,Over_no_Ball,Over_wide,Over_byes,Over_leg_byes,Over_number,Over_runs,Over_wickets,Dismissal_is_true,Dismissal_type,Dismissal_fielder_iskeeper,Dismissal_text,Innings_run_rate,Innings_byes,Innings_balls,Innings_no_balls,Innings_wickets,Innings_leg_byes,Innings_session,Innings_day,Innings_wides,Innings_runs
run,8,Sri Lanka,7,Pakistan,1st innings,1,"fuller on the stumps, a hint of swing away, pushed towards mid-off for a quick single","Mohammad Amir to Gunathilaka, 1 run",1/0,290948,Mohammad Amir,0,1,0,0.1,1,False,False,0,0,0,False,0,345821,Danushka Gunathilaka,1,1,0,0,784369,Avishka Fernando,0,0,0,0,1,False,0,0,0,0,0,1,5,0,False,,False,False,6.0,0,1,0,0,0,1,1,0,1
no run,8,Sri Lanka,7,Pakistan,1st innings,0,"length ball around off, comes forward and taps it towards extra cover","Mohammad Amir to Fernando, no run",1/0,290948,Mohammad Amir,0,2,0,0.2,1,False,False,0,0,0,False,0,784369,Avishka Fernando,0,1,0,0,345821,Danushka Gunathilaka,1,1,0,0,2,False,0,0,0,0,0,1,5,0,False,,False,False,3.0,0,2,0,0,0,1,1,0,1
no run,8,Sri Lanka,7,Pakistan,1st innings,0,"length around off, tapped towards covers from the front foot","Mohammad Amir to Fernando, no run",1/0,290948,Mohammad Amir,0,3,0,0.3,1,False,False,0,0,0,False,0,784369,Avishka Fernando,0,2,0,0,345821,Danushka Gunathilaka,1,1,0,0,3,False,0,0,0,0,0,1,5,0,False,,False,False,2.0,0,3,0,0,0,1,1,0,1
no run,8,Sri Lanka,7,Pakistan,1st innings,0,"length again, a touch straighter this time, defended towards mid-on this time","Mohammad Amir to Fernando, no run",1/0,290948,Mohammad Amir,0,4,0,0.4,1,False,False,0,0,0,False,0,784369,Avishka Fernando,0,3,0,0,345821,Danushka Gunathilaka,1,1,0,0,4,False,0,0,0,0,0,1,5,0,False,,False,False,1.5,0,4,0,0,0,1,1,0,1
four,8,Sri Lanka,7,Pakistan,1st innings,4,"a touch fuller this time, Fernando pushes at it half-heatedly, ends up chipping down the ground but well away and to the right of mid-off, dribbles towards the boundary","Mohammad Amir to Fernando, FOUR runs",5/0,290948,Mohammad Amir,0,5,0,0.5,5,False,False,0,0,0,False,0,784369,Avishka Fernando,4,4,1,0,345821,Danushka Gunathilaka,1,1,0,0,5,False,0,0,0,0,0,1,5,0,False,,False,False,6.0,0,5,0,0,0,1,1,0,5
no run,8,Sri Lanka,7,Pakistan,1st innings,0,"length ball from Amir, just around the off stump, comes forward and taps it towards mid-off","Mohammad Amir to Fernando, no run",5/0,290948,Mohammad Amir,0,6,0,1.0,5,False,False,0,0,0,False,0,784369,Avishka Fernando,4,5,1,0,345821,Danushka Gunathilaka,1,1,0,0,6,True,0,0,0,0,0,1,5,0,False,,False,False,5.0,0,6,0,0,0,1,1,0,5
four,8,Sri Lanka,7,Pakistan,1st innings,4,"length ball but angling on to the pads, flicked away to beat the fine leg fielder for four","Usman Shinwari to Gunathilaka, FOUR runs",9/0,697279,Usman Shinwari,0,1,0,0.1,4,290948,Mohammad Amir,0,6,0,1.0,5,345821,Danushka Gunathilaka,5,2,1,0,784369,Avishka Fernando,4,5,1,0,1,False,0,0,0,0,0,2,8,0,False,,False,False,7.71,0,7,0,0,0,1,1,0,9
no run,8,Sri Lanka,7,Pakistan,1st innings,0,"corrects his line this time. Length ball around off, defended down the wicket","Usman Shinwari to Gunathilaka, no run",9/0,697279,Usman Shinwari,0,2,0,0.2,4,290948,Mohammad Amir,0,6,0,1.0,5,345821,Danushka Gunathilaka,5,3,1,0,784369,Avishka Fernando,4,5,1,0,2,False,0,0,0,0,0,2,8,0,False,,False,False,6.75,0,8,0,0,0,1,1,0,9
no run,8,Sri Lanka,7,Pakistan,1st innings,0,"fuller around off, flicked again but short midwicket comes in the picture","Usman Shinwari to Gunathilaka, no run",9/0,697279,Usman Shinwari,0,3,0,0.3,4,290948,Mohammad Amir,0,6,0,1.0,5,345821,Danushka Gunathilaka,5,4,1,0,784369,Avishka Fernando,4,5,1,0,3,False,0,0,0,0,0,2,8,0,False,,False,False,6.0,0,9,0,0,0,1,1,0,9
no run,8,Sri Lanka,7,Pakistan,1st innings,0,"length ball in the corridor, comes forward and leaves it alone","Usman Shinwari to Gunathilaka, no run",9/0,697279,Usman Shinwari,0,4,0,0.4,4,290948,Mohammad Amir,0,6,0,1.0,5,345821,Danushka Gunathilaka,5,5,1,0,784369,Avishka Fernando,4,5,1,0,4,False,0,0,0,0,0,2,8,0,False,,False,False,5.4,0,10,0,0,0,1,1,0,9
four,8,Sri Lanka,7,Pakistan,1st innings,4,"length ball, some room outside off, Gunathilaka stands tall and punches it through covers for the second four of the over","Usman Shinwari to Gunathilaka, FOUR runs",13/0,697279,Usman Shinwari,0,5,0,0.5,8,290948,Mohammad Amir,0,6,0,1.0,5,345821,Danushka Gunathilaka,9,6,2,0,784369,Avishka Fernando,4,5,1,0,5,False,0,0,0,0,0,2,8,0,False,,False,False,7.09,0,11,0,0,0,1,1,0,13
no run,8,Sri Lanka,7,Pakistan,1st innings,0,"fuller around off, comes forward and pushes it towards extra cover with the full face of the bat, cannot find the gap though","Usman Shinwari to Gunathilaka, no run",13/0,697279,Usman Shinwari,0,6,0,1.0,8,290948,Mohammad Amir,0,6,0,1.0,5,345821,Danushka Gunathilaka,9,7,2,0,784369,Avishka Fernando,4,5,1,0,6,True,0,0,0,0,0,2,8,0,False,,False,False,6.5,0,12,0,0,0,1,1,0,13
out,8,Sri Lanka,7,Pakistan,1st innings,0,"and there's an edge. A length ball around off, Fernando was playing on the walk, pushing at it without reaching to the pitch. The ball angles across him and a regulation catch for Sarfaraz behind the stumps","Mohammad Amir to Fernando, OUT",13/1,290948,Mohammad Amir,0,7,1,1.1,5,697279,Usman Shinwari,0,6,0,1.0,8,784369,Avishka Fernando,4,6,1,0,345821,Danushka Gunathilaka,9,7,2,0,1,False,0,0,0,0,0,3,4,1,True,caught,False,WIA Fernando c &dagger;Sarfaraz Ahmed b Mohammad Amir 4 (6b 1x4 0x6) SR: 66.66,6.0,0,13,0,1,0,1,1,0,13
four,8,Sri Lanka,7,Pakistan,1st innings,4,"fuller on the leg stump, pushed to the left of mid-on, Wahab chases it all the way before putting in a slide but think his foot was touching the boundary line as he pushed the ball in. A bit sloppy from the fast bowler, I will have to say","Mohammad Amir to Thirimanne, FOUR runs",17/1,290948,Mohammad Amir,0,8,1,1.2,9,697279,Usman Shinwari,0,6,0,1.0,8,301236,Lahiru Thirimanne,4,1,1,0,345821,Danushka Gunathilaka,9,7,2,0,2,False,0,0,0,0,0,3,4,1,False,,False,False,7.28,0,14,0,1,0,1,1,0,17
no run,8,Sri Lanka,7,Pakistan,1st innings,0,"length ball on the stumps, gets behind it and defends with the full face of the bat","Mohammad Amir to Thirimanne, no run",17/1,290948,Mohammad Amir,0,9,1,1.3,9,697279,Usman Shinwari,0,6,0,1.0,8,301236,Lahiru Thirimanne,4,2,1,0,345821,Danushka Gunathilaka,9,7,2,0,3,False,0,0,0,0,0,3,4,1,False,,False,False,6.8,0,15,0,1,0,1,1,0,17
no run,8,Sri Lanka,7,Pakistan,1st innings,0,"length ball around off, some extra bounce there as well. Thirimanne was pushing at it, gets an inside edge on to the pad","Mohammad Amir to Thirimanne, no run",17/1,290948,Mohammad Amir,0,10,1,1.4,9,697279,Usman Shinwari,0,6,0,1.0,8,301236,Lahiru Thirimanne,4,3,1,0,345821,Danushka Gunathilaka,9,7,2,0,4,False,0,0,0,0,0,3,4,1,False,,False,False,6.37,0,16,0,1,0,1,1,0,17
no run,8,Sri Lanka,7,Pakistan,1st innings,0,"a touch fuller around off, defend towards short midwicket from the crease","Mohammad Amir to Thirimanne, no run",17/1,290948,Mohammad Amir,0,11,1,1.5,9,697279,Usman Shinwari,0,6,0,1.0,8,301236,Lahiru Thirimanne,4,4,1,0,345821,Danushka Gunathilaka,9,7,2,0,5,False,0,0,0,0,0,3,4,1,False,,False,False,6.0,0,17,0,1,0,1,1,0,17
no run,8,Sri Lanka,7,Pakistan,1st innings,0,"length ball around fourth stump, a big stride forward and a solid block","Mohammad Amir to Thirimanne, no run",17/1,290948,Mohammad Amir,0,12,1,2.0,9,697279,Usman Shinwari,0,6,0,1.0,8,301236,Lahiru Thirimanne,4,5,1,0,345821,Danushka Gunathilaka,9,7,2,0,6,True,0,0,0,0,0,3,4,1,False,,False,False,5.66,0,18,0,1,0,1,1,0,17
no run,8,Sri Lanka,7,Pakistan,1st innings,0,"length ball around off, punched off the back foot towards extra cover","Usman Shinwari to Gunathilaka, no run",17/1,697279,Usman Shinwari,0,7,0,1.1,8,290948,Mohammad Amir,0,12,1,2.0,9,345821,Danushka Gunathilaka,9,8,2,0,301236,Lahiru Thirimanne,4,5,1,0,1,False,1,0,0,0,0,4,0,0,False,,False,False,5.36,0,19,0,1,0,1,1,0,17
no run,8,Sri Lanka,7,Pakistan,1st innings,0,"fuller around off, driven firmly down the ground but Shinwari fields it in his follow through","Usman Shinwari to Gunathilaka, no run",17/1,697279,Usman Shinwari,0,8,0,1.2,8,290948,Mohammad Amir,0,12,1,2.0,9,345821,Danushka Gunathilaka,9,9,2,0,301236,Lahiru Thirimanne,4,5,1,0,2,False,1,0,0,0,0,4,0,0,False,,False,False,5.1,0,20,0,1,0,1,1,0,17
no run,8,Sri Lanka,7,Pakistan,1st innings,0,"fuller around off, drives from the front foot but gets a thick outside edge towards point, Shadab dives full length to his right to make the stop. One of the best fielders around in that region","Usman Shinwari to Gunathilaka, no run",17/1,697279,Usman Shinwari,0,9,0,1.3,8,290948,Mohammad Amir,0,12,1,2.0,9,345821,Danushka Gunathilaka,9,10,2,0,301236,Lahiru Thirimanne,4,5,1,0,3,False,1,0,0,0,0,4,0,0,False,,False,False,4.85,0,21,0,1,0,1,1,0,17
no run,8,Sri Lanka,7,Pakistan,1st innings,0,"<b>beaten!</b> Fuller outside off, inviting the drive once again. Gunathilaka was walking into the shot, was playing down the wrong line too and fails to make any contact","Usman Shinwari to Gunathilaka, no run",17/1,697279,Usman Shinwari,0,10,0,1.4,8,290948,Mohammad Amir,0,12,1,2.0,9,345821,Danushka Gunathilaka,9,11,2,0,301236,Lahiru Thirimanne,4,5,1,0,4,False,1,0,0,0,0,4,0,0,False,,False,False,4.63,0,22,0,1,0,1,1,0,17
no run,8,Sri Lanka,7,Pakistan,1st innings,0,"<b>Shadab again.</b> Fuller and driven in the point direction but Shadab is excellent once again, another dive to his right to make the partial stop and that's enough to prevent any runs","Usman Shinwari to Gunathilaka, no run",17/1,697279,Usman Shinwari,0,11,0,1.5,8,290948,Mohammad Amir,0,12,1,2.0,9,345821,Danushka Gunathilaka,9,12,2,0,301236,Lahiru Thirimanne,4,5,1,0,5,False,1,0,0,0,0,4,0,0,False,,False,False,4.43,0,23,0,1,0,1,1,0,17
no run,8,Sri Lanka,7,Pakistan,1st innings,0,"<b>and that's a maiden.</b> A length ball around off, Gunathilaka comes forward and taps it towards covers","Usman Shinwari to Gunathilaka, no run",17/1,697279,Usman Shinwari,1,12,0,2.0,8,290948,Mohammad Amir,0,12,1,2.0,9,345821,Danushka Gunathilaka,9,13,2,0,301236,Lahiru Thirimanne,4,5,1,0,6,True,1,0,0,0,0,4,0,0,False,,False,False,4.25,0,24,0,1,0,1,1,0,17
no run,8,Sri Lanka,7,Pakistan,1st innings,0,"a slower one from Amir, fuller around off, Thirimanne defends it from the front foot","Mohammad Amir to Thirimanne, no run",17/1,290948,Mohammad Amir,0,13,1,2.1,9,697279,Usman Shinwari,1,12,0,2.0,8,301236,Lahiru Thirimanne,4,6,1,0,345821,Danushka Gunathilaka,9,13,2,0,1,False,0,0,0,0,0,5,6,0,False,,False,False,4.08,0,25,0,1,0,1,1,0,17
run,8,Sri Lanka,7,Pakistan,1st innings,1,"length ball on the pads, tucked away towards fine leg","Mohammad Amir to Thirimanne, 1 run",18/1,290948,Mohammad Amir,0,14,1,2.2,10,697279,Usman Shinwari,1,12,0,2.0,8,301236,Lahiru Thirimanne,5,7,1,0,345821,Danushka Gunathilaka,9,13,2,0,2,False,0,0,0,0,0,5,6,0,False,,False,False,4.15,0,26,0,1,0,1,1,0,18
four,8,Sri Lanka,7,Pakistan,1st innings,4,"short outside off but not that quick and Gunathilaka swivels to pull it in front of the square leg, rolling his hands over it to keep it down","Mohammad Amir to Gunathilaka, FOUR runs",22/1,290948,Mohammad Amir,0,15,1,2.3,14,697279,Usman Shinwari,1,12,0,2.0,8,345821,Danushka Gunathilaka,13,14,3,0,301236,Lahiru Thirimanne,5,7,1,0,3,False,0,0,0,0,0,5,6,0,False,,False,False,4.88,0,27,0,1,0,1,1,0,22
run,8,Sri Lanka,7,Pakistan,1st innings,1,"length ball outside off, tapped towards point but a fumble from Shadab this time allows the batsman a single","Mohammad Amir to Gunathilaka, 1 run",23/1,290948,Mohammad Amir,0,16,1,2.4,15,697279,Usman Shinwari,1,12,0,2.0,8,345821,Danushka Gunathilaka,14,15,3,0,301236,Lahiru Thirimanne,5,7,1,0,4,False,0,0,0,0,0,5,6,0,False,,False,False,4.92,0,28,0,1,0,1,1,0,23
no run,8,Sri Lanka,7,Pakistan,1st innings,0,"length ball around off and middle, defended from the back foot","Mohammad Amir to Thirimanne, no run",23/1,290948,Mohammad Amir,0,17,1,2.5,15,697279,Usman Shinwari,1,12,0,2.0,8,301236,Lahiru Thirimanne,5,8,1,0,345821,Danushka Gunathilaka,14,15,3,0,5,False,0,0,0,0,0,5,6,0,False,,False,False,4.75,0,29,0,1,0,1,1,0,23
no run,8,Sri Lanka,7,Pakistan,1st innings,0,"length ball around off, stays in his crease and taps it towards covers","Mohammad Amir to Thirimanne, no run",23/1,290948,Mohammad Amir,0,18,1,3.0,15,697279,Usman Shinwari,1,12,0,2.0,8,301236,Lahiru Thirimanne,5,9,1,0,345821,Danushka Gunathilaka,14,15,3,0,6,True,0,0,0,0,0,5,6,0,False,,False,False,4.6,0,30,0,1,0,1,1,0,23
four,8,Sri Lanka,7,Pakistan,1st innings,4,"fuller around off, Gunathilaka puts a stride forward and drives it imperiously through extra cover, lovely timing and balance on that","Usman Shinwari to Gunathilaka, FOUR runs",27/1,697279,Usman Shinwari,1,13,0,2.1,12,290948,Mohammad Amir,0,18,1,3.0,15,345821,Danushka Gunathilaka,18,16,4,0,301236,Lahiru Thirimanne,5,9,1,0,1,False,0,0,0,0,0,6,9,0,False,,False,False,5.22,0,31,0,1,0,1,1,0,27
no run,8,Sri Lanka,7,Pakistan,1st innings,0,"length ball around off, taps it towards covers from the front foot","Usman Shinwari to Gunathilaka, no run",27/1,697279,Usman Shinwari,1,14,0,2.2,12,290948,Mohammad Amir,0,18,1,3.0,15,345821,Danushka Gunathilaka,18,17,4,0,301236,Lahiru Thirimanne,5,9,1,0,2,False,0,0,0,0,0,6,9,0,False,,False,False,5.06,0,32,0,1,0,1,1,0,27
run,8,Sri Lanka,7,Pakistan,1st innings,1,"Shinwari goes short this time but Gunathilaka is once again up to it, pulls it down towards deep square leg, only a single this time though","Usman Shinwari to Gunathilaka, 1 run",28/1,697279,Usman Shinwari,1,15,0,2.3,13,290948,Mohammad Amir,0,18,1,3.0,15,345821,Danushka Gunathilaka,19,18,4,0,301236,Lahiru Thirimanne,5,9,1,0,3,False,0,0,0,0,0,6,9,0,False,,False,False,5.09,0,33,0,1,0,1,1,0,28
no run,8,Sri Lanka,7,Pakistan,1st innings,0,"length ball around off, defends it on the off side from the crease","Usman Shinwari to Thirimanne, no run",28/1,697279,Usman Shinwari,1,16,0,2.4,13,290948,Mohammad Amir,0,18,1,3.0,15,301236,Lahiru Thirimanne,5,10,1,0,345821,Danushka Gunathilaka,19,18,4,0,4,False,0,0,0,0,0,6,9,0,False,,False,False,4.94,0,34,0,1,0,1,1,0,28
no run,8,Sri Lanka,7,Pakistan,1st innings,0,"length ball around off, opens the face of the bat this time to work it towards point","Usman Shinwari to Thirimanne, no run",28/1,697279,Usman Shinwari,1,17,0,2.5,13,290948,Mohammad Amir,0,18,1,3.0,15,301236,Lahiru Thirimanne,5,11,1,0,345821,Danushka Gunathilaka,19,18,4,0,5,False,0,0,0,0,0,6,9,0,False,,False,False,4.8,0,35,0,1,0,1,1,0,28
four,8,Sri Lanka,7,Pakistan,1st innings,4,"<b> a scorching drive through covers.</b> Fuller around off once again and Thirimanne gets into the act this time, leaning into the shot to end the over in the same manner it started","Usman Shinwari to Thirimanne, FOUR runs",32/1,697279,Usman Shinwari,1,18,0,3.0,17,290948,Mohammad Amir,0,18,1,3.0,15,301236,Lahiru Thirimanne,9,12,2,0,345821,Danushka Gunathilaka,19,18,4,0,6,True,0,0,0,0,0,6,9,0,False,,False,False,5.33,0,36,0,1,0,1,1,0,32
wide,8,Sri Lanka,7,Pakistan,1st innings,1,"length ball but down the leg side, needs to be bowled again","Mohammad Amir to Gunathilaka, 1 wide",33/1,290948,Mohammad Amir,0,18,1,3.0,16,697279,Usman Shinwari,1,18,0,3.0,17,345821,Danushka Gunathilaka,19,18,4,0,301236,Lahiru Thirimanne,9,12,2,0,1,False,0,0,1,0,0,7,3,0,False,,False,False,5.5,0,36,0,1,0,1,1,1,33
run,8,Sri Lanka,7,Pakistan,1st innings,1,length ball on the pads tucked away in front of square leg,"Mohammad Amir to Gunathilaka, 1 run",34/1,290948,Mohammad Amir,0,19,1,3.1,17,697279,Usman Shinwari,1,18,0,3.0,17,345821,Danushka Gunathilaka,20,19,4,0,301236,Lahiru Thirimanne,9,12,2,0,2,False,0,0,0,0,0,7,3,0,False,,False,False,5.51,0,37,0,1,0,1,1,0,34
no run,8,Sri Lanka,7,Pakistan,1st innings,0,"short of length on the off stump, goes back on his toes and drops it at his feet with soft hands","Mohammad Amir to Thirimanne, no run",34/1,290948,Mohammad Amir,0,20,1,3.2,17,697279,Usman Shinwari,1,18,0,3.0,17,301236,Lahiru Thirimanne,9,13,2,0,345821,Danushka Gunathilaka,20,19,4,0,3,False,0,0,0,0,0,7,3,0,False,,False,False,5.36,0,38,0,1,0,1,1,0,34
no run,8,Sri Lanka,7,Pakistan,1st innings,0,"length ball around off, defends it from the crease","Mohammad Amir to Thirimanne, no run",34/1,290948,Mohammad Amir,0,21,1,3.3,17,697279,Usman Shinwari,1,18,0,3.0,17,301236,Lahiru Thirimanne,9,14,2,0,345821,Danushka Gunathilaka,20,19,4,0,4,False,0,0,0,0,0,7,3,0,False,,False,False,5.23,0,39,0,1,0,1,1,0,34
no run,8,Sri Lanka,7,Pakistan,1st innings,0,"fuller on the stumps, pushes it towards mid-on this time","Mohammad Amir to Thirimanne, no run",34/1,290948,Mohammad Amir,0,22,1,3.4,17,697279,Usman Shinwari,1,18,0,3.0,17,301236,Lahiru Thirimanne,9,15,2,0,345821,Danushka Gunathilaka,20,19,4,0,5,False,0,0,0,0,0,7,3,0,False,,False,False,5.1,0,40,0,1,0,1,1,0,34
run,8,Sri Lanka,7,Pakistan,1st innings,1,"length ball around off, steers it towards third man by opening the face of the bat","Mohammad Amir to Thirimanne, 1 run",35/1,290948,Mohammad Amir,0,23,1,3.5,18,697279,Usman Shinwari,1,18,0,3.0,17,301236,Lahiru Thirimanne,10,16,2,0,345821,Danushka Gunathilaka,20,19,4,0,6,False,0,0,0,0,0,7,3,0,False,,False,False,5.12,0,41,0,1,0,1,1,0,35
no run,8,Sri Lanka,7,Pakistan,1st innings,0,"fuller around off, comes forward and pushes it tentatively towards mid-off","Mohammad Amir to Gunathilaka, no run",35/1,290948,Mohammad Amir,0,24,1,4.0,18,697279,Usman Shinwari,1,18,0,3.0,17,345821,Danushka Gunathilaka,20,20,4,0,301236,Lahiru Thirimanne,10,16,2,0,7,True,0,0,0,0,0,7,3,0,False,,False,False,5.0,0,42,0,1,0,1,1,0,35
no run,8,Sri Lanka,7,Pakistan,1st innings,0,"fuller around off, defended from the front foot","Iftikhar Ahmed to Thirimanne, no run",35/1,480603,Iftikhar Ahmed,0,1,0,0.1,0,290948,Mohammad Amir,0,24,1,4.0,18,301236,Lahiru Thirimanne,10,17,2,0,345821,Danushka Gunathilaka,20,20,4,0,1,False,1,0,0,0,0,8,0,0,False,,False,False,4.88,0,43,0,1,0,1,1,0,35
no run,8,Sri Lanka,7,Pakistan,1st innings,0,"flatter and fuller on the pads this time, pushed towards short midwicket","Iftikhar Ahmed to Thirimanne, no run",35/1,480603,Iftikhar Ahmed,0,2,0,0.2,0,290948,Mohammad Amir,0,24,1,4.0,18,301236,Lahiru Thirimanne,10,18,2,0,345821,Danushka Gunathilaka,20,20,4,0,2,False,1,0,0,0,0,8,0,0,False,,False,False,4.77,0,44,0,1,0,1,1,0,35
no run,8,Sri Lanka,7,Pakistan,1st innings,0,"length ball around off, comes forward and defends right under his eyes","Iftikhar Ahmed to Thirimanne, no run",35/1,480603,Iftikhar Ahmed,0,3,0,0.3,0,290948,Mohammad Amir,0,24,1,4.0,18,301236,Lahiru Thirimanne,10,19,2,0,345821,Danushka Gunathilaka,20,20,4,0,3,False,1,0,0,0,0,8,0,0,False,,False,False,4.66,0,45,0,1,0,1,1,0,35
no run,8,Sri Lanka,7,Pakistan,1st innings,0,"length ball around off, pushes towards covers from the front foot","Iftikhar Ahmed to Thirimanne, no run",35/1,480603,Iftikhar Ahmed,0,4,0,0.4,0,290948,Mohammad Amir,0,24,1,4.0,18,301236,Lahiru Thirimanne,10,20,2,0,345821,Danushka Gunathilaka,20,20,4,0,4,False,1,0,0,0,0,8,0,0,False,,False,False,4.56,0,46,0,1,0,1,1,0,35
no run,8,Sri Lanka,7,Pakistan,1st innings,0,"short of length around off, punched towards mid-on from the back foot","Iftikhar Ahmed to Thirimanne, no run",35/1,480603,Iftikhar Ahmed,0,5,0,0.5,0,290948,Mohammad Amir,0,24,1,4.0,18,301236,Lahiru Thirimanne,10,21,2,0,345821,Danushka Gunathilaka,20,20,4,0,5,False,1,0,0,0,0,8,0,0,False,,False,False,4.46,0,47,0,1,0,1,1,0,35
no run,8,Sri Lanka,7,Pakistan,1st innings,0,"<b>and he starts with a maiden.</b> Short of length outside off, goes for the cut but gets a thick outside edge, Amir makes a stop to his right at short third man","Iftikhar Ahmed to Thirimanne, no run",35/1,480603,Iftikhar Ahmed,1,6,0,1.0,0,290948,Mohammad Amir,0,24,1,4.0,18,301236,Lahiru Thirimanne,10,22,2,0,345821,Danushka Gunathilaka,20,20,4,0,6,True,1,0,0,0,0,8,0,0,False,,False,False,4.37,0,48,0,1,0,1,1,0,35
no run,8,Sri Lanka,7,Pakistan,1st innings,0,"length ball around off, pushed towards cover-point","Wahab Riaz to Gunathilaka, no run",35/1,43590,Wahab Riaz,0,1,0,0.1,0,480603,Iftikhar Ahmed,1,6,0,1.0,0,345821,Danushka Gunathilaka,20,21,4,0,301236,Lahiru Thirimanne,10,22,2,0,1,False,0,0,0,0,0,9,8,0,False,,False,False,4.28,0,49,0,1,0,1,1,0,35
four,8,Sri Lanka,7,Pakistan,1st innings,4,"fuller on the stumps and flicked past mid-on, great timing on that. Once it beat the fielder, there was no chance of stopping it","Wahab Riaz to Gunathilaka, FOUR runs",39/1,43590,Wahab Riaz,0,2,0,0.2,4,480603,Iftikhar Ahmed,1,6,0,1.0,0,345821,Danushka Gunathilaka,24,22,5,0,301236,Lahiru Thirimanne,10,22,2,0,2,False,0,0,0,0,0,9,8,0,False,,False,False,4.68,0,50,0,1,0,1,1,0,39
no run,8,Sri Lanka,7,Pakistan,1st innings,0,"length ball around off, comes forward and defends it towards extra cover","Wahab Riaz to Gunathilaka, no run",39/1,43590,Wahab Riaz,0,3,0,0.3,4,480603,Iftikhar Ahmed,1,6,0,1.0,0,345821,Danushka Gunathilaka,24,23,5,0,301236,Lahiru Thirimanne,10,22,2,0,3,False,0,0,0,0,0,9,8,0,False,,False,False,4.58,0,51,0,1,0,1,1,0,39
no run,8,Sri Lanka,7,Pakistan,1st innings,0,"length ball around off, gets behind the line and blocks","Wahab Riaz to Gunathilaka, no run",39/1,43590,Wahab Riaz,0,4,0,0.4,4,480603,Iftikhar Ahmed,1,6,0,1.0,0,345821,Danushka Gunathilaka,24,24,5,0,301236,Lahiru Thirimanne,10,22,2,0,4,False,0,0,0,0,0,9,8,0,False,,False,False,4.5,0,52,0,1,0,1,1,0,39
no run,8,Sri Lanka,7,Pakistan,1st innings,0,"length ball around off, steers it towards the right of the point fielder, Shadab once again dives to his right to make the stop","Wahab Riaz to Gunathilaka, no run",39/1,43590,Wahab Riaz,0,5,0,0.5,4,480603,Iftikhar Ahmed,1,6,0,1.0,0,345821,Danushka Gunathilaka,24,25,5,0,301236,Lahiru Thirimanne,10,22,2,0,5,False,0,0,0,0,0,9,8,0,False,,False,False,4.41,0,53,0,1,0,1,1,0,39
four,8,Sri Lanka,7,Pakistan,1st innings,4,"short of length outside off, some room as well, Thirimanne stands tall and punches it through the covers for the second four of the over","Wahab Riaz to Gunathilaka, FOUR runs",43/1,43590,Wahab Riaz,0,6,0,1.0,8,480603,Iftikhar Ahmed,1,6,0,1.0,0,345821,Danushka Gunathilaka,28,26,6,0,301236,Lahiru Thirimanne,10,22,2,0,6,True,0,0,0,0,0,9,8,0,False,,False,False,4.77,0,54,0,1,0,1,1,0,43
no run,8,Sri Lanka,7,Pakistan,1st innings,0,"length ball around off, punched to the left of the extra cover fielder","Iftikhar Ahmed to Thirimanne, no run",43/1,480603,Iftikhar Ahmed,1,7,0,1.1,0,43590,Wahab Riaz,0,6,0,1.0,8,301236,Lahiru Thirimanne,10,23,2,0,345821,Danushka Gunathilaka,28,26,6,0,1,False,0,0,0,0,0,10,6,0,False,,False,False,4.69,0,55,0,1,0,1,1,0,43
four,8,Sri Lanka,7,Pakistan,1st innings,4,"short outside off, gets it through this time, cuts it between point and short third man to find the boundary","Iftikhar Ahmed to Thirimanne, FOUR runs",47/1,480603,Iftikhar Ahmed,1,8,0,1.2,4,43590,Wahab Riaz,0,6,0,1.0,8,301236,Lahiru Thirimanne,14,24,3,0,345821,Danushka Gunathilaka,28,26,6,0,2,False,0,0,0,0,0,10,6,0,False,,False,False,5.03,0,56,0,1,0,1,1,0,47
wide,8,Sri Lanka,7,Pakistan,1st innings,1,"length ball but drifting down the leg side, a wide","Iftikhar Ahmed to Thirimanne, 1 wide",48/1,480603,Iftikhar Ahmed,1,8,0,1.2,5,43590,Wahab Riaz,0,6,0,1.0,8,301236,Lahiru Thirimanne,14,24,3,0,345821,Danushka Gunathilaka,28,26,6,0,3,False,0,0,1,0,0,10,6,0,False,,False,False,5.14,0,56,0,1,0,1,1,1,48
no run,8,Sri Lanka,7,Pakistan,1st innings,0,"length ball around off, defended from the crease","Iftikhar Ahmed to Thirimanne, no run",48/1,480603,Iftikhar Ahmed,1,9,0,1.3,5,43590,Wahab Riaz,0,6,0,1.0,8,301236,Lahiru Thirimanne,14,25,3,0,345821,Danushka Gunathilaka,28,26,6,0,4,False,0,0,0,0,0,10,6,0,False,,False,False,5.05,0,57,0,1,0,1,1,0,48
no run,8,Sri Lanka,7,Pakistan,1st innings,0,"length ball outside off, punched firmly but straight towards cover","Iftikhar Ahmed to Thirimanne, no run",48/1,480603,Iftikhar Ahmed,1,10,0,1.4,5,43590,Wahab Riaz,0,6,0,1.0,8,301236,Lahiru Thirimanne,14,26,3,0,345821,Danushka Gunathilaka,28,26,6,0,5,False,0,0,0,0,0,10,6,0,False,,False,False,4.96,0,58,0,1,0,1,1,0,48
run,8,Sri Lanka,7,Pakistan,1st innings,1,"length ball angling on to the pads, helped behind square leg","Iftikhar Ahmed to Thirimanne, 1 run",49/1,480603,Iftikhar Ahmed,1,11,0,1.5,6,43590,Wahab Riaz,0,6,0,1.0,8,301236,Lahiru Thirimanne,15,27,3,0,345821,Danushka Gunathilaka,28,26,6,0,6,False,0,0,0,0,0,10,6,0,False,,False,False,4.98,0,59,0,1,0,1,1,0,49
no run,8,Sri Lanka,7,Pakistan,1st innings,0,"length ball outside off, comes forward and defends it with hard hands","Iftikhar Ahmed to Gunathilaka, no run",49/1,480603,Iftikhar Ahmed,1,12,0,2.0,6,43590,Wahab Riaz,0,6,0,1.0,8,345821,Danushka Gunathilaka,28,27,6,0,301236,Lahiru Thirimanne,15,27,3,0,7,True,0,0,0,0,0,10,6,0,False,,False,False,4.9,0,60,0,1,0,1,1,0,49
run,8,Sri Lanka,7,Pakistan,1st innings,1,"length ball outside off, looks to push it towards point, gets a thick outside edge towards third man","Wahab Riaz to Thirimanne, 1 run",50/1,43590,Wahab Riaz,0,7,0,1.1,9,480603,Iftikhar Ahmed,1,12,0,2.0,6,301236,Lahiru Thirimanne,16,28,3,0,345821,Danushka Gunathilaka,28,27,6,0,1,False,0,0,0,0,0,11,4,0,False,,False,False,4.91,0,61,0,1,0,1,1,0,50
run,8,Sri Lanka,7,Pakistan,1st innings,1,"length ball on the pads, tucked away towards backward square leg, they thought of the second first but settled for one in the end","Wahab Riaz to Gunathilaka, 1 run",51/1,43590,Wahab Riaz,0,8,0,1.2,10,480603,Iftikhar Ahmed,1,12,0,2.0,6,345821,Danushka Gunathilaka,29,28,6,0,301236,Lahiru Thirimanne,16,28,3,0,2,False,0,0,0,0,0,11,4,0,False,,False,False,4.93,0,62,0,1,0,1,1,0,51
