PlayType_description,Batting_Team_id,Batting_Team_name,Bowling_Team_id,Bowling_Team_name,Innings,Total_Runs_on_delivery,Commentary,Commentary_short,Score,Bowler_id,Bowler_name,Bowler_maiden,Bowler_balls,Bowler_wickets,Bowler_over,Bowler_conceded,Other_Bowler_id,Other_Bowler_name,Other_Bowler_maidens,Other_Bowler_balls,Other_Bowler_wickets,Other_Bowler_overs,Other_Bowler_conceded,Batsman_id,Batsman_name,Batsman_runs,Batsman_balls_faced,Batsman_four,Batsman_sixes,Other_Batsman_id,Other_Batsman_name,Other_Batsman_runs,Other_Batsman_balls_faced,Other_Batsman_four,Other_Batsman_sixes,Over_ball,Over_complete,Over_maiden,Over_no_Ball,Over_wide,Over_byes,Over_leg_byes,Over_number,Over_runs,Over_wickets,Dismissal_is_true,Dismissal_type,Dismissal_fielder_iskeeper,Dismissal_text,Innings_run_rate,Innings_byes,Innings_balls,Innings_no_balls,Innings_wickets,Innings_leg_byes,Innings_session,Innings_day,Innings_wides,Innings_runs
run,8,Sri Lanka,7,Pakistan,1st innings,1,"skips down the track and slashes it over covers, not from the middle of the bat, only a single","Shadab Khan to Jayasuriya, 1 run",234/4,922943,Shadab Khan,0,51,0,8.3,48,480603,Iftikhar Ahmed,1,54,0,9.0,43,422965,Shehan Jayasuriya,3,5,0,0,345821,Danushka Gunathilaka,130,128,16,1,3,False,0,0,0,0,0,43,3,1,False,,False,False,5.5,0,255,0,4,0,1,1,0,234
wide,8,Sri Lanka,7,Pakistan,1st innings,1,"flatter but well outside off, left alone","Shadab Khan to Gunathilaka, 1 wide",235/4,922943,Shadab Khan,0,51,0,8.3,49,480603,Iftikhar Ahmed,1,54,0,9.0,43,345821,Danushka Gunathilaka,130,128,16,1,422965,Shehan Jayasuriya,3,5,0,0,4,False,0,0,1,0,0,43,3,1,False,,False,False,5.52,0,255,0,4,0,1,1,1,235
run,8,Sri Lanka,7,Pakistan,1st innings,1,"length outside off, cuts it towards sweeper cover for one","Shadab Khan to Gunathilaka, 1 run",236/4,922943,Shadab Khan,0,52,0,8.4,50,480603,Iftikhar Ahmed,1,54,0,9.0,43,345821,Danushka Gunathilaka,131,129,16,1,422965,Shehan Jayasuriya,3,5,0,0,5,False,0,0,0,0,0,43,3,1,False,,False,False,5.53,0,256,0,4,0,1,1,0,236
out,8,Sri Lanka,7,Pakistan,1st innings,0,"length ball on the stumps, goes for the slog sweep but fails to middle it. Gets more height than the distance and Iftikhar makes no mistake at deep midwicket","Shadab Khan to Jayasuriya, OUT",236/5,922943,Shadab Khan,0,53,1,8.5,50,480603,Iftikhar Ahmed,1,54,0,9.0,43,422965,Shehan Jayasuriya,3,6,0,0,345821,Danushka Gunathilaka,131,129,16,1,6,False,0,0,0,0,0,43,3,1,True,caught,False,GSNFG Jayasuriya c Iftikhar Ahmed b Shadab Khan 3 (6b 0x4 0x6) SR: 50.00,5.5,0,257,0,5,0,1,1,0,236
no run,8,Sri Lanka,7,Pakistan,1st innings,0,"length ball down the leg side, goes for the flick but misses. <b>An appeal for caught-behind by Sarfaraz</b>, Aleem Dar says wide but Sarfaraz wants to review it. Replays show it brushed the thigh pad but no bat at all. <b>Pakistan lose their review</b>. But think Aleem Dar will have to change his decision of the wide too. Some confusion here but the common sense prevails in the end and it's deemed a legal delivery","Shadab Khan to Gunathilaka, no run",236/5,922943,Shadab Khan,0,54,1,9.0,50,480603,Iftikhar Ahmed,1,54,0,9.0,43,345821,Danushka Gunathilaka,131,130,16,1,437316,Dasun Shanaka,0,0,0,0,7,True,0,0,0,0,0,43,3,1,False,,False,False,5.48,0,258,0,5,0,1,1,0,236
no run,8,Sri Lanka,7,Pakistan,1st innings,0,"length ball outside off, pushes at it and gets beaten","Usman Shinwari to Shanaka, no run",236/5,697279,Usman Shinwari,1,43,1,7.1,35,922943,Shadab Khan,0,54,1,9.0,50,437316,Dasun Shanaka,0,1,0,0,345821,Danushka Gunathilaka,131,130,16,1,1,False,0,0,0,0,0,44,6,0,False,,False,False,5.46,0,259,0,5,0,1,1,0,236
run,8,Sri Lanka,7,Pakistan,1st innings,1,"length ball around off, taps it towards covers for one","Usman Shinwari to Shanaka, 1 run",237/5,697279,Usman Shinwari,1,44,1,7.2,36,922943,Shadab Khan,0,54,1,9.0,50,437316,Dasun Shanaka,1,2,0,0,345821,Danushka Gunathilaka,131,130,16,1,2,False,0,0,0,0,0,44,6,0,False,,False,False,5.46,0,260,0,5,0,1,1,0,237
run,8,Sri Lanka,7,Pakistan,1st innings,1,"fuller on the stumps, following the batsman who was backing away, works it towards wide long-on","Usman Shinwari to Gunathilaka, 1 run",238/5,697279,Usman Shinwari,1,45,1,7.3,37,922943,Shadab Khan,0,54,1,9.0,50,345821,Danushka Gunathilaka,132,131,16,1,437316,Dasun Shanaka,1,2,0,0,3,False,0,0,0,0,0,44,6,0,False,,False,False,5.47,0,261,0,5,0,1,1,0,238
run,8,Sri Lanka,7,Pakistan,1st innings,1,"length ball angling on the pads, tucked away towards fine leg","Usman Shinwari to Shanaka, 1 run",239/5,697279,Usman Shinwari,1,46,1,7.4,38,922943,Shadab Khan,0,54,1,9.0,50,437316,Dasun Shanaka,2,3,0,0,345821,Danushka Gunathilaka,132,131,16,1,4,False,0,0,0,0,0,44,6,0,False,,False,False,5.47,0,262,0,5,0,1,1,0,239
wide,8,Sri Lanka,7,Pakistan,1st innings,1,fuller but way down the leg side,"Usman Shinwari to Gunathilaka, 1 wide",240/5,697279,Usman Shinwari,1,46,1,7.4,39,922943,Shadab Khan,0,54,1,9.0,50,345821,Danushka Gunathilaka,132,131,16,1,437316,Dasun Shanaka,2,3,0,0,5,False,0,0,1,0,0,44,6,0,False,,False,False,5.49,0,262,0,5,0,1,1,1,240
run,8,Sri Lanka,7,Pakistan,1st innings,1,"length ball around off, hits it into the ground and over the bowler, a single to long-off","Usman Shinwari to Gunathilaka, 1 run",241/5,697279,Usman Shinwari,1,47,1,7.5,40,922943,Shadab Khan,0,54,1,9.0,50,345821,Danushka Gunathilaka,133,132,16,1,437316,Dasun Shanaka,2,3,0,0,6,False,0,0,0,0,0,44,6,0,False,,False,False,5.49,0,263,0,5,0,1,1,0,241
run,8,Sri Lanka,7,Pakistan,1st innings,1,"fuller on the stumps, looks to hit it towards midwicket, gets an inside edge on to the pads","Usman Shinwari to Shanaka, 1 run",242/5,697279,Usman Shinwari,1,48,1,8.0,41,922943,Shadab Khan,0,54,1,9.0,50,437316,Dasun Shanaka,3,4,0,0,345821,Danushka Gunathilaka,133,132,16,1,7,True,0,0,0,0,0,44,6,0,False,,False,False,5.5,0,264,0,5,0,1,1,0,242
run,8,Sri Lanka,7,Pakistan,1st innings,1,"a brilliant yorker on the stumps, jams his bat at it and digs it out towards extra cover, Babar looks to flick it on to the stumps as the non-striker was backing up, misses and concedes an overthrow","Mohammad Amir to Shanaka, 1 run",243/5,290948,Mohammad Amir,0,43,1,7.1,35,697279,Usman Shinwari,1,48,1,8.0,41,437316,Dasun Shanaka,4,5,0,0,345821,Danushka Gunathilaka,133,132,16,1,1,False,0,0,0,0,0,45,5,1,False,,False,False,5.5,0,265,0,5,0,1,1,0,243
no run,8,Sri Lanka,7,Pakistan,1st innings,0,"fuller outside off, goes for the reverse sweep, gets a bottom edge into the ground and to the keeper","Mohammad Amir to Gunathilaka, no run",243/5,290948,Mohammad Amir,0,44,1,7.2,35,697279,Usman Shinwari,1,48,1,8.0,41,345821,Danushka Gunathilaka,133,133,16,1,437316,Dasun Shanaka,4,5,0,0,2,False,0,0,0,0,0,45,5,1,False,,False,False,5.48,0,266,0,5,0,1,1,0,243
out,8,Sri Lanka,7,Pakistan,1st innings,0,"another yorker, full and straight, Gunathilaka was looking to hit towards long-on, misses and the ball clatters into the stumps. Gunathilaka walks back for 133 off 134","Mohammad Amir to Gunathilaka, OUT",243/6,290948,Mohammad Amir,0,45,2,7.3,35,697279,Usman Shinwari,1,48,1,8.0,41,345821,Danushka Gunathilaka,133,134,16,1,437316,Dasun Shanaka,4,5,0,0,3,False,0,0,0,0,0,45,5,1,True,bowled,False,MD Gunathilaka  b Mohammad Amir 133 (134b 16x4 1x6) SR: 99.25,5.46,0,267,0,6,0,1,1,0,243
wide,8,Sri Lanka,7,Pakistan,1st innings,1,"a slower one but down the leg side, needs to bowl this again","Mohammad Amir to de Silva, 1 wide",244/6,290948,Mohammad Amir,0,45,2,7.3,36,697279,Usman Shinwari,1,48,1,8.0,41,784379,Wanindu Hasaranga,0,0,0,0,437316,Dasun Shanaka,4,5,0,0,4,False,0,0,1,0,0,45,5,1,False,,False,False,5.48,0,267,0,6,0,1,1,1,244
run,8,Sri Lanka,7,Pakistan,1st innings,1,"length ball around off, taps it towards covers for one","Mohammad Amir to de Silva, 1 run",245/6,290948,Mohammad Amir,0,46,2,7.4,37,697279,Usman Shinwari,1,48,1,8.0,41,784379,Wanindu Hasaranga,1,1,0,0,437316,Dasun Shanaka,4,5,0,0,5,False,0,0,0,0,0,45,5,1,False,,False,False,5.48,0,268,0,6,0,1,1,0,245
run,8,Sri Lanka,7,Pakistan,1st innings,1,"another slower one, length around off, drops it towards covers for one more","Mohammad Amir to Shanaka, 1 run",246/6,290948,Mohammad Amir,0,47,2,7.5,38,697279,Usman Shinwari,1,48,1,8.0,41,437316,Dasun Shanaka,5,6,0,0,784379,Wanindu Hasaranga,1,1,0,0,6,False,0,0,0,0,0,45,5,1,False,,False,False,5.48,0,269,0,6,0,1,1,0,246
run,8,Sri Lanka,7,Pakistan,1st innings,1,"fuller on the pads, flicks it away but straight towards short fine leg","Mohammad Amir to de Silva, 1 run",247/6,290948,Mohammad Amir,0,48,2,8.0,39,697279,Usman Shinwari,1,48,1,8.0,41,784379,Wanindu Hasaranga,2,2,0,0,437316,Dasun Shanaka,5,6,0,0,7,True,0,0,0,0,0,45,5,1,False,,False,False,5.48,0,270,0,6,0,1,1,0,247
run,8,Sri Lanka,7,Pakistan,1st innings,1,"fuller outside off, almost a yorker, steers it towards point by opening the face of the bat","Wahab Riaz to de Silva, 1 run",248/6,43590,Wahab Riaz,0,43,0,7.1,45,290948,Mohammad Amir,0,48,2,8.0,39,784379,Wanindu Hasaranga,3,3,0,0,437316,Dasun Shanaka,5,6,0,0,1,False,0,0,0,0,0,46,17,0,False,,False,False,5.49,0,271,0,6,0,1,1,0,248
four,8,Sri Lanka,7,Pakistan,1st innings,4,"fuller on the stumps, swipes it towards deep square leg, Iftikhar misfields at the boundary and allows it to go for a boundary, <b>250 is up for Sri Lanka</b>","Wahab Riaz to Shanaka, FOUR runs",252/6,43590,Wahab Riaz,0,44,0,7.2,49,290948,Mohammad Amir,0,48,2,8.0,39,437316,Dasun Shanaka,9,7,1,0,784379,Wanindu Hasaranga,3,3,0,0,2,False,0,0,0,0,0,46,17,0,False,,False,False,5.55,0,272,0,6,0,1,1,0,252
run,8,Sri Lanka,7,Pakistan,1st innings,1,"fuller on the stumps, pushes towards mid-on for a quick single, a direct hit there but Shanka was well in","Wahab Riaz to Shanaka, 1 run",253/6,43590,Wahab Riaz,0,45,0,7.3,50,290948,Mohammad Amir,0,48,2,8.0,39,437316,Dasun Shanaka,10,8,1,0,784379,Wanindu Hasaranga,3,3,0,0,3,False,0,0,0,0,0,46,17,0,False,,False,False,5.56,0,273,0,6,0,1,1,0,253
run,8,Sri Lanka,7,Pakistan,1st innings,1,"length ball around off, taps it towards covers for one","Wahab Riaz to de Silva, 1 run",254/6,43590,Wahab Riaz,0,46,0,7.4,51,290948,Mohammad Amir,0,48,2,8.0,39,784379,Wanindu Hasaranga,4,4,0,0,437316,Dasun Shanaka,10,8,1,0,4,False,0,0,0,0,0,46,17,0,False,,False,False,5.56,0,274,0,6,0,1,1,0,254
four,8,Sri Lanka,7,Pakistan,1st innings,4,"short of length down the leg side, pulled away towards fine leg and <b>Amir lets it go through his legs</b>","Wahab Riaz to Shanaka, FOUR runs",258/6,43590,Wahab Riaz,0,47,0,7.5,55,290948,Mohammad Amir,0,48,2,8.0,39,437316,Dasun Shanaka,14,9,2,0,784379,Wanindu Hasaranga,4,4,0,0,5,False,0,0,0,0,0,46,17,0,False,,False,False,5.62,0,275,0,6,0,1,1,0,258
six,8,Sri Lanka,7,Pakistan,1st innings,6,"fuller on the stumps, clears his front leg and smashes it overs the bowler's head for a six","Wahab Riaz to Shanaka, SIX runs",264/6,43590,Wahab Riaz,0,48,0,8.0,61,290948,Mohammad Amir,0,48,2,8.0,39,437316,Dasun Shanaka,20,10,2,1,784379,Wanindu Hasaranga,4,4,0,0,6,True,0,0,0,0,0,46,17,0,False,,False,False,5.73,0,276,0,6,0,1,1,0,264
run,8,Sri Lanka,7,Pakistan,1st innings,2,"fuller and wider outside off, lofts it towards deep extra cover","Mohammad Amir to de Silva, 2 runs",266/6,290948,Mohammad Amir,0,49,2,8.1,41,43590,Wahab Riaz,0,48,0,8.0,61,784379,Wanindu Hasaranga,6,5,0,0,437316,Dasun Shanaka,20,10,2,1,1,False,0,0,0,0,0,47,9,0,False,,False,False,5.76,0,277,0,6,0,1,1,0,266
run,8,Sri Lanka,7,Pakistan,1st innings,1,"short of length outside off, tennis-ball bounce, dabs it behind point","Mohammad Amir to de Silva, 1 run",267/6,290948,Mohammad Amir,0,50,2,8.2,42,43590,Wahab Riaz,0,48,0,8.0,61,784379,Wanindu Hasaranga,7,6,0,0,437316,Dasun Shanaka,20,10,2,1,2,False,0,0,0,0,0,47,9,0,False,,False,False,5.76,0,278,0,6,0,1,1,0,267
four,8,Sri Lanka,7,Pakistan,1st innings,4,"a low full toss outside off, way too outside off, Shanaka gets some bat on it and the thick outside edge beats the keeper","Mohammad Amir to Shanaka, FOUR runs",271/6,290948,Mohammad Amir,0,51,2,8.3,46,43590,Wahab Riaz,0,48,0,8.0,61,437316,Dasun Shanaka,24,11,3,1,784379,Wanindu Hasaranga,7,6,0,0,3,False,0,0,0,0,0,47,9,0,False,,False,False,5.82,0,279,0,6,0,1,1,0,271
no run,8,Sri Lanka,7,Pakistan,1st innings,0,"better, in the blockhole, digs it out towards mid-off","Mohammad Amir to Shanaka, no run",271/6,290948,Mohammad Amir,0,52,2,8.4,46,43590,Wahab Riaz,0,48,0,8.0,61,437316,Dasun Shanaka,24,12,3,1,784379,Wanindu Hasaranga,7,6,0,0,4,False,0,0,0,0,0,47,9,0,False,,False,False,5.8,0,280,0,6,0,1,1,0,271
run,8,Sri Lanka,7,Pakistan,1st innings,1,"another full toss, this time on the pads, tucked away towards deep midwicket","Mohammad Amir to Shanaka, 1 run",272/6,290948,Mohammad Amir,0,53,2,8.5,47,43590,Wahab Riaz,0,48,0,8.0,61,437316,Dasun Shanaka,25,13,3,1,784379,Wanindu Hasaranga,7,6,0,0,5,False,0,0,0,0,0,47,9,0,False,,False,False,5.8,0,281,0,6,0,1,1,0,272
run,8,Sri Lanka,7,Pakistan,1st innings,1,"slower length ball outside off, cuts it to cover-point, Sohail there","Mohammad Amir to de Silva, 1 run",273/6,290948,Mohammad Amir,0,54,2,9.0,48,43590,Wahab Riaz,0,48,0,8.0,61,784379,Wanindu Hasaranga,8,7,0,0,437316,Dasun Shanaka,25,13,3,1,6,True,0,0,0,0,0,47,9,0,False,,False,False,5.8,0,282,0,6,0,1,1,0,273
run,8,Sri Lanka,7,Pakistan,1st innings,1,"a low full toss on the stumps, a bit of reverse swing, pushed towards covers for a quick single","Wahab Riaz to de Silva, 1 run",274/6,43590,Wahab Riaz,0,49,0,8.1,62,290948,Mohammad Amir,0,54,2,9.0,48,784379,Wanindu Hasaranga,9,8,0,0,437316,Dasun Shanaka,25,13,3,1,1,False,0,0,0,0,0,48,9,0,False,,False,False,5.8,0,283,0,6,0,1,1,0,274
no run,8,Sri Lanka,7,Pakistan,1st innings,0,"slower length ball, moves across and looks to scoop towards fine leg, misses","Wahab Riaz to Shanaka, no run",274/6,43590,Wahab Riaz,0,50,0,8.2,62,290948,Mohammad Amir,0,54,2,9.0,48,437316,Dasun Shanaka,25,14,3,1,784379,Wanindu Hasaranga,9,8,0,0,2,False,0,0,0,0,0,48,9,0,False,,False,False,5.78,0,284,0,6,0,1,1,0,274
six,8,Sri Lanka,7,Pakistan,1st innings,6,"another slower one, fuller around off, Shanaka clears his front leg and smashes it over long-off, just clears the boundary","Wahab Riaz to Shanaka, SIX runs",280/6,43590,Wahab Riaz,0,51,0,8.3,68,290948,Mohammad Amir,0,54,2,9.0,48,437316,Dasun Shanaka,31,15,3,2,784379,Wanindu Hasaranga,9,8,0,0,3,False,0,0,0,0,0,48,9,0,False,,False,False,5.89,0,285,0,6,0,1,1,0,280
no run,8,Sri Lanka,7,Pakistan,1st innings,0,"<b>147kph!</b> Short of length down the leg side, goes for the pull but it hurries on to the batsman, dribbles towards short fine leg","Wahab Riaz to Shanaka, no run",280/6,43590,Wahab Riaz,0,52,0,8.4,68,290948,Mohammad Amir,0,54,2,9.0,48,437316,Dasun Shanaka,31,16,3,2,784379,Wanindu Hasaranga,9,8,0,0,4,False,0,0,0,0,0,48,9,0,False,,False,False,5.87,0,286,0,6,0,1,1,0,280
run,8,Sri Lanka,7,Pakistan,1st innings,1,"short of length once again, mistimes the pull towards square leg","Wahab Riaz to Shanaka, 1 run",281/6,43590,Wahab Riaz,0,53,0,8.5,69,290948,Mohammad Amir,0,54,2,9.0,48,437316,Dasun Shanaka,32,17,3,2,784379,Wanindu Hasaranga,9,8,0,0,5,False,0,0,0,0,0,48,9,0,False,,False,False,5.87,0,287,0,6,0,1,1,0,281
run,8,Sri Lanka,7,Pakistan,1st innings,1,"short of length around off, bends his back and ramps it towards third man","Wahab Riaz to de Silva, 1 run",282/6,43590,Wahab Riaz,0,54,0,9.0,70,290948,Mohammad Amir,0,54,2,9.0,48,784379,Wanindu Hasaranga,10,9,0,0,437316,Dasun Shanaka,32,17,3,2,6,True,0,0,0,0,0,48,9,0,False,,False,False,5.87,0,288,0,6,0,1,1,0,282
no run,8,Sri Lanka,7,Pakistan,1st innings,0,"a yorker at the stumps, Hasaranga can only dig it out back to the bowler","Mohammad Amir to de Silva, no run",282/6,290948,Mohammad Amir,0,55,2,9.1,48,43590,Wahab Riaz,0,54,0,9.0,70,784379,Wanindu Hasaranga,10,10,0,0,437316,Dasun Shanaka,32,17,3,2,1,False,0,0,0,0,0,49,3,2,False,,False,False,5.85,0,289,0,6,0,1,1,0,282
leg bye,8,Sri Lanka,7,Pakistan,1st innings,1,"another yorker, this time following the batsman who was moving away, misses the flick. A leg bye as the ball rolls towards cover","Mohammad Amir to de Silva, 1 leg bye",283/6,290948,Mohammad Amir,0,56,2,9.2,48,43590,Wahab Riaz,0,54,0,9.0,70,784379,Wanindu Hasaranga,10,11,0,0,437316,Dasun Shanaka,32,17,3,2,2,False,0,0,0,0,1,49,3,2,False,,False,False,5.85,0,290,0,6,1,1,1,0,283
run,8,Sri Lanka,7,Pakistan,1st innings,1,"down the track and takes it on the full, but only a single to long-on","Mohammad Amir to Shanaka, 1 run",284/6,290948,Mohammad Amir,0,57,2,9.3,49,43590,Wahab Riaz,0,54,0,9.0,70,437316,Dasun Shanaka,33,18,3,2,784379,Wanindu Hasaranga,10,11,0,0,3,False,0,0,0,0,0,49,3,2,False,,False,False,5.85,0,291,0,6,0,1,1,0,284
out,8,Sri Lanka,7,Pakistan,1st innings,0,"fuller outside off, Hasaranga was moving towards the off side, goes for the flick but ends up hitting it on to his stumps. Amir gets his third wicket","Mohammad Amir to de Silva, OUT",284/7,290948,Mohammad Amir,0,58,3,9.4,49,43590,Wahab Riaz,0,54,0,9.0,70,784379,Wanindu Hasaranga,10,12,0,0,437316,Dasun Shanaka,33,18,3,2,4,False,0,0,0,0,0,49,3,2,True,bowled,False,PWH de Silva  b Mohammad Amir 10 (12b 0x4 0x6) SR: 83.33,5.83,0,292,0,7,0,1,1,0,284
out,8,Sri Lanka,7,Pakistan,1st innings,0,"length ball around middle and leg, drops it on the leg side and sets off, Amir fields it, turns around and hits the stumps direct to find Shanaka short at the non-striker's end","Mohammad Amir to Sandakan, OUT",284/8,290948,Mohammad Amir,0,59,3,9.5,49,43590,Wahab Riaz,0,54,0,9.0,70,429738,Lakshan Sandakan,0,1,0,0,437316,Dasun Shanaka,33,18,3,2,5,False,0,0,0,0,0,49,3,2,True,run out,False,PADLR Sandakan run out (Mohammad Amir) 0 (1b 0x4 0x6) SR: 0.00,5.81,0,293,0,8,0,1,1,0,284
run,8,Sri Lanka,7,Pakistan,1st innings,1,"another yorker, digs it out towards cover for a quick single. A shy at the bowler's end, misses. Think Shanaka was in anyway","Mohammad Amir to Shanaka, 1 run",285/8,290948,Mohammad Amir,0,60,3,10.0,50,43590,Wahab Riaz,0,54,0,9.0,70,437316,Dasun Shanaka,34,19,3,2,324358,Nuwan Pradeep,0,0,0,0,6,True,0,0,0,0,0,49,3,2,False,,False,False,5.81,0,294,0,8,0,1,1,0,285
four,8,Sri Lanka,7,Pakistan,1st innings,4,"a full toss outside off to start with and Shanaka has smashed it over covers, finds the gap in the deep","Wahab Riaz to Shanaka, FOUR runs",289/8,43590,Wahab Riaz,0,55,0,9.1,74,290948,Mohammad Amir,0,60,3,10.0,50,437316,Dasun Shanaka,38,20,4,2,324358,Nuwan Pradeep,0,0,0,0,1,False,0,0,0,0,0,50,12,1,False,,False,False,5.87,0,295,0,8,0,1,1,0,289
four,8,Sri Lanka,7,Pakistan,1st innings,4,"fuller outside off, clears his front leg and smashes it past mid-off for four more","Wahab Riaz to Shanaka, FOUR runs",293/8,43590,Wahab Riaz,0,56,0,9.2,78,290948,Mohammad Amir,0,60,3,10.0,50,437316,Dasun Shanaka,42,21,5,2,324358,Nuwan Pradeep,0,0,0,0,2,False,0,0,0,0,0,50,12,1,False,,False,False,5.93,0,296,0,8,0,1,1,0,293
no ball,8,Sri Lanka,7,Pakistan,1st innings,1,"length ball this time, looks to go aerial down the ground, gets a top edge and Sarfaraz completes a good catch near short third man. But wait, they are checking for a front-foot no-ball, <b>and Wahab has overstepped here</b>. Shanaka survives, free hit coming up as well","Wahab Riaz to Shanaka, 1 no ball",294/8,43590,Wahab Riaz,0,56,0,9.2,79,290948,Mohammad Amir,0,60,3,10.0,50,437316,Dasun Shanaka,42,22,5,2,324358,Nuwan Pradeep,0,0,0,0,3,False,0,1,0,0,0,50,12,1,False,,False,False,5.95,0,296,1,8,0,1,1,0,294
bye,8,Sri Lanka,7,Pakistan,1st innings,1,"a brilliant yorker at the off stump, Pradeep was backing away and misses. But it's a free hit and they get a single as the ball ricochets towards third man. Shinwari does well to stop the boundary","Wahab Riaz to Pradeep, 1 bye",295/8,43590,Wahab Riaz,0,57,0,9.3,79,290948,Mohammad Amir,0,60,3,10.0,50,324358,Nuwan Pradeep,0,1,0,0,437316,Dasun Shanaka,42,22,5,2,4,False,0,0,0,1,0,50,12,1,False,,False,False,5.95,1,297,0,8,0,1,1,0,295
run,8,Sri Lanka,7,Pakistan,1st innings,1,"short of length, Shanaka pulls it towards deep square leg","Wahab Riaz to Shanaka, 1 run",296/8,43590,Wahab Riaz,0,58,0,9.4,80,290948,Mohammad Amir,0,60,3,10.0,50,437316,Dasun Shanaka,43,23,5,2,324358,Nuwan Pradeep,0,1,0,0,5,False,0,0,0,0,0,50,12,1,False,,False,False,5.95,0,298,0,8,0,1,1,0,296
run,8,Sri Lanka,7,Pakistan,1st innings,1,"fuller outside off, slashed towards sweeper cover for one","Wahab Riaz to Pradeep, 1 run",297/8,43590,Wahab Riaz,0,59,0,9.5,81,290948,Mohammad Amir,0,60,3,10.0,50,324358,Nuwan Pradeep,1,2,0,0,437316,Dasun Shanaka,43,23,5,2,6,False,0,0,0,0,0,50,12,1,False,,False,False,5.95,0,299,0,8,0,1,1,0,297
out,8,Sri Lanka,7,Pakistan,1st innings,0,"length, wide outside off, Shanaka was backing away and had to reach out for it, ends up mistiming it towards extra and an easy catch for Haris Sohail there","Wahab Riaz to Shanaka, OUT",297/9,43590,Wahab Riaz,0,60,1,10.0,81,290948,Mohammad Amir,0,60,3,10.0,50,437316,Dasun Shanaka,43,24,5,2,324358,Nuwan Pradeep,1,2,0,0,7,True,0,0,0,0,0,50,12,1,True,caught,False,MD Shanaka c Haris Sohail b Wahab Riaz 43 (24b 5x4 2x6) SR: 179.16,5.94,0,300,0,9,0,1,1,0,297
no run,7,Pakistan,8,Sri Lanka,2nd innings,0,"length ball outside off, and angling further away. Left alone","Pradeep to Fakhar Zaman, no run",0,324358,Nuwan Pradeep,0,1,0,0.1,0,False,False,0,0,0,False,0,512191,Fakhar Zaman,0,1,0,0,39950,Abid Ali,0,0,0,0,1,False,1,0,0,0,0,1,0,0,False,,False,False,0.0,0,1,0,0,0,1,1,0,0
no run,7,Pakistan,8,Sri Lanka,2nd innings,0,"length ball on middle, offering little space to the batsman. Flat-batted back to the bowler","Pradeep to Fakhar Zaman, no run",0,324358,Nuwan Pradeep,0,2,0,0.2,0,False,False,0,0,0,False,0,512191,Fakhar Zaman,0,2,0,0,39950,Abid Ali,0,0,0,0,2,False,1,0,0,0,0,1,0,0,False,,False,False,0.0,0,2,0,0,0,1,1,0,0
no run,7,Pakistan,8,Sri Lanka,2nd innings,0,"length ball outside off, and punched to cover","Pradeep to Fakhar Zaman, no run",0,324358,Nuwan Pradeep,0,3,0,0.3,0,False,False,0,0,0,False,0,512191,Fakhar Zaman,0,3,0,0,39950,Abid Ali,0,0,0,0,3,False,1,0,0,0,0,1,0,0,False,,False,False,0.0,0,3,0,0,0,1,1,0,0
no run,7,Pakistan,8,Sri Lanka,2nd innings,0,,"Pradeep to Fakhar Zaman, no run",0,324358,Nuwan Pradeep,0,4,0,0.4,0,False,False,0,0,0,False,0,512191,Fakhar Zaman,0,4,0,0,39950,Abid Ali,0,0,0,0,4,False,1,0,0,0,0,1,0,0,False,,False,False,0.0,0,4,0,0,0,1,1,0,0
no run,7,Pakistan,8,Sri Lanka,2nd innings,0,"full, wide outside off and angling further away. Fakhar throws hsi hands at this, but can't connect","Pradeep to Fakhar Zaman, no run",0,324358,Nuwan Pradeep,0,5,0,0.5,0,False,False,0,0,0,False,0,512191,Fakhar Zaman,0,5,0,0,39950,Abid Ali,0,0,0,0,5,False,1,0,0,0,0,1,0,0,False,,False,False,0.0,0,5,0,0,0,1,1,0,0
no run,7,Pakistan,8,Sri Lanka,2nd innings,0,"length ball on middle, and Fakhar can only tap this back to the bowler. <B>Starts off with a maiden</b>","Pradeep to Fakhar Zaman, no run",0,324358,Nuwan Pradeep,1,6,0,1.0,0,False,False,0,0,0,False,0,512191,Fakhar Zaman,0,6,0,0,39950,Abid Ali,0,0,0,0,6,True,1,0,0,0,0,1,0,0,False,,False,False,0.0,0,6,0,0,0,1,1,0,0
no run,7,Pakistan,8,Sri Lanka,2nd innings,0,"full, just outside off stump. Leans forward to mistime a drive to the bowler","Shanaka to Abid Ali, no run",0,437316,Dasun Shanaka,0,1,0,0.1,0,324358,Nuwan Pradeep,1,6,0,1.0,0,39950,Abid Ali,0,1,0,0,512191,Fakhar Zaman,0,6,0,0,1,False,0,0,0,0,0,2,2,0,False,,False,False,0.0,0,7,0,0,0,1,1,0,0
no run,7,Pakistan,8,Sri Lanka,2nd innings,0,"full, just outside off stump. Firmly defended to cover","Shanaka to Abid Ali, no run",0,437316,Dasun Shanaka,0,2,0,0.2,0,324358,Nuwan Pradeep,1,6,0,1.0,0,39950,Abid Ali,0,2,0,0,512191,Fakhar Zaman,0,6,0,0,2,False,0,0,0,0,0,2,2,0,False,,False,False,0.0,0,8,0,0,0,1,1,0,0
run,7,Pakistan,8,Sri Lanka,2nd innings,2,"good length on off, and he rides the bounce before pulling along the ground to deep midwicket","Shanaka to Abid Ali, 2 runs",0,437316,Dasun Shanaka,0,3,0,0.3,2,324358,Nuwan Pradeep,1,6,0,1.0,0,39950,Abid Ali,2,3,0,0,512191,Fakhar Zaman,0,6,0,0,3,False,0,0,0,0,0,2,2,0,False,,False,False,1.33,0,9,0,0,0,1,1,0,2
no run,7,Pakistan,8,Sri Lanka,2nd innings,0,"length again, this time outside off. Firmly pushed back to the bowler","Shanaka to Fakhar Zaman, no run",0,437316,Dasun Shanaka,0,4,0,0.4,2,324358,Nuwan Pradeep,1,6,0,1.0,0,39950,Abid Ali,2,4,0,0,512191,Fakhar Zaman,0,6,0,0,4,False,0,0,0,0,0,2,2,0,False,,False,False,1.2,0,10,0,0,0,1,1,0,2
no run,7,Pakistan,8,Sri Lanka,2nd innings,0,"full, on off, and worked off his toes to the leg side","Shanaka to Abid Ali, no run",0,437316,Dasun Shanaka,0,5,0,0.5,2,324358,Nuwan Pradeep,1,6,0,1.0,0,39950,Abid Ali,2,5,0,0,512191,Fakhar Zaman,0,6,0,0,5,False,0,0,0,0,0,2,2,0,False,,False,False,1.09,0,11,0,0,0,1,1,0,2
no run,7,Pakistan,8,Sri Lanka,2nd innings,0,"overpitched just outside off, and he smacks it back to the bowler. Stopped by Shanaka on his followthrough, sticking his left arm outwards","Shanaka to Abid Ali, no run",0,437316,Dasun Shanaka,0,6,0,1.0,2,324358,Nuwan Pradeep,1,6,0,1.0,0,39950,Abid Ali,2,6,0,0,512191,Fakhar Zaman,0,6,0,0,6,True,0,0,0,0,0,2,2,0,False,,False,False,1.0,0,12,0,0,0,1,1,0,2
run,7,Pakistan,8,Sri Lanka,2nd innings,1,"full, on off, and he mistimes a drive straight past the bowler. Mid-off dives to his left, but can't stop the single","Pradeep to Fakhar Zaman, 1 run",0,324358,Nuwan Pradeep,1,7,0,1.1,1,437316,Dasun Shanaka,0,6,0,1.0,2,512191,Fakhar Zaman,1,7,0,0,39950,Abid Ali,2,6,0,0,1,False,0,0,0,0,0,3,9,0,False,,False,False,1.38,0,13,0,0,0,1,1,0,3
no run,7,Pakistan,8,Sri Lanka,2nd innings,0,"length ball, just outside off. Presses forward and fends it back to the bowler","Pradeep to Abid Ali, no run",0,324358,Nuwan Pradeep,1,8,0,1.2,1,437316,Dasun Shanaka,0,6,0,1.0,2,39950,Abid Ali,2,7,0,0,512191,Fakhar Zaman,1,7,0,0,2,False,0,0,0,0,0,3,9,0,False,,False,False,1.28,0,14,0,0,0,1,1,0,3
