PlayType_description,Batting_Team_id,Batting_Team_name,Bowling_Team_id,Bowling_Team_name,Innings,Total_Runs_on_delivery,Commentary,Commentary_short,Score,Bowler_id,Bowler_name,Bowler_maiden,Bowler_balls,Bowler_wickets,Bowler_over,Bowler_conceded,Other_Bowler_id,Other_Bowler_name,Other_Bowler_maidens,Other_Bowler_balls,Other_Bowler_wickets,Other_Bowler_overs,Other_Bowler_conceded,Batsman_id,Batsman_name,Batsman_runs,Batsman_balls_faced,Batsman_four,Batsman_sixes,Other_Batsman_id,Other_Batsman_name,Other_Batsman_runs,Other_Batsman_balls_faced,Other_Batsman_four,Other_Batsman_sixes,Over_ball,Over_complete,Over_maiden,Over_no_Ball,Over_wide,Over_byes,Over_leg_byes,Over_number,Over_runs,Over_wickets,Dismissal_is_true,Dismissal_type,Dismissal_fielder_iskeeper,Dismissal_text,Innings_run_rate,Innings_byes,Innings_balls,Innings_no_balls,Innings_wickets,Innings_leg_byes,Innings_session,Innings_day,Innings_wides,Innings_runs
no run,2,Australia,7,Pakistan,3rd innings,0,"143 kph, bouncer outside off, Khawaja hurries underneath that","Wahab Riaz to Khawaja, no run",0,43590,Wahab Riaz,0,14,1,2.2,12,43685,Yasir Shah,0,24,0,4.0,40,215155,Usman Khawaja,14,31,1,0,267192,Steven Smith,2,5,0,0,2,False,0,0,0,0,0,11,2,0,False,,False,False,7.16,0,62,0,1,0,2,4,0,74
no run,2,Australia,7,Pakistan,3rd innings,0,"good length outside off, 139 kph, left alone","Wahab Riaz to Khawaja, no run",0,43590,Wahab Riaz,0,15,1,2.3,12,43685,Yasir Shah,0,24,0,4.0,40,215155,Usman Khawaja,14,32,1,0,267192,Steven Smith,2,5,0,0,3,False,0,0,0,0,0,11,2,0,False,,False,False,7.04,0,63,0,1,0,2,4,0,74
no run,2,Australia,7,Pakistan,3rd innings,0,"good length outside off, dabbed to gully from the crease","Wahab Riaz to Khawaja, no run",0,43590,Wahab Riaz,0,16,1,2.4,12,43685,Yasir Shah,0,24,0,4.0,40,215155,Usman Khawaja,14,33,1,0,267192,Steven Smith,2,5,0,0,4,False,0,0,0,0,0,11,2,0,False,,False,False,6.93,0,64,0,1,0,2,4,0,74
run,2,Australia,7,Pakistan,3rd innings,1,"bouncer on off, pulled to fine leg","Wahab Riaz to Khawaja, 1 run",0,43590,Wahab Riaz,0,17,1,2.5,13,43685,Yasir Shah,0,24,0,4.0,40,215155,Usman Khawaja,15,34,1,0,267192,Steven Smith,2,5,0,0,5,False,0,0,0,0,0,11,2,0,False,,False,False,6.92,0,65,0,1,0,2,4,0,75
no run,2,Australia,7,Pakistan,3rd innings,0,"full delivery outside off, Smith gets forward and defends","Wahab Riaz to Smith, no run",0,43590,Wahab Riaz,0,18,1,3.0,13,43685,Yasir Shah,0,24,0,4.0,40,267192,Steven Smith,2,6,0,0,215155,Usman Khawaja,15,34,1,0,6,True,0,0,0,0,0,11,2,0,False,,False,False,6.81,0,66,0,1,0,2,4,0,75
no run,2,Australia,7,Pakistan,3rd innings,0,"flight outside off, Khawaja wants to drive against the spin but skews one towards midwicket","Yasir Shah to Khawaja, no run",0,43685,Yasir Shah,0,25,0,4.1,40,43590,Wahab Riaz,0,18,1,3.0,13,215155,Usman Khawaja,15,35,1,0,267192,Steven Smith,2,6,0,0,1,False,0,0,0,0,0,12,4,0,False,,False,False,6.71,0,67,0,1,0,2,4,0,75
no run,2,Australia,7,Pakistan,3rd innings,0,"tossed up outside off, Khawaja gets forward and defends","Yasir Shah to Khawaja, no run",0,43685,Yasir Shah,0,26,0,4.2,40,43590,Wahab Riaz,0,18,1,3.0,13,215155,Usman Khawaja,15,36,1,0,267192,Steven Smith,2,6,0,0,2,False,0,0,0,0,0,12,4,0,False,,False,False,6.61,0,68,0,1,0,2,4,0,75
no run,2,Australia,7,Pakistan,3rd innings,0,"flat delivery outside off, spins back in. Defended into the off side","Yasir Shah to Khawaja, no run",0,43685,Yasir Shah,0,27,0,4.3,40,43590,Wahab Riaz,0,18,1,3.0,13,215155,Usman Khawaja,15,37,1,0,267192,Steven Smith,2,6,0,0,3,False,0,0,0,0,0,12,4,0,False,,False,False,6.52,0,69,0,1,0,2,4,0,75
run,2,Australia,7,Pakistan,3rd innings,2,Khawaja comes down the pitch and lifts the ball nicely over the bowler's head for a couple. Not great timing,"Yasir Shah to Khawaja, 2 runs",0,43685,Yasir Shah,0,28,0,4.4,42,43590,Wahab Riaz,0,18,1,3.0,13,215155,Usman Khawaja,17,38,1,0,267192,Steven Smith,2,6,0,0,4,False,0,0,0,0,0,12,4,0,False,,False,False,6.6,0,70,0,1,0,2,4,0,77
run,2,Australia,7,Pakistan,3rd innings,2,swept away powerfully to deep square leg for a couple more,"Yasir Shah to Khawaja, 2 runs",0,43685,Yasir Shah,0,29,0,4.5,44,43590,Wahab Riaz,0,18,1,3.0,13,215155,Usman Khawaja,19,39,1,0,267192,Steven Smith,2,6,0,0,5,False,0,0,0,0,0,12,4,0,False,,False,False,6.67,0,71,0,1,0,2,4,0,79
no run,2,Australia,7,Pakistan,3rd innings,0,defended off the front foot,"Yasir Shah to Khawaja, no run",0,43685,Yasir Shah,0,30,0,5.0,44,43590,Wahab Riaz,0,18,1,3.0,13,215155,Usman Khawaja,19,40,1,0,267192,Steven Smith,2,6,0,0,6,True,0,0,0,0,0,12,4,0,False,,False,False,6.58,0,72,0,1,0,2,4,0,79
run,2,Australia,7,Pakistan,3rd innings,1,"147 kph, on the pads, wristily flicked to deep square leg for one","Wahab Riaz to Smith, 1 run",0,43590,Wahab Riaz,0,19,1,3.1,14,43685,Yasir Shah,0,30,0,5.0,44,267192,Steven Smith,3,7,0,0,215155,Usman Khawaja,19,40,1,0,1,False,0,0,0,0,0,13,2,0,False,,False,False,6.57,0,73,0,1,0,2,4,0,80
no run,2,Australia,7,Pakistan,3rd innings,0,defended back up the pitch,"Wahab Riaz to Khawaja, no run",0,43590,Wahab Riaz,0,20,1,3.2,14,43685,Yasir Shah,0,30,0,5.0,44,215155,Usman Khawaja,19,41,1,0,267192,Steven Smith,3,7,0,0,2,False,0,0,0,0,0,13,2,0,False,,False,False,6.48,0,74,0,1,0,2,4,0,80
no run,2,Australia,7,Pakistan,3rd innings,0,"slower delivery outsider off, 108 kph, guided towards point with a dab","Wahab Riaz to Khawaja, no run",0,43590,Wahab Riaz,0,21,1,3.3,14,43685,Yasir Shah,0,30,0,5.0,44,215155,Usman Khawaja,19,42,1,0,267192,Steven Smith,3,7,0,0,3,False,0,0,0,0,0,13,2,0,False,,False,False,6.4,0,75,0,1,0,2,4,0,80
no run,2,Australia,7,Pakistan,3rd innings,0,"141 kph, fullish length in a fourth-stump channel, defended into the off side","Wahab Riaz to Khawaja, no run",0,43590,Wahab Riaz,0,22,1,3.4,14,43685,Yasir Shah,0,30,0,5.0,44,215155,Usman Khawaja,19,43,1,0,267192,Steven Smith,3,7,0,0,4,False,0,0,0,0,0,13,2,0,False,,False,False,6.31,0,76,0,1,0,2,4,0,80
run,2,Australia,7,Pakistan,3rd innings,1,"144 kph, nudged off his hips towards square leg","Wahab Riaz to Khawaja, 1 run",0,43590,Wahab Riaz,0,23,1,3.5,15,43685,Yasir Shah,0,30,0,5.0,44,215155,Usman Khawaja,20,44,1,0,267192,Steven Smith,3,7,0,0,5,False,0,0,0,0,0,13,2,0,False,,False,False,6.31,0,77,0,1,0,2,4,0,81
no run,2,Australia,7,Pakistan,3rd innings,0,"144 kph, <b>ouuuch</b>. Back of a length outside off, Smith gets across, looking to pull but inside-edges the ball into an area of ridicule. Writhing in pain while the rest of the players enjoy a giggle.","Wahab Riaz to Smith, no run",0,43590,Wahab Riaz,0,24,1,4.0,15,43685,Yasir Shah,0,30,0,5.0,44,267192,Steven Smith,3,8,0,0,215155,Usman Khawaja,20,44,1,0,6,True,0,0,0,0,0,13,2,0,False,,False,False,6.23,0,78,0,1,0,2,4,0,81
run,2,Australia,7,Pakistan,3rd innings,1,"flat delivery outside off, 90 kph, patted away towards point","Yasir Shah to Khawaja, 1 run",0,43685,Yasir Shah,0,31,0,5.1,45,43590,Wahab Riaz,0,24,1,4.0,15,215155,Usman Khawaja,21,45,1,0,267192,Steven Smith,3,8,0,0,1,False,0,0,0,0,0,14,5,0,False,,False,False,6.22,0,79,0,1,0,2,4,0,82
no run,2,Australia,7,Pakistan,3rd innings,0,"well bowled. Smith comes forward, Smith dances down but Yasir fires it wide outside off, Smith improvises a dab into the off side","Yasir Shah to Smith, no run",0,43685,Yasir Shah,0,32,0,5.2,45,43590,Wahab Riaz,0,24,1,4.0,15,267192,Steven Smith,3,9,0,0,215155,Usman Khawaja,21,45,1,0,2,False,0,0,0,0,0,14,5,0,False,,False,False,6.15,0,80,0,1,0,2,4,0,82
no run,2,Australia,7,Pakistan,3rd innings,0,"short and wide outside off, cut to point","Yasir Shah to Smith, no run",0,43685,Yasir Shah,0,33,0,5.3,45,43590,Wahab Riaz,0,24,1,4.0,15,267192,Steven Smith,3,10,0,0,215155,Usman Khawaja,21,45,1,0,3,False,0,0,0,0,0,14,5,0,False,,False,False,6.07,0,81,0,1,0,2,4,0,82
run,2,Australia,7,Pakistan,3rd innings,1,"flight on middle and leg, pushed to mid-on for one","Yasir Shah to Smith, 1 run",0,43685,Yasir Shah,0,34,0,5.4,46,43590,Wahab Riaz,0,24,1,4.0,15,267192,Steven Smith,4,11,0,0,215155,Usman Khawaja,21,45,1,0,4,False,0,0,0,0,0,14,5,0,False,,False,False,6.07,0,82,0,1,0,2,4,0,83
bye,2,Australia,7,Pakistan,3rd innings,3,"<strong>missed stumping</strong>. Sarfraz misses another. I'm not going to say it's easy because it wasn't, but he should have done better  to at least try and get close to the ball. Flat and wide outside off, Khawaja comes down, Yasir darts it wider. Khawaja can't lay bat on his steer. Just grazes Sarfraz's gloves on the way to third man. His gloves hardly moved. The ball isn't going to come where your glove is. Excellent bowling from yasir","Yasir Shah to Khawaja, 3 byes",0,43685,Yasir Shah,0,35,0,5.5,46,43590,Wahab Riaz,0,24,1,4.0,15,215155,Usman Khawaja,21,46,1,0,267192,Steven Smith,4,11,0,0,5,False,0,0,0,3,0,14,5,0,False,,False,False,6.21,3,83,0,1,0,2,4,0,86
no run,2,Australia,7,Pakistan,3rd innings,0,cut to point,"Yasir Shah to Smith, no run",0,43685,Yasir Shah,0,36,0,6.0,46,43590,Wahab Riaz,0,24,1,4.0,15,267192,Steven Smith,4,12,0,0,215155,Usman Khawaja,21,46,1,0,6,True,0,0,0,0,0,14,5,0,False,,False,False,6.14,0,84,0,1,0,2,4,0,86
no run,2,Australia,7,Pakistan,3rd innings,0,"good length on middle and leg, defended","Wahab Riaz to Khawaja, no run",0,43590,Wahab Riaz,0,25,1,4.1,15,43685,Yasir Shah,0,36,0,6.0,46,215155,Usman Khawaja,21,47,1,0,267192,Steven Smith,4,12,0,0,1,False,0,0,0,0,0,15,3,0,False,,False,False,6.07,0,85,0,1,0,2,4,0,86
no run,2,Australia,7,Pakistan,3rd innings,0,"good length around off, pushed back towards mid-on","Wahab Riaz to Khawaja, no run",0,43590,Wahab Riaz,0,26,1,4.2,15,43685,Yasir Shah,0,36,0,6.0,46,215155,Usman Khawaja,21,48,1,0,267192,Steven Smith,4,12,0,0,2,False,0,0,0,0,0,15,3,0,False,,False,False,6.0,0,86,0,1,0,2,4,0,86
run,2,Australia,7,Pakistan,3rd innings,2,"on the pads, worked through backward square leg for two. Played that well","Wahab Riaz to Khawaja, 2 runs",0,43590,Wahab Riaz,0,27,1,4.3,17,43685,Yasir Shah,0,36,0,6.0,46,215155,Usman Khawaja,23,49,1,0,267192,Steven Smith,4,12,0,0,3,False,0,0,0,0,0,15,3,0,False,,False,False,6.06,0,87,0,1,0,2,4,0,88
no run,2,Australia,7,Pakistan,3rd innings,0,"138 kph, bouncer on off, Khawaja hustles underneath","Wahab Riaz to Khawaja, no run",0,43590,Wahab Riaz,0,28,1,4.4,17,43685,Yasir Shah,0,36,0,6.0,46,215155,Usman Khawaja,23,50,1,0,267192,Steven Smith,4,12,0,0,4,False,0,0,0,0,0,15,3,0,False,,False,False,6.0,0,88,0,1,0,2,4,0,88
wide,2,Australia,7,Pakistan,3rd innings,1,"a bouncer outside off, loops over Khawaja and wide called","Wahab Riaz to Khawaja, 1 wide",0,43590,Wahab Riaz,0,28,1,4.4,18,43685,Yasir Shah,0,36,0,6.0,46,215155,Usman Khawaja,23,50,1,0,267192,Steven Smith,4,12,0,0,5,False,0,0,1,0,0,15,3,0,False,,False,False,6.06,0,88,0,1,0,2,4,1,89
no run,2,Australia,7,Pakistan,3rd innings,0,"140 kph, full delivery outside off, driven away towards mid-off","Wahab Riaz to Khawaja, no run",0,43590,Wahab Riaz,0,29,1,4.5,18,43685,Yasir Shah,0,36,0,6.0,46,215155,Usman Khawaja,23,51,1,0,267192,Steven Smith,4,12,0,0,6,False,0,0,0,0,0,15,3,0,False,,False,False,6.0,0,89,0,1,0,2,4,0,89
no run,2,Australia,7,Pakistan,3rd innings,0,"137 kph, keeps a tad low outside off, bunted away towards cover","Wahab Riaz to Khawaja, no run",0,43590,Wahab Riaz,0,30,1,5.0,18,43685,Yasir Shah,0,36,0,6.0,46,215155,Usman Khawaja,23,52,1,0,267192,Steven Smith,4,12,0,0,7,True,0,0,0,0,0,15,3,0,False,,False,False,5.93,0,90,0,1,0,2,4,0,89
run,2,Australia,7,Pakistan,3rd innings,2,"shortish and wide outside off, slashed away through point for a couple. Nicely played","Yasir Shah to Smith, 2 runs",0,43685,Yasir Shah,0,37,0,6.1,48,43590,Wahab Riaz,0,30,1,5.0,18,267192,Steven Smith,6,13,0,0,215155,Usman Khawaja,23,52,1,0,1,False,0,0,0,0,0,16,12,0,False,,False,False,6.0,0,91,0,1,0,2,4,0,91
run,2,Australia,7,Pakistan,3rd innings,2,"slow outside off, some spin. Smith whips the ball from well outside towards midwicket for two more.","Yasir Shah to Smith, 2 runs",0,43685,Yasir Shah,0,38,0,6.2,50,43590,Wahab Riaz,0,30,1,5.0,18,267192,Steven Smith,8,14,0,0,215155,Usman Khawaja,23,52,1,0,2,False,0,0,0,0,0,16,12,0,False,,False,False,6.06,0,92,0,1,0,2,4,0,93
four,2,Australia,7,Pakistan,3rd innings,4,"comes down the pitch, gets to the pitch and shovels the ball to the long-on boundary with a wristy flick","Yasir Shah to Smith, FOUR runs",0,43685,Yasir Shah,0,39,0,6.3,54,43590,Wahab Riaz,0,30,1,5.0,18,267192,Steven Smith,12,15,1,0,215155,Usman Khawaja,23,52,1,0,3,False,0,0,0,0,0,16,12,0,False,,False,False,6.25,0,93,0,1,0,2,4,0,97
no run,2,Australia,7,Pakistan,3rd innings,0,"86 kph, flat delivery outside off, dabbed away towards point","Yasir Shah to Smith, no run",0,43685,Yasir Shah,0,40,0,6.4,54,43590,Wahab Riaz,0,30,1,5.0,18,267192,Steven Smith,12,16,1,0,215155,Usman Khawaja,23,52,1,0,4,False,0,0,0,0,0,16,12,0,False,,False,False,6.19,0,94,0,1,0,2,4,0,97
four,2,Australia,7,Pakistan,3rd innings,4,"short this time on middle, pulled away over midwicket. Picked the length early and dispatched it away. Superb shot","Yasir Shah to Smith, FOUR runs",0,43685,Yasir Shah,0,41,0,6.5,58,43590,Wahab Riaz,0,30,1,5.0,18,267192,Steven Smith,16,17,2,0,215155,Usman Khawaja,23,52,1,0,5,False,0,0,0,0,0,16,12,0,False,,False,False,6.37,0,95,0,1,0,2,4,0,101
no run,2,Australia,7,Pakistan,3rd innings,0,driven back towards Yasir,"Yasir Shah to Smith, no run",0,43685,Yasir Shah,0,42,0,7.0,58,43590,Wahab Riaz,0,30,1,5.0,18,267192,Steven Smith,16,18,2,0,215155,Usman Khawaja,23,52,1,0,6,True,0,0,0,0,0,16,12,0,False,,False,False,6.31,0,96,0,1,0,2,4,0,101
run,2,Australia,7,Pakistan,3rd innings,2,"flat down leg, worked down towards square leg for a run","Azhar Ali to Khawaja, 2 runs",0,39037,Azhar Ali,0,1,0,0.1,2,43685,Yasir Shah,0,42,0,7.0,58,215155,Usman Khawaja,25,53,1,0,267192,Steven Smith,16,18,2,0,1,False,0,0,0,0,0,17,6,0,False,,False,False,6.37,0,97,0,1,0,2,4,0,103
no run,2,Australia,7,Pakistan,3rd innings,0,"flat outside off, defended","Azhar Ali to Khawaja, no run",0,39037,Azhar Ali,0,2,0,0.2,2,43685,Yasir Shah,0,42,0,7.0,58,215155,Usman Khawaja,25,54,1,0,267192,Steven Smith,16,18,2,0,2,False,0,0,0,0,0,17,6,0,False,,False,False,6.3,0,98,0,1,0,2,4,0,103
no run,2,Australia,7,Pakistan,3rd innings,0,"86 kph, outside off, worked to short leg","Azhar Ali to Khawaja, no run",0,39037,Azhar Ali,0,3,0,0.3,2,43685,Yasir Shah,0,42,0,7.0,58,215155,Usman Khawaja,25,55,1,0,267192,Steven Smith,16,18,2,0,3,False,0,0,0,0,0,17,6,0,False,,False,False,6.24,0,99,0,1,0,2,4,0,103
no run,2,Australia,7,Pakistan,3rd innings,0,"flatter delivery outside off, Khawaja dabs the ball towards gully. Younis dives to his left, uses his right hand to stop some runs","Azhar Ali to Khawaja, no run",0,39037,Azhar Ali,0,4,0,0.4,2,43685,Yasir Shah,0,42,0,7.0,58,215155,Usman Khawaja,25,56,1,0,267192,Steven Smith,16,18,2,0,4,False,0,0,0,0,0,17,6,0,False,,False,False,6.18,0,100,0,1,0,2,4,0,103
no run,2,Australia,7,Pakistan,3rd innings,0,defended off the front foot,"Azhar Ali to Khawaja, no run",0,39037,Azhar Ali,0,5,0,0.5,2,43685,Yasir Shah,0,42,0,7.0,58,215155,Usman Khawaja,25,57,1,0,267192,Steven Smith,16,18,2,0,5,False,0,0,0,0,0,17,6,0,False,,False,False,6.11,0,101,0,1,0,2,4,0,103
four,2,Australia,7,Pakistan,3rd innings,4,"driven beautifully through cover for four. Too full, played against the spin, but did so with exceptional ease","Azhar Ali to Khawaja, FOUR runs",0,39037,Azhar Ali,0,6,0,1.0,6,43685,Yasir Shah,0,42,0,7.0,58,215155,Usman Khawaja,29,58,2,0,267192,Steven Smith,16,18,2,0,6,True,0,0,0,0,0,17,6,0,False,,False,False,6.29,0,102,0,1,0,2,4,0,107
no run,2,Australia,7,Pakistan,3rd innings,0,a flick of the wrists to drive to cover,"Yasir Shah to Smith, no run",0,43685,Yasir Shah,0,43,0,7.1,58,39037,Azhar Ali,0,6,0,1.0,6,267192,Steven Smith,16,19,2,0,215155,Usman Khawaja,29,58,2,0,1,False,0,0,0,0,0,18,10,0,False,,False,False,6.23,0,103,0,1,0,2,4,0,107
run,2,Australia,7,Pakistan,3rd innings,2,"flat and wide outside off, Smith works the ball through backward square leg for a couple","Yasir Shah to Smith, 2 runs",0,43685,Yasir Shah,0,44,0,7.2,60,39037,Azhar Ali,0,6,0,1.0,6,267192,Steven Smith,18,20,2,0,215155,Usman Khawaja,29,58,2,0,2,False,0,0,0,0,0,18,10,0,False,,False,False,6.28,0,104,0,1,0,2,4,0,109
run,2,Australia,7,Pakistan,3rd innings,1,"flat delivery outside off, punched to long-off","Yasir Shah to Smith, 1 run",0,43685,Yasir Shah,0,45,0,7.3,61,39037,Azhar Ali,0,6,0,1.0,6,267192,Steven Smith,19,21,2,0,215155,Usman Khawaja,29,58,2,0,3,False,0,0,0,0,0,18,10,0,False,,False,False,6.28,0,105,0,1,0,2,4,0,110
no run,2,Australia,7,Pakistan,3rd innings,0,"tossed up outside off, Khawaja gets forward and defends","Yasir Shah to Khawaja, no run",0,43685,Yasir Shah,0,46,0,7.4,61,39037,Azhar Ali,0,6,0,1.0,6,215155,Usman Khawaja,29,59,2,0,267192,Steven Smith,19,21,2,0,4,False,0,0,0,0,0,18,10,0,False,,False,False,6.22,0,106,0,1,0,2,4,0,110
run,2,Australia,7,Pakistan,3rd innings,1,"drifts down leg, clipped for a run to short fine leg","Yasir Shah to Khawaja, 1 run",0,43685,Yasir Shah,0,47,0,7.5,62,39037,Azhar Ali,0,6,0,1.0,6,215155,Usman Khawaja,30,60,2,0,267192,Steven Smith,19,21,2,0,5,False,0,0,0,0,0,18,10,0,False,,False,False,6.22,0,107,0,1,0,2,4,0,111
six,2,Australia,7,Pakistan,3rd innings,6,"flight outside off, Smith gets down and heaves the ball way over midwicket for six. What a way to <strong>finish the session</strong>","Yasir Shah to Smith, SIX runs",0,43685,Yasir Shah,0,48,0,8.0,68,39037,Azhar Ali,0,6,0,1.0,6,267192,Steven Smith,25,22,2,1,215155,Usman Khawaja,30,60,2,0,6,True,0,0,0,0,0,18,10,0,False,,False,False,6.5,0,108,0,1,0,2,4,0,117
no run,2,Australia,7,Pakistan,3rd innings,0,"starts with a full delivery outside off, driven out towards cover","Wahab Riaz to Khawaja, no run",0,43590,Wahab Riaz,0,31,1,5.1,18,43685,Yasir Shah,0,48,0,8.0,68,215155,Usman Khawaja,30,61,2,0,267192,Steven Smith,25,22,2,1,1,False,0,0,0,0,0,19,3,0,False,,False,False,6.44,0,109,0,1,0,3,4,0,117
no run,2,Australia,7,Pakistan,3rd innings,0,"141 kph, quick and accurate, close to off. Blocked","Wahab Riaz to Khawaja, no run",0,43590,Wahab Riaz,0,32,1,5.2,18,43685,Yasir Shah,0,48,0,8.0,68,215155,Usman Khawaja,30,62,2,0,267192,Steven Smith,25,22,2,1,2,False,0,0,0,0,0,19,3,0,False,,False,False,6.38,0,110,0,1,0,3,4,0,117
no run,2,Australia,7,Pakistan,3rd innings,0,"back of a length outside off, pulled towards midwicket. Wanted that finer","Wahab Riaz to Khawaja, no run",0,43590,Wahab Riaz,0,33,1,5.3,18,43685,Yasir Shah,0,48,0,8.0,68,215155,Usman Khawaja,30,63,2,0,267192,Steven Smith,25,22,2,1,3,False,0,0,0,0,0,19,3,0,False,,False,False,6.32,0,111,0,1,0,3,4,0,117
run,2,Australia,7,Pakistan,3rd innings,3,"nicely played. Back of a length outside off, punched through cover for three. Easily made","Wahab Riaz to Khawaja, 3 runs",0,43590,Wahab Riaz,0,34,1,5.4,21,43685,Yasir Shah,0,48,0,8.0,68,215155,Usman Khawaja,33,64,2,0,267192,Steven Smith,25,22,2,1,4,False,0,0,0,0,0,19,3,0,False,,False,False,6.42,0,112,0,1,0,3,4,0,120
no run,2,Australia,7,Pakistan,3rd innings,0,"128 kph, slower ball down leg. Smith walks right across, exposes his leg stump but the ball bounces over.","Wahab Riaz to Smith, no run",0,43590,Wahab Riaz,0,35,1,5.5,21,43685,Yasir Shah,0,48,0,8.0,68,267192,Steven Smith,25,23,2,1,215155,Usman Khawaja,33,64,2,0,5,False,0,0,0,0,0,19,3,0,False,,False,False,6.37,0,113,0,1,0,3,4,0,120
no run,2,Australia,7,Pakistan,3rd innings,0,"full delivery outside off, Smith stays in his crease, looking to nail one through cover. Gets a thick inside-edge into his body. Shows the importance of footwork","Wahab Riaz to Smith, no run",0,43590,Wahab Riaz,0,36,1,6.0,21,43685,Yasir Shah,0,48,0,8.0,68,267192,Steven Smith,25,24,2,1,215155,Usman Khawaja,33,64,2,0,6,True,0,0,0,0,0,19,3,0,False,,False,False,6.31,0,114,0,1,0,3,4,0,120
run,2,Australia,7,Pakistan,3rd innings,1,"flat and wide outside off, 89 kph, pushed towards point for one","Yasir Shah to Khawaja, 1 run",0,43685,Yasir Shah,0,49,0,8.1,69,43590,Wahab Riaz,0,36,1,6.0,21,215155,Usman Khawaja,34,65,2,0,267192,Steven Smith,25,24,2,1,1,False,0,0,0,0,0,20,9,0,False,,False,False,6.31,0,115,0,1,0,3,4,0,121
no run,2,Australia,7,Pakistan,3rd innings,0,"nice idea, flawed execution. Flat outside off, Smith wanted to scythe that just wide of Younis at slip. No connection","Yasir Shah to Smith, no run",0,43685,Yasir Shah,0,50,0,8.2,69,43590,Wahab Riaz,0,36,1,6.0,21,267192,Steven Smith,25,25,2,1,215155,Usman Khawaja,34,65,2,0,2,False,0,0,0,0,0,20,9,0,False,,False,False,6.25,0,116,0,1,0,3,4,0,121
run,2,Australia,7,Pakistan,3rd innings,2,a fine paddle sweep down towards fine leg for a couple. Leading edge,"Yasir Shah to Smith, 2 runs",0,43685,Yasir Shah,0,51,0,8.3,71,43590,Wahab Riaz,0,36,1,6.0,21,267192,Steven Smith,27,26,2,1,215155,Usman Khawaja,34,65,2,0,3,False,0,0,0,0,0,20,9,0,False,,False,False,6.3,0,117,0,1,0,3,4,0,123
run,2,Australia,7,Pakistan,3rd innings,2,"short and wide, 92 kph, crashed straight to deep cover. Smith somehow comes back for two. Superb","Yasir Shah to Smith, 2 runs",0,43685,Yasir Shah,0,52,0,8.4,73,43590,Wahab Riaz,0,36,1,6.0,21,267192,Steven Smith,29,27,2,1,215155,Usman Khawaja,34,65,2,0,4,False,0,0,0,0,0,20,9,0,False,,False,False,6.35,0,118,0,1,0,3,4,0,125
run,2,Australia,7,Pakistan,3rd innings,1,"on the pads, flicked away merrily through midwicket for a run. Lovely stroke","Yasir Shah to Smith, 1 run",0,43685,Yasir Shah,0,53,0,8.5,74,43590,Wahab Riaz,0,36,1,6.0,21,267192,Steven Smith,30,28,2,1,215155,Usman Khawaja,34,65,2,0,5,False,0,0,0,0,0,20,9,0,False,,False,False,6.35,0,119,0,1,0,3,4,0,126
run,2,Australia,7,Pakistan,3rd innings,3,another fine paddle. Sees the fielder is in but square. Gets it fine. Three more. Just simple field manipulation,"Yasir Shah to Khawaja, 3 runs",0,43685,Yasir Shah,0,54,0,9.0,77,43590,Wahab Riaz,0,36,1,6.0,21,215155,Usman Khawaja,37,66,2,0,267192,Steven Smith,30,28,2,1,6,True,0,0,0,0,0,20,9,0,False,,False,False,6.45,0,120,0,1,0,3,4,0,129
run,2,Australia,7,Pakistan,3rd innings,1,"legcutter on off, Khawaja sees it early and flicks to deep square leg","Wahab Riaz to Khawaja, 1 run",0,43590,Wahab Riaz,0,37,1,6.1,22,43685,Yasir Shah,0,54,0,9.0,77,215155,Usman Khawaja,38,67,2,0,267192,Steven Smith,30,28,2,1,1,False,0,0,0,0,0,21,7,0,False,,False,False,6.44,0,121,0,1,0,3,4,0,130
four,2,Australia,7,Pakistan,3rd innings,4,"good length and straight, Smith gets across, but the ball is too straight. Somehow he is able to drag the ball down to fine leg with a fine whip. Power in those wrists with fast hands","Wahab Riaz to Smith, FOUR runs",0,43590,Wahab Riaz,0,38,1,6.2,26,43685,Yasir Shah,0,54,0,9.0,77,267192,Steven Smith,34,29,3,1,215155,Usman Khawaja,38,67,2,0,2,False,0,0,0,0,0,21,7,0,False,,False,False,6.59,0,122,0,1,0,3,4,0,134
run,2,Australia,7,Pakistan,3rd innings,1,worked through midwicket for a run again. Just a nudge. Not bad bowling at all,"Wahab Riaz to Smith, 1 run",0,43590,Wahab Riaz,0,39,1,6.3,27,43685,Yasir Shah,0,54,0,9.0,77,267192,Steven Smith,35,30,3,1,215155,Usman Khawaja,38,67,2,0,3,False,0,0,0,0,0,21,7,0,False,,False,False,6.58,0,123,0,1,0,3,4,0,135
no run,2,Australia,7,Pakistan,3rd innings,0,"nice bouncer. Well directed, on off. Khawaja gets underneath that","Wahab Riaz to Khawaja, no run",0,43590,Wahab Riaz,0,40,1,6.4,27,43685,Yasir Shah,0,54,0,9.0,77,215155,Usman Khawaja,38,68,2,0,267192,Steven Smith,35,30,3,1,4,False,0,0,0,0,0,21,7,0,False,,False,False,6.53,0,124,0,1,0,3,4,0,135
run,2,Australia,7,Pakistan,3rd innings,1,"another bouncer, decent direction. Pulled down to fine leg for one","Wahab Riaz to Khawaja, 1 run",0,43590,Wahab Riaz,0,41,1,6.5,28,43685,Yasir Shah,0,54,0,9.0,77,215155,Usman Khawaja,39,69,2,0,267192,Steven Smith,35,30,3,1,5,False,0,0,0,0,0,21,7,0,False,,False,False,6.52,0,125,0,1,0,3,4,0,136
no run,2,Australia,7,Pakistan,3rd innings,0,goes well down leg again. Smith has shuffled too far across and can't make contact,"Wahab Riaz to Smith, no run",0,43590,Wahab Riaz,0,42,1,7.0,28,43685,Yasir Shah,0,54,0,9.0,77,267192,Steven Smith,35,31,3,1,215155,Usman Khawaja,39,69,2,0,6,True,0,0,0,0,0,21,7,0,False,,False,False,6.47,0,126,0,1,0,3,4,0,136
run,2,Australia,7,Pakistan,3rd innings,1,"good length outside off, swatted through square leg for one.","Imran Khan to Khawaja, 1 run",0,316363,Imran Khan,2,25,0,4.1,21,43590,Wahab Riaz,0,42,1,7.0,28,215155,Usman Khawaja,40,70,2,0,267192,Steven Smith,35,31,3,1,1,False,0,0,0,0,0,22,11,0,False,,False,False,6.47,0,127,0,1,0,3,4,0,137
run,2,Australia,7,Pakistan,3rd innings,1,flicked through square leg for one,"Imran Khan to Smith, 1 run",0,316363,Imran Khan,2,26,0,4.2,22,43590,Wahab Riaz,0,42,1,7.0,28,267192,Steven Smith,36,32,3,1,215155,Usman Khawaja,40,70,2,0,2,False,0,0,0,0,0,22,11,0,False,,False,False,6.46,0,128,0,1,0,3,4,0,138
run,2,Australia,7,Pakistan,3rd innings,1,"full and very wide outside off, creamed to deep point with a scythed drive","Imran Khan to Khawaja, 1 run",0,316363,Imran Khan,2,27,0,4.3,23,43590,Wahab Riaz,0,42,1,7.0,28,215155,Usman Khawaja,41,71,2,0,267192,Steven Smith,36,32,3,1,3,False,0,0,0,0,0,22,11,0,False,,False,False,6.46,0,129,0,1,0,3,4,0,139
four,2,Australia,7,Pakistan,3rd innings,4,"shovelled through midwicket. Full and straight, Smith wants to go straight but can't. Off the inside half and into the gap","Imran Khan to Smith, FOUR runs",0,316363,Imran Khan,2,28,0,4.4,27,43590,Wahab Riaz,0,42,1,7.0,28,267192,Steven Smith,40,33,4,1,215155,Usman Khawaja,41,71,2,0,4,False,0,0,0,0,0,22,11,0,False,,False,False,6.6,0,130,0,1,0,3,4,0,143
no run,2,Australia,7,Pakistan,3rd innings,0,"on a length around off, defended","Imran Khan to Smith, no run",0,316363,Imran Khan,2,29,0,4.5,27,43590,Wahab Riaz,0,42,1,7.0,28,267192,Steven Smith,40,34,4,1,215155,Usman Khawaja,41,71,2,0,5,False,0,0,0,0,0,22,11,0,False,,False,False,6.54,0,131,0,1,0,3,4,0,143
