PlayType_description,Batting_Team_id,Batting_Team_name,Bowling_Team_id,Bowling_Team_name,Innings,Total_Runs_on_delivery,Commentary,Commentary_short,Score,Bowler_id,Bowler_name,Bowler_maiden,Bowler_balls,Bowler_wickets,Bowler_over,Bowler_conceded,Other_Bowler_id,Other_Bowler_name,Other_Bowler_maidens,Other_Bowler_balls,Other_Bowler_wickets,Other_Bowler_overs,Other_Bowler_conceded,Batsman_id,Batsman_name,Batsman_runs,Batsman_balls_faced,Batsman_four,Batsman_sixes,Other_Batsman_id,Other_Batsman_name,Other_Batsman_runs,Other_Batsman_balls_faced,Other_Batsman_four,Other_Batsman_sixes,Over_ball,Over_complete,Over_maiden,Over_no_Ball,Over_wide,Over_byes,Over_leg_byes,Over_number,Over_runs,Over_wickets,Dismissal_is_true,Dismissal_type,Dismissal_fielder_iskeeper,Dismissal_text,Innings_run_rate,Innings_byes,Innings_balls,Innings_no_balls,Innings_wickets,Innings_leg_byes,Innings_session,Innings_day,Innings_wides,Innings_runs
no run,2,Australia,7,Pakistan,1st innings,0,"fuller and wide outside off, left alone","Imran Khan to Renshaw, no run",384/3,316363,Imran Khan,3,118,0,19.4,94,290948,Mohammad Amir,1,114,0,19.0,64,722303,Matt Renshaw,182,291,20,0,334337,Peter Handscomb,44,100,4,0,4,False,0,0,0,0,0,94,6,1,False,,False,False,4.09,0,562,0,3,0,1,2,0,384
run,2,Australia,7,Pakistan,1st innings,2,"lovely bowling. Renshaw shuffles right across and Imran aims for middle and leg. The stumps are exposed. But Renshaw is in lovely touch, flicks down towards fine leg","Imran Khan to Renshaw, 2 runs",386/3,316363,Imran Khan,3,119,0,19.5,96,290948,Mohammad Amir,1,114,0,19.0,64,722303,Matt Renshaw,184,292,20,0,334337,Peter Handscomb,44,100,4,0,5,False,0,0,0,0,0,94,6,1,False,,False,False,4.11,0,563,0,3,0,1,2,0,386
out,2,Australia,7,Pakistan,1st innings,0,"and Renshaw's innings ends. Superb knock from the 20-year-old. What were you doing when you were 20? A good length delivery outside off, Renshaw plants his front foot forward, slightly across like usual. Wanted to dab one down to third man but the holds its line, unlike the previous deliveries, takes the inside edge and knocks into the stumps. A loud ovation for Renshaw","Imran Khan to Renshaw, OUT",386/4,316363,Imran Khan,3,120,1,20.0,96,290948,Mohammad Amir,1,114,0,19.0,64,722303,Matt Renshaw,184,293,20,0,334337,Peter Handscomb,44,100,4,0,6,True,0,0,0,0,0,94,6,1,True,bowled,False,MT Renshaw  b Imran Khan 184 (413m 293b 20x4 0x6) SR: 62.79,4.1,0,564,0,4,0,1,2,0,386
run,2,Australia,7,Pakistan,1st innings,2,a thick inside edge towards midwicket and the pair get two easily,"Mohammad Amir to Handscomb, 2 runs",388/4,290948,Mohammad Amir,1,115,0,19.1,66,316363,Imran Khan,3,120,1,20.0,96,334337,Peter Handscomb,46,101,4,0,557295,Hilton Cartwright,0,0,0,0,1,False,0,0,0,0,0,95,11,0,False,,False,False,4.12,0,565,0,4,0,1,2,0,388
run,2,Australia,7,Pakistan,1st innings,2,"135 kph, back of a length on off, Handscomb gets on top of the bounce and pulls through midwicket for a couple","Mohammad Amir to Handscomb, 2 runs",390/4,290948,Mohammad Amir,1,116,0,19.2,68,316363,Imran Khan,3,120,1,20.0,96,334337,Peter Handscomb,48,102,4,0,557295,Hilton Cartwright,0,0,0,0,2,False,0,0,0,0,0,95,11,0,False,,False,False,4.13,0,566,0,4,0,1,2,0,390
run,2,Australia,7,Pakistan,1st innings,1,carved down to third man for one,"Mohammad Amir to Handscomb, 1 run",391/4,290948,Mohammad Amir,1,117,0,19.3,69,316363,Imran Khan,3,120,1,20.0,96,334337,Peter Handscomb,49,103,4,0,557295,Hilton Cartwright,0,0,0,0,3,False,0,0,0,0,0,95,11,0,False,,False,False,4.13,0,567,0,4,0,1,2,0,391
four,2,Australia,7,Pakistan,1st innings,4,"off the mark off his first ball. How easy is Test cricket? Full delivery outside off, Cartwright leans forward and sends the ball whistling away through cover. Shot.","Mohammad Amir to Cartwright, FOUR runs",395/4,290948,Mohammad Amir,1,118,0,19.4,73,316363,Imran Khan,3,120,1,20.0,96,557295,Hilton Cartwright,4,1,1,0,334337,Peter Handscomb,49,103,4,0,4,False,0,0,0,0,0,95,11,0,False,,False,False,4.17,0,568,0,4,0,1,2,0,395
no run,2,Australia,7,Pakistan,1st innings,0,"big inside edge into his paad. Full and straight, Cartwright presses forward","Mohammad Amir to Cartwright, no run",395/4,290948,Mohammad Amir,1,119,0,19.5,73,316363,Imran Khan,3,120,1,20.0,96,557295,Hilton Cartwright,4,2,1,0,334337,Peter Handscomb,49,103,4,0,5,False,0,0,0,0,0,95,11,0,False,,False,False,4.16,0,569,0,4,0,1,2,0,395
run,2,Australia,7,Pakistan,1st innings,2,"140 kph, slightly leg side-ish, worked towards midwicket for a couple more. Sprightly beginning","Mohammad Amir to Cartwright, 2 runs",397/4,290948,Mohammad Amir,1,120,0,20.0,75,316363,Imran Khan,3,120,1,20.0,96,557295,Hilton Cartwright,6,3,1,0,334337,Peter Handscomb,49,103,4,0,6,True,0,0,0,0,0,95,11,0,False,,False,False,4.17,0,570,0,4,0,1,2,0,397
no run,2,Australia,7,Pakistan,1st innings,0,"lovely length to Handsomb. Full and straight, some movement. Defended from the back foot","Imran Khan to Handscomb, no run",397/4,316363,Imran Khan,3,121,1,20.1,96,290948,Mohammad Amir,1,120,0,20.0,75,334337,Peter Handscomb,49,104,4,0,557295,Hilton Cartwright,6,3,1,0,1,False,0,0,0,0,0,96,1,0,False,,False,False,4.17,0,571,0,4,0,1,2,0,397
no run,2,Australia,7,Pakistan,1st innings,0,"131 kph, full and straight, blocked to mid-off","Imran Khan to Handscomb, no run",397/4,316363,Imran Khan,3,122,1,20.2,96,290948,Mohammad Amir,1,120,0,20.0,75,334337,Peter Handscomb,49,105,4,0,557295,Hilton Cartwright,6,3,1,0,2,False,0,0,0,0,0,96,1,0,False,,False,False,4.16,0,572,0,4,0,1,2,0,397
no run,2,Australia,7,Pakistan,1st innings,0,"fullish delivery a tad wide outside off, no stroke","Imran Khan to Handscomb, no run",397/4,316363,Imran Khan,3,123,1,20.3,96,290948,Mohammad Amir,1,120,0,20.0,75,334337,Peter Handscomb,49,106,4,0,557295,Hilton Cartwright,6,3,1,0,3,False,0,0,0,0,0,96,1,0,False,,False,False,4.15,0,573,0,4,0,1,2,0,397
no run,2,Australia,7,Pakistan,1st innings,0,"133 kph, fullish delivery outside off, inside-edged into the pad","Imran Khan to Handscomb, no run",397/4,316363,Imran Khan,3,124,1,20.4,96,290948,Mohammad Amir,1,120,0,20.0,75,334337,Peter Handscomb,49,107,4,0,557295,Hilton Cartwright,6,3,1,0,4,False,0,0,0,0,0,96,1,0,False,,False,False,4.14,0,574,0,4,0,1,2,0,397
no run,2,Australia,7,Pakistan,1st innings,0,"nice shot. Full delivery on off, whipped the ball towards square leg","Imran Khan to Handscomb, no run",397/4,316363,Imran Khan,3,125,1,20.5,96,290948,Mohammad Amir,1,120,0,20.0,75,334337,Peter Handscomb,49,108,4,0,557295,Hilton Cartwright,6,3,1,0,5,False,0,0,0,0,0,96,1,0,False,,False,False,4.14,0,575,0,4,0,1,2,0,397
run,2,Australia,7,Pakistan,1st innings,1,"too straight and <b>Handscomb has another fifty</b>. Worked down to fine leg. Not a bad Test average, more than 99.","Imran Khan to Handscomb, 1 run",398/4,316363,Imran Khan,3,126,1,21.0,97,290948,Mohammad Amir,1,120,0,20.0,75,334337,Peter Handscomb,50,109,4,0,557295,Hilton Cartwright,6,3,1,0,6,True,0,0,0,0,0,96,1,0,False,,False,False,4.14,0,576,0,4,0,1,2,0,398
no run,2,Australia,7,Pakistan,1st innings,0,"136 kph, fullish around off, Handscomb defends","Mohammad Amir to Handscomb, no run",398/4,290948,Mohammad Amir,1,121,0,20.1,75,316363,Imran Khan,3,126,1,21.0,97,334337,Peter Handscomb,50,110,4,0,557295,Hilton Cartwright,6,3,1,0,1,False,0,0,0,0,0,97,2,0,False,,False,False,4.13,0,577,0,4,0,1,2,0,398
no run,2,Australia,7,Pakistan,1st innings,0,"140 kph, around off, Handscomb defends towards point","Mohammad Amir to Handscomb, no run",398/4,290948,Mohammad Amir,1,122,0,20.2,75,316363,Imran Khan,3,126,1,21.0,97,334337,Peter Handscomb,50,111,4,0,557295,Hilton Cartwright,6,3,1,0,2,False,0,0,0,0,0,97,2,0,False,,False,False,4.13,0,578,0,4,0,1,2,0,398
no run,2,Australia,7,Pakistan,1st innings,0,"slower delivery, 121 kph, defended to mid-off","Mohammad Amir to Handscomb, no run",398/4,290948,Mohammad Amir,1,123,0,20.3,75,316363,Imran Khan,3,126,1,21.0,97,334337,Peter Handscomb,50,112,4,0,557295,Hilton Cartwright,6,3,1,0,3,False,0,0,0,0,0,97,2,0,False,,False,False,4.12,0,579,0,4,0,1,2,0,398
run,2,Australia,7,Pakistan,1st innings,2,"nicely driven. Full and wide outside off, crisply driven through extra cover for a couple to bring up Australia's 400","Mohammad Amir to Handscomb, 2 runs",400/4,290948,Mohammad Amir,1,124,0,20.4,77,316363,Imran Khan,3,126,1,21.0,97,334337,Peter Handscomb,52,113,4,0,557295,Hilton Cartwright,6,3,1,0,4,False,0,0,0,0,0,97,2,0,False,,False,False,4.13,0,580,0,4,0,1,2,0,400
no run,2,Australia,7,Pakistan,1st innings,0,"138 kph, on a length around off, defended to mid-on","Mohammad Amir to Handscomb, no run",400/4,290948,Mohammad Amir,1,125,0,20.5,77,316363,Imran Khan,3,126,1,21.0,97,334337,Peter Handscomb,52,114,4,0,557295,Hilton Cartwright,6,3,1,0,5,False,0,0,0,0,0,97,2,0,False,,False,False,4.13,0,581,0,4,0,1,2,0,400
no run,2,Australia,7,Pakistan,1st innings,0,"slower ball on leg, 124 kph, another solid defensive block","Mohammad Amir to Handscomb, no run",400/4,290948,Mohammad Amir,1,126,0,21.0,77,316363,Imran Khan,3,126,1,21.0,97,334337,Peter Handscomb,52,115,4,0,557295,Hilton Cartwright,6,3,1,0,6,True,0,0,0,0,0,97,2,0,False,,False,False,4.12,0,582,0,4,0,1,2,0,400
no run,2,Australia,7,Pakistan,1st innings,0,"hung outside off at 132 kph, left alone","Imran Khan to Cartwright, no run",400/4,316363,Imran Khan,3,127,1,21.1,97,290948,Mohammad Amir,1,126,0,21.0,77,557295,Hilton Cartwright,6,4,1,0,334337,Peter Handscomb,52,115,4,0,1,False,1,0,0,0,0,98,0,0,False,,False,False,4.11,0,583,0,4,0,1,2,0,400
no run,2,Australia,7,Pakistan,1st innings,0,"fullish delivery outside off, defended towards cover","Imran Khan to Cartwright, no run",400/4,316363,Imran Khan,3,128,1,21.2,97,290948,Mohammad Amir,1,126,0,21.0,77,557295,Hilton Cartwright,6,5,1,0,334337,Peter Handscomb,52,115,4,0,2,False,1,0,0,0,0,98,0,0,False,,False,False,4.1,0,584,0,4,0,1,2,0,400
no run,2,Australia,7,Pakistan,1st innings,0,"tight around off, 135 kph, blocked","Imran Khan to Cartwright, no run",400/4,316363,Imran Khan,3,129,1,21.3,97,290948,Mohammad Amir,1,126,0,21.0,77,557295,Hilton Cartwright,6,6,1,0,334337,Peter Handscomb,52,115,4,0,3,False,1,0,0,0,0,98,0,0,False,,False,False,4.1,0,585,0,4,0,1,2,0,400
no run,2,Australia,7,Pakistan,1st innings,0,"full and wide outside off, 132 kph, left alone","Imran Khan to Cartwright, no run",400/4,316363,Imran Khan,3,130,1,21.4,97,290948,Mohammad Amir,1,126,0,21.0,77,557295,Hilton Cartwright,6,7,1,0,334337,Peter Handscomb,52,115,4,0,4,False,1,0,0,0,0,98,0,0,False,,False,False,4.09,0,586,0,4,0,1,2,0,400
no run,2,Australia,7,Pakistan,1st innings,0,"full and straight, 130 kph, defended back.","Imran Khan to Cartwright, no run",400/4,316363,Imran Khan,3,131,1,21.5,97,290948,Mohammad Amir,1,126,0,21.0,77,557295,Hilton Cartwright,6,8,1,0,334337,Peter Handscomb,52,115,4,0,5,False,1,0,0,0,0,98,0,0,False,,False,False,4.08,0,587,0,4,0,1,2,0,400
no run,2,Australia,7,Pakistan,1st innings,0,"wide outside off, left alone. Good stuff, maiden","Imran Khan to Cartwright, no run",400/4,316363,Imran Khan,4,132,1,22.0,97,290948,Mohammad Amir,1,126,0,21.0,77,557295,Hilton Cartwright,6,9,1,0,334337,Peter Handscomb,52,115,4,0,6,True,1,0,0,0,0,98,0,0,False,,False,False,4.08,0,588,0,4,0,1,2,0,400
no run,2,Australia,7,Pakistan,1st innings,0,"short and wide, slashed to point's right. a good diving stop","Yasir Shah to Handscomb, no run",400/4,43685,Yasir Shah,2,181,1,30.1,132,316363,Imran Khan,4,132,1,22.0,97,334337,Peter Handscomb,52,116,4,0,557295,Hilton Cartwright,6,9,1,0,1,False,0,0,0,0,0,99,1,0,False,,False,False,4.07,0,589,0,4,0,1,2,0,400
no run,2,Australia,7,Pakistan,1st innings,0,"drift, shorter outside off, punched to cover","Yasir Shah to Handscomb, no run",400/4,43685,Yasir Shah,2,182,1,30.2,132,316363,Imran Khan,4,132,1,22.0,97,334337,Peter Handscomb,52,117,4,0,557295,Hilton Cartwright,6,9,1,0,2,False,0,0,0,0,0,99,1,0,False,,False,False,4.06,0,590,0,4,0,1,2,0,400
run,2,Australia,7,Pakistan,1st innings,1,"83 kph, clipped through midwicket for a run","Yasir Shah to Handscomb, 1 run",401/4,43685,Yasir Shah,2,183,1,30.3,133,316363,Imran Khan,4,132,1,22.0,97,334337,Peter Handscomb,53,118,4,0,557295,Hilton Cartwright,6,9,1,0,3,False,0,0,0,0,0,99,1,0,False,,False,False,4.07,0,591,0,4,0,1,2,0,401
no run,2,Australia,7,Pakistan,1st innings,0,"flat, pushed through on off, Cartwright goes back and punches to cover","Yasir Shah to Cartwright, no run",401/4,43685,Yasir Shah,2,184,1,30.4,133,316363,Imran Khan,4,132,1,22.0,97,557295,Hilton Cartwright,6,10,1,0,334337,Peter Handscomb,53,118,4,0,4,False,0,0,0,0,0,99,1,0,False,,False,False,4.06,0,592,0,4,0,1,2,0,401
no run,2,Australia,7,Pakistan,1st innings,0,gets right forward to defend,"Yasir Shah to Cartwright, no run",401/4,43685,Yasir Shah,2,185,1,30.5,133,316363,Imran Khan,4,132,1,22.0,97,557295,Hilton Cartwright,6,11,1,0,334337,Peter Handscomb,53,118,4,0,5,False,0,0,0,0,0,99,1,0,False,,False,False,4.05,0,593,0,4,0,1,2,0,401
no run,2,Australia,7,Pakistan,1st innings,0,"84 kph, slow through the air but a tad short outside off, defended into the off side","Yasir Shah to Cartwright, no run",401/4,43685,Yasir Shah,2,186,1,31.0,133,316363,Imran Khan,4,132,1,22.0,97,557295,Hilton Cartwright,6,12,1,0,334337,Peter Handscomb,53,118,4,0,6,True,0,0,0,0,0,99,1,0,False,,False,False,4.05,0,594,0,4,0,1,2,0,401
run,2,Australia,7,Pakistan,1st innings,1,"on the pads, flicked down to fine leg","Wahab Riaz to Handscomb, 1 run",402/4,43590,Wahab Riaz,4,115,2,19.1,64,43685,Yasir Shah,2,186,1,31.0,133,334337,Peter Handscomb,54,119,4,0,557295,Hilton Cartwright,6,12,1,0,1,False,0,0,0,0,0,100,2,0,False,,False,False,4.05,0,595,0,4,0,1,2,0,402
no run,2,Australia,7,Pakistan,1st innings,0,"136 kph, around middle and leg, defended into the leg side","Wahab Riaz to Cartwright, no run",402/4,43590,Wahab Riaz,4,116,2,19.2,64,43685,Yasir Shah,2,186,1,31.0,133,557295,Hilton Cartwright,6,13,1,0,334337,Peter Handscomb,54,119,4,0,2,False,0,0,0,0,0,100,2,0,False,,False,False,4.04,0,596,0,4,0,1,2,0,402
run,2,Australia,7,Pakistan,1st innings,1,"on the pads, worked towards fine leg for another easy run. Wahab's line not too great","Wahab Riaz to Cartwright, 1 run",403/4,43590,Wahab Riaz,4,117,2,19.3,65,43685,Yasir Shah,2,186,1,31.0,133,557295,Hilton Cartwright,7,14,1,0,334337,Peter Handscomb,54,119,4,0,3,False,0,0,0,0,0,100,2,0,False,,False,False,4.05,0,597,0,4,0,1,2,0,403
no run,2,Australia,7,Pakistan,1st innings,0,"141 kph, still a bit leg side. On a length around middle and leg, defended to mid-on","Wahab Riaz to Handscomb, no run",403/4,43590,Wahab Riaz,4,118,2,19.4,65,43685,Yasir Shah,2,186,1,31.0,133,334337,Peter Handscomb,54,120,4,0,557295,Hilton Cartwright,7,14,1,0,4,False,0,0,0,0,0,100,2,0,False,,False,False,4.04,0,598,0,4,0,1,2,0,403
no run,2,Australia,7,Pakistan,1st innings,0,"137 kph, blocked into the off side, off the back foot","Wahab Riaz to Handscomb, no run",403/4,43590,Wahab Riaz,4,119,2,19.5,65,43685,Yasir Shah,2,186,1,31.0,133,334337,Peter Handscomb,54,121,4,0,557295,Hilton Cartwright,7,14,1,0,5,False,0,0,0,0,0,100,2,0,False,,False,False,4.03,0,599,0,4,0,1,2,0,403
no run,2,Australia,7,Pakistan,1st innings,0,"140 kph, still a bit leg side-osh and Handscomb hurries into a nudge into the leg side","Wahab Riaz to Handscomb, no run",403/4,43590,Wahab Riaz,4,120,2,20.0,65,43685,Yasir Shah,2,186,1,31.0,133,334337,Peter Handscomb,54,122,4,0,557295,Hilton Cartwright,7,14,1,0,6,True,0,0,0,0,0,100,2,0,False,,False,False,4.03,0,600,0,4,0,1,2,0,403
no run,2,Australia,7,Pakistan,1st innings,0,"87 kph, quick through the air, flat, defended into the leg side","Yasir Shah to Cartwright, no run",403/4,43685,Yasir Shah,2,187,1,31.1,133,43590,Wahab Riaz,4,120,2,20.0,65,557295,Hilton Cartwright,7,15,1,0,334337,Peter Handscomb,54,122,4,0,1,False,0,0,0,0,0,101,3,0,False,,False,False,4.02,0,601,0,4,0,1,2,0,403
no run,2,Australia,7,Pakistan,1st innings,0,"inside-edged but just wide of short leg, flat through the air. Good pace from Yasir","Yasir Shah to Cartwright, no run",403/4,43685,Yasir Shah,2,188,1,31.2,133,43590,Wahab Riaz,4,120,2,20.0,65,557295,Hilton Cartwright,7,16,1,0,334337,Peter Handscomb,54,122,4,0,2,False,0,0,0,0,0,101,3,0,False,,False,False,4.01,0,602,0,4,0,1,2,0,403
run,2,Australia,7,Pakistan,1st innings,1,"a low full toss on middle and leg, driven to a deep-ish mid-off for one","Yasir Shah to Cartwright, 1 run",404/4,43685,Yasir Shah,2,189,1,31.3,134,43590,Wahab Riaz,4,120,2,20.0,65,557295,Hilton Cartwright,8,17,1,0,334337,Peter Handscomb,54,122,4,0,3,False,0,0,0,0,0,101,3,0,False,,False,False,4.01,0,603,0,4,0,1,2,0,404
run,2,Australia,7,Pakistan,1st innings,1,shimmies down to the pitch and drives to long-off with the spin. Lovely cricket stroke,"Yasir Shah to Handscomb, 1 run",405/4,43685,Yasir Shah,2,190,1,31.4,135,43590,Wahab Riaz,4,120,2,20.0,65,334337,Peter Handscomb,55,123,4,0,557295,Hilton Cartwright,8,17,1,0,4,False,0,0,0,0,0,101,3,0,False,,False,False,4.02,0,604,0,4,0,1,2,0,405
no run,2,Australia,7,Pakistan,1st innings,0,defended into the leg side,"Yasir Shah to Cartwright, no run",405/4,43685,Yasir Shah,2,191,1,31.5,135,43590,Wahab Riaz,4,120,2,20.0,65,557295,Hilton Cartwright,8,18,1,0,334337,Peter Handscomb,55,123,4,0,5,False,0,0,0,0,0,101,3,0,False,,False,False,4.01,0,605,0,4,0,1,2,0,405
run,2,Australia,7,Pakistan,1st innings,1,nice again. Decisiveness. Comes down and drives to a deep-ish mid-off for a run,"Yasir Shah to Cartwright, 1 run",406/4,43685,Yasir Shah,2,192,1,32.0,136,43590,Wahab Riaz,4,120,2,20.0,65,557295,Hilton Cartwright,9,19,1,0,334337,Peter Handscomb,55,123,4,0,6,True,0,0,0,0,0,101,3,0,False,,False,False,4.01,0,606,0,4,0,1,2,0,406
run,2,Australia,7,Pakistan,1st innings,1,"shortish length, 142 kph on the ribs, nudged towards square leg","Wahab Riaz to Cartwright, 1 run",407/4,43590,Wahab Riaz,4,121,2,20.1,66,43685,Yasir Shah,2,192,1,32.0,136,557295,Hilton Cartwright,10,20,1,0,334337,Peter Handscomb,55,123,4,0,1,False,0,0,0,0,0,102,1,0,False,,False,False,4.02,0,607,0,4,0,1,2,0,407
no run,2,Australia,7,Pakistan,1st innings,0,"good length on off, 143 kph, defended","Wahab Riaz to Handscomb, no run",407/4,43590,Wahab Riaz,4,122,2,20.2,66,43685,Yasir Shah,2,192,1,32.0,136,334337,Peter Handscomb,55,124,4,0,557295,Hilton Cartwright,10,20,1,0,2,False,0,0,0,0,0,102,1,0,False,,False,False,4.01,0,608,0,4,0,1,2,0,407
no run,2,Australia,7,Pakistan,1st innings,0,"pushed a tad fuller at 140 kph, defended off the back foot towards point","Wahab Riaz to Handscomb, no run",407/4,43590,Wahab Riaz,4,123,2,20.3,66,43685,Yasir Shah,2,192,1,32.0,136,334337,Peter Handscomb,55,125,4,0,557295,Hilton Cartwright,10,20,1,0,3,False,0,0,0,0,0,102,1,0,False,,False,False,4.0,0,609,0,4,0,1,2,0,407
no run,2,Australia,7,Pakistan,1st innings,0,"139 kph, back of a length on off, Handscomb sways out of the line","Wahab Riaz to Handscomb, no run",407/4,43590,Wahab Riaz,4,124,2,20.4,66,43685,Yasir Shah,2,192,1,32.0,136,334337,Peter Handscomb,55,126,4,0,557295,Hilton Cartwright,10,20,1,0,4,False,0,0,0,0,0,102,1,0,False,,False,False,4.0,0,610,0,4,0,1,2,0,407
no run,2,Australia,7,Pakistan,1st innings,0,"145 kph, tight on middle. Good length. Handscomb dabs to point","Wahab Riaz to Handscomb, no run",407/4,43590,Wahab Riaz,4,125,2,20.5,66,43685,Yasir Shah,2,192,1,32.0,136,334337,Peter Handscomb,55,127,4,0,557295,Hilton Cartwright,10,20,1,0,5,False,0,0,0,0,0,102,1,0,False,,False,False,3.99,0,611,0,4,0,1,2,0,407
no run,2,Australia,7,Pakistan,1st innings,0,"144 kph, short on middle and leg, Handscomb hurries underneath.","Wahab Riaz to Handscomb, no run",407/4,43590,Wahab Riaz,4,126,2,21.0,66,43685,Yasir Shah,2,192,1,32.0,136,334337,Peter Handscomb,55,128,4,0,557295,Hilton Cartwright,10,20,1,0,6,True,0,0,0,0,0,102,1,0,False,,False,False,3.99,0,612,0,4,0,1,2,0,407
run,2,Australia,7,Pakistan,1st innings,1,"short delivery outside off, pulled towards midwicket for a run. Wahab runs to his right from mid-on to save three","Yasir Shah to Cartwright, 1 run",408/4,43685,Yasir Shah,2,193,1,32.1,137,43590,Wahab Riaz,4,126,2,21.0,66,557295,Hilton Cartwright,11,21,1,0,334337,Peter Handscomb,55,128,4,0,1,False,0,0,0,0,0,103,5,0,False,,False,False,3.99,0,613,0,4,0,1,2,0,408
no run,2,Australia,7,Pakistan,1st innings,0,driven back to the bowler after a forward shimmy,"Yasir Shah to Handscomb, no run",408/4,43685,Yasir Shah,2,194,1,32.2,137,43590,Wahab Riaz,4,126,2,21.0,66,334337,Peter Handscomb,55,129,4,0,557295,Hilton Cartwright,11,21,1,0,2,False,0,0,0,0,0,103,5,0,False,,False,False,3.98,0,614,0,4,0,1,2,0,408
four,2,Australia,7,Pakistan,1st innings,4,"smashed. Tossed up outside off, Handscomb gets low and nails his sweep through midwicket","Yasir Shah to Handscomb, FOUR runs",412/4,43685,Yasir Shah,2,195,1,32.3,141,43590,Wahab Riaz,4,126,2,21.0,66,334337,Peter Handscomb,59,130,5,0,557295,Hilton Cartwright,11,21,1,0,3,False,0,0,0,0,0,103,5,0,False,,False,False,4.01,0,615,0,4,0,1,2,0,412
no run,2,Australia,7,Pakistan,1st innings,0,"84 kph, Handscomb runs down to defend","Yasir Shah to Handscomb, no run",412/4,43685,Yasir Shah,2,196,1,32.4,141,43590,Wahab Riaz,4,126,2,21.0,66,334337,Peter Handscomb,59,131,5,0,557295,Hilton Cartwright,11,21,1,0,4,False,0,0,0,0,0,103,5,0,False,,False,False,4.01,0,616,0,4,0,1,2,0,412
no run,2,Australia,7,Pakistan,1st innings,0,"a quicker, flatter variation, on middle. Blocked","Yasir Shah to Handscomb, no run",412/4,43685,Yasir Shah,2,197,1,32.5,141,43590,Wahab Riaz,4,126,2,21.0,66,334337,Peter Handscomb,59,132,5,0,557295,Hilton Cartwright,11,21,1,0,5,False,0,0,0,0,0,103,5,0,False,,False,False,4.0,0,617,0,4,0,1,2,0,412
no run,2,Australia,7,Pakistan,1st innings,0,"84 kph, driven back to the bowler","Yasir Shah to Handscomb, no run",412/4,43685,Yasir Shah,2,198,1,33.0,141,43590,Wahab Riaz,4,126,2,21.0,66,334337,Peter Handscomb,59,133,5,0,557295,Hilton Cartwright,11,21,1,0,6,True,0,0,0,0,0,103,5,0,False,,False,False,4.0,0,618,0,4,0,1,2,0,412
no run,2,Australia,7,Pakistan,1st innings,0,"141 kph, on Cartwright's hips and flicked but straight to a deep bat-pad fielder","Wahab Riaz to Cartwright, no run",412/4,43590,Wahab Riaz,4,127,2,21.1,66,43685,Yasir Shah,2,198,1,33.0,141,557295,Hilton Cartwright,11,22,1,0,334337,Peter Handscomb,59,133,5,0,1,False,0,0,0,0,0,104,1,0,False,,False,False,3.99,0,619,0,4,0,1,2,0,412
no run,2,Australia,7,Pakistan,1st innings,0,"141 kph, digs this in on leg, gets underneath","Wahab Riaz to Cartwright, no run",412/4,43590,Wahab Riaz,4,128,2,21.2,66,43685,Yasir Shah,2,198,1,33.0,141,557295,Hilton Cartwright,11,23,1,0,334337,Peter Handscomb,59,133,5,0,2,False,0,0,0,0,0,104,1,0,False,,False,False,3.98,0,620,0,4,0,1,2,0,412
no run,2,Australia,7,Pakistan,1st innings,0,"140 kph, on a middle and leg line, clipped towards short leg","Wahab Riaz to Cartwright, no run",412/4,43590,Wahab Riaz,4,129,2,21.3,66,43685,Yasir Shah,2,198,1,33.0,141,557295,Hilton Cartwright,11,24,1,0,334337,Peter Handscomb,59,133,5,0,3,False,0,0,0,0,0,104,1,0,False,,False,False,3.98,0,621,0,4,0,1,2,0,412
no run,2,Australia,7,Pakistan,1st innings,0,"139 kph, nice and straight, another defensive block","Wahab Riaz to Cartwright, no run",412/4,43590,Wahab Riaz,4,130,2,21.4,66,43685,Yasir Shah,2,198,1,33.0,141,557295,Hilton Cartwright,11,25,1,0,334337,Peter Handscomb,59,133,5,0,4,False,0,0,0,0,0,104,1,0,False,,False,False,3.97,0,622,0,4,0,1,2,0,412
run,2,Australia,7,Pakistan,1st innings,1,"139 kph, strays down leg, nudged down to fine leg","Wahab Riaz to Cartwright, 1 run",413/4,43590,Wahab Riaz,4,131,2,21.5,67,43685,Yasir Shah,2,198,1,33.0,141,557295,Hilton Cartwright,12,26,1,0,334337,Peter Handscomb,59,133,5,0,5,False,0,0,0,0,0,104,1,0,False,,False,False,3.97,0,623,0,4,0,1,2,0,413
no run,2,Australia,7,Pakistan,1st innings,0,"bouncer down leg, Handscomb gets underneath that","Wahab Riaz to Handscomb, no run",413/4,43590,Wahab Riaz,4,132,2,22.0,67,43685,Yasir Shah,2,198,1,33.0,141,334337,Peter Handscomb,59,134,5,0,557295,Hilton Cartwright,12,26,1,0,6,True,0,0,0,0,0,104,1,0,False,,False,False,3.97,0,624,0,4,0,1,2,0,413
four,2,Australia,7,Pakistan,1st innings,4,"a misfield. Through the legs. Full delivery outside off, Cartwright nails his drive but straight to Azhar at cover. The ball deviates away and beats Azhar's dive","Yasir Shah to Cartwright, FOUR runs",417/4,43685,Yasir Shah,2,199,1,33.1,145,43590,Wahab Riaz,4,132,2,22.0,67,557295,Hilton Cartwright,16,27,2,0,334337,Peter Handscomb,59,134,5,0,1,False,0,0,0,0,0,105,4,0,False,,False,False,4.0,0,625,0,4,0,1,2,0,417
no run,2,Australia,7,Pakistan,1st innings,0,"flat on off, defended","Yasir Shah to Cartwright, no run",417/4,43685,Yasir Shah,2,200,1,33.2,145,43590,Wahab Riaz,4,132,2,22.0,67,557295,Hilton Cartwright,16,28,2,0,334337,Peter Handscomb,59,134,5,0,2,False,0,0,0,0,0,105,4,0,False,,False,False,3.99,0,626,0,4,0,1,2,0,417
no run,2,Australia,7,Pakistan,1st innings,0,"Handscomb sends Cartwright back. Probably was Cartwright's call, but Handscomb chooses the safer option. Driven to mid-on, lots of partner-watching, then Handscomb yells 'noooo'","Yasir Shah to Cartwright, no run",417/4,43685,Yasir Shah,2,201,1,33.3,145,43590,Wahab Riaz,4,132,2,22.0,67,557295,Hilton Cartwright,16,29,2,0,334337,Peter Handscomb,59,134,5,0,3,False,0,0,0,0,0,105,4,0,False,,False,False,3.99,0,627,0,4,0,1,2,0,417
no run,2,Australia,7,Pakistan,1st innings,0,,"Yasir Shah to Cartwright, no run",417/4,43685,Yasir Shah,2,202,1,33.4,145,43590,Wahab Riaz,4,132,2,22.0,67,557295,Hilton Cartwright,16,30,2,0,334337,Peter Handscomb,59,134,5,0,4,False,0,0,0,0,0,105,4,0,False,,False,False,3.98,0,628,0,4,0,1,2,0,417
no run,2,Australia,7,Pakistan,1st innings,0,"86 kph, driven to short cover","Yasir Shah to Cartwright, no run",417/4,43685,Yasir Shah,2,203,1,33.5,145,43590,Wahab Riaz,4,132,2,22.0,67,557295,Hilton Cartwright,16,31,2,0,334337,Peter Handscomb,59,134,5,0,5,False,0,0,0,0,0,105,4,0,False,,False,False,3.97,0,629,0,4,0,1,2,0,417
