PlayType_description,Batting_Team_id,Batting_Team_name,Bowling_Team_id,Bowling_Team_name,Innings,Total_Runs_on_delivery,Commentary,Commentary_short,Score,Bowler_id,Bowler_name,Bowler_maiden,Bowler_balls,Bowler_wickets,Bowler_over,Bowler_conceded,Other_Bowler_id,Other_Bowler_name,Other_Bowler_maidens,Other_Bowler_balls,Other_Bowler_wickets,Other_Bowler_overs,Other_Bowler_conceded,Batsman_id,Batsman_name,Batsman_runs,Batsman_balls_faced,Batsman_four,Batsman_sixes,Other_Batsman_id,Other_Batsman_name,Other_Batsman_runs,Other_Batsman_balls_faced,Other_Batsman_four,Other_Batsman_sixes,Over_ball,Over_complete,Over_maiden,Over_no_Ball,Over_wide,Over_byes,Over_leg_byes,Over_number,Over_runs,Over_wickets,Dismissal_is_true,Dismissal_type,Dismissal_fielder_iskeeper,Dismissal_text,Innings_run_rate,Innings_byes,Innings_balls,Innings_no_balls,Innings_wickets,Innings_leg_byes,Innings_session,Innings_day,Innings_wides,Innings_runs
no run,7,Pakistan,2,Australia,2nd innings,0,"142 kph, driven to mid-off off the full length","Hazlewood to Azhar Ali, no run",0,288284,Josh Hazlewood,3,61,2,10.1,26,272279,Nathan Lyon,1,54,0,9.0,34,39037,Azhar Ali,52,118,4,0,43652,Younis Khan,64,112,7,0,1,False,0,0,0,0,0,41,6,0,False,,False,False,2.98,0,241,0,2,0,3,2,0,120
no run,7,Pakistan,2,Australia,2nd innings,0,"137 kph, good length outside off, left alone","Hazlewood to Azhar Ali, no run",0,288284,Josh Hazlewood,3,62,2,10.2,26,272279,Nathan Lyon,1,54,0,9.0,34,39037,Azhar Ali,52,119,4,0,43652,Younis Khan,64,112,7,0,2,False,0,0,0,0,0,41,6,0,False,,False,False,2.97,0,242,0,2,0,3,2,0,120
run,7,Pakistan,2,Australia,2nd innings,2,"full and straight, 135 kph, attacking the pads, flicked through square leg for a couple more","Hazlewood to Azhar Ali, 2 runs",0,288284,Josh Hazlewood,3,63,2,10.3,28,272279,Nathan Lyon,1,54,0,9.0,34,39037,Azhar Ali,54,120,4,0,43652,Younis Khan,64,112,7,0,3,False,0,0,0,0,0,41,6,0,False,,False,False,3.01,0,243,0,2,0,3,2,0,122
no run,7,Pakistan,2,Australia,2nd innings,0,"another leave outside off, carries to Wade on the bounce","Hazlewood to Azhar Ali, no run",0,288284,Josh Hazlewood,3,64,2,10.4,28,272279,Nathan Lyon,1,54,0,9.0,34,39037,Azhar Ali,54,121,4,0,43652,Younis Khan,64,112,7,0,4,False,0,0,0,0,0,41,6,0,False,,False,False,3.0,0,244,0,2,0,3,2,0,122
four,7,Pakistan,2,Australia,2nd innings,4,"140 kph, too straight, Azhar flicks away merrily through square leg. Into Azhar's bread, butter and whatnot","Hazlewood to Azhar Ali, FOUR runs",0,288284,Josh Hazlewood,3,65,2,10.5,32,272279,Nathan Lyon,1,54,0,9.0,34,39037,Azhar Ali,58,122,5,0,43652,Younis Khan,64,112,7,0,5,False,0,0,0,0,0,41,6,0,False,,False,False,3.08,0,245,0,2,0,3,2,0,126
no run,7,Pakistan,2,Australia,2nd innings,0,"140 kph, overpitched and drilled to mid-off. That will be it for day 2","Hazlewood to Azhar Ali, no run",0,288284,Josh Hazlewood,3,66,2,11.0,32,272279,Nathan Lyon,1,54,0,9.0,34,39037,Azhar Ali,58,123,5,0,43652,Younis Khan,64,112,7,0,6,True,0,0,0,0,0,41,6,0,False,,False,False,3.07,0,246,0,2,0,3,2,0,126
four,7,Pakistan,2,Australia,2nd innings,4,"starts with a wide yorker outside off, moving away. Guided through backward point for four. Just a neat dab","Starc to Younis Khan, FOUR runs",0,311592,Mitchell Starc,2,61,0,10.1,38,288284,Josh Hazlewood,3,66,2,11.0,32,43652,Younis Khan,68,113,8,0,39037,Azhar Ali,58,123,5,0,1,False,0,0,0,0,0,42,5,0,False,,False,False,3.15,0,247,0,2,0,2,3,0,130
run,7,Pakistan,2,Australia,2nd innings,1,"a low full toss this time outside off, driven through the cover region for a run. Younis wants to be positive","Starc to Younis Khan, 1 run",0,311592,Mitchell Starc,2,62,0,10.2,39,288284,Josh Hazlewood,3,66,2,11.0,32,43652,Younis Khan,69,114,8,0,39037,Azhar Ali,58,123,5,0,2,False,0,0,0,0,0,42,5,0,False,,False,False,3.16,0,248,0,2,0,2,3,0,131
no run,7,Pakistan,2,Australia,2nd innings,0,"full and wide, 140 kph, some reverse? Left alone. Starc hiding the shiny side","Starc to Azhar Ali, no run",0,311592,Mitchell Starc,2,63,0,10.3,39,288284,Josh Hazlewood,3,66,2,11.0,32,39037,Azhar Ali,58,124,5,0,43652,Younis Khan,69,114,8,0,3,False,0,0,0,0,0,42,5,0,False,,False,False,3.15,0,249,0,2,0,2,3,0,131
no run,7,Pakistan,2,Australia,2nd innings,0,"full and straight, 142 kph, driven back to the bowler","Starc to Azhar Ali, no run",0,311592,Mitchell Starc,2,64,0,10.4,39,288284,Josh Hazlewood,3,66,2,11.0,32,39037,Azhar Ali,58,125,5,0,43652,Younis Khan,69,114,8,0,4,False,0,0,0,0,0,42,5,0,False,,False,False,3.14,0,250,0,2,0,2,3,0,131
no run,7,Pakistan,2,Australia,2nd innings,0,"full and wide again, a hint of away movement. A calm leave","Starc to Azhar Ali, no run",0,311592,Mitchell Starc,2,65,0,10.5,39,288284,Josh Hazlewood,3,66,2,11.0,32,39037,Azhar Ali,58,126,5,0,43652,Younis Khan,69,114,8,0,5,False,0,0,0,0,0,42,5,0,False,,False,False,3.13,0,251,0,2,0,2,3,0,131
no run,7,Pakistan,2,Australia,2nd innings,0,"digs this one in on leg, Azhar bails out of a pull, gets underneath","Starc to Azhar Ali, no run",0,311592,Mitchell Starc,2,66,0,11.0,39,288284,Josh Hazlewood,3,66,2,11.0,32,39037,Azhar Ali,58,127,5,0,43652,Younis Khan,69,114,8,0,6,True,0,0,0,0,0,42,5,0,False,,False,False,3.11,0,252,0,2,0,2,3,0,131
no run,7,Pakistan,2,Australia,2nd innings,0,"full and straight, 134 kph, skewed towards point from the crease","Hazlewood to Younis Khan, no run",0,288284,Josh Hazlewood,3,67,2,11.1,32,311592,Mitchell Starc,2,66,0,11.0,39,43652,Younis Khan,69,115,8,0,39037,Azhar Ali,58,127,5,0,1,False,0,0,0,0,0,43,1,0,False,,False,False,3.1,0,253,0,2,0,2,3,0,131
no run,7,Pakistan,2,Australia,2nd innings,0,"full outside off, 132 kph, not a lot of swing, Defended under the eyes","Hazlewood to Younis Khan, no run",0,288284,Josh Hazlewood,3,68,2,11.2,32,311592,Mitchell Starc,2,66,0,11.0,39,43652,Younis Khan,69,116,8,0,39037,Azhar Ali,58,127,5,0,2,False,0,0,0,0,0,43,1,0,False,,False,False,3.09,0,254,0,2,0,2,3,0,131
no run,7,Pakistan,2,Australia,2nd innings,0,"134 kph, attacking the stumps with a straight line, pushed out towards mid-on","Hazlewood to Younis Khan, no run",0,288284,Josh Hazlewood,3,69,2,11.3,32,311592,Mitchell Starc,2,66,0,11.0,39,43652,Younis Khan,69,117,8,0,39037,Azhar Ali,58,127,5,0,3,False,0,0,0,0,0,43,1,0,False,,False,False,3.08,0,255,0,2,0,2,3,0,131
run,7,Pakistan,2,Australia,2nd innings,1,"nicely bowled, full and straight, nudged down to fine leg for one","Hazlewood to Younis Khan, 1 run",0,288284,Josh Hazlewood,3,70,2,11.4,33,311592,Mitchell Starc,2,66,0,11.0,39,43652,Younis Khan,70,118,8,0,39037,Azhar Ali,58,127,5,0,4,False,0,0,0,0,0,43,1,0,False,,False,False,3.09,0,256,0,2,0,2,3,0,132
no run,7,Pakistan,2,Australia,2nd innings,0,"nice lines, around off, 140 kph. Pushed to mid-on","Hazlewood to Azhar Ali, no run",0,288284,Josh Hazlewood,3,71,2,11.5,33,311592,Mitchell Starc,2,66,0,11.0,39,39037,Azhar Ali,58,128,5,0,43652,Younis Khan,70,118,8,0,5,False,0,0,0,0,0,43,1,0,False,,False,False,3.08,0,257,0,2,0,2,3,0,132
no run,7,Pakistan,2,Australia,2nd innings,0,"tight around off, hardly any movement and Azhar blocks","Hazlewood to Azhar Ali, no run",0,288284,Josh Hazlewood,3,72,2,12.0,33,311592,Mitchell Starc,2,66,0,11.0,39,39037,Azhar Ali,58,129,5,0,43652,Younis Khan,70,118,8,0,6,True,0,0,0,0,0,43,1,0,False,,False,False,3.06,0,258,0,2,0,2,3,0,132
no run,7,Pakistan,2,Australia,2nd innings,0,"just short of gully. Full and wide outside off, moving away. Younis flirts and the thick outside edge lands in front of Khawaja","Starc to Younis Khan, no run",0,311592,Mitchell Starc,2,67,0,11.1,39,288284,Josh Hazlewood,3,72,2,12.0,33,43652,Younis Khan,70,119,8,0,39037,Azhar Ali,58,129,5,0,1,False,0,0,0,0,0,44,2,0,False,,False,False,3.05,0,259,0,2,0,2,3,0,132
no run,7,Pakistan,2,Australia,2nd innings,0,"144 kph, around off, blocked","Starc to Younis Khan, no run",0,311592,Mitchell Starc,2,68,0,11.2,39,288284,Josh Hazlewood,3,72,2,12.0,33,43652,Younis Khan,70,120,8,0,39037,Azhar Ali,58,129,5,0,2,False,0,0,0,0,0,44,2,0,False,,False,False,3.04,0,260,0,2,0,2,3,0,132
no run,7,Pakistan,2,Australia,2nd innings,0,"full and swinging towards middle and leg, 144 kph, worked towards midwicket","Starc to Younis Khan, no run",0,311592,Mitchell Starc,2,69,0,11.3,39,288284,Josh Hazlewood,3,72,2,12.0,33,43652,Younis Khan,70,121,8,0,39037,Azhar Ali,58,129,5,0,3,False,0,0,0,0,0,44,2,0,False,,False,False,3.03,0,261,0,2,0,2,3,0,132
run,7,Pakistan,2,Australia,2nd innings,1,"back of a length on off, 144 kph, nudged down towards square leg for a run","Starc to Younis Khan, 1 run",0,311592,Mitchell Starc,2,70,0,11.4,40,288284,Josh Hazlewood,3,72,2,12.0,33,43652,Younis Khan,71,122,8,0,39037,Azhar Ali,58,129,5,0,4,False,0,0,0,0,0,44,2,0,False,,False,False,3.04,0,262,0,2,0,2,3,0,133
no run,7,Pakistan,2,Australia,2nd innings,0,"short delivery outside off, nice pace, nice carry. Azhar sways out of the line","Starc to Azhar Ali, no run",0,311592,Mitchell Starc,2,71,0,11.5,40,288284,Josh Hazlewood,3,72,2,12.0,33,39037,Azhar Ali,58,130,5,0,43652,Younis Khan,71,122,8,0,5,False,0,0,0,0,0,44,2,0,False,,False,False,3.03,0,263,0,2,0,2,3,0,133
run,7,Pakistan,2,Australia,2nd innings,1,"back of a length on middle, bobbled down to fine leg via the splice of Azhar's bat","Starc to Azhar Ali, 1 run",0,311592,Mitchell Starc,2,72,0,12.0,41,288284,Josh Hazlewood,3,72,2,12.0,33,39037,Azhar Ali,59,131,5,0,43652,Younis Khan,71,122,8,0,6,True,0,0,0,0,0,44,2,0,False,,False,False,3.04,0,264,0,2,0,2,3,0,134
no run,7,Pakistan,2,Australia,2nd innings,0,"138 kph, nice line, just outside off, defended","Hazlewood to Azhar Ali, no run",0,288284,Josh Hazlewood,3,73,2,12.1,33,311592,Mitchell Starc,2,72,0,12.0,41,39037,Azhar Ali,59,132,5,0,43652,Younis Khan,71,122,8,0,1,False,1,0,0,0,0,45,0,0,False,,False,False,3.03,0,265,0,2,0,2,3,0,134
no run,7,Pakistan,2,Australia,2nd innings,0,"big big appeal. No says umpire Ravi. <strong>Smith opts to review</strong>. Full and straight from Hazlewood, Azhar gets across and just plain misses a flick. Struck flush in front of middle. Hit on the kneeroll. Don't think line is an issue, could only be height. Ooh, just clipping the side of leg stump. Would have been out had it been given out. A good review I think.","Hazlewood to Azhar Ali, no run",0,288284,Josh Hazlewood,3,74,2,12.2,33,311592,Mitchell Starc,2,72,0,12.0,41,39037,Azhar Ali,59,133,5,0,43652,Younis Khan,71,122,8,0,2,False,1,0,0,0,0,45,0,0,False,,False,False,3.02,0,266,0,2,0,2,3,0,134
no run,7,Pakistan,2,Australia,2nd innings,0,"full delivery outside off, 141 kph, outside-halved towards point","Hazlewood to Azhar Ali, no run",0,288284,Josh Hazlewood,3,75,2,12.3,33,311592,Mitchell Starc,2,72,0,12.0,41,39037,Azhar Ali,59,134,5,0,43652,Younis Khan,71,122,8,0,3,False,1,0,0,0,0,45,0,0,False,,False,False,3.01,0,267,0,2,0,2,3,0,134
no run,7,Pakistan,2,Australia,2nd innings,0,"140 kph, close to off, defended back","Hazlewood to Azhar Ali, no run",0,288284,Josh Hazlewood,3,76,2,12.4,33,311592,Mitchell Starc,2,72,0,12.0,41,39037,Azhar Ali,59,135,5,0,43652,Younis Khan,71,122,8,0,4,False,1,0,0,0,0,45,0,0,False,,False,False,3.0,0,268,0,2,0,2,3,0,134
no run,7,Pakistan,2,Australia,2nd innings,0,"141 kph, tighter around off, blocked","Hazlewood to Azhar Ali, no run",0,288284,Josh Hazlewood,3,77,2,12.5,33,311592,Mitchell Starc,2,72,0,12.0,41,39037,Azhar Ali,59,136,5,0,43652,Younis Khan,71,122,8,0,5,False,1,0,0,0,0,45,0,0,False,,False,False,2.98,0,269,0,2,0,2,3,0,134
no run,7,Pakistan,2,Australia,2nd innings,0,a 139 kph delivery around off and Azhar defends it to midwicket. Similar to the previous delivery,"Hazlewood to Azhar Ali, no run",0,288284,Josh Hazlewood,4,78,2,13.0,33,311592,Mitchell Starc,2,72,0,12.0,41,39037,Azhar Ali,59,137,5,0,43652,Younis Khan,71,122,8,0,6,True,1,0,0,0,0,45,0,0,False,,False,False,2.97,0,270,0,2,0,2,3,0,134
no run,7,Pakistan,2,Australia,2nd innings,0,"141 kph, good length outside off, defended into the off side, towards point","Starc to Younis Khan, no run",0,311592,Mitchell Starc,2,73,0,12.1,41,288284,Josh Hazlewood,4,78,2,13.0,33,43652,Younis Khan,71,123,8,0,39037,Azhar Ali,59,137,5,0,1,False,1,0,0,0,0,46,0,0,False,,False,False,2.96,0,271,0,2,0,2,3,0,134
no run,7,Pakistan,2,Australia,2nd innings,0,"full and wide outside off, pushed to cover. Still playing away from his body","Starc to Younis Khan, no run",0,311592,Mitchell Starc,2,74,0,12.2,41,288284,Josh Hazlewood,4,78,2,13.0,33,43652,Younis Khan,71,124,8,0,39037,Azhar Ali,59,137,5,0,2,False,1,0,0,0,0,46,0,0,False,,False,False,2.95,0,272,0,2,0,2,3,0,134
no run,7,Pakistan,2,Australia,2nd innings,0,"145 kph, driven again to short cover. A nice forward press","Starc to Younis Khan, no run",0,311592,Mitchell Starc,2,75,0,12.3,41,288284,Josh Hazlewood,4,78,2,13.0,33,43652,Younis Khan,71,125,8,0,39037,Azhar Ali,59,137,5,0,3,False,1,0,0,0,0,46,0,0,False,,False,False,2.94,0,273,0,2,0,2,3,0,134
no run,7,Pakistan,2,Australia,2nd innings,0,defended back up the pitch,"Starc to Younis Khan, no run",0,311592,Mitchell Starc,2,76,0,12.4,41,288284,Josh Hazlewood,4,78,2,13.0,33,43652,Younis Khan,71,126,8,0,39037,Azhar Ali,59,137,5,0,4,False,1,0,0,0,0,46,0,0,False,,False,False,2.93,0,274,0,2,0,2,3,0,134
no run,7,Pakistan,2,Australia,2nd innings,0,"142 kph, strays down leg, Younis doesn't bother with that","Starc to Younis Khan, no run",0,311592,Mitchell Starc,2,77,0,12.5,41,288284,Josh Hazlewood,4,78,2,13.0,33,43652,Younis Khan,71,127,8,0,39037,Azhar Ali,59,137,5,0,5,False,1,0,0,0,0,46,0,0,False,,False,False,2.92,0,275,0,2,0,2,3,0,134
no run,7,Pakistan,2,Australia,2nd innings,0,drifts down leg for an ODI wide,"Starc to Younis Khan, no run",0,311592,Mitchell Starc,3,78,0,13.0,41,288284,Josh Hazlewood,4,78,2,13.0,33,43652,Younis Khan,71,128,8,0,39037,Azhar Ali,59,137,5,0,6,True,1,0,0,0,0,46,0,0,False,,False,False,2.91,0,276,0,2,0,2,3,0,134
no run,7,Pakistan,2,Australia,2nd innings,0,"139 kph, around off on a good length, dabbed to point","Hazlewood to Azhar Ali, no run",0,288284,Josh Hazlewood,4,79,2,13.1,33,311592,Mitchell Starc,3,78,0,13.0,41,39037,Azhar Ali,59,138,5,0,43652,Younis Khan,71,128,8,0,1,False,0,0,0,0,0,47,5,0,False,,False,False,2.9,0,277,0,2,0,2,3,0,134
no run,7,Pakistan,2,Australia,2nd innings,0,"getting some definite shape. On a length on off, the ball angles back in, beats Azhar's inside edge but not his midriff. Ouch","Hazlewood to Azhar Ali, no run",0,288284,Josh Hazlewood,4,80,2,13.2,33,311592,Mitchell Starc,3,78,0,13.0,41,39037,Azhar Ali,59,139,5,0,43652,Younis Khan,71,128,8,0,2,False,0,0,0,0,0,47,5,0,False,,False,False,2.89,0,278,0,2,0,2,3,0,134
run,7,Pakistan,2,Australia,2nd innings,1,"back of a length on middle and leg, worked down to fine leg","Hazlewood to Azhar Ali, 1 run",0,288284,Josh Hazlewood,4,81,2,13.3,34,311592,Mitchell Starc,3,78,0,13.0,41,39037,Azhar Ali,60,140,5,0,43652,Younis Khan,71,128,8,0,3,False,0,0,0,0,0,47,5,0,False,,False,False,2.9,0,279,0,2,0,2,3,0,135
no run,7,Pakistan,2,Australia,2nd innings,0,"fullish outside off, defended","Hazlewood to Younis Khan, no run",0,288284,Josh Hazlewood,4,82,2,13.4,34,311592,Mitchell Starc,3,78,0,13.0,41,43652,Younis Khan,71,129,8,0,39037,Azhar Ali,60,140,5,0,4,False,0,0,0,0,0,47,5,0,False,,False,False,2.89,0,280,0,2,0,2,3,0,135
no run,7,Pakistan,2,Australia,2nd innings,0,"rather full on middle, driven to mid-on with the angle of the swing","Hazlewood to Younis Khan, no run",0,288284,Josh Hazlewood,4,83,2,13.5,34,311592,Mitchell Starc,3,78,0,13.0,41,43652,Younis Khan,71,130,8,0,39037,Azhar Ali,60,140,5,0,5,False,0,0,0,0,0,47,5,0,False,,False,False,2.88,0,281,0,2,0,2,3,0,135
four,7,Pakistan,2,Australia,2nd innings,4,"<b>edged but there's just one slip</b>. Full delivery outside off, Younis gets a thick outside edge and it flies through second slip. Would have been out had there been the extra fielder","Hazlewood to Younis Khan, FOUR runs",0,288284,Josh Hazlewood,4,84,2,14.0,38,311592,Mitchell Starc,3,78,0,13.0,41,43652,Younis Khan,75,131,9,0,39037,Azhar Ali,60,140,5,0,6,True,0,0,0,0,0,47,5,0,False,,False,False,2.95,0,282,0,2,0,2,3,0,139
no run,7,Pakistan,2,Australia,2nd innings,0,"full and wide outside off, 143 kph, left alone","Starc to Azhar Ali, no run",0,311592,Mitchell Starc,3,79,0,13.1,41,288284,Josh Hazlewood,4,84,2,14.0,38,39037,Azhar Ali,60,141,5,0,43652,Younis Khan,75,131,9,0,1,False,0,0,0,0,0,48,8,0,False,,False,False,2.94,0,283,0,2,0,2,3,0,139
four,7,Pakistan,2,Australia,2nd innings,4,"143 kph, full and wide, Azhar sees some width and nails his square drive through extra cover, Lovely timing","Starc to Azhar Ali, FOUR runs",0,311592,Mitchell Starc,3,80,0,13.2,45,288284,Josh Hazlewood,4,84,2,14.0,38,39037,Azhar Ali,64,142,6,0,43652,Younis Khan,75,131,9,0,2,False,0,0,0,0,0,48,8,0,False,,False,False,3.02,0,284,0,2,0,2,3,0,143
no run,7,Pakistan,2,Australia,2nd innings,0,"145 kph, did it carry? No. Just. <strong>Lands just short</strong> of Cartwright at short cover. Full delivery outside off, Azhar pokes and just bunts the ball towards cover. Cartwright gets forward but can't quite get there","Starc to Azhar Ali, no run",0,311592,Mitchell Starc,3,81,0,13.3,45,288284,Josh Hazlewood,4,84,2,14.0,38,39037,Azhar Ali,64,143,6,0,43652,Younis Khan,75,131,9,0,3,False,0,0,0,0,0,48,8,0,False,,False,False,3.01,0,285,0,2,0,2,3,0,143
no run,7,Pakistan,2,Australia,2nd innings,0,pushed out into the off side,"Starc to Azhar Ali, no run",0,311592,Mitchell Starc,3,82,0,13.4,45,288284,Josh Hazlewood,4,84,2,14.0,38,39037,Azhar Ali,64,144,6,0,43652,Younis Khan,75,131,9,0,4,False,0,0,0,0,0,48,8,0,False,,False,False,3.0,0,286,0,2,0,2,3,0,143
no run,7,Pakistan,2,Australia,2nd innings,0,"back of a length outside off, 143 kph. Azhar sways away from the line","Starc to Azhar Ali, no run",0,311592,Mitchell Starc,3,83,0,13.5,45,288284,Josh Hazlewood,4,84,2,14.0,38,39037,Azhar Ali,64,145,6,0,43652,Younis Khan,75,131,9,0,5,False,0,0,0,0,0,48,8,0,False,,False,False,2.98,0,287,0,2,0,2,3,0,143
four,7,Pakistan,2,Australia,2nd innings,4,"146 kph, lovely stroke from Azhar. Gets forward and caresses his cover drive delectably through cover point. Superb timing","Starc to Azhar Ali, FOUR runs",0,311592,Mitchell Starc,3,84,0,14.0,49,288284,Josh Hazlewood,4,84,2,14.0,38,39037,Azhar Ali,68,146,7,0,43652,Younis Khan,75,131,9,0,6,True,0,0,0,0,0,48,8,0,False,,False,False,3.06,0,288,0,2,0,2,3,0,147
no run,7,Pakistan,2,Australia,2nd innings,0,"nice. Gets this to angle back in on off, pushed to mid-on.","Hazlewood to Younis Khan, no run",0,288284,Josh Hazlewood,4,85,2,14.1,38,311592,Mitchell Starc,3,84,0,14.0,49,43652,Younis Khan,75,132,9,0,39037,Azhar Ali,68,146,7,0,1,False,1,0,0,0,0,49,0,0,False,,False,False,3.05,0,289,0,2,0,2,3,0,147
no run,7,Pakistan,2,Australia,2nd innings,0,"140 kph, coming back in on middle and leg, defended","Hazlewood to Younis Khan, no run",0,288284,Josh Hazlewood,4,86,2,14.2,38,311592,Mitchell Starc,3,84,0,14.0,49,43652,Younis Khan,75,133,9,0,39037,Azhar Ali,68,146,7,0,2,False,1,0,0,0,0,49,0,0,False,,False,False,3.04,0,290,0,2,0,2,3,0,147
no run,7,Pakistan,2,Australia,2nd innings,0,"140kph, swerves back in outside off, solidly defended into the off side","Hazlewood to Younis Khan, no run",0,288284,Josh Hazlewood,4,87,2,14.3,38,311592,Mitchell Starc,3,84,0,14.0,49,43652,Younis Khan,75,134,9,0,39037,Azhar Ali,68,146,7,0,3,False,1,0,0,0,0,49,0,0,False,,False,False,3.03,0,291,0,2,0,2,3,0,147
no run,7,Pakistan,2,Australia,2nd innings,0,"138 kph, around off, skewed away towards midwicket","Hazlewood to Younis Khan, no run",0,288284,Josh Hazlewood,4,88,2,14.4,38,311592,Mitchell Starc,3,84,0,14.0,49,43652,Younis Khan,75,135,9,0,39037,Azhar Ali,68,146,7,0,4,False,1,0,0,0,0,49,0,0,False,,False,False,3.02,0,292,0,2,0,2,3,0,147
no run,7,Pakistan,2,Australia,2nd innings,0,"full outside off, blocked into the off side","Hazlewood to Younis Khan, no run",0,288284,Josh Hazlewood,4,89,2,14.5,38,311592,Mitchell Starc,3,84,0,14.0,49,43652,Younis Khan,75,136,9,0,39037,Azhar Ali,68,146,7,0,5,False,1,0,0,0,0,49,0,0,False,,False,False,3.01,0,293,0,2,0,2,3,0,147
no run,7,Pakistan,2,Australia,2nd innings,0,"back of a length delivery, 133 kph, Younis ducks underneath","Hazlewood to Younis Khan, no run",0,288284,Josh Hazlewood,5,90,2,15.0,38,311592,Mitchell Starc,3,84,0,14.0,49,43652,Younis Khan,75,137,9,0,39037,Azhar Ali,68,146,7,0,6,True,1,0,0,0,0,49,0,0,False,,False,False,3.0,0,294,0,2,0,2,3,0,147
no run,7,Pakistan,2,Australia,2nd innings,0,"full and wide, jammed out towards cover point","Starc to Azhar Ali, no run",0,311592,Mitchell Starc,3,85,0,14.1,49,288284,Josh Hazlewood,5,90,2,15.0,38,39037,Azhar Ali,68,147,7,0,43652,Younis Khan,75,137,9,0,1,False,1,0,0,0,0,50,0,0,False,,False,False,2.98,0,295,0,2,0,2,3,0,147
no run,7,Pakistan,2,Australia,2nd innings,0,"excellent bowling. Yorker on middle, jammed out towards mid-on","Starc to Azhar Ali, no run",0,311592,Mitchell Starc,3,86,0,14.2,49,288284,Josh Hazlewood,5,90,2,15.0,38,39037,Azhar Ali,68,148,7,0,43652,Younis Khan,75,137,9,0,2,False,1,0,0,0,0,50,0,0,False,,False,False,2.97,0,296,0,2,0,2,3,0,147
no run,7,Pakistan,2,Australia,2nd innings,0,"back of a length outside off, 143 kph, defended into the off side","Starc to Azhar Ali, no run",0,311592,Mitchell Starc,3,87,0,14.3,49,288284,Josh Hazlewood,5,90,2,15.0,38,39037,Azhar Ali,68,149,7,0,43652,Younis Khan,75,137,9,0,3,False,1,0,0,0,0,50,0,0,False,,False,False,2.96,0,297,0,2,0,2,3,0,147
no run,7,Pakistan,2,Australia,2nd innings,0,"great stop from Smith. A low full toss outside off, Azhar chops to Smith at second slip who gets his left hand down and saves four","Starc to Azhar Ali, no run",0,311592,Mitchell Starc,3,88,0,14.4,49,288284,Josh Hazlewood,5,90,2,15.0,38,39037,Azhar Ali,68,150,7,0,43652,Younis Khan,75,137,9,0,4,False,1,0,0,0,0,50,0,0,False,,False,False,2.95,0,298,0,2,0,2,3,0,147
no run,7,Pakistan,2,Australia,2nd innings,0,beauty. Full moving away. Reverse swing. The ball <strong>beats the bat</strong> as Azhar is drawn into playing,"Starc to Azhar Ali, no run",0,311592,Mitchell Starc,3,89,0,14.5,49,288284,Josh Hazlewood,5,90,2,15.0,38,39037,Azhar Ali,68,151,7,0,43652,Younis Khan,75,137,9,0,5,False,1,0,0,0,0,50,0,0,False,,False,False,2.94,0,299,0,2,0,2,3,0,147
no run,7,Pakistan,2,Australia,2nd innings,0,"144 kph, solidly defended into the off side","Starc to Azhar Ali, no run",0,311592,Mitchell Starc,4,90,0,15.0,49,288284,Josh Hazlewood,5,90,2,15.0,38,39037,Azhar Ali,68,152,7,0,43652,Younis Khan,75,137,9,0,6,True,1,0,0,0,0,50,0,0,False,,False,False,2.94,0,300,0,2,0,2,3,0,147
no run,7,Pakistan,2,Australia,2nd innings,0,"swerves back in on off, Younis blocks off the full face. Bat and pad close together","Hazlewood to Younis Khan, no run",0,288284,Josh Hazlewood,5,91,2,15.1,38,311592,Mitchell Starc,4,90,0,15.0,49,43652,Younis Khan,75,138,9,0,39037,Azhar Ali,68,152,7,0,1,False,0,0,0,0,0,51,1,0,False,,False,False,2.93,0,301,0,2,0,2,3,0,147
no run,7,Pakistan,2,Australia,2nd innings,0,"135 kph, coming back in on off, Younis drives back to the bowler. The lines are nice","Hazlewood to Younis Khan, no run",0,288284,Josh Hazlewood,5,92,2,15.2,38,311592,Mitchell Starc,4,90,0,15.0,49,43652,Younis Khan,75,139,9,0,39037,Azhar Ali,68,152,7,0,2,False,0,0,0,0,0,51,1,0,False,,False,False,2.92,0,302,0,2,0,2,3,0,147
run,7,Pakistan,2,Australia,2nd innings,1,"142 kph, flicked through midwicket for one. Cartwright dives to his right to save some runs","Hazlewood to Younis Khan, 1 run",0,288284,Josh Hazlewood,5,93,2,15.3,39,311592,Mitchell Starc,4,90,0,15.0,49,43652,Younis Khan,76,140,9,0,39037,Azhar Ali,68,152,7,0,3,False,0,0,0,0,0,51,1,0,False,,False,False,2.93,0,303,0,2,0,2,3,0,148
no run,7,Pakistan,2,Australia,2nd innings,0,"bouncer on off, Azhar's first instinct was to duck but had to get on top of the bounce late to defend. Played well eventually","Hazlewood to Azhar Ali, no run",0,288284,Josh Hazlewood,5,94,2,15.4,39,311592,Mitchell Starc,4,90,0,15.0,49,39037,Azhar Ali,68,153,7,0,43652,Younis Khan,76,140,9,0,4,False,0,0,0,0,0,51,1,0,False,,False,False,2.92,0,304,0,2,0,2,3,0,148
no run,7,Pakistan,2,Australia,2nd innings,0,"coming back in on a length, pushed towards mid-on","Hazlewood to Azhar Ali, no run",0,288284,Josh Hazlewood,5,95,2,15.5,39,311592,Mitchell Starc,4,90,0,15.0,49,39037,Azhar Ali,68,154,7,0,43652,Younis Khan,76,140,9,0,5,False,0,0,0,0,0,51,1,0,False,,False,False,2.91,0,305,0,2,0,2,3,0,148
no run,7,Pakistan,2,Australia,2nd innings,0,"tight around off, solidly played back","Hazlewood to Azhar Ali, no run",0,288284,Josh Hazlewood,5,96,2,16.0,39,311592,Mitchell Starc,4,90,0,15.0,49,39037,Azhar Ali,68,155,7,0,43652,Younis Khan,76,140,9,0,6,True,0,0,0,0,0,51,1,0,False,,False,False,2.9,0,306,0,2,0,2,3,0,148
no run,7,Pakistan,2,Australia,2nd innings,0,"good length and angling away outside off from over the stumps, jab-like defence to cover","Starc to Younis Khan, no run",0,311592,Mitchell Starc,4,91,0,15.1,49,288284,Josh Hazlewood,5,96,2,16.0,39,43652,Younis Khan,76,141,9,0,39037,Azhar Ali,68,155,7,0,1,False,0,0,0,0,0,52,1,0,False,,False,False,2.89,0,307,0,2,0,2,3,0,148
no run,7,Pakistan,2,Australia,2nd innings,0,"much fuller and on off stump, 144.3ks, Younis is on the move as he dabs the ball defensively towards mid-off","Starc to Younis Khan, no run",0,311592,Mitchell Starc,4,92,0,15.2,49,288284,Josh Hazlewood,5,96,2,16.0,39,43652,Younis Khan,76,142,9,0,39037,Azhar Ali,68,155,7,0,2,False,0,0,0,0,0,52,1,0,False,,False,False,2.88,0,308,0,2,0,2,3,0,148
run,7,Pakistan,2,Australia,2nd innings,1,"143.2ks, rising short ball on the leg stump, well negotiated by Younis. He leaps, rides the bounce, and deflects the ball to the right of square leg","Starc to Younis Khan, 1 run",0,311592,Mitchell Starc,4,93,0,15.3,50,288284,Josh Hazlewood,5,96,2,16.0,39,43652,Younis Khan,77,143,9,0,39037,Azhar Ali,68,155,7,0,3,False,0,0,0,0,0,52,1,0,False,,False,False,2.89,0,309,0,2,0,2,3,0,149
