PlayType_description,Batting_Team_id,Batting_Team_name,Bowling_Team_id,Bowling_Team_name,Innings,Total_Runs_on_delivery,Commentary,Commentary_short,Score,Bowler_id,Bowler_name,Bowler_maiden,Bowler_balls,Bowler_wickets,Bowler_over,Bowler_conceded,Other_Bowler_id,Other_Bowler_name,Other_Bowler_maidens,Other_Bowler_balls,Other_Bowler_wickets,Other_Bowler_overs,Other_Bowler_conceded,Batsman_id,Batsman_name,Batsman_runs,Batsman_balls_faced,Batsman_four,Batsman_sixes,Other_Batsman_id,Other_Batsman_name,Other_Batsman_runs,Other_Batsman_balls_faced,Other_Batsman_four,Other_Batsman_sixes,Over_ball,Over_complete,Over_maiden,Over_no_Ball,Over_wide,Over_byes,Over_leg_byes,Over_number,Over_runs,Over_wickets,Dismissal_is_true,Dismissal_type,Dismissal_fielder_iskeeper,Dismissal_text,Innings_run_rate,Innings_byes,Innings_balls,Innings_no_balls,Innings_wickets,Innings_leg_byes,Innings_session,Innings_day,Innings_wides,Innings_runs
no run,8,Sri Lanka,1,England,1st innings,0,one hand comes off the bat as Akila drives loosely into the covers,"Stone to Dananjaya, no run",226/6,457279,Olly Stone,0,39,0,6.3,47,550235,Tom Curran,1,42,1,7.0,30,574178,Akila Dananjaya,5,9,0,0,233514,Thisara Perera,30,32,2,0,3,False,0,0,0,0,0,46,6,0,False,,False,False,4.96,0,273,0,6,0,1,1,0,226
no run,8,Sri Lanka,1,England,1st innings,0,"slower ball, chopped to point","Stone to Dananjaya, no run",226/6,457279,Olly Stone,0,40,0,6.4,47,550235,Tom Curran,1,42,1,7.0,30,574178,Akila Dananjaya,5,10,0,0,233514,Thisara Perera,30,32,2,0,4,False,0,0,0,0,0,46,6,0,False,,False,False,4.94,0,274,0,6,0,1,1,0,226
run,8,Sri Lanka,1,England,1st innings,2,"flipped up and over the leg side, finds the gap well in the deep","Stone to Dananjaya, 2 runs",228/6,457279,Olly Stone,0,41,0,6.5,49,550235,Tom Curran,1,42,1,7.0,30,574178,Akila Dananjaya,7,11,0,0,233514,Thisara Perera,30,32,2,0,5,False,0,0,0,0,0,46,6,0,False,,False,False,4.97,0,275,0,6,0,1,1,0,228
run,8,Sri Lanka,1,England,1st innings,1,"slower ball once again, worked to the leg side","Stone to Dananjaya, 1 run",229/6,457279,Olly Stone,0,42,0,7.0,50,550235,Tom Curran,1,42,1,7.0,30,574178,Akila Dananjaya,8,12,0,0,233514,Thisara Perera,30,32,2,0,6,True,0,0,0,0,0,46,6,0,False,,False,False,4.97,0,276,0,6,0,1,1,0,229
run,8,Sri Lanka,1,England,1st innings,2,"tapped into the off-side, Moeen at backward point fumbles as he rushes the run-out chance, and gives away another run","Curran to Dananjaya, 2 runs",231/6,550235,Tom Curran,1,43,1,7.1,32,457279,Olly Stone,0,42,0,7.0,50,574178,Akila Dananjaya,10,13,0,0,233514,Thisara Perera,30,32,2,0,1,False,0,0,0,0,0,47,11,0,False,,False,False,5.0,0,277,0,6,0,1,1,0,231
run,8,Sri Lanka,1,England,1st innings,1,fenced off the pads to square leg,"Curran to Dananjaya, 1 run",232/6,550235,Tom Curran,1,44,1,7.2,33,457279,Olly Stone,0,42,0,7.0,50,574178,Akila Dananjaya,11,14,0,0,233514,Thisara Perera,30,32,2,0,2,False,0,0,0,0,0,47,11,0,False,,False,False,5.0,0,278,0,6,0,1,1,0,232
six,8,Sri Lanka,1,England,1st innings,6,<strong>whipped up and over the leg side!</strong> Tremendous timing off the toes as Curran loses his line. Vital runs,"Curran to Perera, SIX runs",238/6,550235,Tom Curran,1,45,1,7.3,39,457279,Olly Stone,0,42,0,7.0,50,233514,Thisara Perera,36,33,2,1,574178,Akila Dananjaya,11,14,0,0,3,False,0,0,0,0,0,47,11,0,False,,False,False,5.11,0,279,0,6,0,1,1,0,238
leg bye,8,Sri Lanka,1,England,1st innings,1,"slower ball, on the pads again, deflected to square leg","Curran to Perera, 1 leg bye",239/6,550235,Tom Curran,1,46,1,7.4,39,457279,Olly Stone,0,42,0,7.0,50,233514,Thisara Perera,36,34,2,1,574178,Akila Dananjaya,11,14,0,0,4,False,0,0,0,0,1,47,11,0,False,,False,False,5.12,0,280,0,6,1,1,1,0,239
no run,8,Sri Lanka,1,England,1st innings,0,"slower again, pressed back down the pitch, Perera at the non-striker's end has to wait for the ball to pass before hustling through","Curran to Dananjaya, no run",239/6,550235,Tom Curran,1,47,1,7.5,39,457279,Olly Stone,0,42,0,7.0,50,574178,Akila Dananjaya,11,15,0,0,233514,Thisara Perera,36,34,2,1,5,False,0,0,0,0,0,47,11,0,False,,False,False,5.1,0,281,0,6,0,1,1,0,239
run,8,Sri Lanka,1,England,1st innings,1,"clipped to the leg side, a sharp single. Good pick-up from Curran whose shy on the turn isn't a million miles away either","Curran to Dananjaya, 1 run",240/6,550235,Tom Curran,1,48,1,8.0,40,457279,Olly Stone,0,42,0,7.0,50,574178,Akila Dananjaya,12,16,0,0,233514,Thisara Perera,36,34,2,1,6,True,0,0,0,0,0,47,11,0,False,,False,False,5.1,0,282,0,6,0,1,1,0,240
run,8,Sri Lanka,1,England,1st innings,1,"round the wicket, slower ball, angled into the body, defended off the back foot","Woakes to Dananjaya, 1 run",241/6,247235,Chris Woakes,0,49,1,8.1,23,550235,Tom Curran,1,48,1,8.0,40,574178,Akila Dananjaya,13,17,0,0,233514,Thisara Perera,36,34,2,1,1,False,0,0,0,0,0,48,6,0,False,,False,False,5.1,0,283,0,6,0,1,1,0,241
run,8,Sri Lanka,1,England,1st innings,1,"swished into the leg side, midwicket cuts off the second run","Woakes to Perera, 1 run",242/6,247235,Chris Woakes,0,50,1,8.2,24,550235,Tom Curran,1,48,1,8.0,40,233514,Thisara Perera,37,35,2,1,574178,Akila Dananjaya,13,17,0,0,2,False,0,0,0,0,0,48,6,0,False,,False,False,5.11,0,284,0,6,0,1,1,0,242
run,8,Sri Lanka,1,England,1st innings,1,"smashed out to  deep point, one bounce to the sweeper","Woakes to Dananjaya, 1 run",243/6,247235,Chris Woakes,0,51,1,8.3,25,550235,Tom Curran,1,48,1,8.0,40,574178,Akila Dananjaya,14,18,0,0,233514,Thisara Perera,37,35,2,1,3,False,0,0,0,0,0,48,6,0,False,,False,False,5.11,0,285,0,6,0,1,1,0,243
run,8,Sri Lanka,1,England,1st innings,1,"retreats to the leg side, pushed into the covers","Woakes to Perera, 1 run",244/6,247235,Chris Woakes,0,52,1,8.4,26,550235,Tom Curran,1,48,1,8.0,40,233514,Thisara Perera,38,36,2,1,574178,Akila Dananjaya,14,18,0,0,4,False,0,0,0,0,0,48,6,0,False,,False,False,5.11,0,286,0,6,0,1,1,0,244
run,8,Sri Lanka,1,England,1st innings,1,"low full toss, pushed into the off side, Morgan decides against risking the shy and allows them to take the single","Woakes to Dananjaya, 1 run",245/6,247235,Chris Woakes,0,53,1,8.5,27,550235,Tom Curran,1,48,1,8.0,40,574178,Akila Dananjaya,15,19,0,0,233514,Thisara Perera,38,36,2,1,5,False,0,0,0,0,0,48,6,0,False,,False,False,5.12,0,287,0,6,0,1,1,0,245
run,8,Sri Lanka,1,England,1st innings,1,"full toss again, from over the wicket this time, bunted into the covers, and that's another fine over from Woakes","Woakes to Perera, 1 run",246/6,247235,Chris Woakes,0,54,1,9.0,28,550235,Tom Curran,1,48,1,8.0,40,233514,Thisara Perera,39,37,2,1,574178,Akila Dananjaya,15,19,0,0,6,True,0,0,0,0,0,48,6,0,False,,False,False,5.12,0,288,0,6,0,1,1,0,246
run,8,Sri Lanka,1,England,1st innings,1,"gives himself room, cuts down into the ground and over the bowler's head","Curran to Perera, 1 run",247/6,550235,Tom Curran,1,49,1,8.1,41,247235,Chris Woakes,0,54,1,9.0,28,233514,Thisara Perera,40,38,2,1,574178,Akila Dananjaya,15,19,0,0,1,False,0,0,0,0,0,49,10,0,False,,False,False,5.12,0,289,0,6,0,1,1,0,247
run,8,Sri Lanka,1,England,1st innings,1,"low full toss, angled across the left-hander, flat-batted into the covers","Curran to Dananjaya, 1 run",248/6,550235,Tom Curran,1,50,1,8.2,42,247235,Chris Woakes,0,54,1,9.0,28,574178,Akila Dananjaya,16,20,0,0,233514,Thisara Perera,40,38,2,1,2,False,0,0,0,0,0,49,10,0,False,,False,False,5.13,0,290,0,6,0,1,1,0,248
run,8,Sri Lanka,1,England,1st innings,1,"hauled out to the leg side, loses his shape in his eagerness to batter this into the next kingdom. Midwicket gathers","Curran to Perera, 1 run",249/6,550235,Tom Curran,1,51,1,8.3,43,247235,Chris Woakes,0,54,1,9.0,28,233514,Thisara Perera,41,39,2,1,574178,Akila Dananjaya,16,20,0,0,3,False,0,0,0,0,0,49,10,0,False,,False,False,5.13,0,291,0,6,0,1,1,0,249
four,8,Sri Lanka,1,England,1st innings,4,"<B>top boshing!</B> Makes room on the leg side, and smokes a topspin forehand through the covers","Curran to Dananjaya, FOUR runs",253/6,550235,Tom Curran,1,52,1,8.4,47,247235,Chris Woakes,0,54,1,9.0,28,574178,Akila Dananjaya,20,21,1,0,233514,Thisara Perera,41,39,2,1,4,False,0,0,0,0,0,49,10,0,False,,False,False,5.19,0,292,0,6,0,1,1,0,253
run,8,Sri Lanka,1,England,1st innings,1,"well bowled, a looping slower ball, dipping into the blockhole as the drive swishes through the line","Curran to Dananjaya, 1 run",254/6,550235,Tom Curran,1,53,1,8.5,48,247235,Chris Woakes,0,54,1,9.0,28,574178,Akila Dananjaya,21,22,1,0,233514,Thisara Perera,41,39,2,1,5,False,0,0,0,0,0,49,10,0,False,,False,False,5.2,0,293,0,6,0,1,1,0,254
run,8,Sri Lanka,1,England,1st innings,2,worked to the leg side. One to go.,"Curran to Perera, 2 runs",256/6,550235,Tom Curran,1,54,1,9.0,50,247235,Chris Woakes,0,54,1,9.0,28,233514,Thisara Perera,43,40,2,1,574178,Akila Dananjaya,21,22,1,0,6,True,0,0,0,0,0,49,10,0,False,,False,False,5.22,0,294,0,6,0,1,1,0,256
six,8,Sri Lanka,1,England,1st innings,6,"<strong>picked to perfection!</strong> A slower ball, doodlebugging into the slot, and duly smoked over cow corner!","Woakes to Dananjaya, SIX runs",262/6,247235,Chris Woakes,0,55,1,9.1,34,550235,Tom Curran,1,54,1,9.0,50,574178,Akila Dananjaya,27,23,1,1,233514,Thisara Perera,43,40,2,1,1,False,0,0,0,0,0,50,17,1,False,,False,False,5.32,0,295,0,6,0,1,1,0,262
four,8,Sri Lanka,1,England,1st innings,4,"Woakes sees him coming and fires it down the leg side, but that's a fine bit of spanking, <strong>clean through the gap at square leg!</strong>","Woakes to Dananjaya, FOUR runs",266/6,247235,Chris Woakes,0,56,1,9.2,38,550235,Tom Curran,1,54,1,9.0,50,574178,Akila Dananjaya,31,24,2,1,233514,Thisara Perera,43,40,2,1,2,False,0,0,0,0,0,50,17,1,False,,False,False,5.39,0,296,0,6,0,1,1,0,266
no run,8,Sri Lanka,1,England,1st innings,0,"better from Woakes, goes for the wide yorker and nails it well enough","Woakes to Dananjaya, no run",266/6,247235,Chris Woakes,0,57,1,9.3,38,550235,Tom Curran,1,54,1,9.0,50,574178,Akila Dananjaya,31,25,2,1,233514,Thisara Perera,43,40,2,1,3,False,0,0,0,0,0,50,17,1,False,,False,False,5.37,0,297,0,6,0,1,1,0,266
run,8,Sri Lanka,1,England,1st innings,1,"yorker once more, this time tailing into the stumps and squeezed into the covers","Woakes to Dananjaya, 1 run",267/6,247235,Chris Woakes,0,58,1,9.4,39,550235,Tom Curran,1,54,1,9.0,50,574178,Akila Dananjaya,32,26,2,1,233514,Thisara Perera,43,40,2,1,4,False,0,0,0,0,0,50,17,1,False,,False,False,5.37,0,298,0,6,0,1,1,0,267
run,8,Sri Lanka,1,England,1st innings,1,"back over the wicket to the left-hander, panned up and over the leg side, Perera wants as many runs as possible and takes on Stokes' arm from the deep... it wasn't a contest ... but the end of a fine aggressive knock. He's given his team a chance","Woakes to Perera, 1 run, OUT",268/7,247235,Chris Woakes,0,59,1,9.5,40,550235,Tom Curran,1,54,1,9.0,50,233514,Thisara Perera,44,41,2,1,574178,Akila Dananjaya,32,26,2,1,5,False,0,0,0,0,0,50,17,1,True,run out,False,NLTC Perera run out (Stokes/&dagger;Buttler) 44 (41b 2x4 1x6) SR: 107.31,5.37,0,299,0,7,0,1,1,0,268
wide,8,Sri Lanka,1,England,1st innings,1,"oops, we'll have that one again","Woakes to Malinga, 1 wide",269/7,247235,Chris Woakes,0,59,1,9.5,41,550235,Tom Curran,1,54,1,9.0,50,49758,Lasith Malinga,0,0,0,0,574178,Akila Dananjaya,32,26,2,1,6,False,0,0,1,0,0,50,17,1,False,,False,False,5.39,0,299,0,7,0,1,1,1,269
four,8,Sri Lanka,1,England,1st innings,4,"wide yorker,<strong> thumped on the up through the covers!</strong> Malinga nails his drive, and Woakes' superb figures from the first eight overs of his spell take something of a battering.","Woakes to Malinga, FOUR runs",273/7,247235,Chris Woakes,0,60,1,10.0,45,550235,Tom Curran,1,54,1,9.0,50,49758,Lasith Malinga,4,1,1,0,574178,Akila Dananjaya,32,26,2,1,7,True,0,0,0,0,0,50,17,1,False,,False,False,5.46,0,300,0,7,0,1,1,0,273
no run,1,England,8,Sri Lanka,2nd innings,0,"length ball, sitting up on off stump, chopped square on the off side","Malinga to Roy, no run",0,49758,Lasith Malinga,0,1,0,0.1,0,False,False,0,0,0,False,0,298438,Jason Roy,0,1,0,0,249866,Alex Hales,0,0,0,0,1,False,0,0,0,0,0,1,12,0,False,,False,False,0.0,0,1,0,0,0,1,1,0,0
bye,1,England,8,Sri Lanka,2nd innings,4,"dipping, beats the bat in the channel, 85mph but it scuttles past Dickwella and England get their first runs in byes","Malinga to Roy, 4 byes",0,49758,Lasith Malinga,0,2,0,0.2,0,False,False,0,0,0,False,0,298438,Jason Roy,0,2,0,0,249866,Alex Hales,0,0,0,0,2,False,0,0,0,4,0,1,12,0,False,,False,False,12.0,4,2,0,0,0,1,1,0,4
bye,1,England,8,Sri Lanka,2nd innings,4,"back of a length, swings away as Roy chases it, a hard-handed swipe fails to connect... and Dickwella fails to grab it again! The keeper beaten diving to his right, again it ends up going fine of third man for four!","Malinga to Roy, 4 byes",0,49758,Lasith Malinga,0,3,0,0.3,0,False,False,0,0,0,False,0,298438,Jason Roy,0,3,0,0,249866,Alex Hales,0,0,0,0,3,False,0,0,0,4,0,1,12,0,False,,False,False,16.0,4,3,0,0,0,1,1,0,8
four,1,England,8,Sri Lanka,2nd innings,4,"slammed through cover point, this one is timed, all right! Runs off the bat, Roy pinging the ball ttrough the off side as he gets going with a four","Malinga to Roy, FOUR runs",0,49758,Lasith Malinga,0,4,0,0.4,4,False,False,0,0,0,False,0,298438,Jason Roy,4,4,1,0,249866,Alex Hales,0,0,0,0,4,False,0,0,0,0,0,1,12,0,False,,False,False,18.0,0,4,0,0,0,1,1,0,12
no run,1,England,8,Sri Lanka,2nd innings,0,"back of a length, better line and worked to the on side","Malinga to Roy, no run",0,49758,Lasith Malinga,0,5,0,0.5,4,False,False,0,0,0,False,0,298438,Jason Roy,4,5,1,0,249866,Alex Hales,0,0,0,0,5,False,0,0,0,0,0,1,12,0,False,,False,False,14.4,0,5,0,0,0,1,1,0,12
no run,1,England,8,Sri Lanka,2nd innings,0,"length delivery, 139kph/87mph around off stump, driven back to the bowler","Malinga to Roy, no run",0,49758,Lasith Malinga,0,6,0,1.0,4,False,False,0,0,0,False,0,298438,Jason Roy,4,6,1,0,249866,Alex Hales,0,0,0,0,6,True,0,0,0,0,0,1,12,0,False,,False,False,12.0,0,6,0,0,0,1,1,0,12
run,1,England,8,Sri Lanka,2nd innings,1,"lobbed up on leg stump, makes room and clips a single down the ground to long-on","Aponso to Hales, 1 run",0,429748,Amila Aponso,0,1,0,0.1,1,49758,Lasith Malinga,0,6,0,1.0,4,249866,Alex Hales,1,1,0,0,298438,Jason Roy,4,6,1,0,1,False,0,0,0,0,0,2,6,0,False,,False,False,11.14,0,7,0,0,0,1,1,0,13
run,1,England,8,Sri Lanka,2nd innings,1,"flighted, pitching on middle and leg, not much turn as yet and Roy punches one back down the ground","Aponso to Roy, 1 run",0,429748,Amila Aponso,0,2,0,0.2,2,49758,Lasith Malinga,0,6,0,1.0,4,298438,Jason Roy,5,7,1,0,249866,Alex Hales,1,1,0,0,2,False,0,0,0,0,0,2,6,0,False,,False,False,10.5,0,8,0,0,0,1,1,0,14
no run,1,England,8,Sri Lanka,2nd innings,0,"nice and slow, on the stumps, Hales smothers it","Aponso to Hales, no run",0,429748,Amila Aponso,0,3,0,0.3,2,49758,Lasith Malinga,0,6,0,1.0,4,249866,Alex Hales,1,2,0,0,298438,Jason Roy,5,7,1,0,3,False,0,0,0,0,0,2,6,0,False,,False,False,9.33,0,9,0,0,0,1,1,0,14
no run,1,England,8,Sri Lanka,2nd innings,0,"pushed through quicker, threatening the timbers and Hales blocks again","Aponso to Hales, no run",0,429748,Amila Aponso,0,4,0,0.4,2,49758,Lasith Malinga,0,6,0,1.0,4,249866,Alex Hales,1,3,0,0,298438,Jason Roy,5,7,1,0,4,False,0,0,0,0,0,2,6,0,False,,False,False,8.4,0,10,0,0,0,1,1,0,14
no run,1,England,8,Sri Lanka,2nd innings,0,pushed into the off side coming forwards,"Aponso to Hales, no run",0,429748,Amila Aponso,0,5,0,0.5,2,49758,Lasith Malinga,0,6,0,1.0,4,249866,Alex Hales,1,4,0,0,298438,Jason Roy,5,7,1,0,5,False,0,0,0,0,0,2,6,0,False,,False,False,7.63,0,11,0,0,0,1,1,0,14
four,1,England,8,Sri Lanka,2nd innings,4,"floated up on off stump, lovely stroke from Hales, using those long levers to punch through the covers and into the open acres for four","Aponso to Hales, FOUR runs",0,429748,Amila Aponso,0,6,0,1.0,6,49758,Lasith Malinga,0,6,0,1.0,4,249866,Alex Hales,5,5,1,0,298438,Jason Roy,5,7,1,0,6,True,0,0,0,0,0,2,6,0,False,,False,False,9.0,0,12,0,0,0,1,1,0,18
no run,1,England,8,Sri Lanka,2nd innings,0,"back of a length, lashed in front of point on the back foot, well fielded on the edge of the ring","Malinga to Roy, no run",0,49758,Lasith Malinga,0,7,0,1.1,4,429748,Amila Aponso,0,6,0,1.0,6,298438,Jason Roy,5,8,1,0,249866,Alex Hales,5,5,1,0,1,False,0,0,0,0,0,3,1,0,False,,False,False,8.3,0,13,0,0,0,1,1,0,18
no run,1,England,8,Sri Lanka,2nd innings,0,"touch short, 136kph/84mph room for Roy to swing the rhubarb once again, slapped to cover point again","Malinga to Roy, no run",0,49758,Lasith Malinga,0,8,0,1.2,4,429748,Amila Aponso,0,6,0,1.0,6,298438,Jason Roy,5,9,1,0,249866,Alex Hales,5,5,1,0,2,False,0,0,0,0,0,3,1,0,False,,False,False,7.71,0,14,0,0,0,1,1,0,18
no run,1,England,8,Sri Lanka,2nd innings,0,"back of a length, worked to the leg side","Malinga to Roy, no run",0,49758,Lasith Malinga,0,9,0,1.3,4,429748,Amila Aponso,0,6,0,1.0,6,298438,Jason Roy,5,10,1,0,249866,Alex Hales,5,5,1,0,3,False,0,0,0,0,0,3,1,0,False,,False,False,7.2,0,15,0,0,0,1,1,0,18
no run,1,England,8,Sri Lanka,2nd innings,0,dug in and again Roy can only tap down towards midwicket,"Malinga to Roy, no run",0,49758,Lasith Malinga,0,10,0,1.4,4,429748,Amila Aponso,0,6,0,1.0,6,298438,Jason Roy,5,11,1,0,249866,Alex Hales,5,5,1,0,4,False,0,0,0,0,0,3,1,0,False,,False,False,6.75,0,16,0,0,0,1,1,0,18
no run,1,England,8,Sri Lanka,2nd innings,0,"shortish, outside off and met with a straight bat as Roy comes across and defends","Malinga to Roy, no run",0,49758,Lasith Malinga,0,11,0,1.5,4,429748,Amila Aponso,0,6,0,1.0,6,298438,Jason Roy,5,12,1,0,249866,Alex Hales,5,5,1,0,5,False,0,0,0,0,0,3,1,0,False,,False,False,6.35,0,17,0,0,0,1,1,0,18
wide,1,England,8,Sri Lanka,2nd innings,1,spears this one down the leg side,"Malinga to Roy, 1 wide",0,49758,Lasith Malinga,0,11,0,1.5,5,429748,Amila Aponso,0,6,0,1.0,6,298438,Jason Roy,5,12,1,0,249866,Alex Hales,5,5,1,0,6,False,0,0,1,0,0,3,1,0,False,,False,False,6.7,0,17,0,0,0,1,1,1,19
no run,1,England,8,Sri Lanka,2nd innings,0,tight liens from Malinga and this is punched on the up to extra cover - nothing given away this time (bar the wide),"Malinga to Roy, no run",0,49758,Lasith Malinga,0,12,0,2.0,5,429748,Amila Aponso,0,6,0,1.0,6,298438,Jason Roy,5,13,1,0,249866,Alex Hales,5,5,1,0,7,True,0,0,0,0,0,3,1,0,False,,False,False,6.33,0,18,0,0,0,1,1,0,19
no run,1,England,8,Sri Lanka,2nd innings,0,"tossed up from round the wicket, Hales gets out and blocks","Aponso to Hales, no run",0,429748,Amila Aponso,0,7,0,1.1,6,49758,Lasith Malinga,0,12,0,2.0,5,249866,Alex Hales,5,6,1,0,298438,Jason Roy,5,13,1,0,1,False,0,0,0,0,0,4,1,0,False,,False,False,6.0,0,19,0,0,0,1,1,0,19
no run,1,England,8,Sri Lanka,2nd innings,0,comes across on off and pushes square,"Aponso to Hales, no run",0,429748,Amila Aponso,0,8,0,1.2,6,49758,Lasith Malinga,0,12,0,2.0,5,249866,Alex Hales,5,7,1,0,298438,Jason Roy,5,13,1,0,2,False,0,0,0,0,0,4,1,0,False,,False,False,5.7,0,20,0,0,0,1,1,0,19
no run,1,England,8,Sri Lanka,2nd innings,0,"Hales takes a couple of steps down, plonks the front dog to drive, picks out extra cover","Aponso to Hales, no run",0,429748,Amila Aponso,0,9,0,1.3,6,49758,Lasith Malinga,0,12,0,2.0,5,249866,Alex Hales,5,8,1,0,298438,Jason Roy,5,13,1,0,3,False,0,0,0,0,0,4,1,0,False,,False,False,5.42,0,21,0,0,0,1,1,0,19
no run,1,England,8,Sri Lanka,2nd innings,0,"flatter delivery, skidding in to hit the pads, Hales standing outside leg stump, though","Aponso to Hales, no run",0,429748,Amila Aponso,0,10,0,1.4,6,49758,Lasith Malinga,0,12,0,2.0,5,249866,Alex Hales,5,9,1,0,298438,Jason Roy,5,13,1,0,4,False,0,0,0,0,0,4,1,0,False,,False,False,5.18,0,22,0,0,0,1,1,0,19
no run,1,England,8,Sri Lanka,2nd innings,0,"tossed up on off, can't pierce the cover ring again","Aponso to Hales, no run",0,429748,Amila Aponso,0,11,0,1.5,6,49758,Lasith Malinga,0,12,0,2.0,5,249866,Alex Hales,5,10,1,0,298438,Jason Roy,5,13,1,0,5,False,0,0,0,0,0,4,1,0,False,,False,False,4.95,0,23,0,0,0,1,1,0,19
run,1,England,8,Sri Lanka,2nd innings,1,"sliding a touch straighter, nudged off the pads for a single through square leg","Aponso to Hales, 1 run",0,429748,Amila Aponso,0,12,0,2.0,7,49758,Lasith Malinga,0,12,0,2.0,5,249866,Alex Hales,6,11,1,0,298438,Jason Roy,5,13,1,0,6,True,0,0,0,0,0,4,1,0,False,,False,False,5.0,0,24,0,0,0,1,1,0,20
no run,1,England,8,Sri Lanka,2nd innings,0,"length ball, 135kph/84mph around off, defended square","Malinga to Hales, no run",0,49758,Lasith Malinga,0,13,0,2.1,5,429748,Amila Aponso,0,12,0,2.0,7,249866,Alex Hales,6,12,1,0,298438,Jason Roy,5,13,1,0,1,False,0,0,0,0,0,5,4,0,False,,False,False,4.8,0,25,0,0,0,1,1,0,20
no run,1,England,8,Sri Lanka,2nd innings,0,"fuller, 86mph and dipping as Hales gets across and flicks towards mid-on","Malinga to Hales, no run",0,49758,Lasith Malinga,0,14,0,2.2,5,429748,Amila Aponso,0,12,0,2.0,7,249866,Alex Hales,6,13,1,0,298438,Jason Roy,5,13,1,0,2,False,0,0,0,0,0,5,4,0,False,,False,False,4.61,0,26,0,0,0,1,1,0,20
no run,1,England,8,Sri Lanka,2nd innings,0,"back of a length, whipped to midwicket without moving his feet","Malinga to Hales, no run",0,49758,Lasith Malinga,0,15,0,2.3,5,429748,Amila Aponso,0,12,0,2.0,7,249866,Alex Hales,6,14,1,0,298438,Jason Roy,5,13,1,0,3,False,0,0,0,0,0,5,4,0,False,,False,False,4.44,0,27,0,0,0,1,1,0,20
no run,1,England,8,Sri Lanka,2nd innings,0,"slower ball, tailing menacingly on middle and leg stump, Hales dabs it away carefully to the leg side","Malinga to Hales, no run",0,49758,Lasith Malinga,0,16,0,2.4,5,429748,Amila Aponso,0,12,0,2.0,7,249866,Alex Hales,6,15,1,0,298438,Jason Roy,5,13,1,0,4,False,0,0,0,0,0,5,4,0,False,,False,False,4.28,0,28,0,0,0,1,1,0,20
four,1,England,8,Sri Lanka,2nd innings,4,"short and wide, dismissed through backward point... Poor from Malinga and Hales cashes his chips with a breezy swing of the arms","Malinga to Hales, FOUR runs",0,49758,Lasith Malinga,0,17,0,2.5,9,429748,Amila Aponso,0,12,0,2.0,7,249866,Alex Hales,10,16,2,0,298438,Jason Roy,5,13,1,0,5,False,0,0,0,0,0,5,4,0,False,,False,False,4.96,0,29,0,0,0,1,1,0,24
no run,1,England,8,Sri Lanka,2nd innings,0,"stays back and chops towards point, 'No!' is the call as the throw comes in and hits directly at the non-striker's end, with Roy's bat grounded","Malinga to Hales, no run",0,49758,Lasith Malinga,0,18,0,3.0,9,429748,Amila Aponso,0,12,0,2.0,7,249866,Alex Hales,10,17,2,0,298438,Jason Roy,5,13,1,0,6,True,0,0,0,0,0,5,4,0,False,,False,False,4.8,0,30,0,0,0,1,1,0,24
four,1,England,8,Sri Lanka,2nd innings,4,"boshty! Fetch that! Flighted on off, Roy just cracks it back over the bowler's head for a one-bounce four","Aponso to Roy, FOUR runs",0,429748,Amila Aponso,0,13,0,2.1,11,49758,Lasith Malinga,0,18,0,3.0,9,298438,Jason Roy,9,14,2,0,249866,Alex Hales,10,17,2,0,1,False,0,0,0,0,0,6,13,0,False,,False,False,5.41,0,31,0,0,0,1,1,0,28
six,1,England,8,Sri Lanka,2nd innings,6,"goes again, <b>smeared over long-off for six!</b> 'Gerronwivit,' chirps Jason Roy's inner Ray Winstone, and he munches Aponso for another clean hit, extending the arms, up, up and away","Aponso to Roy, SIX runs",0,429748,Amila Aponso,0,14,0,2.2,17,49758,Lasith Malinga,0,18,0,3.0,9,298438,Jason Roy,15,15,2,1,249866,Alex Hales,10,17,2,0,2,False,0,0,0,0,0,6,13,0,False,,False,False,6.37,0,32,0,0,0,1,1,0,34
run,1,England,8,Sri Lanka,2nd innings,1,"pushed through straighter, tucked for one","Aponso to Roy, 1 run",0,429748,Amila Aponso,0,15,0,2.3,18,49758,Lasith Malinga,0,18,0,3.0,9,298438,Jason Roy,16,16,2,1,249866,Alex Hales,10,17,2,0,3,False,0,0,0,0,0,6,13,0,False,,False,False,6.36,0,33,0,0,0,1,1,0,35
no run,1,England,8,Sri Lanka,2nd innings,0,"this pops off the surface, hits the shoulder of the bat as Hales prods away from his body","Aponso to Hales, no run",0,429748,Amila Aponso,0,16,0,2.4,18,49758,Lasith Malinga,0,18,0,3.0,9,249866,Alex Hales,10,18,2,0,298438,Jason Roy,16,16,2,1,4,False,0,0,0,0,0,6,13,0,False,,False,False,6.17,0,34,0,0,0,1,1,0,35
run,1,England,8,Sri Lanka,2nd innings,1,"angled in with the arm, Hales works against the spin","Aponso to Hales, 1 run",0,429748,Amila Aponso,0,17,0,2.5,19,49758,Lasith Malinga,0,18,0,3.0,9,249866,Alex Hales,11,19,2,0,298438,Jason Roy,16,16,2,1,5,False,0,0,0,0,0,6,13,0,False,,False,False,6.17,0,35,0,0,0,1,1,0,36
run,1,England,8,Sri Lanka,2nd innings,1,"flat on the stumps, not much spin for Aponso, another easy single tapped to midwicket","Aponso to Roy, 1 run",0,429748,Amila Aponso,0,18,0,3.0,20,49758,Lasith Malinga,0,18,0,3.0,9,298438,Jason Roy,17,17,2,1,249866,Alex Hales,11,19,2,0,6,True,0,0,0,0,0,6,13,0,False,,False,False,6.16,0,36,0,0,0,1,1,0,37
no run,1,England,8,Sri Lanka,2nd innings,0,"length, shaping away a fraction on off stump, defended watchfully","Rajitha to Roy, no run",0,499594,Kasun Rajitha,0,1,0,0.1,0,429748,Amila Aponso,0,18,0,3.0,20,298438,Jason Roy,17,18,2,1,249866,Alex Hales,11,19,2,0,1,False,0,0,0,0,0,7,5,0,False,,False,False,6.0,0,37,0,0,0,1,1,0,37
wide,1,England,8,Sri Lanka,2nd innings,1,"pushed down the leg side as Roy steps out, swishes and misses","Rajitha to Roy, 1 wide",0,499594,Kasun Rajitha,0,1,0,0.1,1,429748,Amila Aponso,0,18,0,3.0,20,298438,Jason Roy,17,18,2,1,249866,Alex Hales,11,19,2,0,2,False,0,0,1,0,0,7,5,0,False,,False,False,6.16,0,37,0,0,0,1,1,1,38
no run,1,England,8,Sri Lanka,2nd innings,0,"fired in straight, 137kph/85mph and Roy clips it firmly to midwicket","Rajitha to Roy, no run",0,499594,Kasun Rajitha,0,2,0,0.2,1,429748,Amila Aponso,0,18,0,3.0,20,298438,Jason Roy,17,19,2,1,249866,Alex Hales,11,19,2,0,3,False,0,0,0,0,0,7,5,0,False,,False,False,6.0,0,38,0,0,0,1,1,0,38
no run,1,England,8,Sri Lanka,2nd innings,0,"fuller, 83mph and it straightens enough to get Roy miscuing towards mid-on as he brings the bat down","Rajitha to Roy, no run",0,499594,Kasun Rajitha,0,3,0,0.3,1,429748,Amila Aponso,0,18,0,3.0,20,298438,Jason Roy,17,20,2,1,249866,Alex Hales,11,19,2,0,4,False,0,0,0,0,0,7,5,0,False,,False,False,5.84,0,39,0,0,0,1,1,0,38
