PlayType_description,Batting_Team_id,Batting_Team_name,Bowling_Team_id,Bowling_Team_name,Innings,Total_Runs_on_delivery,Commentary,Commentary_short,Score,Bowler_id,Bowler_name,Bowler_maiden,Bowler_balls,Bowler_wickets,Bowler_over,Bowler_conceded,Other_Bowler_id,Other_Bowler_name,Other_Bowler_maidens,Other_Bowler_balls,Other_Bowler_wickets,Other_Bowler_overs,Other_Bowler_conceded,Batsman_id,Batsman_name,Batsman_runs,Batsman_balls_faced,Batsman_four,Batsman_sixes,Other_Batsman_id,Other_Batsman_name,Other_Batsman_runs,Other_Batsman_balls_faced,Other_Batsman_four,Other_Batsman_sixes,Over_ball,Over_complete,Over_maiden,Over_no_Ball,Over_wide,Over_byes,Over_leg_byes,Over_number,Over_runs,Over_wickets,Dismissal_is_true,Dismissal_type,Dismissal_fielder_iskeeper,Dismissal_text,Innings_run_rate,Innings_byes,Innings_balls,Innings_no_balls,Innings_wickets,Innings_leg_byes,Innings_session,Innings_day,Innings_wides,Innings_runs
no run,6,India,2,Australia,2nd innings,0,"full around off, pushed off the inside of the bat towards mid-on","Stoinis to Dhoni, no run",0,325012,Marcus Stoinis,0,12,1,2.0,7,533042,Billy Stanlake,0,30,0,5.0,23,28081,MS Dhoni,8,10,0,0,253802,Virat Kohli,29,41,3,0,6,True,0,0,0,0,0,19,4,0,False,,False,False,3.63,0,114,0,2,0,1,1,0,69
run,6,India,2,Australia,2nd innings,3,"short, straightening outside off, rocks back and cuts behind point","Zampa to Kohli, 3 runs",0,379504,Adam Zampa,0,13,0,2.1,10,325012,Marcus Stoinis,0,12,1,2.0,7,253802,Virat Kohli,32,42,3,0,28081,MS Dhoni,8,10,0,0,1,False,0,0,0,0,0,20,4,0,False,,False,False,3.75,0,115,0,2,0,1,1,0,72
no run,6,India,2,Australia,2nd innings,0,comes down the track to a flat and fuller one and pushes it straight back,"Zampa to Dhoni, no run",0,379504,Adam Zampa,0,14,0,2.2,10,325012,Marcus Stoinis,0,12,1,2.0,7,28081,MS Dhoni,8,11,0,0,253802,Virat Kohli,32,42,3,0,2,False,0,0,0,0,0,20,4,0,False,,False,False,3.72,0,116,0,2,0,1,1,0,72
no run,6,India,2,Australia,2nd innings,0,"back of a length, subtly spinning away towards off, defended off the backfoot","Zampa to Dhoni, no run",0,379504,Adam Zampa,0,15,0,2.3,10,325012,Marcus Stoinis,0,12,1,2.0,7,28081,MS Dhoni,8,12,0,0,253802,Virat Kohli,32,42,3,0,3,False,0,0,0,0,0,20,4,0,False,,False,False,3.69,0,117,0,2,0,1,1,0,72
no run,6,India,2,Australia,2nd innings,0,"shortish, sliding in, it's the wrong'un, Dhoni tries to pull but doesn't find the room he's looking for","Zampa to Dhoni, no run",0,379504,Adam Zampa,0,16,0,2.4,10,325012,Marcus Stoinis,0,12,1,2.0,7,28081,MS Dhoni,8,13,0,0,253802,Virat Kohli,32,42,3,0,4,False,0,0,0,0,0,20,4,0,False,,False,False,3.66,0,118,0,2,0,1,1,0,72
no run,6,India,2,Australia,2nd innings,0,"full on middle, pushed to mid-on","Zampa to Dhoni, no run",0,379504,Adam Zampa,0,17,0,2.5,10,325012,Marcus Stoinis,0,12,1,2.0,7,28081,MS Dhoni,8,14,0,0,253802,Virat Kohli,32,42,3,0,5,False,0,0,0,0,0,20,4,0,False,,False,False,3.63,0,119,0,2,0,1,1,0,72
run,6,India,2,Australia,2nd innings,1,advances to a low full toss and slaps it to deep cover,"Zampa to Dhoni, 1 run",0,379504,Adam Zampa,0,18,0,3.0,11,325012,Marcus Stoinis,0,12,1,2.0,7,28081,MS Dhoni,9,15,0,0,253802,Virat Kohli,32,42,3,0,6,True,0,0,0,0,0,20,4,0,False,,False,False,3.65,0,120,0,2,0,1,1,0,73
no run,6,India,2,Australia,2nd innings,0,"back of a length around off, advances and ends up knocking it to mid-on","Stoinis to Dhoni, no run",0,325012,Marcus Stoinis,0,13,1,2.1,7,379504,Adam Zampa,0,18,0,3.0,11,28081,MS Dhoni,9,16,0,0,253802,Virat Kohli,32,42,3,0,1,False,0,0,0,0,0,21,3,0,False,,False,False,3.61,0,121,0,2,0,1,1,0,73
no run,6,India,2,Australia,2nd innings,0,"slower ball, back of a length, inside-edged into the surface, <b>almost chopped on</b>","Stoinis to Dhoni, no run",0,325012,Marcus Stoinis,0,14,1,2.2,7,379504,Adam Zampa,0,18,0,3.0,11,28081,MS Dhoni,9,17,0,0,253802,Virat Kohli,32,42,3,0,2,False,0,0,0,0,0,21,3,0,False,,False,False,3.59,0,122,0,2,0,1,1,0,73
no run,6,India,2,Australia,2nd innings,0,"<b>run out chance, missed</b>. Dhoni drives this fuller one to extra cover. Dhoni gives a slight indication that he might be interested in the single. Kohli takes off and then Dhoni backs off, sending his captain back. Direct hit, and Kohli wasn't even in the frame","Stoinis to Dhoni, no run",0,325012,Marcus Stoinis,0,15,1,2.3,7,379504,Adam Zampa,0,18,0,3.0,11,28081,MS Dhoni,9,18,0,0,253802,Virat Kohli,32,42,3,0,3,False,0,0,0,0,0,21,3,0,False,,False,False,3.56,0,123,0,2,0,1,1,0,73
no run,6,India,2,Australia,2nd innings,0,,"Stoinis to Dhoni, no run",0,325012,Marcus Stoinis,0,16,1,2.4,7,379504,Adam Zampa,0,18,0,3.0,11,28081,MS Dhoni,9,19,0,0,253802,Virat Kohli,32,42,3,0,4,False,0,0,0,0,0,21,3,0,False,,False,False,3.53,0,124,0,2,0,1,1,0,73
run,6,India,2,Australia,2nd innings,3,"shortish, pulled with the angle behind square leg, and now they're back to their best running between the wickets, collecting three for it","Stoinis to Dhoni, 3 runs",0,325012,Marcus Stoinis,0,17,1,2.5,10,379504,Adam Zampa,0,18,0,3.0,11,28081,MS Dhoni,12,20,0,0,253802,Virat Kohli,32,42,3,0,5,False,0,0,0,0,0,21,3,0,False,,False,False,3.64,0,125,0,2,0,1,1,0,76
no run,6,India,2,Australia,2nd innings,0,"full, shapes in and goes off the inside of the bat towards mid-on as Kohli drives","Stoinis to Kohli, no run",0,325012,Marcus Stoinis,0,18,1,3.0,10,379504,Adam Zampa,0,18,0,3.0,11,253802,Virat Kohli,32,43,3,0,28081,MS Dhoni,12,20,0,0,6,True,0,0,0,0,0,21,3,0,False,,False,False,3.61,0,126,0,2,0,1,1,0,76
run,6,India,2,Australia,2nd innings,1,"full, sliding and dips late, Dhoni reaches forward to drill it away wide of long-off","Zampa to Dhoni, 1 run",0,379504,Adam Zampa,0,19,0,3.1,12,325012,Marcus Stoinis,0,18,1,3.0,10,28081,MS Dhoni,13,21,0,0,253802,Virat Kohli,32,43,3,0,1,False,0,0,0,0,0,22,2,0,False,,False,False,3.63,0,127,0,2,0,1,1,0,77
no run,6,India,2,Australia,2nd innings,0,"<b>run out chance again</b> Referred upstairs. But Dhoni might be safe, I reckon. Yup, full stretch forward, bat dragged along the ground and it saves him. This time Dhoni took off after Kohli carved a fuller one away to backward point. Kohli called but was ball-watching and eventually sends Dhoni back","Zampa to Kohli, no run",0,379504,Adam Zampa,0,20,0,3.2,12,325012,Marcus Stoinis,0,18,1,3.0,10,253802,Virat Kohli,32,44,3,0,28081,MS Dhoni,13,21,0,0,2,False,0,0,0,0,0,22,2,0,False,,False,False,3.6,0,128,0,2,0,1,1,0,77
run,6,India,2,Australia,2nd innings,1,"pitched up outside off, opens up for a slap to sweeper cover","Zampa to Kohli, 1 run",0,379504,Adam Zampa,0,21,0,3.3,13,325012,Marcus Stoinis,0,18,1,3.0,10,253802,Virat Kohli,33,45,3,0,28081,MS Dhoni,13,21,0,0,3,False,0,0,0,0,0,22,2,0,False,,False,False,3.62,0,129,0,2,0,1,1,0,78
no run,6,India,2,Australia,2nd innings,0,comes down the track to smother it,"Zampa to Dhoni, no run",0,379504,Adam Zampa,0,22,0,3.4,13,325012,Marcus Stoinis,0,18,1,3.0,10,28081,MS Dhoni,13,22,0,0,253802,Virat Kohli,33,45,3,0,4,False,0,0,0,0,0,22,2,0,False,,False,False,3.6,0,130,0,2,0,1,1,0,78
no run,6,India,2,Australia,2nd innings,0,backs away and chops this into the surface as he doesn't get the room to free up his arms,"Zampa to Dhoni, no run",0,379504,Adam Zampa,0,23,0,3.5,13,325012,Marcus Stoinis,0,18,1,3.0,10,28081,MS Dhoni,13,23,0,0,253802,Virat Kohli,33,45,3,0,5,False,0,0,0,0,0,22,2,0,False,,False,False,3.57,0,131,0,2,0,1,1,0,78
no run,6,India,2,Australia,2nd innings,0,"short, a bit of width, cut late to backward point","Zampa to Dhoni, no run",0,379504,Adam Zampa,0,24,0,4.0,13,325012,Marcus Stoinis,0,18,1,3.0,10,28081,MS Dhoni,13,24,0,0,253802,Virat Kohli,33,45,3,0,6,True,0,0,0,0,0,22,2,0,False,,False,False,3.54,0,132,0,2,0,1,1,0,78
no run,6,India,2,Australia,2nd innings,0,"full outside off, tails in late and Kohli blocks into the leg side off the inside of the bat","Stoinis to Kohli, no run",0,325012,Marcus Stoinis,0,19,1,3.1,10,379504,Adam Zampa,0,24,0,4.0,13,253802,Virat Kohli,33,46,3,0,28081,MS Dhoni,13,24,0,0,1,False,0,0,0,0,0,23,5,0,False,,False,False,3.51,0,133,0,2,0,1,1,0,78
run,6,India,2,Australia,2nd innings,1,powerfully and wristily whips away this fuller one after moving across off to get behind the line,"Stoinis to Kohli, 1 run",0,325012,Marcus Stoinis,0,20,1,3.2,11,379504,Adam Zampa,0,24,0,4.0,13,253802,Virat Kohli,34,47,3,0,28081,MS Dhoni,13,24,0,0,2,False,0,0,0,0,0,23,5,0,False,,False,False,3.53,0,134,0,2,0,1,1,0,79
four,6,India,2,Australia,2nd innings,4,shot! Imperious from Dhoni. As if to say 'go fetch that'. Advances down the ground to a length ball and swats it away to the left of mid-on,"Stoinis to Dhoni, FOUR runs",0,325012,Marcus Stoinis,0,21,1,3.3,15,379504,Adam Zampa,0,24,0,4.0,13,28081,MS Dhoni,17,25,1,0,253802,Virat Kohli,34,47,3,0,3,False,0,0,0,0,0,23,5,0,False,,False,False,3.68,0,135,0,2,0,1,1,0,83
no run,6,India,2,Australia,2nd innings,0,"slower length ball, a cutter on middle, defended back","Stoinis to Dhoni, no run",0,325012,Marcus Stoinis,0,22,1,3.4,15,379504,Adam Zampa,0,24,0,4.0,13,28081,MS Dhoni,17,26,1,0,253802,Virat Kohli,34,47,3,0,4,False,0,0,0,0,0,23,5,0,False,,False,False,3.66,0,136,0,2,0,1,1,0,83
no run,6,India,2,Australia,2nd innings,0,"full, curving in, pushed to mid-on off the inside of the bat","Stoinis to Dhoni, no run",0,325012,Marcus Stoinis,0,23,1,3.5,15,379504,Adam Zampa,0,24,0,4.0,13,28081,MS Dhoni,17,27,1,0,253802,Virat Kohli,34,47,3,0,5,False,0,0,0,0,0,23,5,0,False,,False,False,3.63,0,137,0,2,0,1,1,0,83
no run,6,India,2,Australia,2nd innings,0,"full on middle, clipped to midwicket","Stoinis to Dhoni, no run",0,325012,Marcus Stoinis,0,24,1,4.0,15,379504,Adam Zampa,0,24,0,4.0,13,28081,MS Dhoni,17,28,1,0,253802,Virat Kohli,34,47,3,0,6,True,0,0,0,0,0,23,5,0,False,,False,False,3.6,0,138,0,2,0,1,1,0,83
run,6,India,2,Australia,2nd innings,1,"tossed up on off, driven out through the covers","Zampa to Kohli, 1 run",0,379504,Adam Zampa,0,25,0,4.1,14,325012,Marcus Stoinis,0,24,1,4.0,15,253802,Virat Kohli,35,48,3,0,28081,MS Dhoni,17,28,1,0,1,False,0,0,0,0,0,24,2,0,False,,False,False,3.62,0,139,0,2,0,1,1,0,84
no run,6,India,2,Australia,2nd innings,0,"subtle turn and lots of bounce outside off, left alone","Zampa to Dhoni, no run",0,379504,Adam Zampa,0,26,0,4.2,14,325012,Marcus Stoinis,0,24,1,4.0,15,28081,MS Dhoni,17,29,1,0,253802,Virat Kohli,35,48,3,0,2,False,0,0,0,0,0,24,2,0,False,,False,False,3.6,0,140,0,2,0,1,1,0,84
no run,6,India,2,Australia,2nd innings,0,drills a fuller one straight to cover,"Zampa to Dhoni, no run",0,379504,Adam Zampa,0,27,0,4.3,14,325012,Marcus Stoinis,0,24,1,4.0,15,28081,MS Dhoni,17,30,1,0,253802,Virat Kohli,35,48,3,0,3,False,0,0,0,0,0,24,2,0,False,,False,False,3.57,0,141,0,2,0,1,1,0,84
no run,6,India,2,Australia,2nd innings,0,"slider on middle and leg, defended down the track","Zampa to Dhoni, no run",0,379504,Adam Zampa,0,28,0,4.4,14,325012,Marcus Stoinis,0,24,1,4.0,15,28081,MS Dhoni,17,31,1,0,253802,Virat Kohli,35,48,3,0,4,False,0,0,0,0,0,24,2,0,False,,False,False,3.54,0,142,0,2,0,1,1,0,84
run,6,India,2,Australia,2nd innings,1,"short, makes some room and cuts through point","Zampa to Dhoni, 1 run",0,379504,Adam Zampa,0,29,0,4.5,15,325012,Marcus Stoinis,0,24,1,4.0,15,28081,MS Dhoni,18,32,1,0,253802,Virat Kohli,35,48,3,0,5,False,0,0,0,0,0,24,2,0,False,,False,False,3.56,0,143,0,2,0,1,1,0,85
no run,6,India,2,Australia,2nd innings,0,"pitched up with lots of width, Kohli opens up and slaps it hard but Maxwell flings himself to his left and saves four","Zampa to Kohli, no run",0,379504,Adam Zampa,0,30,0,5.0,15,325012,Marcus Stoinis,0,24,1,4.0,15,253802,Virat Kohli,35,49,3,0,28081,MS Dhoni,18,32,1,0,6,True,0,0,0,0,0,24,2,0,False,,False,False,3.54,0,144,0,2,0,1,1,0,85
no run,6,India,2,Australia,2nd innings,0,"back of a length around off, defended","Siddle to Dhoni, no run",0,7898,Peter Siddle,1,25,1,4.1,13,379504,Adam Zampa,0,30,0,5.0,15,28081,MS Dhoni,18,33,1,0,253802,Virat Kohli,35,49,3,0,1,False,0,0,0,0,0,25,8,0,False,,False,False,3.51,0,145,0,2,0,1,1,0,85
run,6,India,2,Australia,2nd innings,2,comes down the track and whips it away to the right of midwicket,"Siddle to Dhoni, 2 runs",0,7898,Peter Siddle,1,26,1,4.2,15,379504,Adam Zampa,0,30,0,5.0,15,28081,MS Dhoni,20,34,1,0,253802,Virat Kohli,35,49,3,0,2,False,0,0,0,0,0,25,8,0,False,,False,False,3.57,0,146,0,2,0,1,1,0,87
four,6,India,2,Australia,2nd innings,4,"short around off, doesn't get entirely on top of it but enough to pull it away through midwicket","Siddle to Dhoni, FOUR runs",0,7898,Peter Siddle,1,27,1,4.3,19,379504,Adam Zampa,0,30,0,5.0,15,28081,MS Dhoni,24,35,2,0,253802,Virat Kohli,35,49,3,0,3,False,0,0,0,0,0,25,8,0,False,,False,False,3.71,0,147,0,2,0,1,1,0,91
run,6,India,2,Australia,2nd innings,1,"short of good length outside off, nudged off the hips to square leg","Siddle to Dhoni, 1 run",0,7898,Peter Siddle,1,28,1,4.4,20,379504,Adam Zampa,0,30,0,5.0,15,28081,MS Dhoni,25,36,2,0,253802,Virat Kohli,35,49,3,0,4,False,0,0,0,0,0,25,8,0,False,,False,False,3.72,0,148,0,2,0,1,1,0,92
no run,6,India,2,Australia,2nd innings,0,comes down the track and drives but off the inside half of the bat towards mid-off,"Siddle to Kohli, no run",0,7898,Peter Siddle,1,29,1,4.5,20,379504,Adam Zampa,0,30,0,5.0,15,253802,Virat Kohli,35,50,3,0,28081,MS Dhoni,25,36,2,0,5,False,0,0,0,0,0,25,8,0,False,,False,False,3.7,0,149,0,2,0,1,1,0,92
run,6,India,2,Australia,2nd innings,1,"shortish outside off, rides the bounce and nudges it away to third man","Siddle to Kohli, 1 run",0,7898,Peter Siddle,1,30,1,5.0,21,379504,Adam Zampa,0,30,0,5.0,15,253802,Virat Kohli,36,51,3,0,28081,MS Dhoni,25,36,2,0,6,True,0,0,0,0,0,25,8,0,False,,False,False,3.72,0,150,0,2,0,1,1,0,93
run,6,India,2,Australia,2nd innings,2,the whip-lash cover drive! Kohli gets inside the line of a tossed up ball outside off and powers it through with a snap of his wrists,"Zampa to Kohli, 2 runs",0,379504,Adam Zampa,0,31,0,5.1,17,7898,Peter Siddle,1,30,1,5.0,21,253802,Virat Kohli,38,52,3,0,28081,MS Dhoni,25,36,2,0,1,False,0,0,0,0,0,26,5,0,False,,False,False,3.77,0,151,0,2,0,1,1,0,95
run,6,India,2,Australia,2nd innings,1,"a little slower through the air, a little closer to  off stump, and that means Kohli leans forward and works it to long-on, again with a snap of his wrists","Zampa to Kohli, 1 run",0,379504,Adam Zampa,0,32,0,5.2,18,7898,Peter Siddle,1,30,1,5.0,21,253802,Virat Kohli,39,53,3,0,28081,MS Dhoni,25,36,2,0,2,False,0,0,0,0,0,26,5,0,False,,False,False,3.78,0,152,0,2,0,1,1,0,96
no run,6,India,2,Australia,2nd innings,0,pokes the flighted delivery outside off to short cover,"Zampa to Dhoni, no run",0,379504,Adam Zampa,0,33,0,5.3,18,7898,Peter Siddle,1,30,1,5.0,21,28081,MS Dhoni,25,37,2,0,253802,Virat Kohli,39,53,3,0,3,False,0,0,0,0,0,26,5,0,False,,False,False,3.76,0,153,0,2,0,1,1,0,96
no run,6,India,2,Australia,2nd innings,0,lets the deliciously full ball go outside off - and it's just within the wide line too. Excellent bowling from the legspinner,"Zampa to Dhoni, no run",0,379504,Adam Zampa,0,34,0,5.4,18,7898,Peter Siddle,1,30,1,5.0,21,28081,MS Dhoni,25,38,2,0,253802,Virat Kohli,39,53,3,0,4,False,0,0,0,0,0,26,5,0,False,,False,False,3.74,0,154,0,2,0,1,1,0,96
run,6,India,2,Australia,2nd innings,1,"loops it up on middle, Dhoni pushes it down to long-off","Zampa to Dhoni, 1 run",0,379504,Adam Zampa,0,35,0,5.5,19,7898,Peter Siddle,1,30,1,5.0,21,28081,MS Dhoni,26,39,2,0,253802,Virat Kohli,39,53,3,0,5,False,0,0,0,0,0,26,5,0,False,,False,False,3.75,0,155,0,2,0,1,1,0,97
run,6,India,2,Australia,2nd innings,1,rocks back to carve the shorter delivery on off stump - no turn on it - to the sweeper cover,"Zampa to Kohli, 1 run",0,379504,Adam Zampa,0,36,0,6.0,20,7898,Peter Siddle,1,30,1,5.0,21,253802,Virat Kohli,40,54,3,0,28081,MS Dhoni,26,39,2,0,6,True,0,0,0,0,0,26,5,0,False,,False,False,3.76,0,156,0,2,0,1,1,0,98
run,6,India,2,Australia,2nd innings,1,"fuller of a length outside off, flicked towards mid-on. A slight yes-and-no makes Marsh throw. He hits - with Dhoni inside - and they get the single off the deflection","Siddle to Kohli, 1 run",0,7898,Peter Siddle,1,31,1,5.1,22,379504,Adam Zampa,0,36,0,6.0,20,253802,Virat Kohli,41,55,3,0,28081,MS Dhoni,26,39,2,0,1,False,0,0,0,0,0,27,6,0,False,,False,False,3.78,0,157,0,2,0,1,1,0,99
no run,6,India,2,Australia,2nd innings,0,"length outside off, defended into the covers","Siddle to Dhoni, no run",0,7898,Peter Siddle,1,32,1,5.2,22,379504,Adam Zampa,0,36,0,6.0,20,28081,MS Dhoni,26,40,2,0,253802,Virat Kohli,41,55,3,0,2,False,0,0,0,0,0,27,6,0,False,,False,False,3.75,0,158,0,2,0,1,1,0,99
run,6,India,2,Australia,2nd innings,1,"short of a length, advances and nudges towards mid-on. Sets off for a quick one and beats Marsh diving with the throw at the bowler's end","Siddle to Dhoni, 1 run",0,7898,Peter Siddle,1,33,1,5.3,23,379504,Adam Zampa,0,36,0,6.0,20,28081,MS Dhoni,27,41,2,0,253802,Virat Kohli,41,55,3,0,3,False,0,0,0,0,0,27,6,0,False,,False,False,3.77,0,159,0,2,0,1,1,0,100
run,6,India,2,Australia,2nd innings,1,"short, bit of width, cut to deep cover","Siddle to Kohli, 1 run",0,7898,Peter Siddle,1,34,1,5.4,24,379504,Adam Zampa,0,36,0,6.0,20,253802,Virat Kohli,42,56,3,0,28081,MS Dhoni,27,41,2,0,4,False,0,0,0,0,0,27,6,0,False,,False,False,3.78,0,160,0,2,0,1,1,0,101
no run,6,India,2,Australia,2nd innings,0,"back of a length, cut late to point where Maxwell remains impregnable","Siddle to Dhoni, no run",0,7898,Peter Siddle,1,35,1,5.5,24,379504,Adam Zampa,0,36,0,6.0,20,28081,MS Dhoni,27,42,2,0,253802,Virat Kohli,42,56,3,0,5,False,0,0,0,0,0,27,6,0,False,,False,False,3.76,0,161,0,2,0,1,1,0,101
run,6,India,2,Australia,2nd innings,3,"short outside off, Dhoni pulls it to deep midwicket. Only a fielder at deep square leg, and it's well wide of him for them to come back for a third","Siddle to Dhoni, 3 runs",0,7898,Peter Siddle,1,36,1,6.0,27,379504,Adam Zampa,0,36,0,6.0,20,28081,MS Dhoni,30,43,2,0,253802,Virat Kohli,42,56,3,0,6,True,0,0,0,0,0,27,6,0,False,,False,False,3.85,0,162,0,2,0,1,1,0,104
no run,6,India,2,Australia,2nd innings,0,"back of a length outside off, punched to cover","Richardson to Dhoni, no run",0,774223,Jhye Richardson,0,31,0,5.1,12,7898,Peter Siddle,1,36,1,6.0,27,28081,MS Dhoni,30,44,2,0,253802,Virat Kohli,42,56,3,0,1,False,1,0,0,0,0,28,0,0,False,,False,False,3.82,0,163,0,2,0,1,1,0,104
no run,6,India,2,Australia,2nd innings,0,"fuller around off, pushed to cover","Richardson to Dhoni, no run",0,774223,Jhye Richardson,0,32,0,5.2,12,7898,Peter Siddle,1,36,1,6.0,27,28081,MS Dhoni,30,45,2,0,253802,Virat Kohli,42,56,3,0,2,False,1,0,0,0,0,28,0,0,False,,False,False,3.8,0,164,0,2,0,1,1,0,104
no run,6,India,2,Australia,2nd innings,0,"full around off, driven towards mid-off","Richardson to Dhoni, no run",0,774223,Jhye Richardson,0,33,0,5.3,12,7898,Peter Siddle,1,36,1,6.0,27,28081,MS Dhoni,30,46,2,0,253802,Virat Kohli,42,56,3,0,3,False,1,0,0,0,0,28,0,0,False,,False,False,3.78,0,165,0,2,0,1,1,0,104
no run,6,India,2,Australia,2nd innings,0,"short outside off, keeps the hands down and lets it go","Richardson to Dhoni, no run",0,774223,Jhye Richardson,0,34,0,5.4,12,7898,Peter Siddle,1,36,1,6.0,27,28081,MS Dhoni,30,47,2,0,253802,Virat Kohli,42,56,3,0,4,False,1,0,0,0,0,28,0,0,False,,False,False,3.75,0,166,0,2,0,1,1,0,104
no run,6,India,2,Australia,2nd innings,0,"back of a length around off, punched back","Richardson to Dhoni, no run",0,774223,Jhye Richardson,0,35,0,5.5,12,7898,Peter Siddle,1,36,1,6.0,27,28081,MS Dhoni,30,48,2,0,253802,Virat Kohli,42,56,3,0,5,False,1,0,0,0,0,28,0,0,False,,False,False,3.73,0,167,0,2,0,1,1,0,104
no run,6,India,2,Australia,2nd innings,0,"fuller around off, half-shuffles and pushes it into the covers. Maiden from Richardson","Richardson to Dhoni, no run",0,774223,Jhye Richardson,1,36,0,6.0,12,7898,Peter Siddle,1,36,1,6.0,27,28081,MS Dhoni,30,49,2,0,253802,Virat Kohli,42,56,3,0,6,True,1,0,0,0,0,28,0,0,False,,False,False,3.71,0,168,0,2,0,1,1,0,104
run,6,India,2,Australia,2nd innings,1,"short and wide, cracked off the backfoot to deep point","Siddle to Kohli, 1 run",0,7898,Peter Siddle,1,37,1,6.1,28,774223,Jhye Richardson,1,36,0,6.0,12,253802,Virat Kohli,43,57,3,0,28081,MS Dhoni,30,49,2,0,1,False,0,0,0,0,0,29,5,0,False,,False,False,3.72,0,169,0,2,0,1,1,0,105
no run,6,India,2,Australia,2nd innings,0,tries to flick it with the inward angle and gets an inside edge to the pad,"Siddle to Dhoni, no run",0,7898,Peter Siddle,1,38,1,6.2,28,774223,Jhye Richardson,1,36,0,6.0,12,28081,MS Dhoni,30,50,2,0,253802,Virat Kohli,43,57,3,0,2,False,0,0,0,0,0,29,5,0,False,,False,False,3.7,0,170,0,2,0,1,1,0,105
no run,6,India,2,Australia,2nd innings,0,"back of a length, stops a little on the surface, punched airily to mid-off","Siddle to Dhoni, no run",0,7898,Peter Siddle,1,39,1,6.3,28,774223,Jhye Richardson,1,36,0,6.0,12,28081,MS Dhoni,30,51,2,0,253802,Virat Kohli,43,57,3,0,3,False,0,0,0,0,0,29,5,0,False,,False,False,3.68,0,171,0,2,0,1,1,0,105
four,6,India,2,Australia,2nd innings,4,<b>edged and over the keeper</b>. The dots were building up so you could sense this was coming. Down the ground but it's too short for him comfort. Has a free swing and gets a thick nick past the outstretched right hand of the keeper,"Siddle to Dhoni, FOUR runs",0,7898,Peter Siddle,1,40,1,6.4,32,774223,Jhye Richardson,1,36,0,6.0,12,28081,MS Dhoni,34,52,3,0,253802,Virat Kohli,43,57,3,0,4,False,0,0,0,0,0,29,5,0,False,,False,False,3.8,0,172,0,2,0,1,1,0,109
no run,6,India,2,Australia,2nd innings,0,"comes down the ground and swings for the fences again, this time looking to hack it over the leg side, and the ball sneaks underneath the bat. Ah, hang on.. not quite. It has taken a feather on the udneredge. Australia don't appeal, barring Maxwell at point. <b>Another chance gone</b>","Siddle to Dhoni, no run",0,7898,Peter Siddle,1,41,1,6.5,32,774223,Jhye Richardson,1,36,0,6.0,12,28081,MS Dhoni,34,53,3,0,253802,Virat Kohli,43,57,3,0,5,False,0,0,0,0,0,29,5,0,False,,False,False,3.78,0,173,0,2,0,1,1,0,109
no run,6,India,2,Australia,2nd innings,0,"very full on middle and leg, clipped to midwicket","Siddle to Dhoni, no run",0,7898,Peter Siddle,1,42,1,7.0,32,774223,Jhye Richardson,1,36,0,6.0,12,28081,MS Dhoni,34,54,3,0,253802,Virat Kohli,43,57,3,0,6,True,0,0,0,0,0,29,5,0,False,,False,False,3.75,0,174,0,2,0,1,1,0,109
no run,6,India,2,Australia,2nd innings,0,,"Richardson to Kohli, no run",0,774223,Jhye Richardson,1,37,0,6.1,12,7898,Peter Siddle,1,42,1,7.0,32,253802,Virat Kohli,43,58,3,0,28081,MS Dhoni,34,54,3,0,1,False,0,0,0,0,0,30,4,1,False,,False,False,3.73,0,175,0,2,0,1,1,0,109
run,6,India,2,Australia,2nd innings,1,"short and wide, slapped away to deep point","Richardson to Kohli, 1 run",0,774223,Jhye Richardson,1,38,0,6.2,13,7898,Peter Siddle,1,42,1,7.0,32,253802,Virat Kohli,44,59,3,0,28081,MS Dhoni,34,54,3,0,2,False,0,0,0,0,0,30,4,1,False,,False,False,3.75,0,176,0,2,0,1,1,0,110
run,6,India,2,Australia,2nd innings,1,worked away to third man,"Richardson to Dhoni, 1 run",0,774223,Jhye Richardson,1,39,0,6.3,14,7898,Peter Siddle,1,42,1,7.0,32,28081,MS Dhoni,35,55,3,0,253802,Virat Kohli,44,59,3,0,3,False,0,0,0,0,0,30,4,1,False,,False,False,3.76,0,177,0,2,0,1,1,0,111
no run,6,India,2,Australia,2nd innings,0,"fuller outside off, goes hard at it and knocks it back to the bowler off the inside of the bat","Richardson to Kohli, no run",0,774223,Jhye Richardson,1,40,0,6.4,14,7898,Peter Siddle,1,42,1,7.0,32,253802,Virat Kohli,44,60,3,0,28081,MS Dhoni,35,55,3,0,4,False,0,0,0,0,0,30,4,1,False,,False,False,3.74,0,178,0,2,0,1,1,0,111
run,6,India,2,Australia,2nd innings,2,"full, pushes away from the body for a brace behind point","Richardson to Kohli, 2 runs",0,774223,Jhye Richardson,1,41,0,6.5,16,7898,Peter Siddle,1,42,1,7.0,32,253802,Virat Kohli,46,61,3,0,28081,MS Dhoni,35,55,3,0,5,False,0,0,0,0,0,30,4,1,False,,False,False,3.78,0,179,0,2,0,1,1,0,113
out,6,India,2,Australia,2nd innings,0,"<b>edged and gone</b>. Australia finally have a wicket. And it's BiiiiG! Kohli pushes way away from the body, Richardson tempting him with pace and width. Big, fat edge to Carey who holds on this time","Richardson to Kohli, OUT",0,774223,Jhye Richardson,1,42,1,7.0,16,7898,Peter Siddle,1,42,1,7.0,32,253802,Virat Kohli,46,62,3,0,28081,MS Dhoni,35,55,3,0,6,True,0,0,0,0,0,30,4,1,True,caught,False,V Kohli c &dagger;Carey b Richardson 46 (62b 3x4 0x6) SR: 74.19,3.76,0,180,0,3,0,1,1,0,113
run,6,India,2,Australia,2nd innings,2,"full, angled into the pads, clipped to deep square leg","Stanlake to Dhoni, 2 runs",0,533042,Billy Stanlake,0,31,0,5.1,25,774223,Jhye Richardson,1,42,1,7.0,16,28081,MS Dhoni,37,56,3,0,290716,Kedar Jadhav,0,0,0,0,1,False,0,0,0,0,0,31,4,0,False,,False,False,3.81,0,181,0,3,0,1,1,0,115
run,6,India,2,Australia,2nd innings,1,"fuller of a length on middle, nudged to square leg","Stanlake to Dhoni, 1 run",0,533042,Billy Stanlake,0,32,0,5.2,26,774223,Jhye Richardson,1,42,1,7.0,16,28081,MS Dhoni,38,57,3,0,290716,Kedar Jadhav,0,0,0,0,2,False,0,0,0,0,0,31,4,0,False,,False,False,3.82,0,182,0,3,0,1,1,0,116
no run,6,India,2,Australia,2nd innings,0,"good length outside off, gets an inside edge onto the pad as he presses forward to defend","Stanlake to Jadhav, no run",0,533042,Billy Stanlake,0,33,0,5.3,26,774223,Jhye Richardson,1,42,1,7.0,16,290716,Kedar Jadhav,0,1,0,0,28081,MS Dhoni,38,57,3,0,3,False,0,0,0,0,0,31,4,0,False,,False,False,3.8,0,183,0,3,0,1,1,0,116
no run,6,India,2,Australia,2nd innings,0,"very full outside off, clipped towards mid-on","Stanlake to Jadhav, no run",0,533042,Billy Stanlake,0,34,0,5.4,26,774223,Jhye Richardson,1,42,1,7.0,16,290716,Kedar Jadhav,0,2,0,0,28081,MS Dhoni,38,57,3,0,4,False,0,0,0,0,0,31,4,0,False,,False,False,3.78,0,184,0,3,0,1,1,0,116
run,6,India,2,Australia,2nd innings,1,"fullish outside off, nudged into the on side for a quick one","Stanlake to Jadhav, 1 run",0,533042,Billy Stanlake,0,35,0,5.5,27,774223,Jhye Richardson,1,42,1,7.0,16,290716,Kedar Jadhav,1,3,0,0,28081,MS Dhoni,38,57,3,0,5,False,0,0,0,0,0,31,4,0,False,,False,False,3.79,0,185,0,3,0,1,1,0,117
