PlayType_description,Batting_Team_id,Batting_Team_name,Bowling_Team_id,Bowling_Team_name,Innings,Total_Runs_on_delivery,Commentary,Commentary_short,Score,Bowler_id,Bowler_name,Bowler_maiden,Bowler_balls,Bowler_wickets,Bowler_over,Bowler_conceded,Other_Bowler_id,Other_Bowler_name,Other_Bowler_maidens,Other_Bowler_balls,Other_Bowler_wickets,Other_Bowler_overs,Other_Bowler_conceded,Batsman_id,Batsman_name,Batsman_runs,Batsman_balls_faced,Batsman_four,Batsman_sixes,Other_Batsman_id,Other_Batsman_name,Other_Batsman_runs,Other_Batsman_balls_faced,Other_Batsman_four,Other_Batsman_sixes,Over_ball,Over_complete,Over_maiden,Over_no_Ball,Over_wide,Over_byes,Over_leg_byes,Over_number,Over_runs,Over_wickets,Dismissal_is_true,Dismissal_type,Dismissal_fielder_iskeeper,Dismissal_text,Innings_run_rate,Innings_byes,Innings_balls,Innings_no_balls,Innings_wickets,Innings_leg_byes,Innings_session,Innings_day,Innings_wides,Innings_runs
run,6,India,4,West Indies,1st innings,1,"length ball on the leg stump and turning across, he stays back and tucks it square","Walsh to Jadhav, 1 run",230/5,443263,Hayden Walsh,0,27,0,4.3,27,230559,Kieron Pollard,0,24,1,4.0,28,290716,Kedar Jadhav,19,17,0,1,234675,Ravindra Jadeja,7,8,1,0,3,False,0,0,0,0,0,43,7,0,False,,False,False,5.41,0,255,0,5,0,1,1,0,230
run,6,India,4,West Indies,1st innings,2,"<b>hesitation in running leads to a wild throw and an extra run</b>. This was pushed to point from close to his body. Jadeja was sauntering down Jadhav responded late, having not realised a single was on. The fielder at point saw that, and threw it quickly but over the keeper","Walsh to Jadeja, 2 runs",232/5,443263,Hayden Walsh,0,28,0,4.4,29,230559,Kieron Pollard,0,24,1,4.0,28,234675,Ravindra Jadeja,9,9,1,0,290716,Kedar Jadhav,19,17,0,1,4,False,0,0,0,0,0,43,7,0,False,,False,False,5.43,0,256,0,5,0,1,1,0,232
run,6,India,4,West Indies,1st innings,1,"a touch short, pulled to midwicket","Walsh to Jadeja, 1 run",233/5,443263,Hayden Walsh,0,29,0,4.5,30,230559,Kieron Pollard,0,24,1,4.0,28,234675,Ravindra Jadeja,10,10,1,0,290716,Kedar Jadhav,19,17,0,1,5,False,0,0,0,0,0,43,7,0,False,,False,False,5.43,0,257,0,5,0,1,1,0,233
run,6,India,4,West Indies,1st innings,1,"short, well outside off, cuts to deep point","Walsh to Jadhav, 1 run",234/5,443263,Hayden Walsh,0,30,0,5.0,31,230559,Kieron Pollard,0,24,1,4.0,28,290716,Kedar Jadhav,20,18,0,1,234675,Ravindra Jadeja,10,10,1,0,6,True,0,0,0,0,0,43,7,0,False,,False,False,5.44,0,258,0,5,0,1,1,0,234
no run,6,India,4,West Indies,1st innings,0,"bit of swing into him, and he's late on that, trying to clip it square. Takes a leading edge that rolls along the ground towards cover","Joseph to Jadhav, no run",234/5,670031,Alzarri Joseph,1,43,2,7.1,25,443263,Hayden Walsh,0,30,0,5.0,31,290716,Kedar Jadhav,20,19,0,1,234675,Ravindra Jadeja,10,10,1,0,1,False,0,0,0,0,0,44,11,0,False,,False,False,5.42,0,259,0,5,0,1,1,0,234
run,6,India,4,West Indies,1st innings,1,"down the track and giving himself room, but he bowls it a bit shorter and follows the batsman, who can only hack it away towards midwicket","Joseph to Jadhav, 1 run",235/5,670031,Alzarri Joseph,1,44,2,7.2,26,443263,Hayden Walsh,0,30,0,5.0,31,290716,Kedar Jadhav,21,20,0,1,234675,Ravindra Jadeja,10,10,1,0,2,False,0,0,0,0,0,44,11,0,False,,False,False,5.42,0,260,0,5,0,1,1,0,235
run,6,India,4,West Indies,1st innings,1,"full on off, jabbed towards extra cover","Joseph to Jadeja, 1 run",236/5,670031,Alzarri Joseph,1,45,2,7.3,27,443263,Hayden Walsh,0,30,0,5.0,31,234675,Ravindra Jadeja,11,11,1,0,290716,Kedar Jadhav,21,20,0,1,3,False,0,0,0,0,0,44,11,0,False,,False,False,5.42,0,261,0,5,0,1,1,0,236
four,6,India,4,West Indies,1st innings,4,"smartly done. full toss on the pads, with Jadhav moving away to create room and the bowler following him. But he adjusts and sweeps it over short fine leg","Joseph to Jadhav, FOUR runs",240/5,670031,Alzarri Joseph,1,46,2,7.4,31,443263,Hayden Walsh,0,30,0,5.0,31,290716,Kedar Jadhav,25,21,1,1,234675,Ravindra Jadeja,11,11,1,0,4,False,0,0,0,0,0,44,11,0,False,,False,False,5.49,0,262,0,5,0,1,1,0,240
wide,6,India,4,West Indies,1st innings,1,way down legside and that'll have to be rebowled,"Joseph to Jadhav, 1 wide",241/5,670031,Alzarri Joseph,1,46,2,7.4,32,443263,Hayden Walsh,0,30,0,5.0,31,290716,Kedar Jadhav,25,21,1,1,234675,Ravindra Jadeja,11,11,1,0,5,False,0,0,1,0,0,44,11,0,False,,False,False,5.51,0,262,0,5,0,1,1,1,241
four,6,India,4,West Indies,1st innings,4,"<b>shot!</b>. Short and wide outside off, and he had no protection deep and square, so Jadhav cuts it over the in-field","Joseph to Jadhav, FOUR runs",245/5,670031,Alzarri Joseph,1,47,2,7.5,36,443263,Hayden Walsh,0,30,0,5.0,31,290716,Kedar Jadhav,29,22,2,1,234675,Ravindra Jadeja,11,11,1,0,6,False,0,0,0,0,0,44,11,0,False,,False,False,5.58,0,263,0,5,0,1,1,0,245
no run,6,India,4,West Indies,1st innings,0,"good length on the stumps, patted back down the pitch","Joseph to Jadhav, no run",245/5,670031,Alzarri Joseph,1,48,2,8.0,36,443263,Hayden Walsh,0,30,0,5.0,31,290716,Kedar Jadhav,29,23,2,1,234675,Ravindra Jadeja,11,11,1,0,7,True,0,0,0,0,0,44,11,0,False,,False,False,5.56,0,264,0,5,0,1,1,0,245
run,6,India,4,West Indies,1st innings,1,"back of a length, tucking him up, punched to cover","Cottrell to Jadeja, 1 run",246/5,495551,Sheldon Cottrell,3,43,2,7.1,27,670031,Alzarri Joseph,1,48,2,8.0,36,234675,Ravindra Jadeja,12,12,1,0,290716,Kedar Jadhav,29,23,2,1,1,False,0,0,0,0,0,45,5,0,False,,False,False,5.56,0,265,0,5,0,1,1,0,246
run,6,India,4,West Indies,1st innings,1,"fuller on off, flicked to midwicket","Cottrell to Jadhav, 1 run",247/5,495551,Sheldon Cottrell,3,44,2,7.2,28,670031,Alzarri Joseph,1,48,2,8.0,36,290716,Kedar Jadhav,30,24,2,1,234675,Ravindra Jadeja,12,12,1,0,2,False,0,0,0,0,0,45,5,0,False,,False,False,5.57,0,266,0,5,0,1,1,0,247
no run,6,India,4,West Indies,1st innings,0,"length ball, nipping back in, misses the flick and the ball rolls off pad","Cottrell to Jadeja, no run",247/5,495551,Sheldon Cottrell,3,45,2,7.3,28,670031,Alzarri Joseph,1,48,2,8.0,36,234675,Ravindra Jadeja,12,13,1,0,290716,Kedar Jadhav,30,24,2,1,3,False,0,0,0,0,0,45,5,0,False,,False,False,5.55,0,267,0,5,0,1,1,0,247
leg bye,6,India,4,West Indies,1st innings,1,"was giving himself room but the bowler followed, spearing it in full and Jadeja misses connecting again. hits the pad and goes towards cover","Cottrell to Jadeja, 1 leg bye",248/5,495551,Sheldon Cottrell,3,46,2,7.4,28,670031,Alzarri Joseph,1,48,2,8.0,36,234675,Ravindra Jadeja,12,14,1,0,290716,Kedar Jadhav,30,24,2,1,4,False,0,0,0,0,1,45,5,0,False,,False,False,5.55,0,268,0,5,1,1,1,0,248
leg bye,6,India,4,West Indies,1st innings,1,"moving across to try and ramp it, but doesn't get it in the right slot and can only paddle it to short fine leg","Cottrell to Jadhav, 1 leg bye",249/5,495551,Sheldon Cottrell,3,47,2,7.5,28,670031,Alzarri Joseph,1,48,2,8.0,36,290716,Kedar Jadhav,30,25,2,1,234675,Ravindra Jadeja,12,14,1,0,5,False,0,0,0,0,1,45,5,0,False,,False,False,5.55,0,269,0,5,1,1,1,0,249
run,6,India,4,West Indies,1st innings,1,"was giving himself room again, backed away a long way but the bowler followed, not letting him free his arms. Punches to long-on from the inside half of his bat","Cottrell to Jadeja, 1 run",250/5,495551,Sheldon Cottrell,3,48,2,8.0,29,670031,Alzarri Joseph,1,48,2,8.0,36,234675,Ravindra Jadeja,13,15,1,0,290716,Kedar Jadhav,30,25,2,1,6,True,0,0,0,0,0,45,5,0,False,,False,False,5.55,0,270,0,5,0,1,1,0,250
run,6,India,4,West Indies,1st innings,1,"full on the stumps, slogs across the line but doesn't get hold of it and it rolls to deep midwicket","Joseph to Jadeja, 1 run",251/5,670031,Alzarri Joseph,1,49,2,8.1,37,495551,Sheldon Cottrell,3,48,2,8.0,29,234675,Ravindra Jadeja,14,16,1,0,290716,Kedar Jadhav,30,25,2,1,1,False,0,0,0,0,0,46,10,0,False,,False,False,5.55,0,271,0,5,0,1,1,0,251
run,6,India,4,West Indies,1st innings,2,"full on the pads, whips it with his wrists between long-on and deep midwicket","Joseph to Jadhav, 2 runs",253/5,670031,Alzarri Joseph,1,50,2,8.2,39,495551,Sheldon Cottrell,3,48,2,8.0,29,290716,Kedar Jadhav,32,26,2,1,234675,Ravindra Jadeja,14,16,1,0,2,False,0,0,0,0,0,46,10,0,False,,False,False,5.58,0,272,0,5,0,1,1,0,253
leg bye,6,India,4,West Indies,1st innings,1,"late swing into the batsman, who is trying to almost helicopter it away, but misses. Thuds into pad and Joseph's appealing - bad idea because it was easily going down leg and it also gives the batsman the space to steal a leg-bye","Joseph to Jadhav, 1 leg bye",254/5,670031,Alzarri Joseph,1,51,2,8.3,39,495551,Sheldon Cottrell,3,48,2,8.0,29,290716,Kedar Jadhav,32,27,2,1,234675,Ravindra Jadeja,14,16,1,0,3,False,0,0,0,0,1,46,10,0,False,,False,False,5.58,0,273,0,5,1,1,1,0,254
run,6,India,4,West Indies,1st innings,1,"yorker on leg stump, he gives himself room but it's too close to his body to do anything much and he can only hoick it to long-on","Joseph to Jadeja, 1 run",255/5,670031,Alzarri Joseph,1,52,2,8.4,40,495551,Sheldon Cottrell,3,48,2,8.0,29,234675,Ravindra Jadeja,15,17,1,0,290716,Kedar Jadhav,32,27,2,1,4,False,0,0,0,0,0,46,10,0,False,,False,False,5.58,0,274,0,5,0,1,1,0,255
run,6,India,4,West Indies,1st innings,1,"giving himself room again, Joseph keeps it full and straight on the stumps, and the batsman slaps it down to long-off","Joseph to Jadhav, 1 run",256/5,670031,Alzarri Joseph,1,53,2,8.5,41,495551,Sheldon Cottrell,3,48,2,8.0,29,290716,Kedar Jadhav,33,28,2,1,234675,Ravindra Jadeja,15,17,1,0,5,False,0,0,0,0,0,46,10,0,False,,False,False,5.58,0,275,0,5,0,1,1,0,256
four,6,India,4,West Indies,1st innings,4,"this time he didn't give himself room, though made as if he would. Joseph bowled it full and just outside leg, but with Jadeja staying put, he was in ideal positoin to flick it past short fine leg","Joseph to Jadeja, FOUR runs",260/5,670031,Alzarri Joseph,1,54,2,9.0,45,495551,Sheldon Cottrell,3,48,2,8.0,29,234675,Ravindra Jadeja,19,18,2,0,290716,Kedar Jadhav,33,28,2,1,6,True,0,0,0,0,0,46,10,0,False,,False,False,5.65,0,276,0,5,0,1,1,0,260
four,6,India,4,West Indies,1st innings,4,"backs away and slashes it through the vacant slip area. No fielder that fine on the boundary also, so he'll get four","Cottrell to Jadhav, FOUR runs",264/5,495551,Sheldon Cottrell,3,49,2,8.1,33,670031,Alzarri Joseph,1,54,2,9.0,45,290716,Kedar Jadhav,37,29,3,1,234675,Ravindra Jadeja,19,18,2,0,1,False,0,0,0,0,0,47,8,0,False,,False,False,5.71,0,277,0,5,0,1,1,0,264
no run,6,India,4,West Indies,1st innings,0,"fuller and quicker, on the fifth stump. He tried to whip a drive in front of square but misses it","Cottrell to Jadhav, no run",264/5,495551,Sheldon Cottrell,3,50,2,8.2,33,670031,Alzarri Joseph,1,54,2,9.0,45,290716,Kedar Jadhav,37,30,3,1,234675,Ravindra Jadeja,19,18,2,0,2,False,0,0,0,0,0,47,8,0,False,,False,False,5.69,0,278,0,5,0,1,1,0,264
run,6,India,4,West Indies,1st innings,2,"pace off again, leg-cutter coming into him, he waits for it and flicks it with soft hands through midwicket. Jadeja pushes hard for the second and they get it","Cottrell to Jadhav, 2 runs",266/5,495551,Sheldon Cottrell,3,51,2,8.3,35,670031,Alzarri Joseph,1,54,2,9.0,45,290716,Kedar Jadhav,39,31,3,1,234675,Ravindra Jadeja,19,18,2,0,3,False,0,0,0,0,0,47,8,0,False,,False,False,5.72,0,279,0,5,0,1,1,0,266
run,6,India,4,West Indies,1st innings,1,"fuller, speared into him, defended to cover for a single","Cottrell to Jadhav, 1 run",267/5,495551,Sheldon Cottrell,3,52,2,8.4,36,670031,Alzarri Joseph,1,54,2,9.0,45,290716,Kedar Jadhav,40,32,3,1,234675,Ravindra Jadeja,19,18,2,0,4,False,0,0,0,0,0,47,8,0,False,,False,False,5.72,0,280,0,5,0,1,1,0,267
run,6,India,4,West Indies,1st innings,1,"pace off, length ball outside off, Jadeja flicks to midwicket. He wants two again, but Jadhav says no early. Might have been two if he had pushed hard. He meaning Jadhav.","Cottrell to Jadeja, 1 run",268/5,495551,Sheldon Cottrell,3,53,2,8.5,37,670031,Alzarri Joseph,1,54,2,9.0,45,234675,Ravindra Jadeja,20,19,2,0,290716,Kedar Jadhav,40,32,3,1,5,False,0,0,0,0,0,47,8,0,False,,False,False,5.72,0,281,0,5,0,1,1,0,268
no run,6,India,4,West Indies,1st innings,0,"yorker length tailing into him, inside edges onto pad","Cottrell to Jadhav, no run",268/5,495551,Sheldon Cottrell,3,54,2,9.0,37,670031,Alzarri Joseph,1,54,2,9.0,45,290716,Kedar Jadhav,40,33,3,1,234675,Ravindra Jadeja,20,19,2,0,6,True,0,0,0,0,0,47,8,0,False,,False,False,5.7,0,282,0,5,0,1,1,0,268
run,6,India,4,West Indies,1st innings,1,"digs it in short, outside off, Jadeja pulls it through midwicket","Paul to Jadeja, 1 run",269/5,677081,Keemo Paul,0,31,0,5.1,32,495551,Sheldon Cottrell,3,54,2,9.0,37,234675,Ravindra Jadeja,21,20,2,0,290716,Kedar Jadhav,40,33,3,1,1,False,0,0,0,0,0,48,2,2,False,,False,False,5.7,0,283,0,5,0,1,1,0,269
no run,6,India,4,West Indies,1st innings,0,"superb slower bouncer, made Jadhav wait for it for an eternity. He was finally not able to connect trying to slash it away outside off","Paul to Jadhav, no run",269/5,677081,Keemo Paul,0,32,0,5.2,32,495551,Sheldon Cottrell,3,54,2,9.0,37,290716,Kedar Jadhav,40,34,3,1,234675,Ravindra Jadeja,21,20,2,0,2,False,0,0,0,0,0,48,2,2,False,,False,False,5.68,0,284,0,5,0,1,1,0,269
out,6,India,4,West Indies,1st innings,0,"length ball angled across him, he horribly mis-times his swipe, and it lobs up to Pollard at long-on, who holds on easily","Paul to Jadhav, OUT",269/6,677081,Keemo Paul,0,33,1,5.3,32,495551,Sheldon Cottrell,3,54,2,9.0,37,290716,Kedar Jadhav,40,35,3,1,234675,Ravindra Jadeja,21,20,2,0,3,False,0,0,0,0,0,48,2,2,True,caught,False,KM Jadhav c Pollard b Paul 40 (35b 3x4 1x6) SR: 114.28,5.66,0,285,0,6,0,1,1,0,269
out,6,India,4,West Indies,1st innings,0,"fuller on the stumps, jams his bat down in time to send it to midwicket. Quick single taken, safe despite the fielder running in and effecting a direct hit at the striker's end. <b>wait a minute, replays show Jadeja was out of the crease!</b> The umpire didn't go upstairs though. And now they're going up to the third umpire. Which means Jadeja will be ruled out. Bit bizarre sequence of events. Wrong process, but right decision? If a West Indies fielder appealed when the direct hit was effected, there is still a justification for going up to the third umpire, even if late in the proceedings. But is it okay to go up <i>after</i> having seen the replay? That's one for the law mandarins to figure out.","Paul to Jadeja, OUT",269/7,677081,Keemo Paul,0,34,1,5.4,32,495551,Sheldon Cottrell,3,54,2,9.0,37,234675,Ravindra Jadeja,21,21,2,0,714451,Shivam Dube,0,0,0,0,4,False,0,0,0,0,0,48,2,2,True,run out,False,RA Jadeja run out (Chase) 21 (21b 2x4 0x6) SR: 100.00,5.64,0,286,0,7,0,1,1,0,269
run,6,India,4,West Indies,1st innings,1,"nicely struck, too short, outside off, punched through cover","Paul to Dube, 1 run",270/7,677081,Keemo Paul,0,35,1,5.5,33,495551,Sheldon Cottrell,3,54,2,9.0,37,714451,Shivam Dube,1,1,0,0,447261,Deepak Chahar,0,0,0,0,5,False,0,0,0,0,0,48,2,2,False,,False,False,5.64,0,287,0,7,0,1,1,0,270
no run,6,India,4,West Indies,1st innings,0,"well disguised slower bouncer that fools the batsman, who is way too early into the pull shot","Paul to Chahar, no run",270/7,677081,Keemo Paul,0,36,1,6.0,33,495551,Sheldon Cottrell,3,54,2,9.0,37,447261,Deepak Chahar,0,1,0,0,714451,Shivam Dube,1,1,0,0,6,True,0,0,0,0,0,48,2,2,False,,False,False,5.62,0,288,0,7,0,1,1,0,270
run,6,India,4,West Indies,1st innings,1,"length ball outside off, chopped to short third man","Cottrell to Dube, 1 run",271/7,495551,Sheldon Cottrell,3,55,2,9.1,38,677081,Keemo Paul,0,36,1,6.0,33,714451,Shivam Dube,2,2,0,0,447261,Deepak Chahar,0,1,0,0,1,False,0,0,0,0,0,49,9,0,False,,False,False,5.62,0,289,0,7,0,1,1,0,271
run,6,India,4,West Indies,1st innings,1,"yorker length outside off, swipes at it, wanted to go in the direction of cover but takes a thickish edge to short third man","Cottrell to Chahar, 1 run",272/7,495551,Sheldon Cottrell,3,56,2,9.2,39,677081,Keemo Paul,0,36,1,6.0,33,447261,Deepak Chahar,1,2,0,0,714451,Shivam Dube,2,2,0,0,2,False,0,0,0,0,0,49,9,0,False,,False,False,5.62,0,290,0,7,0,1,1,0,272
wide,6,India,4,West Indies,1st innings,1,"slower ball on a length, too far down leg. Wide","Cottrell to Dube, 1 wide",273/7,495551,Sheldon Cottrell,3,56,2,9.2,40,677081,Keemo Paul,0,36,1,6.0,33,714451,Shivam Dube,2,2,0,0,447261,Deepak Chahar,1,2,0,0,3,False,0,0,1,0,0,49,9,0,False,,False,False,5.64,0,290,0,7,0,1,1,1,273
four,6,India,4,West Indies,1st innings,4,"<b>shot!</b>. Full ball tailing into him, doesn't have too much room, but the power he generates is enormous, and he punch-drives tthis through midwicket","Cottrell to Dube, FOUR runs",277/7,495551,Sheldon Cottrell,3,57,2,9.3,44,677081,Keemo Paul,0,36,1,6.0,33,714451,Shivam Dube,6,3,1,0,447261,Deepak Chahar,1,2,0,0,4,False,0,0,0,0,0,49,9,0,False,,False,False,5.71,0,291,0,7,0,1,1,0,277
run,6,India,4,West Indies,1st innings,1,"length ball, swipes across the line to deep midwicket","Cottrell to Dube, 1 run",278/7,495551,Sheldon Cottrell,3,58,2,9.4,45,677081,Keemo Paul,0,36,1,6.0,33,714451,Shivam Dube,7,4,1,0,447261,Deepak Chahar,1,2,0,0,5,False,0,0,0,0,0,49,9,0,False,,False,False,5.71,0,292,0,7,0,1,1,0,278
no run,6,India,4,West Indies,1st innings,0,"normal pace bouncer that flies through, past his attempted wild slog","Cottrell to Chahar, no run",278/7,495551,Sheldon Cottrell,3,59,2,9.5,45,677081,Keemo Paul,0,36,1,6.0,33,447261,Deepak Chahar,1,3,0,0,714451,Shivam Dube,7,4,1,0,6,False,0,0,0,0,0,49,9,0,False,,False,False,5.69,0,293,0,7,0,1,1,0,278
run,6,India,4,West Indies,1st innings,1,"back of a length on middle and leg, pulled to midwicket","Cottrell to Chahar, 1 run",279/7,495551,Sheldon Cottrell,3,60,2,10.0,46,677081,Keemo Paul,0,36,1,6.0,33,447261,Deepak Chahar,2,4,0,0,714451,Shivam Dube,7,4,1,0,7,True,0,0,0,0,0,49,9,0,False,,False,False,5.69,0,294,0,7,0,1,1,0,279
run,6,India,4,West Indies,1st innings,1,"length ball on the stumps, he's moving across and bunts it square to give the strike to Dube","Paul to Chahar, 1 run",280/7,677081,Keemo Paul,0,37,1,6.1,34,495551,Sheldon Cottrell,3,60,2,10.0,46,447261,Deepak Chahar,3,5,0,0,714451,Shivam Dube,7,4,1,0,1,False,0,0,0,0,0,50,8,1,False,,False,False,5.69,0,295,0,7,0,1,1,0,280
run,6,India,4,West Indies,1st innings,2,"full outside off, Dube uses his power to drive this over extra cover. But Pollard's at wide long-off and runs across to tumble and save the ball","Paul to Dube, 2 runs",282/7,677081,Keemo Paul,0,38,1,6.2,36,495551,Sheldon Cottrell,3,60,2,10.0,46,714451,Shivam Dube,9,5,1,0,447261,Deepak Chahar,3,5,0,0,2,False,0,0,0,0,0,50,8,1,False,,False,False,5.71,0,296,0,7,0,1,1,0,282
out,6,India,4,West Indies,1st innings,0,"length ball on the stumps, Dube clears his front leg and swipes across the line. Doesn't get hold of it. Slower ball that stuck in the pitch and he gets more height than distance, holes out to long-off","Paul to Dube, OUT",282/8,677081,Keemo Paul,0,39,2,6.3,36,495551,Sheldon Cottrell,3,60,2,10.0,46,714451,Shivam Dube,9,6,1,0,447261,Deepak Chahar,3,5,0,0,3,False,0,0,0,0,0,50,8,1,True,caught,False,S Dube c Holder b Paul 9 (6b 1x4 0x6) SR: 150.00,5.69,0,297,0,8,0,1,1,0,282
no ball,6,India,4,West Indies,1st innings,1,"full toss on off, smears it from deep within his crease but straight to Cottrell at deep square leg. Chahar thinks that was above waist height and is looking displeased it wasn't called. they belatedly go up to the third umpire who confirms, it was above the waist. Chahar survives.","Paul to Chahar, 1 no ball",283/8,677081,Keemo Paul,0,39,2,6.3,37,495551,Sheldon Cottrell,3,60,2,10.0,46,447261,Deepak Chahar,3,6,0,0,481896,Mohammed Shami,0,0,0,0,4,False,0,1,0,0,0,50,8,1,False,,False,False,5.71,0,297,1,8,0,1,1,0,283
bye,6,India,4,West Indies,1st innings,1,"well bowled, going across him and on a yorker length and he misses it. But they take the bye, even though it's gone to the keeper","Paul to Mohammed Shami, 1 bye",284/8,677081,Keemo Paul,0,40,2,6.4,37,495551,Sheldon Cottrell,3,60,2,10.0,46,481896,Mohammed Shami,0,1,0,0,447261,Deepak Chahar,3,6,0,0,5,False,0,0,0,1,0,50,8,1,False,,False,False,5.71,1,298,0,8,0,1,1,0,284
run,6,India,4,West Indies,1st innings,2,"leg cutter on leg stump, mistimes his pull to deep midwicket but gets enough on it to get a couple","Paul to Chahar, 2 runs",286/8,677081,Keemo Paul,0,41,2,6.5,39,495551,Sheldon Cottrell,3,60,2,10.0,46,447261,Deepak Chahar,5,7,0,0,481896,Mohammed Shami,0,1,0,0,6,False,0,0,0,0,0,50,8,1,False,,False,False,5.73,0,299,0,8,0,1,1,0,286
run,6,India,4,West Indies,1st innings,1,"yorker outside off, he was moving across, drives it to extra cover and they'll end only with a single","Paul to Chahar, 1 run",287/8,677081,Keemo Paul,0,42,2,7.0,40,495551,Sheldon Cottrell,3,60,2,10.0,46,447261,Deepak Chahar,6,8,0,0,481896,Mohammed Shami,0,1,0,0,7,True,0,0,0,0,0,50,8,1,False,,False,False,5.74,0,300,0,8,0,1,1,0,287
no run,4,West Indies,6,India,2nd innings,0,"full, swings in towards off stump, driven to mid-off","Chahar to Hope, no run",0,447261,Deepak Chahar,0,1,0,0.1,0,False,False,0,0,0,False,0,581379,Shai Hope,0,1,0,0,348054,Sunil Ambris,0,0,0,0,1,False,1,0,0,0,0,1,0,0,False,,False,False,0.0,0,1,0,0,0,1,1,0,0
no run,4,West Indies,6,India,2nd innings,0,"back of a length, close to off stump, swings away late and Hope ends up getting beaten on the <i>inside edge</i> while trying to defend. Was he playing for more swing than there was? Huge gap between bat and body","Chahar to Hope, no run",0,447261,Deepak Chahar,0,2,0,0.2,0,False,False,0,0,0,False,0,581379,Shai Hope,0,2,0,0,348054,Sunil Ambris,0,0,0,0,2,False,1,0,0,0,0,1,0,0,False,,False,False,0.0,0,2,0,0,0,1,1,0,0
no run,4,West Indies,6,India,2nd innings,0,"another outswinger outside off, a little fuller, left alone","Chahar to Hope, no run",0,447261,Deepak Chahar,0,3,0,0.3,0,False,False,0,0,0,False,0,581379,Shai Hope,0,3,0,0,348054,Sunil Ambris,0,0,0,0,3,False,1,0,0,0,0,1,0,0,False,,False,False,0.0,0,3,0,0,0,1,1,0,0
no run,4,West Indies,6,India,2nd innings,0,"back of a length, a bit of shape away from the right-hander, punched into the point region","Chahar to Hope, no run",0,447261,Deepak Chahar,0,4,0,0.4,0,False,False,0,0,0,False,0,581379,Shai Hope,0,4,0,0,348054,Sunil Ambris,0,0,0,0,4,False,1,0,0,0,0,1,0,0,False,,False,False,0.0,0,4,0,0,0,1,1,0,0
no run,4,West Indies,6,India,2nd innings,0,"length ball close to off stump, gets forward and defends towards backward point","Chahar to Hope, no run",0,447261,Deepak Chahar,0,5,0,0.5,0,False,False,0,0,0,False,0,581379,Shai Hope,0,5,0,0,348054,Sunil Ambris,0,0,0,0,5,False,1,0,0,0,0,1,0,0,False,,False,False,0.0,0,5,0,0,0,1,1,0,0
no run,4,West Indies,6,India,2nd innings,0,"length ball outside off, a bit of outswing again, left alone","Chahar to Hope, no run",0,447261,Deepak Chahar,1,6,0,1.0,0,False,False,0,0,0,False,0,581379,Shai Hope,0,6,0,0,348054,Sunil Ambris,0,0,0,0,6,True,1,0,0,0,0,1,0,0,False,,False,False,0.0,0,6,0,0,0,1,1,0,0
no run,4,West Indies,6,India,2nd innings,0,"beauty. Late outswing in the channel outside off, from a good length. No footwork from Ambris, just defends from the crease and gets beaten by a long way","Mohammed Shami to Ambris, no run",0,481896,Mohammed Shami,0,1,0,0.1,0,447261,Deepak Chahar,1,6,0,1.0,0,348054,Sunil Ambris,0,1,0,0,581379,Shai Hope,0,6,0,0,1,False,0,0,0,0,0,2,8,0,False,,False,False,0.0,0,7,0,0,0,1,1,0,0
no run,4,West Indies,6,India,2nd innings,0,"another outswinger on a good length close to off stump, this time Ambris gets a bit of a stride towards the ball and defends to cover point","Mohammed Shami to Ambris, no run",0,481896,Mohammed Shami,0,2,0,0.2,0,447261,Deepak Chahar,1,6,0,1.0,0,348054,Sunil Ambris,0,2,0,0,581379,Shai Hope,0,6,0,0,2,False,0,0,0,0,0,2,8,0,False,,False,False,0.0,0,8,0,0,0,1,1,0,0
four,4,West Indies,6,India,2nd innings,4,"length ball on middle stump, and that's superb timing, clipped away through the vacant square leg region, leaving fine leg far too much work to do","Mohammed Shami to Ambris, FOUR runs",0,481896,Mohammed Shami,0,3,0,0.3,4,447261,Deepak Chahar,1,6,0,1.0,0,348054,Sunil Ambris,4,3,1,0,581379,Shai Hope,0,6,0,0,3,False,0,0,0,0,0,2,8,0,False,,False,False,2.66,0,9,0,0,0,1,1,0,4
no run,4,West Indies,6,India,2nd innings,0,"shifts back to the outside-off line, a little wider than the first few balls. Quite full, left alone","Mohammed Shami to Ambris, no run",0,481896,Mohammed Shami,0,4,0,0.4,4,447261,Deepak Chahar,1,6,0,1.0,0,348054,Sunil Ambris,4,4,1,0,581379,Shai Hope,0,6,0,0,4,False,0,0,0,0,0,2,8,0,False,,False,False,2.4,0,10,0,0,0,1,1,0,4
four,4,West Indies,6,India,2nd innings,4,"lovely shot again. This wasn't too straight - it was a length ball on off stump, but Shami doesn't get as much outswing on this occasion, and Ambris times his flick beautifully to beat midwicket diving to his right","Mohammed Shami to Ambris, FOUR runs",0,481896,Mohammed Shami,0,5,0,0.5,8,447261,Deepak Chahar,1,6,0,1.0,0,348054,Sunil Ambris,8,5,2,0,581379,Shai Hope,0,6,0,0,5,False,0,0,0,0,0,2,8,0,False,,False,False,4.36,0,11,0,0,0,1,1,0,8
no run,4,West Indies,6,India,2nd innings,0,"length ball outside off, a bit of late away movement, left alone","Mohammed Shami to Ambris, no run",0,481896,Mohammed Shami,0,6,0,1.0,8,447261,Deepak Chahar,1,6,0,1.0,0,348054,Sunil Ambris,8,6,2,0,581379,Shai Hope,0,6,0,0,6,True,0,0,0,0,0,2,8,0,False,,False,False,4.0,0,12,0,0,0,1,1,0,8
no run,4,West Indies,6,India,2nd innings,0,"back of a length outside off. Decent amount of width for the back-foot punch that Hope is attempting, but the ball stops on the pitch, and he ends up playing too early and hitting it back to the bowler rather than through the covers","Chahar to Hope, no run",0,447261,Deepak Chahar,1,7,0,1.1,0,481896,Mohammed Shami,0,6,0,1.0,8,581379,Shai Hope,0,7,0,0,348054,Sunil Ambris,8,6,2,0,1,False,0,0,0,0,0,3,2,0,False,,False,False,3.69,0,13,0,0,0,1,1,0,8
