PlayType_description,Batting_Team_id,Batting_Team_name,Bowling_Team_id,Bowling_Team_name,Innings,Total_Runs_on_delivery,Commentary,Commentary_short,Score,Bowler_id,Bowler_name,Bowler_maiden,Bowler_balls,Bowler_wickets,Bowler_over,Bowler_conceded,Other_Bowler_id,Other_Bowler_name,Other_Bowler_maidens,Other_Bowler_balls,Other_Bowler_wickets,Other_Bowler_overs,Other_Bowler_conceded,Batsman_id,Batsman_name,Batsman_runs,Batsman_balls_faced,Batsman_four,Batsman_sixes,Other_Batsman_id,Other_Batsman_name,Other_Batsman_runs,Other_Batsman_balls_faced,Other_Batsman_four,Other_Batsman_sixes,Over_ball,Over_complete,Over_maiden,Over_no_Ball,Over_wide,Over_byes,Over_leg_byes,Over_number,Over_runs,Over_wickets,Dismissal_is_true,Dismissal_type,Dismissal_fielder_iskeeper,Dismissal_text,Innings_run_rate,Innings_byes,Innings_balls,Innings_no_balls,Innings_wickets,Innings_leg_byes,Innings_session,Innings_day,Innings_wides,Innings_runs
four,4,West Indies,6,India,2nd innings,4,length ball outside off and Hetmyer is just so beautifully balanced as he cuts this through point. It didn't look like he had the room to really free his arms but powerful forearms and great timing mean it just races to the boundary,"Dube to Hetmyer, FOUR runs",0,714451,Shivam Dube,0,19,0,3.1,26,234675,Ravindra Jadeja,0,30,0,5.0,34,670025,Shimron Hetmyer,80,63,8,3,581379,Shai Hope,38,74,2,0,1,False,0,0,0,0,0,25,8,0,False,,False,False,5.46,0,145,0,1,0,1,1,0,132
no run,4,West Indies,6,India,2nd innings,0,"length outside off, punched to mid-off","Dube to Hetmyer, no run",0,714451,Shivam Dube,0,20,0,3.2,26,234675,Ravindra Jadeja,0,30,0,5.0,34,670025,Shimron Hetmyer,80,64,8,3,581379,Shai Hope,38,74,2,0,2,False,0,0,0,0,0,25,8,0,False,,False,False,5.42,0,146,0,1,0,1,1,0,132
run,4,West Indies,6,India,2nd innings,1,"length outside off, pushed through extra cover","Dube to Hetmyer, 1 run",0,714451,Shivam Dube,0,21,0,3.3,27,234675,Ravindra Jadeja,0,30,0,5.0,34,670025,Shimron Hetmyer,81,65,8,3,581379,Shai Hope,38,74,2,0,3,False,0,0,0,0,0,25,8,0,False,,False,False,5.42,0,147,0,1,0,1,1,0,133
leg bye,4,West Indies,6,India,2nd innings,1,"length ball, jags back into him, hits him high on the thigh pad. He misses the flick, but they get a leg-bye with the ball rolling through backward square leg","Dube to Hope, 1 leg bye",0,714451,Shivam Dube,0,22,0,3.4,27,234675,Ravindra Jadeja,0,30,0,5.0,34,581379,Shai Hope,38,75,2,0,670025,Shimron Hetmyer,81,65,8,3,4,False,0,0,0,0,1,25,8,0,False,,False,False,5.43,0,148,0,1,1,1,1,0,134
run,4,West Indies,6,India,2nd innings,1,clips a fuller ball to wide long-on,"Dube to Hetmyer, 1 run",0,714451,Shivam Dube,0,23,0,3.5,28,234675,Ravindra Jadeja,0,30,0,5.0,34,670025,Shimron Hetmyer,82,66,8,3,581379,Shai Hope,38,75,2,0,5,False,0,0,0,0,0,25,8,0,False,,False,False,5.43,0,149,0,1,0,1,1,0,135
run,4,West Indies,6,India,2nd innings,1,goes back and flicks it off his pads to deep square leg,"Dube to Hope, 1 run",0,714451,Shivam Dube,0,24,0,4.0,29,234675,Ravindra Jadeja,0,30,0,5.0,34,581379,Shai Hope,39,76,2,0,670025,Shimron Hetmyer,82,66,8,3,6,True,0,0,0,0,0,25,8,0,False,,False,False,5.44,0,150,0,1,0,1,1,0,136
four,4,West Indies,6,India,2nd innings,4,"<b>inside edge goes for a boundary</b>. Came off the glove in fact. Good ball on a length and jagging back in, the bounce caught him by surprise as he was coming forward. Clips his glove and goes to fine leg","Mohammed Shami to Hope, FOUR runs",0,481896,Mohammed Shami,1,25,0,4.1,22,714451,Shivam Dube,0,24,0,4.0,29,581379,Shai Hope,43,77,3,0,670025,Shimron Hetmyer,82,66,8,3,1,False,0,0,0,0,0,26,13,0,False,,False,False,5.56,0,151,0,1,0,1,1,0,140
run,4,West Indies,6,India,2nd innings,1,"fuller outside off, driven to the man on the cover boundary","Mohammed Shami to Hope, 1 run",0,481896,Mohammed Shami,1,26,0,4.2,23,714451,Shivam Dube,0,24,0,4.0,29,581379,Shai Hope,44,78,3,0,670025,Shimron Hetmyer,82,66,8,3,2,False,0,0,0,0,0,26,13,0,False,,False,False,5.56,0,152,0,1,0,1,1,0,141
no run,4,West Indies,6,India,2nd innings,0,"back of a length on leg, hint of movement away, steered to point","Mohammed Shami to Hetmyer, no run",0,481896,Mohammed Shami,1,27,0,4.3,23,714451,Shivam Dube,0,24,0,4.0,29,670025,Shimron Hetmyer,82,67,8,3,581379,Shai Hope,44,78,3,0,3,False,0,0,0,0,0,26,13,0,False,,False,False,5.52,0,153,0,1,0,1,1,0,141
run,4,West Indies,6,India,2nd innings,2,"yorker on off, and he jams his bat down in time to push it to mid-off. <b>Overthrows</b> and they get an extra run. The fielder, let loose a throw that nobody could collect at the bowler's end. Pant had to dive to his right to stop the ball but couldn't gather cleanly","Mohammed Shami to Hetmyer, 2 runs",0,481896,Mohammed Shami,1,28,0,4.4,25,714451,Shivam Dube,0,24,0,4.0,29,670025,Shimron Hetmyer,84,68,8,3,581379,Shai Hope,44,78,3,0,4,False,0,0,0,0,0,26,13,0,False,,False,False,5.57,0,154,0,1,0,1,1,0,143
six,4,West Indies,6,India,2nd innings,6,"<b>whoa, what a hit!</b>. Too short and he rocks back to absolutely smoke it over deep midwicket","Mohammed Shami to Hetmyer, SIX runs",0,481896,Mohammed Shami,1,29,0,4.5,31,714451,Shivam Dube,0,24,0,4.0,29,670025,Shimron Hetmyer,90,69,8,4,581379,Shai Hope,44,78,3,0,5,False,0,0,0,0,0,26,13,0,False,,False,False,5.76,0,155,0,1,0,1,1,0,149
no run,4,West Indies,6,India,2nd innings,0,"length ball on the stumps, guides it to point","Mohammed Shami to Hetmyer, no run",0,481896,Mohammed Shami,1,30,0,5.0,31,714451,Shivam Dube,0,24,0,4.0,29,670025,Shimron Hetmyer,90,70,8,4,581379,Shai Hope,44,78,3,0,6,True,0,0,0,0,0,26,13,0,False,,False,False,5.73,0,156,0,1,0,1,1,0,149
no run,4,West Indies,6,India,2nd innings,0,"<b>appeal for a stumping</b>. Beautifully bowled by Jadeja, drawing him forward and spinning it past, but Hope kept his foot grounded behind the crease, so he's safe.","Jadeja to Hope, no run",0,234675,Ravindra Jadeja,0,31,0,5.1,34,481896,Mohammed Shami,1,30,0,5.0,31,581379,Shai Hope,44,79,3,0,670025,Shimron Hetmyer,90,70,8,4,1,False,0,0,0,0,0,27,1,0,False,,False,False,5.69,0,157,0,1,0,1,1,0,149
run,4,West Indies,6,India,2nd innings,1,"length outside off, stays back and drives through cover","Jadeja to Hope, 1 run",0,234675,Ravindra Jadeja,0,32,0,5.2,35,481896,Mohammed Shami,1,30,0,5.0,31,581379,Shai Hope,45,80,3,0,670025,Shimron Hetmyer,90,70,8,4,2,False,0,0,0,0,0,27,1,0,False,,False,False,5.69,0,158,0,1,0,1,1,0,150
no run,4,West Indies,6,India,2nd innings,0,"quicker one, hurried onto him. He was going deep in his crease, ends up mistiming the pull to mid-on","Jadeja to Hetmyer, no run",0,234675,Ravindra Jadeja,0,33,0,5.3,35,481896,Mohammed Shami,1,30,0,5.0,31,670025,Shimron Hetmyer,90,71,8,4,581379,Shai Hope,45,80,3,0,3,False,0,0,0,0,0,27,1,0,False,,False,False,5.66,0,159,0,1,0,1,1,0,150
no run,4,West Indies,6,India,2nd innings,0,"length outside off, punched to mid-on","Jadeja to Hetmyer, no run",0,234675,Ravindra Jadeja,0,34,0,5.4,35,481896,Mohammed Shami,1,30,0,5.0,31,670025,Shimron Hetmyer,90,72,8,4,581379,Shai Hope,45,80,3,0,4,False,0,0,0,0,0,27,1,0,False,,False,False,5.62,0,160,0,1,0,1,1,0,150
no run,4,West Indies,6,India,2nd innings,0,"quicker one on a length outside off, spinning into him, pushed back to the bowler","Jadeja to Hetmyer, no run",0,234675,Ravindra Jadeja,0,35,0,5.5,35,481896,Mohammed Shami,1,30,0,5.0,31,670025,Shimron Hetmyer,90,73,8,4,581379,Shai Hope,45,80,3,0,5,False,0,0,0,0,0,27,1,0,False,,False,False,5.59,0,161,0,1,0,1,1,0,150
no run,4,West Indies,6,India,2nd innings,0,"length outside off, pushed to mid-on. There is a single there, though would have required quick running. He doesn't take it.","Jadeja to Hetmyer, no run",0,234675,Ravindra Jadeja,0,36,0,6.0,35,481896,Mohammed Shami,1,30,0,5.0,31,670025,Shimron Hetmyer,90,74,8,4,581379,Shai Hope,45,80,3,0,6,True,0,0,0,0,0,27,1,0,False,,False,False,5.55,0,162,0,1,0,1,1,0,150
no run,4,West Indies,6,India,2nd innings,0,"fuller outside off, driven back off the toe end, Shami fields on his follow through","Mohammed Shami to Hope, no run",0,481896,Mohammed Shami,1,31,0,5.1,31,234675,Ravindra Jadeja,0,36,0,6.0,35,581379,Shai Hope,45,81,3,0,670025,Shimron Hetmyer,90,74,8,4,1,False,0,0,0,0,0,28,4,0,False,,False,False,5.52,0,163,0,1,0,1,1,0,150
no run,4,West Indies,6,India,2nd innings,0,"yorker length almost, tailing into him a bit, driven to extra cover","Mohammed Shami to Hope, no run",0,481896,Mohammed Shami,1,32,0,5.2,31,234675,Ravindra Jadeja,0,36,0,6.0,35,581379,Shai Hope,45,82,3,0,670025,Shimron Hetmyer,90,74,8,4,2,False,0,0,0,0,0,28,4,0,False,,False,False,5.48,0,164,0,1,0,1,1,0,150
run,4,West Indies,6,India,2nd innings,1,"slower bouncer outside off, controls the pull shot, keeps it down and doesn't hit it hard, to deep square leg. They jog through for a single","Mohammed Shami to Hope, 1 run",0,481896,Mohammed Shami,1,33,0,5.3,32,234675,Ravindra Jadeja,0,36,0,6.0,35,581379,Shai Hope,46,83,3,0,670025,Shimron Hetmyer,90,74,8,4,3,False,0,0,0,0,0,28,4,0,False,,False,False,5.49,0,165,0,1,0,1,1,0,151
run,4,West Indies,6,India,2nd innings,1,"fuller outside off, driven to mid-off and he takes a brisk single. So he's moving a bit better now, apparently","Mohammed Shami to Hetmyer, 1 run",0,481896,Mohammed Shami,1,34,0,5.4,33,234675,Ravindra Jadeja,0,36,0,6.0,35,670025,Shimron Hetmyer,91,75,8,4,581379,Shai Hope,46,83,3,0,4,False,0,0,0,0,0,28,4,0,False,,False,False,5.49,0,166,0,1,0,1,1,0,152
run,4,West Indies,6,India,2nd innings,1,"another short ball outside off, normal pace, but Hope comfortably pulls this to deep midwicket","Mohammed Shami to Hope, 1 run",0,481896,Mohammed Shami,1,35,0,5.5,34,234675,Ravindra Jadeja,0,36,0,6.0,35,581379,Shai Hope,47,84,3,0,670025,Shimron Hetmyer,91,75,8,4,5,False,0,0,0,0,0,28,4,0,False,,False,False,5.49,0,167,0,1,0,1,1,0,153
run,4,West Indies,6,India,2nd innings,1,"fuller outside off, drives the low full toss to long-on","Mohammed Shami to Hetmyer, 1 run",0,481896,Mohammed Shami,1,36,0,6.0,35,234675,Ravindra Jadeja,0,36,0,6.0,35,670025,Shimron Hetmyer,92,76,8,4,581379,Shai Hope,47,84,3,0,6,True,0,0,0,0,0,28,4,0,False,,False,False,5.5,0,168,0,1,0,1,1,0,154
run,4,West Indies,6,India,2nd innings,1,"tossed up wide of off stump, he reaches for it and strokes it through cover","Kuldeep Yadav to Hetmyer, 1 run",0,559235,Kuldeep Yadav,0,31,0,5.1,28,481896,Mohammed Shami,1,36,0,6.0,35,670025,Shimron Hetmyer,93,77,8,4,581379,Shai Hope,47,84,3,0,1,False,0,0,0,0,0,29,6,0,False,,False,False,5.5,0,169,0,1,0,1,1,0,155
run,4,West Indies,6,India,2nd innings,1,"tossed up on the stumps, comes on the front foot and flicks it past midwicket","Kuldeep Yadav to Hope, 1 run",0,559235,Kuldeep Yadav,0,32,0,5.2,29,481896,Mohammed Shami,1,36,0,6.0,35,581379,Shai Hope,48,85,3,0,670025,Shimron Hetmyer,93,77,8,4,2,False,0,0,0,0,0,29,6,0,False,,False,False,5.5,0,170,0,1,0,1,1,0,156
run,4,West Indies,6,India,2nd innings,1,"length ball outside off, breaks sharply away further, and makes Hetmyer reach for it, and slap it through the offside","Kuldeep Yadav to Hetmyer, 1 run",0,559235,Kuldeep Yadav,0,33,0,5.3,30,481896,Mohammed Shami,1,36,0,6.0,35,670025,Shimron Hetmyer,94,78,8,4,581379,Shai Hope,48,85,3,0,3,False,0,0,0,0,0,29,6,0,False,,False,False,5.5,0,171,0,1,0,1,1,0,157
run,4,West Indies,6,India,2nd innings,1,"tossed up on the stumps, comes on the front foot and gets to the pitch, clips to long-on","Kuldeep Yadav to Hope, 1 run",0,559235,Kuldeep Yadav,0,34,0,5.4,31,481896,Mohammed Shami,1,36,0,6.0,35,581379,Shai Hope,49,86,3,0,670025,Shimron Hetmyer,94,78,8,4,4,False,0,0,0,0,0,29,6,0,False,,False,False,5.51,0,172,0,1,0,1,1,0,158
run,4,West Indies,6,India,2nd innings,2,"<b>brilliant diving stop by Pandey at the point boundary</b>. But this was an equally brilliant shot too. Kuldeep's been bowling it wide of off and spinning it away. Hetmyer's caught on and he waits for this, gets into position nicely by transferring weight across and cutting it","Kuldeep Yadav to Hetmyer, 2 runs",0,559235,Kuldeep Yadav,0,35,0,5.5,33,481896,Mohammed Shami,1,36,0,6.0,35,670025,Shimron Hetmyer,96,79,8,4,581379,Shai Hope,49,86,3,0,5,False,0,0,0,0,0,29,6,0,False,,False,False,5.54,0,173,0,1,0,1,1,0,160
no run,4,West Indies,6,India,2nd innings,0,"fuller on the stumps, lunges out to defend","Kuldeep Yadav to Hetmyer, no run",0,559235,Kuldeep Yadav,0,36,0,6.0,33,481896,Mohammed Shami,1,36,0,6.0,35,670025,Shimron Hetmyer,96,80,8,4,581379,Shai Hope,49,86,3,0,6,True,0,0,0,0,0,29,6,0,False,,False,False,5.51,0,174,0,1,0,1,1,0,160
no run,4,West Indies,6,India,2nd innings,0,"length ball on the stumps, he takes a big stride and smothers it","Jadeja to Hope, no run",0,234675,Ravindra Jadeja,0,37,0,6.1,35,559235,Kuldeep Yadav,0,36,0,6.0,33,581379,Shai Hope,49,87,3,0,670025,Shimron Hetmyer,96,80,8,4,1,False,0,0,0,0,0,30,1,0,False,,False,False,5.48,0,175,0,1,0,1,1,0,160
no run,4,West Indies,6,India,2nd innings,0,"length ball, he went back to this one, and wasn't in perfect position to play it, ends up jabbing it down","Jadeja to Hope, no run",0,234675,Ravindra Jadeja,0,38,0,6.2,35,559235,Kuldeep Yadav,0,36,0,6.0,33,581379,Shai Hope,49,88,3,0,670025,Shimron Hetmyer,96,80,8,4,2,False,0,0,0,0,0,30,1,0,False,,False,False,5.45,0,176,0,1,0,1,1,0,160
no run,4,West Indies,6,India,2nd innings,0,"tossed up outside off, driven by opening the bat face, to point","Jadeja to Hope, no run",0,234675,Ravindra Jadeja,0,39,0,6.3,35,559235,Kuldeep Yadav,0,36,0,6.0,33,581379,Shai Hope,49,89,3,0,670025,Shimron Hetmyer,96,80,8,4,3,False,0,0,0,0,0,30,1,0,False,,False,False,5.42,0,177,0,1,0,1,1,0,160
no run,4,West Indies,6,India,2nd innings,0,"tries to run it down, misses it and it rolls near him off the thigh pad","Jadeja to Hope, no run",0,234675,Ravindra Jadeja,0,40,0,6.4,35,559235,Kuldeep Yadav,0,36,0,6.0,33,581379,Shai Hope,49,90,3,0,670025,Shimron Hetmyer,96,80,8,4,4,False,0,0,0,0,0,30,1,0,False,,False,False,5.39,0,178,0,1,0,1,1,0,160
no run,4,West Indies,6,India,2nd innings,0,driven firmly but straight to point,"Jadeja to Hope, no run",0,234675,Ravindra Jadeja,0,41,0,6.5,35,559235,Kuldeep Yadav,0,36,0,6.0,33,581379,Shai Hope,49,91,3,0,670025,Shimron Hetmyer,96,80,8,4,5,False,0,0,0,0,0,30,1,0,False,,False,False,5.36,0,179,0,1,0,1,1,0,160
run,4,West Indies,6,India,2nd innings,1,"length ball on the pads, tucked past midwicket. Raises his <b>fifty</b> but it's taken him 92 balls.","Jadeja to Hope, 1 run",0,234675,Ravindra Jadeja,0,42,0,7.0,36,559235,Kuldeep Yadav,0,36,0,6.0,33,581379,Shai Hope,50,92,3,0,670025,Shimron Hetmyer,96,80,8,4,6,True,0,0,0,0,0,30,1,0,False,,False,False,5.36,0,180,0,1,0,1,1,0,161
run,4,West Indies,6,India,2nd innings,2,"tossed up, he takes a step down and whips it to deep midwicket on the full","Kuldeep Yadav to Hope, 2 runs",0,559235,Kuldeep Yadav,0,37,0,6.1,35,234675,Ravindra Jadeja,0,42,0,7.0,36,581379,Shai Hope,52,93,3,0,670025,Shimron Hetmyer,96,80,8,4,1,False,0,0,0,0,0,31,7,0,False,,False,False,5.4,0,181,0,1,0,1,1,0,163
no run,4,West Indies,6,India,2nd innings,0,"tossed up on a length outside off, he can't get to the pitch despite a big stride and mistimes the drive to mid-off","Kuldeep Yadav to Hope, no run",0,559235,Kuldeep Yadav,0,38,0,6.2,35,234675,Ravindra Jadeja,0,42,0,7.0,36,581379,Shai Hope,52,94,3,0,670025,Shimron Hetmyer,96,80,8,4,2,False,0,0,0,0,0,31,7,0,False,,False,False,5.37,0,182,0,1,0,1,1,0,163
leg bye,4,West Indies,6,India,2nd innings,3,"drifts down leg, tries to turn it but misses. It flicks the pad and goes fine. Dube runs to his right and makes a tumbling stop at the fine leg boundary","Kuldeep Yadav to Hope, 3 leg byes",0,559235,Kuldeep Yadav,0,39,0,6.3,35,234675,Ravindra Jadeja,0,42,0,7.0,36,581379,Shai Hope,52,95,3,0,670025,Shimron Hetmyer,96,80,8,4,3,False,0,0,0,0,3,31,7,0,False,,False,False,5.44,0,183,0,1,3,1,1,0,166
run,4,West Indies,6,India,2nd innings,1,"tossed up on the stumps, clipped off his toes while coming forward, to midwicket","Kuldeep Yadav to Hetmyer, 1 run",0,559235,Kuldeep Yadav,0,40,0,6.4,36,234675,Ravindra Jadeja,0,42,0,7.0,36,670025,Shimron Hetmyer,97,81,8,4,581379,Shai Hope,52,95,3,0,4,False,0,0,0,0,0,31,7,0,False,,False,False,5.44,0,184,0,1,0,1,1,0,167
no run,4,West Indies,6,India,2nd innings,0,"length ball outside off, skids on a bit, he shuffles across and defends from the crease","Kuldeep Yadav to Hope, no run",0,559235,Kuldeep Yadav,0,41,0,6.5,36,234675,Ravindra Jadeja,0,42,0,7.0,36,581379,Shai Hope,52,96,3,0,670025,Shimron Hetmyer,97,81,8,4,5,False,0,0,0,0,0,31,7,0,False,,False,False,5.41,0,185,0,1,0,1,1,0,167
run,4,West Indies,6,India,2nd innings,1,"fuller on the stumps, driven to long-off","Kuldeep Yadav to Hope, 1 run",0,559235,Kuldeep Yadav,0,42,0,7.0,37,234675,Ravindra Jadeja,0,42,0,7.0,36,581379,Shai Hope,53,97,3,0,670025,Shimron Hetmyer,97,81,8,4,6,True,0,0,0,0,0,31,7,0,False,,False,False,5.41,0,186,0,1,0,1,1,0,168
run,4,West Indies,6,India,2nd innings,1,"length ball outside off, comes on the front foot and taps it softly on the offside to get off strike.","Jadeja to Hope, 1 run",0,234675,Ravindra Jadeja,0,43,0,7.1,37,559235,Kuldeep Yadav,0,42,0,7.0,37,581379,Shai Hope,54,98,3,0,670025,Shimron Hetmyer,97,81,8,4,1,False,0,0,0,0,0,32,6,0,False,,False,False,5.42,0,187,0,1,0,1,1,0,169
run,4,West Indies,6,India,2nd innings,1,"length ball on off, patted down to fine leg with a horizintal bat","Jadeja to Hetmyer, 1 run",0,234675,Ravindra Jadeja,0,44,0,7.2,38,559235,Kuldeep Yadav,0,42,0,7.0,37,670025,Shimron Hetmyer,98,82,8,4,581379,Shai Hope,54,98,3,0,2,False,0,0,0,0,0,32,6,0,False,,False,False,5.42,0,188,0,1,0,1,1,0,170
no run,4,West Indies,6,India,2nd innings,0,"length on the stumps, defended towards mid-off","Jadeja to Hope, no run",0,234675,Ravindra Jadeja,0,45,0,7.3,38,559235,Kuldeep Yadav,0,42,0,7.0,37,581379,Shai Hope,54,99,3,0,670025,Shimron Hetmyer,98,82,8,4,3,False,0,0,0,0,0,32,6,0,False,,False,False,5.39,0,189,0,1,0,1,1,0,170
run,4,West Indies,6,India,2nd innings,1,goes back to this one and tucks it off his pads to square leg,"Jadeja to Hope, 1 run",0,234675,Ravindra Jadeja,0,46,0,7.4,39,559235,Kuldeep Yadav,0,42,0,7.0,37,581379,Shai Hope,55,100,3,0,670025,Shimron Hetmyer,98,82,8,4,4,False,0,0,0,0,0,32,6,0,False,,False,False,5.4,0,190,0,1,0,1,1,0,171
run,4,West Indies,6,India,2nd innings,1,"fuller on the pads, comes on the front foot and clips it through square leg to move to 99","Jadeja to Hetmyer, 1 run",0,234675,Ravindra Jadeja,0,47,0,7.5,40,559235,Kuldeep Yadav,0,42,0,7.0,37,670025,Shimron Hetmyer,99,83,8,4,581379,Shai Hope,55,100,3,0,5,False,0,0,0,0,0,32,6,0,False,,False,False,5.4,0,191,0,1,0,1,1,0,172
run,4,West Indies,6,India,2nd innings,2,"marginally short outside off, slapped through cover on the front foot","Jadeja to Hope, (no ball) 1 run",0,234675,Ravindra Jadeja,0,47,0,7.5,42,559235,Kuldeep Yadav,0,42,0,7.0,37,581379,Shai Hope,56,101,3,0,670025,Shimron Hetmyer,99,83,8,4,6,False,0,1,0,0,0,32,6,0,False,,False,False,5.46,0,191,1,1,0,1,1,0,174
no run,4,West Indies,6,India,2nd innings,0,"wide of off stump, launches into a drive but straight to the cover fielder. Stays on 99.","Jadeja to Hetmyer, no run",0,234675,Ravindra Jadeja,0,48,0,8.0,42,559235,Kuldeep Yadav,0,42,0,7.0,37,670025,Shimron Hetmyer,99,84,8,4,581379,Shai Hope,56,101,3,0,7,True,0,0,0,0,0,32,6,0,False,,False,False,5.43,0,192,0,1,0,1,1,0,174
run,4,West Indies,6,India,2nd innings,1,"tossed up on off, gives himself room and drives to wide long-off","Kuldeep Yadav to Hope, 1 run",0,559235,Kuldeep Yadav,0,43,0,7.1,38,234675,Ravindra Jadeja,0,48,0,8.0,42,581379,Shai Hope,57,102,3,0,670025,Shimron Hetmyer,99,84,8,4,1,False,0,0,0,0,0,33,4,0,False,,False,False,5.44,0,193,0,1,0,1,1,0,175
run,4,West Indies,6,India,2nd innings,1,"tossed up on off, comes on the front foot and drives to long-on to raise his <b>fifth ODI century</b>. What a fantastic innings it's been, even after the slight slowdown post that cramps attack.","Kuldeep Yadav to Hetmyer, 1 run",0,559235,Kuldeep Yadav,0,44,0,7.2,39,234675,Ravindra Jadeja,0,48,0,8.0,42,670025,Shimron Hetmyer,100,85,8,4,581379,Shai Hope,57,102,3,0,2,False,0,0,0,0,0,33,4,0,False,,False,False,5.44,0,194,0,1,0,1,1,0,176
run,4,West Indies,6,India,2nd innings,1,"tossed up on the stumps, driven to long-on off his toes","Kuldeep Yadav to Hope, 1 run",0,559235,Kuldeep Yadav,0,45,0,7.3,40,234675,Ravindra Jadeja,0,48,0,8.0,42,581379,Shai Hope,58,103,3,0,670025,Shimron Hetmyer,100,85,8,4,3,False,0,0,0,0,0,33,4,0,False,,False,False,5.44,0,195,0,1,0,1,1,0,177
run,4,West Indies,6,India,2nd innings,1,"slightly short outside off, spinning away from him, stays back and cuts","Kuldeep Yadav to Hetmyer, 1 run",0,559235,Kuldeep Yadav,0,46,0,7.4,41,234675,Ravindra Jadeja,0,48,0,8.0,42,670025,Shimron Hetmyer,101,86,8,4,581379,Shai Hope,58,103,3,0,4,False,0,0,0,0,0,33,4,0,False,,False,False,5.44,0,196,0,1,0,1,1,0,178
no run,4,West Indies,6,India,2nd innings,0,"shuffles across but is cramped for room with Kuldeep bowling it in the channel, and he ends up patting to midwicket","Kuldeep Yadav to Hope, no run",0,559235,Kuldeep Yadav,0,47,0,7.5,41,234675,Ravindra Jadeja,0,48,0,8.0,42,581379,Shai Hope,58,104,3,0,670025,Shimron Hetmyer,101,86,8,4,5,False,0,0,0,0,0,33,4,0,False,,False,False,5.42,0,197,0,1,0,1,1,0,178
no run,4,West Indies,6,India,2nd innings,0,"goes back and cuts this hard, but can't beat cover","Kuldeep Yadav to Hope, no run",0,559235,Kuldeep Yadav,0,48,0,8.0,41,234675,Ravindra Jadeja,0,48,0,8.0,42,581379,Shai Hope,58,105,3,0,670025,Shimron Hetmyer,101,86,8,4,6,True,0,0,0,0,0,33,4,0,False,,False,False,5.39,0,198,0,1,0,1,1,0,178
run,4,West Indies,6,India,2nd innings,1,"back of a length, turns in towards middle stump, goes on the back foot to work it through square leg","Jadeja to Hetmyer, 1 run",0,234675,Ravindra Jadeja,0,49,0,8.1,43,559235,Kuldeep Yadav,0,48,0,8.0,41,670025,Shimron Hetmyer,102,87,8,4,581379,Shai Hope,58,105,3,0,1,False,0,0,0,0,0,34,3,0,False,,False,False,5.39,0,199,0,1,0,1,1,0,179
no run,4,West Indies,6,India,2nd innings,0,"tossed up outside off, driven firmly but Kohli stops it with a dive to his right at extra-cover","Jadeja to Hope, no run",0,234675,Ravindra Jadeja,0,50,0,8.2,43,559235,Kuldeep Yadav,0,48,0,8.0,41,581379,Shai Hope,58,106,3,0,670025,Shimron Hetmyer,102,87,8,4,2,False,0,0,0,0,0,34,3,0,False,,False,False,5.37,0,200,0,1,0,1,1,0,179
no run,4,West Indies,6,India,2nd innings,0,"flat, speared into the pitch. Stops on Hope, who looks to punch off the back foot, and it nearly carries back to Jadeja diving to his left","Jadeja to Hope, no run",0,234675,Ravindra Jadeja,0,51,0,8.3,43,559235,Kuldeep Yadav,0,48,0,8.0,41,581379,Shai Hope,58,107,3,0,670025,Shimron Hetmyer,102,87,8,4,3,False,0,0,0,0,0,34,3,0,False,,False,False,5.34,0,201,0,1,0,1,1,0,179
no run,4,West Indies,6,India,2nd innings,0,"flat length ball on middle stump, goes on the back foot and is hurried into a defensive prod back to the bowler","Jadeja to Hope, no run",0,234675,Ravindra Jadeja,0,52,0,8.4,43,559235,Kuldeep Yadav,0,48,0,8.0,41,581379,Shai Hope,58,108,3,0,670025,Shimron Hetmyer,102,87,8,4,4,False,0,0,0,0,0,34,3,0,False,,False,False,5.31,0,202,0,1,0,1,1,0,179
no run,4,West Indies,6,India,2nd innings,0,"slower now, on off stump, stretches out to block to extra-cover","Jadeja to Hope, no run",0,234675,Ravindra Jadeja,0,53,0,8.5,43,559235,Kuldeep Yadav,0,48,0,8.0,41,581379,Shai Hope,58,109,3,0,670025,Shimron Hetmyer,102,87,8,4,5,False,0,0,0,0,0,34,3,0,False,,False,False,5.29,0,203,0,1,0,1,1,0,179
run,4,West Indies,6,India,2nd innings,2,"drifts onto the pads, and Hope tucks it fine of short fine leg","Jadeja to Hope, 2 runs",0,234675,Ravindra Jadeja,0,54,0,9.0,45,559235,Kuldeep Yadav,0,48,0,8.0,41,581379,Shai Hope,60,110,3,0,670025,Shimron Hetmyer,102,87,8,4,6,True,0,0,0,0,0,34,3,0,False,,False,False,5.32,0,204,0,1,0,1,1,0,181
four,4,West Indies,6,India,2nd innings,4,"lucky. Full, angling in towards off stump. Looks to clear his front leg and drive over mid-off, and gets a thick edge that runs away to the third man boundary. Short third man is too square to cut it off","Chahar to Hetmyer, FOUR runs",0,447261,Deepak Chahar,1,37,1,6.1,20,234675,Ravindra Jadeja,0,54,0,9.0,45,670025,Shimron Hetmyer,106,88,9,4,581379,Shai Hope,60,110,3,0,1,False,0,0,0,0,0,35,10,0,False,,False,False,5.41,0,205,0,1,0,1,1,0,185
no run,4,West Indies,6,India,2nd innings,0,slower bouncer outside off. Too early on the pull and he ends up hitting it back to the bowler,"Chahar to Hetmyer, no run",0,447261,Deepak Chahar,1,38,1,6.2,20,234675,Ravindra Jadeja,0,54,0,9.0,45,670025,Shimron Hetmyer,106,89,9,4,581379,Shai Hope,60,110,3,0,2,False,0,0,0,0,0,35,10,0,False,,False,False,5.38,0,206,0,1,0,1,1,0,185
no run,4,West Indies,6,India,2nd innings,0,"another slower bouncer, a little wider outside off. Hetmyer swings and misses thanks to the loopy bounce, looking for the pull","Chahar to Hetmyer, no run",0,447261,Deepak Chahar,1,39,1,6.3,20,234675,Ravindra Jadeja,0,54,0,9.0,45,670025,Shimron Hetmyer,106,90,9,4,581379,Shai Hope,60,110,3,0,3,False,0,0,0,0,0,35,10,0,False,,False,False,5.36,0,207,0,1,0,1,1,0,185
run,4,West Indies,6,India,2nd innings,1,"<b>dropped</b>. Iyer has put down a straightforward chance here. Short, angling into off stump. Sits up, but loses a bit of pace off the pitch, and Hetmyer can't get this flat-bat hit to carry over long-on as he might have expected. The fielder at long-on, Iyer, dives forward, and can't wrap his hands around the low chance a few inches off the ground","Chahar to Hetmyer, 1 run",0,447261,Deepak Chahar,1,40,1,6.4,21,234675,Ravindra Jadeja,0,54,0,9.0,45,670025,Shimron Hetmyer,107,91,9,4,581379,Shai Hope,60,110,3,0,4,False,0,0,0,0,0,35,10,0,False,,False,False,5.36,0,208,0,1,0,1,1,0,186
four,4,West Indies,6,India,2nd innings,4,"back of a length, a bit of width, opens his bat face and steers it between short third man and backward point","Chahar to Hope, FOUR runs",0,447261,Deepak Chahar,1,41,1,6.5,25,234675,Ravindra Jadeja,0,54,0,9.0,45,581379,Shai Hope,64,111,4,0,670025,Shimron Hetmyer,107,91,9,4,5,False,0,0,0,0,0,35,10,0,False,,False,False,5.45,0,209,0,1,0,1,1,0,190
