PlayType_description,Batting_Team_id,Batting_Team_name,Bowling_Team_id,Bowling_Team_name,Innings,Total_Runs_on_delivery,Commentary,Commentary_short,Score,Bowler_id,Bowler_name,Bowler_maiden,Bowler_balls,Bowler_wickets,Bowler_over,Bowler_conceded,Other_Bowler_id,Other_Bowler_name,Other_Bowler_maidens,Other_Bowler_balls,Other_Bowler_wickets,Other_Bowler_overs,Other_Bowler_conceded,Batsman_id,Batsman_name,Batsman_runs,Batsman_balls_faced,Batsman_four,Batsman_sixes,Other_Batsman_id,Other_Batsman_name,Other_Batsman_runs,Other_Batsman_balls_faced,Other_Batsman_four,Other_Batsman_sixes,Over_ball,Over_complete,Over_maiden,Over_no_Ball,Over_wide,Over_byes,Over_leg_byes,Over_number,Over_runs,Over_wickets,Dismissal_is_true,Dismissal_type,Dismissal_fielder_iskeeper,Dismissal_text,Innings_run_rate,Innings_byes,Innings_balls,Innings_no_balls,Innings_wickets,Innings_leg_byes,Innings_session,Innings_day,Innings_wides,Innings_runs
run,6,India,4,West Indies,1st innings,1,"ooh, again the slowness of the pitch comes into play. Pretty full, pitching on off and angling further across. Not full enough to drive, though, and Pant, reaching for the ball, hits it uppishly to mid-off. There was no single on offer, but Chase gives away an overthrow with a needless throw to the unguarded bowler's end","Joseph to Pant, 1 run",89/3,670031,Alzarri Joseph,1,19,1,3.1,6,391832,Roston Chase,0,18,0,3.0,10,931581,Rishabh Pant,4,11,0,0,642519,Shreyas Iyer,31,47,3,0,1,False,0,0,0,0,0,23,2,0,False,,False,False,4.01,0,133,0,3,0,1,1,0,89
no run,6,India,4,West Indies,1st innings,0,"back of a length close to off stump, dabbed to backward point","Joseph to Iyer, no run",89/3,670031,Alzarri Joseph,1,20,1,3.2,6,391832,Roston Chase,0,18,0,3.0,10,642519,Shreyas Iyer,31,48,3,0,931581,Rishabh Pant,4,11,0,0,2,False,0,0,0,0,0,23,2,0,False,,False,False,3.98,0,134,0,3,0,1,1,0,89
run,6,India,4,West Indies,1st innings,1,"back of a length on off stump, lets it come on and just lets it hit his bat - a la Kane Williamson - and the ball dribbles away into the gully region","Joseph to Iyer, 1 run",90/3,670031,Alzarri Joseph,1,21,1,3.3,7,391832,Roston Chase,0,18,0,3.0,10,642519,Shreyas Iyer,32,49,3,0,931581,Rishabh Pant,4,11,0,0,3,False,0,0,0,0,0,23,2,0,False,,False,False,4.0,0,135,0,3,0,1,1,0,90
no run,6,India,4,West Indies,1st innings,0,"length ball on off stump, gets forward for a checked drive to mid-off","Joseph to Pant, no run",90/3,670031,Alzarri Joseph,1,22,1,3.4,7,391832,Roston Chase,0,18,0,3.0,10,931581,Rishabh Pant,4,12,0,0,642519,Shreyas Iyer,32,49,3,0,4,False,0,0,0,0,0,23,2,0,False,,False,False,3.97,0,136,0,3,0,1,1,0,90
no run,6,India,4,West Indies,1st innings,0,"full on middle stump, clipped to midwicket","Joseph to Pant, no run",90/3,670031,Alzarri Joseph,1,23,1,3.5,7,391832,Roston Chase,0,18,0,3.0,10,931581,Rishabh Pant,4,13,0,0,642519,Shreyas Iyer,32,49,3,0,5,False,0,0,0,0,0,23,2,0,False,,False,False,3.94,0,137,0,3,0,1,1,0,90
no run,6,India,4,West Indies,1st innings,0,"ooh, misread the length there. Wasn't short enough to cut, and the ball, slanting across into the corridor outside off, whizzes past his bat as he tries to bring it down hurriedly","Joseph to Pant, no run",90/3,670031,Alzarri Joseph,1,24,1,4.0,7,391832,Roston Chase,0,18,0,3.0,10,931581,Rishabh Pant,4,14,0,0,642519,Shreyas Iyer,32,49,3,0,6,True,0,0,0,0,0,23,2,0,False,,False,False,3.91,0,138,0,3,0,1,1,0,90
no run,6,India,4,West Indies,1st innings,0,"flat, back of a length, spinning back towards off stump. Punched firmly back to the bowler","Chase to Iyer, no run",90/3,391832,Roston Chase,0,19,0,3.1,10,670031,Alzarri Joseph,1,24,1,4.0,7,642519,Shreyas Iyer,32,50,3,0,931581,Rishabh Pant,4,14,0,0,1,False,0,0,0,0,0,24,6,0,False,,False,False,3.88,0,139,0,3,0,1,1,0,90
run,6,India,4,West Indies,1st innings,1,tossed up slow on off stump and Iyer shuffles out and clips to long-on,"Chase to Iyer, 1 run",91/3,391832,Roston Chase,0,20,0,3.2,11,670031,Alzarri Joseph,1,24,1,4.0,7,642519,Shreyas Iyer,33,51,3,0,931581,Rishabh Pant,4,14,0,0,2,False,0,0,0,0,0,24,6,0,False,,False,False,3.9,0,140,0,3,0,1,1,0,91
run,6,India,4,West Indies,1st innings,1,"back of a length, spins from middle to off, goes back and across and works it into the backward square leg region. Iyer responds immediately to the call for one, and they make it safely despite the short fine leg fielder moving quickly to his right","Chase to Pant, 1 run",92/3,391832,Roston Chase,0,21,0,3.3,12,670031,Alzarri Joseph,1,24,1,4.0,7,931581,Rishabh Pant,5,15,0,0,642519,Shreyas Iyer,33,51,3,0,3,False,0,0,0,0,0,24,6,0,False,,False,False,3.91,0,141,0,3,0,1,1,0,92
no run,6,India,4,West Indies,1st innings,0,"tossed up on a good length close to off stump, defended into the covers","Chase to Iyer, no run",92/3,391832,Roston Chase,0,22,0,3.4,12,670031,Alzarri Joseph,1,24,1,4.0,7,642519,Shreyas Iyer,33,52,3,0,931581,Rishabh Pant,5,15,0,0,4,False,0,0,0,0,0,24,6,0,False,,False,False,3.88,0,142,0,3,0,1,1,0,92
four,6,India,4,West Indies,1st innings,4,"just a touch short, just a touch wide, and Iyer jumps back in a flash to cut fiercely behind backward point","Chase to Iyer, FOUR runs",96/3,391832,Roston Chase,0,23,0,3.5,16,670031,Alzarri Joseph,1,24,1,4.0,7,642519,Shreyas Iyer,37,53,4,0,931581,Rishabh Pant,5,15,0,0,5,False,0,0,0,0,0,24,6,0,False,,False,False,4.02,0,143,0,3,0,1,1,0,96
no run,6,India,4,West Indies,1st innings,0,"back of a length, spins in towards off stump, worked with the turn to square leg","Chase to Iyer, no run",96/3,391832,Roston Chase,0,24,0,4.0,16,670031,Alzarri Joseph,1,24,1,4.0,7,642519,Shreyas Iyer,37,54,4,0,931581,Rishabh Pant,5,15,0,0,6,True,0,0,0,0,0,24,6,0,False,,False,False,4.0,0,144,0,3,0,1,1,0,96
run,6,India,4,West Indies,1st innings,1,"overpitched, close to off stump. Cover point is right on the edge of the circle, and he throws himself into a sprawling dive to his right to stop Pant's drive","Joseph to Pant, 1 run",97/3,670031,Alzarri Joseph,1,25,1,4.1,8,391832,Roston Chase,0,24,0,4.0,16,931581,Rishabh Pant,6,16,0,0,642519,Shreyas Iyer,37,54,4,0,1,False,0,0,0,0,0,25,8,0,False,,False,False,4.01,0,145,0,3,0,1,1,0,97
run,6,India,4,West Indies,1st innings,1,"back of a length close to off stump, dabbed away to third man","Joseph to Iyer, 1 run",98/3,670031,Alzarri Joseph,1,26,1,4.2,9,391832,Roston Chase,0,24,0,4.0,16,642519,Shreyas Iyer,38,55,4,0,931581,Rishabh Pant,6,16,0,0,2,False,0,0,0,0,0,25,8,0,False,,False,False,4.02,0,146,0,3,0,1,1,0,98
run,6,India,4,West Indies,1st innings,2,"length ball slanting across to off stump, clipped away neatly through square leg to bring up India's 100","Joseph to Pant, 2 runs",100/3,670031,Alzarri Joseph,1,27,1,4.3,11,391832,Roston Chase,0,24,0,4.0,16,931581,Rishabh Pant,8,17,0,0,642519,Shreyas Iyer,38,55,4,0,3,False,0,0,0,0,0,25,8,0,False,,False,False,4.08,0,147,0,3,0,1,1,0,100
four,6,India,4,West Indies,1st innings,4,"full on middle and off, and that's lovely use of the wrists from Pant to flick it away to the left of midwicket","Joseph to Pant, FOUR runs",104/3,670031,Alzarri Joseph,1,28,1,4.4,15,391832,Roston Chase,0,24,0,4.0,16,931581,Rishabh Pant,12,18,1,0,642519,Shreyas Iyer,38,55,4,0,4,False,0,0,0,0,0,25,8,0,False,,False,False,4.21,0,148,0,3,0,1,1,0,104
no run,6,India,4,West Indies,1st innings,0,"length ball on off stump, defended into the extra-cover region","Joseph to Pant, no run",104/3,670031,Alzarri Joseph,1,29,1,4.5,15,391832,Roston Chase,0,24,0,4.0,16,931581,Rishabh Pant,12,19,1,0,642519,Shreyas Iyer,38,55,4,0,5,False,0,0,0,0,0,25,8,0,False,,False,False,4.18,0,149,0,3,0,1,1,0,104
no run,6,India,4,West Indies,1st innings,0,"length ball on off stump, blocked back to the bowler","Joseph to Pant, no run",104/3,670031,Alzarri Joseph,1,30,1,5.0,15,391832,Roston Chase,0,24,0,4.0,16,931581,Rishabh Pant,12,20,1,0,642519,Shreyas Iyer,38,55,4,0,6,True,0,0,0,0,0,25,8,0,False,,False,False,4.16,0,150,0,3,0,1,1,0,104
run,6,India,4,West Indies,1st innings,1,"sees Iyer looking to step out and fires it in shorter, at his pads. Clipped to the left of the diving square leg fielder","Chase to Iyer, 1 run",105/3,391832,Roston Chase,0,25,0,4.1,17,670031,Alzarri Joseph,1,30,1,5.0,15,642519,Shreyas Iyer,39,56,4,0,931581,Rishabh Pant,12,20,1,0,1,False,0,0,0,0,0,26,5,0,False,,False,False,4.17,0,151,0,3,0,1,1,0,105
no run,6,India,4,West Indies,1st innings,0,"angles this into the pads, and Pant clips to the fielder at backward square leg","Chase to Pant, no run",105/3,391832,Roston Chase,0,26,0,4.2,17,670031,Alzarri Joseph,1,30,1,5.0,15,931581,Rishabh Pant,12,21,1,0,642519,Shreyas Iyer,39,56,4,0,2,False,0,0,0,0,0,26,5,0,False,,False,False,4.14,0,152,0,3,0,1,1,0,105
no run,6,India,4,West Indies,1st innings,0,"slower now, length ball straightening towards off stump. Gets on the front foot and defends towards the non-striler","Chase to Pant, no run",105/3,391832,Roston Chase,0,27,0,4.3,17,670031,Alzarri Joseph,1,30,1,5.0,15,931581,Rishabh Pant,12,22,1,0,642519,Shreyas Iyer,39,56,4,0,3,False,0,0,0,0,0,26,5,0,False,,False,False,4.11,0,153,0,3,0,1,1,0,105
four,6,India,4,West Indies,1st innings,4,"shortish on off stump, and Pant collapses his back knee to create a little more shortness of length and pulls it away flat to the left of midwicket","Chase to Pant, FOUR runs",109/3,391832,Roston Chase,0,28,0,4.4,21,670031,Alzarri Joseph,1,30,1,5.0,15,931581,Rishabh Pant,16,23,2,0,642519,Shreyas Iyer,39,56,4,0,4,False,0,0,0,0,0,26,5,0,False,,False,False,4.24,0,154,0,3,0,1,1,0,109
no run,6,India,4,West Indies,1st innings,0,"slides on with the angle, clipped to short midwicket","Chase to Pant, no run",109/3,391832,Roston Chase,0,29,0,4.5,21,670031,Alzarri Joseph,1,30,1,5.0,15,931581,Rishabh Pant,16,24,2,0,642519,Shreyas Iyer,39,56,4,0,5,False,0,0,0,0,0,26,5,0,False,,False,False,4.21,0,155,0,3,0,1,1,0,109
no run,6,India,4,West Indies,1st innings,0,"slower, angling down leg. Looks to sweep but can't beat short fine leg","Chase to Pant, no run",109/3,391832,Roston Chase,0,30,0,5.0,21,670031,Alzarri Joseph,1,30,1,5.0,15,931581,Rishabh Pant,16,25,2,0,642519,Shreyas Iyer,39,56,4,0,6,True,0,0,0,0,0,26,5,0,False,,False,False,4.19,0,156,0,3,0,1,1,0,109
run,6,India,4,West Indies,1st innings,1,"shortish, fourth-stump line, gets across to tuck it gently into the square leg region","Paul to Iyer, 1 run",110/3,677081,Keemo Paul,0,13,0,2.1,10,391832,Roston Chase,0,30,0,5.0,21,642519,Shreyas Iyer,40,57,4,0,931581,Rishabh Pant,16,25,2,0,1,False,0,0,0,0,0,27,5,0,False,,False,False,4.2,0,157,0,3,0,1,1,0,110
no run,6,India,4,West Indies,1st innings,0,"length ball angling into off stump, gets forward to block it back to the bowler","Paul to Pant, no run",110/3,677081,Keemo Paul,0,14,0,2.2,10,391832,Roston Chase,0,30,0,5.0,21,931581,Rishabh Pant,16,26,2,0,642519,Shreyas Iyer,40,57,4,0,2,False,0,0,0,0,0,27,5,0,False,,False,False,4.17,0,158,0,3,0,1,1,0,110
no run,6,India,4,West Indies,1st innings,0,"length ball angling into off stump, clipped to midwicket","Paul to Pant, no run",110/3,677081,Keemo Paul,0,15,0,2.3,10,391832,Roston Chase,0,30,0,5.0,21,931581,Rishabh Pant,16,27,2,0,642519,Shreyas Iyer,40,57,4,0,3,False,0,0,0,0,0,27,5,0,False,,False,False,4.15,0,159,0,3,0,1,1,0,110
no run,6,India,4,West Indies,1st innings,0,"fullish outside off, punched to extra-cover","Paul to Pant, no run",110/3,677081,Keemo Paul,0,16,0,2.4,10,391832,Roston Chase,0,30,0,5.0,21,931581,Rishabh Pant,16,28,2,0,642519,Shreyas Iyer,40,57,4,0,4,False,0,0,0,0,0,27,5,0,False,,False,False,4.12,0,160,0,3,0,1,1,0,110
wide,6,India,4,West Indies,1st innings,1,length ball sliding down leg. Aims a big whip at the ball but can't make contact,"Paul to Pant, 1 wide",111/3,677081,Keemo Paul,0,16,0,2.4,11,391832,Roston Chase,0,30,0,5.0,21,931581,Rishabh Pant,16,28,2,0,642519,Shreyas Iyer,40,57,4,0,5,False,0,0,1,0,0,27,5,0,False,,False,False,4.16,0,160,0,3,0,1,1,1,111
run,6,India,4,West Indies,1st innings,2,angles this one into the pads and Pant whips it away to the left of deep square leg,"Paul to Pant, 2 runs",113/3,677081,Keemo Paul,0,17,0,2.5,13,391832,Roston Chase,0,30,0,5.0,21,931581,Rishabh Pant,18,29,2,0,642519,Shreyas Iyer,40,57,4,0,6,False,0,0,0,0,0,27,5,0,False,,False,False,4.21,0,161,0,3,0,1,1,0,113
run,6,India,4,West Indies,1st innings,1,"slower ball, full and wide outside off. Quite deliberate, an attempt to get Pant to hit in the air to wide long-off - he got out playing a similar shot off a similar line in the third T20I - but he controls the shot well and the ball bounces well in front of the fielder","Paul to Pant, 1 run",114/3,677081,Keemo Paul,0,18,0,3.0,14,391832,Roston Chase,0,30,0,5.0,21,931581,Rishabh Pant,19,30,2,0,642519,Shreyas Iyer,40,57,4,0,7,True,0,0,0,0,0,27,5,0,False,,False,False,4.22,0,162,0,3,0,1,1,0,114
no run,6,India,4,West Indies,1st innings,0,"nicely flighted, spins from middle to off, gets forward to block to the bowler","Chase to Pant, no run",114/3,391832,Roston Chase,0,31,0,5.1,21,677081,Keemo Paul,0,18,0,3.0,14,931581,Rishabh Pant,19,31,2,0,642519,Shreyas Iyer,40,57,4,0,1,False,0,0,0,0,0,28,8,0,False,,False,False,4.19,0,163,0,3,0,1,1,0,114
six,6,India,4,West Indies,1st innings,6,"shot. A bit of flight again, but it's fuller, and Pant can reach out and hoist a big slog-sweep into the stands beyond the midwicket boundary","Chase to Pant, SIX runs",120/3,391832,Roston Chase,0,32,0,5.2,27,677081,Keemo Paul,0,18,0,3.0,14,931581,Rishabh Pant,25,32,2,1,642519,Shreyas Iyer,40,57,4,0,2,False,0,0,0,0,0,28,8,0,False,,False,False,4.39,0,164,0,3,0,1,1,0,120
run,6,India,4,West Indies,1st innings,1,"short, a bit of width, slapped to deep point","Chase to Pant, 1 run",121/3,391832,Roston Chase,0,33,0,5.3,28,677081,Keemo Paul,0,18,0,3.0,14,931581,Rishabh Pant,26,33,2,1,642519,Shreyas Iyer,40,57,4,0,3,False,0,0,0,0,0,28,8,0,False,,False,False,4.4,0,165,0,3,0,1,1,0,121
no run,6,India,4,West Indies,1st innings,0,"length ball spinning in towards middle and off. Stays back and looks to clip into the leg side, ends up playing it back to the bowler off the leading edge","Chase to Iyer, no run",121/3,391832,Roston Chase,0,34,0,5.4,28,677081,Keemo Paul,0,18,0,3.0,14,642519,Shreyas Iyer,40,58,4,0,931581,Rishabh Pant,26,33,2,1,4,False,0,0,0,0,0,28,8,0,False,,False,False,4.37,0,166,0,3,0,1,1,0,121
no run,6,India,4,West Indies,1st innings,0,"flatter, a little wider outside off, chopped to backward point","Chase to Iyer, no run",121/3,391832,Roston Chase,0,35,0,5.5,28,677081,Keemo Paul,0,18,0,3.0,14,642519,Shreyas Iyer,40,59,4,0,931581,Rishabh Pant,26,33,2,1,5,False,0,0,0,0,0,28,8,0,False,,False,False,4.34,0,167,0,3,0,1,1,0,121
run,6,India,4,West Indies,1st innings,1,"flat again, spins into the stumps, goes deep in his crease to work it through midwicket","Chase to Iyer, 1 run",122/3,391832,Roston Chase,0,36,0,6.0,29,677081,Keemo Paul,0,18,0,3.0,14,642519,Shreyas Iyer,41,60,4,0,931581,Rishabh Pant,26,33,2,1,6,True,0,0,0,0,0,28,8,0,False,,False,False,4.35,0,168,0,3,0,1,1,0,122
run,6,India,4,West Indies,1st innings,1,"back of a length outside off, steered to third man","Paul to Iyer, 1 run",123/3,677081,Keemo Paul,0,19,0,3.1,15,391832,Roston Chase,0,36,0,6.0,29,642519,Shreyas Iyer,42,61,4,0,931581,Rishabh Pant,26,33,2,1,1,False,0,0,0,0,0,29,7,0,False,,False,False,4.36,0,169,0,3,0,1,1,0,123
no run,6,India,4,West Indies,1st innings,0,"fullish, angling in from wide of the crease. Looks to step forward and across and work it into the leg side, and misses. Lbw appeal from the bowler but the impact was well outside the line of off stump","Paul to Pant, no run",123/3,677081,Keemo Paul,0,20,0,3.2,15,391832,Roston Chase,0,36,0,6.0,29,931581,Rishabh Pant,26,34,2,1,642519,Shreyas Iyer,42,61,4,0,2,False,0,0,0,0,0,29,7,0,False,,False,False,4.34,0,170,0,3,0,1,1,0,123
wide,6,India,4,West Indies,1st innings,1,"slower ball, wanted to bowl that wide line to draw the uppish drive from Pant, but he ends up slipping it much, much wider than intended, towards the very edge of the pitch. Left alone","Paul to Pant, 1 wide",124/3,677081,Keemo Paul,0,20,0,3.2,16,391832,Roston Chase,0,36,0,6.0,29,931581,Rishabh Pant,26,34,2,1,642519,Shreyas Iyer,42,61,4,0,3,False,0,0,1,0,0,29,7,0,False,,False,False,4.37,0,170,0,3,0,1,1,1,124
run,6,India,4,West Indies,1st innings,1,"length ball angling into off stump, clipped to deep midwicket","Paul to Pant, 1 run",125/3,677081,Keemo Paul,0,21,0,3.3,17,391832,Roston Chase,0,36,0,6.0,29,931581,Rishabh Pant,27,35,2,1,642519,Shreyas Iyer,42,61,4,0,4,False,0,0,0,0,0,29,7,0,False,,False,False,4.38,0,171,0,3,0,1,1,0,125
run,6,India,4,West Indies,1st innings,2,"shot. He's really good in that area. Back of a length outside off, uses a slicing motion of his hands to steer the ball behind point, and to the right of third man","Paul to Iyer, 2 runs",127/3,677081,Keemo Paul,0,22,0,3.4,19,391832,Roston Chase,0,36,0,6.0,29,642519,Shreyas Iyer,44,62,4,0,931581,Rishabh Pant,27,35,2,1,5,False,0,0,0,0,0,29,7,0,False,,False,False,4.43,0,172,0,3,0,1,1,0,127
run,6,India,4,West Indies,1st innings,1,"back of a length on off stump, punched to long-on","Paul to Iyer, 1 run",128/3,677081,Keemo Paul,0,23,0,3.5,20,391832,Roston Chase,0,36,0,6.0,29,642519,Shreyas Iyer,45,63,4,0,931581,Rishabh Pant,27,35,2,1,6,False,0,0,0,0,0,29,7,0,False,,False,False,4.43,0,173,0,3,0,1,1,0,128
run,6,India,4,West Indies,1st innings,1,"length ball on off stump, gets forward and meets this with a straight bat to push to the right of midwicket","Paul to Pant, 1 run",129/3,677081,Keemo Paul,0,24,0,4.0,21,391832,Roston Chase,0,36,0,6.0,29,931581,Rishabh Pant,28,36,2,1,642519,Shreyas Iyer,45,63,4,0,7,True,0,0,0,0,0,29,7,0,False,,False,False,4.44,0,174,0,3,0,1,1,0,129
run,6,India,4,West Indies,1st innings,1,"fullish, wide outside off - that line and length again - and Pant goes for the big drive and gets a thick outside edge down to third man. Brings up the 50 partnership","Holder to Pant, 1 run",130/3,391485,Jason Holder,0,37,0,6.1,27,677081,Keemo Paul,0,24,0,4.0,21,931581,Rishabh Pant,29,37,2,1,642519,Shreyas Iyer,45,63,4,0,1,False,0,0,0,0,0,30,8,0,False,,False,False,4.45,0,175,0,3,0,1,1,0,130
no run,6,India,4,West Indies,1st innings,0,"back of a length, angling in towards off stump, defended into the on side","Holder to Iyer, no run",130/3,391485,Jason Holder,0,38,0,6.2,27,677081,Keemo Paul,0,24,0,4.0,21,642519,Shreyas Iyer,45,64,4,0,931581,Rishabh Pant,29,37,2,1,2,False,0,0,0,0,0,30,8,0,False,,False,False,4.43,0,176,0,3,0,1,1,0,130
run,6,India,4,West Indies,1st innings,1,"back of a length, fifth-stump line, punched to deep point","Holder to Iyer, 1 run",131/3,391485,Jason Holder,0,39,0,6.3,28,677081,Keemo Paul,0,24,0,4.0,21,642519,Shreyas Iyer,46,65,4,0,931581,Rishabh Pant,29,37,2,1,3,False,0,0,0,0,0,30,8,0,False,,False,False,4.44,0,177,0,3,0,1,1,0,131
run,6,India,4,West Indies,1st innings,1,"length ball angling in towards middle stump, clipped quietly to the left of midwicket","Holder to Pant, 1 run",132/3,391485,Jason Holder,0,40,0,6.4,29,677081,Keemo Paul,0,24,0,4.0,21,931581,Rishabh Pant,30,38,2,1,642519,Shreyas Iyer,46,65,4,0,4,False,0,0,0,0,0,30,8,0,False,,False,False,4.44,0,178,0,3,0,1,1,0,132
run,6,India,4,West Indies,1st innings,1,"length ball wide of off, opens his bat face and steers to third man","Holder to Iyer, 1 run",133/3,391485,Jason Holder,0,41,0,6.5,30,677081,Keemo Paul,0,24,0,4.0,21,642519,Shreyas Iyer,47,66,4,0,931581,Rishabh Pant,30,38,2,1,5,False,0,0,0,0,0,30,8,0,False,,False,False,4.45,0,179,0,3,0,1,1,0,133
four,6,India,4,West Indies,1st innings,4,"shot. Not too many can play this shot, but Pant can, and does it very well. Length ball angling into off stump, and he gets his front leg across and sweeps up and over, to the backward square leg boundary","Holder to Pant, FOUR runs",137/3,391485,Jason Holder,0,42,0,7.0,34,677081,Keemo Paul,0,24,0,4.0,21,931581,Rishabh Pant,34,39,3,1,642519,Shreyas Iyer,47,66,4,0,6,True,0,0,0,0,0,30,8,0,False,,False,False,4.56,0,180,0,3,0,1,1,0,137
run,6,India,4,West Indies,1st innings,1,"length ball close to off stump, punched to the sweeper at deep cover point","Paul to Iyer, 1 run",138/3,677081,Keemo Paul,0,25,0,4.1,22,391485,Jason Holder,0,42,0,7.0,34,642519,Shreyas Iyer,48,67,4,0,931581,Rishabh Pant,34,39,3,1,1,False,0,0,0,0,0,31,10,0,False,,False,False,4.57,0,181,0,3,0,1,1,0,138
run,6,India,4,West Indies,1st innings,1,"short, on off stump, pulled along the ground to deep square leg","Paul to Pant, 1 run",139/3,677081,Keemo Paul,0,26,0,4.2,23,391485,Jason Holder,0,42,0,7.0,34,931581,Rishabh Pant,35,40,3,1,642519,Shreyas Iyer,48,67,4,0,2,False,0,0,0,0,0,31,10,0,False,,False,False,4.58,0,182,0,3,0,1,1,0,139
run,6,India,4,West Indies,1st innings,1,"shortish, not too much width. Chopped to the right of backward point","Paul to Iyer, 1 run",140/3,677081,Keemo Paul,0,27,0,4.3,24,391485,Jason Holder,0,42,0,7.0,34,642519,Shreyas Iyer,49,68,4,0,931581,Rishabh Pant,35,40,3,1,3,False,0,0,0,0,0,31,10,0,False,,False,False,4.59,0,183,0,3,0,1,1,0,140
no ball,6,India,4,West Indies,1st innings,1,"whoopsie. High full-toss, angling into off stump. Gets up around chest height, and Pant drops his bottom hand off the handle and dabs to backward point","Paul to Pant, 1 no ball",141/3,677081,Keemo Paul,0,27,0,4.3,25,391485,Jason Holder,0,42,0,7.0,34,931581,Rishabh Pant,35,41,3,1,642519,Shreyas Iyer,49,68,4,0,4,False,0,1,0,0,0,31,10,0,False,,False,False,4.62,0,183,1,3,0,1,1,0,141
wide,6,India,4,West Indies,1st innings,1,"slower ball wide of off stump, and it's called wide after Pant shapes to reverse-scoop, then reverse-slog, and misses","Paul to Pant, 1 wide",142/3,677081,Keemo Paul,0,27,0,4.3,26,391485,Jason Holder,0,42,0,7.0,34,931581,Rishabh Pant,35,41,3,1,642519,Shreyas Iyer,49,68,4,0,5,False,0,0,1,0,0,31,10,0,False,,False,False,4.65,0,183,0,3,0,1,1,1,142
four,6,India,4,West Indies,1st innings,4,"full, angling down leg  and Pant helicopters a leg glance down to the fine leg boundary","Paul to Pant, FOUR runs",146/3,677081,Keemo Paul,0,28,0,4.4,30,391485,Jason Holder,0,42,0,7.0,34,931581,Rishabh Pant,39,42,4,1,642519,Shreyas Iyer,49,68,4,0,6,False,0,0,0,0,0,31,10,0,False,,False,False,4.76,0,184,0,3,0,1,1,0,146
run,6,India,4,West Indies,1st innings,1,"slower short ball angling down leg. Looks to swivel into a pull, ends up a little early on the shot and the ball drops down into the ground off his glove","Paul to Pant, 1 run",147/3,677081,Keemo Paul,0,29,0,4.5,31,391485,Jason Holder,0,42,0,7.0,34,931581,Rishabh Pant,40,43,4,1,642519,Shreyas Iyer,49,68,4,0,7,False,0,0,0,0,0,31,10,0,False,,False,False,4.76,0,185,0,3,0,1,1,0,147
no run,6,India,4,West Indies,1st innings,0,"back of a length, angling down leg, tucked to short fine leg","Paul to Iyer, no run",147/3,677081,Keemo Paul,0,30,0,5.0,31,391485,Jason Holder,0,42,0,7.0,34,642519,Shreyas Iyer,49,69,4,0,931581,Rishabh Pant,40,43,4,1,8,True,0,0,0,0,0,31,10,0,False,,False,False,4.74,0,186,0,3,0,1,1,0,147
run,6,India,4,West Indies,1st innings,2,"full outside off, he plants his front foot out and drives imperiously through the line. Good work by Pooran at the extra cover boundary, diving and stopping the ball before it rolls over the boundary","Holder to Pant, 2 runs",149/3,391485,Jason Holder,0,43,0,7.1,36,677081,Keemo Paul,0,30,0,5.0,31,931581,Rishabh Pant,42,44,4,1,642519,Shreyas Iyer,49,69,4,0,1,False,0,0,0,0,0,32,11,0,False,,False,False,4.78,0,187,0,3,0,1,1,0,149
no run,6,India,4,West Indies,1st innings,0,"back of a length, angling across, left alone","Holder to Pant, no run",149/3,391485,Jason Holder,0,44,0,7.2,36,677081,Keemo Paul,0,30,0,5.0,31,931581,Rishabh Pant,42,45,4,1,642519,Shreyas Iyer,49,69,4,0,2,False,0,0,0,0,0,32,11,0,False,,False,False,4.75,0,188,0,3,0,1,1,0,149
run,6,India,4,West Indies,1st innings,1,"length outside off, runs it down to third man off a thick edge","Holder to Pant, 1 run",150/3,391485,Jason Holder,0,45,0,7.3,37,677081,Keemo Paul,0,30,0,5.0,31,931581,Rishabh Pant,43,46,4,1,642519,Shreyas Iyer,49,69,4,0,3,False,0,0,0,0,0,32,11,0,False,,False,False,4.76,0,189,0,3,0,1,1,0,150
run,6,India,4,West Indies,1st innings,2,"good length nibbling outside off, he drops it down with soft hands and takes a quick single as it rolls towards slip. <b>Fifty for Iyer</b> and it's also a no-ball","Holder to Iyer, (no ball) 1 run",152/3,391485,Jason Holder,0,45,0,7.3,39,677081,Keemo Paul,0,30,0,5.0,31,642519,Shreyas Iyer,50,70,4,0,931581,Rishabh Pant,43,46,4,1,4,False,0,1,0,0,0,32,11,0,False,,False,False,4.82,0,189,1,3,0,1,1,0,152
four,6,India,4,West Indies,1st innings,4,"has the license to throw his bat at it and does so with good placement. Full on the stumps, he lofts it straight over the bowler. Not quite as well timed as he would have liked, so it goes for a one bounce four","Holder to Pant, FOUR runs",156/3,391485,Jason Holder,0,46,0,7.4,43,677081,Keemo Paul,0,30,0,5.0,31,931581,Rishabh Pant,47,47,5,1,642519,Shreyas Iyer,50,70,4,0,5,False,0,0,0,0,0,32,11,0,False,,False,False,4.92,0,190,0,3,0,1,1,0,156
run,6,India,4,West Indies,1st innings,1,"skilfully done by Pant. Length outside off, he waits for it and late cuts it fine, past a diving keeper","Holder to Pant, 1 run",157/3,391485,Jason Holder,0,47,0,7.5,44,677081,Keemo Paul,0,30,0,5.0,31,931581,Rishabh Pant,48,48,5,1,642519,Shreyas Iyer,50,70,4,0,6,False,0,0,0,0,0,32,11,0,False,,False,False,4.93,0,191,0,3,0,1,1,0,157
run,6,India,4,West Indies,1st innings,1,"length on the stumps but straying on the pads, tucked backward of square","Holder to Iyer, 1 run",158/3,391485,Jason Holder,0,48,0,8.0,45,677081,Keemo Paul,0,30,0,5.0,31,642519,Shreyas Iyer,51,71,4,0,931581,Rishabh Pant,48,48,5,1,7,True,0,0,0,0,0,32,11,0,False,,False,False,4.93,0,192,0,3,0,1,1,0,158
no run,6,India,4,West Indies,1st innings,0,"fuller outside off, square driven to point","Cottrell to Iyer, no run",158/3,495551,Sheldon Cottrell,3,31,2,5.1,12,391485,Jason Holder,0,48,0,8.0,45,642519,Shreyas Iyer,51,72,4,0,931581,Rishabh Pant,48,48,5,1,1,False,0,0,0,0,0,33,7,0,False,,False,False,4.91,0,193,0,3,0,1,1,0,158
